verdict,text,part
"ת""פ 8639-04-23","ת""פ 8639-04-23 מדינת ישראל נ' אלבז(עציר)",בית המשפט המחוזי בבאר שבע
"ת""פ 8639-04-23","פקודת הסמים המסוכנים [נוסח חדש], תשל""ג-1973: סע'  13, 19",חקיקה שאוזכרה: 
"ת""פ 8639-04-23","חוק העונשין, תשל""ז-1977: סע'  144(ב)",חקיקה שאוזכרה: 
"ת""פ 8639-04-23","הנאשם הורשע על-פי הודאתו, במסגרת הסדר טיעון, בכתב אישום מתוקן (להלן: ""כתב האישום"") בעבירה של סחר בסמים מסוכנים, עבירה לפי סעיפים 13+19 לפקודת הסמים המסוכנים [נוסח חדש], התשל""ג – 1973 (להלן: ""פקודת הסמים"") באישום הראשון, ובעבירה של נשיאת נשק (תחמושת), עבירה לפי סעיף 144(ב) סיפא לחוק העונשין, התשל""ז – 1977 (להלן: ""חוק העונשין"") באישום השני.",	מבוא
"ת""פ 8639-04-23","במסגרת הסדר הטיעון הצדדים הגיעו להסכמה עונשית חלקית במסגרתה המאשימה הגבילה עצמה בטיעוניה לעונש של 33 חודשי מאסר בפועל החל מיום המעצר, מאסר על תנאי, קנס, התחייבות להימנע מביצוע עבירה, פסילת רישיון נהיגה בפועל ופסילת רישיון נהיגה על תנאי. עוד הוסכם, שהמאשימה תוכל לעתור לחילוט הרכב שנתפס. במסגרת ההסדר הוסכם שההגנה תוכל לטעון לעונש באופן חופשי.",	מבוא
"ת""פ 8639-04-23","מעובדות החלק הכללי והאישום הראשון של כתב האישום עולה שביום 25.01.2023 פגש הנאשם בסוכן משטרתי סמוי שהופעל על-ידי המשטרה עמו הייתה לו היכרות מוקדמת. במהלך השיחה הנאשם אמר לסוכן כי הסמים שהסוכן רכש בעסקאות קודמות מאחרים שידועים למאשימה שייכים לו, ואם ברצונו לרכוש סמים במחירים טובים יותר, עליו לפנות אליו ישירות. הנאשם מסר לסוכן את מספר הטלפון שלו תוך שאמר לו שהוא מתגורר בשכנות אליו וסיכם איתו שכשזה ירצה לרכוש סמים הוא יפנה אליו.",	כתב האישום
"ת""פ 8639-04-23","ב-08.03.2023 הנאשם נפגש עם הסוכן בסמוך לביתו של הסוכן ובמהלך פגישה זו הציע לסוכן שימכור לו ""דוסה"" – סם שבו מעורבבים סמים מסוכנים מסוגים שונים כגון קטמין, מתקאתינון ו-MDMA בכמות של כ-100 גרם במחיר של כ-11,500 ₪. הנאשם קבע עם הסוכן כי יקיימו את העסקה למחרת היום.",	כתב האישום
"ת""פ 8639-04-23","ביום 09.03.2023 הנאשם שוחח והתכתב עם הסוכן בווטסאפ וקבע איתו להיפגש בהמשך היום לטובת קידום עסקת הסמים. בחלוף כשעה הנאשם תיאם עם הסוכן להיפגש והאחרון הזמין מונית. הנאשם הסביר לסוכן לאן להגיע, ובחלוף 20 דקות לערך השניים נפגשו. הסוכן ירד מהמונית ונכנס לרכבו של הנאשם ובמהלך הפגישה הנאשם מסר לסוכן שקית ניילון עם סוגר שהכילה סם ""דוסה"" במשקל 88 גרם נטו ובתמורה לכך קיבל הנאשם מהסוכן 11,500 ₪ במזומן.",	כתב האישום
"ת""פ 8639-04-23","מעובדות האישום השני של כתב האישום עולה שביום 13.03.2023 נהג הנאשם ברכבו בכביש 25 מכיוון דימונה לבאר-שבע יחד עם אחר שזהותו ידועה למאשימה, ובמהלך נסיעה זו נעצר הנאשם על-ידי המשטרה. בחיפוש שבוצע על גופו של הנאשם, נמצא בכיס פנימי של הג'קט שאותו לבש כדור אקדח וכן בכיס מכנסיו נמצאו סך של 5,750 ₪.",	כתב האישום
"ת""פ 8639-04-23","מתסקיר שירות המבחן עולה שהנאשם כבן 40, נשוי בשנית ואב ל-3 ילדים (לשניים מהם בעיות רפואיות), שני ילדים מנשואיו הקודמים ותינוקת מנישואיו הנוכחיים, סיים 12 שנות לימוד, התגייס לשירות צבאי מלא, עבד טרם מעצרו במתחם אירועים. עוד עולה כי הנאשם בן להורים גרושים, כי אמו ואביו נשואים בשנית וכי גדל בצל אביו שהיה מכור לסמים עד שעבר הליך גמילה והוא משמש כיום כמדריך לאנשים המתמודדים עם התמכרויות. הנאשם שיתף כי בגיל 23 החל להסתבך עם החוק לאחר שחבר לחברה מעולם הפשע וריצה עונשי מאסר.",	תסקיר שירות המבחן
"ת""פ 8639-04-23","בהתייחס לעבירות הנאשם מסר כי הכיר את הסוכן דרך חברים משותפים, כי היה מודע להשלכות הפוטנציאליות של עיסוק בסחר בסמים, ולמחירים האישיים והמשפחתיים הנלווים לכך, ואולם הוא  לא העמיק בכך בשל רצונו להרוויח כסף קל. באשר להחזקת הכדור מסר כי לקח את הכדור מחבר, כי לא התכוון לעשות בו שימוש וכי לא ידע שמדובר בעבירה.",	תסקיר שירות המבחן
"ת""פ 8639-04-23","ממידע סוציאלי שקיבל שירות המבחן עולה כי לנאשם קשרי משפחה תומכים ויציבים, כי אינו משתמש בסמים ואלכוהול והבדיקה שביצע בבית המעצר נמצאה ללא שרידי סם, כי שולב ומשתף פעולה בתכנית בתחום כישורי חיים.",	תסקיר שירות המבחן
"ת""פ 8639-04-23","שירות המבחן התרשם כי הנאשם נוטה לעיתים לצמצם ולטשטש את חומרת העבירות שביצע, את הנסיבות ואת מניעיו, כי גדל במציאות חיים מורכבת, כי אינו מביע חרטה עמוקה, כי הוא מרוכז בעצמו ובמחירים שעתיד לשלם, כי הוא מתקשה לייצר יציבות ורצף תעסוקתי, כי חבר מגיל צעיר לחברה שולית, כי הוא מתקשה בוויסות עצמי, וחשיבה ביקורתית, בהפעלת שיקול דעת אחראי ובהצבת גבולות פנימיים, מתקשה להפיק לקחים לא חש רתיעה מתוקף מצבו וכן שהוא מתקשה לקחת אחריות מלאה.",	תסקיר שירות המבחן
"ת""פ 8639-04-23",שירות המבחן העריך כי קיים סיכון להישנות התנהגות עוברת חוק והמליץ לשלב הנאשם בהליך ליווי מעקבי ארוך טווח על מנת לשנות את דפוסי מחשבתו.,	תסקיר שירות המבחן
"ת""פ 8639-04-23",הנאשם מצדו מסר שהוא מקבל מענה לצרכיו הטיפוליים במסגרת הכלא.,	תסקיר שירות המבחן
"ת""פ 8639-04-23","בשים לב לאמור ולהתרשמות מגורמי סיכון משמעותיים, שירות המבחן לא בא בהמלצה טיפולית והמליץ להמשיך ולשלב הנאשם בתכניות חינוך בכלא במידה וייגזר עליו עונש מאסר.",	תסקיר שירות המבחן
"ת""פ 8639-04-23",המאשימה טענה לעונש בכתב והשלימה טיעוניה על-פה.,	טענות הצדדים
"ת""פ 8639-04-23","	המאשימה טענה כי מתחם העונש ההולם לשני האישומים נע בין 30 ל-50 חודשי מאסר. המאשימה עתרה בהתאם להסדר לעונש של 33 חודשי מאסר בפועל. בנוסף עתרה המאשימה להטיל על הנאשם מאסר על תנאי, קנס, פסילת רישיון נהיגה בפועל ועל תנאי. יצוין כי בטיעון לעונש בכתב עתרה גם לעונש של חתימה על התחייבות להימנע מביצוע עבירה. בנוסף עתרה המאשימה להכריז על הנאשם כסוחר סמים וכפועל יוצא לחלט את הרכב ואת הכסף המזומן (5,750 ₪) שנתפסו על הנאשם. לעניין החילוט הפנתה המאשימה לעובדה 8 של כתב האישום ממנה עולה שהנאשם הפיק רווח מעבירת הסמים, ולעניין השיהוי בעתירה לחילוט (במעמד גזר הדין ולא במעמד הכרעת הדין) הפנתה לע""פ 170/07 מטיס נ' מדינת ישראל (פורסם בנבו, 19.11.2007) (להלן: ""עניין מטיס"") בו נקבע כי בנסיבות מסוימות ניתן להכריז על הנאשם כסוחר סמים גם בשלב מאוחר מהכרעת הדין. ",	טענות הצדדים
"ת""פ 8639-04-23","המאשימה הפנתה בטיעוניה לערכים המוגנים שנפגעו, למידת הפגיעה המשמעותית בהם ולנסיבות הקשורות בביצוע העבירות לרבות התכנון שקדם לביצוע עבירת הסמים (פרטי העסקה עם הסוכן), חלקו של הנאשם בביצוע העבירות והכרתו את עולם הסמים, המניע לביצוע עבירת הסמים (בצע כסף), הנזק שעלול היה להיגרם מביצוע העבירות, סוג הסם ומשקלו.",	טענות הצדדים
"ת""פ 8639-04-23","המאשימה טענה כי על בית המשפט להעדיף את האינטרס הציבורי ושיקולי ההרתעה על פני האינטרס האישי של הנאשם. המאשימה הפנתה בטיעוניה גם לעברו הפלילי המכביד והרלוונטי של הנאשם, כמו גם להתרשמות שירות המבחן מהנאשם אשר מלמדת על צורך בהרתעה.",	טענות הצדדים
"ת""פ 8639-04-23", 	המאשימה הפנתה לפסיקה לתמיכה בעמדתה העונשית. ,	טענות הצדדים
"ת""פ 8639-04-23","ב""כ הנאשם עתר להסתפק בעונש מאסר לתקופה החופפת את תקופת המעצר של הנאשם (כשנה), מאסר על תנאי, התחייבות להימנע מביצוע עבירה, קנס ופסילת רישיון נהיגה על תנאי.",	טענות הצדדים
"ת""פ 8639-04-23","ביחס לרכיב הקנס עתר שזה יהיה מתון, גם מתוך התחשבות בחילוט סכום הכסף שנתפס על הנאשם.",	טענות הצדדים
"ת""פ 8639-04-23","ב""כ הנאשם הסכים שהנאשם יוכרז כסוחר סמים וכפועל יוצא שיחולט סכום הכסף שנתפס עליו (5,750 ₪). לצד זאת, עתר להימנע מחילוט הרכב שהוזכר בבקשת החילוט משום שזה רשום על אשת הנאשם, משום שחילוט הרכב יהווה סנקציה לא מידתית ומשום שרכב זה משמש את האישה לצרכים יום יומיים ובעיקר להסעת ילדתם המשותפת, הסובלת מבעיות רפואיות, למסגרות חינוכיות ולטיפולים רפואיים.",	טענות הצדדים
"ת""פ 8639-04-23","בעניין זה הוסיף עוד, כי במסגרת תיקון כתב האישום נמחקו בפרק העובדות פרטי הרכב, ""ולא בכדי.",	טענות הצדדים
"ת""פ 8639-04-23","ביחס לנסיבות הקשורות בביצוע העבירות הפנה לכך שמדובר בעסקת סמים אחת באישום הראשון, ולהחזקה של כדור אחד בלבד באישום השני.",	טענות הצדדים
"ת""פ 8639-04-23","ב""כ הנאשם טען כי העמדה העונשית של המאשימה לא מתיישבת עם הענישה שהוטלה על מעורבים אחרים שהורשעו במסגרת אותו מבצע סוכן, לרבות בגזרי דין של מותב זה. בעניין זה הפנה לשני מקרים שבהם נדונו הנאשמים לעונשים של 40 ו-36 חודשי מאסר ואולם באותם מקרים, נסיבות ביצוע העבירות היו חמורות הרבה יותר מאלו שבעניינו של הנאשם, ומכאן שאין מקום להטיל על הנאשם עונש דומה כפי שעותרת המאשימה, אף בהינתן שעברו הפלילי של הנאשם הוא חמור משל אותם נאשמים.",	טענות הצדדים
"ת""פ 8639-04-23","באשר לעברו הפלילי טען כי ברובו הוא ישן וכי הרשעתו האחרונה בעבירת סמים היא מלפני כעשר שנים, נתון המלמד על כך שהנאשם הצליח להשתקם ולא להסתבך בפלילים משך תקופה ארוכה עד למעידתו במקרה זה, עת פגש בסוכן שהופעל על-ידי המשטרה, סוכן שהוא בעצמו אינו שֶׂה תמים.",	טענות הצדדים
"ת""פ 8639-04-23","ב""כ הנאשם התייחס במסגרת טיעוניו לנסיבותיו האישיות והמשפחתיות של הנאשם; למצבה הרפואי המורכב של בתו התינוקת; לתקופה הארוכה בה הוא נתון במעצר, לרבות בתקופת המלחמה, מה שמוסיף קשיים מעבר לקשיים הרגילים של מעצר על הנאשם ומשפחתו; ולאחריות שלקח על ביצוע העבירות.",	טענות הצדדים
"ת""פ 8639-04-23","כן טען, כי אף ששירות המבחן לא בא במסגרת התסקיר בהמלצה טיפולית בעניינו של הנאשם, הוא המליץ על המשך שילובו של הנאשם בתכניות שיקום במסגרת בית הסוהר, תכניות בהן שולב  הנאשם מתחילת מעצרו.",	טענות הצדדים
"ת""פ 8639-04-23","ב""כ הנאשם צרף מסמכים רפואיים בעניין בתו של הנאשם ופסיקה לתמיכה בעמדתו העונשית.",	טענות הצדדים
"ת""פ 8639-04-23","במהלך דיון הטיעונים לעונש הצדדים הודיעו לבית המשפט כי הם מנסים להגיע להבנה ביחס לרכיבים הכלכליים, וכי הם ימסרו הודעה על כך לבית המשפט בתוך שבעה ימים, ובהודעה שנשלחה נמסר כי אלה לא הצליחו להגיע להבנה.",	טענות הצדדים
"ת""פ 8639-04-23","	עוד יצוין, כי בדיון הטיעונים לעונש ב""כ המאשימה נשאלה מדוע הסכימה המאשימה למחוק במסגרת ההסדר את פרטי הרכב בפרק עובדות כתב האישום וזו השיבה שזה נעשה לבקשת ב""כ הנאשם, אך מיד הוסיפה כי איננה יכולה להשיב לכך (עמ' 19, ש' 18-19 לפרוט' מיום 26.03.2024). ",	טענות הצדדים
"ת""פ 8639-04-23","מטעם הנאשם העידה אשתו, הגב' אניטה אלבז. זו שיתפה בכעס שחשה כלפי הנאשם, בהתמודדות שלה עם חסרונו ובהתמודדות שלה עם גידול בתם התינוקת הסובלת מבעיות רפואיות, לרבות מעבר ניתוח בראשה. אשת הנאשם מסרה כי ""המצב מאוד קשה לי. כן הוסיפה שהנאשם הוא דמות דומיננטית בבית שתומך ועוזר אך הוא עצור כשנה, כי היא עושה מאמצים על מנת לא להישבר, כי שוחחה עם הנאשם על התכניות שלהם לעתיד, וכי היא בטוחה ומאמינה שהנאשם לא יחזור לסורו.",	ראיות לעונש
"ת""פ 8639-04-23","ב""כ הנאשם צירף מסמכים רפואיים של בתו בת השנה וחצי (סומן נ/1) מבלי להיכנס לפרטים, בשל צנעת הפרט, היא עברה בעת האחרונה ניתוח כירורגי וכי לה בעיות רפואיות מורכבות המצריכות המשך טיפולים ומעקב.",	ראיות לעונש
"ת""פ 8639-04-23","הנאשם מסר כי הוא מודע לטעות שעשה וכי הוא לוקח אחריות על מעשיו. הנאשם שיתף באשר למצבה הרפואי של בתו, לקושי לשהות בבית מעצר כשבתו נמצאת בטיפול נמרץ לאחר ניתוח, לקושי בהתמודדות של אשתו וביקש מבית המשפט להתחשב בעונשו על מנת שיוכל לסייע לאשתו בטיפול בבתם.",	ראיות לעונש
"ת""פ 8639-04-23","בענייננו הציגו הצדדים הסדר מסוג ""הסדר טווח"" במסגרתו המאשימה הגבילה את טיעוניה לעונש של  33 חודשי מאסר ואילו ב""כ הנאשם טען באופן חופשי, ועתר לעונש החופף את תקופת מעצרו (כ-12 חודשי מאסר).",	דיון והכרעה
"ת""פ 8639-04-23","	בפסיקת בית המשפט העליון קיימות גישות שונות ביחס לשאלה האם במסגרת הסדר ""טווח"" פטור בית המשפט מחובתו לקבוע מתחם עונש הולם. מחד, קיימת גישה לפיה קביעת מתחם עונש הולם על-ידי בית המשפט היא אמירה נורמטיבית של בית המשפט אשר צריכה להיאמר ללא קשר להסדר שבין הצדדים. מאידך, קיימת גישה לפיה בנסיבות דומות, של הסדר ""טווח"", אין מקום לקביעת מתחם עונש הולם. לעניין הגישות השונות ראו למשל ע""פ 8109/15  אביטן נ' מדינת ישראל (פורסם בנבו, 09.06.2016), פסקה 8.",	דיון והכרעה
"ת""פ 8639-04-23","	לצד אלו, קיימת גם גישת ביניים לפיה במקרים דומים אין צורך בהרחבה ובפירוט של מתחם העונש ההולם. צורך שכזה יכול לקום בעיקר עת מוצא בית המשפט להטיל עונש שסוטה מהעונש המוסכם או שנמצא הוא מחוץ לטווח המוסכם. בעניין זה ראו למשל ע""פ 6943/16 גלקין נ' מדינת ישראל (פורסם בנבו, 28.01.2018), פסקה 3.",	דיון והכרעה
"ת""פ 8639-04-23","סבורני כי נוכח אופיו של ההסדר והעובדה שהעונש שאותו מצאתי להטיל על הנאשם אינו חורג מטווח הענישה המוסכם, אין הכרח לשרטט במדויק את גבולות מתחם העונש ההולם אף שלטעמי עונש של 12 חודשי מאסר כפי שעתר ב""כ הנאשם, לא יכול לבוא בגדרו של מתחם העונש ההולם את מקרה זה, אף לא בשוליו התחתונים.",	דיון והכרעה
"ת""פ 8639-04-23","אחר כל האמור, פטור בלא כלום אי אפשר, וכדי להבין את מסקנתי בדבר העונש הראוי לנאשם, מצאתי לעמוד גם על השיקולים שמגבשים על דרך כלל את מתחם העונש ההולם.",	דיון והכרעה
"ת""פ 8639-04-23","העבירה המרכזית של כתב האישום היא עבירת הסחר בסם מסוכן ובה יתמקד גזר הדין. זאת, בהינתן שעבירת החזקת הנשק שגם בה הורשע הנאשם היא למעשה עבירה של החזקת תחמושת, של כדור אחד, ששני הצדדים סברו שעונש של מאסר על תנאי יכול להלום אותה. הכל, כמובן, מבלי להקל ראש בחומרה הגלומה בהחזקת תחמושת, אף של כדור אחד, שיכולה בנסיבות מסוימות להוביל לגרימת נזק קטלני.",	דיון והכרעה
"ת""פ 8639-04-23","כבר בפתח הדיון, מוצא אני להכריז על הנאשם כסוחר סמים. לעניין אפשרות זו בשלב זה של ההליכים, כמקרה חריג, ראו פסקה 8 לעניין מטיס, ועובדה 8 של האישום הראשון ממנה עולה שהנאשם קיבל כסף כתוצאה מעסקת הסמים. מכל מקום, בענייננו אין צורך להרחיב בכך גם לנוכח הסכמת ב""כ הנאשם להכרזה זו.",	דיון והכרעה
"ת""פ 8639-04-23",הערכים המוגנים שעומדים בבסיס עבירת הסחר בסמים שעבר הנאשם הם הגנה על שלום הציבור ובריאותו.,	דיון והכרעה
"ת""פ 8639-04-23","הפגיעה ההרסנית הכרוכה בשימוש בסמים כמו גם הנזקים החברתיים והכלכליים העקיפים הנגרמים עקב הצורך בהשגת הסמים ובהפצתם, מחייבים עמדה ברורה ובלתי מתפשרת כנגד נגע הסמים. התוצאות של עבירות הסמים הן תוצאות קשות ופוגעות הן פגיעה רוחבית במרקם חיי החברה. נכון הוא הדבר לכל שרשרת מפיצי הסם והמסייעים בידיהם. לעניין זה ראו בש""פ 4322/07  סיטבון נ' מדינת ישראל, (פורסם בנבו, 29.05.2007), פסקה 4:",	דיון והכרעה
"ת""פ 8639-04-23","	באשר לחומרה ולנזק שבעבירת הסחר בסמים ראו ע""פ 4522/18 מדינת ישראל נגד אסאבן  (פורסם בנבו, 1.11.18), פסקה 10: ",	דיון והכרעה
"ת""פ 8639-04-23","מידת הפגיעה בערכים המוגנים בענייננו היא משמעותית בשים לב לסוג הסם ולמשקלו. כזכור, הנאשם סחר בסם מסוג ""דוסה"", היינו כזה המשלב בין סמים מסוכנים לא קלים דוגמת MDMA וקטמין, וזאת במשקל משמעותי של 88 גרם. התמורה שקיבל הנאשם בגין הסמים שמכר, 11,500 ₪ במזומן, מעידה אף היא על חומרת האירוע ועל כך שלא מדובר בעסקה זניחה.",	דיון והכרעה
"ת""פ 8639-04-23",באשר לנסיבות הקשורות בביצוע העבירות נתתי משקל לתכנון שקדם לביצוע עבירת הסחר בסם (הפניות היזומות של הנאשם אל הסוכן); לסוג הסם; למשקל הסם; להיקף התמורה שקיבל הנאשם במסגרת העסקה; לחלקו הבלעדי של הנאשם בביצוע העבירה; לנזק שעלול היה להיגרם לציבור אלמלא נתפס הסם ולמניע של הנאשם בביצוע העבירה (בצע כסף).,	דיון והכרעה
"ת""פ 8639-04-23",נתתי דעתי גם לכך שנאשם החזיק בתחמושת כאמור באישום השני ולנזק הפוטנציאלי הטמון בכך.,	דיון והכרעה
"ת""פ 8639-04-23","לצד זאת, נתתי משקל לכך שבסופו של יום הסם שאותו מכר הנאשם לא הופץ לציבור ולכך שהנאשם החזיק בכדור אקדח אחד ללא נשק או מחסנית לצדו.",	דיון והכרעה
"ת""פ 8639-04-23","עיון בענישה הנוהגת מצביע על מנעד ענישה רחב התלוי בנסיבות ה""עושה"" לרבות גילו, נסיבותיו האישיות של הנאשם, עברו הפלילי השתתפותו בהליך שיקומי כמו גם בנסיבות ה""מעשה"" לרבות סוג הסם, משקלו, האם העבירה בוצעה עם אחרים והאם נלוו לביצוע עבירת הסם עבירות נוספות.",	דיון והכרעה
"ת""פ 8639-04-23","להלן אסקור פסיקה במקרים דומים, כאשר כבר עתה אציין כי מודע אני לכך שקיימים הבדלים במישור ה""עושה"" ובמישור ה""מעשה"" בין המקרים שיוזכרו באותה סקירה לבין המקרה שבענייננו, ולהבדלים אלה יינתן המשקל המתאים.",	דיון והכרעה
"ת""פ 8639-04-23","	בע""פ 7617/18 אבייב נ' מדינת ישראל (פורסם בנבו, 6.3.2019) דחה בית המשפט העליון את ערעורו של נאשם שהורשע בשתי עבירות של סחר בסם מסוכן מסוג קוקאין במשקל של כ-50 גרם בכל מקרה ובשתי עבירות של החזקת סם שלא לצריכה עצמית והחזקת סם לצריכה עצמית בשני תיקים שצרף והותיר על כנו עונש של 42 חודשי מאסר.",	דיון והכרעה
"ת""פ 8639-04-23","	בע""פ 8367/18 פלוני נ' מדינת ישראל (פורסם בנבו, 12.3.19) קיבל בית המשפט העליון את ערעורו של נאשם שהורשע בשתי עבירות של סחר בסם מסוכן מסוג קוקאין במשקלים של כ-30 גרם במקרה הראשון ו-50.4 גרם במקרה השני  והעמיד את עונשו על 30 חודשי מאסר חלף  36 חודשי מאסר שהטיל עליו בית המשפט המחוזי. ",	דיון והכרעה
"ת""פ 8639-04-23","בע""פ 3060/15 אבו רגייג נ' מדינת ישראל (פורסם בנבו, 21.7.15) דחה בית המשפט העליון את ערעורו של נאשם שהורשע בסחר בסם מסוכן מסוג קוקאין במשקל של 150 גרם והותיר על כנו עונש של 32 חודשי מאסר.",	דיון והכרעה
