verdict,text,part
"ת""פ 32787-10-18","ת""פ 32787-10-18 מדינת ישראל נ' סלמאן",בית משפט השלום בכפר סבא
"ת""פ 32787-10-18","		ע""י ב""כ עו""ד אוריה תוהמי",בעניין:		מדינת ישראל – פרקליטות מחוז מרכז (פלילי)	המאשימה
"ת""פ 32787-10-18","		ע""י ב""כ עו""ד עלא תילאווי",		מוחמד סלמאן					הנאשם
"ת""פ 32787-10-18","חוק העונשין, תשל""ז-1977: סע'  40ב', 40י(ב)(1), 2, 144(א), 40יב'",חקיקה שאוזכרה: 
"ת""פ 32787-10-18","הנאשם, יליד 1993, הורשע על פי הודאתו, ובמסגרת הסדר טיעון, בעבירות בנשק (החזקת נשק ואבזר לנשק), בניגוד לסעיף 144(א) רישא וסיפא לחוק העונשין, תשל""ז-1977.",גזר דין
"ת""פ 32787-10-18","על פי עובדות כתב האישום, ביום 1.10.18 סמוך לשעה 02:18, הגיע הנאשם לחירבת ג'בארה במזרח טייבה, סמוך לביתו של אחיו, ביחד עם ה.ס., אחיו הקטין, יליד 2001 (להלן – הקטין), ברכבו של אברהים מסארווה. הנאשם והקטין יצאו מהרכב וכעבור זמן קצר חזרו אל הרכב כשהם מצוידים בשני כלי נשק מסוג תת מקלע מאולתר, המכונה ""קרלו"", ותחמושת תואמת.",גזר דין
"ת""פ 32787-10-18","ביום 12.1.20 הגיעו הצדדים להסדר טיעון לפיו הנאשם יודה במיוחס לו בכתב האישום, יורשע ויישלח לשירות המבחן לצורך קבלת תסקיר בעניינו. לעניין העונש, הוסכם כי המאשימה תעתור על פי הנחיית פרקליט המדינה 9.16 למתחם עונש הולם הנע בין 24 ל-48 חודשי מאסר, ותבקש למקם את עונשו של הנאשם בתחתית המתחם, וב""כ הנאשם יוכל לטעון לעונש באופן פתוח.",גזר דין
"ת""פ 32787-10-18","מתסקיר שירות המבחן מיום 13.8.20 עולה כי הנאשם כבן 27, תושב טייבה, שוהה בתנאי מעצר בית מלא בבית אביו מאוקטובר 2018 בפיקוח אחת מאחיותיו. הנאשם מאורס מזה כשנתיים וחצי לבחורה כבת 18. הנאשם סיים 6 שנות לימוד, תאר כי היה תלמיד בעייתי ואלים במסגרת בית הספר, ועזב לבסוף מחוסר עניין בלימודים ובמטרה לעבוד ולסייע בכלכלת המשפחה. עבד ברציפות בעבודות איטום מאז ועד למעצרו בתיק הנוכחי. לנאשם אין הרשעות קודמות. מגיל 24 החל לשתות אלכוהול באופן מזדמן, מאז שהייתו בתנאים מגבילים ועד היום מעשן גראס על בסיס יומי, אך שלל בעיית התמכרות לחומרים פסיכואקטיביים או נזקקות טיפולית בתחום זה. מתוך 4 בדיקות שתן מסר הנאשם רק בדיקה אחת בה נמצאו שרידי גראס, ומכיוון שמשתמש בסמים לא מסר בדיקות נוספות. בהתייחסותו לעבירה דנן מודה בביצועה ולוקח עליה אחריות, אולם מתקשה להסביר את הרקע לביצועה והתייחס אליה באופן מגמתי ומצומצם, שלל קשרים חברתיים שוליים ושלל התנהלות בעייתית במצבו בכלל ובתחום הנשק בפרט. ניכר כי הנאשם מתקשה לבחון לעומק את התנהגותו ואת נסיבות העבירה ונקט בתשובות מצומצמות והסתרה. השירות התרשם כי הנאשם אינו מכיר בחומרת התנהגותו, וכי רמת הסיכון למעורבותו בעבירות אלימות הינה בינונית ברמת חומרה נמוכה. השירות העריך כי ללא מעורבות טיפולית במצבו, קיים סיכון להישנות התנהגותו.",תסקיר שירות המבחן
"ת""פ 32787-10-18","על גורמי הסיכון בעניינו נמנו נגישותו לנשק, מעורבות פלילית עם אחיו, היעדר דמות הורית, שימוש בסמים והתמודדות עם אחריות משפחתית שאינה מתאימה ליכולותיו. על גורמי הסיכוי לשיקום במצבו נמנו היעדר עבר פלילי, יכולתו לעמוד בתנאי מעצר בית ללא הפרות במשך תקופה ממושכת.",תסקיר שירות המבחן
"ת""פ 32787-10-18","שירות המבחן ציין כי הוא אמביוולנטי באשר להמלצה בעניינו של הנאשם, והגם שבולטת נזקקות טיפולית על מנת לצמצם סיכון להישנות התנהגותו, הרי שחומרת התנהגותו, היעדר גורמי תמיכה משמעותיים בסביבתו והיעדר כוחות להביא לשינוי במצבו ולהפסיק בין היתר שימוש בסמים, קיים ספק באשר ליכולתו לשתף פעולה עם השירות ועל כן השירות נמנע מהמלצה טיפולית בעניינו. עם זאת השירות המליץ לשקול בין שיקולי הענישה את גילו העציר של הנאשם, היעדר עבר פלילי והיעדר תיקי מב""ד, ואת העובדה שהתנהגותו לא שנתה מזה כשנתיים.",תסקיר שירות המבחן
"ת""פ 32787-10-18","לבקשת ב""כ הנאשם, בהתאם לסעיף 40י(ב)(1) ו-(2) לחוק העונשין, ועל מנת שתתקבל תמונה כוללת לגבי כלל הנוכחים ברכב ואופן תפיסת הנשק ומיקומו (נוכח הלשון הכוללנית שנקט כתב האישום בסוגיה זו), הוגשו מתיק החקירה ראיות לעונש מטעם ההגנה – דו""חות הפעולה של רס""ר אלימלך עמית (ת/1), רס""ר ארדיטי שניר (ת/2), רס""ר תירם נתנאל (ת/3) ומזכר מאת רס""ר שלומי שוורץ (ת/4). לצורך קבלת תמונה מאוזנת קבעתי בהחלטתי כי ""במידה וב""כ המאשימה מעוניינת להגיש דוחות פעולה ומזכרים של שוטרים נוספים שהשתתפו בפעילות המבצעית, אשר לטעמה משלימים את התמונה המלאה, תהיה רשאית לעשות כן"" – ואולם, ב""כ המאשימה בחרה שלא להגיש חומרים נוספים מתוך תיק החקירה (עמ' 17).",ראיות לעונש
"ת""פ 32787-10-18","ב""כ המאשימה הפנתה לערכים החברתיים המוגנים בעבירות בנשק ובעיקר לקדושת החיים, ביטחונו של אדם, שלמות גופו וערכים של שלטון החוק. היא טענה שבתי המשפט השונים עמדו על חומרת העבירות בנשק, לרבות החזקת נשק, גם בידי אנשים נורמטיביים, נעדרי עבר פלילי, דוגמת הנאשם שלפנינו. נשק ""מתגלגל"" מיד ליד ועלול להגיע לגורמים עבריינים או ביטחוניים ולשמש גם בסכסוכים פעוטים ולפגוע במרכזי אוכלוסיה, בעוברי אורח חפים מפשע שלא קשורים לסכסוכים האלה. נטען שקיים אינטרס ציבורי בהתרעת הרבים בעבירות בנשק ועל כן, על בתי המשפט לגלות אפס סובלנות לזמינות של נשק חם וזאת על דרך של החמרה בענישה. ב""כ המאשימה עתרה לקביעת מתחם עונש הולם הנע בין 24 ל-48 חודשי מאסר, ועתרה למקם את עונשו של הנאשם בתחתית המתחם. היא טענה שהגם שבהתאם להנחיית פרקליט המדינה מדובר במתחם המתאים להחזקת נשק אחד, הרי שבמסגרת הסדר הטיעון נלקחו בחשבון קשיים ראייתיים מסוימים הנוגעים לשני מעורבים נוספים בתיק שלא הועמדו לדין, איאד נופל ואיברהים מסארווה, לגביהם הוגשו דו""חות הפעולה במסגרת הראיות לעונש, והגם שמאשימה סברה כי קיים שוני מהותי בינם לבין הנאשם עדיין הדבר הובא בחשבון לעניין העונש, וכלשונה: ""למעשה מכיוון שמדובר בשני נשקים המתחם כביכול לא תואם את הנחיית פרקליט המדינה כי המתחם הזה הוא מתחם לנשק אחד. ואולם בגלל ההסדר שנכרת בין הצדדים שלקח בחשבון קשיים ראייתיים מסויימים נקרא לזה הנוגעים בעיקר לטענת חברי על שני המעורבים הנוספים שלא הועמדו לדין... הוסכם שנעתור למתחם שציינתי בתחתית המתחם"" (עמ' 18, ש' 14) וכן, ""כמובן שהיינו מבקשים ענישה הרבה יותר חמורה ברגיל"" (עמ' 20, ש' 4). לטענת המאשימה, שני המעורבים האמורים אמנם נתפסו ברכב שבו נמצא הנשק, ושמחלקו הקדמי, בו ישבו, נזרק נשק החוצה, אולם מדובר בשהייה של מספר דקות,  כאשר בתרגיל חקירה שנערך להם ציינו שהנשק שייך ל""ג'חנון"" (כינויו של הנאשם), ולאורך כל החקירות שלהם דבקו בגרסתם והפלילו את הנאשם. בנסיבות אלה, נטען, שאין יכולת לדעת אם היו מודעים לנשק שנזרק אם לאו.","טיעוני ב""כ הצדדים"
"ת""פ 32787-10-18","מבחינת נסיבות שאינן קשורות לביצוע העבירה, הפנתה התובעת לכך שמדובר בנאשם נעדר עבר פלילי שהודה וחסך זמן שיפוטי. מהתסקיר בעניינו עולה שמדובר בנאשם בן 27 המדווח על שימוש בסמים מסוג גראס על בסיס יומיומי, לא משתף פעולה עם בדיקות שתן, ואחת שמסר היתה עם שרידי סם, והגם שמודה בביצוע העבירה, לא מבין את חומרת התנהגותו, נוקט בהסתרה ושולל בעייתיות בהתנהלותו ואין המלצה טיפולית בעניינו.","טיעוני ב""כ הצדדים"
"ת""פ 32787-10-18","בנסיבות אלה, עתרה ב""כ הנאשם לגזור על הנאשם 24 חודשי מאסר, לצד מאסר על תנאי וקנס משמעותי.","טיעוני ב""כ הצדדים"
"ת""פ 32787-10-18","ב""כ הנאשם טען שכתב האישום לא מתאר את ההתרחשות בעת תפיסת כלי הנשק ולאור העובדה שבתחילת הדרך הנאשם הכחיש מעורבות ושינה גירסתו בהמשך, התעורר חשש שכתב האישום אינו משקף נכונה ובאופן מלא ומדויק את אשר התרחש בשטח. ב""כ הנאשם הפנה לדו""חות הפעולה שהגיש, מהם עולה שבתוך הרכב היו לפחות עוד שני אנשים, ואחד מכלי הנשק נזרק מהצד של הנהג, נגדו לא הוגש כתב אישום והתיק בעניינו נסגר; נשק נוסף נתפס במושב האחורי ברכב, כשגם אדם שלישי ששהה בתוך הרכב לא הועמד לדין. בעניינו של הקטין, הרי שבתחילת הדרך הוגש נגדו כתב אישום המייחס לו עבירה של החזקת נשק שלא כדין, ואולם, בהמשך המאשימה הגיעה עמו להסדר טיעון במסגרתו תוקן כתב האישום כאשר העבירה שיוחסה לו היתה קבלת נכס שהושג בעוון, כשהנכס שקיבל לא צוין בכתב האישום המתוקן, והתיק הסתיים בהעמדה בצו מבחן ללא הרשעה בדין. לענין נסיבות ביצוע העבירה נטען שמדובר בארבעה נוסעים ברכב, אשר אינו בבעלות הנאשם, כאשר הנאשם והקטין יושבים מאחור ואיברהים, בעל הרכב,  ואיאד יושבים מלפנים. בנסיבות אלה, הנאשם ואחיו יורדים מהרכב, הולכים למבנה, חוזרים עם דבר מה, שוטרים שעוברים במקום רואים שכלי נשק אחד נזרק מהחלונות הקדמיים של הרכב, ולאחר שמגיעים למקום מתשאלים את האנשים, נאמר להם שאין שום דבר ברכב והשוטרים מוצאים עוד כלי נשק בחלקו האחורי של הרכב.","טיעוני ב""כ הצדדים"
"ת""פ 32787-10-18","נטען שבחקירתו הנאשם הכחיש מעורבות, כמו יתר המעורבים, ואולם לאחר ביצוע עימות, הוא שינה את גרסתו ולקח אחריות על החזקת שני כלי הנשק. בסופו של יום, שני כתבי האישום שמוגשים הם נגד הנאשם ואחיו הקטין, שהינם בבחינת ""שעירים לעזאזל"", ומבין שניהם עניינו של הקטין הסתיים ללא הרשעה בגין עבירה של קבלת נכס שהושג בעוון בלבד, ואילו הנאשם הוא היחיד ששהה במעצר תקופה ארוכה (מיום 9.10.18 עד 21.10.18) ושהה במעצר בית מלא מחודש אוקטובר 2018 עד יולי 2020, קרוב לשנתיים. מאז יולי 2020 עד היום הנאשם נתון ב""מעצר אדם"", ללא הפרות ומבלי שנפתחו נגדו תיקי מב""ד. לאור האמור לעיל, האפליה בעניינו של הנאשם זועקת, אחריותו לשני כלי הנשק ""בעייתית"", מקום בו הוא אינו בעל הרכב, הנשק נזרק שלא ממקום מושבו ברכב, ללא טביעת אצבע או ממצא דנ""א, ואף הודאתו ניתנה לאחר שהכחיש קשר לנשק בחקירתו הראשונה.","טיעוני ב""כ הצדדים"
"ת""פ 32787-10-18",עוד נטען לנסיבות מקילות – מדובר בכלי נשק שעל פי חוות דעת משטרתית אינם קשורים לאירועים פליליים; מדובר בהחזקה רגעית; לא מדובר בנשק טעון; לא נטען שקיים סכסוך פעיל לנאשם או למי מיושבי הרכב; לא נטען שיש תכנית כלשהי לשימוש בנשק; והנשק הוחזק ברכב במקום נידח בטייבה ולא באזור מגורים.,"טיעוני ב""כ הצדדים"
"ת""פ 32787-10-18","בנסיבות אלה נטען שמתחם העונש ההולם נע בין מספר חודשי מאסר חד-ספרתיים ועד ל-18 חודשי מאסר, כשהמאשימה הסכימה למקם את העונש בתחתית המתחם. במסגרת קביעת העונש יש לשקול את חלקו היחסי של הנאשם בעבירה נוכח העובדות, בעוד הוא לוקח על עצמו את האחריות המלאה.","טיעוני ב""כ הצדדים"
"ת""פ 32787-10-18","ב""כ הנאשם הפנה לתסקיר, ממנו עולה שנסיבותיו האישיות של הנאשם קשות, הוא נעדר עורף משפחתי, אמו נפטרה בגיל צעיר, אביו אלכוהוליסט, ולמעשה הוא לקח על עצמו תפקיד שלא מתאים לגילו. השירות התרשם ממצוקתו של הנאשם כמו גם מנזקקות טיפולית,  אך לאור הנתונים הכלליים לא הוצעה תכנית טיפולית. יחד עם זאת, מדובר בנאשם שהודה, לקח אחריות, שיתף פעולה עם גורמי האכיפה, ההליך המשפטי היווה עבורו גורם מציב גבולות ולכן גם לא עבר עבירות נוספות, גורמי סיכויו לשיקום טובים והסיכון למעורבותו בעבירת אלימות היא בינונית, ברמת חומרה  נמוכה, הוא שהה במעצר ממש ובתנאים מגבילים תקופה ארוכה מאוד, באופן שפגע בו ובמשפחתו. כמו כן, מדובר בחלוף זמן של שנתיים וארבעה חודשים מאז ביצוע העבירה.","טיעוני ב""כ הצדדים"
"ת""פ 32787-10-18","הנאשם, בדברו האחרון, הוסיף כי הוא מבקש סליחה.","טיעוני ב""כ הצדדים"
"ת""פ 32787-10-18","כבר נקבע בפסיקת בית המשפט העליון, לא אחת, כי עבירות בנשק, ובכלל זה החזקת נשק, הן בגדר ""מכת מדינה"", ועל בית המשפט לתרום את חלקו בביעור התופעה על ידי החמרת הענישה, כמסר של הרתעה (ע""פ 3877/16 פאדי ג'באלי נ' מדינת ישראל (17.11.16); ע""פ 7703/19 פלוני נ' מדינת ישראל (6.8.20); ע""פ 1509/20 מדינת ישראל נ' ראפאת נבארי (2.7.20); ע""פ 4406/19 מדינת ישראל נ' יונס סובח (5.11.19); ע""פ 5120/11 בילאל שתיווי נ' מדינת ישראל (18.12.11).",דיון והכרעה
"ת""פ 32787-10-18","הערכים החברתיים המוגנים בבסיס העבירות בנשק הם שמירה על שלום הציבור ובטחונו מפני הסיכון ופוטנציאל הנזק העצום שבקיומם של כלי נשק, ובכלל זה תתי מקלע מאולתרים, המסתובבים בשוק החופשי, ומוחזקים על ידי מי שאינם מורשים ומוכשרים לכך, שסופם שיגיעו לגורמים מסוכנים, בעלי מניע ביטחוני או עברייני, ויגרמו לנזקים אדירים.",דיון והכרעה
"ת""פ 32787-10-18","בע""פ 2564/19 איברהים אזברגה נ' מדינת ישראל (18.7.19) עמד על כך בית המשפט העליון –",דיון והכרעה
"ת""פ 32787-10-18","בענייננו, מידת הפגיעה בערכים החברתיים המוגנים הינה ברף בינוני, הואיל ומדובר בשני כלי נשק מאולתרים, מסוג תת מקלע, שהם כלי נשק התקפיים בעיקרם, בעלי פוטנציאל נזק הרסני, קל וחומר כשלצדם תחמושת תואמת, אשר הוחזקו ברכב, וכל זאת כשקטין מעורב באירוע. מנגד, כלי הנשק הוחזקו בפאתי העיר טייבה ולא במקום מרכזי או הומה אדם, לא נעשה בהם שימוש והם לא שימשו לביצוע עבירה נוספת.",דיון והכרעה
"ת""פ 32787-10-18","נסיבות ביצוע העבירה מצביעות על כך שחלקו של הנאשם מרכזי. ביחד עם אחיו הקטין, יצא מהרכב למקום הימצאות כלי הנשק, נטל אותם והכניסם לרכב. הגם שלא נגרם נזק במקרה דנן, הלכה למעשה, הרי שכאמור פוטנציאל הנזק הטמון בשימוש בכלי נשק אלו בידי גורמים מסויימים, עבריינים או ביטחוניים, הוא עצום.",מתחם העונש ההולם
"ת""פ 32787-10-18","מדיניות הענישה בפסיקה מעלה כי בגין העבירה בה הורשע הנאשם, אף כשמדובר בהחזקה של כלי נשק אחד, עם או בלי תחמושת, הוטלו על פי רוב מאסרים ממושכים מאחורי סורג ובריח:",מתחם העונש ההולם
"ת""פ 32787-10-18","רע""פ 4559/16 נוסיראת נ' מדינת ישראל (22.6.16) - הנאשם החזיק נשק מאולתר דמוי קרל גוסטב עם מחסנית תואמת ו-9 כדורים. בית המשפט המחוזי קיבל את ערעור המדינה על קולת העונש והחמיר את עונשו של הנאשם ל-9 חודשי מאסר בפועל, חלף 6 חודשי מאסר בעבודות שירות. בית משפט השלום קבע מתחם שבין 9 ל-24 חודשי מאסר בפועל. הנאשם ללא עבר פלילי. בקשת רשות ערעור נדחתה.",מתחם העונש ההולם
"ת""פ 32787-10-18","ע""פ 3632/14 אנואר אבו סבית נ' מדינת ישראל (8.12.14) - במהלך פגישה קיבל הנאשם תיק גב ובתוכו תת מקלע עם מחסנית ב""הכנס"" וכדור בקנה. נקבע שהנאשם לא ידע על הימצאותם של המחסנית והכדור. נקבע מתחם ענישה הנע בין שנה ל-3 שנות מאסר, והושתו עליו 18 חודשי מאסר בפועל. ערעורו נדחה.",מתחם העונש ההולם
"ת""פ 32787-10-18","ע""פ 3156/11 ג'מיל זראיעה נ' מדינת ישראל (21.2.12) - המערער נסע ברכבו, לאחר שהסליק בו אקדח, מחסנית טעונה בכדורי אקדח בקוטר 9 מ""מ וקופסאות עם כדורי אקדח בקוטר 9 מ""מ. הושתו עליו 24 חודשי מאסר בפועל, מאסר על תנאי וקנס בסך 10,000 ₪. הערעור נדחה.",מתחם העונש ההולם
"ת""פ 32787-10-18","ת""פ (מחוזי מרכז) 63642-12-18 מדינת ישראל נ' אהיב אל מוגרבי (30.4.20) - הנאשם החזיק בידו נשק מסוג רובה M-16 שמספרו הטבוע הושחת והוא עטוף בניילון נצמד, במתחם הסמוך לביתו. הושתו עליו 15 חודשי מאסר לצד מאסר על תנאי וקנס בסך 3,000 ₪.",מתחם העונש ההולם
"ת""פ 32787-10-18","עפ""ג (מחוזי ב""ש) 22885-05-17 אלאסד (עציר) נ' מדינת ישראל (6.7.17) - הנאשם החזיק בנשק מסוג רובה תת מקלע מאולתר ומחסנית עם 10 קליעים בקוטר 9 מ""מ. נקבע מתחם עונש הולם הנע בין 13 ל-36 חודשי מאסר, והושתו עליו 21 חודשי מאסר, מאסר על תנאי וקנס בסך 2,500 ₪. הערעור נדחה.",מתחם העונש ההולם
"ת""פ 32787-10-18","עפ""ג (מחוזי מרכז) 62288-05-17 מדינת ישראל נ' מסרי (15.4.18) - הנאשם החזיק בעסק ברובה מסוג קלצ'ניקוב ובמחסנית עטופים ומוסלקים. בית משפט השלום גזר עליו 6 חודשי מאסר לריצוי בעבודות שירות ובית המשפט המחוזי קבע מתחם שנע בין 10 ל-24 חודשי מאסר בפועל, והחמיר את עונשו של הנאשם ל-10 חודשי מאסר בפועל.",מתחם העונש ההולם
"ת""פ 32787-10-18","ת""פ (מחוזי ב""ש) 53496-03-18 מדינת ישראל נ' סאמר אבו עסא (6.2.19) - החזקת נשק מאולתר אוטומטי. נקבע מתחם הנע בין 36-15 חודשי מאסר, ונגזרו על הנאשם 18 חודשי מאסר.",מתחם העונש ההולם
"ת""פ 32787-10-18","ת""פ (שלום י-ם) 52546-02-19 מדינת ישראל נ' סאמי נאבולסי (9.9.19)- הנאשם הורשע בשתי עבירות החזקת נשק ובעבירה של החזקת תחמושת. במשך כשנתיים וחצי החזיק בנגרייה מתחת לבית משפחתו רובה M1, נשק מאולתר המכיל חלקי רובה צייד ו-77 כדורים שונים. נקבע מתחם הנע בין 9 ל-24 חודשי מאסר ונגזרו עליו 10 חודשי מאסר לצד מאסר על תנאי.",מתחם העונש ההולם
"ת""פ 32787-10-18","ת""פ (כפ""ס) 29239-05-19 מדינת ישראל נ' אמיר זידאת (19.11.20) – הנאשם החזיק תת מקלע מאולתר ובתוכו מחסנית ריקה. הנאשם, צעיר, נעדר עבר פלילי, הודה בביצוע העבירה. נקבע מתחם עונש הולם הנע בין 14 ל-28 חודשי מאסר. על הנאשם נגזרו 14 חודשי מאסר, מאסר על תנאי וקנס בסך 3,000 ₪.",מתחם העונש ההולם
"ת""פ 32787-10-18","בענייננו, בשים לב לעובדה כי מדובר בשני כלי נשק מסוג תת מקלע מאולתר, יחד עם תחמושת תואמת, אני קובע כי ברגיל מתחם העונש ההולם נע בין 22 ל-42 חודשי מאסר, לצד ענישה נלווית.",מתחם העונש ההולם
"ת""פ 32787-10-18","ומדוע ""ברגיל""? שכן, שני הצדדים עתרו לקביעת מתחם עונש הולם שונה מזה שהם טוענים לו בנסיבות ""רגילות"" – הכל כמפורט הלן.",מתחם העונש ההולם
"ת""פ 32787-10-18",אי העמדה לדין של מעורבים אחרים; אחדות הענישה; ונסיבות שאינן קשורות בביצוע העבירה,מתחם העונש ההולם
"ת""פ 32787-10-18","מדובר בנאשם צעיר, כבן 28, נעדר עבר פלילי, שהודה בביצוע העבירה במסגרת הסדר טיעון וחסך בזמן שיפוטי; הנאשם שהה במעצר מאחורי סורג ובריח במשך כשבועיים; לאחר מכן, נותר הנאשם במעצר בית מלא מאוקטובר 2018 עד יולי 2020, קרוב לשנתיים, ומאז יולי 2020 ועד היום מצוי ב""מעצר אדם"", כל זאת מבלי שהפר את תנאי השחרור ולא שב להסתבך בפלילים.",מתחם העונש ההולם
