verdict,text,part
"ת""פ 15842-11-20","לעניין נסיבות שאינן קשורות בביצוע העבירה טען ב""כ הנאשם כי עברו הפלילי של הנאשם מינורי וכולל עבירת תקיפה בגינה נדון למאסר על תנאי. הוא הוסיף כי הנאשם סובל מנכות קשה בשיעור 40% וכי הנאשם נשוי ואב לארבעה, ובתו הבכורה סובלת משיתוק מוחין והמשפחה כולה מתמודדת עם המצב המורכב. גם מצבה הכלכלי של המשפחה קשה והיא מתקיימת מקצבאות ביטוח לאומי. עוד נטען כי הנאשם עבר להתגורר במחנה הפליטים שועפאט וככל הנראה הושפע מגורמים באותו מקום שגרמו למעורבותו בעבירות.",נאשם 2
"ת""פ 15842-11-20",הנאשם עצמו הביע חרטה והתנצל על מעשיו. הוא ביקש להתחשב במצב הרפואי שלו ושל בתו.,נאשם 2
"ת""פ 15842-11-20","שירות המבחן הגיש תסקיר בעניינו של נאשם 2. הנאשם כבן 30, נשוי ואב ל-4 ילדים. הנאשם סיים 11 שנות לימוד. לדבריו היה תלמיד מצטיין ונאלץ להפסיק את לימודיו כדי לסייע בפרנסת המשפחה. בנוסף לדבריו מעבר המשפחה להתגורר במחנה פליטים שועפאט בהיותו בן 16, גרם לחבירתו לחברה שולית, אך עם זאת לדבריו לא היה מעורב בפלילים. הנאשם נפצע לדבריו, לפני כשנתיים ממכשיר חשמלי בסביבת ביתו ומקבל קצבאות מביטוח לאומי. לפני כן עבד שנה וחצי במפעל, וקודם לכן בעבודות מזדמנות.",נאשם 2
"ת""פ 15842-11-20","בתו הבכורה של הנאשם סובלת מעיכוב התפתחותי ופיגור. היא מטופלת במסגרות מיוחדות, אינה עצמאית ונזקקת לפיקוח וליווי יומיומיים. כיום אשתו של הנאשם מטפלת בילדים ללא סיוע והנאשם תיאר רגשות אשם על רקע זה.",נאשם 2
"ת""פ 15842-11-20","הנאשם תיאר את הרקע לעבירות כחיפוש אחר רווח כלכלי ללא עבודה קשה, מבלי שחשב על השלכות אפשריות. קצינת המבחן התרשמה מהבעת חרטה ושיתוף פעולה מצד הנאשם, וציינה רצון לקיום אורח חיים נורמטיבי המושפע גם ממצבה של בתו. זאת, בצד טשטוש וצמצום חומרת העבירות. בשל חומרת העבירות ומסוכנותן לא הובאה המלצה טיפולית, אך הומלץ להביא בחשבון את המצב המשפחתי המורכב.",נאשם 2
"ת""פ 15842-11-20","כפי שהסכימו שני הצדדים, ניתן לראות את העבירות בהן הורשע נאשם 2 כאירוע אחד ולקבוע להן מתחם אחד. מדובר ב-6 אשומים של עבירות נשק שבוצעו תוך תקופה קצרה של מספר שבועות. הם כוללים מעורבות אקטיבית של הנאשם הן בניסיון השגת חלקי נשק על ידי ייבואם מחו""ל, תוך ניסיון לטשטש את מעורבותו בהזמנה, והן בעשיית עסקאות וסחר בחלקי הנשק ובתחמושת. אמנם מספר האישומים בהם הורשע נאשם 2 קטן מהאישומים בהם הורשע נאשם 1, ולא נטען כי הוא הרוח החיה מאחורי האירועים, אולם גם מעשיו של נאשם זה מצביעים על מעורבות עמוקה, ידע והבנה בעסקי הנשק והסחר בנשק. בחלק מהאישומים ניהל נאשם 2 בעצמו משא ומתן עם רוכשים פוטנציאליים ללא מעורבות של נאשמים אחרים.",מתחם העונש ההולם לנאשם 2
"ת""פ 15842-11-20","לעניין הענישה הנוהגת אפנה לפסיקה שנזכרה בעניינו של נאשם 1, שחלק ניכר ממנה רלוונטית לענייננו, וגם לפסקי הדין המפורטים להלן.",מתחם העונש ההולם לנאשם 2
"ת""פ 15842-11-20","ת""פ (י-ם) 41052-11-19 מדינת ישראל נ' עמאר מג'אהד (15.2.21) – הנאשם הורשע במספר עבירות של ייבוא כלי נשק, נקבע מתחם ענישה בין 12-30 חודשי מאסר והנאשם נדון ל-9 חודשי מאסר בפועל בנוסף לתקופת מעצר של כחודשיים וחצי.",מתחם העונש ההולם לנאשם 2
"ת""פ 15842-11-20","ת""פ (י-ם) 34003-04-18 מדינת ישראל נ' מחמד עג'אג (7.10.19) – הנאשם הורשע בארבע עסקאות מכירה של כלי נשק לסוכן משטרתי ועבירות נוספות. נקבע מתחם בין 9-5 שנות מאסר ועל הנאשם נגזרו 6 שנות מאסר בפועל ועונשים נלווים. מדובר בנסיבות חמורות יותר שכללו מכירת כלי נשק ממש לסוכן משטרתי באופן, שאיפשר תפיסת כלי הנשק.",מתחם העונש ההולם לנאשם 2
"ת""פ 15842-11-20","וראו גם: ת""פ (י-ם) 66542-05-20 מדינת ישראל נ' פח'רי אבו נאב (25.1.21); ת""פ (י-ם) 35186-03-18 מדינת ישראל נ' סאמי קאסם (24.1.19)).",מתחם העונש ההולם לנאשם 2
"ת""פ 15842-11-20","כאמור, המאשימה ביקשה לקבוע בעניינו של נאשם 2 מתחם הנע בין 2.5-5 שנות מאסר בפועל. הסניגור טען לרף תחתון של שנה אחת וביקש להסתפק בתקופת מעצרו של הנאשם. אני סבורה שאין הלימה מלאה בין המתחם שביקשה המאשימה בעניינו של נאשם 1 לבין המתחם המבוקש בעניינו של נאשם 2, והשוני בהיקף העבירות המיוחסות להם אינו מצדיק שוני כה גדול במתחמים המבוקשים. בנסיבות העניין אני קובעת מתחם ענישה בין 2.5 -5 שנות מאסר בצד עונשים נלווים.",מתחם העונש ההולם לנאשם 2
"ת""פ 15842-11-20","נאשם 2 הוא יליד 1990, נשוי ואב ל-4 ילדים. הוא עצמו סובל מנכות בעקבות פציעה בשנים האחרונות. בתו הבכורה סובלת משיתוק מוחין הגורם לעיכוב התפתחותי ולפיגור. בעניין זה הוגשו מסמכים רפואיים וכן קיימת התייחסות בתסקיר שירות המבחן. אין ספק שמצבה של הבת מביא להכבדה רבה על אשתו של הנאשם ועל יתר בני המשפחה. מעצרו ומאסרו של הנאשם אינם מאפשרים לו לקחת חלק בטיפול, כך שהעונש גורם קשיים לכל בני המשפחה. עם זאת, בשל חומרת העבירות, משקלם של שיקולים אלו מצטמצם אל מול האינטרס הציבורי.",העונש במסגרת המתחם – נאשם 2
"ת""פ 15842-11-20",הנאשם הודה במיוחס לו וחסך זמן שיפוטי. לחובתו עבר פלילי מינורי הכולל הרשעה בעבירת תקיפה שבגינה נדון למאסר על תנאי וקנס.,העונש במסגרת המתחם – נאשם 2
"ת""פ 15842-11-20",המאשימה ביקשה למקם את הנאשם בתחום התחתון של המתחם ולהטיל עליו 3 שנות מאסר ועונשים נלווים. הסניגור ביקש להסתפק בתקופת מעצר של כשנה.,העונש במסגרת המתחם – נאשם 2
"ת""פ 15842-11-20","שיקול נוסף שיש להביא בחשבון הוא העונש הנגזר על נאשם 1 בתיק זה. אמנם,  מעורבותו של נאשם 1 גדולה, הוא הורשע בעבירות רבות יותר ולחובתו עבר פלילי משמעותי. אולם, גם בהביאי בחשבון את כל אלו נראה שהעונש המבוקש בעניינו של נאשם 2 מבטא גישה מקלה משמעותית לעומת העונש שהתבקש בעניינו של נאשם 1. בנסיבות העניין יש לקבוע את עונשו של נאשם 2 בחלק התחתון, אך לא בתחתית של מתחם הענישה.",העונש במסגרת המתחם – נאשם 2
"ת""פ 15842-11-20","חלקו של נאשם 4 באירועים היה קטן באופן מהותי מחלקם של נאשמים 2 ו-3, והצטמצם במעורבותו באישום 12 בלבד. גם באישום זה היה חלקו של נאשם 4 קטן מחלקו הדומיננטי של נאשם 1. המעשים המיוחסים לנאשם 4 אינם כוללים מעורבות בעבירות הנשק עצמן אלא בהשפעה על החקירה שהתפתחה בעקבות אירוע ירי.",נאשם 4
"ת""פ 15842-11-20","ב""כ המאשימה עמדה על חומרת העבירות המיוחסות לנאשם 4. היא ביקשה לקבוע מתחם של מספר חודשי מאסר אשר יכול שירוצו בעבודות שירות. את הנאשם שבפני ביקשה למקם בשליש התחתון של המתחם לנוכח גילו הצעיר, העובדה שחלקו באירוע שאינו מרכזי  והעובדה שהודה וחסך זמן. המאשימה ביקשה להטיל על נאשם 4 עונש של מספר חודשי עבודות שירות ומאסר על תנאי.",נאשם 4
"ת""פ 15842-11-20","ב""כ הנאשם ביקש להסתפק בתקופת מעצרו של הנאשם. הוא הדגיש את חלקו המצומצם באירוע, כך שפעולות שיבוש החקירה עצמן נעשו על ידי נאשם 1, בעוד חלקו של נאשם 4 התבטא במסירת עובדות לנאשם 1. הסניגור ציין כי על פי עובדות כתב האישום לא ברור אם התקיימה פגישת ההדחה עם נאשם 1 ומה נאמר בפגישה בין נאשם 4 לג'ית, כך שעובדות האירוע עמומות ולטענת נאשם 4 כלל לא היתה הדחה בפועל.",נאשם 4
"ת""פ 15842-11-20","לטענת הסניגור בנסיבות אלו ניתן לקבוע מתחם ענישה שתחתיתו מאסר על תנאי, ומכל מקום ניתן להסתפק בתקופת מעצרו של הנאשם. הוא ציין כי הנאשם הודה, קיבל אחריות וחסך מזמנו של בית המשפט. הנאשם שהה במעצר כחודשיים ולאחר מכן היה נתון בפיקוח אלקטרוני למעלה מ-5 חודשים. לצורך כך היה על משפחתו לעזוב את ביתה ולשכור בית בשכונה אחרת, ונגרמו להם הוצאות וטרחה רבה. עוד טען הסניגור כי הנאשם סובל מבעיות נפשיות ומטופל במרפאה בעקבות פגיעה בראשו לפני זמן רב.",נאשם 4
"ת""פ 15842-11-20",מתחם העונש ההולם והעונש הראוי לנאשם 4   ,נאשם 4
"ת""פ 15842-11-20","מכתב האישום עולה כי נאשם 4 בא לביטוי בעיקר בדיווח ושיחות עם נאשם 1 ""מאחורי הקלעים"" ולא בפעולות השיבוש עצמן. גם בשיחה הנזכרת בסיפא לאישום 12 לא ברור מה היה תוכן השיחה ומה חלקו של נאשם 4, ומכל מקום ברור, כי נאשם 4 וג'ית תיאמו להיפגש גם עם נאשם 1, שהיה הגורם הדומיננטי באירועי אותו אישום.",נאשם 4
"ת""פ 15842-11-20","הצדדים לא הגדירו במדויק את מתחמי הענישה החלים במקרה זה. בשים לב לחלקו המצומצם של הנאשם שלא כלל מעורבות בפעולות השיבוש וההדחה עצמן, ניתן לקבוע מתחם שבין עונש שאינו כולל מאסר בפועל לבין מספר חודשי מאסר.",נאשם 4
"ת""פ 15842-11-20","באשר לעונש במסגרת המתחם, נאשם 4 יליד 1997, ללא עבר פלילי וללא מעורבות בעבירות הנשק עצמן. הנאשם היה עצור מיום 17.11.20 עד יום 18.1.21, ולאחר מכן היה נתון בפיקוח אלקטרוני עד ליום 25.6.21.",נאשם 4
"ת""פ 15842-11-20","כאמור, המאשימה עצמה לא עמדה על כך שיוטל על הנאשם עונש מאסר בפועל ממש וביקשה לבחון את התאמתו לעבודות שירות. בשים לב לכך שהנאשם ריצה למעשה 2 חודשי מאסר בפועל, אני סבורה שניתן להימנע מהטלת עונש מאסר נוסף, בין במאסר ממש ובין בעבודות שירות.",נאשם 4
"ת""פ 15842-11-20",לאור כל האמור עונשיהם של הנאשמים יהיו כמפורט להלן:,סיכום 
"ת""פ 15842-11-20",על עבירות הנשק אני גוזרת על הנאשם  6 שנות מאסר בפועל בניכוי ימי מעצרו.,נאשם 1
"ת""פ 15842-11-20","על עבירות האלימות אני גוזרת על הנאשם שנתיים מאסר בפועל, שירוצו אחת בחופף ואחת במצטבר למאסר על עבירות הנשק.",נאשם 1
"ת""פ 15842-11-20","כמו כן אני מפעילה מאסר מותנה שהוטל על הנאשם בת""פ 47777-08-17 למשך 7 חודשים. מחצית התקופה תהא בחופף ומחציתה במצטבר למאסר שהוטל בתיק זה.",נאשם 1
"ת""פ 15842-11-20",בסך הכל ירצה הנאשם 7 שנים ו-3.5 חודשי מאסר בפועל בניכוי ימי מעצרו.,נאשם 1
"ת""פ 15842-11-20","מאסר על תנאי ל-8 חודשים למשך 3 שנים, על כל עבירת נשק או עבירת אלימות שהיא פשע.",נאשם 1
"ת""פ 15842-11-20","קנס כספי בסך 20,000 ₪ שישולם ב-5 תשלומים חודשיים שווים ורצופים החל מיום 1.2.22.",נאשם 1
"ת""פ 15842-11-20",מאסר בפועל ל-3 שנים בניכוי תקופת מעצרו.,נאשם 2
"ת""פ 15842-11-20","מאסר על תנאי ל-5 חודשים למשך 3 שנים, על כל עבירת נשק.",נאשם 2
"ת""פ 15842-11-20","קנס כספי בסך 15,000 ₪ שישולם ב-5 תשלומים חודשיים שווים ורצופים החל מיום 1.2.22.",נאשם 2
"ת""פ 15842-11-20","מאסר בפועל למשך חודשיים, החופף את התקופה בה היה הנאשם במעצר בתיק זה, כך שהנאשם לא יידרש לשאת תקופת מאסר נוספת.",נאשם 4
"ת""פ 15842-11-20","מאסר על תנאי ל- 3 חודשים למשך 3 שנים, על העבירות בהן הורשע הנאשם.",נאשם 4
"ת""פ 15842-11-20",זכות ערעור לבית המשפט העליון תוך 45 יום. ,54678313
"ת""פ 15842-11-20","ניתן היום,  י""ט טבת תשפ""ב, 23 דצמבר 2021, במעמד הצדדים.",54678313
"ת""פ 15842-11-20",חגית מאק קלמנוביץ 54678313,54678313
"ת""פ 15842-11-20",נוסח מסמך זה כפוף לשינויי ניסוח ועריכה ,54678313
"ת""פ 15842-11-20","בעניין עריכה ושינויים במסמכי פסיקה, חקיקה ועוד באתר נבו – הקש כאן",54678313
