verdict,text,part
"ת""פ 51912-09-23","באי-כוח הנאשמים הדגישו את התיקון המשמעותי של כתב האישום, ואת הודיית הנאשמים ונטילת האחריות למעשים, את גילם הצעיר והביעו בשמם עתירה להפנות עניינם להליכי שיקום בין כתלי בית המאסר, כאשר נאשם 2 אף החל להשתלב בקבוצות בבית המעצר. ראיתי להמליץ כי הנאשמים ישולבו באפיק שיקומי במסגרת ריצוי המאסר שיוטל עליהם.",קביעת העונש המתאים לנאשמים
"ת""פ 51912-09-23","הנאשמים מבינים כיום את הפסול במעשים ואת התוצאות החמורות שנגרמו למתלוננים, כאשר נאשם 1 שהיה עצמו נפגע מירי, הדגיש את חומרת המעשה שביצעו. אביא בחשבון את העובדה כי מדובר במאסר ראשון אותו ירצה נאשם 1, ואף לכך נודעת חשיבות.",קביעת העונש המתאים לנאשמים
"ת""פ 51912-09-23","בבואי לקבוע את העונש המתאים, הבאתי בחשבון את נסיבותיהם האישיות של הנאשמים כפי שפורטו בהרחבה על ידי בא-כוחם, וכן לקחתי בחשבון את גילם הצעיר (בעיקר נאשם 2).",קביעת העונש המתאים לנאשמים
"ת""פ 51912-09-23","נוכח סמיכות הזמנים במסגרתה הוטלו המאסרים ברי ההפעלה בעניינו של נאשם 2, סברתי כי יש מקום לחפיפה ביניהם ולחפיפה מידתית בלבד לעונש שיוטל עליו בגין תיק זה.",קביעת העונש המתאים לנאשמים
"ת""פ 51912-09-23","נוכח מכלול הנסיבות והאמור בתצהירי נפגעי העבירה, יש מקום להטלת פיצוי לנפגעים, כאשר המאשימה עתרה להטלת פיצוי משמעותי יותר לנפגע אשר נדקר (עובדה), בשים לב לנזקים שנגרמו ולמסמכים הרפואיים.",קביעת העונש המתאים לנאשמים
"ת""פ 51912-09-23","אשר על כן, אני מטילה על הנאשמים את העונשים כדלקמן:",קביעת העונש המתאים לנאשמים
"ת""פ 51912-09-23",מאסר בפועל לתקופה של 45 חודשים החל מיום מעצרו- 8/9/2023,נאשם 1-	
"ת""פ 51912-09-23",מאסר למשך 9 חודשים אולם הנאשם לא יישא עונש זה אלא אם יעבור תוך שלוש שנים מיום שחרורו עבירת אלימות נגד הגוף מסוג פשע.,נאשם 1-	
"ת""פ 51912-09-23",מאסר למשך 5 חודשים אולם הנאשם לא יישא עונש זה אלא אם יעבור תוך שלוש שנים מיום שחרורו עבירת אלימות מסוג עוון או החזקת סכין.,נאשם 1-	
"ת""פ 51912-09-23","פיצוי למתלונן עובדה בסך 25,000 ₪ אשר ישולם ב- 10 תשלומים חודשיים שווים החל מיום 1/2/2025.  ",נאשם 1-	
"ת""פ 51912-09-23",מאסר בפועל לתקופה של 65 חודשים החל מיום מעצרו- 8/9/2023,נאשם 2-
"ת""פ 51912-09-23","אני מורה על הפעלת 2 מאסרים מותנים, 8 חודשים (ת""פ 62486-08-2021 מיום 15/3/2022); 5 חודשים (ת""פ 41938-12-20 מיום 10/10/2022) בחופף ובמצטבר כך שסך הכל ירצה הנאשם 2 מאסר למשך 72 חודשי מאסר. ",נאשם 2-
"ת""פ 51912-09-23","מאסר למשך 9 חודשים אולם הנאשם לא יישא עונש זה אלא אם יעבור תוך שלוש שנים מיום שחרורו עבירת אלימות נגד הגוף מסוג פשע, ועבירות בנשק.",נאשם 2-
"ת""פ 51912-09-23",מאסר למשך 5 חודשים אולם הנאשם לא יישא עונש זה אלא אם יעבור תוך שלוש שנים מיום שחרורו עבירת אלימות מסוג עוון.,נאשם 2-
"ת""פ 51912-09-23","פיצוי למתלונן דיאא בסך 15,000 ₪ אשר ישולם ב- 10 תשלומים חודשיים שווים החל מיום 1/2/2025.",נאשם 2-
"ת""פ 51912-09-23",ניתן צו כללי למוצגים לשיקול דעת קצין משטרה או התביעה.,נאשם 2-
"ת""פ 51912-09-23",זכות ערעור כחוק.,נאשם 2-
"ת""פ 51912-09-23","54678313ניתן היום,  ט' אב תשפ""ד, 13 אוגוסט 2024, במעמד הצדדים.",5129371
"ת""פ 51912-09-23",מעין בן ארי 54678313,5129371
"ת""פ 51912-09-23",נוסח מסמך זה כפוף לשינויי ניסוח ועריכה,5129371
"ת""פ 51912-09-23","בעניין עריכה ושינויים במסמכי פסיקה, חקיקה ועוד באתר נבו – הקש כאן",5129371
