verdict,text,part
"ת""פ 17536-08-21","לא ניתן אף להתעלם מהעובדה כי הנאשם ביצע את העבירה ימים ספורים טרם הגיעו לבגרות וכידוע ""אין דינו של קטין שביצע את העבירה על סף גיל האחריות הפלילית כדינו של קטין אשר חצה את גיל האחריות הפלילית זה מכבר"".  נקבע, כי כאשר מדובר בקטין המתקרב לגיל הבגירות, ניתן משקל מופחת לשיקולי הענישה הנוגעים לעבריינים קטינים (ראו בעניין זה ע""פ 1776/10 פלוני נ' מדינת ישראל [פורסם בנבו] (5.5.2010); ע""פ 10715/05 פלוני נ' מדינת ישראל [פורסם בנבו] (4.9.2007);ע""פ 6393/07 פלוני נ' מדינת ישראל [פורסם בנבו] (25.9.2007)). ",דיון והכרעה
"ת""פ 17536-08-21","אמנם בית משפט זה שם לנגד עיניו את שיקולי השיקום בעניינם של נאשמים קטינים כשיקול משמעותי וכבד משקל, וככלל הסטייה מהמלצות שירות המבחן כאשר יש בנמצא אופק שיקומי תהיה רק מטעמים כבדי משקל (ראו בעניין זה ע""פ 8717/16 ‏פלוני נ' מדינת ישראל [פורסם בנבו] (25.6.17)), אולם לצד האמור נקבע כי השיקולים אותם שוקל בית המשפט בבואו לגזור את העונש עשויים להיות רחבים משיקולי השיקום אשר מנחים את שירות המבחן בגיבוש המלצותיו,  ועל כן  ""יודגש, המלצות שירות המבחן – אליהן אנו מתייחסים בכובד ראש רב ורואים בהן כלי עזר חשוב במלאכת השפיטה – כשמן כן הן, המלצות! על בית המשפט להפעיל את שיקול דעתו להכריע בכל עניין ועניין בהתחשב בכלל האינטרסים הרלבנטיים, וכך אנו עושים גם במקרה זה."" (ע""פ 8768/14 פלוני נ' מדינת ישראל [פורסם בנבו])",דיון והכרעה
"ת""פ 17536-08-21","על כך אוסיף כי אין חולק שהשיקולים המנחים את בתי המשפט לנוער הינם בראש ובראשונה שיקולי שיקום, וזאת בשונה מהשיקולים בעניינם של בגירים, אשר הובנו בתיקון 113 לחוק העונשין, התשל""ז 1977, ואשר העיקרון המנחה לגביהם הוא עקרון ההלימה (סעיף 40ב לחוק העונשין). משכך אף הוחרג עניינם של קטינים  מהתיקון האמור, אולם לצד האמור קבע המחוקק (בסעיף 40 טו לחוק העונשין) כי ""בית המשפט רשאי להתחשב בעקרונות ובשיקולים המנחים בענישה המנויים בסימן זה, תוך התאמתם לענישת הקטין, ככל שסבר שראוי לתת להם משקל בנסיבות המקרה.",דיון והכרעה
"ת""פ 17536-08-21","ואכן בית המשפט העליון קבע לא פעם כי ""קטינות אינה יוצרת חסינות  ולעתים שיקולים של הרתעה, מניעה ותגמול עולים במשקלם על השיקול השיקומי"" (ע""פ 8264/02 פלונים נ' מ""י), וכי ""מתן הדגש המיוחד על שיקולי שיקומו של הקטין אינו מאיין את הצורך באיזון עם שיקולי ענישה אחרים, כמו שיקולי ההרתעה והגמול, בהתאם לחומרת העבירה ונסיבותיה"" (ע""פ 6435/16 פלוני נ' מדינת ישראל [פורסם בנבו] (13/09/2016)). ",דיון והכרעה
"ת""פ 17536-08-21","משכך ככל שגילו של הקטין קרוב לגיל הבגירות, וככל שקיים אינטרס ציבורי רחב להחמרה בענישה, יקבלו שיקולי ההרתעה וההלימה משקל מוגבר.",דיון והכרעה
"ת""פ 17536-08-21",נוכח כל האמור לא מצאתי כי ניתן או ראוי להימנע מהרשעתו של הנאשם בעבירה החמורה אותה ביצע.,דיון והכרעה
"ת""פ 17536-08-21","לצד האמור, בבואי לגזור את עונשו של הנאשם נתתי משקל רב לתסקירים החיוביים מאוד בעניינו של הנאשם, ובית המשפט מברך אותו על שיתוף הפעולה עם גורמי הטיפול, ההתמדה והאמונה בהליך, וכן על האפיק החיובי אותו סיגל הנאשם לעצמו כדרך חיים ואם ימשיך הנאשם להתמיד בכך יהא זה שכרו ושכרה של החברה כולה.",דיון והכרעה
"ת""פ 17536-08-21","משכך, ובאופן חריג לראוי ולנהוג בעבירות נשק, לא מצאתי לנכון לגזור על הנאשם עונש מאסר, אשר יהיה בו כדי לקטוע את דרכו החיובית ובחרתי להסתפק בעניינו בעונש צופה פני עתיד. לעניין זה יוער כי ע""פ 241/41 אותו הביאה ב""כ המאשימה ובה נגזר עונש מאסר על דרך של עבודות שירות, (כמו גם ת""פ 39270-12-20 ות""פ 69833-11-18 שם נגזרו על הנאשמים עונשי מאסר על תנאי), עוסקים בעבירות חמורות יותר, כפי שטען בצדק ב""כ הנאשם. כמו כן לעניין הקנס, וחרף הצורך להרתיע, ככלל מפני ביצוע עבירות נשק גם באמצעות רכיבים כספיים משמעותיים, מצאתי כי בנסיבותיו של הנאשם, נוכח המחירים הכבדים שכבר שילם בתקופות בהן היה נתון במעצר מבלי אפשרות לפרנס עצמו, אין מקום להשית קנס מפליג בחומרתו.",דיון והכרעה
"ת""פ 17536-08-21","לאור כל האמור לעיל, אני מרשיעה את הנאשם על פי סעיף 24(1) לחוק הנוער (שפיטה ענישה ודרכי טיפול), התשל""א- 1971 וגוזרת דינו כדלקמן:",דיון והכרעה
"ת""פ 17536-08-21","גוזרת על הנאשם 6 חודשי מאסר על תנאי למשך שלוש שנים מהיום, אותן ירצה אם יעבור עבירה בה הורשע או כל עבירה שעניינה נשק או אמצעי לחימה: החזקה, שימוש, ייצור או סחר לרבות עבירות של ניסיון, שידול או סיוע לעבירות אלו.",דיון והכרעה
"ת""פ 17536-08-21","הנאשם יועמד במבחן, בפיקוח קצין מבחן לנוער, למשך חצי שנה מהיום. מובהר לקטין כי במהלך תקופת המבחן  עליו להמשיך בטיפול פרטני  ו/או קבוצתי על פי שיקול דעת קצין המבחן, ככל שיידרש ממנו, והובהרה לו חשיבות שיתוף הפעולה עם שירות המבחן. הסברתי לנאשם את סמכותו של בימ""ש זה, לפי סעיף 27(א) לחוק הנוער (שפיטה, ענישה ודרכי טיפול), תשל""א – 1971 וסע' 20 לפקודת המבחן [נוסח חדש], התשכ""ט – 1969, להטיל עליו עונש במקום צו המבחן, וזאת ככל שלא ימלא אחר הוראה מהוראות צו המבחן או יורשע בביצוע עבירה נוספת בתקופת המבחן , ועל פי שיקול דעתו של בית המשפט.",דיון והכרעה
"ת""פ 17536-08-21","הנאשם ישלם קנס בסך 3000 ₪ אשר ישולם בשישה תשלומים שווים ורצופים, הראשון שבהם ביום 01/04/2023.",דיון והכרעה
"ת""פ 17536-08-21",את הקנס ניתן לשלם כעבור 3 ימים מהיום באחת מהדרכים הבאות:,דיון והכרעה
"ת""פ 17536-08-21","*  בכרטיס אשראי – באתר המקוון של רשות האכיפה והגבייה, www.eca.gov.il",דיון והכרעה
"ת""פ 17536-08-21",*  מוקד שירות טלפוני בשרות עצמי (מרכז גבייה) – בטלפון 35592 *,דיון והכרעה
"ת""פ 17536-08-21","* במזומן בכל סניף של בנק הדואר – בהצגת תעודת זהות בלבד (אין צורך בהצגת שוברי   תשלום). ככל שהופקדו כספים בתיק או בתיקי המעצר, יקוזזו לטובת הקנס והיתרה תוחזר למפקיד.",   או בטלפון 073-2055000.
"ת""פ 17536-08-21","הסברתי לנאשם כי מתנדב הצפוי להשלים 12 חודשי שירות לאומי אזרחי, יוכל לפנות לנשיא המדינה בבקשה לקיצור תקופת ההתיישנות או המחיקה של הרישום הפלילי בטלפון 02-5411519 או באמצעות המרשתת (אינטרנט) של מחלקת חנינות במשרד המשפטים.",   או בטלפון 073-2055000.
"ת""פ 17536-08-21",זכות ערעור לבית המשפט המחוזי בבאר שבע תוך 45 ימים מהיום.,   או בטלפון 073-2055000.
"ת""פ 17536-08-21","ניתנה והודעה היום ט' אדר תשפ""ג, 02/03/2023 במעמד הנוכחים. ",<#3#>
"ת""פ 17536-08-21",הוקלד על ידי אורלי מרקוס,"שרון ריבלין-אחאי, שופטת"
"ת""פ 17536-08-21",שרון ריבלין אחאי 54678313,"שרון ריבלין-אחאי, שופטת"
"ת""פ 17536-08-21",נוסח מסמך זה כפוף לשינויי ניסוח ועריכה,"שרון ריבלין-אחאי, שופטת"
"ת""פ 17536-08-21","בעניין עריכה ושינויים במסמכי פסיקה, חקיקה ועוד באתר נבו – הקש כאן","שרון ריבלין-אחאי, שופטת"
