verdict,text,part
"ת""פ 40922-11-15","בנוסף מבקשת המאשימה לחלט את הקטנוע הנושא מספר רישוי 73-462-73, ששימש אמצעי לביצוע העבירה, באמצעותו הסיעו הנאשמים את הסוכן הלוך ושוב.",טיעונים לעונש:
"ת""פ 40922-11-15","כן, עותרת המאשימה להטיל על כל הנאשמים קנס אחד כולל בסך של 150,000 ש""ח, כשהחלוקה תיעשה לפי שיקול דעת בית המשפט. העסקאות אותן ביצעו הנאשמים עמדו על סך של 72,000 ₪ אשר שולמו על ידי הסוכן, קרי כספי אוצר המדינה. הקנס אינו מהווה הוצאת הטרף מפי הטורף, אלא גם נועד להרתעה, במיוחד בשל העובדה שמדובר בעבירות לשם בצע כסף.",טיעונים לעונש:
"ת""פ 40922-11-15","ב""כ המאשימה הפנתה לע""פ 6771/12 עומר קאסם נ' מ""י הרלוונטי לעניין זה; שם בית המשפט המחוזי בחיפה השית על הנאשם קנס בסך 50,000 ש""ח, פי 3 מסכום העסקה, ובערכאת הערעור, בהסכמת המדינה, נוכח נסיבות אישיות של המערער הוסכם על הפחתת הקנס ל- 30,000 ש""ח.",טיעונים לעונש:
"ת""פ 40922-11-15","ב""כ הנאשם 1 טענה, כי הנאשם לקח אחריות מלאה על מעשיו, הביע חרטה והודה עוד בטרם נשמעו הראיות; בכך, חסך מזמנו היקר של בית המשפט, ועל כן מבקשת היא לאמץ את הסדר הטיעון אשר הושג בין הצדדים.",טיעונים לעונש:
"ת""פ 40922-11-15","ב""כ הנאשם 2 טען, כי הנאשם 2 הודה בהזדמנות הראשונה וחסך זמן שיפוטי יקר. לעניין נסיבות המעשה טען הוא כי הנאשם הודה בעבירת הסיוע, ולעניין הנהיגה ללא רישיון נהיגה וללא ביטוח, המדובר הוא בקטנוע קטן שנעשה בו שימוש בתוך שטח שאינו בנוי, אלא בתוך שטח חקלאי. רמת הענישה בעבירות שכאלה, עומדת על 5-7 חודשי פסילה בפועל, קנס, פסילה על תנאי ומאסר על תנאי במידת הצורך. על פי הנטען, כל שעשה הנאשם 2 היה לספור את הכסף וחלקו בפרשיה דכאן הוא זעום. ",טיעונים לעונש:
"ת""פ 40922-11-15","ב""כ הנאשם ביקש להגיש חוו""ד פסיכיאטרית משנת 2009 מטעם בית החולים שער מנשה, אולם, תחילה, המאשימה התנגדה לכך. לדידי ההגנה, הנאשם 2 היה מוכר בעבר כאדם שאינו כשיר לעמוד לדין והוא מטופל בתרופות פסיכיאטריות שמטרתן ייצוב מצבו הנפשי. על כן, מוצדק להשית על הנאשם עונש שלא יהא מעל 12 חודשי מאסר בפועל. לאחר קבלת הסכמת המאשימה, הגיש ב""כ הנאשם 2 חוות דעת פסיכיאטרית משנת 2009 של בית החולים שער מנשה, כנסיבה לקולא, לפי סעיף 40יא (8) לחוק העונשין, לפיה - בבדיקות פסיכיאטריות התגלה אפקט חרדתי ומתוח, מחשבות שווא של רדיפת הצוות, רדיפת המשטרה ורוסים, שלטענתו חוטפים אנשים ממוצא ערבי, הורגים אותם ומחליפים אותם לרוסים, על מנת לחסל את כל הערבים בארץ. הנאשם 2 נמצא בעבר (ולא כיום) כמי שסובל ממחלה נפשית במובן המשפטי של המונח, אינו יכול לעמוד לדין ולעקוב אחר הליכי משפט ואינו מבדיל בין טוב לרע.",טיעונים לעונש:
"ת""פ 40922-11-15","יתרה מזו, המשטרה השפילה את הנאשם 2 ביומו הראשון בירח הדבש באילת עת ""משכו"" אותו, בזמן שאכל ארוחת בוקר בחדר האוכל, ואף השאירו את כלתו הטרייה לבדה שם באילת המרוחקת. כאילו שלא די בכך, השוטרים הגיעו לבית אימו של נאשם זה, ערכו חיפוש והפכו את כל תכולת הבית ולבסוף לקחו ארנק ובו כספה, בטענה כי זהו כספו של הנאשם. נסיבה נוספת בעטיה מבקש ב""כ הנאשם להקל בעונשו של הנאשם 2 היא פטירת אחותו הצעירה ז""ל אשר הלכה לעולמה בגיל צעיר.",טיעונים לעונש:
"ת""פ 40922-11-15","לעניין חילוט סכום הכסף בסך של 22900 ₪, טען הוא כי הכסף שייך לאמו אשר מימנה את החתונה שהתקיימה יומיים קודם לחיפוש. האם מתגוררת בבניין מגורים בן 3 קומות, כאשר הקומה הראשונה בבעלותה, והיא גרה בה יחד עם שני בניה- הנאשם 2 והנאשם 4. הכסף נתפס בארנקה של האם. כאמור, לטענת ב""כ הנאשם הכסף שייך לאם אשר מימנה את החתונה ואת שיפוץ ביתו של הנאשם 2. בהמשך טען ב""כ הנאשם, כי הנאשם 2 מתגורר עם אימו והיא שיפצה את דירתה בכדי להכין לו ולאשתו הטריה חדר נפרד. בארנקה אשר נתפס בחדר השינה שלה (ללא כל ניסיון להסתירו) נתפסו צ'קים וסכום כסף מזומן- בשקלים ובדולרים. ב""כ הנאשם 2 הוסיף וציין, כי אחד מהצ'קים הנ""ל ניתן כמתנת חתונה מעוה""ד עדית שינו, המייצגת בתיק זה את הנאשמים האחרים. עוד מוסיף, כי לא הוכח, ואף לא ניתן להוכיח, כי כספים אלה הושגו בפשע. כמו כן, מטעם הנאשם הוגשה לתיק בית המשפט מחברת ובה רשימת נותני המתנות בחתונה. לבסוף, טענה ההגנה, כי אם יחליט בית המשפט לחלט כספים אלה הרי שיש לחלט רק את מחציתם.",טיעונים לעונש:
"ת""פ 40922-11-15","ב""כ הנאשם 2 הפנה לפסק דין בו נגזרו 10 חודשי מאסר בפועל בגין עבירות החזקת נשק, שימוש ברכב לפשע וקשירת קשר לפשע, ואולם , במסגרת ערעור, העונש הופחת ל- 6 חודשי מאסר; פסק דין זה לא הוגש לתיק בית המשפט. בסופו של יום, על רקע מכלול הטיעונים ובשל נסיבותיו האישיות של הנאשם 2, ביקש בא כוחו להסתפק בימי המעצר, ובענישה הצופה פני עתיד. לעניין הקנס טען הוא, כי די והותר באקט ההשפלה והנזק שנגרמו לנאשם כדי להביא את בית המשפט למסקנה, כי, בנסיבות האופפות את ענייננו, אין מקום להטיל קנס. כן, מתחם העונש הראוי הוא החל מ- 10 חודשים.",טיעונים לעונש:
"ת""פ 40922-11-15","ב""כ הנאשם 3 טענה, כי הנאשם לקח אחריות על מעשיו, הביע חרטה וחסך זמן שיפוטי יקר. על כן מבקשת לכבד את ההסדר.",טיעונים לעונש:
"ת""פ 40922-11-15","ב""כ הנאשם 4 טענה, כי הנאשם הביע חרטה, חסך זמן שיפוטי יקר ושיתף פעולה. מעורבותו של הנאשם 4 היתה שולית, הוא רק לקח וספר את הכסף, לא היה לו כל קשר עם הסוכן או המעורבים בעסקאות. נאשם זה עתיד להתחתן עם ארוסתו לכשישתחרר ומעונין לפתוח דף חדש בחייו. בנסיבות כאן, עתרה הסניגורית להסתפק בתקופת מעצרו. מתחם העונש שביקשה המאשימה הוא גבוה ביחס לכך שהעבירה שבוצעה על ידו הינה ברף נמוך. ב""כ הנאשם 4 הפנתה לפסיקה, עליה אעמוד בהמשך.",טיעונים לעונש:
"ת""פ 40922-11-15","לא אחת נפסק, כי גם לאחר תיקון 113 לחוק העונשין, חובה על בית המשפט לבדוק אם העונש המוסכם נופל הוא אל תוך מתחם העונש ההולם. כן, יש לבדוק  את העונש הראוי שהיה מוטל על הנאשם אלמלא הושג הסדר; זאת על מנת לבחון את מידת ההקלה שהנאשם זכה לה, והאם הקלה זו עומדת במבחן האיזון.",סוגיית כיבוד הסדרי טיעון
"ת""פ 40922-11-15","ראה לדוגמה: ע""פ 3856/13 שי גוני נ' מדינת ישראל (פורסם במאגרים המשפטיים); ע""פ 512/13 פלוני נ' מדינת ישראל (פורסם בנבו) (04.12.13); ע""פ 1323/13 חסן נ' מדינת ישראל (05.06.13); ע""פ 9246/12 חמאיסה נ' מדינת ישראל (24.03.14). ראו גם ע""פ 5953/13 מדינת ישראל נ' דוידי (07.07.14) שם נפסק, בין היתר, כך: ""על בית המשפט לקבוע תחילה את מתחם הענישה בהתאם להוראות הדין ולמדיניות הענישה הנוהגת, בשלב הבא, להשוותו לטווח הענישה עליו הסכימו הצדדים, וככל שהטווח מאושר – לקבוע את העונש בהתחשב בהסדר הטיעון"" (שם, בפסקה 20). ",סוגיית כיבוד הסדרי טיעון
"ת""פ 40922-11-15","משכך, על בית-המשפט לבדוק אם הסדר הטיעון שהוצג בפניו הינו סביר ואם ממוקם הוא על סרגל ההלימה (מתחם הענישה) במקום שאין בו סטייה כזו שתביא לדחיית ההסדר.",סוגיית כיבוד הסדרי טיעון
"ת""פ 40922-11-15","במסגרת תיקון 113 לחוק העונשין בית המשפט נדרש לעריכת בחינה תלת שלבית: ראשית, על בית המשפט לקבוע האם מדובר באירוע אחד או במספר אירועים. שנית, על בית המפשט לקבוע את מתחם העונש ההולם וההנמקה לכך. שלישית, קביעת העונש הראוי בתוך המתחם או מחוצה לו, אם החוק מאפשר זאת, וההנמקה לכך. ראה פירוט שלבי הבחינה בפסק דינו המפורט של בית המשפט העליון, מפי כב' השופט סולברג, ע""פ 8641/12 מוחמד סעד נ' מדינת ישראל (טרם פורסם, ניתן ביום 05/08/13) (להלן: ""ע""פ 8641/12"").",מתחם הענישה בהתאם לתיקון 113:
"ת""פ 40922-11-15","בענייננו, הורשעו הנאשמים 1 ו-3 בעבירות של סחר בנשק, החזקת נשק, קשירת קשר לפשע. בנוסף הנאשם 3 הורשע בעבירות של נשיאת נשק, נהיגה ללא רשיון ונהיגה ללא פוליסת ביטוח. הנאשמים 2 ו- 4 הורשעו בעבירות של סיוע לסחר בנשק, סיוע להחזקת נשק, קשירת קשר לביצוע פשע בנוסף הנאשם 2 הורשע בעבירות של נהיגה ללא רשיון וללא ביטוח.",שלב ראשון- ריבוי עבירות או עבירה אחת:
"ת""פ 40922-11-15","עיון בכתב האישום מראה, כי מדובר באירועים נפרדים  ( 3 אישומים נפרדים ), במסגרתם קשרו הנאשמים או מי מהם קשר מספר פעמים לביצוע עסקאות הסחר בנשק. עם זאת, המקרים השונים הם חלק ממסכת אירועים אחת, בה נעברו אותן עבירות, המפעיל והמבצעים שיתפו פעולה, סחרו והחזיקו נשק בצוותא, כל אחד לפי חלקו, וניתן לראות, כי מדובר בעבירות המהוות שרשרת המורכבת ממגוון חוליות באירוע אחד היונק מתוך תוכנית עבריינית אחת.",שלב ראשון- ריבוי עבירות או עבירה אחת:
"ת""פ 40922-11-15","הוראות סעיף 40יג(א) לחוק העונשין ""ריבוי עבירות"", קובע בזו הלשון:",שלב ראשון- ריבוי עבירות או עבירה אחת:
"ת""פ 40922-11-15","(ב) הרשיע בית המשפט נאשם בכמה עבירות המהוות כמה אירועים, יקבע מתחם עונש הולם כאמור בסעיף 40ג(א) לכל אירוע בנפרד, ולאחר מכן רשאי הוא לגזור עונש נפרד לכל אירוע או עונש כולל לכל האירועים; גזר בית המשפט עונש נפרד לכל אירוע, יקבע את מידת החפיפה בין העונשים או הצטברותם.",שלב ראשון- ריבוי עבירות או עבירה אחת:
"ת""פ 40922-11-15","(ג) בגזירת העונש לפי סעיף זה, יתחשב בית המשפט, בין השאר, במספר העבירות, בתדירותן ובזיקה ביניהן, וישמור על יחס הולם בין חומרת מכלול המעשים ומידת אשמו של הנאשם לבין סוג העונש, ואם גזר עונש מאסר – לבין תקופת המאסר שעל הנאשם לשאת.",שלב ראשון- ריבוי עבירות או עבירה אחת:
"ת""פ 40922-11-15","כאמור, וכפי העולה מעובדות המקרה, ניתן לומר, כי המדובר הוא בשלושה אירועים נפרדים בעלי אותו רקע. באשר לנאשמים 1 ו 3  יש לתור אחר המתחם ההולם את מעשיהם ולבחון אם העונש המוסכם נופל הוא אל תוך המתחם ואם הוא חורג באופן ניכר מהעונש הראוי שהיה מוטל אילולא הסדר הטיעון.",שלב ראשון- ריבוי עבירות או עבירה אחת:
"ת""פ 40922-11-15","ביחס לנאשמים 2 ו 4, יש לקבוע את המתחם הרלוונטי בנוגע למעשה שבוצע על ידם,  לבחון אם הסכמת הצדדים באשר לטווח הענישה דרה היא תחת קורת הגג של מתחם ההלימה בשים לב לחלקם היחסי, וכן יש לקבוע, בסופו של יום,  את הענש הראוי לכל אחד משניהם.",שלב ראשון- ריבוי עבירות או עבירה אחת:
"ת""פ 40922-11-15","בעת קביעת מתחם העונש ההולם (סעיף 40ג לחוק העונשין), יש לבדוק את הערך החברתי שנפגע כתוצאה מהעבירה ומידת הפגיעה בו, את מדיניות הענישה הנהוגה ואת הנסיבות הקשורות בביצוע העבירה.",שלב שני- קביעת מתחם העונש ההולם:
"ת""פ 40922-11-15","אין צורך להכביר במילים בדבר חומרת העבירות בהם הורשעו הנאשמים, אך ראוי להדגיש, כי עבירות הנשק בכלל טומנות בחובן פוטנציאל למסוכנות מוחשית וממשית לשלום הציבור ולביטחונו. בית המשפט עמד לא אחת על הצורך להחמיר את רמת הענישה בעבירות נשק. שהמציאות השוררת בארצנו בימים אלה מחייבת מתן ביטוי עונשי הולם והחמרה ברמת הענישה; ע""פ 1332/04 מ""י נ' פס, פ""ד נח 5 541, 545 (2004).",בחינת הערך החברתי שנפגע ומידת הפגיעה בו:
"ת""פ 40922-11-15","בע""פ 7502/12 כוויס נ' מדינת ישראל (טרם פורסם, ניתן ביום 25/06/13) נקבע כי : ",בחינת הערך החברתי שנפגע ומידת הפגיעה בו:
"ת""פ 40922-11-15","באשר לעבירת הסחר נקבע, בע""פ 2251/11 נפאע נ' מדינת ישראל (טרם פורסם, ניתן ביום04/12/11), כי: ",בחינת הערך החברתי שנפגע ומידת הפגיעה בו:
"ת""פ 40922-11-15","""סחר בלתי חוקי בנשק סולל את הדרך לפעילות אלימה ובלתי חוקית והדבר חמור שבעתיים במציאות הישראלית בה קיים חשש תמידי כי נשק המוחזק באופן בלתי חוקי יתגלגל לא רק לידיים עברייניות, עניין חמור לעצמו, כי אם לידיהם של אלה המבקשים להוציא אל הפועל פעילות חבלנית עוינת (ראו: ע""פ 11448/03 מדינת ישראל נ' גרבאן ([פורסם בנבו], 29.3.2004); ע""פ 5220/09 עוואודה נ' מדינת ישראל, פסקה י' ([פורסם בנבו], 30.12.2009)). על כן, כל מי שהופך עצמו לחוליה במנגנון זה של סחר בלתי חוקי בנשק, מוחזק כמי שמבין ויודע אל נכון מה עלולות להיות התוצאות הנובעות ממעשיו ומהן הסכנות הנשקפות ממעשים אלה לחברה כולה (ראו ע""פ 4831/03 אבו בכר נ' מדינת ישראל, פסקה 4 ([פורסם בנבו], 23.5.2004))"". ",בחינת הערך החברתי שנפגע ומידת הפגיעה בו:
"ת""פ 40922-11-15","עבירות הנשק הן רעה חולה הפוגעת בבטחון המדינה, שלום ובטחון הציבור והסדר הציבורי.",בחינת הערך החברתי שנפגע ומידת הפגיעה בו:
"ת""פ 40922-11-15","ראה גם, דברים שצוינו במסגרת ע""פ 2422/14 עלי ח'דר נ' מדינת ישראל (21.12.14) על הפסיקה המאוזכרת שם:",בחינת הערך החברתי שנפגע ומידת הפגיעה בו:
"ת""פ 40922-11-15","""המעשה בו הורשע המערער הוא חמור, ובית משפט זה עמד לא אחת על חומרתן המיוחדת של עבירות בנשק ועל הסכנות הצפויות מעבירות כאלה, אשר גורמות לפעילות עבריינית אחרת ומאיימות על שלום הציבור כולו (ע""פ 5833/07 ח'ורי נ' מדינת ישראל [פורסם בנבו] (18.11.2007); ע""פ 4450/11 עספור נ' מדינת ישראל [פורסם בנבו] (8.2.2012)). על כן, בית משפט זה אימץ עמדה עקרונית לפיה יש להחמיר, ככלל, בענישתם של נאשמים שהורשעו בעבירות נשק בכלל ובעבירות סחר בנשק בפרט (ע""פ 6210/10 מדינת ישראל נ' אגבריה [פורסם בנבו] (23.3.2011); ע""פ 319/11 מדינת ישראל נ' יאסין [פורסם בנבו] (4.12.2011)). במספר הזדמנויות בתי המשפט מצאו כי יש להחמיר בעונשיהם של עברייני נשק בשל הסכנה הנשקפת מהם (ע""פ 4526/04 זעתרי נ' מדינת ישראל [פורסם בנבו] (8.11.2004); ע""פ 5380/06 סלאמה נ' מדינת ישראל [פורסם בנבו] (3.12.2007)). לעניין זה ראוי לציין כי אין נפקא מינה לכך שהקונה הינו סוכן משטרתי, שכן המעורבים אינם מודעים לכך ומסוכנותם נותרת בעינה.""",בחינת הערך החברתי שנפגע ומידת הפגיעה בו:
"ת""פ 40922-11-15","במסגרת ע""פ 4450/11 חאלד עספור נ' מדינת ישראל (ניתן ביום 08.02.12); שם המערערים הורשעו בעבירות המפורטות בכתב האישום המתוקן, לאחר שהודו בעובדותיו: המערער חאלד הורשע בשלוש עבירות של קשירת קשר לפשע, שתי עבירות של סיוע לסחר בנשק, עבירה אחת של סחר בנשק ועבירה אחת של קבלת נכסים שהושגו בעוון והושת עליו עונש של 50 חודשי מאסר בפועל ו-18 חודשי מאסר על תנאי. מערער אחר הורשע בשלוש עבירות של קשירת קשר לפשע, ארבע עבירות של סחר בנשק, עבירה אחת של סיוע לסחר בנשק, שתי עבירות של קבלת נכסים שהושגו בעוון וכן שלוש עבירות של נשיאה והובלת נשק שלא כדין והושת עליו עונש מאסר בפועל בן 90 חודשים ו-18 חודשי מאסר על תנאי. המערער אחמד הורשע בעבירה אחת של קשירת קשר לפשע ועבירה אחת של סחר בנשק; על רקע זה, הושת עליו עונש מאסר בפועל בן 30 חודשים ו-18 חודשי מאסר על תנאי. ",בחינת הערך החברתי שנפגע ומידת הפגיעה בו:
"ת""פ 40922-11-15","ביהמ""ש העליון קיבל את ערעורו של בדיע ודחה את ערעוריהם של חאלד ואחמד. עונשו של בדיע הופחת במקצת ואילו עונשם של יתר המערערים נותר על כנו תוך שבית המשפט, חוזר ומדגיש את חומרת העבירות וכך נקבע שם, בין היתר:",בחינת הערך החברתי שנפגע ומידת הפגיעה בו:
"ת""פ 40922-11-15","""בית משפט זה עמד לא אחת על חומרתן של עבירות הנשק השונות, הסכנות הנשקפות מהן ותוצאותיהן הקשות (ראו למשל, ע""פ 5833/07 ח'ורי נ' מדינת ישראל ([פורסם בנבו], 18.11.2007)). לאחרונה ניכרת מגמת החמרה בעונשי המאסר הנגזרים על נאשמים בעבירות אלו, נוכח היקפן המתרחב והצורך בבלימתן.......... בע""פ 2251/11 נפאע נ' מדינת ישראל ([פורסם בנבו], 4.12.2011) (להלן - עניין נפאע) נקבע כי הגיעה העת להחמיר בעונשיהם של נאשמים המורשעים בעבירות נשק בכלל ובעבירות סחר בנשק בפרט....""",בחינת הערך החברתי שנפגע ומידת הפגיעה בו:
"ת""פ 40922-11-15","בחינת מדיניות הענישה הנוהגת מעלה, כי במקרים דומים הוטלו על נאשמים עונשי מאסר בפועל לתקופות משתנות. שני הצדדים צירפו פסיקה מטעמם, כפי שתפורט להלן:",מדיניות הענישה
"ת""פ 40922-11-15",המאשימה אזכרה מטעמה את הפסיקה הבאה:,מדיניות הענישה
"ת""פ 40922-11-15","ע""פ  2251/11 ו- 2368/11  נפאע נ' מדינת ישראל (טרם פורסם, ניתן ביום 4.12.2011); שם, הנאשם הורשע על פי הודאתו, במסגרת הסדר טיעון, בעבירות של נשיאת והובלת נשק שלא כדין וסחר בנשק שלא כדין. הנאשם מכר נשק לסוכן בשתי הזדמנויות שונות. בית המשפט המחוזי  גזר עליו 38 חודשי מאסר בפועל, 10 חודשי מאסר על תנאי, וקנס בסך 22,500 ₪. עוד קבע בית המשפט, כי מדובר בסחר בנשק באופן שיטתי, וכי מי שעוסק בתיווך בנשק גרידא משמש חוליה בלעדיה אין בשרשרת המעשים המסוכנים המבוצעים לאחר מכן באותו הנשק. המדינה ערערה על קולת העונש והנאשם על חומרתו. בית המשפט העליון קיבל את ערעור המדינה וגזר על הנאשם 46 חודשי מאסר בפועל. המדובר בנאשם שהיה מעורב ביותר מעסקה אחת ובאופן המעיד לכאורה על דפוס התנהלות שיטתי של מעורבות בעבירות נשק. בנוסף נלקח בחשבון עברו הפלילי המכביד והתסקיר השלילי שהוגש בעניינו. ",מדיניות הענישה
"ת""פ 40922-11-15","ע""פ 6771/12  עומר קאסם נ' מדינת ישראל (טרם פורסם, ניתן ביום 28.10.2013)- הנאשם הורשע על פי הודאתו, במסגרת הסדר טיעון, בעבירות של החזקת נשק, נשיאת והובלת נשק וסחר בנשק. הנאשם קשר קשר עם אחר על מנת למכור נשק לסוכן סמוי בשתי הזדמנויות שונות. בית המשפט המחוזי גזר עליו 45 חודשי מאסר בפועל, 12 חודשי מאסר על תנאי וקנס בסך 50 א ש""ח. הנאשם ערער על חומרת הקנס שהושת עליו, המדינה הסכימה להקל ברכיב הקנס, ובהתחשב בנסיבותיו האישיות בית המשפט העליון קיבל את הערעור וסכום הקנס הופחת ל- 30 אלף ש""ח.",מדיניות הענישה
"ת""פ 40922-11-15","ע""פ 2606/13 מוחמד חוסני נ' מדינת ישראל (טרם פורסם, ניתן ביום 02/02/14); הנאשם הורשע בשלושה אישומים שונים בביצוע עבירות של החזקת נשק, שתי עבירות של סחר בנשק ועבירה של סיוע לסחר בנשק. בית המשפט המחוזי גזר עליו 45 חודשי מאסר לריצוי בפועל, מאסר מותנה וקנס בגובה 30,000 ₪. בית המשפט דחה את ערעור הנאשם על חומרת העונש בקבעו, כי אין מדובר במעידה חד פעמית וכי העונש אינו חורג מרף הענישה המצדיק התערבותו. המדובר בנאשם נעדר עבר פלילי (מלבד עבירה אחת שביצע בעת היותו נער).",מדיניות הענישה
