verdict,text,part
"ת""פ 69261-01-23","(11)	ת""פ (מחוזי ירושלים) 2108-08-21 מדינת ישראל נ' אבו לבן (12.6.2023)  – הרשעה על-פי הודאתו בשבעה פרטי אישום בארבע עבירות התפרעות, שלוש עבירות הפרה לשוטר במילוי תפקידו בנסיבות מחמירות, ארבע עבירות של מעשה פזיזות ורשלנות, שני ניסיונות תקיפת שוטר בנסיבות מחמירות, שני ניסיונות הצתה בצוותא, נשיאת נשק בצוותא, שתי פעולות בנשק למטרת טרור, שני מעשיי טרור של ניסיון הצתה, היזק בזדון וניסיון היזק בזדון. דובר בהפרות סדר במהלך חודש הרמדאן. נקבע מתחם עונש בין 4.5 ל-8 שנות מאסר. הושתו 5 שנות מאסר בפועל ועונשי מאסר מותנים.",	- מדיניות הענישה הנוהגת
"ת""פ 69261-01-23","(12)	ת""פ (מחוזי ירושלים) 49353-07-21 מדינת ישראל נ' ג'ית (17.11.2022) – הרשעה על-פי הודאה בארבעה פרטי אישום בארבע עבירות התפרעות, שני מעשיי פזיזות ורשלנות, ניסיון חבלה חמורה בנסיבות מחמירות, שתי עבירות הפרעה לשוטר בנסיבות מחמירות וניסיון תקיפת שוטר. דובר באירועי הפרות סדר במהלך מבצע ""שומר חומות"", שאחד מהם היה במתחם הר הבית. נקבע מתחם עונש בין 32 ל-48 חודשי מאסר. על הנאשם, כבן 19.5 במועד העבירות, הושתו 32 חודשי מאסר בפועל ועונשי מאסר מותנה. ",	- מדיניות הענישה הנוהגת
"ת""פ 69261-01-23","(13)	ת""פ (מחוזי ירושלים) 22921-11-22 מדינת ישראל נ' עסילה (14.3.2024) – הרשעה על-פי הודאה בריבוי עבירות, שנעברו במסגרת שישה פרטי אישום. נקבע מתחם עונש בין 48 ל-72 חודשי מאסר. הושתו 50 חודשי מאסר בפועל, מאסר מותנה וקנס בסך 4,000 ₪. הנאשם הגיש ערעור שטרם נדון (ע""פ 3593/24). ",.
"ת""פ 69261-01-23","(14)	ת""פ (מחוזי ירושלים) 21536-12-21 מדינת ישראל נ' דרבאס (10.3.2024) – הרשעה על-פי הודאה בריבוי עבירות במסגרת שלושה פרטי אישום, לרבות עבירות לפי חוק המאבק בטרור. נקבע מתחם עונש בין 36 ל-60 חודשי מאסר. הושתו 48 חודשי מאסר, הופעלו 6 חודשי מאסר מותנה, 4 מתוכם במצטבר וכן מאסר מותנה. בעקבות ערעור המדינה, עונש המאסר הוחמר ל-56 חודשי מאסר בפועל ובסך הכול, בצירוף המאסר המותנה שהופעל, 60 חודשי מאסר (ע""פ 3620/24 מדינת ישראל נ' דרבאס (30.5.2024)).",.
"ת""פ 69261-01-23","פסקי הדין שהגישה באת-כוח הנאשם 2: ע""פ 7482/20 פלוני נ' מדינת ישראל (15.7.2021). המערער, קטין, הורשע לאחר ניהול הוכחות בעבירת חברות בארגון טרור וכן הורשע במסגרת חמישה פרטי אישום בעבירות קשירת קשר לפשע ממניע גזעני, הצתה, שתי עבירות השחתת פני מקרקעין ממניע גזעני, חבלה במזיד לרכב ממניע גזעני והיזק בזדון ממניע גזעני. העבירות נעברו על רקע לאומני ובין-דתי שנועדו לגרום ל""תבערה ביטחונית"" ואשר כוונו כלפי פלסטינים. הושתו 42 חודשי מאסר בפועל, עונשי מאסר מותנים ופיצויים לנפגעים. הערעור על הכרעת הדין ועל גזר הדין נדחה.",.
"ת""פ 69261-01-23","נסיבות מעשיי העבירות שנשקלו הן אלו: ראשית, הנאשם 1 היה מעורב בשישה אירועים והנאשם 2 בחמישה אירועים, אשר אירעו במהלך כחצי שנה, בין חודש יולי לחודש דצמבר 2022, כך שלא דובר באירוע חד פעמי, אלא בהתנהלות ממושכת שחזרה על עצמה; שנית, בין העבירות שבהן הורשעו הנאשמים נמנות גם עבירות חמורות ובהן חבלה חמורה בנסיבות מחמירות, עבירות לפי חוק המאבק בטרור ובכלל זה, עבירת גילוי הזדהות עם ארגון טרור; שלישית, לכל המעשים קדמו תכנון והכנה, גם אם לא היה זה תכנון מורכב וממושך. בניגוד לטענת באי-כוח הנאשמים, לא דובר באירועים ספונטניים, אלא לרובם קדמה הצטיידות בחפצים שנדרשו לצורך העבירות; רביעית, שני הנאשמים היו פעילים באירועים, כך שלא ניתן לומר כי דובר במי שנגררו או שחלקם לא היה משמעותי; חמישית, העבירות נעברו בצוותא; שישית, גם אם לא נגרמו נזקים קשים, ברוב האירועים פוטנציאל הנזק היה חמור וכן נשקל הנזק למכולות האשפה, שהן רכוש ציבורי; שביעית, הנאשמים יכולים היו להבין את משמעות מעשיהם ואת הפסול שבהם ואף יכולים היו להימנע מעשייתם.",- נסיבות מעשיי העבירות
"ת""פ 69261-01-23","לצד האמור ניתן משקל גם לנסיבות שעליהן הצביעו באי-כוח הנאשמים ובהן העובדה שלא דובר בעבירות שנעברו כחלק מפעילות מאורגנת וכן ניתן נשקלה העובדה שיידוי האבנים ובקבוקי התבערה נעשו ממרחק רב, המצמצם את הסיכון לפגיעה ולנזק.",- נסיבות מעשיי העבירות
"ת""פ 69261-01-23","בהתחשב בכל השיקולים שעליהם עמדנו ובהם, הערכים החברתיים שנפגעו ממעשיי העבירות, מידת הפגיעה בהם, מדיניות הענישה הנהוגה ונסיבות העבירות, מתחם עונש ההולם הוא בין ארבעים ושמונה לשישים חודשי מאסר.",	- קביעת מתחם העונש ההולם - סיכום
"ת""פ 69261-01-23","נסיבותיהם של הנאשמים שאינן קשורות במעשיי העבירות: ראשית, נשקל גילם הצעיר של שני הנאשמים, שבמועד העבירות היו כבני 18. עם זאת, לא רק שאין מדובר בקטינים, אלא כידוע, קטינות אינה מעניקה חסינות מפני ענישה (ע""פ 6435/16 פלוני נ' מדינת ישראל (13.9.2016)‏‏, כבוד השופט א' שהם, פסקה 11). כך בייחוד לגבי עבירות מהסוג הנדון שעל-פי רוב עובריהן הם קטינים ואף הודגש לגבי עבירות אלו כי גילם הצעיר של נאשמים אינו מצדיק הקלה בענישה (ע""פ 196/16 פלוני נ' מדינת ישראל (10.5.2016), כבוד השופט ס' ג'ובראן, פסקה 11; ע""פ 3520/16 פלוני נ' מדינת ישראל (29.8.2016), כבוד השופט א' שהם, פסקה 27; ע""פ 207/16 פלוני נ' מדינת ישראל (15.10.2017), כבוד השופט ס' ג'ובראן, פסקה 15; ע""פ 240/16 מדינת ישראל נ' פלוני (11.1.2017)‏‏, כבוד השופט נ' הנדל, פסקה 5); שנית, הנאשם 1 נעדר הרשעות קודמות ואילו לנאשם 2 הרשעה קודמת לרבות מאסר מותנה חב הפעלה. עם זאת, מאחר ששניהם מעורבים באירועים רבים, להיעדר הרשעות קודמות או להרשעה אחת ניתן משקל מופחת; שלישית, נשקל אורח חייהם הנורמטיבי לרבות לימודיהם עד מעצרם, כך שנראה כי עונש מאסר ממושך עשוי להשליך לרעה על עתידם ולהקשות על חזרתם אל מעגל החיים הנורמטיבי; רביעית, נזקפה לזכות הנאשמים הודאתם במעשיי העבירות.",גזירת עונשם של הנאשמים
"ת""פ 69261-01-23","לאחר שקילת כלל השיקולים, לרבות שיקולי הרתעה אישית והרתעת הרבים ולאחר בחינת טענותיהם של באי-כוח הצדדים, נמצא כי יש להעמיד את עונשם של הנאשמים בחלקו התחתון של מתחם הענישה, גם אם לא בתחתיתו ממש וזאת לנוכח ריבוי העבירות. אמנם הנאשם 1 הורשע בשל מעורבותו בשישה אירועים ואילו הנאשם 2 היה מעורב בחמישה, אך כטענת בא-כוח המאשימה, הבדל זה מתאזן בכך שלחובת הנאשם 2 הרשעה קודמת ומאסר מותנה חב הפעלה. כמו כן נמצא להשית על הנאשמים מאסר מותנה, אשר ישמש גורם מרתיע מפני חזרה על עבירות מהסוג הנדון וכן קנס.",- גזירת העונש המתאים לנאשמים
"ת""פ 69261-01-23","גזר הדין שבמסגרתו ניתן המאסר המותנה שהוטל על הנאשם 2 ניתן ימים בודדים קודם לאירועי האישום הראשון. בנסיבות אלו ומשנמצא כי לא היה בו כדי להרתיעו, הוא יופעל במצטבר.",- גזירת העונש המתאים לנאשמים
"ת""פ 69261-01-23","עונשו של הנאשם 1, עסאם עטון, יהיה כלהלן:",גזר הדין – סיכום
"ת""פ 69261-01-23","חמישים חודשי מאסר בפועל, החל מיום מעצרו ביום 26.12.2022 (במקרה של סתירה לרישומי שב""ס, יש לפעול על-פי רישומיו).",גזר הדין – סיכום
"ת""פ 69261-01-23","שישה חודשי מאסר מותנה. הנאשם יישא עונש זה אם תוך שלוש שנים מיום שחרורו מן המאסר יעבור עבירת אלימות או עבירת רכוש מסוג פשע, או ניסיון לעבור עבירה כאמור.",גזר הדין – סיכום
"ת""פ 69261-01-23","מאסר מותנה למשך שלושה חודשים. הנאשם יישא עונש זה אם תוך שלוש שנים מיום שחרורו מן המאסר יעבור עבירת אלימות או עבירת רכוש מסוג עוון, או ניסיון לעבור עבירה כאמור.",גזר הדין – סיכום
"ת""פ 69261-01-23","קנס כספי בסך 4,000 ₪ או עשרים ימי מאסר תמורתו. הנאשם רשאי לשלם את הקנס בעשרה תשלומים שווים, עוקבים ורצופים, החל מיום 1.9.2024.",גזר הדין – סיכום
"ת""פ 69261-01-23","עונשו של הנאשם 2, מחמד עטון, יהיה כלהלן:",גזר הדין – סיכום
"ת""פ 69261-01-23",חמישים חודשי מאסר בפועל.,גזר הדין – סיכום
"ת""פ 69261-01-23","	הפעלת ארבעה חודשי המאסר המותנה, על-פי גזר הדין מיום 4.7.2022 בת""פ (שלום נוער ירושלים) 46920-05-21, כך שיצטברו לעונש המאסר.",גזר הדין – סיכום
"ת""פ 69261-01-23","סך הכול יישא הנאשם בחמישים וארבעה חודשי מאסר בפועל, החל מיום מעצרו ביום 26.12.2022 (במקרה של סתירה לרישומי שב""ס, יש לפעול על-פי רישומיו).",גזר הדין – סיכום
"ת""פ 69261-01-23","שישה חודשי מאסר מותנה. הנאשם יישא עונש זה אם תוך שלוש שנים מיום שחרורו מן המאסר יעבור עבירת אלימות או עבירת רכוש מסוג פשע, או ניסיון לעבור עבירה כאמור.",גזר הדין – סיכום
"ת""פ 69261-01-23","מאסר מותנה למשך שלושה חודשים. הנאשם יישא עונש זה אם תוך שלוש שנים מיום שחרורו מן המאסר יעבור עבירת אלימות או עבירת רכוש מסוג עוון, או ניסיון לעבור עבירה כאמור.",גזר הדין – סיכום
"ת""פ 69261-01-23","קנס כספי בסך 4,000 ₪ או עשרים ימי מאסר תמורתו. הנאשם רשאי לשלם את הקנס בעשרה תשלומים שווים, עוקבים ורצופים, החל מיום 1.9.2024.",גזר הדין – סיכום
"ת""פ 69261-01-23","54678313ניתן היום, כ""ב בתמוז התשפ""ד, 28 ביולי 2024, במעמד הנאשמים ובאי-כוח הצדדים כמפורט בפרוטוקול הדיון מהיום.",5129371
"ת""פ 69261-01-23","בעניין עריכה ושינויים במסמכי פסיקה, חקיקה ועוד באתר נבו – הקש כאן","תמר בר-אשר, שופטת"
"ת""פ 69261-01-23",תמר בר אשר 54678313-/,"תמר בר-אשר, שופטת"
