verdict,text,part
"ת""פ 3090-07",                         . מ.י. לשכת תביעות ירושלים (פלילי),המאשימה
"ת""פ 3090-07",                         .גוואד מוסלמאן (עציר),הנאשמים
"ת""פ 3090-07","על יסוד הודאת הנאשם, אני מרשיע אותו בביצוע עבירה של נהיגה פוחזת [סע' 338 1) לחוק העונשין] ועבירה של הפרעת שוטר (סעיף 275 לחוק העונשין).",הכרעת דין
"ת""פ 3090-07","ניתנה והודעה היום כ""ו סיון תש""ע, 08/06/2010 במעמד הנוכחים. ",<#4#>
"ת""פ 3090-07","נוכח עונש המאסר של שלוש שנים שהנאשם מרצה כעת בגין עבירות הכוללות  סיכון אדם בנתיב תחבורה, בהתחשב בכך שהעבירות הנדונות בוצעו, כמו העבירות שנדונו בתיק הקודם, בשנת 2005, אני מאמץ את הסדר הטיעון וגוזר על הנאשם 6 חודשי מאסר כאשר בתוכם 3 חודשים יהיו במצטבר לעונש המאסר שהוא מרצה כעת בע""פ (עליון) 10149/08  ו 3 חודשים יהיו בחופף. כמו""כ אני גזור על הנאשם  מאסר על תנאי של 6 חודשים למקרה שיבצע עבירה של נהיגה פוחזת או נהיגה המסכנת אדם בתוך 3 שנים.",גזר -דין
"ת""פ 3090-07",זכות הערעור לבית המשפט המחוזי בירושלים בתוך 45 יום. .,גזר -דין
"ת""פ 3090-07","ניתנה והודעה היום כ""ו סיון תש""ע, 08/06/2010 במעמד הנוכחים.   ",#6#>
"ת""פ 3090-07",נוסח מסמך זה כפוף לשינויי ניסוח ועריכה,"שמעון פיינברג , סגן נשיאה"
"ת""פ 3090-07","הודעה למנויים על עריכה ושינויים במסמכי פסיקה, חקיקה ועוד באתר נבו - הקש כאן","שמעון פיינברג , סגן נשיאה"
