verdict,text,part
"ת""פ 69261-01-23","בא-כוח המאשימה טען כי מעשי הנאשמים פגעו בערכים המוגנים שעניינם הגנה על שלום הציבור וביטחונו ושמירה על הסדר הציבורי וכי דובר בפגיעה לא מבוטלת בערכים אלו. בעניין מדיניות הענישה הנהוגה הפנה אל מספר פסקי דין, אשר יפורטו בהמשך הדברים, תוך הדגשה כי מתחמי הענישה שהתבקשו גבוהים מאלו שנקבעו בפסיקה. בשל ריבוי האירועים, נטען כי יש להחמיר בענישה מעבר לזו הנהוגה. כך בייחוד מאחר שמדיניות הענישה היא רק אחד השיקולים.",טענות הצדדים בעניין העונש ודברי הנאשמים
"ת""פ 69261-01-23","בעניין נסיבותיהם של הנאשמים נטען כי הם צעירים, הודו והכירו באחריותם למעשים. עם זאת, מהתסקירים עולה כי חרף תקופת מעצרם הממושכת, אין מצדם הפנמה מלאה של חומרת העבירות. עוד נטען, כי בקביעת העונש יש חשיבות לשיקולי הרתעת היחיד והרבים בייחוד בשל ריבוי האירועים והמניע האידיאולוגי. בעניין הנאשם 2 הודגשה הרשעתו הקודמת והמאסר המותנה שלא הרתיע אותו.",טענות הצדדים בעניין העונש ודברי הנאשמים
"ת""פ 69261-01-23","המאשימה ביקשה להשית על כל אחד מהנאשמים 7 שנות מאסר בפועל, לצד מאסר מותנה וקנס ובעניין הנאשם 2 התבקשה הפעלת המאסר המותנה במצטבר. אמנם הנאשם 1 הורשע גם באישום השני שהנאשם 2 לא היה מעורב בו, אך לחובתו הרשעה קודמת ומאסר מותנה.",טענות הצדדים בעניין העונש ודברי הנאשמים
"ת""פ 69261-01-23","טענותיו של בא-כוח הנאשם 1: אין מחלוקת לגבי הערכים המוגנים שנפגעו. בניגוד לטענת המאשימה, מתקיים קשר הדוק בין כל האירועים, המתבטא בזהות המעורבים, זהות המסכת העובדתית, סמיכות הזמנים וזהות מקום העבירות. מאחר שמדובר בפרשה אחת, נטען כי יש לקבוע מתחם ענישה אחד. כמו כן טען, כי אין מקום לקביעת מתחם ענישה חמור מזה שנקבע בפסיקה.",טענות הצדדים בעניין העונש ודברי הנאשמים
"ת""פ 69261-01-23","בעניין חלקו של הנאשם 1 ובעניין נסיבות העבירה, נטען כי הוא לא היה הגורם הדומיננטי או המוביל של האירועים. אף לא דובר בפעילות של חוליה מאורגנת שפעלה במסגרת ארגונית, אלא באנשים שמכירים אחד את השני על רקע שכנות וקרבת משפחה, כפי שאף נאמר בכתב האישום.",טענות הצדדים בעניין העונש ודברי הנאשמים
"ת""פ 69261-01-23","בעניין נסיבותיהם של כל אחד מפרטי האישום, הדגיש בא-כוח הנאשם את העובדות הבאות: האישום הראשון – בהיעדר ידיעה בדבר המועד המדויק, יש להניח לטובת הנאשם 1 כי במועד העבירות עדיין היה קטין. אפילו ישנו ספק, עליו לפעול לטובתו. אכן דובר בביצוע בצוותא, אך חלקו יחסית קטן, ואף שהוצתה מכולה, לא נטע כי נגרם נזק וכך גם בכל שאר האירועים; האישום השני – לא דובר באירוע מתוכנן אלא היה זה אירוע ספונטני, מאחר שהנאשמים והאחרים הצטרפו אל אירועי התפרעות שכבר התרחשו. הנאשם 1 לא הצטייד בדבר, לא היה רעול פנים ובכל מקרה, דובר בעבירת ניסיון וביידוי אבן ממרחק לא קצר; האישום השלישי – הנאשם 1 לא היה גורם מוביל או דומיננטי, דובר ביידוי אבנים בצוותא ואף צוין שבקבוק התבערה פגע במכון לשטיפת מכוניות ולא במבנה המש""מ. מיקום הפגיעה ושעת האירוע, 20:00, תומכים בכך שלא הייתה כוונה לפגוע במש""מ או באנשים ומכל מקום, חרף פוטנציאל הנזק, בפועל לא נגרם נזק; האישום החמישי – הנאשם 1 הואשם שיידה אבנים, אך הוא לא הואשם בעבירת ההצתה; האישום השישי – מדובר בעבירת ניסיון ואף לא ניתן לקבוע באופן חד-משמעי שדובר בנשק. גם נשיאתו הייתה למרחק קצר בלבד ובכל מקרה, המטענים התפוצצו תוך השמעת קול חזק. לא נגרם נזק ואף לא הייתה כוונה לפגוע באיש; האישום השביעי – הנאשם 1 רק הביא דגלים ושימש תצפיתן.",טענות הצדדים בעניין העונש ודברי הנאשמים
"ת""פ 69261-01-23","בעניין מדיניות הענישה הנהוגה, הפנה בא-כוח הנאשם 1 אל פסקי-דין רבים שאליהם נידרש בהמשך הדברים. בין השאר הדגיש, כי כתבי אישום בשל עבירת הזדהות עם ארגון טרור בדרך כלל מוגשים אל בית משפט השלום, כפי שעולה מהפסיקה שאליה הפנה וכך גם בנסיבות חמורות. כך למשל, אם הונפו דגלי חמאס במסגד אל אקצא. מהפסיקה אף עולה כי הענישה בנסיבות דומות ואף בנסיבות של ריבוי עבירות או במי שהוא בעל עבר פלילי, נמוכה באופן משמעותי מהענישה שהתבקשה.",טענות הצדדים בעניין העונש ודברי הנאשמים
"ת""פ 69261-01-23","בעניין נסיבותיו של הנאשם 1 נטען כי הוא כבן 19, היה קטין במועד האירוע הראשון ובשאר האירועים היה בגיר צעיר. הוא נעדר הרשעות קודמות וכל עונש מאסר ממושך יפגע בו ובמשפחתו. הוא הודה, הכיר באחריותו וחסך זמן שיפוטי. בעניין התסקיר נטען, כי ההתרשמות השלילית של שירות המבחן כלל לא נומקה, כי התסקיר נערך על סמך מפגש באמצעות היוועדות חזותית שאינו מאפשר התרשמות ממשית ולכן אף לא ניתן לטעון, כטענת המאשימה, כי הנאשם לא הפנים את חומרת העבירות. אף לא ברור על יסוד מה נקבעה הערכת רמת הסיכון הגבוהה.",טענות הצדדים בעניין העונש ודברי הנאשמים
"ת""פ 69261-01-23","עוד נטען, כי יש לשקול את תקופת המעצר הארוכה והממושכת בתנאים קשים. נטען כי לנאשמים לא היו ביקורי משפחות וכי מאז 7.10.2023 הוחמרו תנאי המעצר, גם בכל הנוגע לתזונה. לפיכך נטען כי דווקא השהייה הממושכת במעצר מאיינת את מסוכנות הנאשם 1 ואת הסיכון להישנות עבירות.",טענות הצדדים בעניין העונש ודברי הנאשמים
"ת""פ 69261-01-23","בא-כוח הנאשם 1 עתר לקבוע מתחם ענישה בין 36 ל-60 חודשי מאסר, כפי שנקבע במקרים דומים ולמקם את עונשו של הנאשם 1 בתחתית מתחם העונש.",טענות הצדדים בעניין העונש ודברי הנאשמים
"ת""פ 69261-01-23","טענותיה של באת-כוח הנאשם 2: באת-כוח הנאשם 2 הצטרפה אל טענותיו של בא-כוח הנאשם 1. בעניין מדיניות הענישה הפנתה אל ע""פ 7482/20 פלוני נ' מדינת ישראל (15.7.2021), וכן הגישה (בכתב, לאחר הדיון) את הערותיה לפסקי הדין שאליהם הפנתה המאשימה. לטענתה, יש להקיש דווקא מפסק הדין האמור, אשר מגלם את ההבדלים בין ענישת יהודים לענישת ערבים.",טענות הצדדים בעניין העונש ודברי הנאשמים
"ת""פ 69261-01-23","בטיעוניה הדגישה את העובדה שהנאשמים לא היו חברים בארגון טרור וכי המניע למעשיהם היה המצב בכפר מגוריהם. זאת בשונה מהנאשמים בפסק הדין האמור, אשר פעלו כחלק מהתארגנות שביקשה להגביר את המתח הביטחוני תוך פגיעה בערבים חפים מפשע, ברכושם ובקודשי דת מוסלמיים ונוצריים. כל האירועים שבהם היו הנאשמים באותו הליך, שפעלו ממניע גזעני ופגעו בבתים וברכוש, היו חמורים באופן משמעותי מהאירועים הנדונים. לפיכך לטענתה, על עונשם להיות קל באופן משמעותי.",טענות הצדדים בעניין העונש ודברי הנאשמים
"ת""פ 69261-01-23","עוד נטען כי המש""מ פועל כשורה מאז שנת 2017 וכי האירועים הנדונים התרחשו לאחר חודש יולי 2022, כך שלא ניתן לומר שהייתה כוונה למנוע את פעילותו. אם היו אירועים שנועדו לשבש את פעילותו, הם אינם קשורים אל הנאשמים הנדונים. בעניין פרטי האישום כלהלן: האישום הראשון – דובר בהיגררות להתפרעות שהחלה קודם למעורבות הנאשמים וכי חלקו של הנאשם 2 היה יידוי מספר אבנים אל עבר כוח המשטרה, אך ממרחק 30 מטר; האישום השלישי – האירוע שהתרחש זמן רב לאחר האירוע הראשון, לא הייתה כל יוזמה מצד הנאשם 2, מישהו חילק בקבוקי תבערה ולא היה ירי זיקוקים. אף לא ידוע איזה בקבוק פגע סמוך למש""מ; האישום החמישי – מעשיו של עודאי תמימי אינם קשורים אל הנאשמים, אכן הייתה תגובה משמעותית למותו ואילו הנאשם 2 השתתף רק בחלק קטן מאוד מאותה תגובה. דובר בהצתת מכולת אשפה וביידוי אבן ממרחק כ-30 מטר, אך  בפועל לא נגרם נזק; האישום השישי – כפי שטען בא-כוח הנאשם 1, דובר בהשמדת אותם מטעני צינורות ושמיעת הרעש; האישום השביעי – לא נטען באופן נפרד.",טענות הצדדים בעניין העונש ודברי הנאשמים
"ת""פ 69261-01-23","אף באת-כוח הנאשם 2 טענה כי תסקירי שירות המבחן מעוררים קושי, מאחר שקצינת המבחן אינה דוברת ערבית, אינה מכירה את הרקע התרבותי והראיונות נערכו בהיוועדות חזותית. עוד נטען, כי הנאשם 2 הוא בן למשפחה טובה המונה תשעה ילדים, הוריו מסורים ומגדלים את ילדיהם בצורה מושלמת, האב עובד ובתקופת העבירות הנאשם 2 למד לקראת בחינות הבגרות ועבר אותן בהצלחה. בעניין המאסר המותנה נטען, כי בהליך הקודם הנאשם נדון ל-4 חודשי מאסר מותנה, ו-100 שעות  של""צ, לאחר שהשתתף בקורס באוניברסיטה העברית. ככל הנראה האירועים שפקדו את צור באהר היו חזקים, אך למרות זאת, נראה כי הנאשם 2 פעל מתוך שיקול דעת שגוי, כפי שאמר לקצינת המבחן. הוא לא פעל ממניע אידיאולוגי, אלא נגרר אחר חבריו.",טענות הצדדים בעניין העונש ודברי הנאשמים
"ת""פ 69261-01-23","לבסוף, אף באת-כוח הנאשם 2 טענה כי יש לשקול גם את העובדה שכיום תנאי המעצר של עצורים ביטחוניים הפכו להיות קשים מאד.",טענות הצדדים בעניין העונש ודברי הנאשמים
"ת""פ 69261-01-23",דברי הנאשמים: שני הנאשמים הודיעו שהם מסתפקים בדברי באי-כוחם.,טענות הצדדים בעניין העונש ודברי הנאשמים
"ת""פ 69261-01-23","כפי שטענו באי-כוח הנאשמים ובניגוד לטענת המאשימה, בנסיבות הנדונות מדובר במסכת אירועים אשר לגביהם מתקיים באופן מובהק ""מבחן הקשר ההדוק"" ולכן ייקבע מתחם ענישה אחד (ע""פ 4910/13 ג'אבר נ' מדינת ישראל (29.10.2014), כבוד השופטת ד' ברק ארז, פסקה 5; כבוד השופט ע' פוגלמן, פסקה 2; ע""פ 1261/15 מדינת ישראל נ' דלאל (3.9.2015), כבוד השופט נ' סולברג, פסקה 22). כך בין השאר ובעיקר מאחר שלאירועים מאפיינים דומים או זהים; המעורבים זהים בכל האירועים, או ברובם; האירועים התרחשו בסמיכות זמנים, גם אם לא ברציפות; יש קשר מובהק ודמיון ברור בין כל האירועים; כל האירועים התרחשו באותו מקום או בקרבתו.",	- מספר מתחמי הענישה
"ת""פ 69261-01-23",- הערכים החברתיים שנפגעו מהעבירות ומידת הפגיעה בערכים מוגנים אלו,	- מספר מתחמי הענישה
"ת""פ 69261-01-23","אין מחלוקת על כך שמעשיי העבירות הנדונות פוגעים באופן חמור בשלום הציבור ובסדר הציבורי וכי הם עשויים לפגוע בשלמות הגוף וברכוש. לא אחת נקבע כי יש לראות בחומרה רבה מעשים אלו, אפילו לא נגרם נזק בפועל או נגרם רק נזק מזערי. זאת בשל הסכנה הרבה הגלומה במעשים מסוג זה ובייחוד אם נעשו על רקע אידיאולוגי תוך ניסיון פגיעה בכוחות הביטחון ובאזרחים (ראו למשל: ע""פ 2390/17 מרזיק נ' מדינת ישראל  (28.12.2017), כבוד השופט ע' פוגלמן, פסקה 11).",	- מספר מתחמי הענישה
"ת""פ 69261-01-23",פסקי הדין שהוגשו מטעם המאשימה,	- מדיניות הענישה הנוהגת
"ת""פ 69261-01-23","(1)	 ע""פ 9821/16 פלוני נ' מדינת ישראל (30.11.2017) – בפסק-דין זה נדונו ערעורים של מספר נאשמים אשר הורשעו על-פי הודאותיהם במספר אירועים רב על רקע פעילות במסגרת חוליה מאורגנת, שהעבירות שעברו היו בין השאר, במתחם הר הבית הידוע בנפיצותו (שם, פסקה 14). באותו עניין אף הודגש כי הושתה ענישה מחמירה במיוחד וכי אף המאשימה הסכימה לכך במסגרת הדיון בערעור (שם, פסקה 15). לפיכך לא נמצא מקום להקיש מפסק-דין זה.",	- מדיניות הענישה הנוהגת
"ת""פ 69261-01-23","(2)	ע""פ 18/22 אבו זינה נ' מדינת ישראל (27.07.2022); ת""פ (מחוזי ירושלים) 10894-06-21 מדינת ישראל נ' אבו זינה (8.12.2021) – הנאשם הורשע על-פי הודאתו בעבירות התפרעות, מעשה פזיזות ורשלנות, פעולה בנשק למטרת טרור ומעשה טרור של חבלה בכוונה מחמירה. דובר בהצתת צמיגים והשלכתם אל עבר שוטרים, יידוי אבנים וירי זיקוקים לעברם, לאחר חסימת הכביש באמצעות פחי אשפה. נקבע מתחם עונש בין 30 ל-60 חודשי מאסר בפועל. הושתו 30 חודשי מאסר בפועל ומאסר מותנה. הערעור נדחה. ",	- מדיניות הענישה הנוהגת
"ת""פ 69261-01-23","(3)	ת""פ (מחוזי ירושלים) 14323-03-22 מדינת ישראל נ' פלוני (7.12.2022) – הנאשם קטין כבן 17.5, הורשע על-פי הודאתו בעבירות הצתה, ייצור נשק, היזק בזדון ממניע גזעני, התפרעות, ניסיון תקיפה בנסיבות מחמירות ממניע גזעני, ניסיון תקיפת שוטר בנסיבות מחמירות. דובר בין השאר, ביידוי בקבוקי תבערה אל עבר בית יהודי הגר בשכונת שייח ג'ראח וגרימת שריפה בביתו ובבעימותים שבמהלכם נורו זיקוקים אל עבר כוחות הביטחון. הושתו 30 חודשי מאסר בפועל, מאסר מותנה, פיצוי למתלונן בסך 7,000 ₪ וקנס בסך 7,000 ₪.",	- מדיניות הענישה הנוהגת
"ת""פ 69261-01-23","(4)	ת""פ (מחוזי נצרת) 30891-06-21 מדינת ישראל נ' קיים (19.10.2022) – הנאשם הורשע על-פי הודאתו בעבירות מעשה טרור של הצתה, נשאית נשק שלא כדין והתפרעות שסופה נזק. בהתחשב בגילו הצעיר ובהיעדר הרשעות קודמות, הושתו 4 שנות מאסר, מאסר מותנה וקנס.",	- מדיניות הענישה הנוהגת
"ת""פ 69261-01-23","(5)	ת""פ (מחוזי ירושלים) 33614-01-22 מדינת ישראל נ' אבו עסב (14.3.2023) – הנאשם הורשע על-פי הודאתו בחברות פעילה בארגון טרור, שלגביו נקבע מתחם עונש בין 16 ל-34 חודשי מאסר ובעבירות התפרעות, מעשה טרור של חבלה בכוונה מחמירה בצוותא ופעולה בנשק למטרת טרור, שלגביהן נקבע מתחם עונש בין 24 ל-48 חודשי מאסר. בהתחשב בשלוש הרשעותיו הקודמות ובענישת המעורבים, הושתו 47 חודשי מאסר בפועל ומאסר מותנה. ",	- מדיניות הענישה הנוהגת
"ת""פ 69261-01-23",פסקי הדין שהגיש בא-כוח הנאשם 1:,	- מדיניות הענישה הנוהגת
"ת""פ 69261-01-23","(1)	ת""פ (שלום ירושלים) 11469-04-23 מדינת ישראל נ' מעטאן (30.7.2023) – הרשעה על-פי הודאה בעבירות שהייה בלתי חוקית, גילוי הזדהות עם ארגון טרור והסתה לטרור. נקבע מתחם עונש בין 8 ל-24 חודשי מאסר. הושתו 8 חודשי מאסר, מאסר מותנה, התחייבות וקנס.",	- מדיניות הענישה הנוהגת
"ת""פ 69261-01-23","(2)	ת""פ (שלום ירושלים) 37216-10-22 מדינת ישראל נ' דיריה (28.3.2023) – הרשעה על-פי הודאה בעבירות שהיה בלתי חוקית והסתה לאלימות. נקבע מתחם עונש בין 9 ל-24 חודש. הושתו 10 חודשי מאסר, מאסר מותנה, הופעל מאסר מותנה בן 45 יום במצטבר והתחייבות. ",	- מדיניות הענישה הנוהגת
"ת""פ 69261-01-23","(3)	ת""פ (מחוז ירושלים) 40616-08-15 מדינת ישראל נ' שוויש (6.1.2016) – הרשעה על-פי הודאה בעבירות בתמיכה בארגון טרור והפרעה לשוטר. נקבע מתחם עונש בין 3 ל-10 חודשי מאסר. הושתו 5 חודשי מאסר, הופעל 4 חודשי מאסר מותנה, חלק במצטבר, מאסר מותנה וקנס.",	- מדיניות הענישה הנוהגת
"ת""פ 69261-01-23","(4)	ת""פ (שלום ירושלים) 16408-04-23 מדינת ישראל נ' אחמד (נאשם 1 – מיום 30.7.2023; נאשם 2 – מיום 31.12.2023) – הרשעה במסגרת הסדר טיעון שכלל הסכמה בעניין העונש. הנאשם 1 הורשע בעבירות התפרעות, ניסיון תקיפת שוטרים בנסיבות מחמירות ומעשה פזיזות ורשלנות ונדון ל-8 חודשי מאסר בפועל, מאסר מותנה וקנס; הנאשם 2 הורשע בקשר לשני אירועים בשתי עבירות התפרעות, הפרעה לשוטר בנסיבות מחמירות, שני ניסיונות תקיפת שוטרים בנסיבות מחמירות ושני מעשיי פזיזות ורשלנות ונדון ל-17 חודשי מאסר בפועל, הופעלו 6 חודשי מאסר מותנה שחציו בחופף, מאסר מותנה, התחייבות וקנס. ",	- מדיניות הענישה הנוהגת
"ת""פ 69261-01-23","(5)	ת""פ (שלום ירושלים) 30707-05-23 מדינת ישראל נ' אבו נאב (7.1.2024) – הרשעה במסגרת הסדר טיעון שכלל הסכמה בעניין העונש, בקשר לשלושה אירועים, בשתי עבירות התפרעות, תקיפת שוטרים בנסיבות מחמירות וניסיון תקיפת שוטרים בנסיבות מחמירות, שני מעשיי פזיזות בחומר נפץ וסיוע לארגון טרור. הושתו 24 חודשי מאסר, מאסר מותנה וקנס.",	- מדיניות הענישה הנוהגת
"ת""פ 69261-01-23","(6)	ת""פ (מחוזי ירושלים) 45090-06-23 מדינת ישראל נ' מרקוס (2.4.2024) – הרשעה על-פי הודאה בעבירות סיוע להצתה, הפרעה לשוטר, התפרעות והפרת הוראה חוקית, אשר נעברו במהלך הפגנה המונית ליד אתר עבודות הרכבת הקלה בירושלים. נקבע מתחם עונש בין 8 ל-24 חודשי מאסר. הושתו 9 חודשי עבודות שירות, 6 חודשי מאסר מותנה וקנס.",	- מדיניות הענישה הנוהגת
"ת""פ 69261-01-23","(7)	ת""פ (מחוזי ירושלים) 56327-08-21 מדינת ישראל נ' סלאח (7.3.2022) – הרשעה על-פי הודאה בחמישה פרטי אישום בארבע עבירות התפרעות, ריבוי עבירות ניסיון תקיפת שוטר בנסיבות מחמירות, שתי עבירות מעשה פזיזות, שתי עבירות מעשה פזיזות ממניע גזעני, ניסיון מעשה פזיזות ממניע גזעני, תקיפת שוטר בנסיבות מחמירות, ניסיון תקיפה ממניע גזעני. לחובתו הרשעה קודמת אחת. נקבע מתחם עונש בין 30 ל-48 חודשי מאסר והושתו 30 חודשי מאסר בפועל, מאסר מותנה וקנס בסך 1,500 ₪. ",	- מדיניות הענישה הנוהגת
"ת""פ 69261-01-23","(8)	ת""פ (מחוזי ירושלים) 21278-09-21 מדינת ישראל נ' נאסר (7.6.2022) – הרשעה על-פי הודאה בשישה פרטי אישום בשלוש עבירות מעשה פזיזות ממניע גזעני, ניסיון תקיפה בצוותא ממניע גזעני, שלוש עבירות התפרעות, שני ניסיונות תקיפת שוטר בנסיבות מחמירות, ניסיון תקיפה בצוותא ממניע גזעני והפרעה לשוטר בנסיבות מחמירות. חלק מהאירועים התרחשו ליד בתי היהודים בשכונת שייח ג'ראח בירושלים ואחד בהר הבית. עונשו נקבע תוך השוואה לעניינו של שותפו, סלאח הנזכר לעיל. נקבע מתחם עונש בין 30 ל-48 חודשי מאסר. הושתו 30 חודשי מאסר בפועל, מאסר מותנה וקנס בסך 1,500 ₪.",	- מדיניות הענישה הנוהגת
"ת""פ 69261-01-23","(9)	ת"" פ (מחוזי ירושלים) 27544-05-22 מדינת ישראל נ' אבו ג'נאם (9.5.2023) – הרשעה על-פי הודאה בשישה פרטי אישום בעבירות שרובן נעברו בצוותא: סיוע להיזק מיוחד, ניסיון היזק מיוחד, מעשה פזיזות ממניע גזעני, ניסיון היזק בזדון ממניע גזעני, הצתה, ייצור נשק, התפרעות, הפרעה לשוטר בנסיבות מחמירות וקשירת קשר לפשע. דובר בין השאר, ביידוי אבנים אל עבר מצלמות אבטחה, ירי זיקוקים אל עבר בית חושן, יידוי בקבוקי תבערה ויידוי אבנים אל עבר כוחות הביטחון. הושתו 48 חודשי מאסר, מאסר מותנה וקנס. ",	- מדיניות הענישה הנוהגת
"ת""פ 69261-01-23","(10)	ת""פ (מחוזי ירושלים) 49029-05-22 מדינת ישראל נ' אבו אלהווא (15.3.2023) – הרשעה  על-פי הודאה בארבעה פרטי אישום בעבירות שנעברו בצוותא: ארבע עבירות התפרעות, שלוש עבירות הפרעה לשוטר בנסיבות מחמירות, עבירות תקיפת שוטר בנסיבות מחמירות ומעשה פזיזות ורשלנות. דובר ביידוי אבנים ובקבוקי תבערה ובירי זיקוקים. הושתו 32 חודשי מאסר בפועל, מאסר מותנה ופיצוי בסך 6,000 ₪.",	- מדיניות הענישה הנוהגת
