verdict,text,part
"ת""פ 51209-04-23","ב""כ המאשימה: עו""ד לינה מטר",נוכחים:
"ת""פ 51209-04-23","ב""כ נאשם 1: עו""ד מוחמד מסארווה (מטעם הסנגוריה הציבורית)",נוכחים:
"ת""פ 51209-04-23",נאשם 1 באמצעות הליווי,נוכחים:
"ת""פ 51209-04-23","חוק העונשין, תשל""ז-1977: סע'  29, 31, 33, 40ט, 144, 144(א), 144(ב), 340א.ב.1., 340א.ב.2",חקיקה שאוזכרה: 
"ת""פ 51209-04-23","הנאשם 1 (להלן גם: ""הנאשם"") הורשע על סמך הודאתו, שניתנה במסגרת הסדר טיעון, לאחר תיקון כתב האישום, בעבירה של סיוע לעבירות בנשק (נשיאה והובלה) לפי סעיף 144(א) רישא וסיפא וסעיף 144(ב) רישא וסיפא + סעיף 31 + סעיף 29 לחוק העונשין, התשל""ז-1977 (להלן: ""חוק העונשין""), וכן בעבירה של סיוע לירי באזור מגורים, לפי סעיף 340א(ב)(1)+(2) + סעיף 31 + סעיף 29 לחוק העונשין.",ההליך וכתב האישום
"ת""פ 51209-04-23",הסדר הטיעון לא כלל הסכמה עונשית ועל כן נקבע כי כל צד יטען את טענותיו לעניין העונש באופן חופשי.,ההליך וכתב האישום
"ת""פ 51209-04-23","יוער כי גם נאשם 2 הודה והורשע במסגרת אותו הסדר טיעון, ואולם בעניינו קיימת חובת תסקיר המעוגנת בדין, מחמת גילו במועד ביצוע העבירה, ולכן הוא הופנה לשירות המבחן לעריכת תסקיר בטרם שמיעת טיעוני הצדדים לעונש ביחס אליו. בנסיבות, הופרד הדיון בעניינו של נאשם 2 מהדיון בעניינו של נאשם 1.",ההליך וכתב האישום
"ת""פ 51209-04-23","בעובדות כתב האישום המתוקן (להלן: ""כתב האישום"") נאמר כי בין הנאשמים לבין חוסין עמאש (להלן: ""חוסין""), ובינם לבין עצמם, קיימת היכרות מוקדמת והשלושה מתגוררים בכפר ג'סר אל זרקא.",ההליך וכתב האישום
"ת""פ 51209-04-23","סניור עמאש הוא אביהם של מוחמד עמאש ועודאי עמאש ודודו של מועד עמאש (להלן יחד: ""המתלוננים""), שבינם לבין הנאשמים וחוסין קיימת היכרות מוקדמת.",ההליך וכתב האישום
"ת""פ 51209-04-23","במועד הרלוונטי לכתב האישום התגוררו סניור, בניו מוחמד ועודאי וכן בני משפחה נוספים בביתם ברחוב ג'ובראן חליל ג'ובראן בכפר ג'סר אל זרקא (להלן: ""בית משפחת סניור"").",ההליך וכתב האישום
"ת""פ 51209-04-23","עובר ליום 19.3.2023, בשעות הערב, תכננו הנאשמים וחוסין תכנית, במסגרתה סוכם כי חוסין יבצע ירי לעבר בית משפחת סניור בסיועם של הנאשמים.",ההליך וכתב האישום
"ת""פ 51209-04-23","בתאריך 19.3.2023, בשעה 18:30 או בסמוך לכך, נפגשו הנאשמים וחוסין בביתו של הנאשם ויצאו משם יחדיו לכיוון בית משפחת סניור. הנאשמים וחוסין יצאו מביתו של הנאשם כאשר נאשם 2 מצויד בכלי הנחזה כנשק (להלן: ""הכלי"") ואילו חוסין מצויד בנשק מאולתר שסוגל לירות כדור שבכוחו להמית אדם (להלן: ""הנשק"") וכן מחסנית תואמת ולפחות 6 קליעים בקליבר 9 מ""מ פראבלום המתאימים לו, אותם נשא והוביל חוסין בלא רשות על פי דין בסיועם של הנאשמים ולשם מימוש תכנית הירי.",ההליך וכתב האישום
"ת""פ 51209-04-23","הנאשמים וחוסין הגיעו לאזור בית משפחת סניור והסתובבו באזור הבית והרכב של מוחמד שחנה בסמוך, וזאת כהכנה לקראת מימוש תכנית הירי. באותה העת ישבו מוחמד, עודאי ומועד באחד החדרים בבית וצפו במסך הטלוויזיה שמשדר את מצלמות האבטחה של הבית, ובתוך כך הבחינו בנאשמים ובחוסין משוטטים במקום.",ההליך וכתב האישום
"ת""פ 51209-04-23","או אז, יצאו מחמוד, עודאי ומועד מהבית על מנת לברר מה מעשיהם של הנאשמים וחוסין. משהבחין סניור ביציאתם מהבית, הוא חבר אליהם ויצא אף הוא לכיוונם של הנאשמים וחוסין. בהמשך לאמור ומשהבחינו הנאשמים וחוסין כי המתלוננים מתקדמים לעברם, הוציא נאשם 2 מהחלק הקדמי של מכנסיו את הכלי וירה באמצעותו באוויר. בשלב זה ונוכח חששם של המתלוננים, הם נמלטו בריצה בכיוון הבית.",ההליך וכתב האישום
"ת""פ 51209-04-23","לאחר שהמתלוננים נכנסו לבית משפחת סניור ובמטרה לקדם את תכנית הירי, התקדם חוסין אל עבר בית משפחת סניור, בעוד הנאשמים מתרחקים מהמקום. חוסין ירה שלא כדין לעבר הבית לא פחות מ-6 יריות באמצעות הנשק ופגע בכבל חשמל של הבית. כל זאת, באופן שיש בו כדי לסכן חיי אדם ובסיועם של הנאשמים, אשר במעשיהם כמתואר לעיל אפשרו את ביצוע הירי והקלו על ביצועו. לאחר הירי נפגשו הנאשמים וחוסין בביתו של הנאשם 1.",ההליך וכתב האישום
"ת""פ 51209-04-23","כתוצאה ממעשיהם של הנאשמים וחוסין, נגרמה הפסקת חשמל בבית משפחת סניור וכן נגרם נזק לכבל החשמלי בבית.",ההליך וכתב האישום
"ת""פ 51209-04-23",מטעם המאשימה לא הוגשו ראיות לעונש.,הראיות לעונש
"ת""פ 51209-04-23","ב""כ הנאשם הגיש את חוות הדעת של ועדת האבחון מיום 30.7.2023, שנערכה בעניינו של הנאשם (נע/1), את החלטת ועדת ההשמה מיום 29.5.2023 (נע/2), סיכום אשפוז מבית החולים רמב""ם מיום 13.11.2018 (נע/3), סיכום ביקור במרכז הרפואי ""הלל יפה"" מיום 17.4.2023 (נע/4), ממצאי בדיקת CT שנערכה לנאשם ביום 17.4.2023 (נע/5) והפניה לדימות בקופת חולים כללית מיום 23.5.2023 (נע/6).",הראיות לעונש
"ת""פ 51209-04-23","בטיעוניה לעונש הפנתה המאשימה לחומרת העבירות בהן הורשע הנאשם ולערכים החברתיים שנפגעו כתוצאה מביצוען, הכוללים את שלומו וביטחונו של הציבור בכללותו, ושלומם, ביטחונם ורכושם של המתלוננים, שיורים לעבר ביתם אל מול עיניהם כשהם נמלטים כדי לא להיפגע בעצמם.",טיעוני הצדדים לעונש
"ת""פ 51209-04-23","לטענת המאשימה, מדובר באירוע שתוכנן על ידי כלל המעורבים בו. הנאשם אמנם הורשע בעבירת סיוע, אך לא מדובר בסיוע ברף הנמוך שהתבטא לדוגמה בהסעתו של חוסין לזירת האירוע או הצבעה בפניו על מקום מגוריהם של המתלוננים, אלא השלושה יצאו יחדיו ועשו הכנה ביחד, אך בסופו של דבר חוסין הוא זה שביצע את הירי בפועל.",טיעוני הצדדים לעונש
"ת""פ 51209-04-23","הנזק שנגרם כתוצאה ממעשיו של הנאשם הוא רכושי, אך זה לא העיקר בעבירות מהסוג הזה, שכן הפוטנציאל של פגיעה בביטחון ושלום הציבור והסיכון העצום שנשקף למתלוננים הוא רב ביותר. המאשימה הפנתה לתיקון 140 לחוק העונשין, הקובע עונש מינימום של חודשי מאסר בגין העבירה המושלמת של נשיאה והובלה של נשק, שחל בענייננו. בהתאם לסעיף 33 לחוק העונשין, עונש המינימום שיש להשית על הנאשם רק על עבירת הסיוע לנשיאה והובלה הוא 15 חודשי מאסר.",טיעוני הצדדים לעונש
"ת""פ 51209-04-23","בשים לב לעובדה שבענייננו מדובר בסיוע הן לנשיאה והובלה והן לביצוע ירי, ולאחר שהפנתה להנחיית פרקליט המדינה העוסקת בעבירות בנשק ולמדיניות הענישה הנוהגת, עתרה המאשימה לקבוע מתחם המצוי בטווח שבין 4-2 שנות מאסר בפועל. נוכח גילו הצעיר של הנאשם והעובדה כי הוא נעדר עבר פלילי, ובשים לב להודאתו, ביקשה המאשימה לגזור את עונשו ברף התחתון של המתחם לו עתרה. בנוסף, ביקשה להשית עונשים נלווים בדמות קנס, פיצוי למתלוננים ומאסר מותנה מרתיע.",טיעוני הצדדים לעונש
"ת""פ 51209-04-23","בפתח טיעוניו לעונש ציין הסנגור כי הסיוע של הנאשם היה מינורי ביותר וכי חלקו ביחס לשני המעורבים האחרים היה שולי, שכן העבירות היו מתבצעות אף ללא הסיוע מצדו. עוד הוסיף כי אין מחלוקת שהנאשם לא נשא על גופו את הנשק וגם לא ביצע את הירי בפועל. חלקו מתמצה בכך שיצא מביתו יחד עם שני המעורבים הנוספים והיה מודע לקיומו של נשק עם חוסין. לטענת ההגנה, בעת גזירת עונשו של הנאשם, על בית המשפט לתת ביטוי לתרומתם המינורית של מעשיו לביצוע העבירה ולכך שמדובר בסיוע ברף נמוך.",טיעוני הצדדים לעונש
"ת""פ 51209-04-23","ב""כ הנאשם הוסיף כי מתחם העונש ההולם בעבירות בנשק הוא רחב ותלוי במשתנים רבים ובנסיבותיו הייחודיות של כל מקרה. לשיטתו, מתחם העונש בענייננו צריך להיקבע בטווח שבין 15-9 חודשים ויש לגזור את עונשו של הנאשם ברף התחתון של מתחם זה. מדובר בנאשם צעיר, בן 22 שנים, נעדר עבר פלילי, המצוי במעצר מאז 13.4.2023 ואשר הודה וקיבל על עצמו אחריות מלאה על מעשיו. בנוסף, יש להביא בחשבון את מצבו הקוגניטיבי של הנאשם, כפי שעולה מדו""ח ועדת האבחון (נע/1), שם צוין כי מדובר בצעיר הסובל מקשיים קוגניטיביים על רקע של נזק אורגני למוח, לצד קומפוננטים אישיותיים דלים המנמיכים עוד יותר את כישוריו. חברי ועדת האבחון קבעו אמנם פה אחד כי הנאשם כשיר לעמוד לדין, הן דיונית והן מהותית, אך לצד זאת נקבע כי הוא מתפקד ברמה גבולית.",טיעוני הצדדים לעונש
"ת""פ 51209-04-23","בטיעוניו הכתובים ציין הסנגור כי קרבתו של הנאשם לסייג לאחריות פלילית מצדיקה קביעת מתחם ענישה שונה ממקרים דומים, שאין בהם רקע של קושי שכלי-נפשי. ב""כ המאשימה התנגד לטיעון זה, העומד בסתירה למוסכם בהסדר הטיעון (ה/1), שם הוסכם במפורש כי בטיעוניה לעונש לא תעלה ההגנה טענה לגבי קרבה לסייג לאחריות פלילית. בעקבות התנגדות זו הבהרתי בהחלטתי שניתנה במעמד הדיון ביום 17.1.2024 כי כל טענה החורגת מהסדר הטיעון עליו חתמו הצדדים לא תזכה לכל התייחסות בגזר הדין. יש להצר על הטענות לעניין זה שהעלתה ההגנה, העומדות בניגוד למה שהוסכם בהסדר בין הצדדים.",טיעוני הצדדים לעונש
"ת""פ 51209-04-23","בהתייחס לגזירת העונש בתוך המתחם לו עתר הסנגור, נאמר כי יש לחרוג ממתחם זה, הן בשל הקרבה לסייג אי שפיות הדעת והן משיקולי צדק בשל מצבו הרפואי של הנאשם. בהקשר זה, צוין כי הנאשם עבר ניתוח בראשו בהיותו בן 17 ומאז ניכרת הנמכה קוגניטיבית על רקע אורגני מעבר להנמכה מילדות בשל חסכים סביבתיים וחברתיים. בנוסף, ביקש הסנגור להתחשב בגילו הצעיר של הנאשם, בהיותו נעדר עבר פלילי, בשיתוף הפעולה שלו עם רשויות אכיפת החוק ובנסיבות חייו הקשות.",טיעוני הצדדים לעונש
"ת""פ 51209-04-23","בסיכומו של דבר, ביקש ב""כ הנאשם להסתפק בימי מעצרו של שולחו ולהשית עליו ענישה צופה פני עתיד.",טיעוני הצדדים לעונש
"ת""פ 51209-04-23",בדברו האחרון אמר הנאשם כי הוא עשה טעות עליה הוא מצר והוא לא רוצה לחזור ולעשות טעויות נוספות.,דברו האחרון של הנאשם
"ת""פ 51209-04-23","בגזירת הדין, על בית המשפט לפעול בהתאם לעיקרון ההלימה, המחייב קיומו של יחס הולם בין חומרת העבירה בנסיבותיה ומידת אשמו של הנאשם לבין סוג ומידת העונש המוטל עליו. לשם כך, על בית המשפט להתחשב בערכים החברתיים המוגנים שנפגעו מביצוע העבירה, במידת הפגיעה בהם, במדיניות הענישה הנוהגת במקרים דומים ובכלל הנסיבות הקשורות בביצוע העבירה, כמפורט בסעיף 40ט לחוק העונשין.",קביעת מתחם העונש ההולם
"ת""פ 51209-04-23","הערכים החברתיים שנפגעו מביצוע העבירות בענייננו הם הערך העליון של קדושת החיים וכן ביטחונו, שלמות גופו וקניינו של האדם ושל הציבור בכללותו.",קביעת מתחם העונש ההולם
"ת""פ 51209-04-23","בית המשפט העליון עמד בפסיקה עקבית על חומרתן היתרה של העבירות בנשק ועל חובתו של בית המשפט להירתם למאבק בהתפשטות עבירות אלו על דרך של החמרת הענישה. בע""פ 2165/23 מדינת ישראל נ' בלאל (4.5.2023) נאמר:",קביעת מתחם העונש ההולם
"ת""פ 51209-04-23","""על חומרתן הרבה של עבירות הנשק עמד בית משפט זה פעם אחר פעם. עבירות אלו הפכו זה מכבר ל""מכת מדינה"" בחברה הישראלית (ע""פ 4406/19 מדינת ישראל נ' סובח, פסקה 16 [פורסם בנבו](5.11.2019) ). הן מסכנות את שלום הציבור, גם בהיותן ""קרקע פורייה"" לביצוע עבירות אחרות – החל מעבירות איומים וכלה בעבירות המתה, ובשל יכולתן לגרום לפגיעות בגוף ובנפש (ע""פ 2283/22 אל נבארי נ' מדינת ישראל, פסקה 13 לחוות דעתו של חברי השופט ח' כבוב [פורסם בנבו] (31.7.2022); ע""פ 3728/22 מסאלחה נ' מדינת ישראל, פסקה 14 [פורסם בנבו] (9.8.2022)).",קביעת מתחם העונש ההולם
"ת""פ 51209-04-23","נוכח האמור, הודגש לא אחת כי יש לנקוט במדיניות ענישה ממשית ומשמעותית, בה ניתן מעמד בכורה מבין שיקולי הענישה לשיקולי הרתעת היחיד והרבים, שמשמעותה הרחקת עברייני הנשק מהחברה לפרק זמן משמעותי, על ידי השמתם מאחורי סורג ובריח (ע""פ 2880/23 מדינת ישראל נ' עיסא, פסקה 11 [פורסם בנבו] (25.4.2023); ע""פ 8900/21 מחאג'נה נ' מדינת ישראל, פסקה 9 [פורסם בנבו] (14.8.2022)). כן נקבע, כי עונש מאסר בפועל לתקופה של 3 שנים בגין עבירות הקשורות לנשק התקפי הוא ברף הנמוך של הענישה הראויה (ע""פ 4077/22 פלוני נ' מדינת ישראל, פסקה 13 [פורסם בנבו] (28.7.2022) ). וכפי שקבעתי בעבר, המסר העונשי הנגזר ממדיניות הענישה האמורה הוא כי ""שומר נפשו ושלומו – ירחק מעבירות הנשק באשר הן, קלות כחמורות"" (ע""פ 78/21 פלוני נ' מדינת ישראל, פסקה 10 [פורסם בנבו] (26.7.2022)).",קביעת מתחם העונש ההולם
"ת""פ 51209-04-23","זאת ועוד, מדיניות הענישה המחמירה חלה על ""כל חוליית השרשרת העבריינית"" בעבירות הנשק, החל ממי שסוחר בנשק לא חוקי או רכיביו, ועד למי שנוטל אותו לידו ועושה בו שימוש לא חוקי (ע""פ 4456/21 מדינת ישראל נ' אבו עבסה, פסקה 15 [פורסם בנבו](23.1.2022) ).""",קביעת מתחם העונש ההולם
"ת""פ 51209-04-23","נוכח ממדי התופעה של העבירות בנשק והצורך לנהל נגדה מלחמת חורמה, התגייס אף המחוקק למלחמה זו בדרך של תיקון חוק העונשין שנכנס לתוקפו ביום 8.12.2021. תיקון זה נועד להחמיר בענישה אגב קביעת עונשי מינימום לעבירות בנשק ובכללן רכישה, החזקה, נשיאה והובלה של נשק. נקבע כי בתקופה של שלוש שנים מיום פרסומו של התיקון, לא יפחת עונשו של מי שהורשע בעבירות המנויות בסעיף 144 לחוק העונשין מרבע העונש המרבי שנקבע לאותה עבירה, אלא אם כן יחליט בית המשפט, מטעמים מיוחדים שיירשמו, להקל בעונש. עוד נקבע כי עונש מאסר על פי אותו סעיף לא יהא כולו על תנאי, בהיעדר טעמים מיוחדים לכך. חקיקה זו מעידה על ההחמרה שבה ראה גם המחוקק לנקוט ביחס לעבירות בנשק באשר הן.",קביעת מתחם העונש ההולם
"ת""פ 51209-04-23","בבואי לבחון את הנסיבות הקשורות בביצוע העבירות, נתתי דעתי לעובדה כי הנאשם, יחד עם המעורבים האחרים, תכננו תכנית לפיה יבצע חוסין ירי לעבר בית משפחת סניור. לא מדובר בסיוע לנשיאה והובלה המתבטא בהימצאות אקראית עם מי שנשא והוביל נשק, וכן לא מדובר בסיוע לירי באזור מגורים שנעשה מבלי שהמסייע היה מודע מראש לכוונה לבצע את הירי. בענייננו היה הנאשם בלב התכנית העבריינית שמטרתה ביצוע ירי לעבר ביתם של המתלוננים. אכן, חלקו התבטא בסיוע לביצוע העבירה ולא הוא שביצע את העבירה המוגמרת. יחד עם זאת, אין בידי לקבל את טענת הסנגור כי חלקו היה שולי או זניח. נהפוך הוא. מעובדות כתב האישום עולה בבירור כי הנאשם היה למן ההתחלה חלק מהתכנית, במסגרתה סוכם כי חוסין יבצע ירי לעבר בית משפחת סניור בעוד הנאשם יסייע לו בכך. לא זו בלבד, אלא שבהגיעם של המעורבים למתחם בית משפחת סניור, הסתובב הנאשם יחד עם האחרים באזור הבית כהכנה לקראת מימוש תכנית הירי. העובדה שהנאשם התרחק מזירת האירוע בזמן שחוסין התקדם אל עבר בית משפחת סניור כדי לבצע את הירי, אין בה כדי להקהות מחומרת מעשיו.",קביעת מתחם העונש ההולם
"ת""פ 51209-04-23","הנזק שנגרם כתוצאה מביצוע העבירות בענייננו הוא אמנם נזק רכושי בלבד, המתבטא בנזק לכבל החשמלי בבית משפחת סניור. יחד עם זאת, פוטנציאל הנזק הוא עצום, הן בשים לב לכך שבסמוך לזירת הירי נכחו המתלוננים ומתגוררים גם אנשים אחרים, והן בהתחשב בכך שהפגיעה בכבל החשמלי עלולה הייתה להוביל להתלקחות אש ובמקרה זה אין לדעת כיצד היה האירוע מסתיים.",קביעת מתחם העונש ההולם
"ת""פ 51209-04-23","בבואי לבחון את מדיניות הענישה הנוהגת לגבי העבירות בהן הורשע הנאשם, אני רואה להפנות לע""פ 5602/22 מדינת ישראל נ' פלוני (14.9.2022), שם נאמר כי מתחם העונש ההולם שראוי לקבוע לגבי נאשם בגיר שהורשע בנשיאה של נשק חם באופן בלתי חוקי במרחב הציבורי נע בין 42-30 חודשי מאסר לריצוי בפועל. העבירה של ירי באזור מגורים היא חמורה אף יותר ומתחמי הענישה שנקבעו בפסיקה בנוגע אליה הם מחמירים. להלן מספר דוגמאות המשקפות את מדיניות הענישה הנוהגת, הן ביחס לעבירה של נשיאה והובלה של נשק והן ביחס לירי באזור מגורים. למותר לציין כי מדובר בפסקי דין המתייחסים לעבירה המוגמרת, בעוד שבענייננו מדובר בשתי עבירות סיוע. יחד עם זאת, את העונש בגין עבירות הסיוע יש לגזור מהענישה הנהוגה המוטלת בגין העבירה המוגמרת.",קביעת מתחם העונש ההולם
"ת""פ 51209-04-23","	בע""פ 5681/23 חווא נ' מדינת ישראל (6.12.2023) נדון עניינו של מי שהורשע בעבירה של החזקה ונשיאה של נשק. על פי עובדות כתב האישום באותו מקרה, כשנה וחצי עובר למועד הרלוונטי, החזיק המערער אקדח טעון במחסנית התואמת לו ובתוכה שישה כדורים. בתאריך 3.10.2022 יצא המערער מביתו כשהוא מחזיק ונושא את האקדח טעון במחסנית ובכדורים וכשהנשק מוסתר בבגדיו, והלך יחד עם אשתו לכיוון רכבו שחנה בסמוך. שוטרים שהיו בתצפית יזומה עליו הבחינו בו, ולאחר שזיהה אותם הוא החל לברוח מפניהם. כאשר הורו לו השוטרים לעצור, לא נענה להם המערער ותוך כדי הימלטותו הוציא את האקדח והחזיקו בידו. בהמשך שלף אחד השוטרים את נשקו, דרך אותו וכיוון אותו לעבר המערער, שאז הוא נעצר. בית המשפט העליון אישר את העונש שהושת על ידי בית המשפט המחוזי, שכלל 35 חודשי מאסר לריצוי בפועל, תוך שציין כי העונש שנגזר על המערער אינו מחמיר עמו ואולי אף מקל.",קביעת מתחם העונש ההולם
"ת""פ 51209-04-23","	בע""פ 3728/22 מסאלחה נ' מדינת ישראל (9.8.2022) נדון עניינו של מי שהורשע בעבירות של סיוע לנשיאה והובלה של כלי נשק, נשיאה והובלה של כלי נשק וכן סיוע לירי מנשק חם. על פי עובדות כתב האישום באותו מקרה, נהג המערער ברכב כשאדם אחר יושב במושב שלידו, כאשר אחריהם נסע צוות בילוש. לפתע הוציא האחר את ידו מהחלון וירה ירייה אחת מאקדח מסוג FN. המערער עצר את הרכב בהמשך בצד הדרך והבלשים שחסמו אותו ביצעו חיפוש במהלכו נתפסו 15 כדורים בכיס מכנסיו, בעוד האקדח נתפס ברכב. בית המשפט המחוזי קבע מתחם הנע בין 36-18 חודשי מאסר לריצוי בפועל והשית על המערער 18 חודשי מאסר לצד עונשים נלווים. ערעור על חומרת העונש נדחה על ידי בית המשפט העליון.",קביעת מתחם העונש ההולם
