verdict,text,part
"ת""פ 5000-12","ת""פ 5000-12 ",בית המשפט המחוזי בחיפה
"ת""פ 5000-12",כב' השופט  כמאל סעב,בפני 
"ת""פ 5000-12",כב' השופט  כמאל סעב,בפני 
"ת""פ 5000-12","למאשימה טען עו""ד שגב אדלר.",הנאשם
"ת""פ 5000-12","לנאשם טען עו""ד כנאענה  אברהים",הנאשם
"ת""פ 5000-12","חוק הנוער (שפיטה, ענישה ודרכי טיפול), תשל""א-1971","חוק העונשין, תשל""ז-1977: סע'  144(ב)"
"ת""פ 5000-12","הנאשם הובא לדין בגין עבירות בנשק, עבירה לפי סעיף 144(ב) לחוק העונשין תשל""ז – 1977 (להלן: ""חוק העונשין"").",	מבוא:
"ת""פ 5000-12","בעובדות כתב האישום המתוקן נטען, כי החל משנת 2008, נשא הנאשם אקדח תקני בצבע כסף עם מחסנית תואמת (להלן: ""האקדח"").",	עובדות כתב האישום המתוקן:
"ת""פ 5000-12","ביום 6.8.12, הסליק הנאשם  את האקדח בתוך מגבת בצבע צהוב - לבן ושקית ניילון נצמד כחול מתחת לכיסא הנהג ברכב  מסוג ""פולקסווגן, שהיה בחזקתו (להלן: ""הרכב"").",	עובדות כתב האישום המתוקן:
"ת""פ 5000-12","באותו יום, בשעה 20:40, נשא הנאשם את האקדח, כשהוא מוסתר כאמור, באמצעות הרכב, מביתו שבכפר קרע לתחנת הדלק בשכונת עין ג'ראח באום אל פחם.",	עובדות כתב האישום המתוקן:
"ת""פ 5000-12","במעשיו הנ""ל, נשא הנאשם והוביל אקדח בלא רשות על פי דין. המדובר בכלי  נשק שסוגל להמית אדם.",	עובדות כתב האישום המתוקן:
"ת""פ 5000-12","הצדדים הגיעו לידי הסדר טיעון, לפיו יחזור בו הנאשם מכפירתו, יודה בעובדות כתב האישום המתוק ויורשע. עוד הוסכם כי הטיעון לעונש יהיה חופשי.",	הסדר הטיעון:
"ת""פ 5000-12","הנאשם חזר בו מכפירתו, הודה והורשע עפ""י הודאתו במסגרת הסדר טיעון, בעובדות כתב האישום המתוקן, בעבירות בנשק, לפי סעיף 144(ב) לחוק העונשין.",	הסדר הטיעון:
"ת""פ 5000-12",הנאשם נשלח לשירות המבחן לקבלת תסקיר.,	הסדר הטיעון:
"ת""פ 5000-12","בתסקיר שהוגש ביום 12.2.13, סקר שירות המבחן את נסיבותיו האישיות והמשפחתיות של הנאשם. המדובר בצעיר כבן 21 שנים, יליד הארץ, סיים 12 שנות לימוד, ברשותו תעודת בגרות חלקית, בהמשך השתלב וסיים לימודיו בקורס ""מתקין מערכות שמע ומערכות מיגון לרכב"" במכללת כפר סבא.",	תסקיר שירות המבחן:
"ת""פ 5000-12","מהמלצות שונות שהציג הנאשם בפני שירות המבחן ממעסיקיו עולה כי הוא עבד בצורה מקצועית ואחראית, גילה יחסי אנוש טובים, ללא בעיות חריגות.",	תסקיר שירות המבחן:
"ת""פ 5000-12",אין לחובתו של הנאשם הרשעות קודמות.,	תסקיר שירות המבחן:
"ת""פ 5000-12","הנאשם הודה בעבירה המיוחסת לו בכתב האישום המתוקן, הביע צער ובושה בגין מעשיו והבנה לבעייתיות שבהתנהגותו.",	תסקיר שירות המבחן:
"ת""פ 5000-12","שירות המבחן התרשם כי ההליכים הפליליים שננקטו נגדו, הגינוי ותגובת בני משפחתו הקשה, מהווים גורם הרתעתי משמעותי מפני חזרה על מעשים דומים בעתיד.",	תסקיר שירות המבחן:
"ת""פ 5000-12","עוד התרשם שירות המבחן כי מדובר בצעיר בעל יכולת קוגניטיבית וורבאלית טובה, המאופיין באישיות חסרת בשלות רגשית והינו בעל עולם ערכים נורמטיבי בד""כ.",	תסקיר שירות המבחן:
"ת""פ 5000-12",הנאשם תיאר אורח חיים ודפוסי התנהגות נורמטיביים וכי האירוע דנן מהווה אירוע חריג במערך תפקודיו ואורחות חיו.,	תסקיר שירות המבחן:
"ת""פ 5000-12","להערכת שירות המבחן, לא מדובר באדם בעל דפוסי התנהגות שוליים, אינו בעל קווים אלימים ועבריינים וללא קווים מניפולטיביים.",	תסקיר שירות המבחן:
"ת""פ 5000-12","שירות המבחן התלבט בעניינו של הנאשם, מחד ציין כי המדובר בעבירות חמורות ומאידך, ציין  כי המדובר בצעיר שמנהל אורח חיים נורמטיבי, שזו מעורבותו הראשונה בפלילים, שבה הודה והביע צער ובושה.",	תסקיר שירות המבחן:
"ת""פ 5000-12","לאור כל האמור, המליץ שירות המבחן לשקול אפשרות שלא למצות עם הנאשם את הדין, להטיל עליו צו מבחן לשנה, במהלכו ישתלב בהליך טיפולי.",	תסקיר שירות המבחן:
"ת""פ 5000-12","בנוסף המליץ שירות המבחן על הטלת מאסר מותנה מרתיע, התחייבות כספית ומאסר שירוצה בדרך של עבודות שירות.",	תסקיר שירות המבחן:
"ת""פ 5000-12","להערכת שירות המבחן שליחת הנאשם לריצוי מאסר בפועל, עלולה לחבל במאמציו לנהל אורח חיים תקין, ולהביא להפנמת נורמות עברייניות בבואו במגע עם אסירים אחרים.",	תסקיר שירות המבחן:
"ת""פ 5000-12","המאשימה טענה כי הנאשם הורשע בעבירה חמורה של ביצוע עבירות בנשק, שנשקפת ממנה סכנה רבה כלפי הציבור ומחייבת ענישה ממשית ומרתיעה בדמות מאסר בפועל לתקופה ממושכת.",	טענות המאשימה:
"ת""פ 5000-12","לטענתה, המדובר בתופעה נפוצה ומסוכנת ביותר, שכן לא פעם מגיע נשק שכזה לידיהם של גורמים עבריינים ונעשה בו שימוש כנגד אחרים.",	טענות המאשימה:
"ת""פ 5000-12","המאשימה ציינה כי הנאשם נשא והוביל עמו אקדח תקני, אשר ברור ששימוש בו עלול להוביל לפגיעה בבני אדם.",	טענות המאשימה:
"ת""פ 5000-12",המאשימה סבורה כי נשיאת והובלת נשק במהלך נסיעה ארוכה מכפר קרע לאום אל פחם  ובמיוחד כאשר הנשק מוסתר ומוחבא באופן בו נמצא – עטוף בניילון צמוד ובמגבת – מעידה על כוונות שאינן תמימות.,	טענות המאשימה:
"ת""פ 5000-12","עוד נטען כי הנאשם נשא את האקדח במשך תקופה של כ- 4 שנים, עובדה שמהווה נסיבה לחומרא ומלמדת על כך שלא מדובר בעבירה שבוצעה באופן חד פעמי או רגעי.",	טענות המאשימה:
"ת""פ 5000-12",עוד נטען כי מדובר בעבירה של נשיאת נשק שהעונש המרבי הקבוע בצידה הוא 10 שנות מאסר.,	טענות המאשימה:
"ת""פ 5000-12",המאשימה הפנתה לפסיקה וציינה כי לאחרונה גישת בתי המשפט להחמיר את הדין בעבירות אלו. מגמת החמרה זו באה לידי ביטוי אף בפסיקת בית המשפט העליון.,	טענות המאשימה:
"ת""פ 5000-12","עוד הפנתה המאשימה לתסקיר וציינה כי על אף ששירות המבחן התרשם כי הנאשם לוקח אחריות על מעשיו והביע חרטה, הרי שהנאשם ממזער בחלקו ומפחית את מידת אחריותו, מנסה להמעיט בחומרת מעשיו, לכן חרטתו שהביע אותה, מוטלת בספק.",	טענות המאשימה:
"ת""פ 5000-12","המאשימה סבורה כי אין לקבל את המלצת שירות המבחן, אשר ציין בתסקירו כי הנאשם התקשה להתייחס לחלקים הבעייתיים והלא מתפקדים באישיותו, ולא מסר הסבר מלא על הרקע למעשיו.",	טענות המאשימה:
"ת""פ 5000-12","לטענת המאשימה, אדם אשר נושא אקדח במשך תקופה ארוכה של ארבע שנים וכשהוא מעביר את האקדח מעיר לעיר הוא מחביא אותו הטיב, עבר את רף ""בדיקת הגבולות"", והינו מודע לחלוטין לעובדה כי מעשיו אסורים.",	טענות המאשימה:
"ת""פ 5000-12","לטענת המאשימה, מתחם הענישה ההולם בנוגע לעבירה של נשיאת נשק (אקדח ומחסנית), הינו 3 עד 5 שנות מאסר בפועל, מאסר מותנה וקנס כספי כבד.",	טענות המאשימה:
"ת""פ 5000-12",המאשימה הדגישה כי הנאשם הורשע בנשיאת נשק לתקופה ארוכה של 4 שנים ולכן ביקשה  להטיל על הנאשם עונש שיהיה ברף העליון של מתחם הענישה המוצע.,	טענות המאשימה:
"ת""פ 5000-12","הסנגור ציין כי הנאשם הודה כבר בשלב החקירה ושב והודה גם בבימ""ש כבר בהזדמנות הראשונה ובזה חסך זמן שיפוטי יקר. הנאשם לקח אחריות מלאה על מעשיו, הביע חרטה כנה וצער רב.","טענות ב""כ הנאשם:"
"ת""פ 5000-12","עוד ציין כי לפי עובדות כתב האישום המתוקן, הנאשם נשא את הנשק כאשר היה בן 15, מגיל 15 עד 19  כשבשנים אלו הגם שהוא נשא את הנשק, לא ביצע בו כל עבירה, דבר המעיד על כך שנאשם זה לא נשא את הנשק למטרות פליליות.","טענות ב""כ הנאשם:"
"ת""פ 5000-12",הסנגור ביקש להתחשב בכך כי הנאשם היה במעצר כחודש ימים ולאחר מכן שוחרר למעצר בית בתנאים מגבילים ומאז לא ביצע כל עבירה.,"טענות ב""כ הנאשם:"
"ת""פ 5000-12",הסנגור הפנה לתסקיר שירות המבחן וביקש לאמץ את המלצתו.,"טענות ב""כ הנאשם:"
"ת""פ 5000-12",ציין כי האקדח נתפס כשהוא ריק מכדורים ובנפרד מהמחסנית.,"טענות ב""כ הנאשם:"
"ת""פ 5000-12","הסנגור הפנה לפסיקה וביקש שלא למצות את הדין עם הנאשם, הדגיש כי המדובר בבחור צעיר, בן למשפחה נורמטיבית, נעדר עבר פלילי וזו מעורבותו הראשונה בפלילים, לכן ביקש לתת לו הזדמנות ולהטיל עליו עונש מאסר שירוצה בדרך של עבודות שירות.","טענות ב""כ הנאשם:"
"ת""פ 5000-12","הנאשם בפנותו לביהמ""ש הביע צער על מעשיו.","טענות ב""כ הנאשם:"
"ת""פ 5000-12","הנאשם הורשע בביצוע עבירות בנשק, לאחר שנשא והוביל אקדח עם מחסנית שהיו מוסתרים מתחת לכיסא ברכב בו נסע.",גזירת הדין:
"ת""פ 5000-12","אכן ריבוי העבירות המבוצעות בנשק, התחושה שנשק בלתי מורשה מצוי בידי כל מי שחפץ ובשל הסכנה הנשקפת מנשק זה לציבור, נקטו בתי המשפט בגישה מחמירה שתכליתה הכרזת מלחמה של רשויות האכיפה בתופעה זו ועל כך נאמר בע""פ 9373/10 חמד וותד נגד מדינת ישראל (ניתן ביום 14.9.11) כי:",גזירת הדין:
"ת""פ 5000-12","כאשר קודם לכך כתב ביהמ""ש העליון כי: ",גזירת הדין:
"ת""פ 5000-12","בסופו של יום הקל בעונשו ותחת 50 חודשי מאסר בפועל שהטיל ביהמ""ש המחוזי; הופחת העונש ל- 30 חודשים. (יצוין כי העבירות והנסיבות בהן בוצעו, חמורות יותר).",גזירת הדין:
"ת""פ 5000-12","בשנים האחרונות, אכן המגמה בפסיקה להחמיר בענישה בעבירות נשק - ראו ע""פ 2251/11 נפאע נ' מדינת ישראל (ניתן ביום 4.12.11) וע""פ 4450/11 עספור נ' מדינת ישראל (ניתן ביום 8.2.12). מגמה שזכתה לתמיכה מליאה בפסק דין שניתן לאחרונה ע""י בימ""ש העליון בע""פ 1323/13 רך חסן ואח' נגד מדינת ישראל (ניתן ביום 5.6.13) (להלן: ""חסן""), שם קבעה השופטת ע. ארבל:",גזירת הדין:
"ת""פ 5000-12","גם בעניין הנ""ל הנסיבות חמורות יותר מהנסיבות של המקרה שבפני. מדובר בעבירות סחר בנשק מסוג רימון הלם וסחר בסמים לסוכן משטרתי כשלנאשמים עבר פלילי מכביד, חרף הנסיבות המחמירות הוטל על מערער 1 עונש של 24 חודשי מאסר בפועל ועל השני 36 חודשים, להבדיל מהנאשם שבפני שהחזיק אקדח עם מחסנית ללא כדורים, צעיר, עברו נקי וזה כשלנו הראשון.",גזירת הדין:
"ת""פ 5000-12","אדגיש כי הענישה במקומותינו היא אינדיווידואלית ומותאמת לנסיבות ולנאשם הספציפי העומד לתת את הדין בפני ביהמ""ש – ראו ע""פ 433/89 ג'ורג' אטיאס נ. מידת ישראל, פ""ד מ""ג (4) 170, 174).",גזירת הדין:
"ת""פ 5000-12","לכן יש לבחון כל מקרה ונסיבותיו, לרבות הנסיבות האישיות של הנאשם שעומד לדין בפני בית המשפט. וכך נקבע בע""פ 3210/06 עמארה נ' מדינת ישראל, (ניתן ביום 18.03.07):",גזירת הדין:
"ת""פ 5000-12","על כן, ובשל כל אשר הובא לעיל, על ביהמ""ש להטיל עונש שיהיה בו כדי לאזן בין מכלול השיקולים ומבלי שיהיה בו כדי לפגוע בסיכויי הנאשם לעלות על דרך המלך, לחזור למוטב להמשיך את התהליך השיקומי, וכל זאת מבלי להתעלם מחומרת העבירה והחובה להגן על רכוש הציבור, בהתחשב בשיקולי הענישה שבאינטרס הציבורי.",גזירת הדין:
"ת""פ 5000-12","בית המשפט העליון דן לאחרונה, בקביעת מתחם העונש ההולם, בעבירת נשק כשהוא אומר:",גזירת הדין:
"ת""פ 5000-12",(ראו פסק דין חסן שהוזכר לעיל).,גזירת הדין:
"ת""פ 5000-12","לפי פסיקתו של בית המשפט העליון יש לקבוע את מתחת הענישה ההולם בהתאם לסוג וכמות הנשק שבו החזיק הנאשם, נשא והוביל כשגם התכלית לכך חשובה בועלת משקל.",גזירת הדין:
"ת""פ 5000-12","בענייננו מדובר באקדח אחד עם מחסנית ללא כדורים, דברים אלה מהווים נסיבות הקשורות בביצוע העבירה והם שקובעים את פוטנציאל הנזק הכרוך במעשה העבירה.",גזירת הדין:
"ת""פ 5000-12","יודגש, בעניין זה כי כבר נקבע בעבר שקיים מדרג ענישה בעבירות המבוצעות בנשק, הנקבע, בין השאר, ע""פ סוג, איכות וכמות הנשק שנעשה בו שימוש וכך נאמר לא אחת כי:",גזירת הדין:
"ת""פ 5000-12","""... מידת העונש המוטל בגין עבירות המבוצעות בנשק, מושפעת מפוטנציאל הסיכון הרב הטמון בנשק המוחזק שלא כדין ומהעברתו מיד ליד ללא פיקוח. בבוא בית-המשפט לגזור את הדין בעבירה של החזקה ונשיאה של נשק עליו להתחשב בנסיבות שבהן באה לידי ביטוי החומרה המיוחדת שבעבירה. בין היתר, ייתן בית-המשפט דעתו על סוג הנשק המוחזק שלא כדין, על כמותו, על התכלית שלשמה הוא מוחזק ועל הסכנה המוחשית שיעשה בו ... כאשר מדובר בנשק שעל-פי טיבו אינו מיועד להגנה עצמית, וכל כולו נשק התקפי רב עוצמה אשר השימוש בו יכול להביא להרג ללא הבחנה, יש בעבירת ההחזקה והנשיאה של אותו נשק חומרה מיוחדת."" (ראו ע""פ 1332/04  פס נ' מדינת ישראל, פ""ד נח(5) 541, 544 (2004).",גזירת הדין:
"ת""פ 5000-12","יוער כאן כי בפסק דין חסן הורשעו שני נאשמים ע""פ הודאתם בעבירות של החזקת נשק, נשיאה והובלת נשק וסחר בנשק.",גזירת הדין:
"ת""פ 5000-12","בימ""ש המחוזי קבע מתחם ענישה הולם, בעבירות הנשק, שנע בין 1 עד  4 שנות מאסר וכן קבע מתחם לפי מדיניות הענישה הנוהגת, שנע בין 10 עד 27 חודשי מאסר.",גזירת הדין:
"ת""פ 5000-12","בימ""ש העליון קבע כי:",גזירת הדין:
"ת""פ 5000-12","עוד ראוי לציין, כי לא נעלמה מעיני גם פסיקתו האחרונה של בית משפט העליון בע""פ 318/11 מדינת ישראל נגד אבו ערב (ניתנה ביום 5.12.11), שם קבעה השופטת א' חיות כי:",גזירת הדין:
"ת""פ 5000-12","יחד עם זאת, נסיבות המקרה שלפנינו שונות הן מהותית מהמקרים הנ""ל. כך שבענייננו, לא מיוחסות לנאשם עבירות סחר בנשק, אלא רק נשיאת והובלת נשק. מה גם המדובר בנאשם יליד 1991, שזו לו מעורבותו הראשונה בפלילים, הודה בעבירה והביע חרטה.",גזירת הדין:
"ת""פ 5000-12","לאחר שבחנתי את טענות הצדדים ובהתחשב במכלול הנסיבות ובעיקר, סוג וכמות הנשק (אקדח ומחסנית ללא כדורים), הרקע הנורמטיבי של משפחת הנאשם, עברו הפלילי הנקי, גילו הצעיר, מעצרו כחודש ימים בתיק דנן, הודאתו המידית, לקיחת האחריות ותסקיר שירות המבחן החיובי; נראה לי כי הפעם הנאשם הפנים את הפסול שבהתנהגותו ולמד לקח מהסתבכותו הראשונה ולכן החלטתי לחרוג לקולה ממתחם הענישה ההולם וזאת משיקולים שבטובת האינטרס הציבורי והוא שיקום הנאשם, ועל מנת לאפשר לו לעלות על דרך המלך, כאשר שליחתו למאסר מאחורי סורג ובריח עלולה לפגוע באורחות חייו הנורמטיביות והפנמת נורמות עברייניות, במידה ויהיה במגע עם אסירים אחרים.",גזירת הדין:
"ת""פ 5000-12","לעיין חשיבות הפן השיקומי של נאשמים ובמיוחד כשמדובר בקטינים ראו ע""פ 6914/10 פלוני נגד מדינת ישראל (ניתן ביום 27.2.12), שם ננקט צעד טיפולי בגדרי ערעור, כאשר שירות המבחן המליץ על כך. ראו גם פסק דין שניתן לאחרונה בע""פ 1131/13 פלוני נגד מדינת ישראל (ניתן ביום 12.6.13), שם נדחה ערעור על החלטת בימ""ש המחוזי לנוער לבטל צו מבחן וצו שירות לתועלת הציבור שנגזרו על הנאשם בגין ביצוע עבירות מין חמורות והשית עליו מאסר בפועל וזאת נוכח מעשיו החמורים של הנאשם ונוכח העדר המלצה טיפולית של שירות המבחן לנוער ולאחר שתקופת שיקום ארכה לא הועילה.  שם קבע בימ""ש העליון כי:",גזירת הדין:
"ת""פ 5000-12","""המחוקק חפץ בשיקום קטינים (חוק הנוער (שפיטה, ענישה ודרכי טיפול) תשל""א-1971), ובודאי ובמיוחד בעקבות תיקונו מתשס""ח; שמו של החוק מעיד עליו. בית משפט זה מצווה מפי המחוקק ונותן ידו תדיר למאמצי השיקום (וראו בין השאר פסק הדין בע""פ 49/09 מדינת ישראל נ' פלוני [פורסם בנבו] (2009) בחוות דעתו של השופט דנציגר). ואולם, כבר נאמר לא אחת כי קטינים אינם חסינים ממאסר...""",גזירת הדין:
"ת""פ 5000-12","לאחר ששקלתי ונתתי דעתי למכלול השיקולים והנסיבות שפורטו לעיל לקולה ולחומרה ומבלי להתעלם מחומרת העבירה, ובהתחשב בהמלצת שירות המבחן, אני רואה שלא למצות את הדין עם הנאשם שבפני ומחליט לגזור עליו את העונשים הבאים:",גזירת הדין:
"ת""פ 5000-12","ששה חודשי מאסר בפועל אשר ירוצו בעבודות שירות, אם ימליץ על כך הממונה על עבודות השירות.",גזירת הדין:
"ת""פ 5000-12","18 חודשי מאסר על תנאי, כשהתנאי הוא, שהנאשם לא יישא עונש זה אלא אם, תוך 3 שנים, יעבור עבירה בה הורשע, ויורשעו עליה בדין.",גזירת הדין:
"ת""פ 5000-12","אני מחייב את הנאשם לשלם קנס כספי בסך 3,000 ש""ח, או 30 ימי מאסר תמורתו. הקנס ישולם בשלושה תשלומים שווים ורצופים, כאשר הראשון יהיה תוך 30 יום מיום סיום ריצוי עונש המאסר.",גזירת הדין:
"ת""פ 5000-12","על הנאשם לחתום על התחייבות להימנע מעבירה על סך של 10,000 ₪ ולמשך שנתיים.",גזירת הדין:
"ת""פ 5000-12",הנאשם יועמד למבחן בפיקוח שירות המבחן למשך שנה ממועד סיום ריצוי העונש במסגרת עבודות השירות,גזירת הדין:
"ת""פ 5000-12","בנסיבות אלו על הממונה להגיש את חוות דעתו עובר למועד שיקבע להלן. הממונה יוכל לזמן את הנאשם לראיון באמצעות בא כוחו עו""ד אברהים כנאענה טלפון נייד 0508917798, טלפון 04-6749753 או בפקס 04-6747555 וטלפון של הנאשם 0507661114.",גזירת הדין:
"ת""פ 5000-12","אני קובע ישיבה נוספת ליום  24.7.13, שעה 12:00.",גזירת הדין:
"ת""פ 5000-12",המזכירות תמציא לשירות המבחן ולממונה על עבודות השירות עותק מגזר הדין.,גזירת הדין:
"ת""פ 5000-12","הוסברה לנאשם חובתו להתייצב לדיון הנ""ל ולשתף פעולה עם הממונה על עבודות שירות.",גזירת הדין:
"ת""פ 5000-12","5129371ניתן היום,  ט""ז תמוז תשע""ג, 24 יוני 2013, במעמד ב""א המאשימה, עו""ד הילה כץ, הנאשם בעצמו ובא כוחו עו""ד א. כנאענה.",גזירת הדין:
"ת""פ 5000-12","בעניין עריכה ושינויים במסמכי פסיקה, חקיקה ועוד באתר נבו – הקש כאן",כמאל סעב 54678313-5000/12
