verdict,text,part
"ת""פ 41228-03-18","בהקשר לכך, דיפלומטים כמו גם קונסולים נהנים ממעמד מיוחד במדינה בה הם משרתים. מעמד מיוחד זה נשמר גם כאשר מדובר בכאלה המשרתים באזורי מלחמה או כאלה המאופיינים במתיחות ביטחונית. ההכרה בחשיבות עבודתם של דיפלומטים ועובדי קונסוליה הביאה לכך, שעל דרך הכלל אלה אף נהנים מחסינות מפני העמדה לדין. כגודל המעמד והאמון, כך גם החומרה הנלווית להפרתם.",דיון והכרעה
"ת""פ 41228-03-18","הניצול הציני שעשה הנאשם במעמדו כעובד קונסוליה יש בו מבחינה פוטנציאלית לפגוע גם במרקם מערכת היחסים שבין המדינה לבין עובדי קונסוליה המשרתים בה. כך למשל, יכול ובעקבות מעשים כדוגמת אלה של הנאשם, הבדיקות הפיזיות שתערכנה בעתיד לרכבים קונסולריים היוצאים ונכנסים מעזה ומשטחי איו""ש תהיינה מדוקדקות יותר.",דיון והכרעה
"ת""פ 41228-03-18","לכל אלה יש להוסיף שבתמורה לחלקו, הנאשם קיבל 26,000 ₪, סכום כסף לא מבוטל הרחוק מלהיות צנוע כפי שנטען על ידי ההגנה.",דיון והכרעה
"ת""פ 41228-03-18","יש בכל המפורט לעיל, כדי ללמד שהעונש המוסכם בין הצדדים של שבע שנות מאסר, גם אם אינו קל בפני עצמו יש בו כדי להקל עם הנאשם ואף הקלה משמעותית.",דיון והכרעה
"ת""פ 41228-03-18","הגם כך, אכבד את ההסדר, וזאת מהטעמים הבאים.",דיון והכרעה
"ת""פ 41228-03-18","ראשית, מדובר בנאשם שהודה במרבית המיוחס לו. גם אם הודאה זו, הגיעה לאחר שמיעתם של חלק מהראיות, עדיין יש בהודאה זו משום חסכון בזמן שיפוטי יקר נוכח רשימת עדי התביעה הארוכה, ופרשת ההגנה שצפויה הייתה לכלול זימונם של חוקרי שב""כ על המשמעויות הנגזרות מכך.",דיון והכרעה
"ת""פ 41228-03-18",להודעה זו נלווים גם חרטה ונטילת אחריות. הדברים מוצאים ביטויים לא רק באמירות של הנאשם אלא גם באופן שבו זה כפי הנלמד שיתף פעולה עם חוקריו כבר בראשיתה של החקירה. נטען כי זה פירט את חלקו והוסיף אף מעבר למה שנשאל. בכך סייע הנאשם למצות את הדין ולקבל תמונה ראייתית ברורה ביחס למכלול ההתארגנות העבריינית.,דיון והכרעה
"ת""פ 41228-03-18",משקל לא מבוטל יש לתת לכך שהנאשם לא פעל מתוך מניעים אידיאולוגיים או מתוך כוונה לפגוע בביטחון המדינה. הדברים אמורים גם אם מבחינה פוטנציאלית מעשים שכאלה יכולים להוביל לפגיעה שכזו. הנאשם לא היה מעורב בכל דרך שהיא בסחר שנעשה בהמשכם של דברים באותם נשקים וממילא גם לא קיבל את התמורה בגין אותו סחר.,דיון והכרעה
"ת""פ 41228-03-18","מדובר בנאשם צעיר נעדר עבר פלילי, בן  24 שזוהי לו הסתבכותו הראשונה בפלילים. כפי הנלמד מטיעוני ההגנה וכך מאסופת המסמכים שהוגשה לביהמ""ש הנאשם ניהל אורח חיים נורמטיבי היה אהוד ומקובל על סביבתו ואף התנדב ככבאי בקהילה שבה גדל. מאפיינים אלו, מעבר למשמעותם הבסיסית מובילים לכך שלמעצרו כמו גם למאסרו לראשונה בחייו אפקט מרתיע.",דיון והכרעה
"ת""פ 41228-03-18","הנאשם ללא משפחה או חברים בארץ. הנאשם דובר צרפתית ובפיו אנגלית רצוצה. משכך, בהעדר מעטפת משפחתית תומכת לצד קשיי תקשורת ושפה, מעצרו ומאסרו קשים אף יותר מאשר על דרך הכלל.",דיון והכרעה
"ת""פ 41228-03-18","גם אם מדובר בעונש מקל, בסופם של דברים, המדובר בתקופת מאסר לא קצרה שעומדת בהלימה עם עונשים שנגזרו על מעורבים אחרים תוך ביצוע האבחנה מתבקשת בשים לב לחלקו של הנאשם. ההסדר הושג לאחר הליך גישור שהתקיים בפני כב' ס.הנשיאה  השופט צלקובניק ומשכך, מגלם בתוכו את אינטרס הסתמכות של הצדדים, ככלל, ושל הנאשם בפרט.",דיון והכרעה
"ת""פ 41228-03-18","אשר לגובה הקנס, בשים לב לתמורה אותה קיבל הנאשם בגין מעשיו, בשים לב לקנסות שהוטלו על מעורבים אחרים, הגעתי לכלל מסקנה כי גם אם הנאשם אינו מגיע ממשפחה אמידה, מן הראוי שזה יהיה לכל הפחות בגובה התמורה הכספית אותה קיבל בגין מעשיו ואף מעט מעבר לה.",דיון והכרעה
"ת""פ 41228-03-18","טרם סיום, יש מקום לחזור על ההלכה הידועה ולפיה, בתי משפט יכבדו הסדרי טיעון וחריגה מהם תהיה במקרים יוצאי דופן וזאת כאמור בע""פ 1958/98 פלוני נ' מדינת ישראל: ",דיון והכרעה
"ת""פ 41228-03-18","בנוסף על כל אלה, הסדר טיעון מסייע לנפגע העבירה בהביאו בחשבון את הצורך",דיון והכרעה
"ת""פ 41228-03-18","דברים אלה יפים, ואף ביתר שאת למקרה שבפני, ומכאן גם החלטת בית משפט לכבד את ההסדר.","בשיקומו המהיר ובמניעת פגיעה נוספת בו עקב העדתו"". "
"ת""פ 41228-03-18","סוף דבר,  מכל המקובץ לעיל, הריני לגזור על הנאשם 1 את העונשים הבאים.","בשיקומו המהיר ובמניעת פגיעה נוספת בו עקב העדתו"". "
"ת""פ 41228-03-18","7 שנים מאסר בפועל שימנו מיום מעצרו, 15.02.18.","בשיקומו המהיר ובמניעת פגיעה נוספת בו עקב העדתו"". "
"ת""פ 41228-03-18","6 חודשים מאסר על תנאי למשך 3 שנים מיום שחרורו, שלא יעבור עבירות נשק או עבירות לפי פרק יא' סימן ו' לחוק העונשין מסוג עוון.","בשיקומו המהיר ובמניעת פגיעה נוספת בו עקב העדתו"". "
"ת""פ 41228-03-18","12 חודשים מאסר על תנאי למשך 3 שנים מיום שחרורו שלא יעבור עבירות נשק או עבירות לפי פרק יא' סימן ו' לחוק העונשין, מסוג פשע.","בשיקומו המהיר ובמניעת פגיעה נוספת בו עקב העדתו"". "
"ת""פ 41228-03-18","30,000 ₪ קנס או 100 ימי מאסר תמורתו. הקנס ישולם ב-15 תשלומים חודשיים שווים ורצופים החל מיום 1.6.19.","בשיקומו המהיר ובמניעת פגיעה נוספת בו עקב העדתו"". "
"ת""פ 41228-03-18","5129371ניתנה והודעה היום ג' ניסן תשע""ט, 08/04/2019 במעמד הנוכחים. ",<#3#>
"ת""פ 41228-03-18",512937154678313הוקלד על ידי אילנית רוימי,5129371 
"ת""פ 41228-03-18","בעניין עריכה ושינויים במסמכי פסיקה, חקיקה ועוד באתר נבו – הקש כאן",54678313
"ת""פ 41228-03-18",דניאל בן טולילה 54678313-/,54678313
