verdict,text,part
"ת""פ 39341-05-16","חומרת מעשיו של הנאשם 2 נובעת משני נתונים – הראשון, כוונתו לצאת לסוריה. אלמלא נעצר בשדה התעופה היה מממש את כוונתו. לא זו אף זו – גם לאחר שיציאתו נמנעה על ידי השלטונות, המשיך הנאשם במעשיו במסגרת הארגון. הדבר מעיד על מסוכנותו ועל כי דבר אינו עוצר אותו. אם לא די בכך, מעשיו לצורך רכישת נשק – והכל כדי לבצע פיגועים בתוך מדינת ישראל, מעידים כי טענותיו כאילו מצבם של אזרחי סוריה הוא זה שעמד בראש מעיניו, אין בהן דבר וכי עומד בפנינו מי שחתר במעשים של ממש לפגוע באזרחי מדינת ישראל. איני סבור כי מגיעה לנאשם זה הקלה כלשהי מעבר לרף העליון של הסדר הטווחים שהושג בעניינו.",	דיון ומסקנות
"ת""פ 39341-05-16","הוא הדין בעניינו של הנאשם 6. מדובר במי שהינו מבוגר מיתר הנאשמים, בן 31, שריצה בעבר עונש מאסר של 21 חודשים בעבירה שהרקע לה הוא בטחוני מובהק. עמדתי לעיל על פרטי הרשעתו הקודמת לפני כעשור. אז, תכנן הנאשם להקים חוליה שתבצע פעילות צבאית שמטרתה ביצוע פיגועי טרור בתוך מדינת ישראל ולשם כך ביצע פעולות של ממש כולל חבירה לחולית טרור; וגם כיום חבר הנאשם לארגון איסלאמי קיצוני ורצחני שבין מטרותיו השמדת מדינת ישראל ורצח אזרחים. מדובר, כך עולה, במי שאוחז בעמדות קיצוניות ומסוכנות ואף עושה מעשים של ממש על רקע זה. גם בנוגע לנאשם זה איני סבור כי הוא זכאי להקלה כלשהי מעבר (או מתחת) לרף העליון של טווח הענישה המוסכם אליו הגיעו הצדדים, אשר אף הוא, חרף העובדה כי מדובר בטווח ראוי, מקל למדי בעניינו.",	דיון ומסקנות
"ת""פ 39341-05-16","ביחס לנאשמים 3 ו 4 סבורני כי שקלול כלל הנתונים והשיקולים מוביל למסקנה כי אין מקום, מחד, למצות איתם את הדין (במסגרת הטווחים אותם אימצתי), קרי – אין מקום להעמיד את עונשם על הרף המקסימאלי; ומנגד, לנוכח חומרת מעשיהם אין אף מקום להעמידו ברף התחתון. מדובר בנאשמים שקיבלו אחריות על מעשיהם, התרשמות שירות המבחן מהם היתה, ככלל, חיובית. לא התעלמתי מהאמור בעניינו של הנאשם 4, אך נתתי דעתי לנתונים שעלו בדברי העד בעניינו ולכוונתו לפתוח דף חדש עם שחרורו. לכן, אני סבור כי יש להעמיד את עונשם במחצית הטווח אליו הסכימו הצדדים.",	דיון ומסקנות
"ת""פ 39341-05-16","בעניינו של הנאשם 5, אשר הטווח בעניינו היה זהה לזה שנקבע בעניינם של הנאשמים 3 ו 4, סבורני כי ניתן להקל עמו במקצת ביחס אליהם וזאת משום חלקו הקטן באופן יחסי – עיקר ""פועלו"" התמצה בעצם הימצאותו במפגשים. עוד אפנה לכך כי הלה עבר לאילת והחל את התמחותו ברוקחות עוד טרם מעצרו, נתון שיש בו להעיד כי לא היה נטוע בהווי הארגון. בנוסף, אפנה בעניינו להתרשמות החיובית אודותיו מצד שירות המבחן. לכן, סברתי שיש להעמיד את עונשו על 2.5 שנות מאסר.",	דיון ומסקנות
"ת""פ 39341-05-16","סוף דבר, אני גוזר על הנאשמים את העונשים הבאים:",	דיון ומסקנות
"ת""פ 39341-05-16","אני גוזר על הנאשם עונש של 6 שנות מאסר בפועל, וזאת בניכוי תקופת מעצרו – החל מתאריך 27.11.14 ועד היום.",בעניינו של הנאשם 2
"ת""פ 39341-05-16","הנני דן את הנאשם למאסר לתקופה של 12 חודשים, וזאת על תנאי למשך שלוש שנים מיום שחרורו, והתנאי הוא כי הנאשם לא יעבור עבירה נגד ביטחון המדינה מסוג פשע או עבירת נשק מסוג פשע.",בעניינו של הנאשם 2
"ת""פ 39341-05-16","אני גוזר על הנאשם עונש של 3 שנות מאסר בפועל, וזאת בניכוי תקופת מעצרו מאחורי סורג ובריח – מתאריך 10.12.14 ועד 25.4.16.",בעניינו של הנאשם 3 
"ת""פ 39341-05-16","הנני דן את הנאשם למאסר לתקופה של 12 חודשים, וזאת על תנאי למשך שלוש שנים מיום שחרורו, והתנאי הוא כי הנאשם לא יעבור עבירה נגד ביטחון המדינה מסוג פשע.",בעניינו של הנאשם 3 
"ת""פ 39341-05-16","אני גוזר על הנאשם עונש של 3 שנות מאסר בפועל, וזאת בניכוי תקופת מעצרו – החל מתאריך 8.12.14.",בעניינו של הנאשם 4
"ת""פ 39341-05-16","הנני דן את הנאשם למאסר לתקופה של 12 חודשים, וזאת על תנאי למשך שלוש שנים מיום שחרורו, והתנאי הוא כי הנאשם לא יעבור עבירה נגד ביטחון המדינה מסוג פשע.",בעניינו של הנאשם 4
"ת""פ 39341-05-16","אני גוזר על הנאשם עונש של 2.5 שנות מאסר בפועל, וזאת בניכוי תקופת מעצרו מאחורי סורג ובריח – החל מתאריך 18.12.14 ועד 29.2.16.",בעניינו של הנאשם 5
"ת""פ 39341-05-16","הנני דן את הנאשם למאסר לתקופה של 12 חודשים, וזאת על תנאי למשך שלוש שנים מיום שחרורו, והתנאי הוא כי הנאשם לא יעבור עבירה נגד ביטחון המדינה מסוג פשע.",בעניינו של הנאשם 5
"ת""פ 39341-05-16","אני גוזר על הנאשם עונש של 4.5 שנות מאסר בפועל, וזאת בניכוי תקופת מעצרו – החל מתאריך 17.12.14.",בעניינו של הנאשם 6
"ת""פ 39341-05-16","הנני דן את הנאשם למאסר לתקופה של 12 חודשים, וזאת על תנאי למשך שלוש שנים מיום שחרורו, והתנאי הוא כי הנאשם לא יעבור עבירה נגד ביטחון המדינה מסוג פשע.",בעניינו של הנאשם 6
"ת""פ 39341-05-16","הנאשמים 3 ו 5, אשר מצויים במעצר באיזוק אלק', יתייצבו לריצוי מאסרם בבית מעצר גלבוע בתאריך 30.9.16 עד השעה 10:00, או על פי החלטת שב""ס, כשברשותם תעודת זהות או דרכון. על הנאשמים לתאם את הכניסה למאסר, כולל האפשרות למיון מוקדם, עם ענף אבחון ומיון של שב""ס, טלפונים: 08-9787377, 08-9787336.",בעניינו של הנאשם 6
"ת""פ 39341-05-16","המזכירות תשלח עותק מגזר הדין לשב""ס וכן ליחידת האיזוק האלק'.",זכות ערעור תוך 45 לבית המשפט העליון.
"ת""פ 39341-05-16","ניתן היום,  ה' אלול תשע""ו, 08 ספטמבר 2016, בהעדר הצדדים.",54678313
"ת""פ 39341-05-16",נוסח מסמך זה כפוף לשינויי ניסוח ועריכה,יחיאל ליפשיץ 54678313
"ת""פ 39341-05-16","בעניין עריכה ושינויים במסמכי פסיקה, חקיקה ועוד באתר נבו – הקש כאן",יחיאל ליפשיץ 54678313
