verdict,text,part
"ת""פ 40922-11-15","תיק חיצוני: פמ""צ 4041/15   ","ת""פ 40922-11-15 מדינת ישראל נ' עוביד זועבי(עציר) ואח'"
"ת""פ 40922-11-15","תיק חיצוני: פמ""צ 4041/15   ","ת""פ 40922-11-15 מדינת ישראל נ' עוביד זועבי(עציר) ואח'"
"ת""פ 40922-11-15",לפני כבוד השופט סאאב דבור ,"ת""פ 40922-11-15 מדינת ישראל נ' עוביד זועבי(עציר) ואח'"
"ת""פ 40922-11-15",לפני כבוד השופט סאאב דבור ,"ת""פ 40922-11-15 מדינת ישראל נ' עוביד זועבי(עציר) ואח'"
"ת""פ 40922-11-15",.1 ויסאם עוביד זועבי (עציר),הנאשמים
"ת""פ 40922-11-15",.2 מוחמד עוביד זועבי (עציר),הנאשמים
"ת""פ 40922-11-15",.3 מוחמד זועבי (עציר),הנאשמים
"ת""פ 40922-11-15",.4 דיב עוביד זועבי (עציר),הנאשמים
"ת""פ 40922-11-15","מטעם המאשימה: עו""ד אור לרנר.",נוכחים:
"ת""פ 40922-11-15","מטעם הנאשמים: עו""ד אבו נסאר ועו""ד שינו.",נוכחים:
"ת""פ 40922-11-15",הנאשמים: בעצמם (הובאו על ידי הליווי),נוכחים:
"ת""פ 40922-11-15","הנאשמים 2 ו 3: אנו מצהירים, כי אין אנו מחזיקים ברישיון נהיגה מכל סוג שהוא",נוכחים:
"ת""פ 40922-11-15","חוק העונשין, תשל""ז-1977: סע'  29, 31, 40ג, 40ו, 40ז, 40ט, 144(א), 144(ב), 144(ב2), ג(1), 40יא, 40יא (8), 40יג(א), 415, 499(א)(1)",חקיקה שאוזכרה: 
"ת""פ 40922-11-15","פקודת התעבורה [נוסח חדש]: סע'  10(א), 62(1)",חקיקה שאוזכרה: 
"ת""פ 40922-11-15","פקודת ביטוח רכב מנועי [נוסח חדש], תש""ל-1970: סע'  2",חקיקה שאוזכרה: 
"ת""פ 40922-11-15","פקודת סדר הדין הפלילי (מעצר וחיפוש) [נוסח חדש], תשכ""ט-1969: סע'  39, 39(א)",חקיקה שאוזכרה: 
"ת""פ 40922-11-15","בדיון מיום 01.05.16, הודיעו הצדדים על הסדר טיעון אליו הגיעו ואשר לפיו, חזרו בהם הנאשמים מכפירתם, כתב האישום תוקן כמופיע בכתב האישום אשר הוגש וסומן כא/1, הנאשמים הודו בעובדות כתב האישום המתוקן ובהתאם, הורשעו בביצוע העבירות המיוחסות להם.",הקדמה
"ת""פ 40922-11-15","בהתאם להסדר הטיעון, הוסכם בין הצדדים, באשר לנאשם 1, על הטלת עונש מאסר בן 45 חודשים והפעלת עונש המאסר המותנה בן 10 חודשים העומד ותלוי נגדו, ואשר הוטל במסגרת תיק פלילי 18812-08-12 של בית המשפט השלום בנצרת, חלק בחופף וחלק במצטבר כך שסך הכל יוטלו על נאשם זה 50 חודשי מאסר בפועל. בנוסף, יוטלו עונשים נלווים לפי שיקול דעתו של בית המשפט. ",העונש המוסכם
"ת""פ 40922-11-15","המאשימה טענה לגבי נאשמים 2 ו-4 למתחם בין שנה לשנתיים, כאשר, בנוגע לנאשמים אלה, ההגנה טענה באופן חופשי.",העונש המוסכם
"ת""פ 40922-11-15","לגבי הנאשם 3, הוסכם כי יוטל עליו עונש מאסרבפועל בן 5 שנים ועונשים נלווים, כפי שיקול דעתו של בית המשפט.",העונש המוסכם
"ת""פ 40922-11-15","בהתאם לעובדות כתב האישום המתוקן, במהלך האירועים נשוא כתב אישום זה, שימש נעים הרון סביחי, סוכן משטרתי (להלן: ""הסוכן""), לשם ביצוע עסקאות אמל""ח עם הנאשמים.",מבוא:
"ת""פ 40922-11-15",בין הסוכן ובין הנאשמים קיימת היכרות מוקדמת. ,מבוא:
"ת""פ 40922-11-15","לקראת, ובמהלך האירועים נשוא כתב האישום, התנהלה כל התקשורת בין הסוכן ובין הנאשם 1 באמצעות הטלפון בלבד. בשיחות אלה הציע הנאשם 1 לסוכן לרכוש ממנו סוגי אמל""ח שונים ורקם איתו את פרטי העסקה, ובכלל זה את סוג האמל""ח שיימכר לסוכן ואת מחירו. משהבשילו העסקאות, ונסגרו פרטיהן, קשר הנאשם 1 קשר עם נאשמים 2, 3 ו- 4, במסגרתו ""שיגר"" הנאשם 1 את יתר הנאשמים להוציא את העסקאות אל הפועל, למסור את האמל""ח לסוכן ולקבל את התשלום עבורו, הכל כפי המפורט במסגרת כתב האישום המתוקן והמשתרע על פני שלושה אישומים שונים.",מבוא:
"ת""פ 40922-11-15","מעובדות כתב האישום עולה, כי ביום 2.9.2015 בשעות הצהריים, התקשר הנאשם 1 אל הסוכן והציע לו לקנות ממנו אקדח מסוג F.N (להלן:""האקדח"") בתמורה ל- 20,000 ש""ח.","אישום ראשון (לגבי נאשמים 1, 2 ו- 3):"
"ת""פ 40922-11-15","ביום 6.9.2016 שב והתקשר הנאשם 1 אל הסוכן, מספר פעמים, על מנת לסגור את פרטי עסקת מכירת האקדח. במהלך השיחות סיכמו ביניהם כי תמורת האקדח ישלם הסוכן סכום של 19,000 ש""ח, וכי המכירה תתבצע למחרת, בסיוע הנאשמים 2-4. בהמשך, סיכם הנאשם 1 עם הסוכן, כי יצור קשר עם הנאשם 3 לצורך ביצוע העסקה.","אישום ראשון (לגבי נאשמים 1, 2 ו- 3):"
"ת""פ 40922-11-15","למחרת, ביום 7.9.2015, סמוך לשעה 16:30, פגש הנאשם 3 את הסוכן בתחנת הדלק שבצומת הכניסה לכפר נין (להלן: ""תחנת הדלק""). הנאשם 3 הגיע למקום, רכוב על קטנוע, שעה שאין בידו רשיון נהיגה בתוקף וללא ביטוח, והשניים נסעו אל חוות הסוסים השייכת למשפחתם של הנאשמים בכפר נין.","אישום ראשון (לגבי נאשמים 1, 2 ו- 3):"
"ת""פ 40922-11-15","השניים ירדו בחוות הסוסים, והנאשם 3 הלך להביא את האקדח. כעבור דקות ספורות הגיע אל החווה נאשם 2, רכוב אף הוא על קטנוע, כשאף הוא אינו מחזיק ברשיון נהיגה תקף וללא ביטוח. נאשם 3 חזר ומסר לסוכן אקדח מסוג F.N שמספרו C09326 ובתוכו מחסנית תואמת ו- 10 כדורי 9 מ""מ. בתמורה, מסר הסוכן לנאשם 2 סכום של 19,000 ש""ח, הנאשם 2 ספר את הכסף והסוכן בדק את האקדח. משנסתיימו הבדיקות, הסיע הנאשם 2 את הסוכן חזרה לתחנת הדלק.","אישום ראשון (לגבי נאשמים 1, 2 ו- 3):"
"ת""פ 40922-11-15","סחר בנשק ותחמושת, עבירה לפי סעיף 144(ב2) +ג(1) + 29 לחוק העונשין, התשל""ז -1977 (להלן: ""חוק העונשין"");","בהתאם לאישום זה, יוחסו לנאשם 1 עבירות אלה:"
"ת""פ 40922-11-15","החזקת נשק ותחמושת, עבירה לפי סעיף 144(א) רישא +סיפא + 29 לחוק העונשין;","בהתאם לאישום זה, יוחסו לנאשם 1 עבירות אלה:"
"ת""פ 40922-11-15","קשירת קשר לביצוע פשע, עבירה לפי סעיף 499(א)(1) לחוק העונשין.","בהתאם לאישום זה, יוחסו לנאשם 1 עבירות אלה:"
"ת""פ 40922-11-15","סיוע לסחר בנשק ותחמושת, עבירה לפי סעיף 144(ב2) +ג(1) +31 לחוק העונשין;",לנאשם 2 יוחסו עבירות אלה:
"ת""פ 40922-11-15","סיוע להחזקת נשק ותחמושת, עבירה לפי סעיף  144(א) רישא +סיפא + 31 לחוק העונשין;",לנאשם 2 יוחסו עבירות אלה:
"ת""פ 40922-11-15","קשירת קשר לביצוע פשע, עבירה לפי סעיף 499(א)(1) לחוק העונשין.",לנאשם 2 יוחסו עבירות אלה:
"ת""פ 40922-11-15","נהיגה ללא רישיון, עבירה לפי סעיף 10(א) בצירוף סעיף 62(1) לפקודת התעבורה;",לנאשם 2 יוחסו עבירות אלה:
"ת""פ 40922-11-15","נהיגה ללא פוליסת ביטוח בת תוקף, עבירה לפי סעיף 2 לפקודת ביטוח רכב מנועי.",לנאשם 2 יוחסו עבירות אלה:
"ת""פ 40922-11-15","סחר בנשק ותחמושת, עבירה לפי סעיף 144(ב2) +ג(1) + 29 לחוק העונשין;",ולנאשם 3 יוחסו עבירות אלה:
"ת""פ 40922-11-15","נשיאת נשק ותחמושת, עבירה לפי סעיף 144(ב) רישא + סיפא לחוק העונשין;",ולנאשם 3 יוחסו עבירות אלה:
"ת""פ 40922-11-15","החזקת נשק ותחמושת, עבירה לפי סעיף 144(א) רישא +סיפא + 29 לחוק העונשין;",ולנאשם 3 יוחסו עבירות אלה:
"ת""פ 40922-11-15","קשירת קשר לביצוע פשע, עבירה לפי סעיף 499(א)(1) לחוק העונשין.",ולנאשם 3 יוחסו עבירות אלה:
"ת""פ 40922-11-15","נהיגה ללא רישיון, עבירה לפי סעיף 10(א) בצירוף סעיף 62(1) לפקודת התעבורה;",ולנאשם 3 יוחסו עבירות אלה:
"ת""פ 40922-11-15","נהיגה ללא פוליסת ביטוח בת תוקף, עבירה לפי סעיף 2 לפקודת ביטוח רכב מנועי.",ולנאשם 3 יוחסו עבירות אלה:
"ת""פ 40922-11-15","בראשית חודש אוקטובר 2015, התקשר הנאשם 1 אל הסוכן והציע לו לקנות ממנו אקדח בתמורה ל- 23,000 ש""ח (להלן: ""העסקה"").","אישום שני (לגבי נאשמים 1, 3 ו- 4):"
"ת""פ 40922-11-15","ביום 12.10.2015 סיכם הנאשם עם הסוכן, בשיחה טלפונית, כי הסוכן ירכוש ממנו את האקדח, וכי העסקה תתבצע בדומה לעסקה הקודמת ביניהם, באמצעות הנאשם 3.","אישום שני (לגבי נאשמים 1, 3 ו- 4):"
"ת""פ 40922-11-15","ביום 13.10.2015 שוחח הסוכן עם הנאשמים 1 ו- 3 טלפונית, ותיאם עימם את מקום ביצוע העסקה, ואת המועד המדויק.","אישום שני (לגבי נאשמים 1, 3 ו- 4):"
"ת""פ 40922-11-15","בסמוך לשעה 14:00 הגיע הסוכן לצומת הכניסה לכפר נין (להלן: ""הצומת""), שם אסף אותו הנאשם 3 בקטנועו, כאשר הוא נוהג בו ללא רישיון נהיגה בתוקף וללא ביטוח.","אישום שני (לגבי נאשמים 1, 3 ו- 4):"
"ת""פ 40922-11-15","השניים נסעו לחוות הסוסים, שם המתין להם הנאשם 4. בהתאם לסיכום עם הנאשם 1, מסר הסוכן לנאשם 3 סך של 23,000 ש""ח, הנאשם 3 העביר לנאשם 4 את הכסף, והאחרון ספר אותו, ובתמורה, מסר לסוכן אקדח מסוג ""סטאר"" שמספרו 1607090 ובתוכו מחסנית תואמת. בתום העסקה הסיע הנאשם 3 את הסוכן חזרה לצומת, בקטנועו.","אישום שני (לגבי נאשמים 1, 3 ו- 4):"
"ת""פ 40922-11-15","סחר בנשק ותחמושת, עבירה לפי סעיף 144(ב2) +ג(1) + 29 לחוק העונשין;","בהתאם לאישום זה, יוחסו לנאשם 1 עבירות אלה:"
"ת""פ 40922-11-15","החזקת נשק ותחמושת, עבירה לפי סעיף 144(א) רישא +סיפא + 29 לחוק העונשין;","בהתאם לאישום זה, יוחסו לנאשם 1 עבירות אלה:"
"ת""פ 40922-11-15","קשירת קשר לביצוע פשע, עבירה לפי סעיף 499(א)(1) לחוק העונשין.","בהתאם לאישום זה, יוחסו לנאשם 1 עבירות אלה:"
"ת""פ 40922-11-15","סחר בנשק ותחמושת, עבירה לפי סעיף 144(ב2) +ג(1) + 29 לחוק העונשין;",לנאשם 3 יוחסו עבירות אלה:
"ת""פ 40922-11-15","נשיאת נשק ותחמושת, עבירה לפי סעיף 144(ב) רישא + סיפא לחוק העונשין;",לנאשם 3 יוחסו עבירות אלה:
"ת""פ 40922-11-15","החזקת נשק ותחמושת, עבירה לפי סעיף 144(א) רישא +סיפא + 29 לחוק העונשין;",לנאשם 3 יוחסו עבירות אלה:
"ת""פ 40922-11-15","קשירת קשר לביצוע פשע, עבירה לפי סעיף 499(א)(1) לחוק העונשין.",לנאשם 3 יוחסו עבירות אלה:
"ת""פ 40922-11-15","נהיגה ללא רישיון, עבירה לפי סעיף 10(א) בצירוף סעיף 62(1) לפקודת התעבורה;",לנאשם 3 יוחסו עבירות אלה:
"ת""פ 40922-11-15","נהיגה ללא פוליסת ביטוח בת תוקף, עבירה לפי סעיף 2 לפקודת ביטוח רכב מנועי.",לנאשם 3 יוחסו עבירות אלה:
"ת""פ 40922-11-15","סיוע לסחר בנשק ותחמושת, עבירה לפי סעיף 144(ב2) +ג(1) +31 לחוק העונשין;",ולנאשם 4 יוחסו עבירות אלה:
"ת""פ 40922-11-15","סיוע להחזקת נשק ותחמושת, עבירה לפי סעיף  144(א) רישא +סיפא + 31 לחוק העונשין;",ולנאשם 4 יוחסו עבירות אלה:
"ת""פ 40922-11-15","קשירת קשר לביצוע פשע, עבירה לפי סעיף 499(א)(1) לחוק העונשין.",ולנאשם 4 יוחסו עבירות אלה:
"ת""פ 40922-11-15","ביום 14.10.2015 התקשר הנאשם 1 לסוכן והציע לו לרכוש ממנו מטען חבלה (להלן: ""המטען"") בתמורה ל- 25,000-30,000 ש""ח (להלן: ""העסקה"").",אישום שלישי (לגבי נאשמים 1 ו- 3):
"ת""פ 40922-11-15","בין התאריכים 15-17.10.2015 ניהל הנאשם 1 מספר שיחות טלפון עם הסוכן, במהלכן נרקמו פרטי העסקה ונקבע כי הסוכן ישלם סך של 30,000 ש""ח תמורת המטען.",אישום שלישי (לגבי נאשמים 1 ו- 3):
"ת""פ 40922-11-15","ביום 18.10.2015 בסמוך לשעה 17:00 התקשר הנאשם 1 לסוכן והודיע לו, כי המטען מוכן, וכי על הסוכן ליצור קשר עם הנאשם 3 בהמשך אותו ערב, לשם ביצוע העסקה.",אישום שלישי (לגבי נאשמים 1 ו- 3):
"ת""פ 40922-11-15","בסמוך לשעה 21:00 הגיע הסוכן לצומת הכניסה לכפר נין (להלן: ""הצומת""), והנאשם 3 הגיע רכוב על קטנועו לאסוף אותו, כאשר הוא נוהג ללא רישיון בתוקף וללא ביטוח. הנאשם 3 והסוכן נסעו לחוות הסוסים, שם מסר הנאשם 3 לסוכן תיק ובו חפץ הנחזה להיות מטען ואמר לו כי החפץ הינו מטען חבלה מדגם C-4 800 גרם. בתמורה מסר לו הסוכן 30,000 ש""ח.",אישום שלישי (לגבי נאשמים 1 ו- 3):
"ת""פ 40922-11-15",בתום העסקה הסיע הנאשם 3 את הסוכן לצומת. מיד לאחר מכן פגש הסוכן את מפעילו ולמקום הוזעק חבלן לבדיקת המטען. בבדיקה התברר כי אין מדובר במטען.,אישום שלישי (לגבי נאשמים 1 ו- 3):
"ת""פ 40922-11-15","קבלת דבר במרמה, עבירה לפי סעיף 415 רישא +29 לחוק העונשין;","בהתאם לאישום זה, יוחסו לנאשם 1 עבירות אלה:"
"ת""פ 40922-11-15","קשירת קשר לביצוע פשע, עבירה לפי סעיף 499(א)(1) לחוק העונשין.","בהתאם לאישום זה, יוחסו לנאשם 1 עבירות אלה:"
"ת""פ 40922-11-15","קבלת דבר במרמה, עבירה לפי סעיף 415 רישא +29 לחוק העונשין;",ולנאשם 3 יוחסו עבירות אלה:
"ת""פ 40922-11-15","קשירת קשר לביצוע פשע, עבירה לפי סעיף 499(א)(1) לחוק העונשין;",ולנאשם 3 יוחסו עבירות אלה:
"ת""פ 40922-11-15","נהיגה ללא רישיון, עבירה לפי סעיף 10(א) בצירוף סעיף 62(1) לפקודת התעבורה;",ולנאשם 3 יוחסו עבירות אלה:
"ת""פ 40922-11-15","נהיגה ללא פוליסת ביטוח בת תוקף, עבירה לפי סעיף 2 לפקודת ביטוח רכב מנועי.",ולנאשם 3 יוחסו עבירות אלה:
"ת""פ 40922-11-15","הנאשמים כפרו תחילה בעבירות אשר יוחסו להם ובשלב יותר מאוחר חזרו בהם מכפירתם, הודו בעובדות כתב האישום המתוקן, כמפורט ברישא של פסק דין זה.",ולנאשם 3 יוחסו עבירות אלה:
"ת""פ 40922-11-15","במסגרת טיעוניה לעונש, הגישה המאשימה את גיליון העבר הפלילי והתעבורתי של הנאשמים. ב""כ המאשימה טענה לחומרת העבירות במיוחד עת מדובר בסחר באמל""ח לו פוטנציאל נזק רב. המדובר הוא בתופעה מסוכנת בשל הקלות בה הנשק יכול להגיע לידיים זדוניות, פליליות ו/או אף עויינות למדינה ובטחונה. הנאשמים 1 ו- 3 עסקו, כדבר שבשגרה, לשם בצע כסף, בסחר באמל""ח ו/או בסיוע לסחר שכזה. הם שימשו כרוח החיה, היוזמים והמבצעים העיקריים של העסקאות. הנאשמים 2 ו- 4 סייעו בידם לעשות כן.",טיעונים לעונש:
"ת""פ 40922-11-15","המאשימה הפנתה לפסיקה רלוונטית ממנה עולה, כי בעבירות של סחר בנשק, הנעשות באופן שיטתי, הטילו בתי המשפט עונשים הנעים בין 45-50 חודשי מאסר בפועל. ",טיעונים לעונש:
"ת""פ 40922-11-15","בטיעוניה ביחס לנאשם 1, הדגישה המאשימה, כי נאשם זה שימש כמעיין ממנו ינקו השורשים של כל העסקאות, כאשר הוא ביצע אותן מתוך חומות הכלא, תוך שהוא משוחח עם הסוכן מהטלפונים הציבוריים בכלא, וכן מפעיל את אחיו - הנאשמים 2 ו-4 - וקרוב משפחתו  - הנאשם 3 -, ומקשר ביניהם לבין הסוכן. לחובתו של נאשם 1, 16 הרשעות קודמות במגוון עבירות חמורות. ביחס לנאשם זה, עתרה המאשימה להשית עליו 50 חודשי מאסר בפועל, כאשר, כאמור לעיל, 45 חודשים מתוכם יוטלו בגין תיק זה ו- 5 חודשים יוטלו במצטבר בגין התנאי שיופעל. בנוסף, מבקשת המאשימה להטיל עליו מאסר על תנאי ארוך ומרתיע, וקנס משמעותי ביותר, לשיקול דעת בית המשפט.",טיעונים לעונש:
"ת""פ 40922-11-15","הנאשם 2, סייע באופן משמעותי בביצוע העסקה מושא האישום הראשון בכך שספר את הכסף והסיע את הסוכן חזרה לצומת כפר נין ועל כן איננו נחשב כמי שנמצא במעגל החיצוני של ההתרחשויות. נוסף על כך, נאשם זה נהג ללא רישיון נהיגה וללא ביטוח, דבר המסכן אף הוא את שלום הציבור; עברו הפלילי כולל 9 הרשעות קודמות בעבירות סמים, איומים, תקיפות שוטרים, הדחה בחקירה ועוד. בנוסף, לחובתו גם עבר בתחום התעבורתי. לדידי המאשימה, מתחם העונש ביחס לנאשם זה נע בין 12 ל- 24 חודשי מאסר בפועל, ובמסגרת שיקולי ההסדר המאשימה הגבילה את עצמה לטעון ל- 18 חודשי מאסר בפועל; זאת על אף קיומן של נסיבות המצדיקות את מיקום העונש בחלקו העליון של המתחם. לעניין חוות הדעת הפסיכיאטרית שהגיש ב""כ הנאשם 2, טוענת המאשימה כי אין לכך כל משמעות, משום שגם אם לפני 7 שנים נמצא הוא כמי שלא היה כשיר לעמוד לדין, אין בכך להעיד באשר למצבו הנפשי העדכני, ואף לא נטען בשום שלב לקושי נפשי עכשווי. גם אם הוגשה חוות הדעת לשם הוכחת הנסיבות המפורטות בסעיף 40ט לחוק העונשין, הרי שהמחוקק דורש קשר בין מצבו הנפשי של הנאשם לבין ביצוע העבירה. לא רק שלא הוכח כי הנאשם 2 סובל ממחלה נפשית כלשהי או מקושי נפשי אחר, הרי שלא הוכח ואף לא נטען כי קושי זה הוא הבסיס לביצוע העבירות. עבר פסיכיאטרי אף לא נמנה עם הנסיבות המפורטות בסעיף 40יא לחוק העונשין, והנסיבות לפי סעיף 40יא (8) לחוק העונשין יכולות להוות נסיבה לקולא רק ככל שהייתה להן השפעה על ביצוע העבירה. לפיכך, ולאור הנימוקים לעיל, מבקשת המאשימה שלא לייחס משקל לחוות הדעת שהוגשה.",טיעונים לעונש:
"ת""פ 40922-11-15","הנאשם 3, עושה דברו של הנאשם 1, והוא בבחינת המוציא לפועל את העסקאות. הוא עסק בסחר באמל""ח, במספר הזדמנויות, כמתואר בעובדות כתב האישום, לשם בצע כסף. בעברו 2 הרשעות קודמות בעבירות של חבלה חמורה כשהעבריין מזוין ואיומים, בגינן אף ריצה מאסרים. גם בעניינו, הוסכם על רכיב העונש - 5 שנות מאסר בפועל ועונשים נלווים. בנוסף עתרה המאשימה להטיל עליו עונש של מאסר על תנאי ארוך משמעותי ומרתיע, קנס, פסילה בפועל ופסילה על תנאי לאור עבירות התעבורה שביצע.",טיעונים לעונש:
"ת""פ 40922-11-15","הנאשם 4, סייע באופן מצומצם יותר מאשר נאשם 2, בעברו הפלילי 6 הרשעות בעבירות סמים, אך בניגוד לנאשם 2 לא הורשע הוא בעבירות של נהיגה ללא רשיון ו/או ביטוח ועל כן מבקשת המאשימה להשית עליו 16 חודשים מאסר בפועל, כשמתחם הענישה הוא 12-24 חודשי מאסר בפועל.",טיעונים לעונש:
"ת""פ 40922-11-15","עוד, ביקשה המאשימה לחלט כספים בסך 22,900 ₪ שנמצאו בתיק שחור בבית הנאשם 4. על פי האישום הראשון בו הודה הנאשם 2, סייע הוא בכך שקיבל את הכסף בסך  19,000 ש""ח לידיו וספר אותו. אף בזמן מעצרו באילת נתפסו בכספת בחדרו 4400 ₪, סכום שהמאשימה אינה מבקשת לחלט. אולם במסגרת האישום השני, שילם הסוכן לנאשמים סך של 23,000 ש""ח, הסכום הועבר לנאשם 4 אשר ספר אותו. כשבועיים לאחר מכן, נעצר הנאשם 4, ובחיפוש שנערך בביתו, נמצא בתוך תיק שחור, סכום של 22,920 ₪. נוכח סמיכות הזמנים בין מועד העסקה ובין מועד תפיסת הכסף, וההתאמה הכמעט מושלמת בין הסכום שנמסר לנאשם 4 והסכום שנתפס, מבקשת המאשימה לחלט סכום זה, וזאת מתוקף סעיף 39 לפקודת סדר הדין הפלילי (מעצר וחיפוש) [נוסח חדש], תשכ""ט- 1969. המאשימה מבקשת להדגיש כי סכום של 2800 ₪ נתפס בכיס מכנסיו של נאשם 4, ובנוסף מדגישה היא כי הנאשם 2 אינו מתגורר בבית בו נתפס הכסף. לטענת הנאשם 2, סך הכסף שנתפס הוא הסכום אותו קיבל מכספי חתונה ועל כן חציו שייך לאשתו. לגישת המאשימה כסף זה לא נתפס במעטפות ולא הובאה כל ראיה המלמדת שהכסף אכן מקורו במתנות החתונה, למעט מחברת (שלגביה, נטען ,כביכול, שהיא מכילה תיעוד של מתנות החתונה) המפרטת סכומים בעלמא המצטברים לסך של - 71,560 ₪. יודגש, כי, סכום זה אינו תואם לסכום הכסף שנתפס, וזאת בניגוד לסכום הקרוב להפליא שקיבל הנאשם 4 מהסוכן על-פי עובדות כתב האישום.",טיעונים לעונש:
"ת""פ 40922-11-15","בשונה מטענתו של הנאשם 2, הטעימה המאשימה, כי היא מעולם לא טענה כי הכסף שנתפס הינו כספי החתונה של נאשם 2. אלא כל שטענה הוא, שהגרסה לפיה - הכספים שייכים לאימו של הנאשם, אינה מתיישבת אף עם טענותיו של הנאשם 2 עצמו בהליכים הקודמים ואשר לפיה, הכסף הוא כספי חתונתו ומשכך שייך לו, ולא לאימו.",טיעונים לעונש:
