verdict,text,part
"ת""פ 40922-11-15","אני פוסל את הנאשם מלהחזיק ומלקבל רישיון נהיגה לתקופה של שנה מיום שחרורו ממאסר. על רקע הצהרת הנאשם כי אין הוא מחזיק ברישיון נהיגה כלשהו, המזכירות תנפיק לו אישור הפקדה מהיום.",הנאשם 2
"ת""פ 40922-11-15","אני דן את הנאשם למאסר לתקופה של 5 שנים, החל מיום מעצרו 2/11/15.",הנאשם 3
"ת""פ 40922-11-15","מאסר למשך 16 חודשים ואולם הנאשם לא יישא בעונש זה אלא אם יעבור בתוך שלוש שנים כל עבירת נשק מסוג פשע ו/או עבירה של קשירת קשר לביצוע פשע שנוגעת לעבירות בנשק, ויורשע בה בתקופת התנאי או אחריה.",הנאשם 3
"ת""פ 40922-11-15",מאסר למשך 12 חודשים ואולם הנאשם לא יישא בעונש זה אלא אם יעבור במשך שלוש שנים עבירה שענינה קשירת קשר לביצוע פשע (שלא בנוגע לעבירות בנשק) ו/או כל עבירת נשק מסוג עוון ויורשע בה בתקופת התנאי או אחריה.,הנאשם 3
"ת""פ 40922-11-15",מאסר למשך 7חודשים ואולם הנאשם לא יישא בעונש זה אלא אם יעבור במשך שנתיים עבירה שעניינה  נהיגה בזמן פסילה ו/או נהיגה ללא רישיון נהיגה (כאשר רישיון הנהיגה פג תקופה העולה על שנה וחצי או כאשר אין לנאשם כלל רישיון) ו/או עבירה של קבלת דבר במירמה ויורשע בה בתקופת התנאי או אחריה.,הנאשם 3
"ת""פ 40922-11-15","הנאשם ישלם קנס בסך של 20,000 ₪ או ארבעה חודשי מאסר תמורתו. הקנס ישולם בתוך 15 תשלומים חודשיים שויים ורצופים החל מיום 1/1/2017.",הנאשם 3
"ת""פ 40922-11-15","אני פוסל את הנאשם מלקבל ומלהחזיק רישיון נהיגה לתקופה של שנה. לאור הצהרת הנאשם כי אינו מחזיק ברישיון נהיגה מכל סוג שהוא, המזכירות תנפיק אישור הפקדה מהיום.",הנאשם 3
"ת""פ 40922-11-15","אני דן את הנאשם למאסר לתקופה של 14 חודשים, החל מיום מעצרו 2/11/15.",הנאשם 4 
"ת""פ 40922-11-15","מאסר למשך 10 חודשים ואולם הנאשם לא יישא בעונש זה אלא אם יעבור בתוך שנתיים עבירת נשק מסוג פשע ו/או סיוע לעבירה שכזו ו/או עבירה של קשירת קשר לביצוע פשע (בנוגע לביצוע עבירות בנשק), ויורשע בה בתקופת התנאי או אחריה.",הנאשם 4 
"ת""פ 40922-11-15","מאסר למשך 6 חודשים ואולם הנאשם לא יישא בעונש זה אלא אם יעבור במשך שנתיים כל עבירת נשק מסוג עוון ו/או סיוע לעבירה שכזו, ויורשע בה בתקופת התנאי או אחריה.",הנאשם 4 
"ת""פ 40922-11-15","הנאשם ישלם קנס בסך של 4,000 ₪ או 30 ימי מאסרמאסר תמורתו. הקנס ישולם בתוך 120 יום מהיום.",הנאשם 4 
"ת""פ 40922-11-15","סמכות לחלט הרכוש שנתפס ע""י המשטרה מוסדרת בסעיף 39(א) לפקודת סדר הדין הפלילי (מעצר וחיפוש) [נוסח חדש], תשכ""ט -1969, הקובע, כי:",סוגיית החילוט
"ת""פ 40922-11-15","אפתח בכך, כי כסף המשולם על ידי סוכן משטרתי, בתוקף תפקידו, אמור להיות מסומן. במקרה דנן, שטרות הכסף לא היו מסומנים ועל המאשימה הנטל להוכיח שהכספים שנתפסו הם כספים שהושגו בפשע. אך, משטען הנאשם, כי אלו כספי חתונה היה עליו להוכיח זאת. טענה זו נטענה בעלמא, ללא שום הוכחה, פרט למחברת  המתעדת, כך על-פי הנטען, את מתנות האורחים שניתנו.",סוגיית החילוט
"ת""פ 40922-11-15","מסיכום סכומי המתנות שניתנו בחתונה עולה, כי מדובר בסכום של כ – 71500 ש""ח הגדול משווי הסכום שנתפס. סכום המזומנים שנתפס, הינו  22,920 ₪, סכום התואם לסכום העסקה נשוא האישום השני.",סוגיית החילוט
"ת""פ 40922-11-15","הנאשם 4 אף ציין בחקירתו מיום 2.11.2015, כי הצקים- 10,000 ₪ על שם אלעביד מרים, וצ'ק על סך 500 ₪ על שם עוה""ד שינו, שנתפסו היו מונחים בתעודת הזהות שלו אף מלפני זמן. מעיון במסמכים שהוגשו עולה, כי הצ'ק על סך 10,000 ₪ ניתן להפקדה ליום 20.10.2015 והצ'ק על סך 500 ₪ ניתן להפקדה ליום 31.10.2015. מעובדה זו, לא ניתן ללמוד על מועד מתן הצ'ק ואין צורך להעמיק את הדיון בסוגיה זו מאחר וסכומים אלה, וסכום נוסף של 400$, (כספים שלכאורה תלו והניחו על צוארו של אחיו החתן), אינם נכללים בסכום אותו מבקשת המאשימה לחלט.",סוגיית החילוט
"ת""פ 40922-11-15","ב""כ הנאשם טען, כי המאשימה לא הוכיחה שביתה של אם הנאשמים משמש הוא גם כביתו של הנאשם 4, אך מכל האמור לעיל עולה, כי הנאשם 4 אכן מתגורר עם אימו, ואין צורך להוסיף על כך.",סוגיית החילוט
"ת""פ 40922-11-15","מבירור מעמיק בטיעוני הצדדים ניכר, כי חל בלבול מסוים בין הצדדים באשר לרכוש המבוקש חילוטו. כפי שהבהירה המאשימה במסגרת הודעת ההבהרה והשלמת טיעונים בעניין החילוט אותה הגישה, הובהר, כי החילוט המבוקש הינו ביחס לקטנוע וכן ביחס לסכום הכסף שנתפס על ידי המשטרה בבית הנאשם 4 בסך של 22,900 ₪.",סוגיית החילוט
"ת""פ 40922-11-15","המאשימה הבהירה, כי הסכומים אשר נתפסו בחזקתו של נאשם 2 באילת אינם מבין הסכומים המבוקש לחלטם.",סוגיית החילוט
"ת""פ 40922-11-15","כטענת המאשימה, כשבועיים לאחר העסקה נשוא האישום השני, נעצר הנאשם 4. בחיפוש שנערך בביתו, נתפס בתוך תיק שחור סכום של 22,920 ₪ כאשר חלק מהסכום (סך של 2,800 ₪) נתפס בכיס מכנסיו של הנאשם 4 אשר היה מונח בארון הבגדים שלו. מכאן, נוכח האמור לעיל, ונוכח סמיכות הזמנים בין מועד העיסקה לבין המועד בו נתפס הכסף וכן, נוכח ההתאמה הכמעט מושלמת בין הסכומים, מתבקשת המסקנה לפיה, מוצדק יהא להורות על חילוט סכום הכסף שנתפס.",סוגיית החילוט
"ת""פ 40922-11-15","לטיעונים אלה של המאשימה לא נמצאה תשובה מפיו של מי מהנאשמים משכך, נימוקיה מקובלים עליי ובכך נסללת הדרך להורות על חילוט הסך 22,920 ₪.",סוגיית החילוט
"ת""פ 40922-11-15","בתגובה אשר הוגשה על ידי ב""כ נאשם 2 והשלמת טיעונים ביחס לחילוט, לא מצאתי תשובה הולמת לטיעוני המאשימה. הטענה מפיו, לפיו הסכומים שנתפסו הינם כספי חתונה אינה מקובלת עליי ולא די בהעלאת טענה בעלמא; על רקע זה, לא מצאתי מקום לאמצה. בהנחה והסכומים אכן מקורם בחתונה, הרי אין התאמה בין גובה הסכומים ולא הוכח איך אלה הגיעו לידיו של נאשם 4. בהנחה ואמו היא זו אשר נשאה בהוצאות, אזיי, הכספים אמורים להיות באמתחתה להבדיל מהנאשם 4.",סוגיית החילוט
"ת""פ 40922-11-15","על כן, אני מורה על חילוט סכום הכסף המזומן בשווי  22,920 ₪.",סוגיית החילוט
"ת""פ 40922-11-15","אני מורה על החזרת הצ'קים והדולרים בלבד, ככל שאלה טרם הוחזרו, לידי הנאשם 2.",סוגיית החילוט
"ת""פ 40922-11-15","לעניין סמכות חילוט הקטנוע, נקבע בע""פ 6234/03 מדינת ישראל נגד מוראד זיתאווי - (טרם פורסם, ניתן ביום 9/3/05):",סוגיית החילוט
"ת""פ 40922-11-15","אין ספק, כי הקטנוע המדובר שימש לביצוע העבירות מושא כתב האישום כאן. כן, הנאשמים אף לא התייחסו לשאלת חילוט הקטנוע, לפיכך, אני מורה על חילוטו כמבוקש (המדובר בקטנוע מ""ר",סוגיית החילוט
"ת""פ 40922-11-15","ניתנה היום, 20 יולי 2016, במעמד הצדדים.      ",54678313
"ת""פ 40922-11-15",נוסח מסמך זה כפוף לשינויי ניסוח ועריכה,סאאב דבור 54678313
"ת""פ 40922-11-15","בעניין עריכה ושינויים במסמכי פסיקה, חקיקה ועוד באתר נבו – הקש כאן",סאאב דבור 54678313
