verdict,text,part
"ת""פ 36511-09-14","ע""פ 3027/13 ראובן דהוקרקר נ' מדינת ישראל – בגין שני אירועים (שוד וניסיון שוד) שנעברו בידי שוטר משמר הגבול, בעת שלבש מדים ונשא נשק, אשר בוצעו בצוותא עם אחרים וכוונו לבני מיעוטים, הוטלו על המערער - צעיר בן 20 ללא עבר פלילי אשר השתתף בקבוצה טיפולית לצעירים בשירות המבחן ואשר שירות המבחן בא בעניינו בהמלצה טיפולית (צו מבחן לצד עבודות שירות) - שנתיים מאסר בפועל, 8 חודשי מאסר מותנים ופיצוי בסך 5,000 ₪ לכל אחד מהמתלוננים. בית המשפט המחוזי קבע כי מתחם העונש ההולם במקרה זה נע בין שנתיים לשש שנות אסר בפועל. הערעור על העונש נדחה תוך שבית המשפט העליון (כב' הש' פוגלמן) עמד על חומרת המעשים. יודגש, כי בתיק זה המערער יחד עם אחרים הוביל בשתי הזדמנויות בני מיעוטים לסמטה בטענה שבכוונתו לבדוק אותם, ולאחר שגנבו את רכושם שחררו אותם. הרכוש שנגנב עמד על סך של כ-1,370 ₪ ולא ננקטה אלימות משמעותית. ","טיעוני ב""כ המאשימה לעונש"
"ת""פ 36511-09-14","בת""פ (מחוזי י-ם) 8973-06-12 מדינת ישראל נ' עוזיאל חנון ואוסאמה אל סאחלי – נגזרו על הנאשמים, שותפיו של דהוקרקר המפורט לעיל, 32 ו-27 חודשי מאסר לריצוי בפועל. זאת, על אף המלצות שירות המבחן בעניינם, על אף גילם הצעיר, נסיבותיהם האישיות הלא קלות וההמלצות בעניינם. ","טיעוני ב""כ המאשימה לעונש"
"ת""פ 36511-09-14","ע""פ 190/15, 441 מאיר פפו ועידן צ'קוב נ' מדינת ישראל – המערערים, צעירים בגילאי 26-27, מתנדבים במשמר האזרחי, הגיעו במספר הזדמנויות במסגרת משמרת, בניידת משטרה, אל אזור התחנה המרכזית הישנה בתל אביב, ללא סמכות, נכנסו לבתי עסק של  נתינים זרים מאריתראה באצטלה של אנשי מרות, תקפו אותם באמצעות תרסיס גז פלפל ושדדו מהם סך של כמה מאות שקלים. בית המשפט המחוזי ציין כי בשים לב לניצול לרעה של תפקידם והפגיעה באוכלוסייה מוחלשת, אין לתת משקל בכורה לשיקולי שיקום כפי שאלה באו לידי ביטוי בתסקירי שירות המבחן, קבע כי מתחם העונש ההולם נע בין שנה וחצי לחמש שנות מאסר וגזר על כל אחד מהמערערים 17 חודשי מאסר לריצוי בפועל. ","טיעוני ב""כ המאשימה לעונש"
"ת""פ 36511-09-14","בית המשפט העליון מצא כי אין מקום להתערב בעונש שנקבע, תוך שציין כי מדובר בסכום כסף שנחוץ היה לאותם נתינים זרים החיים מן היד אל הפה, לצורך קיומם, וכי המערערים לא בחלו בדרכי ערמה, נקטו באלימות ופעלו באופן חוזר ונשנה והכל באצטלה של אנשי מרות, ובכך העצימו את פגיעתם לא רק כלפי קרבנות העבירה הישירים אלא כלפי הציבור כולו ותדמית המשטרה. ביחס לפסק דין זה ביקשה ב""כ המאשימה להבהיר כי דובר במקרה חריג, בו לא ניתן היה להעיד את המתלוננים.","טיעוני ב""כ המאשימה לעונש"
"ת""פ 36511-09-14","ע""פ 1795/06 רון יוספי  נ' מדינת ישראל – המערער הורשע בארבע עבירות של שוד, בארבע עבירות של שימוש לרעה בכוח המשרה, תקיפה בנסיבות מחמירות וחבלה במזיד לרכב, וזאת בשל התנכלות לתושבים ערביים ולרכושם ומעורבות באירועי שוד חנויות וגניבת רכוש, בצוותא עם אחרים, הכל בעודו שוטר חובה במג""ב, ונדון ל-18 חודשי מאסר בפועל, 8 חודשי מאסר מותנים ופיצוי בסך 3,000 ₪ לכל אחד מהמתלוננים.  בית המשפט העליון (כבוד השופטת ברלינר) ציין כי המערער יצר מתח ופחד מכוונים בקרב המתלוננים, באמתלה של עריכת חיפוש חוקי, והחזקת הנשק חיזקה את אווירת האיום ואת רצינות כוונותיהם של השודדים.","טיעוני ב""כ המאשימה לעונש"
"ת""פ 36511-09-14","גם ערעורו של דוד סחייק (ע""פ 8961/07) עניינו בפרשה המתוארת בעניין יוספי, ואף שבית המשפט העליון עמד על חזרתו של המערער בתשובה, על היותו נורמטיבי ועל כך שניתן להניח ולקוות כי לא ישוב לסורו, הרי שחומרת המעשים, הפוגעים בכבוד האדם ובערכי יסוד של שיטת משפטנו, מצדיקים העדפת אלמנט ההרתעה וענישה ממשית, וכי החרטה והתשובה יעמדו למערער בעמדו לדיון בשחרורו על תנאי. ""בנידון דידן ביזו וביישו המערער וחבריו, לובשי מדים, את המדינה ואת כוחות הביטחון. אוי לאוזניים שככה שומעות"" (כב' הש' רובינשטיין). במקרה זה המערער הורשע במעורבות בחמישה מקרי שוד, והושתו עליו 20 חודשי מאסר בפועל.","טיעוני ב""כ המאשימה לעונש"
"ת""פ 36511-09-14","ע""פ 8526/12 פלוני נ' מדינת ישראל – המערער, שוטר משמר הגבול כבן 25, שדד בצוותא עם קטין 15 פועלים – חלקם שוהים בלתי חוקיים – במרתף ליד אזור תעשייה ברהט, כשהוא לובש מדים ונושא רובה M-16 וגז פלפל, נטל מהם כסף מזומן ומכשירי טלפון ניידים, הורה להם לפשוט בגדיהם ונמלט מן המקום. שירות המבחן המליץ על שילוב המערער בהליך טיפולי, ועל הטלת עונש מאסר שירוצה בעבודות שירות. ","טיעוני ב""כ המאשימה לעונש"
"ת""פ 36511-09-14","בית המשפט קמא סקר את נסיבותיו האישיות, את השבת הרכוש לנפגעים ואת היותו נעדר עבר פלילי, אך בשים לב לחומרת העבירות גזר על המערער עונש של 4 שנות מאסר לריצוי בפועל. בית המשפט העליון דחה את הערעור תוך שעמד על חומרת העבירות, ועל העדפת האינטרס הציבורי.","טיעוני ב""כ המאשימה לעונש"
"ת""פ 36511-09-14","ב""כ הנאשם 1 הפנה לאסופת מסמכים כדלקמן:",ראיות לעונש מטעם הנאשמים:
"ת""פ 36511-09-14","אישור על שירות סדיר וזאת למשך שנתיים, 3 חודשים ויום (עד ליום 28.2.15).",ראיות לעונש מטעם הנאשמים:
"ת""פ 36511-09-14","תעודת הוקרה ממג""ד בא""ח גולני; מכתב הערכה של תא""ל הושע פרידמן בן-שלום, קצין מילואים ראשי, ממנו עולה כי לאחר האירועים נשוא כתב האישום פנה אליו הנאשם 1 וביקש להשתלב בצבא ולהשלים את שירותו הצבאי. מר בן-שלום התרשם מחרטתו של הנאשם 1 על מעשיו, ולקח אותו תחת חסותו, והנאשם 1 הגיע להרצות לפני חיילים על הטעות שעשה. להערכתו, לנאשם 1 פוטנציאל גבוה לשיקום ועל כן ראוי הוא להזדמנות שנייה.",ראיות לעונש מטעם הנאשמים:
"ת""פ 36511-09-14","מכתב המלצה של שלומי אבני, מנהל התכנית הארצית ""נירים בשכונות"", שמטרתה להעלות את שיעור המתגייסים ליחידות קרביות מקרב אוכלוסיות מוחלשות ונוער בסיכון גבוה. מהמכתב עולה כי חלומו של הנאשם 1 להמשיך ולשרת בצבא לא צלח אולם מר אבני התרשם מכנות חרטתו של הנאשם 1 על מעשיו, ומסר שהנאשם 1 הרצה במס' הזדמנויות לפני חיילים על הטעות שעשה עם חבריו. להערכתו הנאשם 1 כבר שילם על הטעות שביצע.",ראיות לעונש מטעם הנאשמים:
"ת""פ 36511-09-14","מכתב המלצה של הגב' אילנית חפוטה, מנהלת עמותת ""מאיר פנים"" והאחראית על ביצוע של""צ ומפקחת על עובדי שירות, ממנו עולה כי הנאשם 1 השתתף בפעולות התנדבות רבות ובהן אריזת סלי מזון למשפחות נזקקות באור עקיבא, סיוע במועדונית לילדים ממשפחות קשות יום, סיוע לקשישים תשושי נפש, והיא התרשמה מאדם רגיש הפועל לתועלת הציבור. להערכתה, הנאשם 1 ניתן לשיקום.",ראיות לעונש מטעם הנאשמים:
"ת""פ 36511-09-14","חוות דעת פסיכולוג ד""ר הלפרין חיים מבוססת על נתוני רקע שנתקבלו מהנאשם 1; על כתב האישום (המקורי) שהוגש, תסקיר מעצר, ומכתבי המלצה;",ראיות לעונש מטעם הנאשמים:
"ת""פ 36511-09-14","על מבחן MMPI-2 שערך ד""ר הלפרין לנאשם 1 ולפיו הנאשם 1 נמצא במצוקה ברמה בינונית, מצוי בסערה רגשית, מביע דאגה ודכאון, סובל מחוסר בטחון ודמוי עצמי נמוך; ועל התרשמותו של ד""ר הלפרין, ממנה עולה כי הנאשם 1 פעל לנוכח מצוקה כלכלית קשה, מבנה אישיות פאסיבי ורמת רצייה חברתית גבוהה. להערכתו הנאשם 1 הפנים את הלקח ומכה על חטא, הסבירות שיעבור בעתיד עבירות דומות נמוכה ביותר, ויש לנקוט במקרה זה בענישה שיקומית.",ראיות לעונש מטעם הנאשמים:
"ת""פ 36511-09-14","ד""ר הלפרין נחקר לפני אודות חוות דעתו, ומעדותו עלה כי קיים פער בין הדברים אותם מסר לו הנאשם 1 במסגרת פגישותיהם לבין העובדות המסוכמות בהן הודה הנאשם 1 במסגרת כתב האישום המתוקן, וכי הנאשם 1 מזער מחומרת מעשיו, מנקיטת האלימות כלפי המתלוננים ומסכום הכסף המזומן שגנב. כמו כן עומת העד עם כך שגרסתו של הנאשם 1 כפי שנמסרה לו– ואשר מטילה את האחריות לביצוע העבירות לפתחו של הנאשם 2 – אינה מתיישבת עם גרסתו של הנאשם 2, ולפיו הנאשם 1 יזם את האירועים. העד מסר כי לא בדק את הנאשם 2 ואינו יכול לקבוע מי משקר ומי דובר אמת.",ראיות לעונש מטעם הנאשמים:
"ת""פ 36511-09-14","תעודת סיום לימודים יזמות והשקעות נדל""ן במכללת ""אפיק"". ",ראיות לעונש מטעם הנאשמים:
"ת""פ 36511-09-14","אישורים על העברות בנקאיות לפועלים הסינים, כדי חלקו של הנאשם 1, דהיינו בגובה שליש מהסכום שניטל מהם.",ראיות לעונש מטעם הנאשמים:
"ת""פ 36511-09-14",מסמכים רפואיים וכלכליים הנוגעים למשפחת הנאשם 1 (הוריו ואחותו). ,ראיות לעונש מטעם הנאשמים:
"ת""פ 36511-09-14","ב""כ הנאשם 2 הגיש מכתב ממעסיקו למשך 3.5 חודשים, מנהל בחברת גינון, שבו ציין כי התרשם שהנאשם אחראי ועמד ביעדים שהוגדרו לו; אישורים על העברות בנקאיות לפועלים הסינים, כדי חלקו של הנאשם 2, דהיינו בגובה שליש מהסכום שניטל מהם; כמו כן העיד מפקדו של הנאשם 2, שוטר במג""ב, אשר מסר שהנאשם 2 גילה מוטיבציה רבה וסייע רבות באירועים בהם השתתף. דבר מעצרו של הנאשם 2 היו עבורו בגדר הלם.",ראיות לעונש מטעם הנאשמים:
"ת""פ 36511-09-14","מטעם הנאשם 3 העיד מעסיקו, מר מוטי קארו, אשר מסר כי הוא עוסק בייבוא צעצועים, וכי העסיק את הנאשם 3 לאחר האירועים והתרשם מעובד מסור ואמין. לדבריו, הנאשם 3 מתחרט על מעשיו והביע בפניו חרטה עליהם, המעשים השפיעו עליו רבות ואף על בני משפחתו.",ראיות לעונש מטעם הנאשמים:
"ת""פ 36511-09-14","ב""כ הנאשם 1 עמד על כך שהנאשם 1 החזיר הכספים לכלל המתלוננים, וטען כי הנאשם 1 נטל אחריות על מעשיו, הביע חרטה עליהם, עבר  טיפול ממושך, התנדב בעמותות ושיתף חיילים בסיפורו האישי. מצבו הרפואי של אביו בכי רע, וגם מצבה של האם, שהיא המפרנסת היחידה במשפחה, התדרדר לאחרונה. נטען כי עונש מאסר ממושך עלול לפגוע בנאשם ובתהליך החיובי שהחל. עוד נטען כי מדובר בבגיר צעיר, בעל רקע נורמטיבי, אשר השתתף בהליך טיפולי ממושך המצדיק סטייה לקולא ממתחם הענישה.","טיעוני ב""כ הנאשמים לעונש"
"ת""פ 36511-09-14","ב""כ הנאשם 1 אבחן את הפסיקה אליה הפנתה ב""כ המאשימה, והפנה לפסיקה כדלקמן:","טיעוני ב""כ הנאשמים לעונש"
"ת""פ 36511-09-14","ע""פ 4168/09 נתנאל פרץ נ' מדינת ישראל – בשל אירוע חד פעמי בו המערער ושני אחרים – כולם שוטרי מג""ב- פגשו שלושה שוהים בלתי חוקיים ודרשו מהם את תכולת כיסיהם ובה כסף מזומן ומכשירי טלפון ניידים, הוטלו על המערער 6 חודשי עבודות שירות. ","טיעוני ב""כ הנאשמים לעונש"
"ת""פ 36511-09-14","ע""פ 5241/13 סעיד מלשה נ' מדינת ישראל – המערער, שוטר מג""ב, הורשע בעבירה של גניבה ושימוש לרעה בכוח המשרה, לאחר שנכנס בשתי הזדמנויות לחנות כשנשקו על כתפו, נטל בקבוק קולה ושתי חפיסות סיגריות, אמר למוכר: ""אתה עושה בעיות?"" ויצא מבלי לשלם. בית המשפט המחוזי קבע כי מתחם העונש ההולם נע בין 8 חודשי מאסר בפועל ל-5 שנות מאסר בפועל, והטיל עליו 10 חודשי מאסר לריצוי בפועל. ","טיעוני ב""כ הנאשמים לעונש"
"ת""פ 36511-09-14","ע""פ 7006/14 שי תורג'מן, חזי כהן ואליאור סאדה - בגין שלושה אירועי שוד אלימים כלפי אוכלוסייה מוחלשת ומתוך מניע גזעני נגזרו על שלושת המערערים – כדי חלקם – עונשים של 14, 17 ו-21 חודשי מאסר בפועל. יודגש, כי אף שדובר בעניין זה בצעירים נעדרי עבר פלילי, הרי שאין המדובר בשוטרים או במי שפעלו תוך הפרת אמון בתפקידם, ועל כן אין ללמוד לטעמי מרמת הענישה במקרה זה לענייננו. ","טיעוני ב""כ הנאשמים לעונש"
"ת""פ 36511-09-14","ב""כ הנאשם 1 הפנה לפסיקה של בית הדין הצבאי במסגרתה חיילים נטלו כסף מזומן באירוע חד פעמי, ואין בדעתי ללמוד מהם לענייננו. כמו כן הפנה ב""כ הנאשם 1 לפסיקה נוספת ביחס לאירועי שוד, אלא שאלה לא בוצעו בנסיבות הדומות לענייננו, ועל כן לא מצאתי לסקרם.","טיעוני ב""כ הנאשמים לעונש"
"ת""פ 36511-09-14","ב""כ הנאשם 2 טענה כי האירועים הם בבחינת שבר לנאשם 2 ולמשפחתו, הנאשם 2 הביע צער עמוק וחרטה על המעשים, שאינם עולים בקנה אחד עם זהותו ואופיו, והשיב למתלוננים את רכושם. כן נטען, כי האירועים התרחשו על פני תקופה קצרה, ועל כן יש להתייחס אליהם כאל אירוע אחד; כי הנאשם 2 צעיר ולעונש מאסר משמעותי עלולות להיות השלכות שליליות עליו; התסקיר מצביע על קיומו של תהליך משמעותי במישור האישי. בנוסף, בחינת רמת הענישה מצביעה על כך שהמתחם נע בין 15 ל-24 חודשי מאסר בפועל, ואין ביסוס לעתירתה העונשית של ב""כ המאשימה. כתימוכין לדבריה הפנתה לפסיקה שנסקרה לעיל, וכן לע""פ 8535/07 אופיר ערן נ' מדינת ישראל, במסגרתו הגיע המערער, לוחם במג""ב, עם חברים לחנות בחברון, נטל קופסה עם מטבעות, ארנק וכרטיסי חיוג, ובהמשך נכנס לחנות נוספת, הוציא ממנה את בעליה וגנב מתוכה בצוותא עם אחר 100 ₪ ושתי חבילות סיגריות. כשביקש מהם בעל החנות להשיב את הגניבה הם איימו עליו עם נשקם. בגין אלה נדון המערער, צעיר ללא עבר ובעל תסקיר חיובי, ל-9 חודשי מאסר לריצוי בפועל.","טיעוני ב""כ הנאשמים לעונש"
"ת""פ 36511-09-14","ב""כ הנאשם 3 טען שהמעשים המיוחסים לנאשם 2 מהווים אירוע אחד, וכי בנסיבות ובהן גילו הצעיר של הנאשם 3, חלוף הזמן מביצוע העבירה, משך הזמן של כחודשיים בהם היה עצור והערכת שירות המבחן בדבר רמת סיכון נמוכה, הרי שיש להסתפק בעניינו בעונש של עבודות שירות. כתימוכין לעתירתו הפנה ב""כ הנאשם 3 לפסיקה כדלקמן:","טיעוני ב""כ הנאשמים לעונש"
"ת""פ 36511-09-14","ע""פ 3879/12 פלוני נ' מדינת ישראל – אירוע של שוד עובד בחנות נוחות בתחנת דלק כשהמערער (שהיה קטין) ושותפיו היו בגילופין. בית המשפט המחוזי דחה את הסדר הטיעון במסגרתו הוסכם על עונש של 6 חודשי עבודות שירות, והטיל על המערער 12 חודשי מאסר לריצוי בפועל. בית המשפט העליון הביע דעתו כי העונש שהוסכם עליו – אף כי הוא מקל יחסית - מצוי בטווח הענישה לעבירות מסוג זה. ","טיעוני ב""כ הנאשמים לעונש"
"ת""פ 36511-09-14","יובהר, כי האירוע נשוא תיקנו אינו דומה כלל ועיקר לאירוע המתואר בפסק הדין האמור, ועל כן אין ללמוד מרמת ענישה זו לענייננו.","טיעוני ב""כ הנאשמים לעונש"
"ת""פ 36511-09-14","ע""פ 9094/12 איתן טספאי נ' מדינת ישראל – בגין אירוע שוד בנק כשהמערער תחב את ידו בכיסו על מנת לגרום לפקידה להבין שבידו אקדח, הוטלו על המערער, נעדר עבר פלילי, 10 חודשי מאסר בפועל. בשים לב לכך שלא הופעלה כל אלימות במהלך השוד, לתסקיר עדכני ולתקלה שארעה בהפניית המערער לממונה על עבודות שירות, הקל בית המשפט העליון בעונשו של המערער והעמידו על 6 חודשי עבודות שירות. ","טיעוני ב""כ הנאשמים לעונש"
"ת""פ 36511-09-14","ע""פ 4154/07 מוחמד טאהא נ' מדינת ישראל – המערער, צעיר כבן 18 ללא עבר פלילי, משך מידו של אחר מכשיר טלפון סלולארי, ובאירוע נוסף כרך ידו סביב צווארו של אדם נוסף ודרש ממנו להוציא את מכשיר הטלפון הנייד שלו מכיסו, ובהמשך משך ותלש שרשרת זהב שהיתה תלויה על צווארו. בשים לב לכך שביצע את העבירות על סף הבגירות, לכך שתסקיר שירות המבחן חיובי בעניינו ולכך שהשתלב בעבודה מסודרת, העמיד בית המשפט העליון את עונשו על 6 חודשי עבודות שירות. ","טיעוני ב""כ הנאשמים לעונש"
"ת""פ 36511-09-14","ע""פ 2849/13 מדינת ישראל נ' טייצאו טגבה – בעקבות קטטה שדד המשיב מהמתלונן את ארנקו ובו 200 ₪ במזומן, וכן נטל את מכשיר הטלפון הנייד שלו, ופצע את המתלונן באמצעות חפץ חד והכה אותו. לאחר מכן השליך המשיב לעבר המתלונן את הטלפון הנייד וכרטיסי האשראי שהיו בארנקו, ונמלט מהמקום. בהמשך ביקש המשיב מקטין לפנות למתלונן ולהניא אותו מהגשת התלונה, והקטין עשה כדבריו. בית המשפט המחוזי קבע כי מתחם העונש ההולם נע בין 6  ל-50 חודשי מאסר, והטיל על המשיב, צעיר ללא עבר משמעותי ובעל תסקיר חיובי, 6 חודשי עבודות שירות. בית המשפט דחה את הערעור, תוך שקבע כי מתחם העונש ההולם שנקבע לאירוע של שוד ספונטני ללא תכנון מוקדם וללא שימוש בנשק תוך שלנפגע העבירה נגרמו נזקים קלים בלבד הינו מתחם נכון. מכאן ברי כי אין להקיש ממקרה זה לענייננו, שכן בענייננו העבירות בוצעו בצוותא עם אחרים, לאחר תכנון מוקדם ותוך שימוש בנשק.","טיעוני ב""כ הנאשמים לעונש"
"ת""פ 36511-09-14","ע""פ 11115/04 ג'הלין נ' מדינת ישראל – שני המערערים, אחים בגילאי 20 ללא עבר פלילי, התנפלו על המתלונן שלאביו סכסוך כספי עימם, ונטלו מכיסו ארנק ובו מסמכים וכסף מזומן, וטלפון נייד. בית המשפט המחוזי גזר עליהם 9 חודשי מאסר לריצוי בפועל, ובית המשפט העליון הפחית את עונשם והעמידו על 6 חודשי עבודות שירות.","טיעוני ב""כ הנאשמים לעונש"
"ת""פ 36511-09-14","ע""פ 8944/04 איליה לזדון נ' מדינת ישראל – שוד בצוותא עם אחר של מתדלק בתחנת דלק, האחר הצמיד סכין לגופו של המתדלק, המערער הראה סכין למתדלק. המתדלק נתן לנאשם האחר סך של 255 ₪ במזומן, אולם ההליכים נגד האחר הופסקו בשל היותו בלתי כשיר לעמוד לדין. המערער, צעיר ללא עבר ובעל תסקיר חיובי, נדון בבית המשפט המחוזי ל-15 חודשי מאסר לריצוי בפועל. בית המשפט העליון ציין כי המערער השלים שירות צבאי תוך הערכה רבה של מפקדיו, וכיום השתלב בעבודה, עתיד להינשא, ומתסקירי שירות המבחן עולה שאין חשש מפני הישנות מעשים דומים מצידו. בנסיבות אלה מצא בית המשפט העליון להעמיד את עונשו של המערער על 6 חודשי עבודות שירות. ","טיעוני ב""כ הנאשמים לעונש"
"ת""פ 36511-09-14","ע""פ 7876/07 מדינת ישראל נ' פלונים – המשיבים הינם קטין ובגיר כבן 20, אשר בגין שני אירועי שוד אלים של פרוצות אותם ביצעו עת היו בגילופין נדונו לעונש של 6 חודשי מאסר בפועל. בית המשפט העליון התחשב בכך שמדובר בצעירים ללא עבר פלילי שתסקיר שירות המבחן בעניינם חיובי, בכך שמידת האלימות שננקטה אינה חמורה ולא הצריכה טיפול רפואי, ובכך שהמשיב 1 סיים לרצות את עונשו זה מכבר, ולא החמיר בעונשם של המשיבים. ","טיעוני ב""כ הנאשמים לעונש"
