verdict,text,part
"ת""פ 51209-04-23","	בע""פ 309/22 מדינת ישראל נ' ביאדסה (10.5.2022) נדון עניינו של מי שהורשע בהחזקה, נשיאה והובלה של שני כלי נשק. באותו מקרה מדובר היה במי שנסע ברכב כשהוא מוביל רובה מסוג קלצ'ניקוב, מחסנית תואמת ובה 29 כדורים וכן אקדח חצי אוטומטי טעון במחסנית תואמת המכילה 27 כדורים ומחסנית נוספת שמכילה 14 כדורים. בית המשפט המחוזי גזר על המשיב 19 חודשי מאסר לריצוי בפועל. בית המשפט העליון התערב בקולת העונש והעמידו על 30 חודשי מאסר.",קביעת מתחם העונש ההולם
"ת""פ 51209-04-23","	בע""פ 6068/21 מדינת ישראל נ' אברהים פקיה (19.12.2021) נדון עניינו של מי שהורשע בעבירה של נשיאה והובלה של כלי נשק וביצוע ירי באזור מגורים. בית המשפט המחוזי קבע מתחם שנע בין 14 - 36 חודשי מאסר וגזר על המשיב 14 חודשי מאסר לריצוי בפועל. ערעור המדינה על קולת העונש התקבל ובית המשפט העליון העמיד את עונשו של המשיב על 25 חודשי מאסר, תוך שהדגיש את הכלל לפיו ערכאת הערעור אינה נוהגת למצות את הדין. ",קביעת מתחם העונש ההולם
"ת""פ 51209-04-23","בע""פ 1427/21 שוויקי נ' מדינת ישראל (26.5.2021) - נדחה ערעורו של נאשם, בעל עבר פלילי מכביד, אשר הורשע בנשיאת נשק וביצוע ירי מנשק חם ונידון ל-37 חודשי מאסר בפועל, לאחר שנקבע בעניינו מתחם ענישה הנע בין 26 ל- 56 חודשי מאסר בפועל. באותו מקרה דובר בנאשם שהגיע למקום בו התקהלו עשרות אנשים, נעמד סמוך להתקהלות וירה באוויר לפחות 17 כדורים. בית המשפט העליון דחה כאמור את הערעור על חומרת העונש בקבעו כי מדובר בעבירות נשק שביחס אליהן קיימת מגמת החמרה בפסיקה ולא בכדי. מדובר במעשים חמורים שפוטנציאל הנזק הגלום בהם עצום, ואך מזל הוא שהאירוע לא הסתיים בפגיעה בנפש. ",קביעת מתחם העונש ההולם
"ת""פ 51209-04-23","בע""פ 3169/21 מדינת ישראל נ' אגבאריה ואח' (21.6.2021) - התקבל ערעורה של המדינה על קולת העונש שהוטל על מי שהורשעו בעבירה של החזקה, נשיאה והובלה של נשק, ירי באזור מגורים, איומים, שינוי זהות של רכב, הפרעה לשוטר בשעת מילוי תפקידו, היזק בזדון ושיבוש מהלכי משפט. יצוין בתמצית כי באותו מקרה מדובר בשני נאשמים שלמדו במכללה וקשרו קשר לירות בנשק בסמוך לביתו של מנהל המכללה בה למדו. השניים השליכו ראש כבש לחצר ביתו של המנהל וירו באוויר בקרבת בית מגוריו 37 קליעים באוויר ובהמשך 11 קליעים נוספים. בית המשפט העליון התערב בעונש שנגזר על הנאשמים באותו מקרה בדמות 24 חודשי מאסר בפועל והעמיד את עונשם על 36 חודשים.",קביעת מתחם העונש ההולם
"ת""פ 51209-04-23","	בע""פ 1509/20 מדינת ישראל נ' נבארי (2.7.2020) - נדון עניינו של מי שהורשע בעבירה של נשיאה והובלה של נשק וירי מנשק חם באזור מגורים, ואשר נידון על ידי בית המשפט המחוזי ל-27 חודשי מאסר בפועל. באותו מקרה מדובר במי שנהג ברכב בעיר לוד כשברשותו תת מקלע מאולתר מסוג קרלו ובו מחסנית טעונה בכדורים. מסיבה בלתי ידועה ירה הנאשם שני כדורים באזור מגורים ועזב את המקום ברכבו. בית המשפט העליון קיבל את הערעור על קולת העונש והעמיד את עונשו של הנאשם על 36 חודשי מאסר בפועל, תוך שהפנה לצורך במיגור התופעה של שימוש בנשק בלתי חוקי. יצוין כי לחובת אותו נאשם עמד עבר פלילי הכולל ארבע הרשעות בעבירות אלימות.",קביעת מתחם העונש ההולם
"ת""פ 51209-04-23","בהביאי בחשבון את הערכים החברתיים שנפגעו כתוצאה מביצוע העבירות בענייננו, את מידת הפגיעה בהם, את נסיבות ביצוען ואת מדיניות הענישה הנוהגת, ובכלל זאת מגמת ההחמרה הניכרת בענישה, אני סבור כי מתחם העונש ההולם במקרה דידן מצוי בטווח שבין 40-20 חודשי מאסר לריצוי בפועל, לצד עונשים נלווים.",קביעת מתחם העונש ההולם
"ת""פ 51209-04-23","בבואי לגזור את עונשו של הנאשם בתוך המתחם שנקבע לגביו נתתי דעתי לגילו הצעיר בעת ביצוע העבירה, בן 22, ולעובדה שהוא נעדר כל הרשעות קודמות וזו הסתבכותו הראשונה עם החוק. כמו כן הבאתי בחשבון את הודאתו בשלב מוקדם של הליך, המבטאת נטילת אחריות מצדו על מעשיו והביאה גם לחסכון בזמן שיפוטי יקר.",גזירת העונש בתוך המתחם
"ת""פ 51209-04-23","בנוסף, ראיתי גם להתחשב בנסיבותיו האישיות של הנאשם, לרבות מצבו הרפואי והקוגניטיבי. נכון שאין הוא מצוי בקרבה לסייג, אך לא ניתן להתעלם מכך שמדובר במי שסובל מקשיים קוגניטיביים על רקע נזק אורגני למוח, קשיים המצטרפים ליכולות מונמכות ממילא, נוכח מאפייניו האישיותיים, כפי שעולה מדו""ח וועדת האבחון שהונח בפניי (נע/1).",גזירת העונש בתוך המתחם
"ת""פ 51209-04-23","לא מצאתי כל מקום לחרוג לקולא ממתחם העונש כפי שביקש הסנגור. כפי שצוין מצבו הקוגניטיבי  של הנאשם אינו מצוי בקרבה לסייג, ומצבו הרפואי אינו מצדיק חריגה מטעמי צדק. חריגה מעין זו שמורה לנסיבות ייחודיות ויוצאות דופן שאינן מתקיימות בענייננו.",גזירת העונש בתוך המתחם
"ת""פ 51209-04-23","לסיכום, על יסוד מקבץ הטעמים והשיקולים שמניתי לעיל, אני גוזר על הנאשם את העונשים הבאים:",גזירת העונש בתוך המתחם
"ת""פ 51209-04-23",א.	20 חודשי מאסר לריצוי בפועל בניכוי ימי מעצרו מיום 13.4.2023.,גזירת העונש בתוך המתחם
"ת""פ 51209-04-23",ב. 12 חודשי מאסר על תנאי לבל יעבור משך שלוש שנים כל עבירת נשק מסוג פשע יורשע בגינה.,גזירת העונש בתוך המתחם
"ת""פ 51209-04-23",ג.	6 חודשי מאסר על תנאי לבל יעבור משך שלוש שנים כל עבירת נשק מסוג עוון ויורשע בגינה.,גזירת העונש בתוך המתחם
"ת""פ 51209-04-23","ד. פיצוי למתלונן סניור עמאש בסך 3,000 ₪ שישולם באמצעות המרכז לגביית קנסות, אגרות והוצאות בשלושה שיעורים חודשיים, שווים ורצופים כאשר מועד תשלום השיעור הראשון יחול ביום 1.3.2024 ויתר התשלומים ב- 1 לכל חודש עוקב. לא שולם אחד התשלומים במלואו או במועדו, תעמוד כל היתרה לפירעון מידי בתוספת ריבית פיגורים על פי דין.",גזירת העונש בתוך המתחם
"ת""פ 51209-04-23",	זכות ערעור לבית המשפט העליון תוך 45 ימים.  ,גזירת העונש בתוך המתחם
"ת""פ 51209-04-23","54678313ניתן היום,  כ""ח שבט תשפ""ד, 07 פברואר 2024, במעמד הנוכחים.",5129371
"ת""פ 51209-04-23",נוסח מסמך זה כפוף לשינויי ניסוח ועריכה,אמיר טובי 54678313
"ת""פ 51209-04-23","בעניין עריכה ושינויים במסמכי פסיקה, חקיקה ועוד באתר נבו – הקש כאן",אמיר טובי 54678313
