verdict,text,part
"ת""פ 9693-11-14","בבואי לגזור את עונשו של הנאשם, מביא אני בחשבון לזכותו את העובדה שהודה במעשים, לקח עליהם אחריות והביע צער כלפי המתלונן. אציין עוד, כי כעולה מהתסקיר, עובר למעצרו עבד הנאשם במינימרקט הנמצא בבעלותו ובבעלות אחותו. עוד אני מביא בחשבון את נסיבות חייו של הנאשם כעולה מתסקיר שירות המבחן. ואולם, לחובתו של הנאשם מביא אני בחשבון, כאמור, את עברו הפלילי המכביד, את חומרת המעשה וחומרת הפגיעה במתלונן, ואת התרשמות שירות המבחן כי הנאשם זקוק לענישה מרתיעה ומציבת גבולות. בשים לב לעברו הפלילי העשיר של הנאשם, והעובדה שהוא שב ומבצע עבירות, אינטרס שלום הציבור מחייב את הרחקתו של הנאשם מהחברה לתקופה משמעותית.",גזירת עונשו של הנאשם
"ת""פ 9693-11-14","לעניין המחלוקת הקיימת בשאלה אם יש להורות על כך שהעונש בתיק זה יצטבר לעונש אותו מרצה כיום הנאשם בתיק אחר (ת.פ. 7209-03-12), או שיש להורות על חפיפתו, דעתי היא שיש להורות על הצטברות העונשים. מדובר בשתי עבירות שאין קשר ביניהן וכל אחת עומדת בפני עצמה. בת.פ. 7209-03-12 מדובר היה בעבירה של גניבת רכב. את העבירה הנוכחית ביצע הנאשם בעת שהיה משוחרר בערובה בתיק האחר, ויש לראות זאת כנימוק לחומרא. עם זאת, לא נעלם מעיניי שכיום מרצה הנאשם במסגרת התיק האחר עונש מאסר לתקופה של 26 חודשים (בניכוי כחודשיים בהם היה נתון במעצר), ואתן לכך משקל מסוים בקביעת גובה העונש שאטיל על הנאשם. ",גזירת עונשו של הנאשם
"ת""פ 9693-11-14","סיכומו של דבר. לאחר שנתתי דעתי לטענות שהעלו באי כוח הצדדים, לפסיקה שהציגו, ובשוקלי את השיקולים לכאן ולכאן, אני מחליט להטיל על הנאשם את העונשים הבאים:",גזירת עונשו של הנאשם
"ת""פ 9693-11-14","5 שנות מאסר, במצטבר לעונש אותו מרצה כעת הנאשם בת.פ. 7209-03-12, וזאת בניכוי תקופת מעצרו מיום 24.10.14 (המועד בו נעצר בתיק הנוכחי) ועד ליום 31.5.15 (המועד בו החל הנאשם לרצות את עונש המאסר שהוטל עליו בת.פ. 7209-03-12).",גזירת עונשו של הנאשם
"ת""פ 9693-11-14","12 חודשי מאסר על תנאי, והתנאי הוא שלא יעבור תוך 3 שנים ממועד שחרורו מהכלא אחת מהעבירות בהן הורשע.",גזירת עונשו של הנאשם
"ת""פ 9693-11-14","פיצוי למתלונן בסכום של 25,000 ₪. הפיצוי ישולם בתוך 90 ימים.",גזירת עונשו של הנאשם
"ת""פ 9693-11-14","5129371ניתן היום,  כ""ג באלול תשע""ה, 7 בספטמבר 2015, במעמד הנוכחים.",זכות ערעור לבית המשפט העליון בתוך 45 ימים.
"ת""פ 9693-11-14","בעניין עריכה ושינויים במסמכי פסיקה, חקיקה ועוד באתר נבו – הקש כאן",54678313
"ת""פ 9693-11-14",אריה רומנוב 54678313-/,54678313
