verdict,text,part
"ת""פ 18397-02-16","""הכלל הנקוט בפסיקת בית משפט זה הוא שתסקיר שירות המבחן מהווה המלצה שאינה מחייבת את בית המשפט. אמנם שירות המבחן הוא הגורם המקצועי הרלבנטי הבוחן, בין היתר, את מסוכנותו של נאשם ואת הפוטנציאל השיקומי שלו, ועל כן נדרש בית המשפט להביא בחשבון את המלצתו בבואו לקבל החלטה בעניינו של נאשם, אולם מכלול השיקולים והאינטרסים אותם שוקל בית המשפט הוא רחב מאלו אותם שוקל שירות המבחן (ראו: ע""פ 2032/15 ממן נ' מדינת ישראל, פסקה 22 (11.8.2015); ע""פ 6341/14 בן איטשי נ' מדינת ישראל, פסקה 13 (8.7.2015); בש""פ 5309/05 צמח נ' מדינת ישראל, פסקה 6 (29.6.2005)).",גזירת העונש:
"ת""פ 18397-02-16","בשנים האחרונות ניכרת מגמת החמרה עם עברייני נשק, וזאת בשל הסיכון הגלום רק בעצם החזקתו. בית המשפט העליון חזר על גישתו המחמירה בעבירות נשק בע""פ 5681/14 מדינת ישראל נ' טאטור (ניתן ביום 01/02/15) וקבע כי:",גזירת העונש:
"ת""פ 18397-02-16",אין בענייננו הצדקה או אפשרות לחרוג לקולא ממתחם העונש ההולם למטרת שיקום. אף אין בענייננו הצדקה לחרוג לחומרה מן המתחם ההולם.,גזירת העונש:
"ת""פ 18397-02-16","אני מטיל על הנאשם 18 חודשי מאסר בפועל בניכוי ימי מעצרו, מיום 2.2.16 עד 10.3.16.","אשר על-כן, הנני גוזר על הנאשם את העונשים הבאים:"
"ת""פ 18397-02-16","אני מטיל על הנאשם מאסר על תנאי של 12 חודשים למשך 3 שנים, שלא יעבור על עבירה הקשורה בנשק או נהיגה בזמן פסילה.","אשר על-כן, הנני גוזר על הנאשם את העונשים הבאים:"
"ת""פ 18397-02-16",אני פוסל את הנאשם מלקבל ומלהחזיק רישיון נהיגה לתקופה של 12 חודשים בפועל.,"אשר על-כן, הנני גוזר על הנאשם את העונשים הבאים:"
"ת""פ 18397-02-16","אני מטיל על הנאשם קנס בסך 2,000 ש""ח או חודש מאסר תמורתו. הקנס ישולם ב-4 תשלומים חודשיים, תשלום ראשון בעוד חודש. במידה ולא ישולם תשלום אחד מבין התשלומים, יעמוד כל הקנס לפירעון מידי ובמידה ולא ישלמו, ירצה ימי המאסר תחת הקנס. במידה והופקדו כספים במסגרת תיק זה, יש לקזזם עם הקנס ואת היתרה, באם קיימת, יש להשיב לנאשם.","אשר על-כן, הנני גוזר על הנאשם את העונשים הבאים:"
"ת""פ 18397-02-16","תשומת לב שב""ס למצבו הנפשי של הנאשם, כפי שנטען על ידו בפני שירות המבחן ולאפשרות שילובו במסגרת טיפולית שיקומית במהלך תקופת מאסרו.","אשר על-כן, הנני גוזר על הנאשם את העונשים הבאים:"
"ת""פ 18397-02-16","הסנגור: אבקש עיכוב ביצוע. הבקשה שלנו היתה, חברתי הסכימה למועד אחר, אני ביקשתי אחרי חג הרמאדן, אבקש לסוף החודש, באותם תנאים של איזוק אלקטרוני, הערבויות הופקדו, הכל ישאר על כנו.","ג'ורג' אזולאי , שופט "
"ת""פ 18397-02-16",התובעת: נבקש שיתווספו הפקדות כספיות. ,"ג'ורג' אזולאי , שופט "
"ת""פ 18397-02-16",אני מחליט לעכב את תחילת ריצוי המאסר עד לתאריך 3.7.17.,החלטה
"ת""פ 18397-02-16","במועד זה, במידה ולא תהיה החלטה אחרת של בית המשפט העליון, יתייצב הנאשם לריצוי מאסרו, כשהוא מצויד בתעודה מזהה, בבית המעצר צלמון, לא יאוחר מהשעה 12:00,  אלא אם כן עבר מיון מוקדם בהתאם לנוהל שב""ס.",החלטה
"ת""פ 18397-02-16","ביכולתו של הנאשם או ב""כ ליצור קשר ישירות עם רס""ר ניצה יעקב, נציגת שב""ס, בטל' 08-9787337, לצורך מיון מוקדם.  ",החלטה
"ת""פ 18397-02-16","תנאי השחרור יישאר בעינם, עד התייצבותו של הנאשם לריצוי העונש.","המזכירות תעביר העתק ההחלטה לשב""ס."
"ת""פ 18397-02-16","5129371ניתנה והודעה היום י""ד סיוון תשע""ז, 08/06/2017 במעמד הנוכחים. ",<#5#>
"ת""פ 18397-02-16",5129371הוקלד על ידי נאוה בר,"ג'ורג' אזולאי , שופט "
"ת""פ 18397-02-16","בעניין עריכה ושינויים במסמכי פסיקה, חקיקה ועוד באתר נבו – הקש כאן",54678313
"ת""פ 18397-02-16",ג'ורג' אזולאי 54678313-/,54678313
