verdict,text,part
"ת""פ 8639-04-23","בע""פ 1965/20 בדואי נ' מדינת ישראל (פורסם בנבו, 11.6.20) קיבל בית המשפט העליון באופן חלקי את ערעורו של נאשם שהורשע בעבירה של סחר בסם מסוכן מסוג קוקאין במשקל של כ-30 גרם ובסיוע לסחר בסם מסוכן מסוג קוקאין במשקל של 39.62 גרם קוקאין והעמיד את עונשו על 30 חודשי מאסר בכך שהפעיל את עונש המאסר המותנה בן 4 חודשים שהיה תלוי ועומד כנגדו בחופף חלף הפעלתו במצטבר על-ידי בית המשפט המחוזי.",	דיון והכרעה
"ת""פ 8639-04-23","	המאשימה צרפה בין היתר את רע""פ 2275/15 אברמוב נ' מדינת ישראל (פורסם בנבו, 5.5.2015) בו דחה בית המשפט העליון בקשת רשות ערעור של נאשם שהורשע בסחר בסמים מסוכנים מסוג קוקאין והרואין במשקל כולל של 40 גרם לסוכן משטרתי והותיר על כנו עונש של 48 חודשי מאסר;",	דיון והכרעה
"ת""פ 8639-04-23","	את ע""פ 1987/15 דורי נ' מדינת ישראל (פורסם בנבו, 17.8.2015) בו דחה בית המשפט העליון את ערעורו של נאשם שהורשע בעבירה של סחר בסם מסוכן מסוג קוקאין לסוכן משטרתי במשקל של 50 גרם והותיר על כנו עונש של 26 חודשי מאסר;",	דיון והכרעה
"ת""פ 8639-04-23","	את ת""פ (מחוזי-ת""א) 10429-12-18 מדינת ישראל נ' מגדלאוי ואח' (פורסם בנבו 30.6.2021) בו גזר בית המשפט המחוזי על נאשם 1 שהורשע בביצוע שתי עבירות של סחר בסם מסוכן מסוג קוקאין במשקל של כ-10 גרם במקרה אחד, ו-50.16 גרם במקרה השני, עונש של 37 חודשי מאסר, במנותק מעונש מאסר נוסף שרובו נצבר בגין תיק אחר שצרף.",	דיון והכרעה
"ת""פ 8639-04-23","	ב""כ הנאשם צרף את ת""פ (שלום ב""ש) 51624-03-23 מדינת ישראל נ' אבו רקייק ואח' (פורסם בנבו, 6.9.2023) בו גזר בית משפט השלום על נאשמים שהורשעו בעבירה של סחר בסמים במסגרת הסדר טיעון ""סגור"" עונש 25 חודשי מאסר על נאשם 1 שסחר בסם מסוג קוקאין בשני מקרים במשקל של 4.8 גר' ו-29 גר'; 21 חודשי מאסר כולל הפעלה של 4 חודשי מאסר על תנאי במצטבר על נאשם 2 שסחר בסם מסוכן מסוג קוקאין בשני מקרים במשקל של 4.8 גר' ו-9.4 גר', ו-9 חודשי מאסר על נאשם 3 שסחר בסם מסוכן מסוג קוקאין במשקל של 6.6 גר.",	דיון והכרעה
"ת""פ 8639-04-23","	כן הפנה ב""כ הנאשם לת""פ (מחוזי-ב""ש) 50938-03-23 מדינת ישראל נ' דוידוב (לא פורסם,25.1.2024) בו נגזר על-ידי מותב זה עונש של 40 חודשי מאסר לנאשם שהורשע בשלוש עבירות של סחר בתערובת של סמים מסוג  MDMA  וקטמין  במשקל של 90 גרם במקרה הראשון והשני, ושל 9 גרם במקרה השלישי, כשבמקרה נוסף סייע בתיווך למכירת סם מסוכן מסוג קוקאין במשקל של 45 גרם מסגרת הסדר טיעון סגור. יצוין, כי הנאשם באותו מקרה הורשע במסגרת אותו מבצע סוכן שבענייננו.",	דיון והכרעה
"ת""פ 8639-04-23",מעיון ביחס למדיניות הענישה הנוהגת בעבירה של החזקת תחמושת בהיקפים נמוכים נראה כי זו נעה בין מאסר מותנה למספר חודשי מאסר לריצוי בעבודות שירות בנסיבות דומות.,	דיון והכרעה
"ת""פ 8639-04-23","באשר לנסיבות שאינן קשורות לביצוע העבירה נתתי משקל להודאת הנאשם שיש בה משום לקיחת אחריות וחיסכון בזמן שיפוטי, לנסיבות חייו האישיות והמשפחתיות המורכבות, למצבה הבריאותי של בתו התינוקת, לקושי שייגרם לנאשם ולמשפחתו כתוצאה מהעונש שיוטל עליו ולהליך הטיפולי המסוים שבו החל במסגרת מעצרו.",	דיון והכרעה
"ת""פ 8639-04-23","לצד זאת, נתתי דעתי לכך שלנאשם עבר פלילי מכביד במגוון עבירות, לרבות בעבירות סם, שבגין חלקן אף ריצה תקופות מאסר ממושכות (אף שהרשעתו האחרונה היא משנת 2015, והרשעתו האחרונה בעבירות סם היא משנת 2011). כן נתתי דעתי להתרשמות שירות המבחן כמפורט לעיל, לרבות מקיומם של גורמי סיכון בעניינו. נתונים אלה מלמדים על צורך במתן ביטוי בגזר הדין לשיקול הרתעת הנאשם. זאת, לצד צורך במתן ביטוי בגזר הדין גם לשיקול הרתעת הרבים היפה הן לגזרת עבירות הסמים והן לגזרת עבירות הנשק.",	דיון והכרעה
"ת""פ 8639-04-23","באשר לפסילת רישיון הנהיגה אציין, כי מצאתי להורות על פסילת רישיון הנהיגה של הנאשם בפועל ולא על תנאי בלבד כפי שעתר בא כוחו. מי אשר מנצל הרישיון שנתנה לו המדינה לנהוג רכב לצורך סחר בסמים ראוי למנוע ממנו להמשיך לנהוג. עם זאת, בשל מכלול רכיבי הענישה ולנוכח הנסיבות המשפחתיות של הנאשם, מצאתי שלא להכביד עם הנאשם ביחס לרכיב זה.",	דיון והכרעה
"ת""פ 8639-04-23","לנוכח הכרזת הנאשם כסוחר סמים יש צורך לדון בשאלת החילוט. כזכור, המאשימה עתרה לחלט גם סכום של 5,750 ₪ שנתפס על הנאשם וגם רכב שהנאשם עשה בו שימוש אשר רשום על שמה של אשתו. ב""כ הנאשם הסכים לחילוט סכום הכסף שנתפס אך עתר להימנע מחילוט הרכב. על-פי דין נראה כי היה מקום לחלט גם את הרכב בו עשה הנאשם שימוש לצורך ביצוע עסקת הסמים. דא עקא, שמעובדה 7 לכתב האישום, לאחר תיקונו, נמחקו פרטי הרכב שבו עשה שימוש הנאשם. ב""כ המאשימה שהופיעה בדיון לא יכלה לתת הסבר לעניין זה.",	בקשת החילוט
"ת""פ 8639-04-23","אף שבמסגרת ההסדר צוין כי המאשימה תעתור גם לחילוט הרכב, ואף שהרכב מושא בקשת החילוט מוזכר גם בבקשת החילוט גם בנוסחו המתוקן של כתב האישום, סבורני כי נותר ספק ביחס לכוונת הצדדים, שאחרת מה טעם היה במחיקת פרטי הרכב מהאישום המרכזי של התיק?",	בקשת החילוט
"ת""פ 8639-04-23","ברי, כי לא יהיה זה מידתי לחלט את הרכב אך בשל כך שנעשה בו שימוש לצורך החזקת כדור אחד כאמור באישום השני. בעניין החילוט נתתי דעתי גם לכך שהרכב, אף אליבא דמאשימה, רשום על שם אשת הנאשם ולמעשה היא עושה בו שימוש. מהמסמכים הרפואיים שהוגשו ומדברי אשת הנאשם עולה, כי חלק מהשימוש שעושה אשת הנאשם ברכב הוא לצורך הבאת הבת הקטנה לטיפולים רפואיים להם היא נדרשת. כזכור, מדובר בבת שלה בעיות רפואיות קשות ושעברה ניתוח משמעותי בראשה שבעקבותיו היא זקוקה להמשך טיפולים ומעקב, ובכלל הנסיבות האמורות, מצאתי להימנע מחילוט רכב זה.",	בקשת החילוט
"ת""פ 8639-04-23","עם זאת, מצאתי לאזן את העיצום הכלכלי שיוטל על הנאשם בכללותו באמצעות קנס הולם.",	בקשת החילוט
"ת""פ 8639-04-23",לאור כל האמור לעיל אני מטיל על הנאשם את העונשים הבאים:,	בקשת החילוט
"ת""פ 8639-04-23",26 חודשי מאסר בניכוי ימי מעצרו.,	בקשת החילוט
"ת""פ 8639-04-23","12 חודשי מאסר על תנאי, למשך 3 שנים מיום שחרור הנאשם ממאסרו, שלא",	בקשת החילוט
"ת""פ 8639-04-23",               יעבור עבירת סמים מסוג פשע או עבירת נשק.,	בקשת החילוט
"ת""פ 8639-04-23","6 חודשי מאסר על תנאי, למשך 3 שנים מיום שחרור הנאשם ממאסרו, שלא",	בקשת החילוט
"ת""פ 8639-04-23",                יעבור עבירת סמים מסוג עוון.,	בקשת החילוט
"ת""פ 8639-04-23","קנס בסך של 20,000 ₪ או 75 ימי מאסר תמורתו. הקנס ישולם 8 שיעורים חודשיים שווים ורצופים החל מיום 1.9.2024",	בקשת החילוט
"ת""פ 8639-04-23",אני פוסל את הנאשם מלקבל או להחזיק רישיון נהיגה למשך 6 חודשים החל מיום 	שחרורו 	מן המאסר.,	בקשת החילוט
"ת""פ 8639-04-23","על הנאשם להפקיד את רישיונו במזכירות בית המשפט ולחלופין למלא תצהיר 	מתאים 	לצורך תחילת מנין תקופת הפסילה. הפסילה תהיה במצטבר לכל פסילה אחרת, אם 	קיימת.",	בקשת החילוט
"ת""פ 8639-04-23","54678313סך של 5,750 ₪ שנתפסו על הנאשם יחולטו לטובת קרן הסמים.",5129371
"ת""פ 8639-04-23","ניתן היום,  ז' ניסן תשפ""ד, 15 אפריל 2024, במעמד הצדדים.",זכות ערעור לבית המשפט העליון בתוך 45 יום.
"ת""פ 8639-04-23",נוסח מסמך זה כפוף לשינויי ניסוח ועריכה,יובל ליבדרו 54678313
"ת""פ 8639-04-23","בעניין עריכה ושינויים במסמכי פסיקה, חקיקה ועוד באתר נבו – הקש כאן",יובל ליבדרו 54678313
