verdict,text,part
"ת""פ 25624-03-22","ב""כ המאשימה: עו""ד מונא מנסור",נוכחים:
"ת""פ 25624-03-22","ב""כ הנאשם: עו""ד רסלאן מחאג'נה",נוכחים:
"ת""פ 25624-03-22","ש""ז פלר   יסודות בדיני עונשין ",ספרות:
"ת""פ 25624-03-22","חוק העונשין, תשל""ז-1977: סע'  40ט, 144, 144(ב2)","חוק הכניסה לישראל, תשי""ב-1952: סע'  12(1)"
"ת""פ 25624-03-22","הנאשם הורשע על סמך הודאתו, שניתנה במסגרת הסדר טיעון, בעבירות של כניסה וישיבה בישראל שלא כחוק, עבירה לפי סעיף 12(1) לחוק כניסה לישראל, התשי""ב-1952, ועבירות בנשק (עסקה אחרת), עבירה לפי סעיף 144(ב2) לחוק העונשין, התשל""ז-1977 (להלן: ""חוק העונשין"").",ההליך וכתב האישום
"ת""פ 25624-03-22","הודאת הנאשם ניתנה, כאמור, במסגרת הסדר טיעון אשר כלל את תיקון כתב האישום, מבלי שהושגה הסכמה לעניין העונש. נקבע כי לעניין זה יטען כל צד את טענותיו באופן חופשי.",ההליך וכתב האישום
"ת""פ 25624-03-22","בעובדות כתב האישום המתוקן (להלן: ""כתב האישום"") נאמר כי מואמן אבו עאסלה (להלן: ""מואמן""), ג'ואד אבו ריא (להלן: ""ג'ואד"") והאדי עאסלה (להלן: ""האדי"") הם קרובי משפחה וחברים. אחיו של האדי, באסל עאסלה (להלן: ""באסל""), הינו הבעלים של עסק לשטיפת רכבים בעראבה.",ההליך וכתב האישום
"ת""פ 25624-03-22","במהלך שנת 2021, במועדים שאינם ידועים למאשימה, נכנס הנאשם לישראל ושהה בה לתקופות שונות לסירוגין, בניגוד לחוק וללא אישור כניסה ושהייה כדין. במסגרת שהותו זו בישראל, במועדים שאינם ידועים למאשימה, עבד הנאשם בעסק של באסל ובמסגרת עבודתו הכיר את מואמן, ג'ואד והאדי.",ההליך וכתב האישום
"ת""פ 25624-03-22","עובר ליום 30.10.2021 תכנן מואמן לרכוש כלי נשק. לשם כך, יצר מואמן קשר עם הנאשם ביום 30.10.2021 וביקש ממנו לבדוק עבורו אפשרות לרכישת כלי נשק מסוג קרלו. בתגובה, מסר הנאשם למואמן כי יש לו חבר המעוניין למכור כלי נשק (להלן: ""הסוחר"").",ההליך וכתב האישום
"ת""פ 25624-03-22","בהמשך לאמור, ביום 5.11.2021, לאחר תיאום מוקדם באמצעות הנאשם בין מואמן לסוחר, נסע מואמן לטול כרם יחד עם ג'ואד והאדי, שם פגש את הנאשם והסוחר. במעמד זה הציג הסוחר למואמן, בנוכחות הנאשם, תת מקלע מאולתר מסוג קרלו בצבע שחור, שהינו כלי שסוגל לירות כדור או קליע שבכוחם להמית אדם (להלן: ""הנשק""). לאחר שבדק את טיב הנשק, סיכם מואמן עם הסוחר כי ירכוש אותו תמורת 3,500 ₪, אותם העביר לסוחר במעמד המפגש. עוד הוסכם כי החזקה בנשק תועבר לידי מואמן על ידי הנאשם לאחר שמואמן ייצא משטחי הרשות הפלסטינית.",ההליך וכתב האישום
"ת""פ 25624-03-22","בהמשך אותו יום, פגש הנאשם את מואמן בעיר טייבה ומסר לידיו את הנשק. כל זאת, בלא רשות על פי דין ומבלי שהיה לנאשם אישור כניסה ושהייה כדין בישראל. בהמשך, נסע מואמן לעראבה, יחד עם ג'ואד והאדי, כשהוא מחזיק, נושא ומוביל את הנשק בתוך שקית בלא רשות על פי דין.",ההליך וכתב האישום
"ת""פ 25624-03-22","במסגרת ראיותיה לעונש הגישה המאשימה את תדפיס רישומו הפלילי של הנאשם (מע/1), ממנו עולה כי לחובתו הרשעה קודמת אחת מיום 1.3.2022, בעבירות של כניסה או ישיבה בישראל שלא כחוק והפרעה לשוטר במילוי תפקידו, בגינן הוטל עליו מאסר מותנה בן 14 ימים שהינו בר הפעלה. כן הגישה המאשימה את הכרעת הדין וגזר הדין בתיק מושא ההרשעה הנ""ל (מע/3).",הראיות לעונש 
"ת""פ 25624-03-22","	המאשימה הציגה הכרעת דין וגזר דין נוספים שניתנו כנגד הנאשם ביום 3/10/2022 - כשבעה חודשים לאחר ביצוע העבירות נשוא תיק זה - בת""פ 58907-07-22 בבית המשפט המחוזי מרכז לוד, בו הורשע הנאשם בעבירה של קשירת קשר לפשע (מע/2). בגין אותו תיק, נדון הנאשם למאסר בפועל החופף את תקופת מעצרו מיום 18.7.2022 ועד 3.10.2022 וכן ל- 6 חודשי מאסר על תנאי.",הראיות לעונש 
"ת""פ 25624-03-22",מטעם ההגנה לא הוגשו ראיות לעונש.,הראיות לעונש 
"ת""פ 25624-03-22","בטיעוניה לעונש עמדה המאשימה על חומרתה של תופעת החזקת הנשק הבלתי חוקי, אשר אלמלא הייתה קיימת לא היו מבוצעות עבירות אלימות באמצעות נשק. תופעה זו פוגעת בשלום הציבור וביטחונו, בחיי אדם וברכוש, ועל בית המשפט להילחם בה באמצעות הטלת ענישה מחמירה. עבירת הכניסה לישראל שלא כחוק פוגעת בשלטון החוק ובסדר הציבורי.",טיעוני הצדדים לעונש
"ת""פ 25624-03-22","בבחינת נסיבות ביצוע העבירות, ביקשה ב""כ המאשימה ליתן את הדעת לסוג הנשק מושא העסקה - תת מקלע מאולתר מסוג קרלו, שהינו כלי שסוגל לירות כדור או קליע שבכוחם להמית אדם, שפוטנציאל הנזק הנשקף ממנו רב ביותר. בהפנותה לגזר הדין שניתן בעניינם של מואמן, ג'ואד ומעורב נוסף, נטען כי במקרה דנא אין המדובר בהחזקה תמימה של נשק למטרה שאינה ידועה. השלושה עשו שימוש בנשק זה עת ירו לעבר בניין מפלגת ""חד""ש"" בעיר סח'נין, והתכוונו לעשות בו שימוש נוסף של ירי לעבר ביתו של אדם החב להם כסף, שאז נתפסו על ידי המשטרה. כן ביקשה המאשימה להביא בחשבון את חלקו הדומיננטי של הנאשם בעסקת הנשק, שאפשר למעשה להוציאה אל הפועל, ואת התכנון שקדם לביצועה.",טיעוני הצדדים לעונש
"ת""פ 25624-03-22","לשיטת המאשימה, יש לקבוע שני מתחמי ענישה נפרדים בגין העבירות שיוחסו לנאשם, שכל אחת מהן מהווה אירוע עברייני נפרד.",טיעוני הצדדים לעונש
"ת""פ 25624-03-22","לאחר שהציגה פסיקה המלמדת לשיטתה על מדיניות הענישה הנוהגת, עתרה המאשימה לקבוע מתחם הנע בין 54 ל-89 חודשי מאסר בפועל ביחס לעבירת הנשק, ומתחם הנע בין מאסר מותנה ל-5 חודשי מאסר בפועל ביחס לעבירת הכניסה לישראל שלא כחוק.",טיעוני הצדדים לעונש
"ת""פ 25624-03-22","נוכח עברו הפלילי של הנאשם, ביקשה המאשימה לגזור את עונשו ברף האמצעי של המתחמים שהתבקשו על ידה, ולהפעיל את המאסר המותנה בן 14 הימים התלוי ועומד כנגדו במצטבר לכל עונש שייגזר עליו בתיק זה. המאשימה ביקשה שלא לנכות מהמאסר שיוטל על הנאשם את ימי מעצרו בין 18.7.2022 ועד 3.10.2022, שכן עונש המאסר שנגזר עליו בת""פ 58907-07-22 שצוין לעיל, חופף תקופה זו. כן ביקשה להשית על הנאשם עונש מאסר מותנה וקנס.",טיעוני הצדדים לעונש
"ת""פ 25624-03-22","בפתח טיעוניו לעונש ביקש ב""כ הנאשם שלא לקבל את עמדת המאשימה כי יש לקבוע שני מתחמי ענישה נפרדים בגין העבירות בהן הורשע שולחו. נטען כי כניסתו של הנאשם לישראל הייתה לצורך מסירת הנשק לידי מואמן זמן קצר לאחר שנרכש על ידי האחרון. לפיכך, עתר הסנגור לקבוע מתחם עונש אחד בגין שתי העבירות.",טיעוני הצדדים לעונש
"ת""פ 25624-03-22","לטענת ההגנה, הנאשם לא יכול היה לסרב לבקשתו של מואמן כי יכיר לו סוחר נשק. זאת, נוכח העובדה שאותה עת עבדו השניים בעסק בבעלות בן דודו של מואמן והיו ביניהם יחסי מרות. אי היענות לבקשתו של מואמן עלולה הייתה להביא להפסקת עבודתו של הנאשם, לפגיעה כלכלית במשפחתו, המונה 8 נפשות, ולהפסקת הטיפולים הרפואיים שמקבלת אמו הסובלת ממחלת לב. נטען כי זה השיקול שניצב לנגד עיני הנאשם כאשר נענה לבקשתו של מואמן.",טיעוני הצדדים לעונש
"ת""פ 25624-03-22","הסנגור בקש לדחות את טענת המאשימה בנוגע לחלקו המשמעותי של הנאשם בביצוע עבירת הנשק, באשר לא הוא זה שרכש אותו, מכר אותו או ניהל משא ומתן על מחירו. חלקו הסתכם בעריכת היכרות בין מואמן לבין סוחר הנשק והוא אף לא קיבל כל תמורה בגין תיאום העסקה. לפיכך, לכל היותר היה הנאשם מתווך בעסקה, הגם שלשיטת ב""כ הנאשם חלקו לא עולה אפילו כדי כך.",טיעוני הצדדים לעונש
"ת""פ 25624-03-22","לאור האמור, ביקשה ההגנה לקבוע מתחם ענישה הנע בין 10 ל-24 חודשי מאסר בפועל, הנלמד מהפסיקה אליה הפנתה.",טיעוני הצדדים לעונש
"ת""פ 25624-03-22","בעת גזירת העונש בתוך המתחם, ביקש הסנגור להתחשב בגילו של הנאשם, שהיה כבן 21 בעת ביצוע העבירות והוגדר בפסיקה כבגיר-צעיר, בהודאתו, המבטאת הפנמה של חומרת מעשיו, ובעובדה שהלה שוהה במעצר מזה תקופה ארוכה.",טיעוני הצדדים לעונש
"ת""פ 25624-03-22","בדברו האחרון הודה הנאשם כי עשה טעות והביע צער על מעשיו. לדבריו, הוא נכנס לישראל על מנת לפרנס את משפחתו, וכעת הוא מבקש לחזור לביתו, להתחתן ולהקים משפחה. הנאשם הוסיף כי למד לקח מהמעצר, המהווה חוויה קשה עבורו, כי לא יבצע עבירות נוספות ולא ישוב לישראל.",דברו האחרון של הנאשם
"ת""פ 25624-03-22","בבואו לגזור את עונשו של נאשם, נדרש בית המשפט לפעול בהתאם לעיקרון ההלימה, המחייב קיומו של יחס הולם בין חומרת העבירה בנסיבותיה ומידת אשמו של הנאשם, לבין סוג ומידת העונש המוטל עליו. לשם כך, על בית המשפט להתחשב בערכים החברתיים המוגנים שנפגעו מביצוע העבירה, במידת הפגיעה בהם, במדיניות הענישה הנוהגת במקרים דומים ובכלל הנסיבות הקשורות בביצוע העבירה כמפורט בסעיף 40ט לחוק העונשין.",קביעת מתחם העונש ההולם
"ת""פ 25624-03-22","הערכים המוגנים שנפגעו מביצוע עבירת הנשק בענייננו הם ההגנה על חייו, שלומו וביטחונו של הציבור. העבירה של כניסה וישיבה בישראל שלא כחוק פגעה בערך המוגן של ביטחון המדינה וריבונותה.",קביעת מתחם העונש ההולם
"ת""פ 25624-03-22","על החומרה היתרה בה מתייחס בית המשפט לעבירות בנשק אין צורך להכביר מלים. נוכח היקפן העצום של העבירות הנעשות בנשק, הפוגעות בחברה ובמרקם החיים של אוכלוסיות גדולות בה, תוך שהן מסבות נזקים הרסניים בדמות גרימת נזקים בגוף ובנפש לאזרחים תמימים, ופגיעה ממשית בביטחונם האישי וברווחתם, נרתם בית המשפט למלחמה בתופעה זו בדרך של החמרה בענישה על כלל המעורבים. יפים לעניין זה דברי בית המשפט בע""פ 147/21 מדינת ישראל נ' ביטון (14.2.2021), שם נאמר כי:",קביעת מתחם העונש ההולם
"ת""פ 25624-03-22","""עבירות נשק לסוגיהן היו זה מכבר למכת מדינה. האיסורים על עבירות כאמור באים להגן על ערכים חברתיים שכוללים שמירה על חיי אדם ועל שלמות גופו, וכן שמירה על סדרי חיים תקינים ושלווים שאינם מופרעים על ידי איש האוחז באקדח, ברובה, או בתת-מקלע. יתירה מכך: עסקינן באיסורים על מעשי הכנה לקראת ביצועם של מעשים פליליים חמורים ומסוכנים עד-מאד, אשר נעשים באמצעות כלי ירייה ואשר כוללים איומים, תקיפה, ירי במקום מגורים, גרימת חבלה והמתה. בדרך כלל, מעשי הכנה שאינם מגיעים כדי ניסיון לעבור עבירה פלילית אינם בני עונשין; ואולם, לא כך הוא כאשר מדובר במעשי הכנה שחומרתם מגיעה כדי סיכון ממשי וחמור לפרט ולחברה כאחד (ראו: ש""ז פלר יסודות בדיני עונשין 52-48 (כרך ב', תשמ""ז)). על מעשי הכנה כאלה נענשים בחומרה, ואין זה מקרי שעצם הרכישה או ההחזקה של כלי נשק בלא רשות על פי דין להחזקתו גוררת אחריה עונש מרבי של שבע שנות מאסר, כאמור בסעיף 144(א) לחוק העונשין. עונש זה ועונשים אחרים, שחלקם חמורים אף יותר, אשר מוטלים על עברייני נשק, מהווים חלק ממלחמתה הבלתי מתפשרת של החברה בנגע ששמו זילות חיי אדם והקלות הבלתי נסבלת של הלחיצה על ההדק. [...] הטלת עונשים חמורים ומרתיעים על עברייני נשק היא עיקר תרומתם של בתי המשפט למיגור התופעה ולהרחקת העבריין עם האקדח משגרת חייהם של אזרחי מדינה שומרי חוק"".",קביעת מתחם העונש ההולם
"ת""פ 25624-03-22","	בפסק דין שניתן לאחרונה בע""פ 5602/22 מדינת ישראל נ' פלוני (14.9.2022) ציין כב' השופט א' שטיין כי:",קביעת מתחם העונש ההולם
"ת""פ 25624-03-22","""בהמשך לדברים אלה הבהרתי, בפסק הדין שניתן באחרונה בהסכמת חבריי השופטים י' אלרון וי' כשר, כי הענישה המחמירה והבלתי מתפשרת כאמור צריכה לחול ללא סייגים על כל נאשם בגיר באשר הוא, שכן ""בטיפולנו בעבירות [נשק] מסוג זה ובמבצעיהן, להרתעת היחיד והרבים ולהרחקת עברייני הנשק מהחברה על ידי השמתם בין כותלי הכלא לתקופות ממושכות יש מעמד בכורה"", ועל כן ""ככלל, יעדים עונשיים אלו מוחקים מניה וביה את בקשת העבריין לשיקום [...] גם כאשר מדובר בעבריין צעיר שהסתבך לראשונה בפלילים ובקשתו לשיקום כנה ואף זוכה לתמיכתו של שירות המבחן"" (ראו ע""פ 4077/22 פלוני נ' מדינת ישראל (פסקה 12) [פורסם בנבו] (‏28.7.2022)). זאת, מסיבה פשוטה: ""בימים קשים אלה, השיקום שבראש מעייננו הוא שיקום המרחב הציבורי המדמם כתוצאה מעבירות נשק בלתי פוסקות והשימוש העברייני בנשק חם."" (שם). בהקשר זה אוסיף ואציין את המובן מאליו: בית משפט שמקל בעונשו של עבריין נשק מכביד על החברה שנאלצת להגן על עצמה – על כל בניה ובנותיה – מעברייני נשק"".",קביעת מתחם העונש ההולם
"ת""פ 25624-03-22","	בע""פ 4103/22 מדינת ישראל נ' אמון (6.11.2022) נאמר כי:",קביעת מתחם העונש ההולם
"ת""פ 25624-03-22","""בית משפט זה שב והדגיש את החומרה הרבה הגלומה בעבירות בנשק. עבירות אלו טומנות בחובן פוטנציאל פגיעה בחיי האדם ובשלמות גופו, ומסכנות את ביטחון הציבור והסדר הציבורי בכללותו (עניין ביאדסה, פסקה 6; ע""פ 1695/22 מדינת ישראל נ' גנאים, פסקה 11 [פורסם בנבו] (29.3.2022); ע""פ 5522/20 חלייחל נ' מדינת ישראל, פסקה 7 [פורסם בנבו](24.2.2021) ). חומרתן הרבה של עבירות מסוג זה מתעצמת, בין היתר, משום החשש שישמשו בסיס לביצוע פעילות טרור או פעילות עבריינית (ע""פ 8017/20 מדינת ישראל נ' גריפאת, פסקה 6 [פורסם בנבו] (22.12.2020); ע""פ 135/17 מדינת ישראל נ' בסל, פסקה 10 [פורסם בנבו] (8.3.2017)). בנוסף, כפי שצוין בעבר, עבירות בנשק במדינת ישראל הפכו זה מכבר ל""מכת מדינה"", ומשכך קיים צורך בענישה מחמירה, אשר תגביר את ההרתעה מפני ביצוען. לעניין זה יפים דבריו של השופט י' עמית בעניין קדורה:   ",קביעת מתחם העונש ההולם
"ת""פ 25624-03-22","""החזקת נשק שלא כדין מאיימת על שלום הציבור ובטחונו [...]. לנוכח היקפן המתרחב של עבירות המבוצעות בנשק, הזמינות הבלתי נסבלת של נשק בידי  מי שאינו מורשה לכך, מהווה כאמור סיכון של ממש ומגבירה את הסיכון לביצוע עבירות חמורות נוספות [...] כמו גם לאסונות נוראיים. יעידו על כך ריבוי המקרים במגזר הערבי בעת האחרונה, כאשר אזרחים תמימים – כמו ילד רך בשנים ועלמה צעירה – נפגעים ואף מוצאים את מותם בביתם-מבצרם או בגן השעשועים, כל זאת כתוצאה משימוש בנשק של אחרים. מציאות קשה זו מחייבת לנקוט ביד מחמירה כלפי מעורבים בעבירות נשק, אף אם הם נעדרי עבר פלילי [...]. ענייננו ב'מכת מדינה' שהצורך להילחם בה על מנת להגן על הציבור, מצריך מענה הולם והטלת עונשי מאסר משמעותיים [...]"" (ההדגשות הוספו – ע' פ'; שם, פסקה 6; ראו גם את פסק הדין של השופט מ' מזוז בע""פ 4406/19 סובח נ' מדינת ישראל [פורסם בנבו] (5.11.2019) (להלן: עניין סובח)).""",קביעת מתחם העונש ההולם
"ת""פ 25624-03-22","נוכח היקף התופעה והצורך במיגורה, נרתם אף המחוקק למלחמה בעבירות בנשק. זאת על ידי תיקון חוק העונשין שנכנס לתוקפו ביום 8.12.2021 שמטרתו החמרה בענישה, לרבות קביעת עונשי מינימום לעבירות בנשק, ובכללן רכישה, החזקה, נשיאה, והובלה. התיקון נועד להילחם בהתפשטות העבירות בנשק בקרב קבוצות גדולות באוכלוסייה, נוכח ייחודיות התופעה והשלכותיה החמורות והמחיר שהיא גובה בחיי אדם. התיקון החמיר את העונש הקבוע בצדה של עבירת הרכישה של כלי נשק משבע שנות מאסר לעשר שנות מאסר, וכן קבע כי בתקופה של שלוש שנים מיום פרסומו, לא יפחת עונשו של מי שהורשע בעבירות המנויות בסעיף 144 לחוק העונשין, מרבע העונש המרבי שנקבע לאותה עבירה, אלא אם כן יחליט בית המשפט, מטעמים מיוחדים שיירשמו להקל בעונשו. עוד נקבע כי עונש מאסר לפי אותו סעיף לא יהא, בהעדר טעמים מיוחדים, כולו על תנאי.",קביעת מתחם העונש ההולם
"ת""פ 25624-03-22","נכון הוא שאותו תיקון אינו חל בענייננו, שכן העבירות בוצעו טרם כניסתו לתוקף, אך יש בו כדי ללמד כי בצוק העתים, ונוכח ממדי התופעה, נרתם אף המחוקק למלחמה בעבירות בנשק על ידי החמרת העונשים המוטלים בגינן.",קביעת מתחם העונש ההולם
"ת""פ 25624-03-22","אין בידי לקבל את טענת המאשימה כי יש לקבוע מתחמי ענישה נפרדים בגין כל אחת מהעבירות בהן הורשע הנאשם. העבירה של כניסה לישראל ושהייה בתחומה באופן בלתי חוקי היא זו שאפשרה לנאשם לבצע את עבירת הנשק. לכן נראה כי שתי העבירות כרוכות זו בזו וההפרדה בין השתיים תהיה מלאכותית ומאולצת. יפים לעניין זה דברי בית המשפט בע""פ 2240/21 מדינת ישראל נ' שמואל חיים שחר (08.11.2021) נפסק כי:",קביעת מתחם העונש ההולם
"ת""פ 25624-03-22","""כידוע, השלב הראשון בגזירת הדין עבור ביצוע מספר עבירות, הוא בחינה אם עבירות אלה מהוות ""כמה אירועים"", שאז ייקבעו מתחמי ענישה הולמים לכל אחד מאירועים אלה; או שמדובר ב""אירוע אחד"", שבגינו ייקבע מתחם ענישה כולל (ראו סעיף 40יג לחוק; וכן: ע""פ 8641/12 סעד נ' מדינת ישראל, פ""ד סו(2) 772, 790 (2013)). בתוך כך, נדרש בית המשפט לבחון אם העבירות הנדונות מקיימות ביניהן ""קשר ענייני הדוק"" עד כדי שיש לראות בהן כ""אירוע אחד"" כאמור (ע""פ 4910/13 ג'אבר נ' מדינת ישראל, [פורסם בנבו] פסקה 5 לחוות דעתה של השופטת ד' ברק-ארז (29.10.2014)). בבחינה זו ייתן בית המשפט את דעתו על הנסיבות העובדתיות הרלוונטיות לעבירות, ובין היתר, יבחן ""האם ביצוען של העבירות מאופיין בתכנון; האם ניתן להצביע על שיטתיות בביצוע העבירות; האם העבירות התרחשו בסמיכות של זמן או מקום; האם ביצועה של עבירה אחת נועד לאפשר את ביצועה של העבירה האחרת או את ההימלטות לאחר ביצועה, וכיוצא באלו נסיבות עובדתיות"" (ע""פ 1261/15 מדינת ישראל נ' דלאל, [פורסם בנבו] פסקה 22 לחוות דעתו של השופט נ' סולברג (3.9.2015); ההדגשות במקור).... כן נקבע כי 'בבחינת הנסיבות העובדתיות, מן ההכרח לבית המשפט להעמיד לנגד עיניו את השאלה האם השקפה על העבירות כעל כמה אירועים תהא מלאכותית, באופן שיגרע ממהות העניין בכללותו, או שלא ישקף את סיפור המעשה כהווייתו'"" (ההדגשה אינה במקור – א.ט). ",קביעת מתחם העונש ההולם
"ת""פ 25624-03-22","בבחינת הנסיבות הקשורות בביצוע העבירות בענייננו הבאתי בחשבון את התכנון שהיה כרוך בביצוע עבירת הנשק. תכנון זה כלל תיאום בין מואמן לסוחר מטול כרם, נסיעה משותפת של הנאשם, מואמן, ג'ואד והאדי לטול כרם להשלמת העסקה ומפגש בין הנאשם למואמן בעיר טייבה על מנת למסור את הנשק לידי מואמן.",קביעת מתחם העונש ההולם
