verdict,text,part
"ת""פ 14476-04-15","אשר למדיניות הענישה הנוהגת בעבירת תמיכה בארגון טרוריסטי, הצדדים לא הציגו פסיקה. אפנה לת""פ (ב""ש) 40492-12-14 מדינת ישראל נ' עומר אבו קוש (8.9.15) שם הפנה בית המשפט למספר גזרי דין שעסקו בעבירה זו בנסיבות של פרסומים ברשתות החברתיות בשבח ארגון טרור, ובהם מתחם הענישה נע בין 7 ל-24 חודשי מאסר ונגזרו עונשים ברף התחתון. באותו גזר דין נקבע מתחם שנע בין מאסר על תנאי לחודשי מאסר בודדים, ומתוך התחשבות בנסיבות האישיות של הנאשם, לרבות חרטה וסיכויי שיקום, בוטלה הרשעתו ונגזר עליו של""צ, התחייבות כספית ותשלום הוצאות משפט בסך של 75,000₪. ראו עניין דומה של תמיכה בארגון טרור והסתה לאלימות דרך הרשתות החברתיות, ת""פ (י-ם) 44920-12-14 מדינת ישראל נ' אברהים עאבדין (9.6.15) והפסיקה שנסקרה שם, בו קבע בית המשפט מתחם שנע בין 9 ל-24 חודשי מאסר בפועל ועונש של 10 חודשי מאסר. יחד עם זאת, אין להתעלם מן העובדה שתמיכה בארגון טרור אשר באה לידי ביטוי מעשי בדרך של פרסומים ברשתות החברתיות, שונה מתמיכה באופן של השתתפות באופן אקטיבי בפעילויות של הארגון, כפי שעשה הנאשם בענייננו.",דיון והכרעה
"ת""פ 14476-04-15","בת""פ (י-ם) 42199-12-14 מדינת ישראל נ' עובידה עמירה (30.6.15) הורשע הנאשם בעבירות חברות ותמיכה בארגון טרוריסטי, בנסיבות הדומות מעט לענייננו (נקיטת חלק בפעילויות דתיות, מנהלתיות וחינוכיות של חמאס, פעולות תמיכה באסירי חמאס שובתי רעב ומשוחררי עסקת שליט ועד). בית משפט השלום קבע מתחם לשתי העבירות גם יחד (כאשר חברות בארגון טרוריסטי חמורה יותר מתמיכה בארגון), הנע בין מספר חודשים חד-ספרתי גבוה ל- 24 חודשי מאסר בפועל.",דיון והכרעה
"ת""פ 14476-04-15","אשר למדיניות הענישה הנוהגת בעבירות הנוגעות להתפרעויות והשלכת זיקוקים ובקבוקי תבערה, ב""כ המאשימה הפנתה לע""פ 7643/11 מסוודה נ' מדינת ישראל (7.4.13), בו ביהמ""ש העליון הותיר על כנו עונש של שש שנות מאסר בפועל, בגין השתתפות הנאשם במספר התפרעויות בסילוואן, בהן ייצר יחד עם אחרים 15 בקבוקי תבערה, ויידה בקבוק תבערה אחד ושתי אבנים לעבר בתי יהודים, כאשר בהתפרעויות אלו נפגעו קצין מג""ב ואדם נוסף מבקבוקי התבערה שהושלכו לעברם וספגו כוויות קשות. הנאשם הורשע על פי הודאתו בעבירות ייצור נשק, חבלה בכוונה מחמירה וניסיון לתקיפת שוטר בנסיבות מחמירות. עוד הפנתה לע""פ 2579/14 פרחאן נ' מדינת ישראל (25.5.15), בו בית המשפט העליון הותיר על כנו עונש של שש וחצי שנות מאסר בפועל בגין הרשעת המערער על פי הודאתו בעבירות של קשירת קשר לביצוע פשע, ייצור נשק וחבלה בכוונה מחמירה. דובר היה במקרה אחד של קשירת קשר עם אחרים ליידות בקבוקי תבערה לעבר כוחות הביטחון בסמוך למסגד אל אקצא. המערער ואחרים רכשו וייצרו בקבוקי תבערה, הציתו אותם והשליכו לעבר כוחות הביטחון. אחד מבקבוקי התבערה פגע באפוד של שוטר שנכח במקום וזה החל לבעור. אציין כי בפסק הדין יוחסה חשיבות לתכנון העבירה במקום רגיש, ליד מסגד אל אקצא, כנסיבה לחומרה, ברם מצד שני בשונה מענייננו מדובר שם במקרה אחד בלבד. ",דיון והכרעה
"ת""פ 14476-04-15","ב""כ הנאשם הפנה לגזר דין בת""פ (י-ם) 41851-06-12 מדינת ישראל נ' בצבוץ (4.3.13), שם קבע סגן הנשיא השופט י' נועם כי מתחם הענישה לכל אישום הכולל עבירות של יידוי בקבוק תבערה לעבר כלי רכב או לעבר בניין מגורים – שבו הייתה הרשעה בעבירות של ייצור נשק, ניסיון הצתה וניסיון לגרימת חבלה בכוונה מחמירה – הוא בין 12 חודשים ל-40 חודשים למבצע העיקרי, ובין 8 חודשים ל-30 חודשים בעניינו של מסייע. הנאשמים הורשעו בגין מספר אירועים כאלו, ודינם נגזר בין 36 ל-40 חודשי מאסר בפועל. ערעור הנאשמים על גזר הדין נדחה (ע""פ 2337/13 קוואסמה נ' מדינת ישראל (16.9.13)). עוד הפנה לת""פ (י-ם) 40011-04-14 מדינת ישראל נ' עביד (21.9.15) (להלן: ""פס""ד עביד""), שם קבע בית המשפט, תוך השוואה והסתמכות על פס""ד בצבוץ, מתחם ענישה, ככל שהוא מתייחס לעבירות של יידוי בקבוקי תבערה, שבין 12 ל-50 חודשי מאסר בפועל. בית המשפט גזר את דינם של הנאשמים בהתאם לריבוי האישומים בהם כל אחד מהם הורשע, למהות האישומים ולחלקם של הנאשמים, וגזר בין היתר עונש של 66 חודשי מאסר על נאשם 1 שהורשע בשמונה אישומים, 40 חודשי מאסר לנאשם 2 שהורשע בארבעה אישומים, בתוספת פיצוי ומאסר מותנה, 24 חודשי מאסר לנאשם 3 שהורשע בשני אישומים, ו-52 חודשי מאסר לנאשם 4 שהורשע בששה אישומים.",דיון והכרעה
"ת""פ 14476-04-15","אציין כי לאחר דיון הטיעונים לעונש שהתקיים לפניי, ניתן פסק דין ביום 9.3.16 בערעור שהגישה המדינה על גזר הדין האמור שניתן בפס""ד עביד, אשר בו התקבל הערעור ונקבע כי גזר הדין נוטה לקולא באופן שמצדיק התערבות. לדבריו: ""למותר לציין את החומרה הרבה, את המסוכנות – סכנת נפשות פשוטו כמשמעו – ואת הצורך להרתיע את המשיבים ואחרים שכמותם. ההסלמה מדאיגה, ויש להעניש ביד קשה כדי לעשות לשירוש התופעה. ברי כי מדובר ברקע אידיאולוגי-לאומני-גזעני, והרי זה שיקול חשוב בשיקולי הענישה. יחד עם זאת, עודנו מדברים באנשים צעירים, גם אם אינם קטינים עוד, הרי שעתידם לפניהם, ובד בבד עם יד תקיפה, אין לסתום את הגולל על שיקולי שיקום והתחשבות בנסיבות אישיות."" בית המשפט העליון החמיר את העונשים שנפסקו, כך שבסופו של דבר נפסקו לנאשם 1, 82 חודשי מאסר (חלף 66 חודשים); לנאשם 2, 50 חודשי מאסר (חלף 40 חודשים); לנאשם 3, 30 חודשי מאסר (חלף 24 חודשים); ולנאשם 4, 66 חודשי מאסר (חלף 52 חודשים).",דיון והכרעה
"ת""פ 14476-04-15","עיון בפסיקה מגלה כי ניתן למצוא מנעד רחב יחסית של עונשים באשר לעבירות הכרוכות בזריקת בקבוקי תבערה על כוחות ביטחון או על יהודים על רקע אידיאולוגי. כמובן שיש השלכות ברורות על רמת הענישה כשמדובר במקרה חד פעמי או בריבוי מקרים והתארגנות, כמו גם באם מדובר בקטינים (כאשר גם לגביהם חלה החמרה בענישה). מכל מקום, סבורני כי מגמת ההחמרה בענישה נוכח ההסלמה, כפי שבאה לידי ביטוי בפס""ד עביד בבית המשפט העליון שניתן לאחרונה, היא זו שצריכה להנחותינו בגזירת הדין במקרים כגון דא.",דיון והכרעה
"ת""פ 14476-04-15","כעת אבחן את נסיבות הביצוע לפי סעיף 40ט' לחוק העונשין, בהתאם לאישומים השונים ולפי הרלוונטיות של כל נסיבה ונסיבה:",דיון והכרעה
"ת""פ 14476-04-15","אישום מס' 1 – התמיכה בארגון החמאס מתפרשת על פני מספר רב של אירועים, כולל השתתפות הנאשם בתהלוכות תוך הנפת דגלי חמאס, לרבות בתהלוכה בעיסאוויה בתמיכה בארגון בעת הלחימה שהתנהלה באותה העת (2009) ברצועת עזה), החזקת דגלי חמאס בביתו, השתתפות בכנסים שערך הארגון בהם נשמעו שיעורי דת, ותמיכה באסירים ובמשפחותיהם. להשתתפות בפעילויות אלו ניתן לייחס תכנון חלקי לביצוע העבירות, כאשר לשם ביצוען נדרשה ידיעה ותכנון מראש. מן העבירה צפוי להיגרם נזק בדרך של הגברת התמיכה בארגון הטרור והזדהות עם מטרותיו, ובעידוד לפעולות טרור אלימות כפי שביצע הנאשם בעצמו. לא ניתן לזהות את הנזק שנגרם בפועל מעבירה זו. לנאשם 2 הייתה יכולת להבין את הפסול במעשיו, למרות שהחל בהם בעודו קטין. אשר לנסיבות שהביאו את הנאשם לביצוע העבירה, כאמור לעיל דחיתי את הטענה כאילו שהמניע היה רגשי ולא אידיאולוגי. ביחס לתסקיר שירות המבחן אציין כי פעולות הנאשם באישום 1 וגם בשאר האישומים אינן בגדר היסחפות רגעית חולפת או היגררות אחרי אחרים, אלא נעשו מתוך מניע אידיאולוגי ברור ורצון לפגוע בכוחות הביטחון במטרה להכשילם מביצוע מלאכתם ומתוך הזדהות עם אידיאולוגיית ארגון החמאס.",דיון והכרעה
"ת""פ 14476-04-15","אישומים 4 ו-8 – באישומים אלו הנאשם הצטייד מראש לקראת התפרעות. באישום 4 הצטייד בארבעה בקבוקי תבערה, שתי קופסאות זיקוקים, רוגטקות וגולות, דגלי חמאס ורעלה, ויידה את הזיקוקים והשליך שלושה בקבוקי תבערה ומסר לאחר שניים מאלו שהכין. באישום 8 הצטייד הנאשם בשני ארגזי זיקוקים ויידה אותם. באישומים אלו קיים תכנון משמעותי לביצוע העבירה. חלקו היחסי של הנאשם בביצוע העבירה הוא משמעותי. לא נגרם נזק לגוף או לרכוש מביצוע העבירה, ברם הנזק שהיה צפוי להיגרם מביצוע העבירה הוא סיכון ממשי לחיי אדם ופגיעה ברכוש. הסיבות שהביאו את הנאשם לביצוע העבירה הן אידיאולוגיות, כמתואר לעיל, כאשר באישום 8 נוספה מטרה של סיכול מעצר. הנאשם היה יכול לשלוט על מעשיו ולהימנע מהם.",דיון והכרעה
"ת""פ 14476-04-15","אישום 6 – באישום זה הנאשם השתתף בהתפרעות במהלך מבצע צוק איתן ואחז בכוורת זיקוקים וידה אותם לעבר שוטרים, כאשר אף העז לירות זיקוק לעבר פני שוטר שאחז ביד הנאשם מטווח קרוב. השוטר נפגע והנאשם המשיך לירות זיקוקים לעבר השוטרים. באישום זה אין ציון של עובדות המלמדות על תכנון מראש. חלקו של הנאשם בביצוע העבירה הינו משמעותי, הנזק שהיה צפוי הוא גדול ביותר ביידוי זיקוק מטווח אפס לעבר פני שוטר, ואכן נגרם נזק בפועל לשוטר (הנזק לא פורט ונטען כי הוא ניצל בנס מפגיעה משמעותית). אין ספק כי נסיבות אירוע זה חמורות מאוד.",דיון והכרעה
"ת""פ 14476-04-15","אישום 7 – הנאשם השתתף בהתפרעות ובמהלכה ידה זיקוקים ורימון גז, נמלט מהמקום ושב להתפרעות להמשך יידוי זיקוקים. אחד הזיקוקים פגע בשוטר שהיה במקום. לא מצוין בכתב האישום תכנון שקדם להתפרעות, ברם מעצם החזרה להתפרעות עולה קיומו של תכנון. הנאשם יידה זיקוקים, כאשר על פי כתב האישום, אחד מהם פגע בשוטר. לא צוין מה מידת הנזק שנגרמה לו אך הנזק הצפוי הוא משמעותי. יכולתו של הנאשם להימנע ממעשיו קיימת ומודגשת עקב החזרה להתפרעות. שאר הנסיבות דומות לאישומים דלעיל.",דיון והכרעה
"ת""פ 14476-04-15","לאחר ששקלתי את מכלול הנסיבות, סבורני כי יש להעמיד את מתחמי הענישה כדלקמן:",דיון והכרעה
"ת""פ 14476-04-15",אישום 1: 6 עד 18 חודשי מאסר בפועל;,דיון והכרעה
"ת""פ 14476-04-15","אישומים 4, 6, 7 ו-8: 50 עד 84 חודשי מאסר בפועל.",דיון והכרעה
"ת""פ 14476-04-15","בענייננו לא מתקיימים שיקולים חריגים הנוגעים לנאשם המצדיקים סטייה מהמתחמים שנקבעו, בין אם לקולא, בשל שיקולי שיקום של הנאשם (הנאשם לא נמצא בשיקום),  ובין אם לחומרה, לשם הגנה על הציבור. אציין כי המאשימה לא טענה כי יש להחמיר עם הנאשם מעבר למתחמים.",דיון והכרעה
"ת""פ 14476-04-15","כעת אעבור לבחינת הנסיבות האישיות של הנאשם לפי סעיף 40יא לחוק העונשין, לשם גזירת עונשו בתוך המתחם.",דיון והכרעה
"ת""פ 14476-04-15","אין פגיעה מיוחדת הצפויה לנאשם או למשפחתו עקב העונש. לקולא אציין את גילו הצעיר של הנאשם (21), העובדה כי הנאשם הודה במעשיו וחסך זמן שיפוטי. מנגד אשקול לחומרה את העובדה העולה מהתסקיר, שהנאשם אינו נוטל אחריות מלאה למעשיו ואינו מביע חרטה, ואת הערכת שרות המבחן כי הסיכוי להישנות ביצוע העבירות הוא בינוני. אשר להיעדרו של עבר פלילי, מסכים אני עם עמדת המאשימה כי כיוון שמדובר בריבוי עבירות על פני תקופה ארוכה, המשקל שיש לתת להיעדר עבר פלילי הוא נמוך, בהשוואה למצב של עבירה ראשונה ואירוע בודד. כן לאור ההרשעה בתמיכה בארגון טרור והזדהות הנאשם עם אידיאולוגיית החמאס, כפי שבאה לידי ביטוי בעובדות כתב האישום בהן הודה, המדגישה את חומרת העבירות ונסיבות ביצועיהן, סבורני כי אין ליתן משקל משמעותי להיעדר עבר פלילי.",דיון והכרעה
"ת""פ 14476-04-15","כאמור לעיל, ב""כ הנאשם טוען כי יש להתחשב בעונש שנגזר על נאשם 1, שותפו של נאשם 2 לכתב האישום, של 33 חודשי מאסר בפועל במסגרת הסדר טיעון סגור. זאת תוך שהוא מודה כי חלקו של נאשם 2 גדול ודומיננטי יותר מנאשם 1. האישום היחיד המשותף לנאשמים 1 ו-2 הוא האישום הראשון. נאשם 1 הורשע בגין שני אישומים נוספים, בעבירת ניסיון חבלה בכוונה מחמירה (מספר עבירות) וייצור נשק ובגין יידוי בקבוקי תבערה לעבר רכבים בכביש מעלה אדומים ולעבר ג'יפ משמר הגבול בעיסאוויה. מדובר בפחות אירועים, פחות עבירות ואירועים פחות חמורים מאשר אלו שהורשע בהם נאשם 2. לאור האמור, איני מוצא לנכון להתייחס לעונש שנגזר על נאשם 1 באופן המחייב או משפיע על העונש שייגזר על נאשם 2.",דיון והכרעה
"ת""פ 14476-04-15","בהתאם לסעיף 40יג(ב) לחוק, ולאחר ששקלתי את מכלול השיקולים המפורטים לעיל, אני גוזר על נאשם 2 את העונשים הבאים:",דיון והכרעה
"ת""פ 14476-04-15","בגין אישום 1 – 8 חודשי מאסר בפועל; ובגין יתר האישומים, 6.5 שנות מאסר בפועל החל מיום מעצרו, 15.3.15. העונש בגין אישום 1 ירוצה בחופף למאסר שהוטל על הנאשם בגין יתר האישומים.",דיון והכרעה
"ת""פ 14476-04-15","קנס בסך של 10,000 ₪, שישולם בתוך 120 יום מהיום.",דיון והכרעה
"ת""פ 14476-04-15",מאסר מותנה של 18 חודשי מאסר באם יעבור הנאשם עבירה שבה הורשע בתיק זה בשלוש השנים מאז שחרורו ממאסר.,דיון והכרעה
"ת""פ 14476-04-15",זכות ערעור לבית המשפט העליון בתוך 45 יום.,דיון והכרעה
"ת""פ 14476-04-15","ניתן היום,  ג' ניסן תשע""ו, 11 אפריל 2016, בהעדר הצדדים.",54678313
"ת""פ 14476-04-15",בן ציון גרינברגר 54678313,54678313
"ת""פ 14476-04-15",נוסח מסמך זה כפוף לשינויי ניסוח ועריכה,54678313
"ת""פ 14476-04-15","בעניין עריכה ושינויים במסמכי פסיקה, חקיקה ועוד באתר נבו – הקש כאן",54678313
