verdict,text,part
"ת""פ 17536-08-21","חוק העונשין, תשל""ז-1977: סע'  40ב, 144(א), 40 טו",חקיקה שאוזכרה: 
"ת""פ 17536-08-21","חוק הנוער (שפיטה, ענישה ודרכי טיפול), תשל""א-1971: סע'  24(1), 27(א)",חקיקה שאוזכרה: 
"ת""פ 17536-08-21",מיני-רציו:,"פקודת המבחן [נוסח חדש], תשכ""ט-1969: סע'  20"
"ת""פ 17536-08-21","* בית המשפט גזר על הנאשם שהורשע על פי הודאתו בביצוע עבירות נשק כשהיה בן 17 ואחד עשר וחצי חודשים עונש של 6 חודשי מאסר על תנאי. נפסק, כי בנסיבותיו של הנאשם אין לגזור עליו עונש מאסר, אשר יהיה בו כדי לקטוע את דרכו החיובית ובחרתי להסתפק בעניינו בעונש צופה פני עתיד.","פקודת המבחן [נוסח חדש], תשכ""ט-1969: סע'  20"
"ת""פ 17536-08-21",* עונשין – ענישה – קטינים,"פקודת המבחן [נוסח חדש], תשכ""ט-1969: סע'  20"
"ת""פ 17536-08-21",* עונשין – ענישה – מדיניות ענישה: עבירות נשק,"פקודת המבחן [נוסח חדש], תשכ""ט-1969: סע'  20"
"ת""פ 17536-08-21","בית המשפט נדרש לגזור את דינו של הנאשם, בן 17 ואחד עשר וחצי חודשים בזמן ביצוע העבירה, שהודה בכתב אישום מתוקן במסגרת הסדר טיעון המייחס לו עבירות בנשק (החזקה)- עבירות לפי סעיף 144(א) רישא וסיפא לחוק העונשין.",.
"ת""פ 17536-08-21",בית המשפט פסק כלהלן:,.
"ת""פ 17536-08-21","בית המשפט העליון חזר ועמד על הצורך בהחמרה בעבירות נשק, החמרה שאף קיבלה לאחרונה ביטוי בהטלת עונש מינימום בחוק.",.
"ת""פ 17536-08-21","לא ניתן להתעלם מהעובדה כי הנאשם ביצע את העבירה ימים ספורים טרם הגיעו לבגרות וכידוע אין דינו של קטין שביצע את העבירה על סף גיל האחריות הפלילית כדינו של קטין אשר חצה את גיל האחריות הפלילית זה מכבר. כאשר מדובר בקטין המתקרב לגיל הבגירות, ניתן משקל מופחת לשיקולי הענישה הנוגעים לעבריינים קטינים. משכך ככל שגילו של הקטין קרוב לגיל הבגירות, וככל שקיים אינטרס ציבורי רחב להחמרה בענישה, יקבלו שיקולי ההרתעה וההלימה משקל מוגבר.",.
"ת""פ 17536-08-21","בנסיבותיו של עניין זה, לא ניתן או ראוי להימנע מהרשעתו של הנאשם בעבירה החמורה אותה ביצע. לצד האמור, בבוא בית המשפט לגזור את עונשו של הנאשם יש לתת משקל רב לתסקירים החיוביים מאוד בעניינו של הנאשם, ובית המשפט מברך אותו על שיתוף הפעולה עם גורמי הטיפול, ההתמדה והאמונה בהליך, וכן על האפיק החיובי אותו סיגל הנאשם לעצמו כדרך חיים ואם ימשיך הנאשם להתמיד בכך יהא זה שכרו ושכרה של החברה כולה.",.
"ת""פ 17536-08-21","אין לגזור על הנאשם עונש מאסר, אשר יהיה בו כדי לקטוע את דרכו החיובית ובחרתי להסתפק בעניינו בעונש צופה פני עתיד.",.
"ת""פ 17536-08-21","הנאשם יליד.2003 וכיום כבן 19 וחצי, הודה בכתב אישום מתוקן במסגרת הסדר טיעון ביום 12.01.2022, המייחס לו עבירות בנשק (החזקה)- עבירות לפי סעיף 144(א) רישא וסיפא לחוק העונשין התשל""ז-1977.",גזר דין   עותק מותר לפרסום
"ת""פ 17536-08-21","על פי עובדות כתב האישום המתוקן ביום 31.07.2021, עת היה הנאשם כבן 17 ואחד עשר וחצי חודשים, סמוך לשעה 21:00, החזיק הנאשם נשק, שהינו אקח חצי אוטומטי סי-זד (CZ) תוצרת צ'כיה מודל 75, קליבר 9 מ""מ פאראבלום, כשעצר המחלק שבור בחלקו (להלן: ""האקדח""), אשר יורה ובכוחו להמית אדם. יחד עם האקדח החזיק הנאשם מחסנית תואמת לאקדח ובה עשרה כדורים קליבר 9 מ""מ פאראבלום (להלן: ""המחסנית""), והכול שלא כדין.",גזר דין   עותק מותר לפרסום
"ת""פ 17536-08-21","במועד הנ""ל, בעקבות תלונה על ירי באזור המחבר בין שכונות 30 ו-31 ברהט (להלן: ""המקום"") הגיעו שוטרים אל המקום וכן התמקמו 3 שוטרים במארב בוואדי הסמוך אל המקום (להלן: ""המארב בוואדי""). בין השוטרים במארב בוואדי היו גם השוטרים אלמוג אסרף וחי עמר (להלן: ""השוטרים"", ""אלמוג"" ו-""חי"").",גזר דין   עותק מותר לפרסום
"ת""פ 17536-08-21","במועד ובמקום הנ""ל קיבל הנאשם לידיו, את האקדח והמחסנית, מידיו של אחר שזהותו אינה ידועה למאשימה, והחל לצעוד מהמקום לעבר הוואדי, כשהאקדח והמחסנית בידו.",גזר דין   עותק מותר לפרסום
"ת""פ 17536-08-21","במעמד המתואר, משהתקרב הנאשם כשבידו האקדח והמחסנית, אל המארב בוואדי, יצא השוטר אלמוג כשבידו אקדח משטרתי וצעק לנאשם ""משטרה"", והשוטר חי האיר באמצעות פנס משטרתי על הנאשם. בתגובה הנאשם אשר נבהל נפל ארצה והאקדח נשמט מידו.",גזר דין   עותק מותר לפרסום
"ת""פ 17536-08-21",במעשיו המתוארים לעיל החזיק הנאשם נשק ואביזר של נשק ותחמושת בלא רשות על פי דין להחזקתו.,גזר דין   עותק מותר לפרסום
"ת""פ 17536-08-21",הנאשם מגיע ממשפחה המונה זוג הורים נשואים ושבעה אחים כאשר הנאשם הינו האחרון בסדר ההולדה. המשפחה מתגוררת ברהט  בבית בנוי בבעלותה. מצבה הכלכלי של המשפחה תואר כדחוק והיא נתמכת בקצבאות המוסד לביטוח לאומי.,תמצית תסקירי שירות המבחן
"ת""פ 17536-08-21",מהתסקירים עולה כי אבי הנאשם גינה את מעשיו של בנו ומעלה עמדות נורמטיביות ביחס לשמירה על החוק.,תמצית תסקירי שירות המבחן
"ת""פ 17536-08-21","שירות המבחן התרשם כי בשל קשיי הקיום והפרנסה עמם מתמודדת המשפחה הם התקשו לספק לנאשם את צרכיו הפיזיים והרגשיים, אולם קיימת ביניהם מערכת יחסים חיובית המבוססת על כבוד ועזרה הדדית.",תמצית תסקירי שירות המבחן
"ת""פ 17536-08-21",הנאשם נשר מהמסגרת הלימודית בגיל צעיר מאוד בשל מצבה הכלכלי הקשה של המשפחה והרצון לסייע בפרנסת הבית.,תמצית תסקירי שירות המבחן
"ת""פ 17536-08-21","הנאשם שולב בתעסוקה, עבד בעסק של בן משפחה ותואר כעובד אחראי המחויב לעסק המשפחתי. לאחר מכן, וכבר קרוב לשנה, הנאשם עובד במפעל סמוך ל . מעסיקו תאר אותו כעובד חרוץ, המגיע בזמן מדי יום עובד כ-12 שעות ביום ומבצע את המוטל עליו. כמו כן מסר מעסיקו כי הוא אינו מעורב באירועים חריגים ונתפס במפעל כעובד חרוץ ואחראי.",תמצית תסקירי שירות המבחן
"ת""פ 17536-08-21","מעשה העבירה- הנאשם הודה בביצוע העבירה והביע חרטה על מעורבותו בה. אשר לנסיבות ביצועה ציין כי בעת שנכח בחתונה של משפחתו המורחבת החלו יריות באוויר, ודקות לאחר מכן אדם רעול פנים שאינו מוכר לנאשם, אך הוא מניח כי מדובר במשהו ממשפחתו המורחבת, רץ לעברו וזרק את הנשק לידו. הנאשם שחשש להסתבך החליט לברוח. הנאשם מסר כי הבין את הפסול שבמעשיו אולם היה מונע מהפחד שאחז בו. לדבריו האירוע התרחש על פני דקות ספורות בלבד בהן לא הצליח להפעיל שיקול דעת נכון. כיום בחלוף הזמן הנאשם מוסר כי הוא מבין שפעל בצורה שגויה ואילו היה נתקל בסיטואציה כזאת כיום היה מניח את הנשק ולא בורח, ואף שיתף כי כיום הוא נמנע מללכת לחתונות מחשש שייתקל בנשק. הנאשם מסר כי במשפחתו ובהוראת השייח, אוסרים על הבאת נשק בחתונות.",תמצית תסקירי שירות המבחן
"ת""פ 17536-08-21","שירות המבחן התרשם כי הנאשם הביע רצינות רבה ביחס למסרים שהועברו לו והוא הביע כאב אודות המצב הקשה במגזר הערבי ואובדן החיים הרב, כמו כן התרשם כי הנאשם מביע חרטה כנה אודות מעורבותו בעבירה ומביע עמדות נורמטיביות ביחס לשמירה על חוקים, אי החזקת נשק ושימוש בנשק, וכן מבין את הנזקים וההשלכות ההרסניות שיש למעשים אלו.",תמצית תסקירי שירות המבחן
"ת""פ 17536-08-21","כמו כן מתרשם כי הנאשם מבחין בין טוב לרע ומבחין כי עליו לשמור על עצמו באופן הדוק, שכן לעתים קרובות ישנם אירועי אלימות בקרבת ביתו.",תמצית תסקירי שירות המבחן
"ת""פ 17536-08-21","הקשר עם שירות המבחן-ב- 08.08.2021 הוגש נגד הנאשם כתב האישום וכן בקשה למעצר עד תום ההליכים נגדו. הנאשם נעצר ושוחרר למעצר בית ביום 17.08.2021 בפיקוח דודיו מצד האב. הוא הביע קושי רב לשהות במעצר בית מלא וחש כי מהווה נטל על משפחתו מבלי יכולת לסייע להם כלכלית במצב הקשה בו היא מצויה. בהמשך השתלב הנאשם בתעסוקה והביע שביעות רצון במישור זה. ביום 12.01.2022 התנאים המגבילים שונו והוחלט כי הנאשם ישהה במעצר בית לילי בין השעות 07:00-19:00 בפיקוח הוריו, ביום 05.04.2022 הורחבו שעות ההתאווררות כך שמעצר הבית תקף בין השעות 06:00-23:00 בלבד.",תמצית תסקירי שירות המבחן
"ת""פ 17536-08-21","שירות המבחן מציין כי הנאשם הגיע לרובן המוחלט של הפגישות אליהן זומן, וכן יצר עמו קשר גם מיוזמתו, בשיחות עמו מדבר באופן כן ונעים,  ומביע את רצונו ללמוד עברית ולהשתלב בתעסוקה משמעותית. שירות המבחן מציין כי לאור המוטיבציה הגבוהה שהביע הנאשם להשתלב בשירות לאומי, הוא הופנה לקורס כיבוי אש במסגרת עמותת בת עמי לנערים דוברי ערבית בעלי תיקים פליליים,  והוא מצוי בשלב זה במיונים. שירות המבחן התרשם כי הפנייתו לקורס ושילובו נעשה מיוזמתו ורצונו האישי בלבד ולא מתוך רתיעה מן ההליך הפלילי.",תמצית תסקירי שירות המבחן
"ת""פ 17536-08-21","שירות המבחן מציין כי התלבט בבואו לגבש המלצה בעניינו של הנאשם, שכן מחד מדובר בנאשם אשר ביצע עבירה חמורה מאוד שבעקבותיה עשוי היה לפגוע באופן חמור בזולת, וכן לאור המצב הקשה במגזר הערבי בכלל ובעיר מגוריו של הנאשם בפרט, יש להעביר מסר ברור בנוגע לחומר המעשים. מאידך מדובר בנאשם אשר שיתף פעולה מאז שהופנה לשירות המבחן: הגיע למרבית הפגישות, יצר קשר וניכר כי הבין את חשיבות שיתוף הפעולה עמם. הנאשם לקח אחריות על מעשיו והשיחות עמו היו משמעותיות מאוד. הוא מקיים אורח חיים תקין, אינו מעורב באירועים חריגים ולא נפתחו כנגדו תיקים פליליים נוספים. הוא מביע רצון לקיים אורח חיים נורמטיבי ולהתקדם בחייו, ולהימנע ממעורבות בפלילים.",תמצית תסקירי שירות המבחן
"ת""פ 17536-08-21","שירות המבחן מציין כי ההליך הטיפולי מול הנאשם והשיח אודות העבירה מוצו ובשלה העת לסיים את ההליכים הפליליים נגדו, אך לאור המוטיבציה שמביע להשתלב בשירות לאומי יש מקום להמשיך וללוותו בתהליך באמצעות צו מבחן למשך חצי שנה.",תמצית תסקירי שירות המבחן
"ת""פ 17536-08-21","בסופו של יום המליץ שירות המבחן להימנע מהרשעת הנאשם ולנקוט כלפיו בדרכי טיפול בדמות- צו מבחן למשך חצי שנה, התחייבות, של""צ וקנס.",תמצית תסקירי שירות המבחן
"ת""פ 17536-08-21","ב""כ המאשימה עתרה שלא לקבל המלצת שירות המבחן על כל רכיביה.",טיעוני הצדדים
"ת""פ 17536-08-21","ב""כ המאשימה הדגישה את העובדה כי בעת ביצוע העבירה היה הנאשם ימים ספורים לפני בגרותו וכידוע ככל שהקטין מגיע בפני בימ""ש לנוער, קרוב לבגרות בעת המעשים כך משקלם של השיקולים הקבועים בחוק העונשין, ובפרט עיקרון ההלימה עולה. ב""כ המאשימה סברה כי במקרה זה יש לתת את המשקל לסוג הנשק ולגילו של הנאשם, כמו גם לעובדה שמדובר בעבירה שהיא מכת מדינה ובמיוחד באזור מגוריו של הנאשם.",טיעוני הצדדים
"ת""פ 17536-08-21","בהתייחסה לתסקיר טענה כי חומרת העבירה, כפי שאף עולה מהנסיבות המתוארות בתסקיר, אינה עומדת בהלימה עם המלצת שירות המבחן.",טיעוני הצדדים
"ת""פ 17536-08-21","המאשימה הגישה אסופת פסיקה כדי לתמוך בטענותיה, ובין היתר הפנתה לע""פ 241/21 מדינת ישראל נ' פלוני,  [פורסם בנבו] שם הורשע נאשם שהיה קטין בעת ביצוע העבירה ונגזר עליו עונש מאסר על דרך של עבודות שירות, חרף תסקיר חיובי של שירות המבחן. היא ציינה כי אמנם שם מדובר בעבירות חמורות יותר של נשיאה והובלת נשק, אך עדיין ניתן ללמוד מהאמור שם על הפסיקה הראויה בעבירות נשק, כאשר ביהמ""ש העליון חוזר ומבהיר כי קטינות אינה מהווה תעודת ביטוח מפני הרשעה ואף ענישה מחמירה במקרים המתאימים. כן הפנתה לת""פ ת""פ 39270-12-20 שם הורשע מי שעבר עבירות של החזקת נשק וירי בנשק חם שביצע בהיותו קטין, וזאת חרף המלצה חיובית של שירות המבחן, ולת""פ 69833-11-18 גם שם הורשע מי שעבר עבירה של החזקת נזק בהיותו קטין, חרף המלצה חיובית של שירות המבחן, והושתו עליו מאסר על תנאי, קנס ושל""צ (בהמשך הגישה את ענ""פ 30078-12-19 של בית המשפט המחוזי בבאר שבע אשר דחה ערעור ההגנה על גזר הדין הנ""ל).",טיעוני הצדדים
"ת""פ 17536-08-21","לבסוף, ציינה כי אף שהמדיניות בעבירות מסוג זה הינה לטעון לעונש של מאסר בפועל, הרי שנוכח הנסיבות המתוארות בתסקיר, עתרה להרשעת הנאשם וכן להשתת מאסר בפועל שבאופן חריג-יכול שירוצה בעבודות שירות, מאסר על תנאי, וקנס שלא יפחת מסך 10,000 ₪.",טיעוני הצדדים
"ת""פ 17536-08-21","ב""כ הנאשם עתר לאמץ את המלצות שירות המבחן כלשונן. ",טיעוני הצדדים
"ת""פ 17536-08-21","ראשית התייחס לפסיקה אליה הפנתה ב""כ המאשימה וציין כי בע""פ 241/21 [פורסם בנבו] דובר בתיק שהוגש לבית המשפט המחוזי בגין עבירות הובלה ונשיאת נשק, ומשכך הוא לא רלוונטי לעניינינו. ביחס  לת""פ 39270-12-20 - ציין כי מדובר בהחזקת נשק ותחמושת ועבירה נלווית של ירי בנשק חם ועל כן גם שם מדובר במקרה חמור יותר מאשר בענייננו.",טיעוני הצדדים
"ת""פ 17536-08-21","אשר לטענת המאשימה בנוגע לגילו של הנאשם ולהנחיות בעבירות אלה- טען ב""כ הנאשם כי לטעמו הגיל אינו רלוונטי ומה שרלוונטי היא שאלת מודעותו של הנאשם למעשיו, והשאלה האם הפיק לקחים מהטעות שעשה והפנים והבין את טעותו.",טיעוני הצדדים
"ת""פ 17536-08-21","ב""כ הנאשם ציין כי נסיבות ביצוע העבירה הן אלו המפורטות בהרחבה בתסקיר ואינן מהנסיבות החמורות בעבירות מסוג זה.",טיעוני הצדדים
"ת""פ 17536-08-21","בהתייחסו לתסקיר ציין כי הנאשם היה עצור 8 ימים וכן שהה במעצר בית מלא, לאחר מכן מעצר בית חלקי ויציאה לעבודה, ללא כל הפרת תנאים. הנאשם הגיע לכל המפגשים שנקבעו לו בשירות המבחן והשתתף בקבוצות כנדרש.",טיעוני הצדדים
"ת""פ 17536-08-21","ב""כ הנאשם הוסיף, שביחס לעבירה, מהתסקיר עולה כי גם הוריו של הנאשם מבינים את חומרת המעשה ואת ההשלכות האפשריות, הם מעבירים לנאשם מסרים נורמטיביים ביחס לשמירה על החוק ומביעים דאגה ביחס לעתידו. הנאשם משולב בתעסוקה וחוות דעת מעסיקו חיובית מאוד, הנאשם מסייע למשפחתו, חוסך כסף ומביע שאיפות נורמטיביות לעתידו. ציין כי עולה מהתסקירים כי מדובר בצעיר חכם המבחין בין טוב לרע, שומר על עצמו ונמנע מהסתבכות באירועים אלימים או פליליים.",טיעוני הצדדים
"ת""פ 17536-08-21","עוד ציין לזכות הנאשם כי מהתסקירים עולה שהוא מודה בביצוע העבירה, מביע חרטה, ולוקח אחריות על מעשיו. הנאשם אף נמנע מלהגיע לחתונות כדי להתרחק מעבירות מסוג זה ומבין את ההשלכות של עבירות הנשק. ב""כ הנאשם הדגיש את הקשר החיובי והרציף של הנאשם עם שירות המבחן אשר המליץ לנאשם להשתלב בקורס כיבוי אש, במסגרת עמותת בת עמי כאשר הנאשם מסכים לכל התנאים הנדרשים כדי להשתלב בהכשרות הנדרשות.",טיעוני הצדדים
"ת""פ 17536-08-21","ב""כ הנאשם הוסיף ואמר כי אנשים כדוגמת הנאשם עם ועל אף עברם הפלילי הגיעו לתפקידים בכירים בצבא ובשירות הציבורי, ולאור המלצתו החיובית של שירות המבחן נראה שיש להעדיף אפקט טיפולי שיקומי על פני אפקט הרתעתי וזאת על אף הנחיית פרקליט המדינה ביחס לענישה. בסוף דבריו טען כי שילובו של הנאשם בשירות הלאומי בכיבוי האש עשוי לתת תכלית לחייו ולשרת את הציבור ולעומת זאת ואם יורשע בעבירות נשק לא תהיה בכך כל תועלת לאינטרס הציבורי, על כן עתר לאמץ את המלצות שירות המבחן במלואן.",טיעוני הצדדים
"ת""פ 17536-08-21","לאור דיווח למשטרת ישראל על ירי בעיר רהט, ובתגובה לכך, הקימו מספר שוטרים מארב אשר הנאשם מצא עצמו צועד הישר לעברו ובידו אקדח חצי אוטומטי ומחסנית. כתב האישום בדומה לגרסת הנאשם בפני שירות המבחן, מתאר כי הנאשם קיבל לידיו את הנשק מאחר שזהותו אינה ידועה למאשימה ואף לא לנאשם וכך החל הנאשם לצעוד לכיוון הוואדי שם נעצר על ידי שוטרי המארב והנשק נתפס. אילו לא היה צועד הנאשם הישר לעבר המארב לא ניתן היה לדעת מה היה עולה בגורלו של הנשק, שכן עצם הימצאו של  כלי נשק בידיו של מי שאינו מוסמך לכך, מגלם בחובו פוטנציאל נזק רב, אף מבלי לחשוש מכוונותיו הספציפיות של הנאשם בעניינינו.",דיון והכרעה
"ת""פ 17536-08-21","בהקשר זה נאמר בע""פ 3288/14 מדינת ישראל נ' קריספל [פורסם בנבו] :",דיון והכרעה
"ת""פ 17536-08-21","הנאשם בחר באופן אקטיבי ליטול עמו את הנשק ולנוע עמו לעבר הוואדי ובכך הגדיל את פוטנציאל הסיכון הנ""ל.",דיון והכרעה
"ת""פ 17536-08-21","בית המשפט העליון חזר ועמד על הצורך בהחמרה בעבירות נשק, החמרה שאף קיבלה לאחרונה ביטוי בהטלת עונש מינימום בחוק ויפים לכך הדברים שנאמרו לאחרונה בע""פ 2482/22 מדינת ישראל נ' אחמד קדורה, (פורסם במאגרים ובנבו):",דיון והכרעה
"ת""פ 17536-08-21","החזקת נשק שלא כדין מאיימת על שלום הציבור ובטחונו (ע""פ 7473/20 ‏מדינת ישראל נ' מחאמיד, פסקה 24 [פורסם בנבו] (‏29.6.2021)). לנוכח היקפן המתרחב של עבירות המבוצעות בנשק, הזמינות הבלתי נסבלת של נשק בידי מי שאינו מורשה לכך, מהווה כאמור סיכון של ממש ומגבירה את הסיכון לביצוע עבירות חמורות נוספות (ע""פ 9702/16 אבו אלוליאיה נ' מדינת ישראל, פסקה 3 לפסק דינו של השופט מינץ [פורסם בנבו] (13.9.2017(; ע""פ 2398/14 אלהזייל נ' מדינת ישראל, פסקה 4 לפסק דיני [פורסם בנבו] (8.7.2014)) כמו גם לאסונות נוראיים. יעידו על כך ריבוי המקרים במגזר הערבי בעת האחרונה, כאשר אזרחים תמימים – כמו ילד רך בשנים ועלמה צעירה – נפגעים ואף מוצאים את מותם בביתם-מבצרם או בגן השעשועים, כל זאת כתוצאה משימוש בנשק של אחרים. מציאות קשה זו מחייבת לנקוט ביד מחמירה כלפי מעורבים בעבירות נשק, אף אם הם נעדרי עבר פלילי (ע""פ 8846/15 דראז נ' מדינת ישראל, פסקה 6 [פורסם בנבו] (13.3.2016); ע""פ 5330/20 ענבתאוי נ' מדינת ישראל, פסקה 14 [פורסם בנבו] (‏22.11.2020)). ענייננו ב""מכת מדינה"" שהצורך להילחם בה על מנת להגן על הציבור, מצריך מענה הולם והטלת עונשי מאסר משמעותיים (ע""פ 2251/21 אבו עראר נ' מדינת ישראל, פסקה 25 [פורסם בנבו] (15.12.2021)). ידע כל מי שמחזיק בנשק בלתי חוקי כי צפוי הוא להיענש בחומרה, בבחינת ""אם מחזיקים – למאסר נשלחים"".",דיון והכרעה
