verdict,text,part
"ת""פ 7074-11-23","בהתאם לסעיף 40ב לחוק, העיקרון המנחה בענישה הוא הלימה, קרי: יחס הולם בין חומרת מעשה העבירה ונסיבותיו ומידת אשמו של הנאשם, לבין סוג ומידת העונש המוטל עליו. בקביעת מתחם העונש ההולם, על בית המשפט להתחשב בערך החברתי שנפגע, במידת הפגיעה בו, במדיניות הענישה הנהוגה ובנסיבות הקשורות לביצוע העבירה.",מתחם העונש ההולם
"ת""פ 7074-11-23","הערכים החברתיים עליהם יש להגן מפני אלה המבצעים עבירות בנשק, הם הגנה על שלום הציבור וביטחונו, שמירה על שלמות גופו ורכושו של אדם ומניעת פגיעה משמעותית בהם כתוצאה משימוש בנשק חם. בית המשפט העליון חזר פעם אחר פעם על החומרה הגלומה בעבירות נשק ועל פוטנציאל הפגיעה בנפש וברכוש שעלולים להיגרם כתוצאה מהשימוש בו. עוד נפסק, כי בשל הסכנה הרבה הטמונה בעבירות הנשק, על בית המשפט לתת משקל משמעותי יותר לאינטרס הציבורי ולצורך להרתיע עבריינים מלבצע עבירות דומות, על-פני הנסיבות האישיות של העבריין.",מתחם העונש ההולם
"ת""פ 7074-11-23","על עוצמת הערך המוגן, ניתן ללמוד מכך שהעונש המרבי הקבוע לצדה של עבירת נשיאת הנשק עומד על 10 שנות מאסר. עבירות הנשק עלולות להביא, בסופו של יום, לביצוע עבירות שלצדן אלימות קשה, ואף חלילה לקיפוד חיי אדם, וכן עלול להיגרם נזק גדול לביטחון המדינה. באחת הפרשות ציין בית המשפט העליון כי עבירות הנשק ""הפכו זה מכבר ל""מכת מדינה"" בחברה הישראלית [...]. הן מסכנות את שלום הציבור, גם בהיותן ""קרקע פורייה"" לביצוע עבירות אחרות – החל מעבירות איומים וכלה בעבירות המתה, ובשל יכולתן לגרום לפגיעות בגוף ובנפש"" (ע""פ 2165/23 מדינת ישראל נ' פלאח בלאל, פסקה 10 (4.5.23)). עוד הודגש, כי ""חומרה מיוחדת מיוחסת בפסיקת בית משפט זה לאותם מקרים שבהם השימוש בנשק חם נעשה בתוך שטח עירוני ובסביבת בתי מגורים"" (ע""פ 4377/16 רמדאן תורק נ' מדינת ישראל, פסקה 18 (6.10.16)).",מתחם העונש ההולם
"ת""פ 7074-11-23",הערך החברתי המוגן שנפגע כתוצאה מביצוע עבירת האיומים הוא הגנה על שלוות נפשו של הפרט ושלמות גופו וחירותו. ערך מוגן עקיף הנובע מהגנה על החירות הוא חופש הפעולה והבחירה של הפרט. בתי המשפט עמדו זה מכבר על החומרה הנובעת מעבירת האיומים בשל המסוכנות הטבועה בה בהתייחס להוצאת דברי האיומים מן הכוח אל הפועל ולהיותם מעשי בריונות לשמה.,מתחם העונש ההולם
"ת""פ 7074-11-23","בע""פ 103/88 ליכטמן נ' מדינת ישראל (6.9.89) בית המשפט העליון קבע, כי: ""אינטרס החברה הוא להגן על שלוות נפשו של הפרט [...] מפני מעשי הפחדה והקנטה שלא כדין, אינטרס חברתי נוסף אף הוא מוגן בעקיפין בעבירה זו, והוא נוגע לחופש הפעולה של הפרט [...] וידוע הוא שבמקרים רבים מושמעים איומים SE PER כמסר מסווה להתנהגות המצופה מן המאוים[...]"".",מתחם העונש ההולם
"ת""פ 7074-11-23","אשר לנסיבות הקשורות לביצוע העבירה, שקלתי כי לעבירה קדם תכנון, שכן בטרם ביצועה היה על הנאשם לקבל לידיו את רימון ההלם, ללבוש חולצה ארוכה עם קפוצ'ון ולהגיע לבית המתלוננים בשעת ערב חשוכה כדי להקשות על זיהויו, וכן הוא הגיע מחלקו האחורי של הבית על מנת להשליך את הרימון לעבר חצר בית המתלוננים.",מתחם העונש ההולם
"ת""פ 7074-11-23","אשר לשאלה בדבר חלקו היחסי של הנאשם בביצוע העבירה ומידת ההשפעה של אחר עליו בביצועה- טען ב""כ הנאשם, כי בדומה לעניינו של י.כ., אדם אחר שלח את הנאשם להשליך את רימון ההלם לעבר בית המתלוננים, וכי לנאשם עצמו אין כל סכסוך עמם. מנגד, ב""כ המאשימה טענה כי מאחר שהנאשם סירב להעיד לעניין זה ולא מסר את שמו של מי ששלח אותו, אין מקום לקבוע באופן פוזיטיבי עובדה זו שאינה מוזכרת בכתב האישום. אכן, דרך המלך הייתה כי הנאשם יעיד וייחקר במהלך דיוני ההוכחות בדבר גרסתו, כי לא ביצע את העבירה מיוזמתו, אלא נשלח על ידי אחר לעשותה. עם זאת, מאחר שהנאשם הודה בתום פרשת ההגנה, לאחר שעדותו כבר הסתיימה, מצאתי לנכון להורות כי הצדדים יטענו ביחס לנסיבה זו במסגרת הטיעונים לעונש. דומני, כי בענייננו, העובדה שהנאשם נשלח על ידי אחר להשליך את הרימון עולה בבירור לא רק מדברי הנאשם אלא אף מראיות התביעה, שכן אחד מעדי התביעה, סגן ניצב ליאור בן שלום, העיד כי בתחילת החקירה היה חשוד נוסף במעורבות באירוע, אשר נחשד בקשירת קשר לזריקת הרימון (ר' פרוטוקול הדיון מיום 18.7.24, עמ' 53, ש' 26-27; עמ' 54, ש' 16-22; עמ' 56, ש' 31-32). כך גם עולה מגרסת המתלוננים, כפי שהיא באה לידי ביטוי בתסקיר נפגעי העבירה. נוסף על כך, גם עניינו של י.כ., אשר לגביו הוסכם כי נשלח על ידי אחר, ומעשיו דומים לאלה של הנאשם ואף אירעו מבחינה כרונולוגית לאחר שהנאשם ביצע את העבירות וכבר היה עצור, מצביעים על כך שהנאשם, בדומה לי.כ., לא פעל מיוזמתו. יצוין, כי כאשר הנאשם טוען לקיומה של נסיבה מקילה הקשורה בביצוע העבירה, בהתאם להוראת סעיף 40י(ג) לחוק, הנטל המוטל עליו להוכחתה הוא כמו במשפט אזרחי. בהתחשב בצבר הראיות, המפורט לעיל, ניתן לומר ששוכנעתי כי הנאשם נשלח על ידי אחר לזרוק את רימון ההלם.",מתחם העונש ההולם
"ת""פ 7074-11-23","על כל פנים, יוער כי אף אם הנאשם לא יזם את ביצוע העבירה ואין לו דבר וחצי דבר כנגד המתלוננים, קשה לומר שמדובר בנסיבה מקילה, שכן התנהלותו של הנאשם כשכיר חרב מלמדת על אדם שמוכן תמורת בצע כסף לנקוט באלימות כנגד אזרחים תמימים וחפים מפשע, לרבות משפחה עם ילדים בעלי מוגבלויות קשות, כשהוא אדיש לחלוטין להשלכות האפשריות של מעשיו.",מתחם העונש ההולם
"ת""פ 7074-11-23","הנזק הפוטנציאלי הגלום בעבירה שביצע הנאשם הוא משמעותי. אמנם, מדובר בנזק פוטנציאלי מוגבל באופן יחסי, שכן מדובר ברימון הלם אשר נצרתו לא נשלפה, ולא ברימון רסס למשל. עם זאת, ברי כי גם רימון הלם עלול ""לגרום פציעה לאדם, בכפוף לקרבתו למוקד הפעלתו"" (ע""פ 1323/13 רך חסן נ' מדינת ישראל, פסקה 10 (5.6.13)). כמו כן, אך במזל איש לא נכח בחצר בעת שהרימון הושלך ואיש לא נגע בו, כך שהוא לא התפוצץ. עם זאת, הגם שלמרבה המזל לא נגרם בפועל נזק בנפש או ברכוש, הרי שנגרם נזק נפשי משמעותי למתלוננים. כפי שעולה מתצהיר נפגעי העבירה, מדובר במשפחה שמלכתחילה מתמודדת עם מציאות חיים מורכבת שבה שלושה מארבעת ילדיהם הם בעלי צרכים מיוחדים. האימה והפחד שאחזו בהם בעת השלכת הרימון לחצר ביתם לא הסתיימו באותו ערב, אלא מוסיפים ללוות אותם עד עצם היום הזה. כפי שמתואר בתצהיר נפגעי העבירה, ילדיהם של המתלוננים חוששים לשהות בחצר הבית והמשפחה כולה חוששת כשהיא יוצאת מהבית ונמצאת סמוך לו.",מתחם העונש ההולם
"ת""פ 7074-11-23","בקביעת מתחם העונש ההולם בענייננו יש לתת משקל, בין היתר, לסוג הרימון שהושלך, ולנזק שנגרם ועלול היה להיגרם, הן פיזית והן נפשית, לנפגע העבירה. בחינת מדיניות הענישה הנהוגה מעלה, כי במקרים דומים הוטלו על נאשמים עונשי מאסר בפועל מאחורי סורג ובריח לתקופות משתנות, כפי שיפורט להלן:",מתחם העונש ההולם
"ת""פ 7074-11-23","בע""פ 1693/23 אסלאם אבו אחמד נ' מדינת ישראל (3.12.23), נדון עניינו של מי שהורשע, על פי הודאתו בהסדר טיעון, בעבירות של נשיאת נשק בצוותא ואיומים. כדי לאיים על שוטר שסבר שהתנכל לו, המערער חבר לאחר והשניים נסעו לעבר בית השוטר כשהם מצוידים ברימון הלם. המערער שנהג ברכב הוריד את האחר במרחק קצר מבית השוטר ועזב את המקום, ואילו האחר נטל את רימון ההלם והשליכו לעבר הכניסה לבית, שם הוא התפוצץ וגרם לרעש גדול ולסימני פיח. בית המשפט המחוזי קבע מתחם עונש הולם שנע בין 30 ל-60 חודשי מאסר בפועל, וגזר על המערער 48 חודשי מאסר בפועל, מאסר על תנאי, קנס בסך 2,000 ₪ ופיצוי לנפגע העבירה בסך 10,000 ₪. בית המשפט העליון דחה את הערעור.",מתחם העונש ההולם
"ת""פ 7074-11-23","בע""פ 6469/19 מחמוד אבו דקה נ' מדינת ישראל (27.11.19), נדון עניינו של מי שהורשע, על פי הודאתו בהסדר טיעון, בעבירות של קשירת קשר לביצוע פשע, שתי עבירות של החזקת נשק שלא כדין וירי באזור מגורים. המערער נשלח על ידי שני אחרים תמורת תשלום כספי, בשתי הזדמנויות שונות, לבצע ירי ולהשליך רימונים סמוך לבית המתלונן. בפעם הראשונה המערער ירה 9 כדורים מאקדח לעבר ביתו של המתלונן, וחלק מהקליעים פגעו בחלון הבית ובקיר החיצוני; ובפעם השנייה המערער השליך רימון הלם לעבר בית המתלונן כשהוא ובני משפחתו ישנו בבית, והרימון התפוצץ ויצר בהלה בקרב בני הבית. במסגרת הסדר הטיעון הוסכם כי המאשימה תעתור להטלת עונש של 14 חודשי מאסר בלבד. בית המשפט המחוזי קבע מתחם עונש הולם שנע בין 12 ל-36 חודשי מאסר בפועל, וגזר על המערער עונש של 12 חודשי מאסר בפועל, מאסר על תנאי וקנס בסך 3,000 ₪. בית המשפט העליון דחה את הערעור.",מתחם העונש ההולם
"ת""פ 7074-11-23","בע""פ 2933/19 אהרון צדיק נ' מדינת ישראל (26.9.19), נדון עניינו של מי שהורשע, על פי הודאתו בהסדר טיעון, בעבירות של נשיאת והובלת נשק ומעשה פזיזות ורשלנות. המערער נסע ברכבו כשהוא נושא רימון הלם, החנה את הרכב והתקרב רגלית למסעדה, שם שחרר את נצרת הרימון והשליכו לעבר מדרכה הסמוכה למסעדה, ושם התפוצץ הרימון במרחק קצר מהמסעדה. בית המשפט המחוזי קבע מתחם עונש הולם שנע בין 9 ל-26 חודשי מאסר בפועל, וגזר על הנאשם עונש של 12 חודשי מאסר בפועל ומאסר על תנאי. בית המשפט העליון דחה את הערעור. ",מתחם העונש ההולם
"ת""פ 7074-11-23","בע""פ 8845/15 מנסור פואז נ' מדינת ישראל (17.11.16), נדון עניינו של מי שהורשע, לאחר שמיעת ראיות, בעבירות של נשיאת והובלת נשק ומעשה פזיזות ורשלנות. המערער, שמשפחתו הייתה מסוכסכת עם משפחת המתלוננים, הגיע רגלית לעבר בתי המשפחה האחרת וזרק רימון הלם לעבר שניים מהם, אשר נפל במרחק קצר מהם והתפוצץ בסמוך אליהם, מבלי שנגרם נזק. בית המשפט המחוזי גזר על המערער עונש של 18 חודשי מאסר בפועל, מאסר על תנאי וקנס בסך 7,500 ₪. בית המשפט העליון דחה את הערעור.  ",מתחם העונש ההולם
"ת""פ 7074-11-23","בת""פ 22642-11-23 מדינת ישראל זידאן טאהא (5.2.24), נדון עניינו של מי שהורשע, על פי הודאתו בהסדר טיעון, בעבירה של החזקת נשק. הנאשם וחברו נסעו ברכב כאשר הנאשם יושב במושב הנוסע והחבר נהג, וכאשר הנאשם מחזיק על רצפת הרכב, סמוך לרגליו, רימון הלם. בית המשפט קבע מתחם עונש הולם שנע בין 8 ל-20 חודשי מאסר, וגזר על הנאשם עונש של 8 חודשי מאסר לריצוי בעבודות שירות, מאסר על תנאי וקנס בסך 3,000 ₪.",מתחם העונש ההולם
"ת""פ 7074-11-23","בת""פ 54202-01-23 מדינת ישראל נ' עמנואל מנגיסטו (22.10.23), נדון עניינו של מי שהורשע, על פי הודאתו בהסדר טיעון, בשתי עבירות של סחר בנשק ובעבירה של נשיאת נשק. הנאשם מכר לסוכן משטרתי שלושה רימוני הלם תמורת סכום כולל של 2,400 ₪. בית המשפט קבע מתחם עונש הולם שנע בין 20 ל-50 חודשי מאסר בפועל, וגזר על הנאשם עונש של 25 חודשי מאסר בפועל, מאסר על תנאי וקנס בסך 5,000 ₪. ",מתחם העונש ההולם
"ת""פ 7074-11-23","בת""פ 38883-05-22 מדינת ישראל נ' פאר סרקיה ואח' (2.1.23), נדון עניינו של מי שהורשע, על פי הודאתו בהסדר טיעון, בעבירות של קשירת קשר לפשע, נשיאת והובלת נשק בצוותא, ואיומים בצוותא. על רקע סכסוך בין הנאשם ושני אחרים למתלונן, השלושה קשרו קשר להשליך רימון הלם על ביתו בכוונה להפחידו. הנאשמים נסעו לעבר הבית, ואחד מהם השליך את הרימון על הבית, שם הוא התפוצץ ברעש וגרם לנזקי פיח בחצר הבית. בית המשפט קבע מתחם עונש הולם שנע בין 18 ל-36 חודשי מאסר, וגזר על הנאשם עונש של 24 חודשי מאסר בפועל, כאשר יחד עם הפעלת מאסרים מותנים שחלקם בחופף וחלקם במצטבר ירצה בסך הכל תקופה של 28 חודשי מאסר בפועל, וכן מאסר על תנאי, קנס בסך 4,000 ₪ ופיצוי בסך 6,000 ₪. ",מתחם העונש ההולם
"ת""פ 7074-11-23","בת""פ 7133-07-20 מדינת ישראל נ' ניסים נס רוזן (6.9.22), נדון עניינו של מי שהורשע, על פי הודאתו בהסדר טיעון, בעבירות של נשיאת והובלת נשק, החזקת נשק ומעשה פזיזות ורשלנות בחומר נפיץ. הנאשם נסע עם אחר לבית הגרוש של בת זוגו, כשהנאשם נוהג ברכב והאחר יושב לצדו, ועם הגעתם לבית המתלונן, השליך האחר רימון הלם אל עבר גדר הבית, והרימון התפוצץ בעוצמה. כמו כן, באותו מועד החזיק הנאשם ברכב אקדח. בית המשפט קבע מתחם עונש הולם שנע בין 19 ל-48 חודשי מאסר, וגזר על הנאשם עונש של 19 חודשי מאסר בפועל ומאסר על תנאי. ",מתחם העונש ההולם
"ת""פ 7074-11-23","בת""פ 22765-09-19 מדינת ישראל נ' מחמוד מטרי (5.12.19), נדון עניינו של מי שהורשע, על פי הודאתו בהסדר טיעון, בעבירות של נשיאת והובלת נשק, מעשה פזיזות ורשלנות ואיומים. הנאשם הגיע ברכבו לבית המתלונן, והשליך מתוך הרכב רימון לחצר ביתו, הרימון התפוצץ וגרם קול נפץ חזק. בית המשפט קבע מתחם עונש הולם שנע בין 9 חודשי מאסר שניתן לרצות גם בעבודות שירות ל-24 חודשי מאסר בפועל, וגזר על הנאשם עונש של 9 חודשי מאסר לריצוי בעבודות שירות, מאסר על תנאי וקנס בסך 15,000 ₪. ",מתחם העונש ההולם
"ת""פ 7074-11-23","כאמור, י.כ. נדון בשל מעשים דומים לעונש של 7 חודשי מאסר, אולם לא ניתן ללמוד מגזר דין זה, גזירה שווה לעניינינו. בניגוד לנאשם שהוא בגיר בן 19 בעת ביצוע המעשים, הנאשם שם היה בן 15, הוא הודה במסגרת הסדר טיעון סגור בתחילת ההליך, העבירה המיוחסות לו היא במדרג חומרה נמוך יותר, הוא החזיק רימון גז ולא רימון הלם, והוא נעדר עבר פלילי.",מתחם העונש ההולם
"ת""פ 7074-11-23","לאחר שבחנתי את הערך החברתי שנפגע כתוצאה מביצוע העבירות, את נסיבות ביצוען ואת מדיניות הענישה הנהוגה, ואת מדיניות ההחמרה בעבירות הנשק, הגעתי לכלל מסקנה שיש לקבוע מתחם עונש הולם הנע בין 16 לבין 32 חודשי מאסר בפועל, זאת לצד רכיבי ענישה נלווים.",מתחם העונש ההולם
"ת""פ 7074-11-23","אשר לנסיבות שאינן קשורות לביצוע העבירה- לקולה שקלתי, כי הנאשם בחור צעיר מאוד, בן 20 כיום ובן 19 בלבד במועד ביצוע העבירה, אשר נמצא במעצר למעלה מ-11 חודשים, וידוע כי תנאי המעצר קשים מהתנאים במאסר. כמו כן, אף שזוהי אינה הרשעתו הראשונה של הנאשם בפלילים, הוא מעולם לא ריצה מאסר מאחורי סורג ובריח וזהו מאסרו הראשון. התחשבתי לקולה גם בנסיבות חייו המורכבות של הנאשם, כפי שעולה מתסקיר שירות המבחן, אשר מילדותו נחשף לחברה שולית ובלתי מיטבית בסביבתו המשפחתית והחברתית, שהוטמעו והופנמו בתהליך גיבוש זהותו.",העונש המתאים
"ת""פ 7074-11-23","עוד שקלתי לזכותו של הנאשם את החלטתו בסופו של דבר להודות בעובדות כתב האישום. אמנם, הנאשם עשה כן רק בתום פרשת ההגנה, לאחר שעדי התביעה כבר הטריחו עצמם להגיע לבית המשפט ולהיחקר בחקירה נגדית, ולאחר שהתברר לנאשם בתום עדותו כי גרסתו הופרכה אל מול ראיות התביעה ועדויות עדי ההגנה שלו עצמו. ואולם, בכך שהנאשם בחר להודות בסופו של דבר, יש משום לקיחת אחריות ראשונית מצדו, כמו גם חיסכון בזמן השיפוטי הדרוש לשמיעת סיכומי הצדדים ולצורך כתיבת הכרעת הדין. הגם, כאמור, שאין מדובר באותו משקל שניתן להודאה בתחילת המשפט מבחינת לקיחת האחריות והחיסכון בזמן שיפוטי. כמו כן, ראיתי לחיוב את דבריו האחרונים של הנאשם לפניי, אשר לקח אחריות פעם נוספת, התנצל על כך ששיקר בעדותו בבית המשפט והביע צער ואמפתיה למתלוננים בשל מעשיו.",העונש המתאים
"ת""פ 7074-11-23","מנגד, לחומרה שקלתי, כי לנאשם עבר פלילי מכביד בשים לב לכך שמדובר באדם כה צעיר. לנאשם שלוש הרשעות קודמות בעבירות אלימות, רכוש וסמים, כאשר בפועל מדובר בחמישה תיקים פליליים שהנאשם הורשע בהם, שכן במסגרת הרשעתו הראשונה צירף הנאשם יחדיו שלושה תיקים, אשר את העבירות בהם ביצע כבר בהיותו בגיל 12-13 שנים בלבד. בנוסף, שירות המבחן התרשם שלנאשם דפוסי אישיות עברייניים והתמכרותיים, הוא מצמצם ומטשטש מחומרת מעשיו, מתקשה בהתבוננות עליהם לצורך עריכת שינוי, אינו רואה בעייתיות בהתנהלותו ושולל כל נזקקות טיפולית. בהקשר זה יצוין, כי מתסקיר שירות המבחן גם עולה שלפני מספר שנים נעשו שני ניסיונות לשלב את הנאשם בתכניות טיפוליות, אך אלה עלו בתוהו נוכח מעורבותו באירועי אלימות פיזית ומילולית, התנגדות לצוות המסגרת ולסמכותו, צריכת חומרים ממכרים ואף בריחה מהמסגרת. לכן, בין היתר, שירות המבחן העריך כי קיים סיכון גבוה להישנות התנהגות עוברת חוק מצד הנאשם, ונמנע מהמלצה בעניינו.",העונש המתאים
"ת""פ 7074-11-23","מכאן, שיש ליתן דגש לשיקולי הרתעת היחיד ולצורך להגן על הציבור מפני הנאשם, בהיעדר אופק שיקומי טיפולי ברור ונוכח הצורך בהצבת גבול ברור ומרתיע לנאשם, וכן יש לתת דגש לשיקולי הרתעת הרבים. מנגד, יש להתחשב בגילו הצעיר מאוד של הנאשם, שאך מלאו לו 20 שנה, ושזהו לו מאסרו הראשון. משכך, החלטתי להטיל על הנאשם עונש בתפר שבין הרף התחתון לרף הבינוני של מתחם העונש ההולם.",העונש המתאים
"ת""פ 7074-11-23","בטרם חתימה יצוין, כי בשים לב לגילו המאוד צעיר, ניתן לומר שהנאשם עומד כעת בצומת דרכים, והבחירה נתונה בידו. האם יבחר להמשיך להתבוסס בעולם העברייני, והוא יכנס ויצא מבין כותלי שב""ס לעוד שנים רבות, או שמא, למרות הקושי הרב, הוא יבחר להשתלב בהליכי טיפול ושיקום בעת מאסרו ולאחר שחרורו, ישנה את דפוסיו, ויבחר בדרך הישר והטוב. אנו מצויים כעת בחודש הרחמים והסליחות, בערב ראש השנה, תקופה בה שערי תשובה פתוחים לרווחה, ואני תקווה שהנאשם ישכיל למצוא את הכוחות לצאת ממעגל זה, ולעבור שינוי.",העונש המתאים
"ת""פ 7074-11-23","סופו של דבר, החלטתי להטיל על הנאשם את העונשים הבאים כדלהלן:",העונש המתאים
"ת""פ 7074-11-23","21 חודשי מאסר בפועל, אשר ירוצו מיום מעצרו 24.10.23.",העונש המתאים
"ת""פ 7074-11-23",12 חודשי מאסר. הנאשם לא ירצה עונש זה אלא אם יעבור בתוך שלוש שנים מיום שחרורו מהמאסר על כל עבירת נשק מסוג פשע.,העונש המתאים
"ת""פ 7074-11-23",6 חודשי מאסר. הנאשם לא ירצה עונש זה אלא יעבור בתוך שלוש שנים מיום שחרורו מהמאסר על כל עבירת נשק מסוג עוון או מעשה פזיזות ורשלנות או כל עבירת אלימות.,העונש המתאים
