verdict,text,part
"ת""פ 36511-09-14","הנאשם 1 בדברו האחרון ביקש סליחה מהמתלוננים ומבני משפחתו, מסר כי הוא מודע לחומרת מעשיו וביקש להמשיך בהליך השיקומי בו החל.","טיעוני ב""כ הנאשמים לעונש"
"ת""פ 36511-09-14","הנאשם 2 בדברו האחרון הביע חרטה על מעשיו ומסר כי הוא בתהליך של חשבון נפש, ומאוכזב מעצמו על כך שפגע באנשים חסרי אונים.","טיעוני ב""כ הנאשמים לעונש"
"ת""פ 36511-09-14",הנאשם 3 בדברו האחרון הביע חרטה וביקש את סליחת משפחתו והמתלוננים להם הסב סבל.,"טיעוני ב""כ הנאשמים לעונש"
"ת""פ 36511-09-14","בשולי הטיעונים לעונש ביקשה ב""כ המאשימה להסיר את איסור הפרסום מתיק זה, בהיעדר נימוק ממשי להשארתו על כנו. ב""כ הנאשמים התנגדו לכך.","טיעוני ב""כ הנאשמים לעונש"
"ת""פ 36511-09-14","בהתאם להוראות סעיף 40יג. לחוק העונשין, על בית המשפט לבחון האם העבירות בהן הורשע נאשם מהוות אירוע אחד או מספר אירועים, ובהתאם לכך יקבע את מתחם העונש ההולם.","מהו ""מעשה העבירה""?"
"ת""פ 36511-09-14","בענייננו הנאשם 3 הצטרף לנאשמים 1 ו-2 לביצוע העבירות בהזדמנות אחת, באירוע המתואר באישום השלישי, ויש לראות במסכת האירועים המתוארת בעניינו במסגרת אישום זה כאירוע אחד.","מהו ""מעשה העבירה""?"
"ת""פ 36511-09-14","שונה המצב בעניינם של הנאשמים 1 ו-2, אשר ביצעו את העבירות שהינן אלימות ביסודן בשלושה מועדים שונים, בשלושה אתרים שונים, כלפי קרבנות מזדמנים רבים ושונים, ובהרכב עברייני שונה (כאמור באירוע השלישי הצטרף הנאשם 3 לביצוע העבירות).","מהו ""מעשה העבירה""?"
"ת""פ 36511-09-14","בית המשפט העליון נתן את דעתו לסוגיה זו במסגרת ע""פ 4910/13 ג'אבר נ' מדינת ישראל (כב' הש' ברק-ארז):","מהו ""מעשה העבירה""?"
"ת""פ 36511-09-14","(וראו לעניין זה גם את ע""פ 4927/14 ברבי נ' מדינת ישראל, בע""פ 3164/14 גיא פן נ' מדינת ישראל וברע""פ 4760/14 קיסלמן נ'  מדינת ישראל).","מהו ""מעשה העבירה""?"
"ת""פ 36511-09-14","יחד עם זאת, במסגרת ע""פ 1261/15 מדינת ישראל נ' דלאל עמד כב' הש' סולברג על כך שיתכנו מצבים בהם אין מסקנה ברורה אף לאחר הפעלת מבחן הקשר ההדוק, או אז נדרשת הצדקה נורמטיבית לשם קבלת המסקנה האם מדובר באירועים נפרדים, אם לאו. ","מהו ""מעשה העבירה""?"
"ת""פ 36511-09-14","בענייננו נטען ע""י ב""כ הנאשמים 1 ו-2 כי הנאשמים פעלו בהתאם ל""תכנית עבריינית אחת"", היא שוד של פועלי בניין באתרי בנייה. אף המאשימה בחרה לנסח ""חלק כללי"" לכתב האישום, המאחד את מעשיהם של הנאשמים, אשר בוצעו על פני תקופה של כחודש.","מהו ""מעשה העבירה""?"
"ת""פ 36511-09-14","יחד עם זאת, בבואי לגזור את דינם של הנאשמים, לא מצאתי לומר כי ""מבחן הקשר ההדוק"" מתקיים באופן מובהק , כיוון שישנה אסקלציה ופער מהותי בין טיב המעשים המתוארים באישומים הראשון והשני, לבין האירוע המתואר באישום השלישי, שהינו חמור יותר, ובמסגרתו בוצעה העבירה יחד עם מעורב נוסף (הוא הנאשם 3), כאשר הנאשמים הצטיידו בסוגים נוספים של תחמושת, הפקידו שומר שנחזה להיות חמוש (הנאשם 3) על המתלוננים בעוד שהם ערכו חיפוש במתחם המגורים כולו ולבסוף הותירו את המתלוננים כשחלקם כפותים בתוך חדר חשוך ונעול.","מהו ""מעשה העבירה""?"
"ת""פ 36511-09-14","כמו כן, אין המדובר בעבירות מרמה או עבירות רכוש במובנן הקלאסי, אלא מדובר בעבירות אלימות, ועל כן לטעמי האינטרס הציבורי מחייב התייחסות נפרדת לאירוע המתואר באישום השלישי.","מהו ""מעשה העבירה""?"
"ת""פ 36511-09-14","עמדה זו עולה בקנה אחד עם עמדו של כב' הש' סולברג ועם העמדה שהובעה בתזכיר חוק העונשין (הבניית שיקול הדעת השיפוטי בענישה – תיקונים שונים), התשע""ו-2015, המבקשת לבכר את האינטרסים החברתיים המוגנים ואת נפגעי העבירה.","מהו ""מעשה העבירה""?"
"ת""פ 36511-09-14","לאור האמור לעיל, מצאתי להתייחס לאירועים המפורטים באישומים הראשון והשני כאל אירוע אחד.","מהו ""מעשה העבירה""?"
"ת""פ 36511-09-14","אחרון הוא האישום החמישי, המיוחס לנאשם 1, ואשר אין חולק כי מדובר בעבירה עצמאית ונפרדת.","מהו ""מעשה העבירה""?"
"ת""פ 36511-09-14",בהתאם למתווה זה יקבעו מתחמי הענישה להלן. ,"מהו ""מעשה העבירה""?"
"ת""פ 36511-09-14","הנאשמים 1 ו-2, שוטרי מג""ב בעת ביצוע העבירות, תכננו מבעוד מועד את מעשיהם, וניצלו את תפקידם, מדי השיטור שלהם והנשק שקיבלו לצורך עבודתם, על מנת להיכנס שלא כדין בשתי הזדמנויות לאתרי בנייה - אף שלא נדרשו לעשות כן - ולבקש מפועלי בניין את ניירותיהם ואת רכושם לבדיקה. בעשותם כן פעלו כעבריינים בחסות החוק.",מתחם העונש ההולם – אישומים ראשון ושני
"ת""פ 36511-09-14","באירוע הראשון נקטו הנאשמים באלימות כלפי המתלוננים – שני נתינים סודנים - ובעטו ברגליהם, ובהמשך כבלו אותם כשידיהם מאחורי גבם וגנבו מהם סך של כ-2,300 ₪ במזומן, טלפון נייד מסוג גלקסי 3 ואת אשרות השהייה שלהם.",מתחם העונש ההולם – אישומים ראשון ושני
"ת""פ 36511-09-14","באירוע השני, גנבו הנאשמים 1 ו-2 באופן דומה חמישה מכשירי טלפון ניידים ששוויים אינו ידוע מחמישה פועלים שזהותם אינה ידועה. יצויין, כי מכיוון שזהות המתלוננים באישום זה אינה ידועה, יוחסה לנאשמים בגין אישום זה עבירת גניבה חלף עבירת השוד.",מתחם העונש ההולם – אישומים ראשון ושני
"ת""פ 36511-09-14","בעשותם את האמור לעיל, השתמשו הנאשמים 1 ו-2 במדי השיטור שניתנו להם ובנשק שהופקד בידיהם כדי להגן על הציבור ולשמור על בטחונו, ובכך ניצלו לרעה את תפקידם ואת האמון שניתן בהם. אם לא די בכך, הרי שהמעשים כוונו לקבוצת אוכלוסייה מוחלשת, היא קבוצת העובדים הזרים, תוך פגיעה בכבודם, בחירותם ובקניינם -עבורם עמלים הם בארץ זרה הרחק מבני משפחתם יומם וליל.",מתחם העונש ההולם – אישומים ראשון ושני
"ת""פ 36511-09-14","כל זאת , תחת חסות שקרית שמדובר בפעולות שיטור על פי דין, וככל הנראה תוך ניצול מעמדם הרגיש של קרבנות העבירה וההנחה כי לא יטו להתלונן כנגדם (וראו בהקשר זה את דבריו של כב' הש' פוגלמן בע""פ 8526/12 פלוני נ' מדינת ישראל). מכאן, כי המעשים פגעו אף בתדמיתה של המשטרה בעיני הציבור בכלל ובעיני שכבת אוכלוסייה מוחלשת הזקוקה לה, בפרט.",מתחם העונש ההולם – אישומים ראשון ושני
"ת""פ 36511-09-14","ביחס לניצול הכוח תוך ביזוי המדים ציין בית המשפט העליון לא אחת כי מעשים אלה ""גורמים לאבדן אמון בציבור לובשי המדים, וממילא מקשים על תפקודם של חיילים ושוטרים המבצעים את עבודתם כחוק"" (ע""פ 1795/06 יוספי נ' מדינת ישראל). ",מתחם העונש ההולם – אישומים ראשון ושני
"ת""פ 36511-09-14","בשים לב לחומרת המעשים ורמת הענישה הנוהגת במקרים כגון דא , באתי לכלל מסקנה כי מתחם העונש ההולם בגין האישומים הראשון והשני גם יחד נע בין 15 ל-34 חודשי מאסר לריצוי בפועל.",מתחם העונש ההולם – אישומים ראשון ושני
"ת""פ 36511-09-14","באירוע זה כאמור, ניכר כי הנאשמים 1 ו-2 שיכללו את פעולותיהם, ולשם כך ציוותו אליהם את הנאשם 3, שהיה בזמן האירוע חייל בשירות סדיר, ציידו אותו בכובע זיהוי משטרתי, תרסיס גז פלפל ואמצעי להתזת גז פלפל הנחזה להיות אקדח ובפנס, וזאת בנוסף לנשק מסוג M-16 שהיה ברשותם מתוקף תפקידם. כמו כן עטו הנאשמים על ידיהם כפפות חד פעמיות בהן הצטיידו מבעוד מועד ונכנסו למגורונים בהם לנו פועלים תושבי השטחים, כפתו שלושה פועלים באזיקוני פלסטיק בהם הצטיידו מבעוד מעוד, וגנבו מהם כסף מזומן בסך 450 ₪ ותעודות זיהוי.",מתחם העונש ההולם – אישומים שלישי/שלישי ורביעי
"ת""פ 36511-09-14","בהמשך, לאחר שנאשם 1 חדר למתחם המגורים של הפועלים הסינים, הוציא אותם בחטף מחדריהם ונטל מהם את דרכוניהם, ריכזו אותם הנאשמים במתחם אחד, יחד עם שלושת תושבי השטחים, הנאשם 3 שמר עליהם כשהוא מכוון לעברם אמצעי להתזת גז פלפל הנחזה להיות אקדח, סינוורם בפנס ואיים עליהם, בעוד שהנאשמים 1 ו-2 תרו במגורונים אחר רכוש הניתן להיגנב, ונאשם 2 אף מסר כי נמצאו סמים במקום בכדי להצדיק את מעשיהם.",מתחם העונש ההולם – אישומים שלישי/שלישי ורביעי
"ת""פ 36511-09-14","בסיומו של האירוע נגנבו מחמישה פועלים סינים סך נוסף של כ-10,281 ₪, והנאשמים ריכזו את כל הפועלים יחד בחדר אחד, כאשר שלושת תושבי השטחים עודם כפותים, והותירו אותם בחדר כשהוא חשוך ונעול. את דרכוניהם של המתלוננים הסינים הותירו מחוץ לאתר הבנייה, וחילקו בניהם את שלל האירוע.",מתחם העונש ההולם – אישומים שלישי/שלישי ורביעי
"ת""פ 36511-09-14","זמן קצר לאחר מכן, ולאחר שנודע לנאשמים 1 ו-2 כי המשטרה עצרה את גיסו של הנאשם 1, ולאחר שאחותו של הנאשם 1 הפצירה בו להעלים את מכשירי הטלפון הניידים שגנב, השליכו הנאשמים 1 ו-2 את חמשת מכשירי הטלפון הניידים ששדדו באירוע המתואר באישום השני, וזאת על מנת להעלים הראיות.",מתחם העונש ההולם – אישומים שלישי/שלישי ורביעי
"ת""פ 36511-09-14","בשים לב לטיב האירועים ולרמת הענישה הנוהגת, מצאתי כי מתחם העונש ההולם ביחס לאישומים השלישי והרביעי יחד נע בין 30 ל-60 חודשי מאסר בפועל.",מתחם העונש ההולם – אישומים שלישי/שלישי ורביעי
"ת""פ 36511-09-14","אף כי הנאשם 3 היה שותף מלא למעשיהם של הנאשמים 1 ו-2 בכל הנוגע לאישום השלישי, וחבש לראשו כובע זיהוי משטרתי, הרי שבשונה מהם הוא לא שרת כשוטר בפועל ולא הפר במובן זה אמונים כלפי שולחיו וכלפי הציבור. על כן, האינטרסים בעניינו מעט שונים, ודומים בעיקרם לאירוע של שוד מזוין במובנו הרגיל של המילה, שבנסיבותיו נחזה הנאשם 3 להיות שוטר. בשים לב לכך, מתחם העונש בעניינו שונה בהתאם, באופן יחסי לעניינם של הנאשמים 1 ו-2, ויעמוד על טווח שבין 20 ל-40 חודשי מאסר לריצוי בפועל.",מתחם העונש ההולם – אישומים שלישי/שלישי ורביעי
"ת""פ 36511-09-14","בחיפוש שנערך בביתו של הנאשם 1 בסמוך למעצרו נמצאה בארון בגדים בביתו תחמושת מסוג רימון הלם ורימון סינוור, אשר הוחזקה על ידו שלא כדין.",מתחם העונש ההולם – אישום חמישי
"ת""פ 36511-09-14",בשים לב למעשים דנן ולרמת הענישה בעבירות החזקת נשק עולה כי מתחם העונש ההולם בענייננו נע בין מספר חודשי מאסר בודדים לבין 10 חודשי מאסר בפועל.,מתחם העונש ההולם – אישום חמישי
"ת""פ 36511-09-14",סקירת הנסיבות שאינן קשורות בביצוע העבירה  וגזירת העונש הולם בתוך המתחם,מן הכלל לפרט
"ת""פ 36511-09-14","ראשית אציין, כי לא מצאתי בעניינם של הנאשמים 1 ו-2 לסטות ממתחם העונש ההולם מטעמי שיקום. זאת, מהטעם שמעשי העבירה ומידת האשם הינם בעלי חומרה יתרה (סעיף 40ד(ב) לחוק העונשין), ועל אף תסקירי שירות המבחן, לא מצאתי קיומן של נסיבות מיוחדות ויוצאות דופן המצדיקות סטייה כאמור.",מן הכלל לפרט
"ת""פ 36511-09-14",כך גם לא מצאתי הצדקה לסטות מן המתחם בעניינו של הנאשם 3 בשים לב להוראות סעיף 40ד(א) לחוק העונשין ולתסקיר שירות המבחן בעניינו.,מן הכלל לפרט
"ת""פ 36511-09-14","ממכלול הראיות לעונש שהובאו בפני עולה כי הנאשם 1 הינו רווק, בן 22, ללא עבר פלילי, שרת כשוטר במג""ב ובעקבות המעשים נשוא תיק זה פוטר משירות צבאי. הנאשם 1 השלים 12 שנות לימוד, השתלב בעבודות נורמטיביות, משפחתו סובלת ממצוקה כלכלית עקב מצב רפואי קשה של הוריו ושל אחת מאחיותיו. במסגרת ההליך המשפטי שהה הנאשם 1 במעצר בית ושולב בקבוצה טיפולית במסגרת שירות המבחן, גילה תובנה מלאה לחומרת מעשיו והביע חרטה – שאף להתרשמותי- הינה כנה, ואף השיב למתלוננים (באישום הראשון והשלישי בלבד) את כספם כדי חלקו, ושיתף את סיפורו ולקחיו עם חיילים אחרים. הנאשם 1 אף השתלב מיוזמתו בטיפול פסיכולוגי.",מן הכלל לפרט
"ת""פ 36511-09-14","בשים לב לאמור, תמימת דעים אני עם הערכת שירות המבחן ולפיה מידת המסוכנות הנשקפת מן הנאשם 1 פחתה בעקבות התהליך אותו עבר. יחד עם זאת, כפי שציינתי בפתח דבריי, אין בכל אלה כדי להקהות מחומרת המעשים ומהפגיעה במתלוננים.",מן הכלל לפרט
"ת""פ 36511-09-14","בשים לב לגילו של הנאשם 1, לנטילת האחריות על ידו, למאמציו לתקן תוצאות העבירה ולפצות המתלוננים, להיעדר עבר פלילי, לחלוף הזמן מעם ביצוע העבירה , להיותו נתון במעצר בית, ולתהליך אותו עבר במסגרת שירות המבחן, כמו גם לעתירתה של ב""כ המאשימה, אשר הגבילה עצמה בטיעוניה לעונש בן 45 חודשי מאסר, אני גוזרת את דינו כדלקמן:",מן הכלל לפרט
"ת""פ 36511-09-14",בגין האישומים הראשון והשני: 20 חודשי מאסר לריצוי בפועל.,מן הכלל לפרט
"ת""פ 36511-09-14",בגין האישומים השלישי והרביעי: 34 חודשי מאסר לריצוי בפועל. ,מן הכלל לפרט
"ת""פ 36511-09-14",בגין האישום החמישי: חודשיים מאסר בפועל.,מן הכלל לפרט
"ת""פ 36511-09-14","בשים לב לסעיף 40יג לחוק העונשין, הריני מורה כי העונשים יחפפו בחלקם זה לזה, כך שהנאשם 1 ירצה בסה""כ 36 חודשי מאסר בפועל.",מן הכלל לפרט
"ת""פ 36511-09-14","כמו כן יוטל על הנאשם 1 עונש מאסר מותנה בן 12 חודשים והתנאי הוא שלא יעבור עבירה מן העבירות בהן בה הורשע במשך 3 שנים מתום ריצוי עונשו, ופיצוי בסך של 1,000 ש""ח לכל אחד מהמתלוננים המצוינים בכתב האישום.",מן הכלל לפרט
"ת""פ 36511-09-14","ממכלול הראיות לעונש שהובאו בפני בעניינו של הנאשם 2 עולה  כי אף הוא רווק בן 21, נעדר עבר פלילי, אשר שרת במג""ב בתפקיד קרבי לבקשתו ופוטר משירות בעקבות המעשים נשוא תיק זה. הנאשם  2 השלים 12 שנות לימוד, השתלב בעבודות נורמטיביות, והמעשים בוצעו על רקע חסרון כיס ובשים לב למצבה הכלכלי העגום של משפחתו, לנוכח מצבו הרפואי של האב והיות אמו מפרנסת יחידה. במסגרת ההליך המשפטי שהה הנאשם 2 במעצר בית ושולב בקבוצה טיפולית במסגרת שירות המבחן, וגילה יכולת – אם כי מסוייגת ומסויימת בלבד – להתייחס לדחפיו האלימים, הרושם הוא כי התקשה בהצבת גבולות וכי נדרשת בחינה נוספת של דפוסי התנהגותו. הערכת המסוכנות בעניינו בינונית. אף הנאשם 2 השיב למתלוננים (באישום הראשון והשני בלבד) את כספם כדי חלקו. הנאשם 2 טען בפני שירות המבחן כי ביצע את המעשים לאחר שהנאשם 1 הציע לו לעשות כן, אולם מקום שנתון זה לא הוסכם בין הצדדים מלכתחילה, איני נדרשת אליו. אעיר, כי מכתב האישום המתוקן בו הודה הנאשם 2 עולה תמונה של שותפות מלאה בין השניים.",מן הכלל לפרט
"ת""פ 36511-09-14","בשים לב לגילו של הנאשם 2, לנטילת האחריות על ידו, להבעת החרטה על ידו ולמאמציו לתקן תוצאות העבירה ולפצות המתלוננים, להיעדר עבר פלילי, לחלוף הזמן מעם ביצוע העבירה, לעובדה שהיה נתון במעצר בית, ולתהליך אותו החל לעבור במסגרת שירות המבחן, כמו גם לעתירתה של ב""כ המאשימה, אשר הגבילה עצמה בטיעוניה לעונש בן 45 חודשי מאסר, אני גוזרת את דינו כדלקמן:",מן הכלל לפרט
"ת""פ 36511-09-14",בגין האישומים הראשון והשני: 20 חודשי מאסר לריצוי בפועל.,מן הכלל לפרט
"ת""פ 36511-09-14",בגין האישומים השלישי והרביעי: 34 חודשי מאסר לריצוי בפועל. ,מן הכלל לפרט
"ת""פ 36511-09-14","בשים לב לסעיף 40יג לחוק העונשין, הריני מורה כי העונשים יחפפו בחלקם זה לזה, כך שהנאשם 2 ירצה בסה""כ עונש מאסר בן 36 חודשים.",מן הכלל לפרט
"ת""פ 36511-09-14","כמו כן יוטל על הנאשם 2 עונש מאסר מותנה בן 12 חודשים והתנאי הוא שלא יעבור עבירה מן העבירות בהן הורשע במשך 3 שנים מתום ריצוי עונשו, ופיצוי בסך של 1,000 ש""ח לכל אחד מהמתלוננים המצוינים בכתב האישום.",מן הכלל לפרט
"ת""פ 36511-09-14","ממכלול הראיות לעונש שהובאו בפני עולה כי הנאשם 3 הינו רווק, בן 20, ללא עבר פלילי, במסגרת ההליך המשפטי שהה הנאשם 3 במעצר בית, השתלב בעבודה נורמטיבית וכן שולב בקבוצה טיפולית במסגרת שירות המבחן. מחד ציין שירות המבחן כי הנאשם 3 נמצא בשלב ראשוני בלבד של בחינת התנהגותו, מצמצם מחלקו, בעל דפוסים רגשיים בעייתיים ונדרשת העמקה נוספת של בחינת התנהגותו התוקפנית. מאידך, הערכת המסוכנות בעניינו נמוכה, ובשים לב לחלקו המופחת ביחס לנאשמים האחרים, אף המליץ שירות המבחן על ענישה שיקומית בעניינו. סבורני, כי פער זה בין מסקנות שירות המבחן לבין המלצותיו אינו מבוסס דיו במסגרת התסקיר.",מן הכלל לפרט
"ת""פ 36511-09-14","לא ניתן אף להתעלם מכך שהנאשם 3 טרם פיצה את קרבנות העבירה, בניגוד לנאשמים 1 ו-2.",מן הכלל לפרט
"ת""פ 36511-09-14","בשים לב לגילו של הנאשם 3, לנטילת האחריות על ידו, להיעדר עבר פלילי, ולעונשים שנגזרו על הנאשמים 1-2, ולאור החומרה היתרה באישום השלישי, אני מטילה על הנאשם 3 20 חודשי מאסר לריצוי בפועל. ",מן הכלל לפרט
"ת""פ 36511-09-14","כמו כן יוטל על הנאשם 3 עונש מאסר מותנה בן 6 חודשים והתנאי הוא שלא יעבור עבירה מן העבירות בהן הורשע במשך 3 שנים מתום ריצוי עונשו, ופיצוי בסך של 1,000 ש""ח לכל אחד מהמתלוננים המצוינים באישום השלישי בכתב האישום.",מן הכלל לפרט
"ת""פ 36511-09-14",הנני גוזרת על הנאשם 1 את העונשים המפורטים להלן:,סוף דבר:
"ת""פ 36511-09-14","36 חודשי מאסר בפועל, בניכוי ימי מעצרו.",סוף דבר:
"ת""פ 36511-09-14","12 חודשי מאסר על תנאי, והתנאי שלא יעבור עבירה מן העבירות בהן הורשע במשך 3 שנים מתום ריצוי מאסרו.",סוף דבר:
"ת""פ 36511-09-14","פיצוי בסך 1,000 ₪ לכל אחד מהמתלוננים המפורטים בכתב האישום.",סוף דבר:
"ת""פ 36511-09-14",הנני גוזרת על הנאשם 2 את העונשים המפורטים להלן:,סוף דבר:
"ת""פ 36511-09-14","36 חודשי מאסר בפועל, בניכוי ימי מעצרו.",סוף דבר:
"ת""פ 36511-09-14","12 חודשי מאסר על תנאי, והתנאי שלא יעבור עבירה מן העבירות בהן הורשע במשך 3 שנים מתום ריצוי מאסרו.",סוף דבר:
"ת""פ 36511-09-14","פיצוי בסך 1,000 ₪ לכל אחד מהמתלוננים המפורטים בכתב האישום.",סוף דבר:
"ת""פ 36511-09-14",הנני גוזרת על הנאשם 3 את העונשים המפורטים להלן:,סוף דבר:
"ת""פ 36511-09-14",20 חודשי מאסר לריצוי בפועל בניכוי ימי מעצרו. ,סוף דבר:
"ת""פ 36511-09-14","6 חודשי מאסר על תנאי, והתנאי שלא יעבור עבירה מן העבירות בהן הורשע במשך 3 שנים מתום ריצוי מאסרו.",סוף דבר:
"ת""פ 36511-09-14","פיצוי בסך 1,000 ₪ לכל אחד מהמתלוננים המפורטים באישום השלישי.",סוף דבר:
"ת""פ 36511-09-14","בשולי הטיעונים לעונש, נתבקשתי על ידי ב""כ המאשימה להתיר פרסום שמם של הנאשמים ואילו באי כוחם ביקשו להותיר את איסור הפרסום על כנו, אף כי לא נימקו בקשתם זו.",איסור פרסום
