verdict,text,part
"ת""פ 47445-08-17","ביום פקודה, על בית המשפט ליקח בחשבון גם את תרומתו הארוכה של הנאשם למדינת ולחברה, כבן למשפחה, שקשרה את גורלה עם המדינה, דור שלישי לשירות בצה""ל ובכוחות הבטחון, בהתנדבות, כאשר הנאשם נטל חלק בפעולות צבאיות משמעותיות.",קביעת הענישה הספציפית בענינו של הנאשם
"ת""פ 47445-08-17",הערכות מפקדיו של הנאשם יוצאות דופן לטובה ומדברות בעד עצמן.,קביעת הענישה הספציפית בענינו של הנאשם
"ת""פ 47445-08-17","מי שהתנהל, כל מהלך חייו, בדרך הישר ומתוך רצון לתרום לחברה ולהיטיב עם המדינה בה שוהה, זכאי לקבל להזדמנות, כאשר טעה וחרג מהנורמה – חריגה חד פעמית.",קביעת הענישה הספציפית בענינו של הנאשם
"ת""פ 47445-08-17","לאיזון התמונה הענישתית, יתווסף עיצום כספי משמעותי ומרתיע.",קביעת הענישה הספציפית בענינו של הנאשם
"ת""פ 47445-08-17",לאחר שבית המשפט שקל את טענות הצדדים; עיין במוצגים שהוגשו; עיין בתסקיר; עיין בפסיקה שהוגשה; שמע דברו האחרון של הנאשם – דן את הנאשם לענשים כדלקמן:,קביעת הענישה הספציפית בענינו של הנאשם
"ת""פ 47445-08-17","9 חדשי מאסר בפועל. בהתאם לחוות דעת הממונה על עבודות השירות בשב""ס, ירצה הנאשם המאסר בדרך של עבודות שירות, במועצה הדתית, ערד, רח' יהודה הלוי 34, ערד, חמישה ימים בשבוע, בהתאם לטווח השעות עליו יורו הממונים במקום העבודה. על הנאשם להתייצב, ביום 07.11.19, שעה 08:00, במשרד הממונה על עבודות השירות במחוז דרום בשב""ס, ומשם ימשיך לריצוי העבודות בהתאם להנחיות שיקבל. הנאשם מוזהר, כי אי התייצבות  לריצוי עבודות השירות; אי שמיעה להוראות הממונים עליו במשרד הממונה על עבודות השירות או במקום ריצוי עבודות השירות; אי שיתוף פעולה עם משרד הממונה על עבודות השירות בכל ענין שהוא, לרבות מסירת בדיקות - עלול להביא להפקעה מנהלית של צו ריצוי המאסר בדרך של עבודות שירות, על כל המשתמע מכך;",קביעת הענישה הספציפית בענינו של הנאשם
"ת""פ 47445-08-17","12 חדשי מאסר על תנאי למשך 3 שנים מיום שחרורו של הנאשם ממאסרו, שהנאשם לא יעבור עבירה בניגוד לחוק העונשין, תשל""ז-1977, פרק ח' סימן א', למעט עבירה בניגוד לסעיף 144(א) סיפא לאותו חוק;",קביעת הענישה הספציפית בענינו של הנאשם
"ת""פ 47445-08-17","6 חדשי מאסר על תנאי למשך 3 שנים מיום שחרורו של הנאשם ממאסרו, שהנאשם לא יעבור עבירה בניגוד לחוק העונשין, תשל""ז-1977, סעיף 144(א) סיפא או סעיף 186;",קביעת הענישה הספציפית בענינו של הנאשם
"ת""פ 47445-08-17","קנס בסך 25,000 ₪ או 90 ימי מאסר תמורתו. הקנס ישולם עד ליום 31.12.2019.",קביעת הענישה הספציפית בענינו של הנאשם
"ת""פ 47445-08-17","54678313ככל שלא תוגש בקשה אחרת מטעם מי מהצדדים בתוך 45 ימים, יחולטו המוצגים בתיק החקירה, לרבות כלי הנשק והתחמושת נושא כתב האישום, או יושמדו, על פי שיקול דעת המאשימה.",5129371
"ת""פ 47445-08-17","ניתנה היום, י""א אלול תשע""ט, 11 ספטמבר 2019, במעמד הצדדים.",5129371
"ת""פ 47445-08-17","בעניין עריכה ושינויים במסמכי פסיקה, חקיקה ועוד באתר נבו – הקש כאן",5129371
"ת""פ 47445-08-17",רון סולקין 54678313-/,5129371
