verdict,text,part
"ת""פ 40922-11-15","ע""פ 9373/10 חמד ותד נ' מדינת ישראל (טרם פורסם, ניתן ביום 14.9.2011); שם, הנאשם הורשע על פי הודאתו בעבירות של החזקת ונשיאת נשק. בית המשפט המחוזי גזר על הנאשם 50 חודשי מאסר בפועל ו- 12 חודשי מאסר על תנאי. הנאשם ערער על חומרת העונש ובית המשפט קיבל את הערעור והפחית את המאסר בפועל ל- 30 חודשים. ",מדיניות הענישה
"ת""פ 40922-11-15","ב""כ הנאשמים הניחו על שולחנו של בית המשפט מספר פסקי דין מהם ניסו לתקוע יתד באשר למדיניות הענישה הנוהגת שיש בה כדי להשליך , כך על-פי טענתם, על מתחם הענישה. אקדים ואומר, כי מצאתי לנכון לאזכר פסקי דין אלה, על אף שמרביתם כללו התיחסות לעבירות של החזקה ו/או נשיאת נשק ו/או עבירות בנשק שאין התאמה וחפיפה בינם לבין העבירות המיוחסות לנאשמים כאן. יחד עם זאת, יש בפסקי דין אלה, כדי ללמד על המגמה ומדיניות הענישה ההנוהגת בעבירות נשק  בכלל ויש בהם אף כדי למקם את ההתרחשות העובדתית מושא כתב האישום כאן ברף הנכון ביחס לעבירות ולפסקי דין שהוגשו מטעם ההגנה.",מדיניות הענישה
"ת""פ 40922-11-15","ב""כ הנאשמים אזכרו מטעמם את הפסיקה הבאה:",מדיניות הענישה
"ת""פ 40922-11-15","ע""פ 5681/14 מדינת ישראל נ' מוחמד טאטור (טרם פורסם, ניתן ביום 29.1.2015); שם, הנאשם הורשע על פי הודאתו, בעבירות של רכישת והחזקת נשק, נשיאת והובלת נשק וכן הפרעה לשוטר. בית המשפט המחוזי גזר עליו 18 חודשי מאסר, מהם 6 חודשי עבודות שירות והיתרה על תנאי וכן קנס בסך 25 אלף ש""ח. המאשימה ערערה על קולת העונש, ובית המשפט העליון קיבל את הערעור וגזר על הנאשם סה""כ 20 חודשי מאסר, כש- 8 חודשים מהם בפועל. שם המדובר היה בנאשם נורמטיבי, אשר השתמש בנשק עם תחמושת סרק, על מנת לירות בשמחות, דבר הנהוג בכפרו. ",מדיניות הענישה
"ת""פ 40922-11-15","ת""פ (נצ') 35007-04-13 מדינת ישראל נ' איסלאם עזאיזה (8.1.2015); שם, הנאשם הורשע על פי הודאתו, במסגרת הסדר טיעון, בעבירות של נשיאת נשק והחזקת נשק. בית המשפט המחוזי גזר עליו 9 חודשי מאסר בפועל, 18 חודשי מאסר על תנאי וקנס בסך 5000 ₪. במקרה זה מדובר בנאשם ""בגיר צעיר"", הנעדר הרשעות קודמות ובאירוע אחד נמשך.",מדיניות הענישה
"ת""פ 40922-11-15","ע""פ 7241/12 עמאר טאטור נ' מדינת ישראל (טרם פורסם, ניתן ביון 3.1.2013); הנאשם הורשע על פי הודאתו, במסגרת הסדר טיעון בו המאשימה עתרה לעונש מאסר של 10 חודשים וב""כ הנאשם רשאי היה לטעון באופן חופשי, בעבירת החזקת נשק. בית המשפט המחוזי גזר על הנאשם 9 חודשי מאסר בפועל, שנה מאסר על תנאי וכן קנס בסך 5000 ₪. הנאשם ערער על רכיב המאסר בפועל, בית משפט העליון דחה את הערעור והעונש נשאר על כנו. ",מדיניות הענישה
"ת""פ 40922-11-15","בע""פ 4945/13 מדינת ישראל נ' עבד אלכרים סלימאן (טרם פורסם, ניתן ביום 19/01/14), הורשע הנאשם בעבירות של רכישה, החזקה, נשיאת והובלת נשק ותחמושת. בית המשפט המחוזי השית עליו 6 חודשי עבודות שירות והמדינה ערערה על קולת העונש. אומנם בסופו של יום בית המשפט העליון הותיר את העונש על כנו, אולם סיכם במסגרתו את מתחם העונש ההולם בעבירות נשק, מפי כב' הש' ארבל - ",מדיניות הענישה
"ת""פ 40922-11-15","""לטעמי, מתחם העונש שקבע בית המשפט המחוזי לעבירות שבהן הורשע המשיב – מאסר בפועל לריצוי בעבודות שירות ועד 20 חודשי מאסר בפועל – הוא מקל יתר על המידה, כטענת המערערת, ועל כן דרוש התערבות...עבירות המבוצעות בנשק – לרבות רכישה, החזקה ונשיאת נשק – טומנות בחובן פוטנציאל סיכון הרסני לפגיעה בשלום הציבור וביטחונו. החשש הוא כי נשק המוחזק שלא כדין ישמש לפעילות עבריינית העלולה להביא לפגיעה ואף לקיפוח חייהם של אזרחים תמימים. אכן, ""התגלגלותם"" של כלי נשק מיד ליד ללא פיקוח עלול להוביל להגעתם בדרך לא דרך לגורמים פליליים ועוינים. אין לדעת מה יעלה בגורלם של כלי נשק אלה ולאילו תוצאות הרסניות יובילו. ודוק: הסיכון שנשקף לשלום הציבור צריך להילקח בחשבון על-ידי כל מי שמחזיק בידו נשק שלא כדין – גם אם אינו מחזיק בו למטרת ביצוען של עבירות אחרות. עצם החזקת נשק בעל פוטנציאל קטילה מבלי שיש עליו ועל בעליו פיקוח מוסדר של הרשויות טומן בחובו סיכון, באשר המחזיק בו נתון תמיד לחשש שיתפתה לעשות בו שימוש, ולו ברגעי לחץ ופחד (ראו: ע""פ 3300/06 אבו סנינה נ' מדינת ישראל, [פורסם בנבו] פסקה 6 (10.8.2006), להלן: עניין אבו סנינה).",מדיניות הענישה
"ת""פ 40922-11-15","עוד ציינה כב' הש' ארבל כי עיון במקרים דומים בפסיקה מגלה, כי בכולם נגזרו עונשי מאסר לריצוי מאחורי סורג ובריח ורובם נעים סביב 20 חודשים ואף בחרה לאזכר את חלקם:",מדיניות הענישה
"ת""פ 40922-11-15","""בע""פ 2892/13 עודתאללה נ' מדינת ישראל [פורסם בנבו] (29.9.2013) דובר במערער שנהג ברכבו כשהוא מוביל ונושא אקדח עם מחסנית ריקה תחת מושבו. משהבחין בחסימה משטרתית, סטה המערער מנתיבו ועצר את הרכב. השוטרים הגיעו אל הרכב ומצאו את האקדח. בפי המערער לא היה הסבר המניח את הדעת לפשר החזקת הנשק והמניע לכך נותר עמום. מתחם העונש שנקבע, ובו לא מצאתי להתערב בגדר הערעור, עמד על 12 עד 36 חודשי מאסר בפועל. גם בעונש שהוטל על המערער – 21 חודשי מאסר בפועל בצירוף ענישה נלווית – לא ראיתי להתערב. יצוין כי דובר בבחור צעיר ונורמטיבי. ",מדיניות הענישה
"ת""פ 40922-11-15","בע""פ 4329/10 אסמאעיל נ' מדינת ישראל [פורסם בנבו] (14.11.2010) החזיק ונשא המערער אקדח טעון במצב נצור ברכבו. גם במקרה זה לא הוצע הסבר להחזקת הנשק. על המערער הוטלו 20 חודשי מאסר בפועל בצירוף ענישה נלווית, חרף המלצת שירות המבחן להשית עליו מאסר בעבודות שירות, ואף שדובר בבחור צעיר ונורמטיבי, ללא עבר פלילי, שהודה במיוחס לו. בית המשפט העליון לא התערב בעונש שנגזר"". ",מדיניות הענישה
"ת""פ 40922-11-15","בסיום החלטתה ציינה כ' השופטת, כי ""בהתחשב בערכים החברתיים הנפגעים ומידת הפגיעה בהם, ובשים לב לנסיבות ביצוע העבירות ומידת אשמתו של המשיב, וכן לאחר שלקחתי בחשבון את מדיניות הענישה הנוהגת לצד המדיניות הראויה, אני סבורה כי מתחם העונש ההולם בענייננו נע בין 12 ל- 36 חודשי מאסר בפועל. לטעמי, ככלל, בעבירות מהסוג הנדון, לא ניתן להסתפק בעונש של 20 חודשי מאסר ברף העליון של המתחם, ויש להגמישו כלפי מעלה באופן שיאפשר הטלת עונשים חמורים יותר על נאשמים שנסיבותיהם מצדיקות זאת"" (הדגשה אינה במקור – ס.ד.).",מדיניות הענישה
"ת""פ 40922-11-15","ת""פ (מר') 11059-05-12 מדינת ישראל נ' באסל אבו מוסא ואח'- הנאשמים הורשעו על פי הודאותיהם בין היתר בעבירת החזקת נשק. מתחם העונש שנקבע הינו מעונש מאסר לריצוי בעבודות שירות ועד 18 חודשי מאסר בפועל. לאחר שקילת מכלול השיקולים נגזר דינו של הנאשם 2 לשלושה חודשי מאסר שירוצו בעבודות שירות ומאסר מותנה. במקרה זה לא מדובר בעבירות שקדם להן תכנון, כמו כן הנאשמים ומשפחותיהם חשו מאוימים על רקע גירושי אחותם, והאקדח שימש להגנה עצמית. ",מדיניות הענישה
"ת""פ 40922-11-15","ת""פ (חי') 5000-12 מדינת ישראל נ' פלוני (2013); הנאשם הודה והורשע במסגרת הסדר טיעון בעבירות נשיאת והובלת נשק. המדובר בבגיר ללא עבר פלילי אשר הודה בעבירה והביע חרטה. בית המשפט המחוזי השית עליו ששה חודשי מאסר אשר ירוצו בעבודות שירות, 18 חודשי מאסר על תנאי וקנס כספי בסך 3000 ₪.",מדיניות הענישה
"ת""פ 40922-11-15","ע""פ 4038/14 מדינת ישראל נ' מהראן אבו עאבד ואח' (טרם פורסם, ניתן ביום 15.7.2014); במסגרת הסדר טיעון יוחסו לנאשמים, בין היתר, עבירות של החזקת ונשיאת נשק. נקבע על ידי בית המשפט המחוזי מתחם ענישה בין 6 חודשי מאסר שניתן לרצותם בעבודות שירות לבין 24 חודשי מאסר בפועל. בית המשפט המחוזי גזר את דינם כדלקמן: נאשם , אשר ירה ופגע בשלושה מתלוננים, נידון ל- 4 חודשי מאסר בפועל, 8 חודשי מאסר על תנאי קנס בסך של 20 אלף ש""ח, ופיצוי לכל אחד מהמתלוננים בסך של 3000 ש""ח. נאשם 2, שירה ופגע בששה מתלוננים, נידון ל- 9 חודשי מאסר בפועל, 9 חודשי מאסר על תנאי, תשלום קנס בסך של 40 אלף ש""ח, וכן פיצוי לכל אחד מהמתלוננים בסך של 5000 ₪. המאשימה ערערה על קולת העונש, ובית המשפט העליון קבע כי בית המשפט המחוזי נתן משקל יתר לנסיבות בדמות התנהגות הנפגעים והעלה את רף הענישה ל- 13 חודשים מאסר בפועל עבור נאשם 1, ו 24 חודשי מאסר עבור נאשם 2.",מדיניות הענישה
"ת""פ 40922-11-15","עוד אוסיף, כי בע""פ 8280/15 מוחמד גולאני נ' מדינת ישראל (טרם פורסם, ניתן ביום 16.2.2016); הנאשם הורשע על יסוד הודאתו במסגרת הסדר טיעון, בעבירות של סיוע לעסקה ונגזרו עליו 20 חודשי מאסר בפועל, 12 חודשי מאסר על תנאי וקנס בסך 5,000 ש""ח. הנאשם ערער על חומרת העונש וטען, כי בית המשפט שגה בקביעתו, כי רף הענישה במקרה הנדון הוא בין 16 ל-36 חודשי מאסר בפועל. בית המשפט העליון דחה את ערעורו וקבע, כי העונש שהושת עליו מאזן כראוי בין חומרת העבירות בהן הורשע ונסיבות ביצוען, לבין הנסיבות המקלות בעניינו, וכי אין בו סטייה ממדיניות הענישה הראויה.",מדיניות הענישה
"ת""פ 40922-11-15",בחינת הנסיבות הקשורות בביצוע העבירות (סעיף 40ט לחוק העונשין),מדיניות הענישה
"ת""פ 40922-11-15","בשלב זה, אין אנו דנים בנסיבותיו האישיות של הנאשם. אולם, על מתחם הענישה להיות מותאם באופן ספציפי לנסיבות ביצועה של העבירה ולמידת אשמו של הנאשם.",מדיניות הענישה
"ת""פ 40922-11-15","בענייננו, העבירות בוצעו במלואן ע""י הנאשמים, כל אחד לפי חלקו כמפורט לעיל. לעבירות אשר ביצעו הנאשמים קדם תכנון מוקדם. כאמור, הנאשם 1 קשר קשר עם הנאשמים 2, 3 ו-4 מתוך כותלי הכלא, ושלח אותם להוציא את העסקאות אל הפועל. הנאשמים כולם מהווים חוליות בשרשרת לשם מכירת הנשק והאמל""ח.",מדיניות הענישה
"ת""פ 40922-11-15","סעיפי האישום (שהם תולדה של פועלם של הנאשמים) מדברים בעד עצמם באשר לחלקו היחסי של כל אחד מהנאשמים בביצוע העבירה. הנאשמים 1 ו-3 יזמו והובילו את המעשים בשיטתיות, כשהנאשם 1 הוא זה הקושר את הקשר עם הסוכן והנאשם 3 מוציא אל הפועל את כל העסקאות. הנאשמים הורשעו, בין היתר, בעבירות סחר בנשק, החזקה, קשירת קשר לביצוע פשע וקבלת דבר במרמה. הנאשם 3 אף הורשע בנוסף בעבירות של נהיגה ללא רשיון וביטוח. לעומתם, הנאשמים 2 ו- 4 סייעו בידם לעשות כן בחלק מהמקרים השונים, בכך שקיבלו לידיהם את הכסף, ספרו אותו ונאשם 2 אף הסיע את הסוכן חזרה אל הצומת. השניים הורשעו, בין היתר, בסיוע לסחר, סיוע להחזקה וקשירת קשר. נאשם 2 הורשע בנוסף בעבירות של נהיגה ללא רשיון וללא ביטוח.",מדיניות הענישה
"ת""פ 40922-11-15","על הנזק אשר צפוי היה להיגרם עמדתי לעיל, עת פורטו הסכנות הנשקפות מזמינות נשק חם, אך ראוי לחזור ולהדגיש את ההשלכות הרוחביות הקמות וצצות מעבירת הסחר בנשק, אשר מלמדות על נזק עצום שעלול היה להיגרם. אין להקל ראש בהדים ובגלים הקטלניים שנוצרו על-ידי מעשי הנאשמים,  אשר חצו את גבול ההחזקה והנשיאה והולידו עבירות חמורות יותר שעניינן קשירת קשר לביצוע פשע, סחר בנשק ו/או סיוע לסחר בו  והחזקתו.",מדיניות הענישה
"ת""פ 40922-11-15","באשר לנזק שנגרם מביצוע העבירות, ראוי להדגיש, כי עבירות הנשק טומנות בחובן פוטנציאל למסוכנות מוחשית וממשית לשלום הציבור ולביטחונו.",מדיניות הענישה
"ת""פ 40922-11-15","לעניין חוות הדעת הפסיכיאטרית שהוגשה בעניינו של הנאשם 2 ראוי לציין, כי לא הוכח בפניי שעברו הפסיכיאטרי השפיע על ביצוע העבירה, ו/או על יכולתו של הנאשם להבין את אשר עשה. המדובר בנאשמים בוגרים, בעלי עבר פלילי אשר יכלו להימנע מלקיחת חלק בפרשה. לא הסוכן הוא שיצר עימם את הקשר על מנת שימכרו לו כלי נשק ואמל""ח, אלא ההיפך הוא הנכון. חוות הדעת שהוגשה הינה משנת 2009 ואין בה כדי ללמד על מצבו הנפשי העכשווי והעדכני של הנאשם.",מדיניות הענישה
"ת""פ 40922-11-15","בשקלול כל אלה, בשים לב לחלקו של כל אחד מהנאשמים השונים, כמפורט בעובדות כתב האישום, ובשים לב לערכים שנפגעו, מידת הפגיעה בהם ומדיניות הענישה הנוהגת כפי שצוטטה לעיל {ובכלל זה ע""פ 1768/14 בהא גנאים נ' מדינת ישראל (פורסם בנבו, מיום 1.7.2014) לפיו הורשע נאשם בגיר-צעיר בעבירות שעניינן החזקה, הובלה נשיאה וסחר בנשק והוטל עליו עונש של 36 חודשי מאסר בפועל, קנס בסך של 15000 ₪  ועונשים נלווים}, מתחם העונש בגין ביצוע העבירות כאן, ביחס לנאשמים 1 ו 3  נע בין שלוש עד שבע שנות מאסר בפועל, לצד עונשים נלווים של מאסר על תנאי וקנס שנע בין 20,000 ₪ ועד 60000 ש""ח .",מדיניות הענישה
"ת""פ 40922-11-15","באשר לנאשמים 2 ו 4 מתחם הענש נע בין 14 חודש ועד לשלוש שנות מאסר בפועל לצד קנס בין 10000 ₪ ועד ל 20000 ₪, ומאסר על תנאי.",מדיניות הענישה
"ת""פ 40922-11-15",בחינת הנסיבות אשר אינן קשורות בביצוע העבירות- (סעיף 40יא לחוק העונשין):,שלב שלישי- גזירת העונש
"ת""פ 40922-11-15","על פי סעיף זה, נסיבותיו האישיות של הנאשם, שאינן קשורות בביצוע העבירה, מוצאות ביטוין בעת קביעת עונשו של הנאשם בתוך מתחם הענישה.",שלב שלישי- גזירת העונש
"ת""פ 40922-11-15","בחנתי את טענות ב""כ הנאשם 2 לעניין נסיבות חייו, ומצאתי כי דינן להידחות. מסכים אני עם טענת המאשימה, כי מדובר בחוות דעת פסיכיאטרית הנוגעת לתקופה של לפני 7 שנים. כיום, אין בפנינו כל ראיה באשר למצבו הנפשי העכשווי; מה גם שטענה זו לא הועלתה בשום שלב של ההליך.",שלב שלישי- גזירת העונש
"ת""פ 40922-11-15","אני דוחה גם את טענת ב""כ הנאשם 2 לפיה צוות היס""מ שהגיעו למלון, השפילו באופן מכוון וזדוני. מועד העיכוב ו/או המעצר של הנאשם לא נגזר במכוון בכדי להביא למעצרו דווקא בזמן שהותו בבית מלון.",שלב שלישי- גזירת העונש
"ת""פ 40922-11-15","נאשם 1: עברו הפלילי כולל  16 הרשעות קודמות, במגוון עבירות חמורות, ביניהן; עבירות סמים, נהיגה בזמן פסילה, חבלה במזיד ברכב, וקשירת קשר לביצוע פשע.",עברם הפלילי של הנאשמים: 
"ת""פ 40922-11-15","נאשם 2: עברו הפלילי כולל  9 הרשעות קודמות בעבירות סמים, איומים, תקיפה ותקיפות שוטרים. בנוסף, קיימות לחובתו 4 הרשעות בעבירות תעבורה.",עברם הפלילי של הנאשמים: 
"ת""פ 40922-11-15","נאשם 3: בעברו 2 הרשעות קודמות בעבירות של חבלה חמורה, חבלה כשעבריין מזויין ואיומים.",עברם הפלילי של הנאשמים: 
"ת""פ 40922-11-15",נאשם 4: בעברו 6 הרשעות קודמות בגין עבירות סמים.,עברם הפלילי של הנאשמים: 
"ת""פ 40922-11-15","כל הנאשמים ריצו מאסרים בפועל בעבר. עם זאת ראוי לציין כי הנאשמים הודו, לקחו אחריות על מעשיהם, וחסכו מזמנו היקר של בית המשפט.",עברם הפלילי של הנאשמים: 
"ת""פ 40922-11-15","למותר לציין, כי יש ליחס משקל לשיקולי הרתעת הנאשמים והרתעת הרבים כפי הוראת סעיפים 40ו ו- 40ז לחוק העונשין ובמגמת ההחמרה עם עברייני הנשק, והסיכון הגלום בהחזקתו וודאי במכירתו של נשק פוגעני.",עברם הפלילי של הנאשמים: 
"ת""פ 40922-11-15","לאחר שמעתי את טיעוני הצדדים לעונש, ובבחינת הנסיבות שקשורות בביצוע העבירה וכאלה שאינן קשורות בביצוע העבירה, ובבחינת חלקו של כל נאשם ונאשם, לצד עברו הפלילי, שיתוף הפעולה והחיסכון בזמן שיפוטי, הגעתי לכלל מסקנה כי, הסדר הטיעון דר הוא תת קורת הגג של תיקון 113, כך שעניין לנו בהסדר סביר הנופל אל תוך מתחם הענישה ההולם ויש בו כדי לשקף נכונה את מגוון השיקולים הרלוונטיים העומדים על הפרק, הנסיבות שאינן קשורות בביצוע העבירה יחד עם הנסיבות הקשורות בביצוע העבירה. כלל הוא, כי רק במקרים חריגים ויוצאי דופן, יסטה בית המשפט מהסדר טיעון שגובש בין הצדדים. חזקה על המאשימה כי לקחה במניין שיקוליה את כל השיקולים הרלוונטיים העומדים על הפרק ובכללם האינטרס הציבורי. ( ע""פ 1958/98 פלוני נ' מ""י, פדי נ""ז (1), 577). ומשכך, יהיה זה נכון, צודק וראוי לכבד את הסדר הטיעון, וכך אני עושה.",עברם הפלילי של הנאשמים: 
"ת""פ 40922-11-15","אשר על כן, אני מאשר את הסדר הטיעון ודן את הנאשמים לעונשים הבאים:",עברם הפלילי של הנאשמים: 
"ת""פ 40922-11-15","אני דן את הנאשם למאסר לתקופה של 45 חודשים, החל מיום מעצרו 2.11.15. כמו כן, אני מורה על הפעלת מאסר על תנאי בן 10 החודשים התלוי ועומד נגד נאשם זה בתיק פלילי 18812-08-12 של בית משפט השלום בנצרת, כאשר מחציתו ירוצה בחופף ומחציתו במצטבר לעונש המאסר בתיק זה. סך הכל, ירצה הנאשם 50 חודשי מאסר בפועל החל מיום מעצרו, כאמור לעיל.",הנאשם 1
"ת""פ 40922-11-15","מאסר למשך 18 חודשים ואולם הנאשם לא יישא בעונש זה אלא אם יעבור בתוך שלוש שנים כל עבירת נשק מסוג פשע ו/או עבירה של קשירת קשר לביצוע פשע (בנוגע לעבירות נשק), ויורשע בה בתקופת התנאי או אחריה.",הנאשם 1
"ת""פ 40922-11-15",מאסר למשך 12 חודשים ואולם הנאשם לא יישא בעונש זה אלא אם יעבור במשך שלוש שנים כל עבירה מסוג פשע (מלבד עבירות בנשק מסוג פשע) ו/או עבירה שענינה קבלת דבר במרמה ו/או כל עבירת נשק מסוג עוון ויורשע בה בתקופת התנאי או אחריה.,הנאשם 1
"ת""פ 40922-11-15","הנאשם ישלם קנס בסך של 25,000 ₪ או חמשה חודשי מאסר תמורתו. הקנס ישולם ב 15 תשלומים חודשיים שווים ורצופים החל מיום 1.1.17.",הנאשם 1
"ת""פ 40922-11-15","אני דן את הנאשם למאסר לתקופה של 16 חודשים, החל מיום מעצרו 2.11.15.",הנאשם 2
"ת""פ 40922-11-15",מאסר למשך 12 חודשים ואולם הנאשם לא יישא בעונש זה אלא אם יעבור בתוך שלוש שנים כל עבירת נשק מסוג פשע (ובכלל זה סיוע לעבירה שכזו) ויורשע בה בתקופת התנאי או אחריה.,הנאשם 2
"ת""פ 40922-11-15",מאסר למשך 7 חודשים ואולם הנאשם לא יישא בעונש זה אלא אם יעבור במשך שנתיים עבירה של קשירת קשר לביצוע פשע ו/או כל עבירת נשק מסוג עוון (ובכלל זה סיוע לעבירה שכזו) ו/או עבירה של נהיגה בזמן פסילה ו/או נהיגה ללא רישיון נהיגה (כאשר רישיון הנהיגה פג תקופה העולה על שנה וחצי או כאשר אין לנאשם כלל רישיון) ויורשע בה בתקופת התנאי או אחריה.,הנאשם 2
"ת""פ 40922-11-15","הנאשם ישלם קנס בסך של 5,000 ₪ או 40 ימי מאסר תמורתו. הקנס ישולם בחמשה תשלומים חודשיים שווים ורצופים החל מיום 1/12/16.",הנאשם 2
