verdict,text,part
"ת""פ 9693-11-14",                                                      נ ג ד,המאשימה
"ת""פ 9693-11-14",                                                      נ ג ד,המאשימה
"ת""פ 9693-11-14","ב""כ המאשימה: עו""ד אורי גולדשטיין – פרקליטות מחוז ירושלים (פלילי)",הנאשם
"ת""פ 9693-11-14","חוק העונשין, תשל""ז-1977: סע'  40ג, 45(ב), 144(א), 329(א), 40יג(א)",חקיקה שאוזכרה: 
"ת""פ 9693-11-14","ביום 4.5.15 הורשע הנאשם על פי הודאתו בעובדות כתב האישום המתוקן שהוגש נגדו בתיק זה, בעבירה של חבלה בכוונה מחמירה, לפי סעיף 329(א) לחוק העונשין, התשל""ז – 1977 (להלן: ""החוק"") ובעבירה של החזקת נשק, לפי סעיף 144(א) לחוק.",כללי וכתב האישום המתוקן
"ת""פ 9693-11-14","ואלה המעשים: בחודש ספטמבר 2014 נפגשו מוחמד אבו סנינה (להלן - ""מוחמד"") והמתלונן עם מהדי שריף (להלן - ""מהדי"") בביתו שברמאללה, בכדי ליישב מחלוקת עסקית שנתגלעה ביניהם. במהלך הפגישה פנה הנאשם, שנכח בביתו של מהדי באותה עת, אל המתלונן וביקש ממנו שיעסיקו במסגרת עסק לשיפוצים אותו מנהל המתלונן, אולם המתלונן לא נעתר לבקשה.",כללי וכתב האישום המתוקן
"ת""פ 9693-11-14","בנוסף, במספר מועדים שונים לאחר מועד הפגישה הנ""ל ועובר ליום 24.10.14, חזר הנאשם על בקשתו בפני המתלונן, אולם זה לא נעתר גם לפניות אלה.",כללי וכתב האישום המתוקן
"ת""פ 9693-11-14","בתגובה לסירובו של המתלונן לבקשה, כשבוע עובר ליום 24.10.14, או בסמוך לכך, בביתו של מהדי ברמאללה, מסר הנאשם כדור תחמושת למוחמד ואמר לו כי יפגע במתלונן. מוחמד מסר למתלונן את דברי הנאשם.",כללי וכתב האישום המתוקן
"ת""פ 9693-11-14","ביום 24.10.14 בשעה 14:00, או בסמוך לכך, הגיעו הנאשם ואדם נוסף, ברכב מסוג פורד פוקוס, לחניון מסעדת ""הים התיכון"" בבית צפאפה שבירושלים, כשהנאשם מצויד באקדח מסוג קולט מתחת לחולצתו, וזאת לאחר שהנאשם ביקש להיפגש עם מוחמד. הנאשם נכנס למסעדה והאדם הנוסף נשאר ברכב. באותה עת שהו במסעדה גם המתלונן, סלימאן אבו סנינה (להלן - ""סלימאן"") – אחיו של מוחמד – ואחרים. בין הנאשם ובין סלימאן, מוחמד והמתלונן, התפתח ויכוח מילולי.",כללי וכתב האישום המתוקן
"ת""פ 9693-11-14",הנאשם יצא מהמסעדה ונכנס לרכב בו שהה האדם הנוסף. מספר דקות לאחר מכן יצא המתלונן מהמסעדה אל המבואה המובילה אליה.,כללי וכתב האישום המתוקן
"ת""פ 9693-11-14","הנאשם נמלט מהמקום ברכב, ובהמשך היום, בשעה 19.30, או בסמוך לכך, נתפס במחסום ביתר כשהאקדח מוסלק בתא המטען של הרכב.",כללי וכתב האישום המתוקן
"ת""פ 9693-11-14","כתוצאה ממעשי הנאשם, נגרם למתלונן חור כניסת קליע מימין לאיבר המין וחור יציאה מתחת לעכוז שמאל ועיבוי של אפידרמיס מימין לאשך ימין וזרימה מופחתת בתוכו, שבגינם נזקק המתלונן לאשפוז ולקבלת טיפול רפואי.",כללי וכתב האישום המתוקן
"ת""פ 9693-11-14","בעניינו של הנאשם הוגש תסקיר מטעם שירות המבחן (מיום 6.7.15). מהתסקיר עולה, כי הנאשם כבן 31, רווק. עובר למעצרו התגורר הנאשם עם אמו ושתי אחיותיו בביתם שביפו והתפרנס מניהול מינימרקט שבבעלותו ובבעלות אחותו הבכורה. הנאשם הוא השני מבין שלושה ילדים. הוריו התגרשו בהיותו כבן 6, וזאת על רקע התמכרותו של האב לסמים והיותו אלים כלפי אמו של הנאשם. בעקבות הגירושין הוצאו ילדי המשפחה, ובכלל זה הנאשם, למסגרת פנימייתית בירושלים. בגיל 12 חזר הנאשם להתגורר עם אמו וסבתו ביפו. הוריו של הנאשם נישאו בשנית לבני זוג אחרים. הנאשם תיאר בפני שירות המבחן קשר רופף עם אביו לאורך השנים וקשר קרוב עם אמו ועם אחיותיו. הנאשם נשר מבית הספר בגיל 14 לערך, והתחבר לחברת שוליים. הדבר הוביל אותו לצריכת סמים ולהסתבכות בפלילים, שבגינה ריצה מספר תקופות מאסר לאורך השנים. על פי התסקיר (בהסתמך על גיליון הרישום הפלילי), במהלך השנים הורשע הנאשם בביצוע עבירות שונות ובכלל זה: עבירות אלימות, איומים, רכוש, סמים, הפרת הוראה חוקית, הפרעת שוטר במילוי תפקידו, ושבל""ר, שבגינן, כאמור, ריצה תקופות מאסר, כפי שיפורט בהמשך. יצוין בהקשר זה, כי מהתסקיר עולה, כי לדברי הנאשם, במהלך מעצרו הנוכחי הוא הועבר ממתקן קודם בו שהה למתקן אחר וזאת לאחר שגורמי מודיעין בשב""ס הצביעו על סכנה לחייו במקום מעצרו הקודם. עוד ציין הנאשם בפני שירות המבחן, כי במהלך מעצר קודם הוא עבר פגיעה טראומטית מצד עצור אחר, וכי בגין כך טופל בתרופות הרגעה.",תסקיר שירות המבחן
"ת""פ 9693-11-14","בהתייחס לעבירות מושא דיוננו מצוין בתסקיר, כי הנאשם מודה בביצוען ולוקח עליהן אחריות. הנאשם הביע צער על הפגיעה במתלונן, והוסיף כי היו מגעים לעריכת סולחה עם משפחת המתלונן, אשר סירבה לכך. בהתייחס להערכת הסיכון ולסיכויי שיקום מציין שירות המבחן בתסקיר, כי ההתרשמות היא שהנאשם גדל במסגרת משפחתית מורכבת ובסביבה חברתית בעייתית בה נחשף לעבריינות, ועל רקע זה הוא אימץ דפוסי התנהגות וחשיבה עבריינים וניהול אורח חיים עברייני. להערכת שירות המבחן, הנאשם הוא בעל כלים וכוחות מוגבלים לעריכת שינוי משמעותי בחייו ובהתנהלותו. עוד התרשם שירות המבחן, כי הנאשם בוחר בדפוסי התנהגות אלימים כדרך לפתרון סכסוכים, וכי במצבים שבהם הוא חווה איום ופגיעה הוא עלול להתנהל באופן תוקפני תוך קושי לוויסות דחפיו. שירות המבחן מציין עוד, כי ניכר שהליכים פליליים קודמים וסנקציות שהוטלו עליו במסגרתם אינם מהווים גורם מרתיע ומציב גבולות עבורו. אשר לסיכויי שיקום, שירות המבחן מציין כגורמים חיוביים את הצלחתו של הנאשם לתפקד במישור התעסוקתי לאחרונה, ואת הדאגה לבני משפחתו.",תסקיר שירות המבחן
"ת""פ 9693-11-14","בסיכומו של דבר, התרשמות שירות המבחן היא, כי קיימת רמת סיכון גבוהה להישנות התנהגות אלימה וברף חומרה גבוה מצידו של הנאשם. על רקע זאת סבור שירות המבחן כי הנאשם זקוק לענישה קונקרטית שתמחיש לו את הפגיעה והחומרה העולים מהתנהגותו, ואשר תהווה גורם מרתיע מפני מעורבות חוזרת בפלילים ובפרט בסיטואציות אלימות.",תסקיר שירות המבחן
"ת""פ 9693-11-14","שני הצדדים הביאו ראיות לעניין העונש. המאשימה הגישה הצהרת נפגע עבירה שניתנה על ידי המתלונן ביום 5.7.15. בהצהרתו ציין המתלונן, כי מאז האירוע הוא חושש פן ייעשה ניסיון נוסף לפגוע בו ובמשפחתו וכי מסיבה זו הוא נמנע מלאפשר לילדיו לצאת מהבית לבד. המתלונן ציין עוד, כי בעקבות הפגיעה הוא אושפז למשך מספר ימים, ובהמשך שהה בחופשת מחלה עד לחודש מאי 2015, וזאת על רקע כאבים חזקים מהם סבל. עוד ציין המתלונן, כי מאז האירוע נפגע תפקודו המיני באופן קשה. המתלונן ציין עוד, כי בעקבות האירוע נגרמו לו הפסדי שכר משמעותיים וכי הוא נאלץ להוציא הוצאות רפואיות. להצהרה צורפו מסמכים רפואיים.",טיעוני הצדדים לעונש
"ת""פ 9693-11-14","הנאשם העיד מטעמו את גב' עטיה עפיפי, דודתו, במטרה לתאר את הרקע שהוביל, לטענתו, להתרחשותו של האירוע, כפי שהדברים יפורטו בהמשך. במהלך חקירתה הנגדית של העדה על ידי ב""כ המאשימה, התבקשה העדה לצאת מן האולם לפרק זמן קצר, וזאת על מנת ללבן השגה שהיתה לב""כ המאשימה באשר לאופי עדותה של העדה ומטרתה. ואולם, לאחר שהסתיימה ההפסקה מסר ב""כ הנאשם כי הוא יצא החוצה על מנת לזמן את העדה לצורך סיום שמיעת עדותה, אך לא מצא אותה.",טיעוני הצדדים לעונש
"ת""פ 9693-11-14","המאשימה סבורה, כי העונש הראוי במקרה זה הוא 13 שנות מאסר וכן חיוב הנאשם בפיצוי משמעותי למתלונן. בטיעוניו הדגיש ב""כ המאשימה את חומרתו של המעשה שביצע הנאשם, המתבטאת בתכנון המוקדם ובנזק החמור שנגרם למתלונן, וזאת על רקע חוסר רצונו של המתלונן לקלוט את הנאשם לעבודה. עוד ציין ב""כ המאשימה את עברו הפלילי של הנאשם, שלחובתו 12 הרשעות קודמות שבגינן ריצה עונשי מאסר ממושכים. ב""כ המאשימה טען עוד, כי יש להביא בחשבון גם את עבירת החזקת הנשק בה הורשע הנאשם. ב""כ המאשימה הפנה לפסיקה בתמיכה לעמדתו. בהתייחס לקיזוז תקופת המעצר בה נתון הנאשם נמסר על ידי ב""כ המאשימה, כי במסגרת התיק מושא דיוננו מצוי הנאשם במעצר מיום 24.10.14. עוד נמסר, כי ביום 31.5.15 החל הנאשם לרצות עונש של 26 חודשי מאסר אשר נגזר עליו במסגרת תיק אחר (ת.פ. (שלום ת""א) 7209-03-12), שעניינו גניבת רכב. במצב דברים זה עותר ב""כ המאשימה לכך שהתקופה מיום 31.5.15 לא תקוזז מעונש המאסר שיוטל על הנאשם במסגרת תיק זה, ושייקבע כי העונש שיוטל על הנאשם במסגרת תיק זה ירוצה במצטבר לעונש שהוטל על הנאשם בת.פ. 7209-03-12 הנ""ל, ולא בחופף לו. ",טיעוני הצדדים לעונש
"ת""פ 9693-11-14","בטיעוניו לעונש טען ב""כ הנאשם, כי הרקע שהוביל להתרחשות האירוע היה הצעות מיניות שהציע המתלונן לדודתו של הנאשם (אשר, כאמור, העידה במסגרת ישיבת הטיעונים לעונש). לפי הטענה, הצעות אלה הכעיסו מאוד את הנאשם וגרמו לו לבצע את המעשה. בהקשר זה ביקש ב""כ הנאשם ליתן משקל לעדותה של הדודה. ב""כ המאשימה טען מנגד, כי בשים לב לכך שהעדה בחרה שלא לשוב לאולם בית המשפט על מנת לסיים את חקירתה הנגדית, הרי שאין לתת לעדות זו כל משקל. יצוין, כי בכתב האישום בו הודה הנאשם אין כל איזכור לעניין זה, ואולם במסגרת הסדר הטיעון הוסכם, כי בשלב הטיעונים לעונש הנאשם יטען שכשבוע וחצי לפני מועד האירוע הוא שמע מקרובת משפחתו כי המתלונן הציע לאותה קרובת משפחה הצעות בעלות רקע מיני, וכי המאשימה לא תביא ראיות לסתור טענה זו. עוד נטען על ידי ב""כ הנאשם, כנסיבה לקולה במקרה זה, כי מדובר בירייה בודדת שכוונה אל עבר פלג גופו התחתון של המתלונן. נטען עוד, כי מהמסמכים הרפואיים שהגיש המתלונן עולה, כי הפגיעה בו היתה פחות חמורה מכפי שנטען. ב""כ הנאשם טען עוד, כי יש להביא לזכותו של הנאשם את העובדה שנטל אחריות על המעשים, גם בפני שירות המבחן, והודה בהם. ב""כ הנאשם הפנה אף הוא לפסיקה בתמיכה בעמדתו.",טיעוני הצדדים לעונש
"ת""פ 9693-11-14","בתגובה שהוגשה מטעמו התייחס ב""כ הנאשם לבקשת המאשימה כי העונש שיוטל על הנאשם במסגרת תיק זה יחול במצטבר לעונש שהוטל עליו במסגרת ת.פ. 7209-03-12, ולא בחופף לו. ב""כ הנאשם טען בהקשר זה, כי יש לדחות את הבקשה. נטען, כי תנאי מעצר קשים מתנאי מאסר במגוון היבטים, ובכלל זה: יציאה לחופשות, התייחדות, קבלת טיפולים שיקומיים ועוד. זכויות אלה, כך נטען, ניתנות רק לאסיר ולא לעציר – המעמד בו נמצא הנאשם. עוד נטען, כי הפסיקה הכירה בשוני שבין תנאי ההחזקה של עציר לעומת אסיר, ומסיבה זו בפסקי דין שונים (אליהם הפנה ב""כ הנאשם) נקבע, כי לפחות חלק מתקופת מעצר שחפפה תקופת מאסר שהחל נאשם לרצות בעודו עצור, תובא בחשבון ותנוכה מתקופת המאסר הכוללת. ב""כ הנאשם הוסיף וטען, כי סעיף 45(ב) לחוק קובע, כי מי שנדון למאסר נוסף בעת שהוא כבר אסיר, ירצה את עונשו בחופף ולא במצטבר, וזאת אלא אם בית המשפט הורה אחרת. עקרון זה מבקש ב""כ הנאשם להחיל גם בענייננו ולקבוע, כי כל עונש מאסר שיושת על הנאשם במסגרת תיק זה ירוצה בחופף לכל עונש מאסר אותו מרצה הנאשם כעת.",טיעוני הצדדים לעונש
"ת""פ 9693-11-14","במסגרת ישיבת הטיעונים לעונש אמר הנאשם, כי הוא מצטער על המעשה שעשה ועל הפגיעה שנגרמה למתלונן.",טיעוני הצדדים לעונש
"ת""פ 9693-11-14","גזירת דינו של הנאשם תיעשה במסגרת הוראת תיקון 113 לחוק. יצוין, כי הגם שהנאשם הורשע בשתי עבירות, אני סבור כי בנסיבות העניין יש לראות בכך אירוע אחד (סעיף 40יג(א) לחוק).",דיון
"ת""פ 9693-11-14","אין צורך להרחיב באשר לערכים החברתיים שנפגעו כתוצאה מביצוע העבירות בהן הורשע הנאשם – חבלה בכוונה מחמירה והחזקת נשק. מדובר בזכות לשלמות הגוף ובשמירה על שלום הציבור. מובן מאליו שכאשר מדובר בירי מטווח קרוב בכוונה לפגוע באחר, תוך גרימת נזקים גופניים של ממש, מידת הפגיעה בערכים המוגנים האמורים היא גבוהה. חברה תקינה אינה יכולה לסבול מצב שבו נעשה שימוש בנשק ובאלימות לצורך פתרון סכסוכים.",דיון
"ת""פ 9693-11-14","בהקשר ל""מדיניות הענישה הנהוגה"" הפנה כל אחד מהצדדים לפסיקה. מטבע הדברים, כל אחד מהצדדים הגיש פסיקה המשקפת את עמדתו לגבי מידת העונש שיש להטיל על הנאשם שלפנינו, לחומרה או לקולה.",דיון
"ת""פ 9693-11-14","בפסיקת בית המשפט העליון נאמר לא אחת, כי אין לקבל מצב שבו נעשה שימוש בנשק קר או חם לצורך פתרון סכסוכים, וכי על בית המשפט לסייע במאמץ למיגור תופעה זו באמצעות ענישה מרתיעה. רא' למשל ע""פ 6310/14 פלוני נ' מדינת ישראל, מיום 16.6.15, שם נאמרו הדברים הבאים (פסקה 9):",דיון
"ת""פ 9693-11-14","""בית משפט זה חזר ועמד על כך שבחברה מתוקנת לא ניתן להשלים עם פתרון סכסוכים בנשק קר או חם ועל חלקם של בתי המשפט במאמץ למגר את הנגע (ראו למשל ע""פ 5794/13 מדינת ישראל נ' שיכה, [פורסם בנבו] פסקה 6 (2.4.2014); ע""פ 2161/13 חבשי נ' מדינת ישראל [פורסם בנבו] (16.5.2013); השוו גם ע""פ 4330/12 דעאס נ' מדינת ישראל, [פורסם בנבו] פסקה 14 (5.11.2012) (להלן: עניין דעאס)). זכותו של כל אדם לשלמות גופו היא זכות יסוד ואין להתיר לאיש לפגוע בה.""",דיון
"ת""פ 9693-11-14","בחינת הפסיקה אליה הפנו הצדדים, ופסיקה נוספת, מעלה כי קיים מנעד של חומרה, וכפועל יוצא מכך של חומרת הענישה, בעבירות של חבלה בכוונה מחמירה. כך למשל, בע""פ 4697/11 (מיום 24.3.13) אליו הפנתה המאשימה מדובר היה במערער שהיה מסוכסך עם אחותו. על רקע זה, המערער הצטייד באקדח ובמהלך מסיבה שנערכה בבית המשפחה נכנס אל החצר בה שהתה האחות ביחד עם חמש נשים נוספות, וירה בגבה שני כדורים בעוד היא מחזיקה על ידיה את בתה הקטינה. כתוצאה מכך נגרמה לאחות חבלה קשה ביותר שהצריכה טיפולים רבים וניתוחים. בית המשפט המחוזי גזר על המערער – שהיה בעל עבר פלילי וריצה בעברו תקופת מאסר מושכת – עונש של 8 שנות מאסר, ואולם בית המשפט העליון החמיר בעונשו של המערער, מבלי למצות עימו את הדין, והעמידו על 9 שנות מאסר. בע""פ 4375/02 (מיום 9.1.03, שגם אליו הפנתה המאשימה) מדובר היה באדם נעדר עבר פלילי, שעל רקע סכסוך עם הממונה עליו במקום העבודה פרץ למשרדו וירה לעברו ממרחק קצר 13 כדורים אשר פגעו בפלג גופו התחתון. יוער, כי האישום היה בתחילה ניסיון לרצח ואולם בסופו של דבר המערער שם הורשע בעבירה של חבלה בכוונה מחמירה. בית המשפט המחוזי (דעת רוב) גזר עונש של 13 שנות מאסר לריצוי בפועל. בית המשפט העליון לא מצא עילה להתערב בגזר הדין. מנגד, בע""פ 479/09 ו- 6163/09 (שנדונו במאוחד, מיום 1.12.09), אליו הפנה ב""כ הנאשם, מדובר היה באדם שהצטייד באקדח, ארב למתלונן, וכאשר האחרון הגיע למקום, ירה לעברו 4-5 יריות. כתוצאה מכך נגרם למתלונן שם שבר מרוסק ברגלו הימנית והוא נותח. בנוסף, נחבלה באורח קל גם עוברת אורח. בית המשפט המחוזי הטיל על אותו נאשם (שהיה כבן 20 בעת המעשה, ובעל עבר פלילי) עונש של 40 חודשי מאסר. ערעור שהגישה המדינה לבית המשפט העליון התקבל, והעונש הוחמר והועמד על 48 חודשי מאסר. יצוין, כי פסיקה זו ניתנה לפני תיקון 113 לחוק. עוד אפנה לע""פ 8641/12 (מיום 5.8.13) שם על רקע סכסוך כלשהו שהיה בין שניים, הגיע המערער אל בית הקפה בו שהה המתלונן וביקש ממנו להתלוות אליו ברכבו. בשלב מסויים עצר המערער את הרכב והשניים יצאו ממנו והחלו ללכת בחניה ולשוחח. באותן הנסיבות שלף המערער את אקדחו וירה 3-4 יריות אל עבר רגליו של המתלונן. 3 מהן פגעו במתלונן. כתוצאה מכך נגרמו למתלונן פגיעות בשתי רגליו אשר הצריכו אותו לעבור ניתוחים לתיקון הנזקים לרגליים. בית המשפט המחוזי הטיל על הנאשם באותו מקרה, שהיה נעדר עבר פלילי, עונש של 42 חודשי מאסר. בית המשפט העליון החמיר בעונש והעמידו על 5 שנות מאסר. אפנה עוד לע""פ 2044/13 (מיום 19.2.14) שם מדובר היה במקרה שבו התגלע ויכוח בין הנאשם והמתלונן במהלכו זרק המתלונן כוס שהיתה בידו לכיוונו של הנאשם והחל לברוח מהמקום. בתגובה שלף המערער אקדח שהיה ברשותו וירה לעבר המתלונן 3 יריות. אחת מהיריות פגעה בירכו השמאלית של המתלונן וגרמה לו לשריטה. בית המשפט המחוזי הטיל על המערער, שהיה בעל עבר פלילי לא מבוטל (כך על פי גזר הדין), עונש של 4 שנות מאסר, ובית המשפט העליון לא התערב בעונש זה. אציין, כי שני פסקי הדין האחרונים הנ""ל ניתנו לאחר כניסתו לתוקף של תיקון 113 לחוק. ",דיון
"ת""פ 9693-11-14","בהתייחס לנסיבות ביצוע העבירה בענייננו, יש לציין לחומרה את התכנון המוקדם; הנזק המשמעותי שנגרם למתלונן; ופוטנציאל הנזק שעלול להיגרם כתוצאה מירי אל עבר גופו של אדם. מנגד, מביא אני בחשבון גם את העובדה שמדובר בירייה בודדת אשר לא כוונה לעבר מרכז הגוף אלא לפלג הגוף התחתון.",דיון
"ת""פ 9693-11-14","בשים לב לכל האמור לעיל, אני סבור כי מתחם הענישה הראוי בענייננו נע בין 4 ל-9 שנות מאסר.",דיון
"ת""פ 9693-11-14","עניין לנו בנאשם כבן 31, בעל עבר פלילי עשיר, שהלכה למעשה בילה חלק ניכר מחייו הבוגרים בין כותלי הכלא. כך, ביום 26.3.01 נדון הנאשם לעונש מאסר של 7 חודשים; ביום 25.6.02 נדון הנאשם לעונש מאסר של 20 חודשים; ביום 10.11.04 נדון הנאשם ל-14 חודשי מאסר; ביום 29.5.08 נדון הנאשם ל- 4 שנות מאסר; ביום 27.1.10 נדון הנאשם ל-19 חודשי מאסר; ביום 17.6.10 נדון הנאשם ל-5 חודשי מאסר; ביום 1.11.10 נדון הנאשם ל-4 חודשי מאסר; ביום 25.2.14 נדון הנאשם ל-45 ימי מאסר; וביום 31.5.15 נדון הנאשם ל-26 חודשי מאסר. בסה""כ, במצטבר, מדובר בכ-12 שנות מאסר. המעשה שביצע הנאשם הוא מעשה חמור. אין בעיניי משמעות של ממש למניע שהוביל את הנאשם לביצוע המעשה, האם הדבר היה בשל אי קבלתו לעבודה על ידי המתלונן או שמא על רקע הצעות כלשהן מצידו של המתלונן לדודתו של הנאשם. מעשה זה מתוסף לעברו הפלילי המכביד של הנאשם. אין אלא לומר, כי העונשים שהוטלו על הנאשם עד כה לא גרמו לו לחדול מדרכו העבריינית, והדבר מצדיק ענישה מתאימה.",גזירת עונשו של הנאשם
