verdict,text,part
"ת""פ 35227-05-17","במסגרת תיק פלילי 9111-02-15 מדינת ישראל נ' חאסרמה (ניתן ביום 20.9.15) גזר בית המשפט המחוזי בחיפה על הנאשם  עונש מאסר בן 10 חודשים לריצוי בפועל בגין ביצוען של שתי עבירות בנשק - האחת, לפי  סעיף 144(א) לחוק העונשין והשנייה לפי סעיף 144(ב) לחוק העונשין. עובדות המקרה בפרשה זו היו אלו:  עת הגיעו שוטרים לסוכת אבלים של משפחת חסארמה, בכפר בענה, במטרה לעכב את יוסף חסארמה לחקירה, הבחין בהם הנאשם שהיה במתחם והחל במנוסה מהם כאשר הוא נושא ומחזיק אקדח מסוג FN ומחסנית עם 13 כדורים 9 מ""מ. במהלך המנוסה מהשוטרים זרק הנאשם את האקדח והמחסנית.  ",וראו גם:
"ת""פ 35227-05-17","ראו בנוסף: ע""פ 2839/05 עבד אל קאדר נ' מדינת ישראל (ניתן ביום 17.11.05); ת""פ (מחוזי חיפה) 37083-11-14 מדינת ישראל נ' עיסאוי (ניתן ביום 13.12.15); ת""פ (מחוזי תל אביב) מדינת ישראל נ' יוסף עלו (ניתן ביום 28.6.10).  ",וראו גם:
"ת""פ 35227-05-17",הנסיבות הקשורות בביצוע העבירה (סעיף 40ט לחוק העונשין),וראו גם:
"ת""פ 35227-05-17","נעבור לבחון את הנסיבות הקשורות בביצוע העבירה: הובלת נשק באמצעות כלי-רכב היא מתוכננת, אלא אם הוכחו נסיבות מיוחדות המוכיחות אחרת; הנאשם ביצע את העבירה לבדו והוא העבריין היחיד. כתוצאה מהמעשה עלול היה להיגרם נזק חמור; משכלי הנשק נתפס לא נגרם כל נזק בפועל. מניעיו של הנאשם בביצוע העבירה לא הובררו כלל. שירות המבחן לא נתן אמון מלא בגרסתו והעריך שנטילת האחריות שלו היא חלקית בלבד. הנאשם הבין את מעשיו, יכול היה וצריך היה להימנע מלבצעם.",וראו גם:
"ת""פ 35227-05-17","בהתחשב במכלול הנסיבות הללו, בערכים המוגנים שנפגעו, במידת הפגיעה בהם ובמדיניות הענישה המקובלת בכגון דא, ראוי לקבוע מתחם ענישה הולם הנע בין 12 חודשי מאסר לריצוי בפועל לבין 36 חודשי מאסר לריצוי בפועל, הכול לצד עונשים נלווים דוגמת מאסר-על-תנאי וקנס כספי.",וראו גם:
"ת""פ 35227-05-17",נסיבות שאינן קשורות בביצוע העבירה (סעיף 40יא לחוק העונשין),וראו גם:
"ת""פ 35227-05-17","משנקבע מתחם העונש ההולם הגיעה השעה למקם את העונש אותו ראוי להטיל על הנאשם בהתחשב בנסיבות שאינן קשורות בביצוע העבירה, נסיבותיו האישיות.",וראו גם:
"ת""פ 35227-05-17","הטלת מאסר ממושך תפגע בנאשם, לנוכח גילו הצעיר, מצבו המשפחתי הקשה, מצבו הכלכלי הקשה וניסיונו (לדבריו) לצאת את מעגל הפשע ולחיות חיים נורמטיביים הכוללים השלמת לימודים וכניסה למעגל התעסוקה. הטלת מאסר ממושך בוודאי תפגע במשפחתו. אביו מאושפז במצב קשה בשעת כתיבת שורות אלו; אמו שרויה במצב רפואי וכלכלי קשה; היא לבדה וזקוקה לנאשם כמסייע כלכלי; הנאשם נטל אחריות חלקית על מעשיו ועושה, לדבריו, מאמצים לשוב למוטב. הנאשם הודה באשמה  במשפטו ובכך חסך זמן שיפוטי; נסיבות חייו לא פשוטות – הוא מגיע מרקע עברייני והוא נגרר בגיל צעיר לבצע עבירות אלימות ועבירות רכוש קשות. עברו הפלילי של הנאשם מכביד. גם אם הרשעותיו הקודמות מתייחסות לעבירות שעבר בהיותו קטין, אופיין החמור, היקפן ומשמעותן מחמירות מאוד.",וראו גם:
"ת""פ 35227-05-17","לנוכח המכלול, וכן בשים לב להמלצת שירות המבחן, אשר לטעמי, מאיינת את האפשרות לסטות ממתחם הענישה מטעמי הרתעה, מצאתי לנכון לגזור לנאשם עונשים כדלקמן –",וראו גם:
"ת""פ 35227-05-17",(א) 15 חודשי מאסר לריצוי בפועל מיום מעצרו; ,וראו גם:
"ת""פ 35227-05-17",(ב) 12 חודשי מאסר על תנאי לבל יעבור במשך 3 שנים עבירה של החזקה נשיאה או הובלה בלתי-חוקית בנשק.,וראו גם:
"ת""פ 35227-05-17",(ג) נמנעתי מלהטיל על הנאשם קנס לנוכח מצבו הכלכלי הקשה ולנוכח חילוט אופנועו.,וראו גם:
"ת""פ 35227-05-17","(ד) אני נעתר לבקשת התביעה ומורה על חילוט אופנועו של הנאשם, מסוג קואנג יאנג טיו מ.ר. 90-766-30 לנוכח הסמכות הנתונה לי מכוח סעיפיו 32 ו-39 לפקודת סדר הדין הפלילי (מעצר וחיפוש) [נוסח חדש], התשכ""ט-1969. הנאשם עשה שימוש באופנוע בביצוע העבירה ולא מצאתי טעם המצדיק הימנעות מהחילוט המבוקש.",וראו גם:
"ת""פ 35227-05-17",אני מצטרף להמלצת שירות המבחן להפניית הנאשם לטיפול בתחום האלימות והשליטה בדחפים במהלך ריצוי מאסרו.,וראו גם:
"ת""פ 35227-05-17","54678313ניתן היום, י""א תשרי תשע""ח, 01 אוקטובר 2017. ",5129371
"ת""פ 35227-05-17",נוסח מסמך זה כפוף לשינויי ניסוח ועריכה,אבי לוי 54678313
"ת""פ 35227-05-17","בעניין עריכה ושינויים במסמכי פסיקה, חקיקה ועוד באתר נבו – הקש כאן",אבי לוי 54678313
