verdict,text,part
"ת""פ 15842-11-20","בע""פ 9543/09 בילאל רחאל נ' מדינת ישראל (19.1.10): ", וכן: 
"ת""פ 15842-11-20","ובע""פ 761/07 מיכאל אדרי נ' מדינת ישראל (22.2.07):", וכן: 
"ת""פ 15842-11-20","החומרה הרבה שבעבירות הנשק, הצורך להחמיר בענישה והכלל של הטלת עונשי מאסר בפועל בדרך כלל עלו בפסקי דין רבים נוספים, ביניהם ע""פ 2251/11 ג'מאל נפעא נ' מדינת ישראל (4.12.11); ע""פ 6989/13 חנא פרח נ' מדינת ישראל (25.2.14), ע""פ 4954/13 מדינת ישראל נ' עבד אלכרים סלימאן (19.1.14), ועוד.", וכן: 
"ת""פ 15842-11-20","לאחרונה, בימים אלה ממש, נפסק בע""פ 6068/21 מדינת ישראל נ' אברהים פקיה (19.12.21):", וכן: 
"ת""פ 15842-11-20","""יש להדגיש את החומרה היתירה שנודעה לביצוע עבירות נשק, על כל סוגיהן ומיניהן. במסגרת פסק הדין בע""פ 4595/13 זובידאת נ' מדינת ישראל (6.7.2014)  בית המשפט קרא למחוקק לשקול את החמרת הענישה בעבירות נשק. בהמשך לכך, בשנת 2018 תיקן המחוקק את סעיף 340א לחוק העונשין והחמיר את העונש הקבוע בצידה של עבירת ירי מנשק חם (ראו: הצעת חוק העונשין (תיקון מס' 132) (ירי מנשק חם), התשע""ח-2018, ה""ח 1223). זאת, כצעד נוסף למלחמה בתופעת השימוש בנשק ופוטנציאל הנזק הכרוך בכך.", וכן: 
"ת""פ 15842-11-20","בהמשך לתיקון זה, בית משפט זה הדגיש בפסיקתו פעם אחר פעם, כי עבירות הנשק הפכו לחזון נפרץ, המביא לעיתים מזומנות לפגיעה בחיי חפים מפשע. בהתאם לכך, בית משפט זה שב וקבע כי החמרת הענישה בגין עבירות אלו היא אינטרס ציבורי מהמעלה הראשונה ותנאי הכרחי להרתעת הציבור מפני ביצוען (ראו מיני רבים: ע""פ 4406/19 מדינת ישראל נ' סובח, פסקאות 16–17 לחוות דעתי (5.11.2019); רע""פ 7344/18 מג'יד נ' מדינת ישראל, פסקה 10 (21.10.2018)).", וכן: 
"ת""פ 15842-11-20","לגישה מחמירה זו מתווספת חומרה יתירה בענייננו בגין העובדה כי המשיב לא פעל להסגרת הנשק בו השתמש לידי המשטרה עד עצם היום הזה. כפי שציינתי בעבר, כלי נשק אשר אינם נמצאים בידי רשויות החוק עלולים לשמש לפעילות עבריינית המסכנת את שלום וביטחון הציבור, ואף לשרת גורמים עוינים לפעילות על רקע ביטחוני (וראו ע""פ 4530/19 ג'זאווי נ' מדינת ישראל, פסקה 12 (11.8.2019))"".", וכן: 
"ת""פ 15842-11-20","עד כאן על כלל עבירות הנשק. מכאן ואילך אעבור לדון בעניינו של כל אחד מהנאשמים בנפרד. אציין כי הן ב""כ המאשימה והן ב""כ הנאשמים עשו עבודתם נאמנה והפנו בטיעוניהם למספר גדול של פסקי דין. לא אפרט את כל פסקי הדין שהוזכרו מטעם כל צד בנוגע לכל אחד מהנאשמים והמתחמים, אלא אפנה לפסיקה הרלוונטית בעיני בהקשרה המתאים בגזר הדין.", וכן: 
"ת""פ 15842-11-20","נאשם 1 יליד 1998. הוא הורשע באישום 3, בגניבת תיק ובו חלקי נשק ותחמושת מתוך רכב; באישום 4 בנשיאת נשק וירי באזור מגורים; באישומים 5, 8, 9, 10 העוסקים בשיחות והכנות שונות לקראת עסקאות נשק ושימוש בנשק; באישום 12 בהדחה וחקירה ושיבוש מהלכי משפט במטרה לפגוע בחקירת אירוע ירי; באישום 17 במעורבות בניסיון לייצר ולשפר כלי נשק או חלקי נשק ובאישום 19 בעבירות פציעה ואלימות במטרה לשבש חקירת אירוע שוד.",נאשם 1 
"ת""פ 15842-11-20","לנאשם 1 עבר פלילי הכולל עבירות ביטחון, אלימות ורכוש. הוא ריצה מאסרים בעבר ולחובתו מאסר על תנאי בר הפעלה על עבירה של החזקת סכין בת""פ 47777-08-17 של בית משפט השלום בירושלים.",נאשם 1 
"ת""פ 15842-11-20","ב""כ המאשימה טענה כי נאשם זה הוא הבכיר ומעשיו הם החמורים מבין כלל הנאשמים. חלקו של נאשם זה היה הדומיננטי ביותר והוא הגורם המתסיס והרוח החיה מאחורי הפרשיה כולה. הנאשם הורשע בעבירות נשק מגוונות, שבגינן ביקשה לקבוע מתחם אחד, מלבד העבירות נשוא אישום 3 ואישום 19 שלגביהן ביקשה לקבוע מתחמים נפרדים. לאישום 3 ביקשה ב""כ המאשימה לקבוע מתחם של 2-4 שנות מאסר, לאישום 19 מתחם של 18-24 שנות מאסר, בשים לב לכך שהנאשם דקר את המתלונן מספר פעמים במטרה לשבש הליכי משפט. באשר ליתר האישומים, ב""כ המאשימה ציינה כי הנאשם לקח חלק מרכזי באירועים מתמשכים ורבים וביקשה לקבוע מתחם הנע בין 5-7 שנות מאסר. עוד טענה ב""כ המאשימה כי הנאשם מצוי בחלקו העליון של המתחם, בשל עברו הפלילי הכולל מגוון עבירות וריצוי מאסר בעבר וקיומו של מאסר על תנאי חב הפעלה. היא ביקשה להטיל על הנאשם 6.5 שנות מאסר בגין עבירות אלו, ובסך הכל בגין כל העבירות 8 שנות מאסר, בנוסף להפעלת המאסר המותנה במצטבר' ומאסר על תנאי מרתיע.",נאשם 1 
"ת""פ 15842-11-20","ב""כ נאשם 1 טען כי אין בסיס לפער המשמעותי בעמדת המאשימה לגבי נאשמים 1 ו-2. הוא ציין כי נאשם 1 ושתי ההרשעות שלחובתו אינן מצדיקות את אותה אבחנה. הסניגור הוסיף כי בכתב האישום המקורי יוחסו לנאשם 1 14 אישומים, ולאחר התיקון, כשנותרו 9 אישומים, הדבר אפשר לו להודות בכתב האישום המתוקן. הוא הוסיף כי האישומים בוצעו בתוך תקופה קצרה של מספר שבועות, וכי יש לקבוע מתחם אחד לכל האישומים מלבד אישום 19, שכן מדובר באותה תכנית עבריינית. הסניגור חלק על טענת המאשימה בדבר הדומיננטיות של נאשם 1 וציין את פערי הגילאים בין נאשם 1 לבין נאשם 2 המבוגר ממנו ב-8 שנים. כמו כן ציין כי נאשם 2 נשוי לאחותו של נאשם 1. הוא הוסיף כי הנאשם הודה בכתב האישום המתוקן וחסך זמן שיפוטי רב, כי הנאשם הודה כבר בהזדמנות הראשונה באישום 3 המתייחס לכלי נשק שנתפסו בביתו וכי הנאשם עשה ניסיונות רבים להגיע להסכמות עם המאשימה ולחסוך את הצורך בניהול התיק או רובו, עוד לפני שיתר הנאשמים פנו לכיוון זה.",נאשם 1 
"ת""פ 15842-11-20","עוד טען ב""כ הנאשם כי הנאשם הושפע ממקום מגוריו והמסגרת החברתית בה היה מצוי, כי מדובר במעשים שאין בהם תכנון או תחכום והנאשם לא חשב לייבא או לייצר בעצמו כלי נשק.",נאשם 1 
"ת""פ 15842-11-20","הסניגור ביקש שלא למצות את הדין עם הנאשם בשל גילו הצעיר והעובדה שהיה ""בגיר צעיר"" בעת ביצוע העבירות. הוא הוסיף כי הנאשם הביע חרטה עמוקה, גדל במשפחה שהיתה טרודה בקשיים כלכליים והוריו, שהיו עסוקים בהישרדות, לא יכלו לדאוג לצרכים הפיזיים והנפשיים של ילדיהם. כיום הנאשם משתתף בקבוצה טיפולית ומעוניין להשתלב בהליך טיפולי גם בזמן מאסרו, לאחר שהחליט לשים קץ להתחברות לעבריינות ולפתוח דף חדש בחייו.",נאשם 1 
"ת""פ 15842-11-20","בנוגע לעבירות הנשק הדגיש ב""כ הנאשם כי הנאשם הורשע בעבירות של קשירת קשר, ניסיון וכדומה אך לא בעבירה המושלמת של סחר בנשק. הוא ביקש לקבוע מתחם ענישה בין 3-6 שנות מאסר ולהסתפק בעונש של 4 שנות מאסר, כולל הפעלת המאסר המותנה. ",נאשם 1 
"ת""פ 15842-11-20","נאשם 1 הביע חרטה על מעשיו וטען שפעל בשל נסיבות חייו, מתוך פחד מהאנשים שסביבו ומסביבתו. הוא הביע רצון לטפל בעצמו ולעזוב את מקום מגוריו.",נאשם 1 
"ת""פ 15842-11-20","שירות המבחן הגש תסקיר בעניינו של נאשם 1. עולה כי הנאשם בן למשפחה קשת יום, הרביעי מבין 7 ילדים. הוא נשר מלימודים בבית הספר בכיתה ז', עבד לעיתים בעבודות מזדמנות, תקופה מסוימת השתמש בסמים וחבר לחברה שולית של צעירים. בעקבות מעורבותו בעבירות בהיותו קטין היה נתון תחת צו פיקוח שירות המבחן לנוער, אולם הפר תנאים. לאחר מעצרו שולב הנאשם לראשונה בחייו במסגרת טיפולית. קצינת המבחן התרשמה מקושי בלקיחת אחריות, אך עם זאת ציינה כי יתכן שחוויית המעצר הממושך וההליכים המשפטיים מהווים גבול מוחשי והרתעתי. היא המליצה כי אם יוטל על הנאשם עונש מאסר, יובאו בחשבון גילו הצעיר ותקופת מעצרו, ותוסב תשומת לב גורמי הטיפול באשר לאפשרות שישתלב בתהליך שיקומי.",נאשם 1 
"ת""פ 15842-11-20","שני הצדדים שותפים לעמדה שיש לקבוע מתחם ענישה אחד למרבית האישומים בהם הורשע נאשם 1. אישום מס' 19 עוסק בעבירות אלימות שאינן קשורות ישירות לעבירות הנשק, ולפיכך יש לקבוע לגביו מתחם נפרד. באשר לאישום 3, על אף שוני מסוים במהות העבירות ופער של מספר חודשים אני סבורה שניתן לראות גם באישום זה חלק ממכלול אישומי הנשק שלגביהם ייקבע מתחם אחד, שכן גם אישום 3 כולל עבירה של החזקת חלקי נשק ותחמושת. הוספת עבירת הגניבה מרכב המתארת את אופן החזקת אותם פריטים, אינה מנתקת את הזיקה בין אישום 3 ליתר אישומי הנשק. יש לקבוע, איפוא, מתחם אחד ל-8 עבירות הנשק ומתחם אחד לעבירות האלימות.",מתחם העונש ההולם לנאשם 1  
"ת""פ 15842-11-20",לעניין הענישה הנוהגת אני מביאה בחשבון את הענישה הנוהגת כמפורט להלן:,מתחם העונש ההולם לנאשם 1  
"ת""פ 15842-11-20","ע""פ 8045/17 מחמוד בראנסי נ' מדינת ישראל (16.8.18) - בעניינו של נאשם 1 בכתב האישום נקבע מתחם על מעורבות ישירה ב-5 עסקאות מכירת נשק בין 4-7 שנים, ועל עסקה נוספת שבה היה המערער מעורב באופן מצומם, בין 18-48 חודשי מאסר בפועל. שם מדובר בעסקאות ממש של מכירת כלי נשק, בעוד בענייננו מדובר בעבירות נגזרות שונות שלא ידוע אם הבשילו לכלל עסקאות, ובחלק מהמקרים במכלולים שונים שאינם כלי נשק שלמים. בעניינו של נאשם 2, בן 19.5 בעת ביצוע העבירות, נגזרו 8 שנות מאסר בגין מעורבות בשש עסקאות נשק שונות, שכללו אספקת הנשק באחד המקרים וכן ירי בשטח בנוי. מערער 3 הורשע במעורבות ב-4 עסקאות נשק ונדון ל-5.5 שנות מאסר. נאשם 19 הורשע בסחר בנשק וקשירת קשר לסחר בנשק, ובעבירות נוספו שבגינן נקבעו מתחמים נפרדים. נקבע מתחם בין 2-5 שנים לעבירות הנשק. בעניינו של נאשם 6 נקבע בגין עבירות נשק דומות מתחם שבין 2-4 שנות מאסר. אני מפנה גם לגזרי הדין של יתר המערערים בתיק זה. ",מתחם העונש ההולם לנאשם 1  
"ת""פ 15842-11-20","ע""פ 4154/16 רונן דהוד נ' מדינת ישראל (19.1.17) – המערער הורשע בשני אירועים שבכל אחד מהם מכירת כלי נשק ואמל""ח לסוכן משטרתי. נדון ל-45 חודשי מאסר וערעורו נדחה.",מתחם העונש ההולם לנאשם 1  
"ת""פ 15842-11-20","ת""פ 8008-07-19 מדינת ישראל נ' סאמי אשקיר (6.8.20) – באירוע גניבת אקדח מתוך רכב נקבע מתחם בין 18-36 חודשי מאסר בפועל, והנאשם נדון ל-18 חודשי מאסר ועונשים נלווים. ",מתחם העונש ההולם לנאשם 1  
"ת""פ 15842-11-20","ע""פ 1768/14 בהא גנאיים נ' מדינת ישראל (22.7.14) –המערער היה מעורב בשני אירועי מכירת נשק לסוכן משטרתי ונדון ל-36 חודשי מאסר בפועל. ערעורו נדחה.",מתחם העונש ההולם לנאשם 1  
"ת""פ 15842-11-20","ע""פ 2733/30  בשיר אבו זיאד נ' מדינת ישראל (24.10.21) - שם אושרו עונשי מאסר כבדים בגין עסקאות נשק, אשר בשונה מהתיק שבפני, כללו עסקאות קונקרטיות שהגיעו לידי ביצוע, כללו כלי נשק שלמים שונים ואלפי כדורים שנתפסו, ומה שהוגדר כסחר בנשק ותחמושת בין הנאשמים עצמם ובינם לבין גורמים חיצוניים, חלקם בתחומי איו""ש. ",מתחם העונש ההולם לנאשם 1  
"ת""פ 15842-11-20","(ראו גם: ע""פ 785/15 איהאב פואקה נ' מדינת ישראל (6.12.15); ת""פ (מרכז) 13227-12-16 מדינת ישראל נ' אחמד מניעי ואח' (22.2.18); ת""פ (י-ם) 66542-05-20 מדינת ישראל נ' פח'רי אבו נאב (25.1.21)).",מתחם העונש ההולם לנאשם 1  
"ת""פ 15842-11-20",לעבירות האלימות:,מתחם העונש ההולם לנאשם 1  
"ת""פ 15842-11-20","ת""פ (ק""ג) 34414-09-10 מדינת ישראל נ' סאלי בונפיטו (27.9.12) – בגין אירוע דקירה באולר נקבע מתחם הקובע עונש מאסר לתקופה שלא תפחת מחודשיים (לא נקבע גבול עליון). בית המשפט חרג מהמתחם משיקולי שיקום, והסתפק ב-10 חודשי מאסר ועונשים נלווים. ",מתחם העונש ההולם לנאשם 1  
"ת""פ 15842-11-20","ראו גם: ע""פ 7287-13 סאאד סידאוי נ'  מדינת ישראל (23.9.14); ע""פ 6340-12 מוחמד סנעאללה נ'  מדינת ישראל (12.5.13); ע""פ 8597-07 חסאן זועבי נ' מדינת ישראל (15.1.08).",מתחם העונש ההולם לנאשם 1  
"ת""פ 15842-11-20","באשר לנסיבות הקשורות לביצוע העבירה אין ספק באשר לחומרה הרבה של עבירות הנשק, ובמיוחד אלה הקשורות לסחר והפצה של כלי נשק ולשימוש בהם.",מתחם העונש ההולם לנאשם 1  
"ת""פ 15842-11-20","עם זאת, בשונה ממרבית המקרים הנדונים בפסיקה, בתיק שבפני אין מדובר במקרים מובהקים של עסקאות או סחר בנשק, אלא בעבירות של קשירת קשר, ניסיון לעסקה וכדומה, ויש בכך כדי להביא להפחה מסוימת ברמת הענישה. זאת ועוד, מטיעוני הצדדים עולה כי מלבד המתואר באישום 3, לא נתפסו ברשות הנאשמים כלי נשק, חלקי נשק או תחמושת כלשהי. השיחות בין הנאשמים המתוארות בכתב האישום אף מצביעות על מחסור מסוים ועל כך שאין ברשותם של הנאשמים מחסניות וכדורים. מאידך גיסא, האישומים שבפני אינם ערטילאיים והם כוללים אלמנטים פיזיים של ירי, בדיקות תקינות של כלי הנשק, העברת חלקי נשק ותחמושת מאדם לאדם וכדומה. חשוב מכך, העובדות המתוארות בכתב האישום מצביעות על מעורבות עמוקה של נאשם 1 בעסקי הנשק והעסקאות בנשק. הוא מהווה כתובת עבור מי שמעוניין לרכוש או לקבל לידיו נשק (אישומים 5, 8, 9) ומעורב בירי באירועים שונים, כולל באירוע של קטטה המונית המוגדר על ידו כ""מלחמה"" (אישומים 4, 10). ריבוי עסקאות בפרק זמן קצר, אף הוא מעיד על האינטנסיביות הגבוהה בעיסוקו של הנאשם בנשק.",מתחם העונש ההולם לנאשם 1  
"ת""פ 15842-11-20","שיקול נוסף בעונש שיש לגזור על נאשם 1 נוגע לעיקרון אחדות הענישה. המאשימה ביקשה לגזור על נאשם 2 בתיק זה עונש של 3 שנות מאסר. אכן, קיים שוני בין שני נאשמים אלו, הן מבחינת העבירות המיוחסות להם והן מבחינת עברם הפלילי, אולם אינני סבורה שיש בשוני זה כדי להצדיק פער כה גדול כך שעונשו של נאשם 1 יהיה יותר מכפל עונשו של נאשם 2, כפי שביקשה המאשימה. שיקול זה יובא בחשבון בגזירת עונשו של נאשם 1, ובפרט בחפיפה בין העונשים השונים.",מתחם העונש ההולם לנאשם 1  
"ת""פ 15842-11-20",	לאור כל האמור אני קובעת לעבירות הנשק מתחם הנע בין 4-7 שנים.   ,מתחם העונש ההולם לנאשם 1  
"ת""פ 15842-11-20","באשר לעבירות האלימות, הנאשם פצע את המתלונן כשדקר אותו מספר דקירות, לאחר שהצטייד לשם כך בסכין, על לא עוול בכפו ובמטרה לסכל חקירה של אירוע שוד. הנאשם איים על המתלונן ועל סופיאן לפני ואחרי אירוע הדקירה. מנגד, למתלונן לא נגרם נזק חמור. על פי כתב האישום מדובר בדימום ברגל שהמתלונן עצר בעצמו ללא צורך בטיפול רפואי.",מתחם העונש ההולם לנאשם 1  
"ת""פ 15842-11-20",אני קובעת לעבירות האלימות מתחם הנע בין 2-4 שנות מאסר.,מתחם העונש ההולם לנאשם 1  
"ת""פ 15842-11-20","הנאשם, יליד 1998, היה צעיר במועד ביצוע העבירות אולם הוא לא היה קטין או על סף קטינות.",העונש במסגרת המתחם – נאשם 1
"ת""פ 15842-11-20","לחובת הנאשם עבר פלילי הכולל הרשעות בעבירות ביטחון, אלימות ורכוש. הוא ריצה מאסר בפועל ולחובתו מאסר על תנאי בר הפעלה על עבירת החזקת סכין, אולם לא היה בכך כדי להרתיעו מלבצע עבירות רבות נוספות.",העונש במסגרת המתחם – נאשם 1
"ת""פ 15842-11-20","הנאשם הודה, הביע חרטה וחסך זמן שיפוטי.",העונש במסגרת המתחם – נאשם 1
"ת""פ 15842-11-20","נטען כי הנאשם פעל בהשפעת סביבת מגוריו, וכי הנאשם מעוניין להשתלב בהליך טיפולי ולפתוח דף חדש בחייו. אולם מתסקיר שירות המבחן לא עולה לקיחת אחריות מלאה ואין בו המלצה טיפולית ממשית. הכיוון הטיפולי אף אינו מתיישב עם חומרת העבירות שביצע הנאשם וריבוין.",העונש במסגרת המתחם – נאשם 1
"ת""פ 15842-11-20",לאור האמור אני סבורה שיש לגזור על הנאשם עונש במחצית העליונה של מתחם הענישה.,העונש במסגרת המתחם – נאשם 1
"ת""פ 15842-11-20","נאשם 2 הורשע באישום 1 בכך שייבא מחו""ל חלקי נשק שונים תוך ניסיון להסוות את הקשר שלו להזמנות; באישום 5 הורשע בניסיון עסקה בנשק, כאשר מעורבותו בעסקה זו היתה מצומצמת יחסית; באישום 13 הורשע נאשם 2 בלבד בעסקה בחלקי נשק ותחמושת; באישום 14 הורשע בסחר בחלקי נשק; באישום 15 הורשע בניסיון החזקת נשק ורכישת כלי נשק ובאישום 16 בניסיון סחר בחלקי נשק. בשלושת האישומים האחרונים הואשם נאשם 2 לבדו, באירועים שכללו ניהול משא ומתן למכירת חלקי נשק ותחמושת עם רוכשים שונים, תוך שימוש במילות קוד והפגנת בקיאות ומעורבות.",נאשם 2
"ת""פ 15842-11-20","ב""כ המאשימה טענה כי הנאשם ביצע באופן נרחב עבירות הקשורות לנשק בעיקר במהלך ספטמבר 2020 ועובר לכך. הוא הזמין את החלקים, סחר בהם, הרכיב אותם והיווה חוליה חיונית בשרשרת הפשיעה, כל זאת לשם בצע כסף. היא ביקשה לראות בכל האישומים אירוע אחד לצורך קביעת המתחם, בשל סמיכות הזמנים והקשר בין האירועים. עוד טענה כי מעשי הנאשם מצביעים על העדר רתיעה מהחוק ומאפשרים את קיומו של שוק שהשלכותיו חמורות. ב""כ המאשימה הפנתה לפסיקה וציינה כי החוק מגדיר חלק נשק כנשק לכל דבר. היא ביקשה לקבוע מתחם ענישה שינוע בין 2.5-5 שנות מאסר בפועל. באשר למיקומו של הנאשם במתחם ציינה ב""כ המאשימה כי לנאשם עבר פלילי קל, הוא הודה והביע חרטה ולפיכך ביקשה למקמו בחלק התחתון של המתחם ולהטיל עליו 3 שנות מאסר ומאסר על תנאי מרתיע.",נאשם 2
"ת""פ 15842-11-20","ב""כ נאשם 2 הסכים כי העבירות בהן הורשע הנאשם מהוות אירוע אחד ויש לקבוע להם מתחם אחד, לאחר שבוצעו במהלך תקופה של כחודשיים וחצי. הוא הוסיף כי הנאשם הורשע בעיקר בעבירות ניסיון, כאשר כתב האישום מבוסס על האזנות סתר מבלי שנתפס דבר, ובנסיבות אלו הודאת הנאשם אינה מובנת מאליה. הסניגור הוסיף וטען כי סחר בכלי נשק יכול להיעשות גם לצרכים חוקיים (טענה זו יש לדחות על הסף שכן עצם החזקת הנשק והסחר בו על ידי גורים שאינם מורשים מהווה עבירה). עוד ציין לגבי החלקים הנזכרים באישום הראשון כי נשק איירוסופט אינו נחשב כנשק וכי אין לגבי חלקי הנשק חוות דעת הקובעת שמדובר בנשק והם עשויים לשמש גם לעניינים חוקיים. עוד ציין ב""כ הנאשם כי התמורה ששולמה נמוכה ועומדת על 2,200 ₪ בלבד, וכי כלי הנשק אינם תקניים ואמינותם נמוכה. בנסיבות שתיאר טען הסניגור כי היקף העבירות מצומצם וממילא גם הפגיעה בערכים המוגנים מצומצמת. באופן ספציפי נטען לגבי אישום 5, כי חלקו של הנאשם באישום זה מצומצם.",נאשם 2
"ת""פ 15842-11-20","הסניגור טען כי בהתאם לפסיקה תקופת מעצרו של הנאשם עד כה, במשך שנה ויותר, מהווה רף תחתון למתחם וכי ניתן להסתפק בתקופה זו.",נאשם 2
