verdict,text,part
"ת""פ 39341-05-16","לזכות הנאשמים 2 ו 3 העיד כעד אופי מר מדיאן אבו סאלח, שהינו מכר המשפחה וחבר של הנאשמים 2 ו 3. מר אבו סלאח הפנה לרקע המשפחתי הקשה שבו גדלו השניים בעיקר משום התמכרותו של אב המשפחה והסתבכויותיו. חרף כך, לקחו השניים, ובייחוד הנאשם 3, את היוזמה לידיהם וחילצו את המשפחה ממצוקתה - הן מבחינה כלכלית והן מבחינה משפחתית. מר אבו סלאח ציין כי אופיים של הנאשמים 2 ו 3 אינו אלים והמעשים בהם הורשעו לא מתאימים לאופיים ואישיותיים.",ראיות הנאשמים לעונש
"ת""פ 39341-05-16","לזכות הנאשם 4 העיד מר זאהר בשיר, שהינו בן דודו של הנאשם. מר בשיר עמד על כך שמשפחתו של הנאשם הינה נורמטיבית ומיטיבה. בנוסף, תיאר מר בשיר את ניסיונותיו של הנאשם, עובר למעצרו, להשתלב בעולם העסקים – ניסיונות שמר בשיר ניסה לסייע בהם. עוד הפנה מר בשיר לכך כי הנאשם היה אמור להתחתן זמן קצר לאחר מעצרו. מעצרו של הנאשם אפשר לו ""לעשות חושבים"" ואין לו ספק שהנאשם לא ילך עוד בכל דרך קיצונית.",ראיות הנאשמים לעונש
"ת""פ 39341-05-16","לזכות הנאשם 5 העידה אמו, אשר מסרה כי היא ובעלה חינכו אותו על אהבת אחרים וכל בני משפחתם מכבדים את המדינה ואת חוקיה ומצויים ביחסים טובים עם בני כלל הדתות. בנוסף ציינה האם, כי לאחר מעצרו באיזוק של בנה, הוא אמר לה שהוא מאוד מצטער על מה שקרה ומתכוון לפתוח בדרך חיובית יותר בעתיד.",ראיות הנאשמים לעונש
"ת""פ 39341-05-16","לזכות הנאשם 6 העיד מר חאסן בשיר שהינו איש רב פעלים וזכויות בסכנין. מדובר בבעל תואר מאסטר ברוקחות אשר עוסק בלימוד קונג פו וטאי צ'י והינו פעיל בתחומים שונים בסכנין וסביבותיה (מנהל צוות חילוץ סכנין, חבר בועדת מל""ח, ממייסדי הועדה העממית, מנהל צוות חובשים ועוד). מר בשיר מסר שהנאשם היה תלמיד שלו בבית הספר לקונג פו, אותו הוא מנהל, ועבר דרך חינוכית מרשימה. הנאשם אף התנדב במסגרות שונות אותן ניהל מר בשיר ושמח תמיד לעמוד לעזר.",ראיות הנאשמים לעונש
"ת""פ 39341-05-16","המאשימה פתחה וציינה כי ההסדר הושג על רקע שיקולים והיבטים ראייתיים שאלמלא כן העמדה העונשית לה היתה עותרת, היתה מחמירה באופן משמעותי. לגופו של ענין, עמדה המאשימה על חומרת מעשי הנאשמים, מעשים שהיוו סיכון ממשי לשלום הציבור ולביטחון המדינה. הנאשמים שייכו עצמם לארגון בשני מישורים – הן בהחלטת ההצטרפות והן בהקמת התאחדות שיצרו בתוך מדינת ישראל כאשר הם רואים עצמם כחלק מהארגון. המאשימה הפנתה למספר נתונים שיש בהם להעיד על חומרת מעשי הנאשמים - משך התקופה שבה נערכו המפגשים – מינואר 2014 ועד נובמבר 2014; תדירות המפגשים; העובדה שהנאשמים המשיכו במעשיהם גם לאחר הכרזת שר הביטחון על הארגון כהתאחדות בלתי מותרת; קיום המפגשים באופן קונספירטיבי תוך שבצעו פעולות להסתרת מעשיהם. נתונים אלה מלמדים כי מדובר במי שחצו את הגבול בין הזדהות כללית ועניינים שבלב, לבין מעשים אקטיביים של ממש. האידיאלוגיה בה החזיק הארגון היתה, כאמור לעיל, אידיאולוגיה סלפית-ג'יהאדית והנאשמים ראו עצמם משויכים לאידיאולוגיה זו - אידיאולוגיה שמהווה סיכון למדינת ישראל ותושביה. בנוסף, לא מדובר היה במפגשים בלבד, אלא הנאשמים תמכו ברצונו של הנאשם 2 לצאת לסוריה וכן ביצעו מעשים אקטיביים על רקע חברותם בארגון – הנאשם 2 ביקש לצאת לסוריה וחרף עיכובו וחקירתו בשדה התעופה המשיך במעשיו. נורת אזהרה זו לא הספיקה לשאר הנאשמים, שידעו על עיכובו של הנאשם 2 וגם הם המשיכו במעשיהם. מעשים של ממש ניתן היה למצוא בשחיטת הכבשים על ידי הנאשמים 2 עד 4 ובלימוד הכנת הבקת""ב על ידי הנאשם 1 לנאשמים 2,3,4 ו 6 (על אף שהיוזמה לכך היתה של הנאשם 1). ניתן אף ללמוד אודות המסוכנות הנשקפת מהנאשמים והעמדות הקיצוניות בהן החזיקו מהעברת הסרטונים והחזקת סמלי הארגון על ידי חלקם.",טיעוני המאשימה לעונש
"ת""פ 39341-05-16",המאשימה הפנתה לנסיבות כל נאשם ונאשם – ,טיעוני המאשימה לעונש
"ת""פ 39341-05-16","בהקשר לנאשם 2, עמדה המאשימה על חומרת מעשיו וכן הפנתה לשני נתונים המדגישים את חומרת מעשיו ואת מסוכנותו: הראשון – כוונתו לצאת לסוריה; והשני – הרשעתו בעבירות הנשק אותו ביקש לרכוש כדי לבצע פיגוע בישראל. מדובר בעליית מדרגה הנובעת מהזדהותו עם הארגון. לכן, עתרה המאשימה להטלת העונש המקסימלי במסגרת ההסדר – עונש שיבטא את הסלידה ממעשיו של מי שלא רק חצה את הקווים והצטרף לארגון עוין, אלא גם פעל באופן  מוחשי להוצאת רעיונות הארגון מהכוח לפועל.",טיעוני המאשימה לעונש
"ת""פ 39341-05-16","חומרה יתרה מצאה המאשימה במעשיו ונתוניו של הנאשם 6 – בהקשר זה, הפנתה המאשימה לעברו משנת 2005 שנסקר לעיל ואשר מצביע על כך כי מדובר במי ששב ומנסה לפגוע במדינת ישראל ובתושביה על רקע אידיאולוגיה קיצונית בה הוא מחזיק. מעשיו החוזרים ונשנים מעידים על רצינותו ועל מסוכנותו. עונש המאסר שנגזר עליו בעבר לא הרתיעו לשוב ולבצע מעשים על רקע שכזה.",טיעוני המאשימה לעונש
"ת""פ 39341-05-16","גם בנוגע ליתר הנאשמים, ביקשה המאשימה לגזור את עונשי המקסימום בהפנותה לכך כי לא מתקיימות בעניינם נסיבות מיוחדות המצדיקות הקלה כלשהי וזאת לנוכח חומרת מעשיהם.",טיעוני המאשימה לעונש
"ת""פ 39341-05-16","ב""כ  הנאשמים 2 ו 3 הדגיש כי מרשיו מביעים צער וחרטה על הסתבכותם ומכים על חטא על מעשיהם. עוד הודגש, כי מבלי להקל ראש במעשי הנאשמים, אין מדובר במי שהינם אויבי המדינה אלא באנשים צעירים, אזרחי המדינה, שאיבדו את הדרך ונגררו אחר סיסמאות שאין להם כל קשר אליהן. כמו כן, נטען כי הזדהותם, השגויה והמוטעית, של הנאשמים עם הארגון לא היתה על רקע רצונם להרע למדינת ישראל. ובהקשר האחרון, הפנה ב""כ הנאשמים לכך כי עם ""לידתו"" של הארגון, עיקר פעילותו היתה כנגד שלטונו של אסד בסוריה והוא נכלל במסגרת ""ארגוני מורדים"" שפעלו בסוריה. זאת ועוד, מדובר בארגון, שאז כמו גם היום עיקר פעילותו אינה כנגד מדינת ישראל, אלא כנגד מוסלמים ברחבי העולם. פעילות זו, חרף חומרתה, משכה את ליבם של הנאשמים אך כאמור לא מתוך עוינות למדינת ישראל אלא על רקע הסיסמאות ששבו את לב הצעירים אותה עת בהתייחס לשלטונו של אסד. ב""כ הנאשמים, שחזר והדגיש כי הנאשמים, כמו כל אדם בר דעת, מגנים את מעשיו המזוויעים של הארגון, עמד על כך שהצטרפות צעירים אזרחי ישאל לארגון אינה תופעה נפוצה והרוב המוחלט של אזרחי ישראל מוקיעים ומגנים את הארגון. לכן, אין מדובר בתופעה נרחבת המחייבת הטלת עונש ברף העליון.",טיעוני הנאשמים לעונש
"ת""פ 39341-05-16","ב""כ הנאשמים עמד על נסיבות גדילתם הקשות של הנאשמים. בהקשר לנאשם 2, אשר כאמור לעיל, הורשע גם בעבירות נשק, צוין כי מדובר באדם פשוט, בעל הערכה עצמית נמוכה, אשר ביקש, כדברי בא כוחו, ""להיות אבו עלי, גיבור..."" ועל רקע זה ניתן להבין את רצונו לרכישת נשק. נטען, שמעבר לרצונו לעשות רושם, לא היה מדובר במי שהיו לו כוונות לממש את אותם דיבורים מכוערים בהקשר לרכישת הנשק ולכן אין להחמיר איתו מעבר לנדרש. עוד בהקשר לנאשם 2,  צוין כי חרף רצונו לצאת לסוריה, אין להחמיר אתו ובוודאי אין להחמיר איתו ביחס לנאשמים (בפרשות אחרות) שמימשו בפועל רצון זה ויצאו לסוריה. בהקשר זה, הפנה בא כח הנאשם לפסיקה של מי שיצאו בפועל לסוריה ונגזרו עליהם עונשים מתונים באופן יחסי.",טיעוני הנאשמים לעונש
"ת""פ 39341-05-16","בהקשר לנאשם 3, הפנה בא כוחו לנתונים החיוביים שעלו מהתסקיר, לכך כי מדובר באדם צעיר שחרף גילו הצעיר נשא את נטל המשפחה על כתפיו וחילץ את המשפחה המורחבת ממצוקותיה.",טיעוני הנאשמים לעונש
"ת""פ 39341-05-16","ב""כ הנאשם 4 הפנה לנתוניו החיוביים של מרשו. בהקשר זה הופנה בית המשפט לכך כי מדובר בצעיר, נעדר עבר פלילי, בן למשפחה מכובדת, אשר נמצא בתחילת דרכו. עוד נטען, כי משיכתו לארגון נבעה בעקבות משבר רגשי שחווה כאשר התגורר באיטליה, מרוחק  ממשפחתו, ואז חיפש הקלה והתחבר לגורמים שונים שהסיטו אותו לאפיקים שאינם מאפיינים את אישיותו ובוודאי שאינם תואמים את הערכים עליהם גדל. כמו כן, הזוועות שבוצעו בסוריה ושאליהן נחשף אף הן הסיטו אותו להתחבר לארגון שהוא סבר בטעות שייתן מענה לאותן התרחשויות בסוריה. לכן, יש להבין את ההקשר הרחב של מעשי הנאשם ואין לראותו כמי שבא לפגוע במדינת ישראל או באזרחיה. מדובר באזרח נאמן למדינה וכך גם משפחתו. ב""כ הנאשם נתן דגש לכך כי לאחר חזרת הנאשם מאיטליה, הוא החליט לפתוח דף חדש ועובר למעצרו חיפש את דרכו בחיים בכך שבחן הזדמנויות עסקיות שונות וכן היה אמור להתחתן.",טיעוני הנאשמים לעונש
"ת""פ 39341-05-16","ב""כ הנאשם 5 הצטרף לדברי יתר באי כוח הנאשמים לעניין השפעת המאורעות בסוריה על הנאשמים בהקשר לרצונם לסייע לאזרחי סוריה בתחילת מלחמת האזרחים. ב""כ הנאשם הדגיש את חרטתו המלאה והכנה של הנאשם אודות מעשיו וכן הפנה לכך כי בפועל, הנאשם התנתק מיתר בני החבורה כחודש טרם מעצרו בכך שעבר להתגורר באילת שם החלה התמחותו ברוקחות, דבר המעיד על רצונו, המגובה במעשה של ממש, להמשיך בחיים בדרך חדשה וחיובית – שתביא לידי ביטוי חיובי את לימודי הרוקחות אותם סיים בהצלחה. עוד ניתן דגש לשוני, לקולא מבחינת הנאשם, ביחס ליתר הנאשמים – הנאשם 5 לא היה מבין יוזמי המפגשים, לא נטל חלק בשחיטת הכבשים, לא העביר סרטונים, לא נטל חלק ב""הדרכת"" הכנת בקבוק התבערה ולא נמצאו אצלו סמלי הארגון. לכן, יש לאמץ בעניינו של נאשם זה את ההסדר ברף התחתון של הסדר הטווחים.",טיעוני הנאשמים לעונש
"ת""פ 39341-05-16","גם ב""כ הנאשם 6 הצטרף לטיעונים הכלליים שנדונו לעיל ביחס ליתר הנאשמים וטען כי אלמלא עברו הפלילי של הנאשם, המעשים שביצע בפועל במסגרת פרשה זו לא היו מציבים אותו בין המעורבים העיקריים. במילים אחרות, בחינת חלקו בפרשה אינו חמור באופן יחסי ועברו הפלילי הוא זה שמנע את מעצרו באיזוק, ולכן אין מקום ""להענישו"" בשנית משום הרשעתו הקודמת.",טיעוני הנאשמים לעונש
"ת""פ 39341-05-16","אציין, כי כלל באי כוח הצדדים הגישו פסיקה מגוונת. באי כוח הצדדים הגישו טיעונים כתובים ומקיפים והדברים שהובאו לעיל נועדו להביא רק את תמצית טענות הצדדים.",טיעוני הנאשמים לעונש
"ת""פ 39341-05-16","במסגרת דברי הנאשמים בטרם גזירת הדין, מסר הנאשם 2 כי הוא מצטער ומתנצל על מעשיו. הנאשם אישר שהלך בדרך מוטעית וביקש את רחמי בית המשפט.",טיעוני הנאשמים לעונש
"ת""פ 39341-05-16",דברים דומים מסר גם הנאשם 3. ,טיעוני הנאשמים לעונש
"ת""פ 39341-05-16",הנאשם 4 הדגיש כי הוא מקבל אחריות מלאה על מעשיו וציין כי במסגרת תקופת מעצרו הממושכת הוא ערך חשבון נפש וביקש להדגיש את צערו וחרטתו על מעשיו. הנאשם ביקש להדגיש כי הוא מגנה כל פעילות אלימה וביקש הזדמנות לשקם את חייו.,טיעוני הנאשמים לעונש
"ת""פ 39341-05-16",הנאשם 5 הביע את צערו על מעשיו וביקש הזדמנות להתחיל את חייו מחדש.,טיעוני הנאשמים לעונש
"ת""פ 39341-05-16",דברים דומים מסר גם הנאשם 6. ,טיעוני הנאשמים לעונש
"ת""פ 39341-05-16",אקדים ואציין כי בחרתי לאמץ את הסדר הטיעון אליו הגיעו הצדדים. מדובר בהסדר סביר ומאוזן המביא לידי ביטוי הן את חומרת מעשי הנאשמים והן שיקולים נוספים כגון בעיות ראייתיות כאלה ואחרות והרצון לחסוך בזמן שיפוטי. ההסדר הושג בסיומו של הליך גישור.,	דיון ומסקנות
"ת""פ 39341-05-16","כפי שנקבע בע""פ 1958/98, פלוני נ' מ""י, פדי נז'(1), 577, הסדר הטיעון במדינת ישראל הוא מוסד אשר יש אינטרס ציבורי בקיומו, יש לו הצדקה רעיונית והוא חלק מהשיטה האדברסרית. עוד נקבע, כי בבוא ביהמ""ש לגזור את הדין, חייב ביהמ""ש להביא בגדר שיקוליו את הסדר הטעון שהצדדים הגיעו אליו. האינטרס הציבורי מחייב כיבוד הסדרי טעון, שאם לא כן, עלול לחול כרסום במעמדו של מוסד זה (עוד ר' בנדון את האמור בע""פ 3068/10, פלונית נ' מ""י, 1.11.10). בנוסף, בפסיקה ניתן דגש לאינטרס ההסתמכות של הנאשם אשר הודה במיוחס לו מתוך ציפייה כי הודאתו תביא לקבלת הסדר הטעון. יחד עם זאת, צוין כי ביהמ""ש אינו ""חותמת גומי"" ונידונו השיקולים והמצבים בהם לא יאמץ ביהמ""ש את הסדר הטעון. ",	דיון ומסקנות
"ת""פ 39341-05-16","כאמור, הסדר הטיעון אליו הגיעו הצדדים הינו ""הסדר טווחים"". טווחים אלה אינם מהווים מתחמי ענישה והדברים ברורים – מדובר בטווחים שהביאו לידי ביטוי אינטרסים ושיקולים נוגדים והיו תוצר של משא ומתן שהתנהל בין הצדדים. משכך, אין מדובר בביטוי נורמטיבי הנקבע על ידי בית המשפט לאחר הרשעת הנאשם ונבנה על בסיס המתווה שנקבע בתיקון 113. כך, לדוגמה, טווחי הענישה אליהם הגיעו הצדדים הביאו לידי ביטוי לא רק את המעשים שביצע כל אחד מהנאשמים אלא אף את נתוני כל נאשם ונאשם כגון עברו הפלילי, וזאת בניגוד למתחם ענישה אשר מתעלם מנתון זה – שהינו רלוונטי רק בעת גזירת הדין בתוך (או מחוץ) למתחם. יחד עם זאת וחרף השוני בין טווחי הענישה אליהם הגיעו הצדדים לבין מתחמי הענישה, איני סבור כי קיים הבדל ""מספרי"" קיצוני אשר מחייב אותי לקביעת המתחמים לגבי כל נאשם ונאשם. באם הייתי סבור כי הטווחים אליהם הגיעו הצדדים סוטים באופן ניכר ממתחמי הענישה באופן שמטיל ספק בדבר אימוץ ההסדר, אזי הייתי נדרש לקביעת מתחמים. במילים אחרות, הגם שהטווחים אליהם הגיעו הצדדים נמוכים במידת מה מהמתחמים שיש להניח שהייתי קובע (והדבר הינו אך מתבקש שכן בכל הסדר טיעון טמונה טובת הנאה מסוימת גם לנאשמים), אין מדובר בפערים קיצוניים ובכל מקרה מדובר בהסדר סביר על פניו. לכן, איני סבור כי המקרה דנן מחייב קביעת מתחמי ענישה. אפנה בהקשר זה לכך כי בפסיקת בית המשפט העליון טרם נקבעה הלכה ברורה בהקשר לסוגיה לעיל, היינו באם נדרש בית המשפט, עת מוצג בפניו הסדר טיעון (""סגור"" או של ""טווחים""), לקבוע מתחם ענישה בטרם יחליט באם לאמץ את ההסדר (ולדעת השונות ר' האמור בע""פ 4301/15 פינטו נ' מ""י, 5.1.16; ע""פ 6799/14 אופיר נ' מ""י, 16.3.15; ע""פ 227/13 פלוני נ' מ""י, 3.12.14. עוד אפנה בנדון למאמרו של פרופ' אורן גזל – אייל, חריגה ממתחם העונש ההולם, ספר דורית ביניש). דעתי, כפי שהובהר לעיל, הינה כי באם סבור בית המשפט שההסדר אליו הגיעו הצדדים הינו סביר ובכוונתו לאמצו, לא נדרש שייקבע מתחם עונש הולם במקרה שכזה. ",	דיון ומסקנות
"ת""פ 39341-05-16","ולגופו של עניין. אין חולק אודות חומרת מעשי הנאשמים. מדובר בבני חבורה שהצטרפו מרצון לארגון רצחני שלא טורח ולא טרח כבר מתחילת דרכו להסתיר את מעשיו. ארגון זה מחזיק באידיאולוגיה סלפית–ג'יהאדית ודוגל, גם אם לא בטווח הזמן המיידי, בהשמדת מדינת ישראל וכל מדינה אחרת, מוסלמית ושאינה כזו, שאינה נוהגת על פי תפיסתו את חוקי השריעה. כל בר דעת היה צריך להבין, גם בתחילת שנת 2014, כי מדובר בארגון שכל פעילות בו הינה אסורה ומהווה איום על מדינת ישראל ואזרחיה. נתתי דעתי לטענות הנאשמים כי בעת בה התחילו לפעול עיקר מעייניהם היו נתונים לשלומם של אזרחי סוריה אשר היו תחת אימת משטרו של אסד. עוד נטען, כי הנאשמים לא ביצעו כל פעילות כנגד מדינת ישראל או אזרחיה. ואולם, אפנה לכך כי לו היו מבצעים הנאשמים מעשים של ממש כנגד מדינת ישראל או אזרחיה, אזי מן הסתם היה עונשם כבד בהרבה מזה שהם מבקשים כיום על פי ההסדר אליו הגיעו. העבירה בה הורשעו במסגרת האישום הראשון הינה חברות בהתאגדות בלתי מותרת ועצם חברותם בארגון היא זו האסורה ודי בה כדי להקנות לה את החומרה. זאת ועוד, מדובר בנאשמים שהיו מודעים לאיסור בהתאגדותם בארגון ואפנה בהקשר זה לניסיונותיהם להסתיר את מעשיהם. הנאשמים אף היו מודעים להכרזת הארגון כהתאחדות בלתי מותרת – דבר שלא מנע מהם להמשיך במעשיהם. אכן, מעשיהם לא כוונו באופן ישיר ומיידי כנגד מדינת ישראל או אזרחיה, אך הנאשמים עברו את שלב ה""דיבורים"" – הנאשם 2 ביצע מעשים של ממש כדי לצאת לסוריה ואלמלא נמנעה יציאתו לשם על ידי השלטונות, בתאריך 30.7.14, היה מממש את כוונותיו. יתר הנאשמים היו מודעים לכוונותיו ומעשיו של הנאשם 2 ורובם סייעו בידיו  מבחינה כספית. בנוסף, לקחו הנאשמים 2, 3 ו 4 חלק בשחיטת כבשים בהדרכת הנאשם 1, על מנת ""לחזק את הלב"" למקרה שיצטרכו להילחם. פעילות הנאשמים, למעט הנאשם 5, כללה גם העברת סרטונים וקבלת הדרכה אודות הכנת בקבוק תבערה, הגם שפעילות זו היתה יוזמה של הנאשם 1 והנאשמים היו פאסיביים בהקשר זה. הזדהות מרבית הנאשמים עם הארגון ומטרותיו באה לידי ביטוי, בין היתר, גם בהחזקת חפצים וסמלים המזוהים עם הארגון.",	דיון ומסקנות
"ת""פ 39341-05-16","אודות התייחסותה הראויה של מערכת המשפט, ובכלל, לאלה התומכים בארגונים כגון דאע""ש עמד בית המשפט בבש""פ 3379/16 אחמד נ' מ""י, 2.5.16: ",	דיון ומסקנות
"ת""פ 39341-05-16","""ייאמר בקול ברור וצלול, כי מדינת ישראל, במצב הביטחוני בו היא שרויה, אינה יכולה להרשות לעצמה את ה'מותרות' של התעסקות עם דאע""ש, כמו מדינות אחרות באירופה המתמודדות עם צעירים הנוסעים לסוריה ולעיראק כדי להילחם בשורות הארגון. ידע כל אחד כי לדאע""ש לא מתקרבים, ושומר נפשו ירחק מכל בדל של עיסוק בנושא"" (בש""פ 6539/15 מדינת ישראל נ' כרים אבו סאלח פס' 15 (19.10.2015)).",	דיון ומסקנות
"ת""פ 39341-05-16","עוד אפנה לע""פ 2058/14 פלוני נ' מ""י, 5.5.14 שם צוין כי: ",	דיון ומסקנות
"ת""פ 39341-05-16","האישום השני מיוחס לנאשם 2 ונוגע לכוונותיו ומעשיו להשגת רובה מסוג קלצ'ניקוב וזאת לאחר שגמלה בלבו החלטה לבצע פיגוע בישראל נגד אנשי ביטחון ודרוזים. חומרת מעשים אלה ברורה מאליה. בניגוד ליתר הנאשמים במסגרת גזר דין זה היכולים לטעון כי כל מעשיהם כוונו, ולו בטווח הזמן המיידי, לסוריה, מעשיו של הנאשם 2 מעידים כאלף עדים על מסוכנותו המיידית והקונקרטית.",	דיון ומסקנות
"ת""פ 39341-05-16",וביחס לכל נאשם ונאשם. בהקשר זה סבורני כי יש לאבחן את עניינם של הנאשמים 2 ו 6 מיתר הנאשמים.,	דיון ומסקנות
