verdict,text,part
"ת""פ 21924-07-22","ת""פ 21924-07-22 מדינת ישראל נ' אבו אלקיעאן(עציר) ואח'",בית המשפט המחוזי בבאר שבע
"ת""פ 21924-07-22","חוק העונשין, תשל""ז-1977: סע'  31, 144, 144(ב)",חקיקה שאוזכרה: 
"ת""פ 21924-07-22","הנאשמים הורשעו על יסוד הודאתם בכתב אישום מתוקן, בעבירות כדלקמן:",האישום והסדר הטיעון
"ת""פ 21924-07-22","הורשע על יסוד הודאתו בעבירות בנשק (נשיאה והובלה של נשק) – עבירה לפי סעיף 144(ב) רישא לחוק העונשין, התשל""ז – 1977 (להלן: ""החוק"") ובעבירה של נהיגה ללא רישיון – עבירה לפי סעיף 10(א) לפקודת התעבורה תשכ""א- 1961 (להלן: ""הפקודה"").",הנאשם 1:  
"ת""פ 21924-07-22",הורשע על יסוד הודאתו בעבירה של סיוע לעבירות בנשק (נשיאה והובלה של נשק) עבירה לפי סעיף 144(ב) רישא ביחד עם סעיף 31 לחוק.,הנאשם 2: 
"ת""פ 21924-07-22",על פי עובדות כתב האישום המתוקן במועד הרלוונטי לכתב האישום לא היה ברשותו של הנאשם 1 רישיון נהיגה מכל סוג שהוא.,הנאשם 2: 
"ת""פ 21924-07-22","בתאריך 26.06.22, בשעה 00:30 או בסמוך לכך, הנאשם 1 נסע ברכב מסוג שברולט מ.ר",הנאשם 2: 
"ת""פ 21924-07-22","37-225-72 (להלן: ""הרכב"") על כביש 316, כשנאשם 1 נוהג ברכב והוא נושא ומוביל בצוותא חדא מאחורי המושבים הקדמיים על רצפת הרכב, נשק – רובה מסוג M16 בצבע שחור עם חיפוי בצבע חאקי (להלן: ""הנשק"") אשר יש בכוחו להמית אדם.",הנאשם 2: 
"ת""פ 21924-07-22","באותו מועד נאשם 2 סיפק רכב לנאשם 1 והצטרף לבקשתו לנסיעה מבלי שידע על קיום הנשק ברכב אך חשד בכך, וכל זאת על מנת להקל על ביצוע העבירה.",הנאשם 2: 
"ת""פ 21924-07-22","במועד ובמקום הנ""ל חיילים, אשר היו בפעילות שגרתית במקום,  הבחינו ברכב ובנאשמים,  והורו להם לעצור. הנאשמים, בתגובה, החלו בנסיעה לאחור במטרה להתחמק מהמקום, אך עצרו את הרכב לאחר שהחייל ו.ג כיוון לעברם את נשקו וצעק לעברם לעצור.",הנאשם 2: 
"ת""פ 21924-07-22","סמוך לאחר מעצר הנאשמים, במהלך חיפוש שביצעו החיילים ברכב תפסו את הנשק הנ""ל.",הנאשם 2: 
"ת""פ 21924-07-22",הנאשמים הודו בכתב האישום המתוקן במסגרת הסדר טיעון ולאחר שנשמעו מרבית עדי התביעה.,הנאשם 2: 
"ת""פ 21924-07-22",במסגרת ההסדר הוסכם כי הצדדים יעתרו במשותף כי בית המשפט יגזור על הנאשמים את העונשים הבאים:,הנאשם 2: 
"ת""פ 21924-07-22","עונש מאסר בפועל בן 30 חודשים, בניכוי ימי מעצרו. ",לנאשם 1: 
"ת""פ 21924-07-22","מאסר על תנאי, קנס ופסילת רישיון נהיגה על תנאי לשיקול דעת בית המשפט.",לנאשם 1: 
"ת""פ 21924-07-22","עונש מאסר בפועל בן 17 חודשים, בניכוי ימי מעצרו.",לנאשם 2: 
"ת""פ 21924-07-22",מאסר על תנאי וקנס לשיקול דעת בית המשפט.,לנאשם 2: 
"ת""פ 21924-07-22","באת כוח המאשימה עתרה לכבד את הסדר הטיעון הגם שלשיטתה הוא מקל וזאת לאחר שנשקלו כלל השיקולים. ההסדר הנו תולדה של גילם של הנאשמים, העדר עברם הפלילי, והקושי הראייתי שהתברר במהלך ניהול ההוכחות שעיקרו נעוץ בשרשרת המוצגים – שרשרת הנשק. ב""כ המאשימה טענה כי במסגרת הסדר הטיעון ניתן משקל גם להודאת הנאשמים, לקיחת האחריות ולחיסכון בזמן השיפוטי.",טיעונים לעונש:
"ת""פ 21924-07-22","בא כוח הנאשם 1 הצטרף לדברי ב""כ המאשימה וביקש לכבד ההסדר שהנו ראוי והולם. ב""כ הנאשם 1 ביקר את מדיניות ההחמרה בענישה בה נוקט בית משפט שכן לדבריו הפתרון לעבירות הנשק במגזר לא צריך להגיע מבית המשפט וכי המענה הנכון הנו בתחום החינוך, האכיפה ושיפור התשתיות. עוד הוסיף ב""כ הנאשם כי יש לעשות את ההבחנה בין נאשם לנאשם ובענייננו הנאשמים צעירים, ועונש מאסר ממושך עלול לפגוע בהם יותר מאשר להועיל. ב""כ הנאשם 1 הפנה לתסקיר שירות המבחן בעניינו של הנאשם.",טיעונים לעונש:
"ת""פ 21924-07-22",בא כוח הנאשם 2 הצטרף לדברי חברו ועתר לכבד את הסדר הטיעון תוך שהפנה לתסקיר שירות המבחן בעניינו של הנאשם.,טיעונים לעונש:
"ת""פ 21924-07-22",נטען כי אין בהרתעה כדי למגר או לצמצם הפשיעה במגזר ולראיה כי למרות מדיניות ההחמרה בענישה האלימות גואה. לדבריו המצב בחברה הערבית נגרם גם בשל כישלון של המדינה שלא הפנתה משאבים מספיקים לטיפול בתשתיות ובחינוך.,טיעונים לעונש:
"ת""פ 21924-07-22","הסניגור הוסיף כי למרות שחלק מעדי התביעה נשמעו הרי שיש לתן משקל לחסכון בזמן השיפוטי, ולקושי הראייתי שציינה המאשימה אשר הביא את הצדדים להסדר הטיעון. ב""כ הנאשם 2 עתר לקנס מתון וציין כי הנאשם 2 שוחרר בהליך המ""ת למעצר בית בפיקוח  אלקטרוני, אך נוכח חוסר במשאבים וקושי לעמוד בתשלומי השכירות ביקש, בלית ברירה, לחזור לתנאי מעצר מאחורי סורג ובריח.",טיעונים לעונש:
"ת""פ 21924-07-22",הנאשם 1 אמר כי הוא מודה ומצטער על מעשיו. לדבריו הוא יודע שזו עבירה חמורה.,טיעונים לעונש:
"ת""פ 21924-07-22",הנאשם 2 אמר כי הוא מתבייש במעשיו ולא יחזור על מעשיו פעם נוספת או על שום עבירה אחרת.,טיעונים לעונש:
"ת""פ 21924-07-22","הנאשם  1  -  יליד 2002, נעדר עבר פלילי, הורשע במסגרת הסדר טיעון בעבירות בנשק (נשיאה והובלה של נשק) ובעבירה של נהיגה ללא רישיון. עצור מיום 26.6.22.",דיון והכרעה:
"ת""פ 21924-07-22","הנאשם 2  - יליד 2003, נעדר עבר פלילי, הורשע במסגרת הסדר טיעון בעבירה של סיוע בעבירות בנשק (נשיאה והובלה של נשק). עצור מיום 26.6.22.",דיון והכרעה:
"ת""פ 21924-07-22","הערכים החברתיים המוגנים בעבירות נשק כוללים שמירת החיים והגוף, בטחון הציבור ושמירת הסדר הציבורי.",דיון והכרעה:
"ת""פ 21924-07-22","רבות נפסק על הסיכון הגלום בעבירות בנשק, גם אם לא נעשה בהם שימוש, וראו לעניין זה ע""פ 7502/12 בסאם כוויס נגד מ""י (25.06.2013):",דיון והכרעה:
"ת""פ 21924-07-22","מיגור התופעה, שהוכרה בפסיקה בשנים האחרונות כמכת מדינה, הינו אינטרס ציבורי חשוב, ויש לעשות זאת גם באמצעות ענישה מחמירה ומרתיעה. הקלות הבלתי נסבלת בביצוע עבירות בנשק מחייבת מענה הולם של בתי המשפט.",דיון והכרעה:
"ת""פ 21924-07-22",""" ...הטלת עונשים חמורים ומרתיעים על עברייני נשק היא עיקר תרומתם של בתי המשפט למיגור התופעה ולהרחקת העבריין עם האקדח משגרת חייהם של אזרחי מדינה שומרי חוק "" ע""פ 147/21 מ""י נ' ביטון (14.2.21).",דיון והכרעה:
"ת""פ 21924-07-22","יוער לעניין זה כי החמרת הענישה כמפורט לעיל, נדרשת ורלוונטית גם בעבירת הסיוע, שכן, כפי שכבר קבעתי בת""פ 2476-07-22  מדינת ישראל נ' אבו אלקעאן (1.5.23), המסייע הינו חלק בשרשרת עבירות הנשק, והערכים המוגנים בעניינו זהים בעיקרם.",דיון והכרעה:
"ת""פ 21924-07-22","בענייננו הנאשם 1 נשא והוביל נשק התקפי בעל פוטנציאל נזק גדול וקטלני, תוך שהוא נעזר לשם כך ברכב. על פי עובדות כתב האישום הנאשם 2 אמנם לא ידע על קיום הנשק ברכב אך חשד בכך, והסיוע שנתן לנאשם 1 היה משמעותי שכן סיפק את הרכב והצטרף לנסיעה. יש ליתן חומרה נוספת לעובדה כי הנאשמים ניסו להתחמק מהחיילים בנסיעה לאחור ונעצרו אך ורק לאחר שחייל כיוון לעברם נשק.",דיון והכרעה:
"ת""פ 21924-07-22","לקולת העונש התחשבתי בגילם הצעיר של הנאשמים, בהיותם נעדרי עבר פלילי, בהודאתם, ובחרטה שהביעו.",דיון והכרעה:
"ת""פ 21924-07-22","לאחר ששמעתי טיעוני באי כוח הצדדים, מצאתי, שלא בלי היסוס, שלא לחרוג מהסדר הטיעון בהינתן מדיניות בתי המשפט הנוגעת לכיבוד הסדר טיעון, גילם הצעיר של  הנאשמים והודאתם, ובעיקר נוכח הקושי הראייתי עליו הצביעה המאשימה באשר לשרשרת המוצג (הנשק), וההנחה שמדובר בקושי של ממש שהיה בו כדי להשפיע על סיכויי ההרשעה, ובאופן הנותן משקל נוסף לעקרון ההסתמכות של הנאשמים כי בית המשפט יכבד את ההסדר.",דיון והכרעה:
"ת""פ 21924-07-22","לאור האמור לעיל, אני גוזר על הנאשמים את העונשים הבאים:",דיון והכרעה:
"ת""פ 21924-07-22","30 חודשי מאסר בפועל, בניכוי ימי מעצרו (מאחורי סורג ובריח בהתאם לרישומי שב""ס).",הנאשם 1: 
"ת""פ 21924-07-22","10 חודשי מאסר על תנאי למשך שלוש שנים מיום שחרורו שלא יעבור עבירה בנשק לפי סעיף 144 לחוק העונשין התשל""ז – 1977 על חלופותיו השונות.",הנאשם 1: 
"ת""פ 21924-07-22","10,000 ₪ קנס או 90 ימי מאסר תמורתו. הקנס ישולם לא יאוחר מיום 01.02.24.",הנאשם 1: 
"ת""פ 21924-07-22",פסילה על תנאי – הנני פוסל את הנאשם מלקבל או מלהחזיק רישיון נהיגה וזאת למשך שנה. הנאשם יישא בעונש זה אם בתקופה של שנתיים מיום שחרורו יעבור עבירה בנשק לפי סעיף 144 לחוק על חלופותיו השונות.,הנאשם 1: 
"ת""פ 21924-07-22","17 חודשי מאסר בפועל, בניכוי ימי מעצרו (מאחורי סורג ובריח בהתאם לרישומי שב""ס).",הנאשם 2: 
"ת""פ 21924-07-22","8 חודשי מאסר על תנאי למשך שלוש שנים מיום שחרורו שלא יעבור עבירה בנשק לפי סעיף 144 לחוק העונשין התשל""ז – 1977 על חלופותיו השונות.",הנאשם 2: 
"ת""פ 21924-07-22","4,000 ₪ קנס או 30 ימי מאסר תמורתו. הקנס ישולם לא יאוחר מיום 01.10.23.",הנאשם 2: 
"ת""פ 21924-07-22","ניתן היום,  ב' אב תשפ""ג, 20 יולי 2023, בהעדר הצדדים.",54678313זכות ערעור תוך 45 ימים לבית המשפט העליון.
"ת""פ 21924-07-22",נוסח מסמך זה כפוף לשינויי ניסוח ועריכה,אלון גביזון 54678313
"ת""פ 21924-07-22","בעניין עריכה ושינויים במסמכי פסיקה, חקיקה ועוד באתר נבו – הקש כאן",אלון גביזון 54678313
