verdict,text,part
"ת""פ 36511-09-14","ת""פ 36511-09-14 מדינת ישראל נ' גדייב ואח'",בית המשפט המחוזי מרכז-לוד
"ת""פ 36511-09-14",כבוד השופטת  מיכל ברנט,בפני 
"ת""פ 36511-09-14",כבוד השופטת  מיכל ברנט,בפני 
"ת""פ 36511-09-14",יוסף גדייב,נגד
"ת""פ 36511-09-14",לירון פוגל,נגד
"ת""פ 36511-09-14",חן עמירה,נגד
"ת""פ 36511-09-14","נוכחים: ב""כ המאשימה עו""ד רזין בית אור",הנאשמים
"ת""פ 36511-09-14","	ב""כ הנאשם 1 עו""ד עידן דביר",הנאשמים
"ת""פ 36511-09-14","	ב""כ הנאשם 2 עו""ד שי פרץ",הנאשמים
"ת""פ 36511-09-14","	ב""כ הנאשם 3 עו""ד משה יוחאי",הנאשמים
"ת""פ 36511-09-14","חוק העונשין, תשל""ז-1977: סע'  40ד(א), 40ד(ב), 144(א), 244, 280(1), 284, 384, 402(א), 402(ב), 407(א)(1), 40יג.",חקיקה שאוזכרה: 
"ת""פ 36511-09-14","חוק העונשין, תשל""ז-1977: סע'  40ד(א), 40ד(ב), 144(א), 244, 280(1), 284, 384, 402(א), 402(ב), 407(א)(1), 40יג.",חקיקה שאוזכרה: 
"ת""פ 36511-09-14","הנאשמים הודו ביום 26.7.15, במסגרת הסדר טיעון, בכתב אישום מתוקן, והורשעו בביצוע העבירות הבאות:",כללי
"ת""פ 36511-09-14","באישום הראשון: שוד, עבירה לפי סעיף 402(ב) לחוק העונשין, התשל""ז-1977 (להלן: ""החוק""); הסגת גבול, עבירה לפי סעיף 407(א)(1) לחוק; שימוש לרעה בכוח המשרה, עבירה לפי סעיף 280(1) לחוק; מרמה והפרת אמונים, עבירה לפי סעיף 284 לחוק.",הנאשמים 1 ו-2 – 
"ת""פ 36511-09-14","באישום השני: גניבה, עבירה לפי סעיף 384 לחוק; הסגת גבול, עבירה לפי סעיף 407(א)(1) לחוק; שימוש לרעה בכוח המשרה, עבירה לפי סעיף 280(1) לחוק; מרמה והפרת אמונים, עבירה לפי סעיף 284 לחוק.",הנאשמים 1 ו-2 – 
"ת""פ 36511-09-14","באישום השלישי: שוד, עבירה לפי סעיף 402(ב) לחוק; הסגת גבול, עבירה לפי סעיף 407(א)(1) לחוק; שימוש לרעה בכוח המשרה, עבירה לפי סעיף 280(1) לחוק; מרמה והפרת אמונים, עבירה לפי סעיף 284 לחוק.",הנאשמים 1 ו-2 – 
"ת""פ 36511-09-14","באישום הרביעי: שיבוש מהלכי משפט, עבירה לפי סעיף 244 לחוק.",הנאשמים 1 ו-2 – 
"ת""פ 36511-09-14","באישום החמישי: לנאשם 1 בלבד – החזקת נשק שלא כדין, עבירה לפי סעיף 144(א) לחוק.",הנאשמים 1 ו-2 – 
"ת""פ 36511-09-14","באישום השלישי: שוד, עבירה לפי סעיף 402(א) לחוק.",הנאשם  3 – 
"ת""פ 36511-09-14","על פי הסדר הטיעון, בעניינם של הנאשמים 1 ו-2 תעתור המאשימה להשית עליהם עונש שלא יעלה על 45 חודשי מאסר בפועל, וכן מאסר מותנה ופיצוי. בעניינו של הנאשם 3 לא הוצגה הסכמה לעניין העונש. הוסכם להפנות את הנאשמים לשירות המבחן לקבלת תסקיר לעונש בעניינם.",הנאשם  3 – 
"ת""פ 36511-09-14","מעובדות כתב האישום המתוקן עולה כי במועדים הרלבנטיים לכתב האישום שרתו הנאשמים 1 ו-2 כשוטרים במג""ב, ביחידת הסיור הכפרי, והנאשם 3 שרת כחייל סדיר בצה""ל.",עובדות כתב האישום המתוקן
"ת""פ 36511-09-14","ביום 27.7.14 בסמוך לשעה 04:00 הגיעו הנאשמים 1 ו-2 כשהם לבושים במדי משמר הגבול ונושאים נשק מסוג M-16 ואלה, אל אתר בנייה בעיר רמלה, אותו הכירו מתוקף עבודתם כשוטרים. באותה עת, לנו במקום שני נתינים זרים מסודן, אדהם סלימאן ואדהן חמיס, המצויים בישראל מכוח אשרה.",האישום הראשון:
"ת""פ 36511-09-14","משהשיבו המתלוננים בשלילה, דרשו מהם הנאשמים 1 ו-2 כי ימסרו להם את אשרות השהייה שלהם.",האישום הראשון:
"ת""פ 36511-09-14","לאחר מכן, תוך שהם יוצרים מצג לפיו הם מבצעים חיפוש כדין, הורו הנאשמים 1 ו-2 לחמיס להוציא מכליו את כל רכושו, לרבות כספו ומכשיר טלפון נייד שברשותו, ולהניחו בצד. בהמשך, דרשו הנאשמים 1 ו-2 מחמיס להצמיד את ידיו לאחור, ולאחר שעשה כן כבל אותו הנאשם 1 באמצעות אזיקון פלסטיק שנשא עמו. לאחר מכן, נטלו הנאשמים 1",האישום הראשון:
"ת""פ 36511-09-14","ו-2 את כספו של חמיס בסך 1,463 ₪, את אשרת השהייה שלו ואת מכשיר הטלפון הנייד שלו מסוג גלקסי 3. הנאשמים הורו לחמיס לשבת כשפניו אל הקיר, תוך שאמרו בכזב כי עליהם לערוך בדיקה אם הטלפון אינו גנוב והשטרות אינם מזויפים.",האישום הראשון:
"ת""פ 36511-09-14","בהמשך פנו הנאשמים 1 ו-2 לסלימאן והורו לו למסור להם את כל הכסף שברשותו. משהשיב סלימאן בשלילה, הובילו אותו הנאשמים 1 ו-2 לחדר והורו לו לשבת כשפניו מופנות לקיר. לאחר מכן, נטלו הנאשמים 1 ו-2 מסליאמן כסף מזומן בסך 810 ₪, ואת אשרת השהייה שלו, בטענה שהם צריכים לבדוק אותם. בהמשך, כבל הנאשם 1 את סלימאן באמצעות אזיקון פלסטיק, כשידיו לאחור.",האישום הראשון:
"ת""פ 36511-09-14","לאחר מכן עזבו הנאשמים את אתר הבנייה, כששללם בידם, תוך שציינו בכזב כי ישובו לאחר זמן קצר, והותירו את המתלוננים כפותים במקום.",האישום הראשון:
"ת""פ 36511-09-14","במועד שאינו ידוע במדויק למאשימה, בין התאריכים 27.7.14 ל-28.8.14, בסמוך לשעה 02:00, הגיעו הנאשמים 1 ו-2 כשהם לבושים במדי משמר הגבול ונושאים נשק מסוג M-16 ואלה, אל אתר בנייה במזכרת בתיה, אותו הכירו במסגרת עבודתם כשוטרים כמקום בו עובדים ולנים שוהים בלתי חוקיים.",האישום השני:
"ת""פ 36511-09-14","הנאשמים 1 ו-2 ניגשו אל כחמישה פועלים שהיו במקום, ואשר זהותם אינה ידועה למאשימה, והורו להם לשבת במרוכז באחד החדרים בבניין. נאשם 1 חיפש בכליהם אחר דברי ערך, בעוד שהנאשם 2 אבטח אותו.",האישום השני:
"ת""פ 36511-09-14","הנאשמים 1 ו-2 נטלו מן הפועלים מכשירי טלפון ניידים, ואמרו להם שהם הולכים לבדוק אותם, ללא כוונה לעשות כן, ועזבו את המקום.",האישום השני:
"ת""פ 36511-09-14","ביום 28.8.14 עובר לשעה 02:40 נפגשו הנאשמים בסמוך לביתו של הנאשם 3, ולבשו את מדי משמר הגבול בהם הצטיידו מבעוד מועד, אף שהנאשמים 1-2 היו בחופשה באותה עת, ואף שהנאשם 3 איננו שוטר. כמו כן, עטו הנאשמים כפפות גומי חד פעמיות, והנאשם 3 חבש כובע זיהוי משטרתי. ",האישום השלישי:
"ת""פ 36511-09-14","בסמוך לשעה 02:40 הגיעו הנאשמים למגורי הפועלים הסמוכים לאתר בנייה בבאר יעקב, אותו הכירו הנאשמים 1-2 מתוקף עבודתם כשוטרים. ",האישום השלישי:
"ת""פ 36511-09-14","הנאשם 1 נשא נשק מסוג M-16, ובנוסף נשאו הנאשמים אלה, תרסיס גז פלפל, אמצעי להתזת גז פלפל הנחזה להיות אקדח, ופנס.",האישום השלישי:
"ת""פ 36511-09-14","תחילה ניגשו הנאשמים אל המגורונים, שם ידעו כי לנים פועלים תושבי השטחים. נאשם 1 ניגש אל נידאל הנייה, מוחמד שאדי געמיס ונאסר אבו זהרה, העיר אותם וכבל אותם באזיקוני פלסטיק, כשידיהם לאחור. הנאשמים הורה לשלושה שלא להפנות אליהם את מבטם, ובכל עת שעשו כן סינוורו אותם באמצעות פנס. הנאשמים דרשו מהם את אשרות השהייה שלהם, ולאחר מכן החלו לחפש בחפציהם האישים רכוש ומסמכים.",האישום השלישי:
"ת""פ 36511-09-14","הנאשמים גנבו מנידאל כסף מזומן בסך של 200 ₪, טלפון נייד ותעודת זיהוי.",האישום השלישי:
"ת""פ 36511-09-14","ממוחמד גנבו הנאשמים כסף מזומן בסך של 100 ₪, טלפון נייד, תיק גב ותעודת זיהוי.",האישום השלישי:
"ת""פ 36511-09-14","מנאסר גנבו הנאשמים כסף מזומן בסך של 150 ₪, תעודת זיהוי ותיק.",האישום השלישי:
"ת""פ 36511-09-14","בהמשך, ניגש נאשם 1 אל מתחם המגורונים בו לנו אותה עת 11 פועלים, נתינים זרים מסין, בעוד שהנאשמים 2 ו-3 נותרו לשמור על נידאל, מוחמד ונאסר.",האישום השלישי:
"ת""פ 36511-09-14","נאשם 1 קפץ מעל שער ברזל שהיה נעול, והורה למתלונן פו לפתוח את השער. פו עשה כן, והנאשם 1 הורה לפועלים הסינים לצאת מחדריהם, מבלי שאפשר להם להתלבש, וביקשם לשבת במרוכז בחצר מתחם המגורונים, להתכופף ולמסור לו את הדרכונים שלהם.",האישום השלישי:
"ת""פ 36511-09-14","הנאשמים 1 ו-2 הובילו את נידאל, מוחמד ונאסר למקום בו ישבו הפועלים הסינים, והנאשם 3 שמר על כל הפועלים תוך שהוא מכוון לעברם אמצעי להתזת גז פלפל הנחזה להיות אקדח, מסנוורם בפנס ומאיים עליהם לבל ידברו.",האישום השלישי:
"ת""פ 36511-09-14","בזמן זה עברו הנאשמים 1 ו-2 בין המגורונים של הפועלים הסינים, וחיפשו בחפציהם האישיים אחר כסף מזומן וחפצים בעלי ערך.",האישום השלישי:
"ת""פ 36511-09-14","בשלב מסוים הודיע הנאשם 2 למתלוננים כי  נמצאו סמים באחד המגורונים, וזאת על מנת ליצור מצג כוזב לפיו הם פועלים מתוקף תפקידם כשוטרים ובסמכות.",האישום השלישי:
"ת""פ 36511-09-14","אחד הפועלים, ג'ה-סיונג ג'ן , ביקש לעקוב אחר מעשיהם של הנאשמים 1 ו-2 בחדרים, אך אחד מהם דחף אותו חזרה לחדר וסגר את הדלת.",האישום השלישי:
"ת""פ 36511-09-14","לאחר שחיפשו בחפציהם של המתלוננים רכוש בעל ערך , גנבו הנאשמים 1 ו-2  מחמישה פועלים סינים סך של כ-10,281 ₪.",האישום השלישי:
"ת""פ 36511-09-14","לאחר שסיימו את החיפוש דרשו הנאשמים 1 ו-2 מכל המתלוננים להיכנס לחדר, אליו הכניסו אף את נידאל מוחמד וניסאר הכפותים, כיבו את האור וסגרו את הדלת באמצעות חוט ברזל. הנאשמים הודיעו להם שישובו תוך זמן קצר, ללא כוונה לעשות כן.",האישום השלישי:
"ת""פ 36511-09-14",את דרכוניהם של המתלוננים הסינים הותירו הנאשמים ביציאה מאתר הבנייה.,האישום השלישי:
"ת""פ 36511-09-14","עם שובם לביתו של הנאשם 3, חילקו הנאשמים ביניהם את הכסף, ונאשם 3 קיבל לידיו סך של 2,000 ₪.",האישום השלישי:
"ת""פ 36511-09-14","הנאשם 1 נהג למסור את מכשירי הטלפון הניידים אותם שדד לאחותו ולבעלה (רוזה ומתי ויסלובסקי), וזאת לצורך הכשרתם למכירה על ידי הנאשם 1 בהמשך. ביום 8.9.14 נעצר מתי ויסלובסקי, ובסמוך לאחר מכן התקשרה אשתו רוזה לאחיה, הנאשם 1, דיווחה לו על דבר מעצרו של בעלה והפצירה בו בשתי הזדמנויות להעלים את מכשירי הטלפון הניידים. בהמשך לכך זרקו הנאשמים 1 ו-2 לפח אשפה בניר צבי חמישה מכשירי טלפון ניידים אותם שדדו כמפורט באישום 2 לעיל.",האישום הרביעי:
"ת""פ 36511-09-14","עובר ליום 8.9.14, החזיק הנאשם 1 בארון בגדים בביתו רימון הלם ורימון סינוור, שלא כדין.",האישום החמישי:
"ת""פ 36511-09-14",תסקיר שירות המבחן - הנאשם 1,תסקירי שירות המבחן
"ת""פ 36511-09-14","מתסקיר שירות המבחן בעניינו עולה כי הנאשם 1, רווק בן 22 והצעיר במשפחת מוצאו,",תסקירי שירות המבחן
"ת""פ 36511-09-14","סיים 12 שנות לימוד בבית ספר מקצועי בלוד, בעל תעודת בגרות חלקית. נעדר עבר",תסקירי שירות המבחן
"ת""פ 36511-09-14","טרם גיוסו עבד במסעדה בשדה התעופה, לאחר מכן גויס לשירות סדיר במג""ב, כנהג מבצעי ולוחם. על רקע ביצוע העבירות פוטר משירות צבאי.",תסקירי שירות המבחן
"ת""פ 36511-09-14","לעותר שתי אחיות, אחת מהן נאשמת בתיק הנוכחי והשנייה נכה בעקבות פציעתה בתאונת דרכים. האב סובל ממחלה, אינו עובד ומוכר כנכה 100% ע""י הביטוח הלאומי, ואמו חולת סוכרת ועובדת ככוח עזר בבית חולים. לדבריו המשפחה מתמודדת עם קשיים כלכליים.",תסקירי שירות המבחן
"ת""פ 36511-09-14","העבירות בוצעו עם הנאשם 2, אותו הכיר במסגרת שירותו במג""ב, ועם הנאשם 3 חברו מילדות.",תסקירי שירות המבחן
"ת""פ 36511-09-14","הנאשם 1 מסר כי ביצע המעשים ממניע כלכלי, ומבין את חומרת המעשים, הפגיעה במתלוננים, במשפחתו ובערכי צה""ל לנוכח השימוש שעשה במדים ובנשק. הפגיעה האלימה במתלוננים המאופיינים בחוסר אונים הינה יוצאת דופן בהתנהגותו.",תסקירי שירות המבחן
"ת""פ 36511-09-14","במהלך מעצרו השתתף הנאשם 1 בקבוצה טיפולית לעצורי בית, גילה מחויבות לטיפול והתקבל הרושם כי גילה הבנה לחומרת מעשיו והעמיק מודעותו לחלקים האלימים באישיותו ולצרכיו בתחושת כוח ושליטה. הנאשם 1 אף יצר קשר מיוזמתו עם אגף חינוך בחטיבת גולני ושיתף עם החיילים את סיפורו האישי ,וכן החל טיפול פסיכולוגי פרטי ושולב בעבודה כעוזר חשמלאי.",תסקירי שירות המבחן
"ת""פ 36511-09-14","להתרשמות שירות המבחן, הנאשם 1 הכיר בפגיעתו באחר, נעזר בתהליך הקבוצתי וישנה הפחתה בסיכון במצבו ולקיחת אחריות. כמו כן ניכר כי להליך המשפטי השפעה משמעותית ומציבת גבול עבורו. בשים לב לאמור , הערכת שירות המבחן הינה כי הסיכון להישנות התנהגות אלימה הוא נמוך ואף אם זו תתרחש חומרתה תהיה נמוכה, והמלצת שירות המבחן הינה להתחשב בעת קביעת משך המאסר בתהליך החיובי שעבר הנאשם 1 ובנכונותו לפצות את נפגעי העבירה.",תסקירי שירות המבחן
"ת""פ 36511-09-14","מתסקיר שירות המבחן בעניינו עולה כי הנאשם 2, רווק בן 21 והבכור משני אחיו, השלים 12 שנות לימוד ובעל תעודת בגרות חלקית. נעדר עבר פלילי. גויס למשמר הגבול ועבר לבקשתו לתפקיד קרבי. אב המשפחה אינו עובד עקב תאונת עבודה, ואמו מנהלת חשבונות. הנאשם 2 התקשה להתייחס לפער בין מאפייניו לבין מאפייני העבירות שבלטו בהם תכנון, אלימות ואדישות לסבל הזולת תוך ניצול מעמד וסמכות. התקבל הרושם שהוא מרוכז בקשייו ומתקשה להיעזר. במסגרת פיקוח מעצר הגיע לשיחות וגילה יכולת מסוימת להתייחס לדחפיו האלימים וכיום ער יותר לפגיעה ולנזק שהסב למתלוננים. כמו כן המעצר וההליך המשפטי מהווים גורמים מרתיעים ומציבי גבול עבורו.",תסקיר שירות המבחן – הנאשם 2
"ת""פ 36511-09-14","הנאשם 2 מסר כי ביצע העבירות לשם רווח כלכלי מהיר, לדבריו נענה לחברו (הנאשם 1) מתוך תחושת כוח, ריגוש ובטחון, והביע נזקקות להמשך טיפול. להערכת שירות המבחן, העבירות בוצעו עקב דימוי עצמי נמוך וקושי בהצבת גבולות, בעיקר במצבים חברתיים ולנוכח הכוח והשליטה על האחר במסגרת תפקידו, וכיום הנאשם 2 מתקשה בבחינה מעמיקה של דפוסי התנהגותו שהובילו לביצוע העבירות. בנסיבות אלה, הסיכון להישנות עבירות אלימות הינו נמוך וחומרת האלימות במידה וישוב לבצע עבירות מוערכת כבינונית. שירות המבחן לא בא בהמלצה שיקומית והמליץ כי בקציבת עונש המאסר יתחשב בית המשפט בגילו הצעיר, היעדר עבר פלילי, העובדה שמכיר ומצר על פגיעתו במתלוננים ומוכן לפצותם והשתלבותו בטיפול במסגרת הליך מעצר כמו גם מוכנותו להמשיך בקשר טיפולי.",תסקיר שירות המבחן – הנאשם 2
"ת""פ 36511-09-14","מתסקיר שירות המבחן עולה כי הנאשם 3 רווק בן 20, סיים 12 שנות לימוד ובעל תעודת בגרות חלקית. נעדר עבר פלילי. בן למשפחה המונה 5 נפשות, האב עובד כנהג מונית והאם עובדת במרכול. הנאשם 3 השתלב בקבוצה לעצורי בית, נמצא בתהליך ראשוני של התבוננות באופן קבלת החלטות והכרה בחלקים כוחניים ותוקפניים. בעל דפוסים רגשיים בעייתיים סביב הצורך ברצייה חברתית, סגירות ודימוי עצמי לא מגובש, וקיים צורך בהעמקה נוספת סביב בחירותיו וקשייו להציב גבול. ביחס לעבירה תאר היכרות וקשר הדוק עם הנאשם 1 מילדות, קושי לעמוד בלחץ החברתי וביצוע המעשים באימפולסיביות להשגת רווח כלכלי מהיר. הנאשם 3 הביע חרטה וצער על הפגיעה במתלוננים, אם כי קיימת מגמת צמצום חלקו, וקושי לבחון לעומק את התנהגותו התוקפנית.",תסקיר שירות המבחן – הנאשם 3
"ת""פ 36511-09-14","קיימת מוטיבציה ונכונות להמשך טיפול, והערכת שירות המבחן הינה כי הסיכון להישנות עבירות אלימות נוספות הינו נמוך וכי במידה וינקוט באלימות חומרת הפגיעה הצפויה הינה בינונית.",תסקיר שירות המבחן – הנאשם 3
"ת""פ 36511-09-14","בשים לב לחלקו המופחת ביחס לנאשמים האחרים, ולהיותו ""צעיר בוגר"", המליץ שירות המבחן להטיל בעניינו ענישה שיקומית, כי מאסר עשוי להוביל להידרדרות ופגיעה בו, וכי בעונש מאסר בעבודות שירות יש להוות עונש מרתיע שידגיש את חומרת העבירות ויחזק את תפקודו מאז המעצר. בנוסף מומלץ להטיל צו מבחן למשך שנה וחצי, במסגרתו ימשיך הנאשם 3 בטיפול במסגרת שירות המבחן, ופיצוי משמעותי למתלוננים.",תסקיר שירות המבחן – הנאשם 3
"ת""פ 36511-09-14","ב""כ המאשימה עמדה בטיעוניה על התכנון המוקדם של המעשים, על ניצול הסמכות והמרות על שכבת אוכלוסייה חלשה, על השימוש בנשק משטרתי ובתירוץ של עריכת חיפוש על פי דין בביצוע המעשים, על הפגיעה בערכי מדינת ישראל כמדינה שומרת חוק, הפגיעה באמון הציבור במשטרה ובשמירה על שלטון החוק והסדר הציבורי.","טיעוני ב""כ המאשימה לעונש"
"ת""פ 36511-09-14","כמו כן עמדה על הנזק שנגרם למתלוננים, שנגנבו מהם שכר עבודתם, אשרות השהייה שלהם ומכשירי טלפון נייד המכילים את פרטיהם האישיים ואת המידע והזיכרונות שלהם. ב""כ המאשימה עמדה על שיטות ההפחדה בה נקטו הנאשמים על מנת להשיג שיתוף פעולה מצד קרבנותיהם: בעטו, כבלו, הושיבו עם הפנים אל הקיר, אחזו בנשק ובאקדח גז הנחזה להיות נשק וסינוורו עם פנס. כמו כן, הנאשמים לא חדלו מביצוע המעשים עד שנתפסו, ואף פגעו בראיות כנגדם עת העלימו את מכשירי הטלפון הגנובים.","טיעוני ב""כ המאשימה לעונש"
"ת""פ 36511-09-14","בעניינו של הנאשם 1 הדגישה ב""כ המאשימה את הפער בין תסקירי המבחן לבין חוות דעת של ד""ר היילפרין, בה הפחית הנאשם 1 ממידת אחריותו והשליכה על הנאשם 2. כמו כן ציינה כי אף לדעת שירות המבחן , הנאשם 1 מצוי רק עתה בתהליך של בחינת המניעים לביצוע העבירה, ועל כן לטעמה אין לקבל את הערכת שירות המבחן בדבר מסוכנות נמוכה.","טיעוני ב""כ המאשימה לעונש"
"ת""פ 36511-09-14","בעניינו של הנאשם 2 הדגישה ב""כ המאשימה כי הוא מצוי בראשית  ההליך בטיפולי, כי אין הסבר לביצוע המעשים ואין הצדקה להערכת מסוכנות נמוכה בעניינו, בפרט כששירות המבחן לא בא בהמלצה טיפולית בעניינו.","טיעוני ב""כ המאשימה לעונש"
"ת""פ 36511-09-14","בעניינו של הנאשם 3 נטען כי אף שהוא השתתף באירוע האחרון, הרי שחלקו באירוע זה היה משמעותי, הוא נכנס למתחם המגורים וערך חיפוש בחפציהם של המתלוננים בעוד הוא מחופש לשוטר, שמר על 11 פועלים תוך הכוונת אמצעי שנחזה להיות אקדח ותוך שהוא מסנוור אותם ומאיים עליהם לבל ידברו.","טיעוני ב""כ המאשימה לעונש"
"ת""פ 36511-09-14","אף בעניינו נטען כי הוא מצוי בראשיתו של הליך טיפולי ומצמצם מחומרת המעשים, ועל כן חלקה ב""כ המאשימה על מסקנות שירות המבחן ביחס להעדר דפוסים עברייניים בעניינו.","טיעוני ב""כ המאשימה לעונש"
"ת""פ 36511-09-14","בשים לב לאמור לעיל, עתרה ב""כ המאשימה להשית על הנאשמים 1 ו-2 45 חודשי מאסר לריצוי בפועל, מאסר מותנה, השבת הכספים שנלקחו ופיצוי למתלוננים. ביחס לנאשם 3 עתרה ב""כ המאשימה להשית עונש מאסר בפועל.","טיעוני ב""כ המאשימה לעונש"
"ת""פ 36511-09-14","כתימוכין לעתירתה הפנתה ב""כ המאשימה לפסיקה כדלקמן:","טיעוני ב""כ המאשימה לעונש"
