verdict,text,part
"ת""פ 34507-07-19","על חומרתה של עבירת ההצתה בכלל, והצתה על רקע אידיאולוגי בפרט, עמד כב' השופט י' אלרון בע""פ 1214/18 נאשף נ' מדינת ישראל (11.11.18): ",דיון – קביעת מתחם העונש ההולם
"ת""פ 34507-07-19","במקרה הנוכחי קיימת חומרה רבה בעבירת ההצתה של ניידת משטרה ובהשלכת בקבוק תבערה לעבר שוטרים. בעבירות אלה יש משום התרסה כלפי המשטרה אשר אמונה על אכיפת החוק. ניסיונות הפגיעה בגורמי אכיפת החוק מערערים את הסדר הציבורי, את שלטון החוק ואת תחושת הביטחון של הציבור, ולפיכך מחייבים תגובה עונשית הולמת.",דיון – קביעת מתחם העונש ההולם
"ת""פ 34507-07-19","חומרה נוספת קיימת בנשיאת הנשק ובעבירות האלימות שביצע הנאשם. אמנם, בקבוק תעברה הינו נשק מאולתר, אשר הפוטנציאל הקטלני שלו נמוך מאשר אקדח או תת מקלע, ואולם מדובר בכלי נשק לכל דבר ועניין, בפרט בנסיבות תיק זה שבהן הנאשם השליך בקבוק תבערה לעבר שוטרים. כך גם עבירות של תקיפה סתם, היזק בזדון, החזקת האגרופן – כל אלה יוצרים יחדיו תמונה כוללת של התנהגות אלימה ומסוכנת.",דיון – קביעת מתחם העונש ההולם
"ת""פ 34507-07-19","בכל הנוגע לעבירת ההסתה, הרי שהיה לדבריו פוטנציאל ליפול על אוזניים קשובות והיה סיכון שאחרים יתרגמו את דבריו למעשי אלימות, כפי שהנאשם עצמו פעל.",דיון – קביעת מתחם העונש ההולם
"ת""פ 34507-07-19","למען הסר ספק יש להבהיר כי הזכות למחאה ולהפגנה היא זכות יסוד חוקתית במדינה דמוקרטית, אך בין מעשיו אלה של הנאשם לבין מחאה לגיטימית – רב המרחק.",דיון – קביעת מתחם העונש ההולם
"ת""פ 34507-07-19","בחינת מידת הפגיעה בערך המוגן מובילה למסקנה כי הפגיעה היא ברף גבוה. הנאשם הסית לאלימות כלפי שוטרים כאשר פרסם ברשת חברתית תמונה של אדם אוחז אקדח ומכוון אותו לעבר מושב הנהג בניידת משטרה ובהמשך לכך אף קרא לחטיפת שוטרים ולפגיעה בהם ובנשותיהם, וכן לזריקת רימונים ובקבוקי תבערה על שוטרים ובכך יצר סיכון שמאן דהוא יפעל בהתאם לקריאותיו. הנאשם הגיע למקום בו התקיימה הפגנה כשהוא רעול פנים, ניסה שוב ושוב ביחד עם אחרים להצית ניידת משטרה, שבר את חלון הניידת, השליך אבן על השמשה הקדמית ושבר אותה, בהמשך לכך הצית מספר רב של פחים וקרטונים, יידה אבנים לעבר שוטרים ותחנת משטרה, השליך ארגז גדול לעבר השוטרים והמפגינים ופגע במפגינים. בהמשך הצטייד בבקבוק תבערה, הסתתר והמתין להגעת שוטרים לקרבתו וכאשר הגיעו השוטרים הנאשם הדליק את בקבוק התבערה והשליך לעברם. ביצוע מעשי הצתה חוזרים וריבוי מעשי תקיפת שוטרים מצביע על רף גבוה של פגיעה בערכים המוגנים.",דיון – קביעת מתחם העונש ההולם
"ת""פ 34507-07-19","במסגרת הנסיבות הקשורות בביצוע העבירה, יש לתת את הדעת לכך שבתקופת המחאה בעקבות מותו של סלומון טקה ז""ל, הנאשם פרסם ברשת החברתית פייסבוק כתמונת פרופיל, את תמונתו כשהוא רעול פנים ואוחז בידו חפץ הנראה כמו אקדח. בהמשך פרסם תמונה של אדם המכוון אקדח לעבר מושב הנהג בניידת משטרה, ובהמשך כתב טקסט הקורא לחטיפת שוטרים ולפגיעה בהם ובנשותיהם ובין היתר קרא לזריקת רימונים ובקבוקי תבערה על שוטרים. אף שהפרסום המסית הוסר מהרשת, הנאשם שב והעלה את הטקסט. במהלך אותו היום בשעת ערב הנאשם יצא מביתו כשהוא מצויד במטפחת לכיסוי פניו, באגרופן ובחומר דליק, ומכך ניתן ללמוד על התכנון שקדם לעבירות ההצתה והאלימות. הנאשם הגיע כשהוא רעול פנים לניידת משטרה שחנתה בסמוך לנקודת משטרה, ובעוד אחרים השליכו אבנים לעבר הניידת, הנאשם שפך חומר דליק בתוך הניידת והדליק אותו באמצעות מצית. הנאשם, ביחד עם האחרים, הצית את הניידת, שבר חלון של הניידת, והשליך אבן ששברה את השמשה הקדמית. האש בניידת כובתה על ידי שוטרים שהגיעו למקום. הנאשם עזב את המקום והלך לעבר תחנת משטרה שמולה התקיימה הפגנה, ובדרכו כשהוא רעול פנים, ובידו אגרופן, הצית מספר רב של פחים וקרטונים באמצעות חומר דליק. הנאשם התקרב אל השוטרים שעמדו בכניסה לתחנה ויידה לעברם אבנים מספר פעמים, וכן הרים ארגז גדול והשליכו לעבר השוטרים והמפגינים ופגע במפגינים. הנאשם הצית ערימת קרשים בסמוך לתחנת המשטרה, הצטייד בבקבוק תבערה, הסתתר והמתין להגעת שוטרים ועם הגעתם של השוטרים זרק לעברם את בקבוק התבערה אשר התנפץ על הכביש סמוך מאוד לשוטרים וגרם לשרפה.",דיון – קביעת מתחם העונש ההולם
"ת""פ 34507-07-19","הסיכון הפוטנציאלי העולה ממעשיו של הנאשם הוא רב וכולל פגיעה בגוף ואף בנפש הן של שוטרים והן של מפגינים או עוברי אורח. דברי ההסתה של הנאשם היו בעלי פוטנציאל לגרום לאחרים לפעול באופן אלים כלפי שוטרים. ריבוי ההצתות שביצע של ניידת המשטרה ושל פחים וקרטונים ברחוב הקימו סיכון להתפשטות האש ולגרימת נזק לרכוש ולגוף, אם כי מהתמונות שהגיש ב""כ הנאשם עולה שהניידת לא עמדה בסמיכות לרכבים אחרים. יידוי אבנים לעבר שוטרים מעלה סיכון לפגיעה משמעותית בגופם של שוטרים ובמפגינים. הנזק שנגרם בפועל כולל נזק לניידת המשטרה (אך שיעור הנזק לא צוין בכתב האישום), לפחים ופגיעה בגופם של מפגינים עת השליך לעברם ארגז. אף שחלק ממעשיו של הנאשם נעשו ביחד עם אחרים, שזהותם אינה ידועה, חלקו של הנאשם היה דומיננטי ומשמעותי.",דיון – קביעת מתחם העונש ההולם
"ת""פ 34507-07-19","הסיבות שהביאו את הנאשם לבצע את העבירה קשורות בקושי בהתמודדות מקדמת עם תחושות של אפליה, כעס, קיפוח ותסכול. זאת לצד העדר בשלות אישית, סערת רגשות ודפוסים אלימים, כאשר ברקע לכל מעשיו השפעת המחאה שפרצה בעקבות מותו של סלומון טקה ז""ל.",דיון – קביעת מתחם העונש ההולם
"ת""פ 34507-07-19","מדובר במסכת ארוכה ומתמשכת של מעשים אשר בכל שלב בהם, היה ביכולתו של הנאשם לחדול ממעשיו, ולקיים מחאה לגיטימית, אך הנאשם בחר להמשיך במעשי האלימות.",דיון – קביעת מתחם העונש ההולם
"ת""פ 34507-07-19",בחינת מדיניות הענישה הנוהגת מעלה כי במקרים דומים הוטלו על נאשמים עונשי מאסר במנעד רחב כמפורט להלן:,דיון – קביעת מתחם העונש ההולם
"ת""פ 34507-07-19","בע""פ 9723/16 נאצר נ' מדינת ישראל (26.10.17), נדחה ערעורו של נאשם שהורשע בעבירות של סיוע לייצור נשק, ניסיון לתקיפת שוטר, הצתה ועוד. באישום הראשון הנאשם נסע עם שני קטינים לקנות חומר דליק וסיפק להם סרט הדבקה ובכך סייע לקטינים לייצר בקבוקי תבערה. הם נטלו את בקבוקי התבערה למקום התאספות של צעירים אחרים, הנאשם חסם את הכביש ובכך סייע לאחרים ליידות אבנים ובקבוקי תבערה לעבר כלי רכב של כוחות הביטחון. באישום השני והשלישי הצטרף להפרות סדר ויידה אבנים לעבר כוחות הביטחון. בית המשפט המחוזי קבע מתחם עונש באישום הראשון הנע בין 24 ל-48 חודשי מאסר בפועל ומתחם עונש באישומים 2-3 הנעים בין 12 ל-30 חודשי מאסר בפועל. הנאשם צעיר ללא עבר פלילי נדון לעונש של 45 חודשי מאסר בפועל. ",דיון – קביעת מתחם העונש ההולם
"ת""פ 34507-07-19","בע""פ 1925/11 כהן נ' מדינת ישראל (6.4.11) נדחה ערעורו של נאשם אשר הורשע על פי הודאתו בעבירה של הצתה. הנאשם ביחד עם אחרים, הציתו תחנת משטרה, וכתוצאה מכך פרצה דלקה שגרמה נזקים, וחייבה התערבות שירות הכבאות. על הנאשם, בעל רקע של התמכרות לסמים, נגזר עונש של 42 חודשי מאסר בפועל. ",דיון – קביעת מתחם העונש ההולם
"ת""פ 34507-07-19","בע""פ 401/16 מדינת ישראל נ' גבאי (28.9.16), התקבל ערעור המדינה על קולת העונש. הנאשם הורשע בעבירות הצתה, השחתת פני מקרקעין, החזקת סכין, הסתה לאלימות, איסור פרסום הסתה לגזענות ותמיכה בארגון טרור. הנאשם הצית עם שניים נוספים את בית הספר הדו-לשוני בירושלים. הנאשם ללא עבר פלילי. בית המשפט המחוזי קבע מתחם לעבירת הצתה בין שנת מאסר ל- 5 שנות מאסר, וגזר על הנאשם 36 חודשי מאסר בפועל. בית המשפט העליון החמיר בעונשו ל-40 חודשי מאסר בפועל.",דיון – קביעת מתחם העונש ההולם
"ת""פ 34507-07-19","בע""פ 1214/18 נאשף נ' מדינת ישראל (11.11.18) נדחה ערעורו של נאשם שהורשע על פי הודאתו בעבירות של הצתה בנסיבות מחמירות בצוותא, תמיכה בארגון טרוריסטי, קשירת קשר לפשע מתוך עוינות לציבור, ועוד. הנאשם ואחרים הביעו תמיכה בארגון דאע""ש. בהמשך, התכנסו ותכננו לסכל הופעה שתוכננה באצטדיון, ולבצע בו הצתה. הנאשם והאחרים הצטיידו בבקבוקים שמילאו בדלק, ובמציתים, והציתו עמוד תאורה, לוח חשמל וכיסאות פלסטיק. הנאשם אף התקשר ודיווח על מטען חבלה במקום, כדי למנוע את ההופעה. נקבע מתחם שנע בין 24 ל-56 חודשי מאסר בפועל, והנאשם, בעל עבר פלילי שהתיישן, נדון ל-36 חודשי מאסר בפועל. ",דיון – קביעת מתחם העונש ההולם
"ת""פ 34507-07-19","בע""פ 1806/17 דארי נ' מדינת ישראל (29.5.17), דחה בית המשפט העליון ערעור נאשם אשר הורשע על פי הודאתו בעבירות של התפרעות, ניסיון הצתה וניסיון לתקיפת עובד ציבור. על פי האישום הראשון הנאשם ואחרים הגיעו כשהם מצויידים בבקבוקי תבערה והם רעולי פנים למקום בו התקיימה התפרעות. הנאשם השליך את בקבוקי התבערה לעבר כוחות הביטחון ויידה לעברם אבנים. באישום השני הנאשם הצטרף להתפרעות שהתקיימה במהלכה הושלכו בקבוקי תבערה, והשליך לעבר כוחות הביטחון אבנים. בית המשפט קבע מתחם עונש באישום הראשון הנע בין 12 ל-30 חודשי מאסר בפועל ובאישום השני 10 עד 28 חודשי מאסר בפועל. הנאשם צעיר בן 20 ללא עבר פלילי נדון לעונש של 32 חודשי מאסר בפועל. ",דיון – קביעת מתחם העונש ההולם
"ת""פ 34507-07-19","בע""פ 2717/15 חביבאללה נ' מדינת ישראל (23.12.15) התקבל ערעורו של נאשם אשר הורשע על פי הודאתו בעבירה של הצתה. בעקבות עיקול שהוטל על ידי המועצה המקומית על חשבון הבנק של אמו של הנאשם, מילא הנאשם בקבוק בבנזין, שפך את הבנזין והציתו. נגרם נזק לרכוש המועצה. בית המשפט המחוזי קבע מתחם עונש הנע בין 3 ל-6 שנות מאסר. הנאשם ללא עבר פלילי, נטל אחריות למעשיו נדון לעונש של 36 חודשי מאסר בפועל. בית המשפט העליון קבע מתחם שבין שנתיים עד חמש שנות מאסר, והפחית את עונשו ל-28 חודשי מאסר בפועל. ",דיון – קביעת מתחם העונש ההולם
"ת""פ 34507-07-19","בע""פ 8691/19 ביאע נ' מדינת ישראל (3.6.20), דחה בית המשפט העליון ערעור נאשם (לאחר שבהמלצתו הנאשם חזר בו מהערעור) אשר הורשע על פי הודאתו בעבירת הצתה. הנאשם הבחין בניידת החונה בסמוך לתחנת משטרה והחליט להציתה. לשם כך הכין בקבוק תבערה לאחר שרכש חומר דליק בתחנת דלק. הנאשם הסתתר מאחורי חומה בסמוך לניידת המשטרה, הצית את בקבוק התבערה והשליכו לעבר הניידת. לניידת נגרם נזק בחלקה הקדמי. בית המשפט קבע מתחם עונש הנע בין 24 ל-48 חודשי מאסר בפועל. הנאשם צעיר בן 19 ללא עבר פלילי נדון לעונש של 26 חודשי מאסר בפועל. ",דיון – קביעת מתחם העונש ההולם
"ת""פ 34507-07-19","בת""פ (מח' חי') 28097-11-10 מדינת ישראל נ' חלבי (31.5.11) הורשע נאשם על פי הודאתו בעבירות של ניסיון הצתה, ייצור נשק, נשיאת נשק, שיבוש הליכי משפט ועוד. הנאשם, ביחד עם אחרים, קשרו קשר להצית תחנת משטרה, רכשו דלק, הכינו בקבוקי תבערה, הגיעו לתחנת המשטרה, כאשר הנאשם נהג ברכב, והאחרים השליכו בקבוק תבערה לעבר תחנת המשטרה, שלא נדלק, וכן שני בקבוקי תבערה לעבר ניידת שחנתה במקום. הבקבוקים נפלו בסמוך לניידת וגרמו לנזק. הנאשם ללא עבר פלילי, נדון ל-36 חודשי מאסר בפועל.",דיון – קביעת מתחם העונש ההולם
"ת""פ 34507-07-19","בת""פ (מח' חי') 760-06-19 מדינת ישראל נ' תיכונוב (3.12.19), הורשע נאשם על פי הודאתו בעבירת הצתה. הנאשם החליט להצית ניידת משטרה, הוא הצטייד בבד ובמקור אש, הדליק את הבד והניחו בסמוך לגלגל הניידת. הניידת עלתה באש וכוחות כיבוי שהוזעקו למקום השתלטו על האש. לניידת נגרם נזק ללא אפשרות לשיקום. בית המשפט קבע מתחם עונש הנע בין 18 ל-36 חודשי מאסר. הנאשם בעל נסיבות חיים קשות ועבר פלילי שאינו מכביד, נדון לעונש של 20 חודשי מאסר בפועל. ",דיון – קביעת מתחם העונש ההולם
"ת""פ 34507-07-19","בהתאם לתיקון 113 לחוק העונשין (סעיף 40 יג'), אני קובע כי מתחם העונש ההולם הוא החל מ-30 ועד 60 חודשי מאסר בפועל.",דיון – קביעת מתחם העונש ההולם
"ת""פ 34507-07-19","במקרה דנן, לא קיימים שיקולים אשר מצדיקים חריגה מהמתחם, לחומרה או לקולה.",דיון – קביעת מתחם העונש ההולם
"ת""פ 34507-07-19","בגזירת העונש המתאים לנאשם, בגדרי מתחם העונש ההולם, יש להתחשב בנסיבות שאינן קשורות בביצוע העבירה. במסגרת זו מן הראוי לתת את הדעת לכך שהנאשם בן 24,  מדבריו ניתן ללמוד כי נסיבות חייו מורכבות, הוא הוצא מהבית בגיל צעיר ונחשף לעבריינות בסביבתו. הנאשם גיבש מגיל צעיר עמדות נוקשות ביחס לגורמי אכיפת החוק לצד תחושות של קיפוח, אפליה וכעס כלפי גורמי ממסד וכבר בהיותו נער החל במעורבותו בפלילים. לנסיבות חייו אלה קשר לביצוע העבירות. מובן שעונש מאסר ממושך יקשה על הנאשם, אף שריצה בעבר עונשי מאסר וזאת נוכח גילו הצעיר. הנאשם הודה כבר בחקירתו במשטרה ובבית המשפט נטל אחריות והביע חרטה על מעשיו. עברו הפלילי של הנאשם כולל ארבע הרשעות קודמות בין השנים 2012-2019 בגין מגוון עבירות ובעיקר מתחום האלימות הכוללות התנהגות פרועה במקום ציבורי, תגרה, תקיפה הגורמת חבלה של ממש, גניבה, תקיפה לשם גניבה, היזק לרכוש, הפרות צווי בית המשפט שנועדו להגנה על אדם ועוד. הנאשם נדון לשני עונשי מאסר בפועל, בני 12 ו-14 חודשים. ",גזירת העונש המתאים לנאשם
"ת""פ 34507-07-19","בהרשעתו הקודמת בת""פ (אי') 61414-03-17 מיום 13.3.19 הורשע הנאשם בביצוע עבירות של התנהגות פרועה במקום ציבורי, העלבת עובד ציבור והיזק לרכוש במזיד, שבוצעו בשנת 2016. באותו הליך הנאשם קילל שוטרים בהיותו בגילופין, סירב לעיכוב כדין, ירק לעבר שוטר ובעט בדלת ניידת וגרם לה נזק. בגין אותו הליך תלוי ועומד נגדו עונש מאסר מותנה בר הפעלה של 6 חודשים, וכן התחייבות כספית להימנע מביצוע עבירה.",גזירת העונש המתאים לנאשם
"ת""פ 34507-07-19",כמו כן נתתי דעתי לחלוף הזמן מביצוע העבירה ולתקופת המעצר הממושכת שבה שוהה הנאשם מאז חודש יולי 19'.,גזירת העונש המתאים לנאשם
"ת""פ 34507-07-19","עוד יש לתת את הדעת לשיקול הרתעת היחיד בגדרו של המתחם, וזאת בשים לב לעברו הפלילי של הנאשם שרובו בגין עבירות אלימות ועבירות נגד שוטרים, כאשר לא היה בעונשי המאסר שהוטלו עליו בעבר, כמו גם במאסר המותנה ובהתחייבות הכספית המרחפים מעל לראשו, שהוטלו עליו כשלושה חודשים וחצי בלבד טרם ביצוע המעשים, בכדי למנוע ממנו לשוב לסורו.",גזירת העונש המתאים לנאשם
"ת""פ 34507-07-19","באיזון בין השיקולים השונים, סבורני כי יש לגזור על הנאשם עונש בחלקו המרכזי של מתחם העונש. כמו כן יש להפעיל את עונש המאסר המותנה במצטבר לעונש המאסר, להטיל עליו עונש מאסר מותנה וכן יש להפעיל את ההתחייבות הכספית.",גזירת העונש המתאים לנאשם
"ת""פ 34507-07-19","40 חודשי מאסר בפועל, אשר מניינם מיום מעצרו 7.7.19.","אשר על-כן, הנני גוזר על הנאשם את העונשים הבאים:"
"ת""פ 34507-07-19","הפעלת עונש המאסר המותנה בן 6 חודשים מת""פ (אי') 61414-03-17 וזאת במצטבר לעונש המאסר שהוטל בתיק זה, כך שסך הכל יישא הנאשם ב-46 חודשי מאסר בפועל וזאת מיום מעצרו.","אשר על-כן, הנני גוזר על הנאשם את העונשים הבאים:"
"ת""פ 34507-07-19","12 חודשי מאסר על תנאי, לבל יעבור הנאשם במשך 3 שנים מיום שחרורו ממאסר כל עבירת הצתה, עבירת נשק מסוג פשע או עבירת אלימות מסוג פשע.","אשר על-כן, הנני גוזר על הנאשם את העונשים הבאים:"
"ת""פ 34507-07-19","6 חודשי מאסר על תנאי, לבל יעבור הנאשם במשך שנתיים מיום שחרורו ממאסר כל עבירת אלימות מסוג עוון, החזקת סכין או אגרופן ועבירת הסתה לאלימות.","אשר על-כן, הנני גוזר על הנאשם את העונשים הבאים:"
"ת""פ 34507-07-19","תשלום סכום ההתחייבות בסך של 6,000 ₪ אשר הוטלה בת""פ (אי') 61414-03-17. הסכום ישולם ב-10 תשלומים חודשיים, שווים ורצופים, שהראשון שבהם ביום 1.1.22. אם לא ישולם תשלום כלשהו במועדו, תעמוד היתרה לפירעון מיידי. ","אשר על-כן, הנני גוזר על הנאשם את העונשים הבאים:"
"ת""פ 34507-07-19",	זכות ערעור לבית-המשפט העליון תוך 45 ימים. ,"אשר על-כן, הנני גוזר על הנאשם את העונשים הבאים:"
"ת""פ 34507-07-19","54678313ניתן היום,  ו' שבט תשפ""א, 19 ינואר 2021, בנוכחות הצדדים.",5129371
"ת""פ 34507-07-19",נוסח מסמך זה כפוף לשינויי ניסוח ועריכה ,עמי קובו 54678313
"ת""פ 34507-07-19","בעניין עריכה ושינויים במסמכי פסיקה, חקיקה ועוד באתר נבו – הקש כאן",עמי קובו 54678313
