verdict,text,part
"ת""פ 37900-06-22","אף סבורני כי דווקא הסתכלות על כל המעשים כמכלול תהלום את חומרתם. לא נעלם הימני כי לנאשם 3 יוחסה עבירה נוספת, חמורה, בדמות עסקה בנשק, אך הפער בחומרת מעשיהם של הנאשמים יבוא לידי ביטוי בעת קביעת מתחם העונש ההולם שייוחד לכל נאשם בנפרד.",אירוע אחד או שני אירועים?
"ת""פ 37900-06-22","בשים לב לקביעותיי אלו, יש אפוא לעבור ולבחון מהו אותו המתחם שיש לקבוע לכל אחד מהנאשמים.",אירוע אחד או שני אירועים?
"ת""פ 37900-06-22","בעת קביעת מתחם העונש ההולם, יש לעמוד תחילה על הערכים החברתיים אשר נפגעו כתוצאה מביצוע העבירות על ידי הנאשמים, וכן על מידת הפגיעה בערכים אלו. הנאשמים הודו והורשעו בביצוע מיני עבירות נשק. באישום הראשון, אשר ענייננו בנשק קרלו, הורשע נאשם 1 בעבירות של רכישת, החזקת ונשיאת נשק. נאשם 3 הורשע בביצוע אותן העבירות, ובנוסף בעבירה של עסקה בנשק. באישום השני אשר ענייננו בנשק מסוג M16, הורשע כל אחד מהנאשמים שלפניי בביצוע עבירת רכישת והחזקת נשק.",מתחם העונש ההולם
"ת""פ 37900-06-22","בעבירות נשק, על דרך הכלל, קיימת פגיעה בשורה של ערכים חברתיים מוגנים. ראש וראשון הוא ערך השמירה על חיי אדם, על ביטחון הציבור ושלומו. עוד נפגעה השמירה על הסדר הציבורי, ותחושת הביטחון השוררת בציבור להתהלך באין מפריע במרחב הציבורי. הנאשמים פגעו בערכים חברתיים אלו. מידת הפגיעה היא גבוהה בשים לב לכך שמדובר בשני כלי נשק התקפיים, אשר אחד מהם (ה-M16) לא נתפס עד היום.",מתחם העונש ההולם
"ת""פ 37900-06-22","בעצם רכישת נשק, החזקתו, נשיאתו והסלקתו בסביבת מגורים, קיימת סכנה שמא ייעשה שימוש בנשק זה; שימוש אשר עלול לגרום לנזק רב עד מאוד לרכוש, ואף חמור מכך - נזק לגוף עד כדי קטילת חיים. ואכן, אנו עדים השכם וערב לשימוש בלתי חוקי בנשק, במהלכו נפגעים לא אחת תמימי דרך אשר כל חטאם כי נקרו הם לזירת האירוע ביד הגורל. אין הכרח כי השימוש בנשק ייערך על ידי מי אשר נותן את הדין. יכול והשימוש ייעשה על ידי אדם אחר, בזמן אחר ובמקום אחר. התוצאה חד היא - נזק הן בהיבט הפרט כלפיו מכוון השימוש בנשק, ונזק הן בהיבט הציבורי. במעשיהם, היוו הנאשמים את אחת החוליות בשרשרת החזקת והפצת נשק בלתי חוקי, אשר כאמור לעיל, עלול להגיע לידיים עוינות של מי אשר לא יהסס לערוך בו שימוש, אף כי הוא לא מוסמך לכך ולא מיומן בכך. תופעה זו יש לגדוע.",מתחם העונש ההולם
"ת""פ 37900-06-22","בית המשפט העליון עמד פעמים רבות על החומרה הגלומה בעבירות נשק, וכן על הצורך בהחמרת הענישה כלפי מי אשר מבצע עבירות כגון דא. ראו על כך פסק הדין בע""פ 8869/21 מדינת ישראל נ' קואסמה, פסקה 11 (13.3.2022) (להלן: ""עניין קואסמה""):",מתחם העונש ההולם
"ת""פ 37900-06-22","'השימוש בנשק חם ככלי ליישוב סכסוכים הפך לרעה חולה, וכמעשה של יום ביומו גובה חיי אדם ולעיתים אף את חייהם של חפים מפשע אשר כל חטאם היה כי התהלכו באותה עת ברחובה של עיר. בשנים האחרונות אף חלה עליה מתמדת במספר אירועי הירי המדווחים למשטרה (ראו למשל: דו""ח מבקר המדינה התמודדות משטרת ישראל עם החזקת אמצעי לחימה לא חוקיים ואירועי ירי ביישובי החברה הערבית וביישובים מעורבים 28 (2018)). על רקע המציאות אותה אנו חווים למרבה הצער מדי יום, אנו עדים לקריאה ציבורית נרגשת להגברת האכיפה כלפי עבירות נשק – ולהחמרה במדיניות הענישה הנוהגת' (ראו ע""פ 4406/19 מדינת ישראל נ' סובח, פסקה 16  (5.11.2019))"".",מתחם העונש ההולם
"ת""פ 37900-06-22","על מגמת ההחמרה והיבט ההרתעה ראו גם את האמור בע""פ 2564/19 אזברגה נ' מדינת ישראל, פסקה 10 (18.7.2019), שם נקבע כי:",מתחם העונש ההולם
"ת""פ 37900-06-22","עוד, ובכל הנוגע לתפקידו של בית המשפט בצמצום ובמיגור השימוש הלא חוקי בנשק, ראו ע""פ 4456/21 מדינת ישראל נ' אבו עבסה, פסקה 15 (23.1.2022):",מתחם העונש ההולם
"ת""פ 37900-06-22","בעניין נשק התקפי, אשר היה מושא שני האישומים דכאן, נקבע בע""פ 4077/22 פלוני נ' מדינת ישראל, פסקה 12 (28.7.2022), כי:",	...
"ת""פ 37900-06-22","בעת קביעת מתחם העונש ההולם, על בית המשפט ליתן דעתו, בין היתר, למדיניות הענישה הנוהגת. זו, כאמור לעיל, הדגישה חזור והדגש את הצורך בענישה מחמירה ומרתיעה כלפי מי אשר מבצע עבירות נשק, תוך שמנעד הענישה רחב. כל אחד מהצדדים להליך הפנה לפסיקה אשר יש בה לטעמו כדי לתמוך בעמדתו.",	...
"ת""פ 37900-06-22","אפנה להלן לסקירה המבטאת את מדיניות הענישה הנוהגת, ממנה יש להקיש לענייננו, ואשר בין היתר על יסודה, ייקבע מתחם העונש ההולם. בסקירה זו אכלול התייחסות לחלק מפסקי הדין אליהם הפנו באי כוח הצדדים;",	...
"ת""פ 37900-06-22","ע""פ 7034/23 גהיים נ' מדנת ישראל (12.12.2023) - הערעור נדחה לאחר שבא כוח המערער קיבל את המלצת בית המשפט העליון וחזר בו מערעורו. בבית המשפט המחוזי, בגזר דין של הח""מ (ת""פ (מחוזי חיפה) 59787-11-21, מיום 3.8.2023) נקבע בעניינו של המערער (שהיה הנאשם הרביעי באותה פרשה) אשר הורשע בביצוע עסקה אחרת בנשק (ביחס למטעני חבלה אשר נמכרו לסוכן משטרתי), מתחם עונש הולם הנע בין 28 ל-60 חודשי מאסר בפועל. לבסוף, הושתו עליו 35 חודשי מאסר בפועל, לצד עונשים נלווים.",	...
"ת""פ 37900-06-22","ע""פ 4712/22 גושה נ' מדינת ישראל (9.2.2023) - המערער הורשע בביצוע שלוש עבירות של עסקה אחרת בנשק, בעבירת נשיאת נשק ובעבירת נשיאת תחמושת. הכל על פני חמישה אישומים שונים. בית המשפט המחוזי קבע מתחם עונש הנע בין 50 ל-75 חודשי מאסר, והשית על המערער 50 חודשי מאסר בפועל, לצד מאסרים מותנים. בית המשפט העליון הקל בעונשו של המערער, כך שעונש המאסר בפועל הועמד על 40 חודשים. זאת, בין היתר, למרות חומרת המעשים, בשים לב לעונש שהושת על מעורב אחר בנסיבות דומות ולעיקרון אחידות הענישה.",	...
"ת""פ 37900-06-22","ע""פ 5602/22 מדינת ישראל נ' פלוני (14.9.2022) - המשיב הורשע בביצוע עבירות של נשיאת נשק, הפרעה לשוטר במילוי תפקידו, וכן כניסה ושהייה בישראל בניגוד לחוק. דובר בתושב ג'נין אשר על אף שאינו מורשה כניסה לישראל, שהה ברכב בעיר אום אל פחם, כשהוא נושא על גופו אקדח חצי אוטומטי עם מחסנית וכדורים תואמים. משנהג הרכב התבקש על ידי שוטרים לעצור לבדיקה, המשיב יצא מהרכב כשהוא נושא את הנשק והחל להימלט. המשיב לא שעה לקריאת השוטר אשר רדף אחריו וצעק לעברו לעצור, ואחרי שנתפס נאבק בשוטר. על המשיב הושתו בבית המשפט המחוזי 18 חודשי מאסר בפועל, לצד עונשים נלווים. בית המשפט העליון בקבלו הערעור על גזר הדין, ציין בפסק דינו, כי ""... מתחם הענישה הרגיל שראוי לקבוע לנאשם בגיר בגין נשיאה בלתי חוקית של נשק חם במרחב הציבורי נע בין 30 ל-42 חודשי מאסר בין סורג ובריח (לצד עונשים נלווים בדמותם של מאסר-על-תנאי וקנס) ..."". בסופו של דבר, ומשערכאת הערעור אינה ממצה את הדין עם הנאשם, הועמד עונש מאסרו בפועל של המשיב על 28 חודשים.",	...
"ת""פ 37900-06-22","רע""פ 3355/22 סלאמה נ' מדינת ישראל (26.5.2022) - פסיקה אליה הפנתה המאשימה. המבקש הורשע בעבירות של החזקת נשק ותקיפת שוטר. על פי המתואר, המבקש החזיק בחצר ביתו שני תתי מקלע מאולתרים, מחסנית ריקה ותרמיל בקליבר 9 מ""מ פאראבלום. בחיפוש משטרתי אותר הנשק ומששב המבקש לביתו ונוכח התנהלותו, פעל אחד השוטרים להרחיקו. המבקש תקף את השוטר וגרם לו חבלה בירך. בית משפט השלום קבע מתחם עונש הנע בין 12 ל-36 חודשי מאסר, והשית על המבקש 15 חודשי מאסר בפועל, לצד עונשים נלווים. בית המשפט המחוזי במסגרת ערעור המדינה, קבע כי מתחם העונש ההולם נע בין 24 ל-50 חודשי מאסר בפועל, והעמיד את עונש מאסרו בפועל של המבקש על 28 חודשים. בית המשפט העליון דחה את בקשת רשות הערעור.",	...
"ת""פ 37900-06-22","עניין קואסמה - המשיב הורשע בביצוע מספר עבירות שנכללו בשלושה אישומים שונים, והן: רכישה והחזקת נשק שלא כדין, סחר ועסקה אחרת בנשק, וכן רכישה והחזקת חלקי נשק שלא כדין. בית המשפט המחוזי קבע מתחם עונש הנע בין 28 ל-58 חודשי מאסר והשית על המשיב 32 חודשי מאסר בפועל לצד עונשים נלווים. בית המשפט העליון החמיר בעונשו של המשיב, ובשים לב לכך שאין זו מדרכה של ערכאת הערעור למצות את הדין, הועמד עונש המאסר בפועל על 42 חודשים.",	...
"ת""פ 37900-06-22","ע""פ 4290/21 זרבאילוב נ' מדינת ישראל (6.12.2021) - פסק דין אליו הפנה סנגורו של נאשם 1. המערער נשא והוביל ברכבו, בתא המטען, שני אקדחים שכל אחד מהם טעון במחסנית אשר בתוכה 5 כדורים. על המערער נגזרו 18 חודשי מאסר בפועל, וכן מאסר מותנה. ערעורו נדחה על ידי בית המשפט העליון. יוער כי בית המשפט המחוזי קבע מתחם עונש הנע בין 16 ל-36 חודשי מאסר בפועל, לצד עונשים נלווים.",	...
"ת""פ 37900-06-22","ע""פ 2033/21 זועבי נ' מדינת ישראל (30.8.2021) - פסק דין אליו הפנה סנגורו של נאשם 1. המערער הורשע בביצוע עבירה של נשיאת והובלת נשק בצוותא. על פי המתואר, המערער ואחרים נסעו ברכב בעודם מצוידים בשני אקדחים, והגיעו לבית מגורים. האחרים ירו לעבר בית המגורים ופגעו ברכב שחנה בסמוך לו. בהמשך, הגיעו לבית מגורים במקום אחר; האחרים ירו לעבר בית המגורים על רקע סכסוך של המערער עם מי אשר התגורר בו, ופגעו ברכב שחנה סמוך לו. בית המשפט המחוזי קבע מתחם עונש הולם הנע בין 18 ל-40 חודשי מאסר בפועל, והשית על המערער 24 חודשי מאסר בפועל, לצד עונשים נלווים. הערעור נדחה.",	...
"ת""פ 37900-06-22","רע""פ 3619/21 אבו הלאל נ' מדינת ישראל (26.5.2021) - פסק דין אליו הפנה סנגורו של נאשם 1. המבקשים הורשעו בביצוע עבירות החזקת נשק ותחמושת. זאת בגין החזקת שני כלי נשק מאולתרים מסוג קרלו, מחסניות ו-4 כדורי 9 מ""מ, וכן החזקה של כדור תחמושת המשמש נשק ארוך, על ידי מבקש מס' 1. בית משפט השלום קבע מתחם עונש הולם הנע בין 10 ל-18 חודשי מאסר בפועל, ותוך סטיה מהמתחם השית על כל אחד מהמבקשים עונש מאסר בפועל בן 9 חודשים לריצוי בעבודות שירות, לצד מאסר מותנה. בית המשפט המחוזי קיבל את ערעור המשיבה, באופן שעונש המאסר בפועל של כל אחד מהמבקשים הועמד על 10 חודשים. בית המשפט העליון דחה את בקשת רשות הערעור.",	...
"ת""פ 37900-06-22","	ע""פ 1944/20 מדינת ישראל נ' אמארה (2.9.2020) - פסיקה אליה הפנתה המאשימה. המשיב הורשע בעבירות של סחר בנשק, עבירות בנשק (החזקה ונשיאה), נהיגה ללא רישיון נהיגה תקף, וכן ללא פוליסת ביטוח תקפה. על פי המתואר, המשיב יצר קשר עם סוכן משטרתי סמוי. בפגישה שנערכה ביניהם בבית המשיב, הציעו המשיב ואדם אחר למכור לסוכן אמצעי לחימה שונים, ובין היתר רובה סער ""קלצ'ניקוב"", תת מקלע ""עוזון"", אקדח ברטה ומטעני חבלה. בהמשך, נפגשו הסוכן והמשיב בשנית בבית המשיב, וזה האחרון הציג לסוכן תת מקלע מסוג CZ ומחסנית ריקה; הסביר לו על השימוש בנשק והדגים לו את השימוש. הסוכן שילם למשיב 20,000 ₪, והמשיב מסר את הנשק לידיו. בפגישה זו הציע המשיב למכור לסוכן אמצעי לחימה שונים נוספים, ואף הציג לסוכן חפץ הנחזה להיות אקדח. בית המשפט המחוזי קבע מתחם עונש הולם הנע בין 3 ל-6 שנות מאסר, והשית על המשיב עונש מאסר בפועל למשך 6 שנים, לצד עונשים נלווים. כמו כן, הפעיל בית המשפט המחוזי עונש מאסר מותנה בן 24 חודשים, כך שחציו ירוצה במצטבר. ",	...
"ת""פ 37900-06-22","בית המשפט העליון ציין בפסק דינו, כי ""אמנם דומה כי מתחם הענישה שקבע בית המשפט המחוזי הוא גבוה יחסית בהשוואה למתחם הנוהג בעבירות נשק, במיוחד בהינתן שליבת כתב האישום עניינה בעסקת נשק אחת בלבד. עם זאת, המתחם שנקבע אינו חורג ממרחב הגמישות שנתון לערכאה הדיונית, כאמור לעיל"" (פסקה 11). מכל מקום, בנסיבות המקרה, ובין היתר בהינתן עברו הפלילי המכביד של המשיב והעובדה כי עונש המאסר המותנה הופעל מחציתו במצטבר, דחה בית המשפט העליון את ערעור המשיב על חומרת העונש, כמו גם את ערעור המדינה על קולת העונש.",	...
"ת""פ 37900-06-22","ע""פ 315/20 אבו טאה נ' מדינת ישראל (7.6.2020) - המערערים היו מעורבים בעסקאות נשק עם סוכן משטרתי. אחד המערערים, פאדל שמו, הורשע בעבירות של סיוע לעסקה אחרת בנשק בצוותא, וכן בעבירת סחר בנשק בצוותא. המערער השני, פתחי שמו, הורשע בעבירה של עסקה אחרת בנשק בצוותא. בית המשפט המחוזי קבע כי מתחם העונש בעניינו של פאדל נע בין 3.5 ל-5.5 שנות מאסר, ובעניינו של פתחי בין 3 ל-5 שנות מאסר. לבסוף נגזרו על פאדל בבית המשפט המחוזי 45 חודשי מאסר בפועל לצד מאסר מותנה, ועל פתחי 36 חודשי מאסר בפועל לצד מאסר מותנה. בית המשפט העליון דחה את ערעורם של פאדל ושל פתחי.",	...
"ת""פ 37900-06-22","ע""פ 3877/16 ג'באלי נ' מדינת ישראל (17.11.2016) - פסק דין אליו הפנתה המאשימה. נדחה ערעור על חומרת העונש שהוטל על המערער בגין נשיאת נשק (אקדח מסוג ""גלוק"" טעון במחסנית שהכילה 14 כדורים). בית המשפט המחוזי קבע מתחם עונש הולם הנע בין 24 ל-48 חודשי מאסר בפועל, והשית על המערער עונש של 34 חודשי מאסר בפועל, לצד עונשים נלווים. יוער כי המערער נשא עמו ברכב את האקדח כשהוא נוסע למקום מפגש אשר נועד ליישוב סכסוך בין אחרים.",	...
"ת""פ 37900-06-22","	ת""פ (מחוזי חיפה) 34178-06-23 מדינת ישראל נ' ג'בארין (21.9.2023) - גזר דין אליו הפנה סנגורו של נאשם 1. נאשם 1 באותה פרשה הורשע בעבירות של נשיאת והובלת נשק. זאת לאחר שהנאשם נהג ברכב, כשבתא הכפפות מצוי אקדח חצי אוטומטי, טעון במחסנית, וכן שתי מחסניות נוספות מלאות בתחמושת. בית המשפט המחוזי קבע מתחם עונש הולם הנע בין 20 ל-40 חודשי מאסר בפועל, והשית על נאשם זה 20 חודשי מאסר בפועל, לצד עונשים נלווים.",	...
"ת""פ 37900-06-22","ת""פ (מחוזי חיפה) 52355-03-22 מדינת ישראל נ' פלוני (27.3.2023) - המאשימה הפנתה לגזר הדין בעניינו של נאשם 4 באותה פרשה. דובר בעניינם של חמישה נאשמים בפרשה בה הופעל סוכן סמוי. נאשם 4 הורשע בביצוע עבירה של עסקה אחרת בנשק (חפץ דמוי רובה סער M16). נקבע לגביו, בגזר הדין של הח""מ, מתחם עונש הולם הנע בין 38 ל-62 חודשי מאסר, והושת על נאשם 4 מאסר בפועל למשך 42 חודשים, לצד עונשים נלווים.",	...
"ת""פ 37900-06-22","ת""פ (מחוזי ירושלים) 35608-04-18 מדינת ישראל נ' קורד (28.2.2019) - גזר דין אליו הפנה סנגורו של נאשם 3. נאשם 3 באותה פרשה הורשע בשתי עבירות של סחר בנשק. על פי המתואר, ובגדרי אחד האישומים, נאשם 1 באותה פרשה נסע ברכבו עם סוכן משטרתי, ואסף את נאשם 3. עם הגעתם לחברון, ניגש נאשם 3 לבית סמוך, שב אל הרכב ומסר לסוכן אקדח מסוג סטאר 9 ומחסנית. בהמשך, יצא נאשם 3 בשנית מהרכב וחזר כשבידיו 10 כדורים, אותם הכניס אל המחסנית. השלושה יצאו מהרכב, כל אחד מהם ירה מהאקדח, ואז שבו הם אל הרכב, שם נאשם 3 העביר לסוכן את האקדח. על פי אישום אחר באותה פרשה, נאשמים 1, 3 והסוכן נסעו יחדיו לחברון. נאשם 3 יצא מן הרכב ובשובו אל הרכב הביא עמו רובה סער מסוג M-16, אשר בסופו של דבר נמכר לסוכן לאחר שבוצע ירי הימנו, לרבות על ידי נאשם 3. בית המשפט המחוזי קבע מתחם עונש הולם של 6-2 שנות מאסר בפועל, והשית על נאשם 3, 34 חודשי מאסר בפועל לצד עונשים נלווים.",	...
"ת""פ 37900-06-22","ת""פ (מחוזי חיפה) 52101-02-15 מדינת ישראל נ' מחאג'נה (21.12.2015) - גזר דין אליו הפנה סנגורו של נאשם 3. הנאשם באותה פרשה הורשע בביצוע עבירות של סחר בנשק, נשיאת נשק וקשירת קשר לביצוע פשע. על פי המתואר, הנאשם נשא והוביל רובה סער קלצ'ניקוב, תת מקלע מאולתר, מחסניות, תחמושת ואביזרי נשק מסוגים שונים, לרבות מכלול של קלצ'ניקוב. באחד מן הימים, הנאשם הגיע ברכבו סמוך לביתו של אחר בשם מוחמד, כשהנשק מוחזק, נישא ומובל על ידו ברכב. בהמשך, הנאשם טען את הקלצ'ניקוב, ויצא יחד עם אחרים לביצוע ניסוי ירי. אחר כך, הקלצ'ניקוב, המכלול והמחסניות הועברו לידי מוחמד תמורת סכום כסף. בהמשך היום, הנאשם נעצר כשברכבו אמצעי לחימה שונים. בית המשפט המחוזי קבע מתחם עונש הולם הנע בין 24 ל-60 חודשי מאסר בפועל, והשית על הנאשם 36 חודשי מאסר בפועל, לצד עונשים נלווים.",	...
"ת""פ 37900-06-22","עד כאן סקירת הפסיקה, אך בשלהי פרק זה חשוב לציין, כי לא נעלמה הימני טענת הסנגורים המלומדים, לפיה, הפסיקה הנוהגת הרלוונטית, היא זו שניתנה בעת בה ביצעו הנאשמים את מעלליהם, ולא הפסיקה אליה הפנתה המאשימה מן העת האחרונה אשר ביקשה להחמיר עם מי אשר מבצע עבירות נשק.",	...
"ת""פ 37900-06-22",	טענה זו יש לדחות בשתי ידיים. ומדוע כך?,	...
"ת""פ 37900-06-22","ראשית, אכן עדים אנו למגמת החמרה בענישה בעבירות נשק אשר הולכת וגוברת ברבות השנים. מגמה זו באה לידי ביטוי בפסיקתו העניפה של בית המשפט העליון (כמפורט לעיל), כמו גם  בתיקוני חקיקה. בעניין אחרון זה, ראו למשל הוראת השעה שעוגנה במסגרת תיקון 140 לחוק, הקובעת עונש מזערי על מי אשר מבצע עבירות נשק, להוציא מקרים חריגים. ראו למשל גם את תיקון 145 לחוק, אשר בין היתר הוציא את עבירת רכישת הנשק מגדרי סעיף 144(א) רישא לחוק והכניסה לגדרי סעיף 144(ב) רישא לחוק; סעיף עבירה שהעונש המרבי הקבוע בצידו גבוה יותר.",	...
"ת""פ 37900-06-22","ואולם, בעוד אין חולק על כי תיקוני החקיקה דלעיל אינם חלים על המקרה דכאן, הרי שבכל הנוגע לפסיקה, בית המשפט העליון קרא זה מכבר להחמרה בענישה בעבירות נשק, וכך עשה, גם בעת ביצוע העבירות דכאן. ראו למשל דבריו של השופט מ' מזוז בע""פ 4406/19 מדינת ישראל נ' סובח (5.11.2019), כי: ""... המאבק בתופעות האלימות החמורות בחברה הישראלית בהן נעשה שימוש בנשק מחייב, מעבר למאמץ 'לשים יד' על כלי הנשק הבלתי חוקיים הרבים שבידי הציבור, גם ענישה מחמירה ומרתיעה בעבירות נשק, לרבות על עצם החזקה או רכישה שלא כדין של נשק"". בהמשך נכתב, כי: ""ביעור תופעת החזקת כלי נשק בלתי חוקיים הוא אפוא אינטרס ציבורי מהמעלה הראשונה ותנאי הכרחי למאבק בתופעות הפשיעה האלימה לסוגיה הרווחות במקומותינו, בבחינת 'ייבוש הביצה' המשמשת ערש לגידולן של תופעות אלה. מהלך כזה מחייב הירתמות גם של בתי המשפט, על ידי ענישה מחמירה ומרתיעה לעבירות נשק בלתי חוקי באשר הן, וכל שכן מקום שנעשה בנשק כזה שימוש בביצוע עבירות אלימות לסוגיהן"".",	...
