verdict,text,part
"ת""פ 37900-06-22","למעשה, בית המשפט העליון עמד על הצורך בענישה מחמירה בעבירות נשק גם שנים קודם ביצוע העבירות על ידי הנאשמים. ראו למשל ע""פ 5900/15 מעוז נ' מדינת ישראל, פסקה 8 (10.5.2016). ",	...
"ת""פ 37900-06-22","משכך, לא מצאתי ממש בטענת הנאשמים, אף בלא שאדרש לשאלה האם הנחת היסוד שבבסיס טענתם, לפיה הפסיקה הנוהגת הרלוונטית היא מן העת בה בוצע מעשה העבירה ולא הפסיקה מן המועד הסמוך לחתימת גזר הדין, נכונה היא, אם לאו.",	...
"ת""פ 37900-06-22","שנית, עיון בפסיקה אליה הפנתה המאשימה מלמד על כי מדובר בפסיקה מגוונת שניתנה על פני ציר זמן של שנים רבות. בכלל זה, יש בנמצא בהפניותיה פסיקה מן השנים 2016 ו-2020. לא זו אף זו, חלק מן הפסיקה אליה הפנה סנגורו של נאשם 1 ניתן לאחר ביצוע העבירות על ידי הנאשמים. בכך, ניטל עוקצה של טענת הסנגורים.",	...
"ת""פ 37900-06-22","לא למותר לציין אף, כי בעוד אחרון המעשים המיוחסים לנאשמים שלפניי בוצע בין שנת 2020 למחצית הראשונה של שנת 2021, כתב האישום הוגש בחודש יוני 2022. הדבר נבע ממועד גילוי העבירות. מכל מקום, אין חולק כי הגשת כתב האישום אינה נגועה בשיהוי מאת המאשימה (ראו על כך גם דברי סנגורו של נאשם 1, עמ' 10 לתמלול הדיון מיום 20.2.2024).",	...
"ת""פ 37900-06-22",	עד כאן בהתייחס לפסיקה.,	...
"ת""פ 37900-06-22","בבחינת הנסיבות הקשורות בביצוע העבירה, יש ליתן את הדעת על כי אף שעסקינן ב""אירוע אחד"", מדובר בשני כלי נשק, שניהם התקפיים. אשר לקרלו, הנאשם 3 קיבל אותו לידיו יחד עם מחסנית ריקה בשנת 2019. הוא הסליק את הקרלו סמוך לאצטדיון באום אל פחם. בהמשך אותה השנה או בשנה שלאחריה, החליף הקרלו ידיים בהינתן קיומו של חוב כספי של נאשם 3 לנאשם 1. לשם כך, נשא נאשם 3 את הקרלו והמחסנית, יחד עם תחמושת, והעבירם לחזקת נאשמים 1 ו-2, אשר נשאו את הנשק. עקב מעשים אלו, הורשע כל אחד מהנאשמים שדינם נגזר כעת בעבירות של רכישת, החזקת ונשיאת נשק. נאשם 3 הורשע גם בעבירה של עסקה בנשק. באישום השני מתואר כי נאשמים 1 ו-3 רכשו והחזיקו בצוותא חדא M16, בהתאם הורשע כל אחד מהם בעבירה של רכישת והחזקת נשק.",	...
"ת""פ 37900-06-22","מדובר במעשים חמורים. כל אחד מהנאשמים רכש, החזיק ונשא נשק. נאשם 3 אף ערך עסקת נשק. באמצעות רכישה / מסירה של נשק, מהווים הנאשמים את אחת החוליות בשרשרת הפצת והחזקת הנשק, בסופה יכול וייפגע מאן דהוא וייארע נזק הרה גורל. ואכן המעגל של אלו המחזיקים בנשק לא נסגר עד עצם היום הזה. בעוד הקרלו נתפס אגב חקירת המשטרה, ה-M16 לא אותר עד היום (ראו על כך טיעוני המאשימה), ואין לדעת אילו ידיים מחזיקות בו, האם ייעשה בו שימוש, לאיזה צורך, ואימתי. בכך, בעוד הנזק הפוטנציאלי הגלום בהחזקת נשק באופן בלתי חוקי לא יתממש עוד בכל הנוגע לקרלו, אין לדעת מה צופן העתיד בכל הנוגע ל-M16. קיים החשש התמידי שמא בסופו של דבר ייעשה שימוש ב-M16, בין אם על רקע פלילי ובין אם על רקע בטחוני.",	...
"ת""פ 37900-06-22","חשש לשימוש מיידי בנשק, אשר מגדיל עוד יותר את פוטנציאל הנזק הצפוי בטווח הזמן הקרוב, יכול היה להתקיים בנוגע לקרלו, אשר על פי עובדות כתב האישום המתוקן, נמסר לידי נאשם 3 יחד עם מחסנית, ובהמשך מנאשם 3 לידי נאשמים 1 ו-2, יחד עם מחסנית ותחמושת. חרף זאת, סעיפי העבירה אשר יוחסו לנאשמים הם 144(א) רישא ו-144(ב) רישא, כך שלנאשמים לא יוחסו עבירות של רכישת, החזקת או נשיאת אבזר או תחמושת, ובהתאם הם לא הורשעו בכך. זאת ועוד, על פי כתב האישום המתוקן, לא ניתן לדעת מה משך ההחזקה המדויק בנשקים, ואין בו פירוט בדבר הרקע או המטרה לרכישת והחזקת הנשקים.",	...
"ת""פ 37900-06-22","על רקע נסיבות ביצוע העבירות, הערכים החברתיים אשר נפגעו ומידת הפגיעה בהם, כמו גם מדיניות הענישה הנוהגת, סבורני כי מתחם העונש ההולם את מעשיו של נאשם 1 נע בין 40 חודשי מאסר בפועל לבין 70 חודשי מאסר בפועל. מתחם העונש ההולם בכל הנוגע למעשיו של נאשם 3 נע בין 50 חודשי מאסר בפועל לבין 80 חודשי מאסר בפועל. הכל לצד עונשי מאסר מותנה, ובשים לב לכך שהמאשימה לא עתרה להשית על הנאשמים קנס.",	...
"ת""פ 37900-06-22","נעבור עתה לבחון את העונש הראוי כי יושת על כל אחד מהנאשמים בגדרי המתחם שזה עתה נקבע בעניינו, ומשאין בנמצא מקום לסטות מעלה או מטה מגבולותיו. שיקול ההגנה על שלום הציבור, הגם שמתקיים מעצם הערך המוגן שנפגע, אינו מצדיק חריגה מהמתחם. שיקול השיקום, אינו מתקיים וממילא אינו מצדיק גם הוא סטייה מהמתחם.",	...
"ת""פ 37900-06-22","בעת קביעת העונש המתאים לכל אחד מהנאשמים, יש להתחשב בנסיבות אשר אינן קשורות בביצוע העבירה, כמפורט בסעיף 40יא לחוק.",העונש המתאים לנאשמים
"ת""פ 37900-06-22","בהקשר זה, יש ליתן משקל להודאת הנאשמים בעובדות המיוחסות להם בכתב האישום המתוקן; הודאה אשר ניתנה אגב ניהול פרשת התביעה. אין חולק כי הודאת הנאשמים, אף בשלב בו היא ניתנה על פני ציר הזמן של ניהול ההליך בעניינם, הביאה לחיסכון בזמן שיפוטי ניכר (ראו על כך גם טיעוני המאשימה). בצד זאת, המאשימה טוענת כי ""אין הדבר דומה להודאה בהזדמנות הראשונה"", ואולם לא מצאתי לזקוף לחובת הנאשמים את ניהול התיק בחלקו בשים לב לתיקון המשמעותי בכתב האישום, הכולל גם מחיקת סעיפי עבירה, ותוך שלא נעלמה מעיניי טענת הסנגורים כי שמיעת חלק מן הראיות הובילה לתיקון כתב האישום.",העונש המתאים לנאשמים
"ת""פ 37900-06-22","עוד נתתי דעתי לצער ולחרטה שהביעו הנאשמים לפניי ואשר התרשמתי מכנות ומאמיתות הדברים. התחשבתי גם בגילם הצעיר באופן יחסי של הנאשמים אשר היו בשנות העשרים לחייהם בעת ביצוע המעשים. תשומת הלב ניתנה גם לטענות סנגורו של נאשם 1 בדבר היות נאשם זה נשוי ואב לשלושה ילדים קטינים וקטנים, שהגדול בהם בן ארבע שנים; לכך שאביו נפטר תוך כדי ניהול ההליך בגיל צעיר יחסית בהיותו בן 53 שנים, ולכך שנוכח תחלואי אחיו נטל פרנסת המשפחה כולה רובץ על שכמו. הווה אומר, כי עונש מאסר משמעותי מאחורי סורג ובריח יהא בעל משמעות גם כלפי בני משפחתו של נאשם 1.",העונש המתאים לנאשמים
"ת""פ 37900-06-22",נתון נוסף בעל משקל משמעותי הוא כי לחובת הנאשמים אין בנמצא רישום פלילי קודם.,העונש המתאים לנאשמים
"ת""פ 37900-06-22","מכלול נתונים אלו, הפועל כולו לזכות הנאשמים, תומך בהצבת עונשם בתחתית מתחם העונש ההולם שנקבע בעניינם. באמצעות ענישה של מאסר בפועל מאחורי סורג ובריח למשך חודשים רבים, בצירוף עונש מאסר מותנה הצופה פני עתיד, סבורני כי יוגשם עיקרון ההלימה, ובד בבד תושג הרתעתם של הרבים, לצד הרתעת הנאשם. עונש זה אף יאפשר בידי הנאשמים שגילם צעיר באופן יחסי לשוב אל חיק קרוביהם ולטפח את התא המשפחתי שלהם עם שחרורם מבית האסורים, וכולי תקווה כי כך יעשו הנאשמים, וכי מאסרם זה הראשון יהא גם האחרון.",העונש המתאים לנאשמים
"ת""פ 37900-06-22","על כן, אני גוזר על הנאשמים את העונשים הבאים:",סוף דבר
"ת""פ 37900-06-22","שניים עשר (12) חודשי מאסר על תנאי למשך שלוש שנים, שלא יעבור כל עבירת נשק מסוג פשע.",תקופה זו תימנה מיום מעצרו של הנאשם בתאריך 18.5.2022.
"ת""פ 37900-06-22","שישה (6) חודשי מאסר על תנאי למשך שלוש שנים, שלא יעבור כל עבירת נשק מסוג עוון.",תקופה זו תימנה מיום מעצרו של הנאשם בתאריך 18.5.2022.
"ת""פ 37900-06-22","תקופה זו תימנה מיום מעצרו של הנאשם בתאריך 14.12.2023, ובנוסף ינוכו ממנה ימי המעצר מיום 24.5.2022 ועד ליום 20.11.2023.",חמישים (50) חודשי מאסר בפועל.
"ת""פ 37900-06-22","ארבעה עשר (14) חודשי מאסר על תנאי למשך שלוש שנים, שלא יעבור כל עבירת נשק מסוג פשע.",חמישים (50) חודשי מאסר בפועל.
"ת""פ 37900-06-22","שמונה (8) חודשי מאסר על תנאי למשך שלוש שנים, שלא יעבור כל עבירת נשק מסוג עוון.",חמישים (50) חודשי מאסר בפועל.
"ת""פ 37900-06-22","ניתן היום,  ט' אדר ב' תשפ""ד, 19 מרץ 2024, בנוכחות הצדדים.",54678313זכות ערעור תוך 45 ימים לבית המשפט העליון.
"ת""פ 37900-06-22","בעניין עריכה ושינויים במסמכי פסיקה, חקיקה ועוד באתר נבו – הקש כאן",54678313זכות ערעור תוך 45 ימים לבית המשפט העליון.
"ת""פ 37900-06-22",אינאס סלאמה 54678313-/,54678313זכות ערעור תוך 45 ימים לבית המשפט העליון.
