verdict,text,part
"ת""פ 4788-09-15","הנאשם גידל סם מסוג קנבוס הנחשב לסם ""קל"", אך גידל בכמות גדולה מאוד של הסם  למעלה מעשרה ק""ג, ומתוך כתב האישום המתוקן תואר כי הנאשם השקיע בגידול הסם משאבים וכסף רב, הוא ייבא סוגים שונים של זני הסם מעבר לים, השקיע בטיפול וטיפוח הסם, לרבות שימוש בכל החומרים והאביזרים הנדרשים לצורך הצלחת הגידולים. בנוסף החזיק הנאשם גם נשק וחלקי תחמושת שעובדת היותם ישנים, לא נסתרה.",דיון בסוגית ההרשעה
"ת""פ 4788-09-15","לעבירות הסמים ישנן השלכות קשות על המבצעים אותן ועל הציבור כולו בשל הנזקים הישרים והנזקים העקיפים הנובעים מהן. גידול סמים, אף אם נעשה במסגרת ביתית, הוא מעשה הדורש תכנון מוקדם ומוקפד לצורך הצלחת הגידולים. במקרה דנן, הניבו גידוליו של הנאשם 215 שתילים שהצמיחו כמות רבה של סמים במשקל 10 ק""ג, ומשכך הפגיעה בביטחון הציבור ובבריאותו הם ברמה בינונית- גבוהה.",דיון בסוגית ההרשעה
"ת""פ 4788-09-15","די בחומרת העבירות ונסיבות ביצוען, כדי שלא לבטל את הרשעתו של הנאשם, מבלי לפגוע בשיקולי ענישה אחרים. ואולם למעלה מן הצורך אוסיף, כי לא סברתי שהותרת הרשעת הנאשם תהווה פגיעה משמעותית בשיקומו, משעה שהנאשם כלל אינו מעוניין בהליך שיקומי. לפניי טען הנאשם, כי הוא מעוניין בסיומו של ההליך המשפטי על מנת לשוב ולהתגורר בחו""ל (עמ' 29 ש' 2-3). כמו כן, בפני שירות המבחן שלל הנאשם נזקקות טיפולית מכל סוג שהוצע לו על ידם, גילה קושי רב בהימנעות משימוש בסמים ושיתוף הפעולה עם שירות המבחן היה חלקי בלבד. לאור התרשמות שירות המבחן מהיעדר המוטיבציה של הנאשם להשתלב בהליך טיפולי, אשר עשוי היה לסייע למצוקתו הנפשית ולתלות שלו בסמים, אף שירות המבחן לא המליץ בעניינו, על ביטול הרשעה. ",דיון בסוגית ההרשעה
"ת""פ 4788-09-15","לנוכח האמור לעיל, אני מותיר את הרשעת הנאשם על כנה.",דיון בסוגית ההרשעה
"ת""פ 4788-09-15","כאמור, הנאשם הורשע בביצוע שתי עבירות מסוגים שונים, גידול סמים והחזקת נשק ללא היתר, ואולם, מדובר בעבירות שבוצעו באותו הזמן ובאותו המקום. הצדדים אף לא ביקשו להתייחס לכל אחת מהעבירות כאירוע נפרד ולפיכך יש לקבוע כי שתי העבירות מהוות אירוע אחד, שבגינו יקבע מתחם עונש הולם אחד.",מתחם העונש ההולם
"ת""פ 4788-09-15","הערכים המוגנים שנפגעו באמצעות עבירת הנשק הן פגיעה בביטחון הציבור, עבירות נשק עלולות להוביל לפגיעה בגוף ובנפש. הנאשם החזיק אקדח על שידה בסלון ביתו, ומחסנית ריקה, ואולם לא הובאו ראיות לסתור את טענתו כי האקדח ישן, חלוד ותקול (ראה נ/2, וכן עדותו של מר רונן רבני עמ' 19 ש' 1-3), ובכך פוחתת מידת הסכנה הנשקפת כתוצאה מביצוע עבירות הנשק ובהתאם- גם מידת הפגיעה בערך המוגן.",מתחם העונש ההולם
"ת""פ 4788-09-15","עבירות הסמים פוגעות בבריאות הציבור, בשל הנזקים הישירים שנגרמים כתוצאה משימוש בסמים. לעבירות סמים אף נזקים עקיפים הנובעים מביצוע תדיר של עבירות שנועדו לממן את צריכת הסם. וכן מכך שחלק ממשתמשי הסמים עושים, תחת השפעת הסמים, פעולות יומיומיות שהן מסוכנות מטבען, כגון נהיגה או הפעלת ציוד מכני מסוכן, ומגבירים בכך את הסכנה הכרוכה ממילא באותן פעולות. עם זאת, על האף הכמות הגדולה של הסמים שגידל הנאשם, כמות העולה במידה רבה על הכמות הקבועה בחוק לצורך שימוש עצמי, לא יוחסה לנאשם עבירה של סחר בסמים, או החזקת סמים שלא לצריכה עצמית.",מתחם העונש ההולם
"ת""פ 4788-09-15","על הצורך להילחם בתופעת הסמים שפשה בחברתנו, ועל תפקידו של בית המשפט להביע עמדתו, בין היתר, באמצעות ענישה מחמירה לצורך מיגור התופעה, נאמר לא אחת בפסיקת בית המשפט העליון. יפים לעניין זה דברי כב' השופט ג'ובראן בע""פ 9482/09 ביטון נ' מדינת ישראל (פורסם בנבו 24.7.11);",מתחם העונש ההולם
"ת""פ 4788-09-15","עיון בפסיקה מלמד, כי מדיניות הענישה הנוהגת בעבירות של גידול סמים, במקרים דומים לאלו של הנאשם, הוטלו ככלל עונשים הכוללים רכיב ענישה מוחשי של מאסר בפועל או בעבודות שירות, ראו למשל רע""פ 3154/16 אוחיון נ' מדינת ישראל [פורסם בנבו 18.4.16]; ע""פ (חיפה) 41827-08-10  פרידמן נ' מדינת ישראל [פורסם בנבו 30.12.10];  רע""פ 4512/15 הרוש נ' מדינת ישראל [פורסם בנבו 6.7.15]; רע""פ 711/13 הנסן נ' מדינת ישראל [פורסם בנבו 30.1.13]; וכן ראה ת""פ (רמלה) 5787-10-14  מדינת ישראל נ' אשטיבקר [פורסם בנבו 13.4.15] והפסיקה הנזכרת שם.",מתחם העונש ההולם
"ת""פ 4788-09-15","בחינת הפסיקה ביחס לעבירות הנשק, מלמדת על מגמה של החמרה הדרגתית בענישה בגין אלה לאורך השנים האחרונות בשל הסכנות הרבות הפוטנציאליות בנשק. ראו למשל עפ""ג (י-ם) 18257-03-16  מדינת ישראל נ' טוויל [פורסם בנבו 6.12.16] והפסיקה הנזכרת שם. עם זאת בהיר כי מידת הסכנה היא פועל יוצא, בין היתר, של תקינות הנשק והמקום שבו הוא הוחזק.",מתחם העונש ההולם
"ת""פ 4788-09-15","בשולי הדברים אציין, כי ב""כ הנאשם הפנתה לפסיקה שרובה ככולה איננה תואמת את נסיבות המקרה דנן, בהם הורשעו נאשמים בעבירות של גידול סמים בכמות הפחותה משמעותית מהכמות המיוחסת לנאשם שלפני, מבלי שיוחסה כלל עבירת נשק, ומשכך אין בידי לקבלה, כך למשל עפ""ג 28110-10-15 מדינת ישראל נ' דוד (פורסם בנבו 17.12.15)- הורשע נאשם בעבירה של גידול סמים בכמות, 21 שתילים סכ""ה 3,600 גרם קנבוס; ובכמות עוד פחותה בת""פ 16759-07-17 מדינת ישראל נ' ביסמוט (פורסם בנבו); ובעפ""ג 50966-05-15 מדינת ישראל נ' נתנוב (פורסם בנבו 8.10.15); אציין, כי אומנם קיימת פסיקה מקלה בעבירות של גידול סמים, אולם באותם מקרים, הנאשם עבר הליך שיקומי אשר אפשר לבית המשפט לחרוג ממתחם העונש ההולם בשל הליך שיקומי, שלא כמו במקרה שלפנינו. ביחס לעבירת הנאשם הציגה ב""כ הנאשם פסיקה ישנה, ת""פ (שלום י-ם) 292/06 מדינת ישראל נ' אלפיניש (פורסם בנבו 6.1.08) – שם דובר בעבירה יחידה של החזקת נשק – לא תקין, ללא גידול סמים ולא בכמות של הנאשם שלפניי. ",מתחם העונש ההולם
"ת""פ 4788-09-15","לנוכח האמור לעיל, מתחם העונש ההולם את העבירות שביצע הנאשם מתחיל משישה חודשי מאסר, שיכול וירוצה בעבודות שירות ועד שמונה - עשר חודשי מאסר בפועל לצד עונשים נלווים.",מתחם העונש ההולם
"ת""פ 4788-09-15","הנאשם בן 41, רווק, נעדר הרשעות קודמות. אזקוף לזכותו את הודייתו בהזדמנות הראשונה בכתב האישום, שכן, בכך יש מידה מסוימת של נטילת אחריות וחיסכון בזמן שיפוטי.",העונש המתאים לנאשם
"ת""פ 4788-09-15","אתחשב בנסיבות חייו המורכבות של הנאשם, כפי שאלו באו לביטוי בתסקירי שירות המבחן שהוגשו בעניינו ומחוות הדעת הפסיכיאטרית, שהוגשה מטעמו, אשר תיארו את תרומתו לחברה, כלוחם בשירות צבאי, ובעת שעסק בעבודות שונות בשירות הביטחון, את מצבו הנפשי בעקבות פיגוע טרור לו היה עד במהלך שירותו הצבאי ואת העובדה שהיום סובל מתסמיני פוסט טראומה. ואולם, לא ניתן להתעלם מהעובדה שהנאשם בוחר להתמודד עם תסמינים אלה באמצעות שימוש בסמים ושולל כל אפשרות טיפולית אחרת שהוצעה לו על ידי שירות המבחן. בנוסף, הנאשם שהה תקופה ממושכת בהולנד ושם עקב התקפי חרדה פנה לטיפול פסיכיאטרי, וממכתבו של הרופא שטיפל בו בהולנד (נ/1), עלה כי הטיפול בנאשם ארך שנה, במהלכה הוא אובחן עם תסמיני דיכאון, ולא הוצע לו טיפול קונבנציונאלי בשל השימוש של הנאשם בסמים.",העונש המתאים לנאשם
"ת""פ 4788-09-15","מתוך תסקירי שירות המבחן עוד עולה, כי הנאשם לקח אחריות לביצוע מעשיו ולמרות שביטא אמביוולנטיות ביחס להשתלבותו בהליך טיפולי, תחילה נענה לדרישותיהם, ובמשך מספר חודשים מסר בדיקות לאיתור שרידי סם, שהעידו על ניקיון מסמים. במקביל נבחנה מסגרת טיפולית המתאימה הן לבעיות הנפשיות והן לבעיית הסמים מהן סובל הנאשם.",העונש המתאים לנאשם
"ת""פ 4788-09-15","ואולם, הליך השיקום שבו החל הנאשם, הופסק עוד בטרם גובשה תוכנית טיפולית בעניינו בשל כך שנתפס כשהוא מזייף בדיקה לאיתור שרידי סם. הנאשם התוודה בפני שירות המבחן כי הוא אינו מסוגל להימנע משימוש בסמים, וכי הוא אינו מעוניין עוד בשילובו בהליך טיפולי. לאור כך, התרשם שירות המבחן כי הנאשם בעל דפוסי התמכרות ותלות עמוקה בסם המריחואנה, לצד מצוקה נפשית חריפה. עוד התרשמו כי הנאשם לא הצליח לגייס כוחות ולהשתלב בתהליך טיפולי ארוך טווח, על אף נזקקתו לכך.",העונש המתאים לנאשם
"ת""פ 4788-09-15","התנהלות זו של הנאשם, מול שירות המבחן, מלמדת על היעדר מוטיבציה שלו לערוך שינוי משמעותי בחייו ולהשתקם, לצד עמדתו הקורבנית וכעסו על המערכת כפי שעלה בתסקירי שירות המבחן, המעידים על חוסר תובנה וצמצום מחומרת מעשיו. כל אלה מקימים חשש לסיכון מסוים הנשקף מהנאשם להישנות התנהגות עוברת חוק, המחייבים שיקולים של הרתעה אישית. כמו כן לא ניתן להתעלם מנסיונו של הנאשם לזייף בדיקות שתן לאיתור השימוש בסמים וכן טענותיו הקשות כנגד מערכת המשפט שאין להן כל שחר והסירוב ליטול חלק בהליך שיקומי. עוד אציין, כי לא מצאתי לאמץ את המלצת שירות מהבחן אשר חורגת ממתחם העונש ההולם וזאת על פי הפסיקה הקיימת. כידוע, המלצת שירות המבחן מובאת במכלול השיקולים שעל בית המשפט לשקול ואינה מחייבת (רע""פ 7596/18 שגיב נ' מ""י).",העונש המתאים לנאשם
"ת""פ 4788-09-15","ממסמכים שצירף הנאשם, במסגרת הטיעונים לעונש, ניתן ללמוד כי בדצמבר שנת 2016 פנה לקצין התגמולים במשרד הביטחון להכרה בו כנכה (נ/3), ואולם לא צירף הנאשם מסמך עדכני בעניין זה או  אישור על הכרה בו כנכה.",העונש המתאים לנאשם
"ת""פ 4788-09-15","לאור האמור, יש לקבוע את עונשו של הנאשם בחלקו התחתון של מתחם העונש ההולם, אם כי לא אמצא עמו את הדין, ולא אחמיר בעונשו מעבר לדרישת המאשימה.",העונש המתאים לנאשם
"ת""פ 4788-09-15","כפי שצויין לעיל, הנאשם לא נמצא מתאים לביצוע עבודות שירות בשל שימוש בסמים, אחרת היה מוטל עליו עונש של מאסר שירוצה בעבודות שירות. לפיכך העונש המתאים הוא בהטלת מאסר בפועל.",העונש המתאים לנאשם
"ת""פ 4788-09-15",אשר על כן אני גוזר על הנאשם את העונשים הבאים:,סוף דבר
"ת""פ 4788-09-15","שישה חודשי מאסר בפועל בניכוי ימי מעצרו. הנאשם יתייצב ביום 1.7.19 בשעה 08:30 בבית המעצר ""ניצן"" ברמלה.",סוף דבר
"ת""פ 4788-09-15","שישה חודשי מאסר על תנאי למשך שנתיים מיום שחרורו, שלא יעבור עבירה לפי סעיף 144 לחוק העונשין- התשל""ז -1977 או עבירה לפי פקודת הסמים המסוכנים [נוסח חדש] התשל""ג- 1973, מסוג פשע למעט החזקת סמים לצריכה עצמית.",סוף דבר
"ת""פ 4788-09-15","חודשיים מאסר על תנאי למשך שנתיים מיום שחרורו, שלא יעבור עבירה של החזקת סמים לצריכה עצמית או כלים לפי פקודת הסמים המסוכנים [נוסח חדש], התשל""ג- 1973.",סוף דבר
"ת""פ 4788-09-15",אני נמנע מהטלת קנס כספי בשל מצבו הכלכלי של הנאשם.,סוף דבר
"ת""פ 4788-09-15",מורה על השמדת הסמים וחילוט המוצג. ,סוף דבר
"ת""פ 4788-09-15",המזכירות תעביר העתק גזר הדין לשירות המבחן ולממונה על עבודות השירות.,סוף דבר
"ת""פ 4788-09-15",זכות ערעור לבית משפט המחוזי בירושלים בתוך 45 ימים מהיום.,סוף דבר
"ת""פ 4788-09-15","ניתן היום, 12.5.19 במעמד ב""כ המאשימה עו""ד מאיר לוברבאום ומתמחה צח דהן, הנאשם וב""כ עו""ד טליה רם.",סוף דבר
"ת""פ 4788-09-15",נוסח מסמך זה כפוף לשינויי ניסוח ועריכה,יצחק שמעוני 54678313
"ת""פ 4788-09-15","בעניין עריכה ושינויים במסמכי פסיקה, חקיקה ועוד באתר נבו – הקש כאן",יצחק שמעוני 54678313
