verdict,text,part
"ת""פ 39341-05-16","ת""פ 39341-05-16 מדינת ישראל נ' עלא אדין(עציר) ואח'",בית המשפט המחוזי בחיפה
"ת""פ 39341-05-16",כרים אבו סאלח,עדנאן עלא אדין
"ת""פ 39341-05-16",פאדי בשיר,עדנאן עלא אדין
"ת""פ 39341-05-16",חוסאם מריסאת (עציר),"    באמצעות ב""כ עו""ד סמארה"
"ת""פ 39341-05-16","תקנות ההגנה (שעת-חירום), 1945",חקיקה שאוזכרה: 
"ת""פ 39341-05-16","חוק העונשין, תשל""ז-1977",חקיקה שאוזכרה: 
"ת""פ 39341-05-16","תקנות ההגנה (שעת-חירום), 1945: סע'  84 (1) (א), (ב), 85 (1) (א), (ד)",חקיקה שאוזכרה: 
"ת""פ 39341-05-16","חוק העונשין, תשל""ז-1977: סע'  29, 144 (א), 499 (א) (1)",חקיקה שאוזכרה: 
"ת""פ 39341-05-16",גזר דין בעניינם של הנאשמים 2 עד 6 ,חקיקה שאוזכרה: 
"ת""פ 39341-05-16","הנאשמים 2 עד 6 הורשעו, עפ""י הודייתם ובמסגרת הסדר טיעון בעבירות ביטחון ועבירות אחרות. הודיית הנאשמים היתה בסיומו של הליך גישור אשר במסגרתו תוקן כתב האישום והצדדים הסכימו על ""הסדר טווחים"" לעניין העונש. הודיית הנאשמים היתה ב""שתי פעימות"" (בתאריך 17.5.16 ו 18.5.16) ולכן הוגשו שני כתבי אישום מתוקנים. מטעמי נוחות, אתייחס לשניהם ככתב אישום מתוקן אחד. הפרשה כללה 7 נאשמים (בשני הליכים נפרדים - ת.פ. 34130-01-15 כנגד הנאשמים 1, 3, 4 6 ו 7 שהתנהל (וממשיך להתנהל בעניינו של הנאשם 1) בפני כב' השופטת ד. סלע; ות.פ. 6438-02-15 כנגד הנאשמים 2 ו 5 שהתנהל בפני כב' השופטת ת. שרון-נתנאל) ונושאה, באופן כללי, הינו התאגדות הנאשמים במחצית השניה של שנת 2014 בהקשר לארגון דאע""ש (להלן: הארגון). אציין, כי הנאשם 1 אשר מוזכר בכתב האישום, ממשיך לנהל את משפטו; ודינו של הנאשם 7 אשר נכלל במסגרת ההסדר, נגזר זה מכבר. ",	כללי
"ת""פ 39341-05-16","הסדר הטיעון אליהם הגיעו הצדדים, היה כדלקמן:",	כללי
"ת""פ 39341-05-16","לגבי הנאשם 2,  סוכם כי המאשימה תעתור ל 6 שנות מאסר, בעוד הנאשם יעתור ל 4 שנות מאסר;",	כללי
"ת""פ 39341-05-16","לגבי הנאשם 3, סוכם כי המאשימה תעתור ל 4 שנות מאסר, בעוד הנאשם יעתור לשנתיים מאסר;",	כללי
"ת""פ 39341-05-16","לגבי הנאשם 4, סוכם כי המאשימה תעתור ל 4 שנות מאסר בעוד הנאשם יעתור לשנתיים מאסר;",	כללי
"ת""פ 39341-05-16","לגבי הנאשם 5, סוכם כי המאשימה תעתור ל 4 שנות מאסר בעוד שהנאשם יעתור לשנתיים מאסר;",	כללי
"ת""פ 39341-05-16","ולגבי הנאשם 6, סוכם כי המאשימה תעתור ל 4.5 שנות מאסר בעוד שהנאשם יעתור לשנתיים מאסר.",	כללי
"ת""פ 39341-05-16","בפרק המבוא של כתב האישום המתוקן נסקרו נתונים כללים אודות הארגון ואודות הכרזתו כהתאחדות בלתי מותרת על ידי שר הביטחון ביום 03.9.14. גם טרם ההכרזה היה הארגון בבחינת התאחדות בלתי מותרת מכח תקנות ההגנה (שעת חירום), 1945. מדובר בארגון בעל אידיאולוגית סלפית–ג'יהאדית התומכת בחזרה למקורות הראשוניים של האסלאם ובג'יהאד בכופרים – הן במשטרים מוסלמים שאינם שולטים על פי השריעה והן במדינות המערב, ביניהן ארצות הברית וישראל. הארגון בעל רמת איום גבוהה כלפי ישראל.",עיקרי כתב האישום המתוקן
"ת""פ 39341-05-16",הנאשם 1 הינו עורך דין המתגורר בנצרת ובעל חווה בכפר מנדא; הנאשמים 2 ו 3 הינם אחים ובני דודים של הנאשם 7; נאשם 4 מאורס לאחותם של הנאשמים 2 ו 3 והנאשם 5 הינו קרוב משפחתם של הנאשמים 2 ו 3  וכן חברם. הנאשמים 2-5 מתגוררים בסחנין. הנאשם 6 הינו תושב דיר חנא וחברם של נאשמים 3 ו 4 . ,עיקרי כתב האישום המתוקן
"ת""פ 39341-05-16","האישום הראשון והמרכזי נוגע לכלל הנאשמים שבענייננו (היינו הנאשמים 2 עד 6), ומתייחס לפעילות הנאשמים במסגרת הארגון. צוין, כי החל מתחילת שנת 2014 לערך, נהגו הנאשמים 2 עד 6 להיפגש באזור סכנין בתדירות גבוהה ולשוחח בנוגע לרעיונות הסלפיה–ג'יהאדיה ותמיכתם ברעיונות אלה, כאשר במהלך המפגשים היו חילוקי דעות בין תמיכה בארגון לבין תמיכה בארגון ג'בהאת אל נוסרה, שהוכרז אף הוא כהתאחדות בלתי מותרת על ידי שר הביטחון. במהלך חודש יוני 2014 הופרד הארגון מאל קאידה וזאת בעקבות נאומו של דובר הארגון – אל עדנאני – נאום במסגרתו הסית הלה את תומכי הארגון להרוג כופרים בין אם מדובר באנשי צבא או באזרחים. לאחר אותו נאום, החליטו הנאשמים 2 עד 6 כי הם תומכים בארגון ומצטרפים לארגון וכן המשיכו את המפגשים על רקע תמיכה זו. במועדים שונים  במהלך חודשים  יוני עד נובמבר 2014 נהגו בני החבורה להיפגש בתדירות גבוהה בשעות הערב וזאת אף לאחר הכרזת שר הביטחון על הארגון כהתאחדות בלתי מותרת. בסביבות חודש יוני 2014 הצטרף הנאשם 1 למפגשים וזאת לאחר שהנאשם 2 הכיר אותו בפייסבוק. מאותו שלב ואילך קיימו בני החבורה מפגשים בהרכב מלא או חלקי, שהתקיימו בשטחים מבודדים באזור סכנין. בחלק מהמפגשים השאירו בני החבורה את מכשירי הטלפון הסלולארי בכלי הרכב וזאת מחשש להאזנות. לאחר הכרזתו של שר הביטחון, שוחחו הנאשמים אודות ההכרזה ואודות הזהירות הנדרשת מהם מאותו שלב ואילך. במהלך המפגשים שוחחו הנאשמים אודות תמיכתם בארגון, אודות האידיאולוגיה של הארגון, דנו בשאלה מי נחשב כופר ומה עליהם לעשות בנוגע לכך.",עיקרי כתב האישום המתוקן
"ת""פ 39341-05-16","הנאשם 2 סיפר לנאשמים 4 ו 6 אודות פעילי הארגון, תושבי ישראל, שיצאו להילחם בסוריה והנאשמים 3 ו 4 הביעו מחשבות לצאת לסוריה ולהילחם לצד הארגון. בהמשך, במהלך חודש יולי 2014 החליט הנאשם 2 לצאת לסוריה דרך טורקיה כדי להצטרף לארגון ללחימה נגד השלטון בסוריה. הנאשם 2 רכש לצורך כך כרטיס טיסה ואף שיתף את הנאשמים 1, 3, 4 ו 6 אודות כוונותיו. על רקע זה, מסר הנאשם 1 לנאשם 2 פרטים אודות אחרים שיוכלו לסייע לו להגיע לסוריה והנאשם 2 יצר קשר עם אחד מאותם אחרים. כמו כן, הנאשמים 4, 5 ו 6 אף מסרו לנאשם 3 סכום כסף כדי שהלה יעביר אותו לנאשם 2 לצורכי הנסיעה.",עיקרי כתב האישום המתוקן
"ת""פ 39341-05-16","בהמשך למתואר לעיל, ולאחר שהנאשם 2 סיפר כי הוא מתקשה לעמוד במראה דם, ביצעו הנאשמים 2, 3 ו 4 שחיטה של כבשים בהדרכת הנאשם 1, סמוך לחג איד אל פיטר ובין היתר על מנת ""לחזק את הלב"" למקרה שיצטרכו להילחם.",עיקרי כתב האישום המתוקן
"ת""פ 39341-05-16","בתאריך 30.7.14 הגיע הנאשם 2 לנתב""ג לצורך יציאתו לסוריה, אולם עוכב על ידי השב""כ ויציאתו נמנעה. לאחר מכן, המשיך הנאשם 2 להיפגש עם יתר בני החבורה ולדון בנושאים הקשורים לארגון כשהאחרונים יודעים שיציאתו נמנעה, כאמור לעיל.",עיקרי כתב האישום המתוקן
"ת""פ 39341-05-16","במועדים שונים הנאשמים 2, 3 4 ו 6 העבירו ביניהם סרטונים הקשורים לפעילות הארגון.",עיקרי כתב האישום המתוקן
"ת""פ 39341-05-16","בתאריך 22.8.14 או בסמוך לכך במהלך אחד המפגשים בחווה שבבעלות הנאשם 1, הסביר הלה לנאשמים 2, 3 , 4 ו 6 כיצד מכינים בקבוק תבערה וכיצד משתמשים בו לעת הצורך.",עיקרי כתב האישום המתוקן
"ת""פ 39341-05-16","עוד צוין, כי הנאשמים 1 עד 4 החזיקו חפצים וסמלים המזוהים עם הארגון. כך, ענד הנאשם 2 מספר פעמים טבעת עם סמל המזוהה עם הארגון וכן הציג פרסומים במחשב הקשורים לארגון; הנאשם 3 החזיק דגל והנאשם 4 החזיק 2 סמלים.",עיקרי כתב האישום המתוקן
"ת""פ 39341-05-16","באישום זה הורשעו הנאשמים בעבירה של חברות ופעילות בהתאחדות בלתי מותרת, לפי תקנות 84 (1) (א) + (ב) + 85 (1) (א), (ד), לתקנות ההגנה (שעת חירום) 1945 + סעיף 29 לחוק העונשין, תשל""ז – 1977.",עיקרי כתב האישום המתוקן
"ת""פ 39341-05-16","האישום השני נוגע לנאשם 2 בלבד – בהמשך לפעילותו של הנאשם שתוארה באישום הראשון, במהלך מחצית 11/14 או בסמוך לכך, גמלה בלבו החלטה לבצע פיגוע בישראל נגד אנשי ביטחון ודרוזים תוך שימוש בנשק חם. לשם קידום תכניתו, פנה הנאשם 2 אל ידידו מועתז גנאים (להלן: מועתז) וביקש ממנו שיסייע בידו לרכוש רובה מסוג קלצ'ניקוב. מועתז פנה בנדון לאיברהים שלעטה וביקשו להשיג עבור הנאשם 2 רובה מסוג קרל גוסטב אולם הנאשם 2 אמר כי אינו מעוניין בנשק שכזה מאחר ואינו מדויק, והתעקש על רכישת רובה מסוג קלצ'ניקוב ובנדון אמר למועתז שיפעל להשגת סכום של 30,000 ₪ לצורך ביצוע עסקת הנשק. ",עיקרי כתב האישום המתוקן
"ת""פ 39341-05-16","באישום זה הורשע הנאשם 2 בעבירות של קשירת קשר לפשע (רכישת נשק), לפי סעיף 499 (א) (1) לחוק העונשין וכן ניסיון רכישת נשק והחזקתו, לפי סעיף 144 (א) רישא + סיפא לחוק העונשין.",עיקרי כתב האישום המתוקן
"ת""פ 39341-05-16","התסקיר בעניינו של הנאשם 2 – הנאשם  בן 23 שנים, בוגר 12 שנות לימוד, נעדר עבר פלילי, רווק, המתגורר בבית הוריו בסכנין אשר עבד בתחום הריצוף עובר למעצרו. שירות המבחן עמד על הרקע המשפחתי בו גדל ובהקשר זה הפנה לכך כי אביו ריצה מספר מאסרים, היה מכור לסמים ונקט באלימות כלפי בני המשפחה. הנאשם נטל אחריות חלקית למעורבות בעבירות שיוחסו לו וטען כי מטרת הצטרפותו לארגון היתה לסייע לאזרחים חפים מפשע בסוריה על רקע האירועים שם ובהקשר לאישום 2 טען כי התכוון לרכוש את הנשק על רקע הקונפליקט בין הדרוזים למוסלמים וככלי להפחדה והטלת מורא ללא כוונה לעשות בו שימוש. שירות המבחן התרשם כי חרף הצהרותיו לעיל, מה שעומד בבסיס העבירות הינן עמדות אידיאולוגיות נוקשות והעריך כי מדובר במי שסובל מדימוי עצמי נמוך ומעבר למניעיו האידיאולוגיים מעורבותו נובעת בין היתר גם מחיפוש אחר תחושת כח וביטחון אשר נעדרו בנסיבות בהן גדל. מדובר בבעל אישיות בלתי בשלה, נתון שבשילוב המרכיבים האידיאולוגיים, מגביר את הסיכון להישנות עבירות דומות. לאור האמור לעיל ולנוכח חומרת העבירות, לא הובאה כל המלצה עונשית או טיפולית.",תסקירי שירות המבחן 
"ת""פ 39341-05-16","התסקיר בעניינו של הנאשם 3 – הנאשם בן 31, בוגר 10 שנות לימוד, נשוי, אב לילד בן 5 ואשתו בהיריון. עובר למעצרו עבד בעבודות ריצוף יחד עם אחיו (הנאשם 2) ולכן הרקע המשפחתי של השניים זהה. צוין, כי על רקע תפקודו הבעייתי של האב, נטל הנאשם כבר מגיל צעיר אחריות כלכלית וחברתית על משפחתו. הנאשם נטל אחריות על ביצוע המעשים המיוחסים לו וייחס זאת לקרבתו לדת והעדר דמות אבהית תומכת ומדריכה. עוד טען, כי נגרר אחר אחיו בהתנהלות הבעייתית. הנאשם אישר כי מאז נולד בנו הוא מקיים אורח חיים דתי אך שלל מעורבות דתית קיצונית וכן הכחיש שפעילותו נבעה מרצון לפגוע בביטחון המדינה. הנאשם הביע צער וחרטה כנים על מעשיו – נתונים שעלו הן בשיחה עם קצינת המבחן והן ממידע שנאסף לאחר מעצרו באיזוק. שירות המבחן התרשם מאדם שניהל לרוב אורח חיים נורמטיבי ללא קיומם של דפוסים עבריינים מושרשים אשר הצליח לשתף בעולמו הפנימי הרגשי. צוין, כי קיימים יסודות בריאים בתפקודו, כפי שבא לידי ביטוי בנשיאה בנטל המשפחתי ובהכרה בפסול שבמעשיו. יחד עם זאת, לנוכח חומרת העבירות לא הובאה המלצה על חלופת ענישה, הגם שהומלץ על שילובו של הנאשם בהליך טיפולי בין כותלי הכלא.",תסקירי שירות המבחן 
"ת""פ 39341-05-16","התסקיר בעניינו של הנאשם 4 – הנאשם בן 28, בוגר 12 שנות לימוד, נעדר עבר פלילי, מאורס. לאחר לימודיו עבד וכן למד במכינה בטכניון לשיפור ציוניו ובהמשך למד באיטליה הנדסת מכונות אך בשנת 2013 גורש מאיטליה על רקע קשר עם בחור שהצטרף לארגון בסוריה. לאחר חזרתו לארץ,  עבד בעבודות בנין עד למעצרו הנוכחי. הנאשם הגיע מרקע משפחתי נורמטיבי - אביו עורך דין וכיהן בעבר כראש מועצת סכנין, אמו בעלת חנות בגדים, אחיו הגדול עורך דין ואחותו הצעירה סטודנטית לרפואה בחו""ל. הנאשם מסר כי נעצר שבועיים לפני חתונתו המתוכננת וחרף מעצרו הקשר בינו לבין ארוסתו נותר הדוק וחם. לדבריו, הוא מתכוון להינשא לאחר שחרורו. הנאשם נטל אחריות פורמלית על מעשיו וטען כי לא התעניין באידיאולוגיה של הארגון אך תמך בו משום שהגיע למסקנה שזהו הארגון הדומיננטי במלחמה במשטר הסורי. עוד ציין, כי ברקע למעשיו עמד תהליך הדרגתי של חזרה בתשובה שהחל עוד בהיותו באיטליה. עוד ציין, כי הפסקת לימודיו באיטליה ובהמשך לכך חקירתו בשב""כ לאחר שגורש מאיטליה היו עבורו מכה קשה שיתכן ודחפה אותו לפעילות בארגון. יחד עם זאת, שלל דפוסי חשיבה קיצוניים וציין כי חרף לבטיו לנסוע לסוריה, הוא הגיע למסקנה, עוד טרם מעצרו, כי עליו להשקיע בחיי משפחתו ובעתידו המקצועי. שירות המבחן ציין כי הנאשם התקשה להתבונן בצורה מעמיקה במעשיו ולקח עליהם אחריות פורמלית שמזערה חלקים שונים בהתנהגותו. עוד התרשם שירות המבחן, שהנאשם התקשה להתייחס לחלקים מורכבים באישיותו. לכן, על רקע, מחד, נתוניו החיוביים של הנאשם והבעת רצונו לנהל חיי משפחה והתפתחות מקצועית, ומנגד, התייחסותו ההגנתית והקושי שלו להתבונן בצורה אותנטית ומעמיקה במעשיו, העריך שירות המבחן כי קיים סיכון להישנות התנהגות דומה בעתיד. כן צוין, כי הנאשם יתקשה מהפקת תועלת מקשר טיפולי. משכך, לא הובאה המלצה לחלופה עונשית.",תסקירי שירות המבחן 
"ת""פ 39341-05-16","התסקיר בעניינו של הנאשם 5 – הנאשם בן 29, רווק, לחובתו הרשעה בעבירת בנייה ללא היתר. הנאשם סיים לימודי רוקחות בירדן, לאחר מכן חזר ארצה, השתלב בעבודות בנייה בסכנין ובמקביל למד לקראת בחינת משרד הבריאות. כחודשיים טרם מעצרו החל את התמחותו ברוקחות באילת. בבעלות משפחתו חנות תכשיטים בסכנין ומשפחתו נורמטיבית ותומכת. הנאשם לקח אחריות על מעשיו ומסר כי ניהל אורח חיים דתי. עוד מסר כי בהיותו בירדן נחשף לגורל הפליטים הסורים ולסבל שנגרם להם על ידי המשטר בסוריה ולכן ראה בארגון ככזה שיכול לסייע לאנשים אלה. הנאשם שלל כוונה לפגוע בביטחון המדינה וטען שאינו דוגל באלימות. עוד  מסר שהבין כי התנהלותו חצתה קווים ופגעה בביטחון המדינה. מנתונים שהתקבלו מהקבוצה הטיפולית בה שולב עת היה מצוי באיזוק אלקטרוני, עלה כי הנאשם התקשה לגלות חיבור רגשי לחומרת מעשיו, הגם שמסר שהוא פיתח עמדה ביקורתית כלפי מעשי הארגון אשר לדבריו אינם משקפים את עמדותיו. שירות המבחן התרשם כי הנאשם נמצא בשלבי גיבוש זהותו הבוגרת. מדובר באדם אינטליגנטי אשר ניהל אורח חיים נורמטיבי ללא דפוסים עבריינים מושרשים. מנגד, מדובר במי שעלול להיגרר לסיטואציות שליליות, בעיקר כאלה על רקע אידיאולוגי סביב הדת. לנוכח חומרת העבירות ולאור האמור לעיל, לא הובאה כל המלצה על חלופה עונשית. הומלץ כי הנאשם ישולב בהליך טיפולי בין כותלי הכלא.",תסקירי שירות המבחן 
"ת""פ 39341-05-16","התסקיר בעניינו של הנאשם 6 – הנאשם בן 31, רווק, בוגר 12 שנות לימוד, התגורר עובר למעצרו בבית הוריו בדיר חנא וכן למד לימודי הנדסאי בנין במכללת סכנין. הרקע של משפחתו נורמטיבי - אביו משמש כמורה בבית ספר תיכון ואמו הינה מורה לעברית בבית ספר יסודי. שירות המבחן הפנה להרשעתו של הנאשם משנת 2005 בעבירות נשק כאשר הרקע לכך, כפי שיורחב, הינו ביטחוני. בגין הרשעתו זו נדון הנאשם למאסר לתקופה של 21 חודשים. שירות המבחן ציין כי הנאשם התקשה בקבלת אחריות על מעשיו וטען כי המפגשים בהם נטל חלק היו חברתיים בעיקרם ועל רקע המשבר בסוריה. הנאשם שלל מניעים אידיאולוגיים ודתיים. שירות המבחן התרשם כי בבסיס העבירה קיימות עמדות ותפיסות אידיאולוגיות נוקשות וכן הפנה לכך כי חרף המאסר שנגזר עליו בעבר, הדבר לא מנע ממנו את ביצוע העבירה הנדונה. כל אלה, והחזרתיות בביצוע עבירות על רקע דומה, מעידים על סיכון להישנות מעורבות בעבירות דומות בעתיד. לכן, לא הובאה כל המלצה.",תסקירי שירות המבחן 
"ת""פ 39341-05-16","במסגרת ראיות המאשימה לעונש הוגשו פלטי הרישום הפלילי של הנאשם 3 (לנ""ל יש הרשעה בעבירות של העסקת והסעת תושב זר משנת 2013 בגינה נדון למאסר על תנאי); של הנאשם 5 (לנ""ל יש הרשעה בביצוע עבודה  ללא היתר משנת 2014 בגינה נדון לקנס והתחייבות).",ראיות המאשימה לעונש
"ת""פ 39341-05-16","בהקשר לנאשם 6 – כפי שצוין לעיל בהתייחס לתסקיר שירות המבחן, לנ""ל הרשעה מבית המשפט המחוזי בירושלים (פ""ח 826/05 מתאריך 21.7.05), בגינה הורשע בעבירות של קשירת קשר וניסיון לעבור עבירות בנשק. כפי שעולה מעיון בגזר הדין (ת/3 א' – אציין כי פרטי הרישום בפלט הרישום הפלילי ת/3 הינם שגויים), הגם שמדובר ""רק"" בעבירות נשק וקשירת קשר, הרקע להן הינו ביטחוני. בכתב האישום המתוקן באותו הליך צוין, כי במהלך שנת 2004 נהג הנאשם לשוטט באתרי אינטרנט העוסקים בטרור בינלאומי ובטרור במדינת ישראל וגילה ענין באתרים של ארגון אל קאידה ושל ארגוני טרור בישראל וכן באופן הכנת מטעני חבלה ובהתמודדות ארגוני טרור אל מול גורמי ביטחון ממשלתיים שונים. בהמשך לכך, התכתב הנאשם בדואר האלקטרוני עם אנשים אחרים אשר הביעו הזדהות עם תכני האתרים לעיל. הנאשם אגר חומר אודות הרכבת חומרי נפץ ומטעני חבלה וכן הסתיר חומר זה (ניירת ודיסקים) במקומות מסתור. בנוסף, תכנן הנאשם במהלך 2004 להקים חוליה שתבצע פעילות צבאית שמטרתה ביצוע פיגועי טרור בתוך מדינת ישראל. לשם כך, החליט לגייס מספר אנשים צעירים. עוד ניסה, במהלך המחצית השניה של 2004, לייצר חומרי חבלה מסוגים שונים באמצעות חומרי גלם שרכש ובהתאם להוראות שהוציא מאתרי אינטרנט שונים והכל במטרה להכין תשתית לחומרי חבלה שישמשו לפעילות טרור ומתוך כוונה לסייע לאויבי המדינה. במהלך ינואר 2005 נסע הנאשם למסגד אל אקצה ופגש שם אדם אחר עמו שוחח על פעילות ארגון אל קאידה. השניים המשיכו לשמור על קשר טלפוני וקשר בדואר האלקטרוני ואף נפגשו מספר פעמים במסגד אל אקצא, עד שנעצרו בתאריך 13.2.05. במהלך המפגשים הם קשרו קשר לבצע פעילות שיש בה סיוע לארגוני טרור במלחמתם נגד ישראל. אותו אחר אף הציע לנאשם להצטרף לחוליה אותה הקים ואליה גייס מספר אנשים והנאשם הסכים לכך ואף נשבע לסור למרותו של אותו אחר ביודעו שמדובר בחוליה שמטרתה ביצוע מעשי טרור כנגד אזרחי המדינה. באותו הליך תוקן כתב האישום, ולו מבחינת העבירות שבו, על רקע קשיים ראייתיים שונים ובכלל זאת הרצון להימנע מחשיפת ראיות חסויות. במסגרת ההסדר אליו הגיעו הצדדים באותו תיק, סוכם על הסדר עונשי ""סגור"" של 21  חודשים, וכך היה. ",ראיות המאשימה לעונש
