verdict,text,part
"ת""פ 37900-06-22","ת""פ 37900-06-22 מדינת ישראל נ' אלבוייראת (עציר) ואח'",בית המשפט המחוזי בחיפה
"ת""פ 37900-06-22","ת""פ 37900-06-22 מדינת ישראל נ' אלבוייראת (עציר) ואח'",בית המשפט המחוזי בחיפה
"ת""פ 37900-06-22", לפני:                                        כבוד השופט אינאס סלאמה ,08 אפריל 2025
"ת""פ 37900-06-22", לפני:                                        כבוד השופט אינאס סלאמה ,08 אפריל 2025
"ת""פ 37900-06-22", לפני:                                        כבוד השופט אינאס סלאמה ,08 אפריל 2025
"ת""פ 37900-06-22","ע""י ב""כ עוה""ד עאדל בויראת",מוחמד אלבוייראת (עציר)
"ת""פ 37900-06-22","ע""י ב""כ עוה""ד אחמד חמזה יונס",חדית אלבוריאת (עצור בפיקוח אלקטרוני)
"ת""פ 37900-06-22","ע""י ב""כ עוה""ד בדר אגבריה",מחמוד בוריאת (עציר)
"ת""פ 37900-06-22","ע""י ב""כ עוה""ד עאדל בויראת",מוחמד אלבוייראת (עציר)
"ת""פ 37900-06-22","ע""י ב""כ עוה""ד אחמד חמזה יונס",חדית אלבוריאת (עצור בפיקוח אלקטרוני)
"ת""פ 37900-06-22","ע""י ב""כ עוה""ד בדר אגבריה",מחמוד בוריאת (עציר)
"ת""פ 37900-06-22","ע""י ב""כ עוה""ד עאדל בויראת",מוחמד אלבוייראת (עציר)
"ת""פ 37900-06-22","ע""י ב""כ עוה""ד אחמד חמזה יונס",חדית אלבוריאת (עצור בפיקוח אלקטרוני)
"ת""פ 37900-06-22","ע""י ב""כ עוה""ד בדר אגבריה",מחמוד בוריאת (עציר)
"ת""פ 37900-06-22","חוק העונשין, תשל""ז-1977: סע'  29, 144(א), 144(ב), 144(ב2), 40יא, 40יג",חקיקה שאוזכרה: 
"ת""פ 37900-06-22",עניינו של הליך זה בשלושה נאשמים אשר יוחסו להם עבירות בנשק. הנאשמים כולם הודו במסגרת הסדר טיעון בעובדות כתב אישום מתוקן שהוגש בעניינם.,בעניינם של נאשמים 1 ו- 3
"ת""פ 37900-06-22","נאשם מס' 1 (להלן: ""נאשם 1"") הורשע בגדרי האישום הראשון, בעבירות בנשק (רכישה והחזקה) - עבירה לפי סעיף 144(א) רישא לחוק העונשין, התשל""ז-1977 (להלן: ""החוק""), ובנשיאת נשק - עבירה לפי סעיף 144(ב) רישא לחוק. בגדרי האישום השני, הורשע נאשם 1 בעבירות בנשק (רכישה והחזקה) - עבירה לפי סעיף 144(א) רישא + 29 לחוק.",בעניינם של נאשמים 1 ו- 3
"ת""פ 37900-06-22","נאשם מס' 3 (להלן: ""נאשם 3"") הורשע בגדרי האישום הראשון, בעבירות בנשק (רכישה והחזקה) - עבירה לפי סעיף 144(א) רישא לחוק, בנשיאת נשק - עבירה לפי סעיף 144(ב) רישא לחוק, וכן בעבירות בנשק (עסקה בנשק) - עבירה לפי סעיף 144(ב2) לחוק. בגדרי האישום השני, הורשע נאשם 3 בעבירות בנשק (רכישה והחזקה) - עבירה לפי סעיף 144(א) רישא + 29 לחוק.",בעניינם של נאשמים 1 ו- 3
"ת""פ 37900-06-22","למען שלמות התמונה יצוין, כי נאשם מס' 2 (להלן: ""נאשם 2"") הודה גם הוא בעובדות כתב האישום המתוקן. בכל הנוגע לחלקו בעבירות המנויות באישום הראשון, בהיות נאשם 2 קטין בעת ביצוע חלק מהמעשים המתוארים באישום זה, נקבע כי הוא ביצע את העבירות המיוחסות לו בכתב האישום המתוקן באישום זה. בנוסף, נאשם 2  הורשע בביצוע עבירת התקהלות אסורה, המנויה באישום השלישי. נאשם 2 הופנה אל שירות המבחן לקבלת תסקיר בעניינו, וגזר דינו יינתן בהמשך.",בעניינם של נאשמים 1 ו- 3
"ת""פ 37900-06-22","כתב האישום המתוקן, אשר עובדותיו יובאו בעיקרן להלן, מגולל שני אישומים ביחס לכל אחד מהנאשמים דלעיל. באישום הראשון, המיוחס לשלושת הנאשמים, מצוין כי הנאשמים מכירים זה שנים.",כתב האישום המתוקן
"ת""פ 37900-06-22","במהלך שנת 2019, נאשם 3 קיבל ממכרו נשק מסוג תת מקלע קרלו אשר סוגל לירות כדור שבכוחו להמית אדם (להלן: ""קרלו""), וכן מחסנית ריקה מכדורים שמהווה אבזר לנשק (להלן: ""המחסנית""). נאשם 3 עטף את הקרלו בניילון נצמד והסתירו סמוך לאצטדיון באום אל פחם.",כתב האישום המתוקן
"ת""פ 37900-06-22","בחלוף חצי שנה לערך, במהלך השנים 2020-2019, על רקע חוב כספי של נאשם 3 לנאשם 1, סיכמו הנאשמים כי נאשם 3 יעביר לנאשמים 1 ו-2 את הקרלו. לצורך ביצוע העסקה, קבעו הנאשמים להיפגש ליד אחת השכונות באום אל פחם. הנאשמים הגיעו אל מקום המפגש בשעות הלילה, כשנאשם 3 נושא ומוביל איתו את הקרלו ואת המחסנית, אותם לקח ממקום המסתור, וכן קופסת כדורי תחמושת המותאמים לקרלו ושבכוחם להמית אדם (להלן: ""התחמושת"". הקרלו, המחסנית והתחמושת יחד, להלן: ""הנשק"").",כתב האישום המתוקן
"ת""פ 37900-06-22","נאשם 3 העביר את הנשק לחזקת הנאשמים 1 ו-2, אשר החזיקוהו בצוותא חדא. בהמשך, נאשמים 1 ו-2 נסעו מהמקום ברכב, כשהם נושאים ומובילים עימם את הנשק לביתו של נאשם 2, שם נאשם 2 נטל את הקרלו והמחסנית והסתירם בסמוך לביתו.",כתב האישום המתוקן
"ת""פ 37900-06-22","בגדרי האישום השני, מפורט כי בין שנת 2020 לבין המחצית הראשונה של שנת 2021, סיכמו נאשמים 1 ו-3 לרכוש בשותפות נשק מסוג רובה סער M16 (להלן: ""M16""). בתקופה המתוארת, במועד שאינו ידוע למאשימה במדויק, רכשו נאשמים 1 ו-3 בצוותא חדא, ממכר שלהם, M16 שסוגל לירות כדור אשר בכוחו להמית אדם, והחזיקו אותו בצוותא חדא במקום מסתור סמוך לביתו של נאשם 3.",כתב האישום המתוקן
"ת""פ 37900-06-22","המאשימה סבורה, כי כל אחד מן האישומים מהווה אירוע שונה, שכן מדובר במועדים שונים בפער זמנים זה מזה, והעיסוק הוא בשני כלי נשק שונים. משכך, טוענת המאשימה כי יש לקבוע מתחם עונש נפרד ביחס לכל אחד מהאישומים. ממשיכה המאשימה וטוענת, כי במעשי הנאשמים נפגעו הערכים החברתיים של שלום הציבור ובטחונו, וכן שמירה על שלטון החוק. לטענתה, תופעת החזקת ונשיאת הנשק הבלתי חוקי, הפכה למכת מדינה של ממש, ועל בית המשפט להילחם בתופעה באמצעות ענישה מחמירה ושלילת חירות לתקופה ממושכת. עוד עמדה המאשימה על הסכנות הגלומות בסחר בלתי חוקי בנשק; על פוטנציאל הסיכון הרב הנובע מעבירות נשק, הן במישור הפלילי והן במישור הבטחוני; על מגמת ההחמרה בענישה בשנים האחרונות, ועל הצורך בהרתעת הנאשמים ושכמותם. המאשימה סבורה כי מדובר בעבירות הנעשות במחשכים וקשה לחשפן, ומשכך הפיתוי לבצען רב.",טענות הצדדים
"ת""פ 37900-06-22","נסיבה נוספת לחומרה היא, כי בעוד במהלך החקירה הקרלו אותר, ה- M16לא אותר ולא ידוע לאילו ידיים עבר ומה היקף הנזק אשר ייגרם מהשימוש שייעשה בו. המאשימה הפנתה גם להנחיית פרקליט המדינה 9.16 בדבר מדיניות התביעה בנוגע לענישה בעבירות נשק, וכן לתיקון 140 לחוק הקובע כהוראת שעה עונש מזערי בעבירות נשק. בעניין אחרון זה ציינה המאשימה, כי התיקון אינו חל בענייננו, אך יש בו ללמד על רצון המחוקק בנוגע להחמרה בעונש. עוד הפנתה המאשימה לשורה של פסקי דין על מנת ללמד על מדיניות הענישה הנוהגת.",טענות הצדדים
"ת""פ 37900-06-22","בבחינת הנסיבות אשר אינן קשורות בביצוע העבירה, ציינה המאשימה כי הנאשמים הודו בעובדות כתב האישום המתוקן לאחר קיומן של מספר ישיבות הוכחות. בכך, הנאשמים חסכו זמן שיפוטי ניכר, אך הדבר אינו דומה להודאה בהזדמנות הראשונה. בנוגע לנאשם 1, עמדה המאשימה על כי הוא יליד שנת 1995, וכי אין לחובתו רישום פלילי קודם. בנוגע לנאשם 3, ציינה המאשימה כי הוא יליד 1992, וגם לחובתו אין רישום פלילי קודם.",טענות הצדדים
"ת""פ 37900-06-22","בשים לב לטיעוניה אלו ועוד, המאשימה עתרה לקביעת המתחמים שיפורטו להלן; בנוגע לנאשם 1 - מתחם הנע בין 32 ל-60 חודשי מאסר בגין האישום הראשון, ומתחם הנע בין 24 ל-48 חודשי מאסר בגין האישום השני. בנוגע לנאשם 3 - מתחם הנע בין 60 ל-84 חודשי מאסר בגין האישום הראשון, ומתחם הנע בין 24 ל-48 חודשי מאסר בגין האישום השני. בנתוני הנאשמים, עתרה המאשימה להעמיד את עונשם ברף הבינוני-תחתון של כל אחד מהמתחמים, וכי העונשים יצטברו זה לזה, ולו באופן חלקי. עוד עתרה המאשימה לענישה בדמות מאסר ממושך על תנאי.",טענות הצדדים
"ת""פ 37900-06-22","סנגורו של נאשם 1 סבור, כי יש לראות את שני האירועים כמסכת עובדתית אחת, שכן יש זהות בין כלי הנשק ואף סמיכות זמנים בין האירועים אשר פרק זמן של חצי שנה מפריד ביניהם. הסנגור סבור, כי יש ""לגזור דינם של הנאשמים ברוח הפסיקה שהייתה לפני 5 שנים, העבירות נשוא כתב האישום המתוקן בוצעו בשנים 20,19 ... יוער, כי בעניין זה המאשימה טענה שמדובר ""על עבירות שאולי התגלו בשלב מאוחר"", ולא על שיהוי בהגשת כתב האישום. הסנגור הפנה ופרט שורה של פסקי דין, וטען כי ""כאשר דובר בעבירה של נשיאה והובלה, ...",טענות הצדדים
"ת""פ 37900-06-22","בכל הנוגע לנאשם עצמו, נטען כי נאשם 1 בן 28, נשוי, אב ל-3 ילדים בגילאי שנה וחצי עד ארבע שנים. קודם מעצרו, עבד כקבלן משנה בהתקנת פיגומים. אביו נפטר במהלך ניהול ההליך ממחלת הסרטן, בהיותו בן 53 שנים. עובדה זו, כך נטען, מעבירה את נטל פרנסת המשפחה על שכמו של הנאשם, בהיות שני אחיו חולים, האחד בסכרת נעורים ולשני מחלת לב מלידה. הנאשמים לקחו אחריות על עובדות כתב האישום המתוקן וחסכו שמיעת חלק נכבד מהעדים. עוד טען סנגורו של נאשם 1, כי בעקבות שמיעת הראיות החלקית בוצע תיקון משמעותי בכתב האישום שכלל מחיקה של עבירות משני האישומים. נאשם 1 נמצא במעצר מיום 18.5.2022, ולא ביקש להשתחרר לחלופה.",טענות הצדדים
"ת""פ 37900-06-22","בשים לב לטיעוניו אלו ועוד, עתר הסנגור להסתפק בתקופת המעצר בה נתון נאשם 1, המגעת כמעט לכדי שנתיים.",טענות הצדדים
"ת""פ 37900-06-22","סנגורו של נאשם 3 סבור אף הוא, כי יש לגזור את דין הנאשמים ""לפי הדין ביום ביצוע המעשה"" (ובכל הנוגע לאישום הראשון מדובר לטענתו בשנת 2019), ולא לפי הדין החל כיום, אחרת יהא הדבר ""מנוגד לחוק העונשין, מונהג להלכה הפסוקה של בית המשפט העליון"". הסנגור הדגיש, כי במהלך השנים 2019, 2020, נאשם 3 העביר ללא תמורה את הקרלו והתחמושת לנאשמים 1 ו-2. מרגע זה הקשר של נאשם 3 לקרלו פסק. היה זה ""לפני 3-4 שנים"". סנגורו של נאשם 3 סבור אף הוא כי מדובר באירוע אחד, שכן מדובר בשני אישומים שעניינם נשק; המעורבים באישום השני הם חלק מהמעורבים באישום הראשון, ופער הזמנים בין המעשים אינו משמעותי. בכל הנוגע למדיניות הענישה הנוהגת, סנגורו של נאשם 3 ביקש לאבחן את הפסיקה אליה הפנתה המאשימה. כמו כן, ביקש הוא להצטרף לפסיקה אליה הפנה סנגורו של נאשם 1, ואף הפנה הוא לשני גזרי דין נוספים.",טענות הצדדים
"ת""פ 37900-06-22","אשר לניהול חלקו של ההליך, טען סנגורו של נאשם 3 כי רק לאחר שנשמעו חלק מעדי התביעה, החלה להתבהר התמונה גם למאשימה ותוקן כתב האישום באופן מהותי בנוגע לעובדות כתב האישום וסעיפי העבירה. זאת ועוד, וגם בשלב בו הודו הנאשמים נחסכה שמיעת שורה ארוכה של עדי תביעה, לרבות חוקרי שב""כ. בנוסף נטען, כי הנאשמים מביעים חרטה אמיתית וכנה ביחס לביצוע המעשים על ידם.",טענות הצדדים
"ת""פ 37900-06-22","בכל הנוגע לנסיבות המעצר, פרט סנגורו של נאשם 3, כי נאשם זה נעצר 3 ימים לפני חתונתו, יממה לפני מסיבת החינה המיועדת של הכלה. נאשם 3 היה נתון במעצר באגף בטחוני. הוא מוחזק במעצר עד תום ההליכים, למעט תקופה של כשלושה שבועות בה היה נתון במעצר בפיקוח אלקטרוני, על מנת שיוכל לראות את אמו שעברה ניתוח קשה. מדובר בנאשם שאין לו עבר פלילי, ואשר עבד בעבודות בניין קודם לכן.",טענות הצדדים
"ת""פ 37900-06-22","בשים לב לטיעוניו אלו ועוד, עתר סנגורו של נאשם 3 להסתפק בתקופת מעצרו של נאשם 3, ולחילופין כי עונש המאסר בפועל אשר יושת עליו לא יעלה על 24 חודשים.",טענות הצדדים
"ת""פ 37900-06-22","לקראת חתימת הדיון, אמרו הנאשמים את דברם. נאשם 1 הביע צער על מעשיו, והוסיף כי ""אני אבא ל-3 ילדים ואני מקווה שבית המשפט יעזור לי ויסייע לי לסיים את המאסר ואני מאוד מצטער על מה שעשיתי. נאשם 3 אמר כך: ""...",דבר הנאשמים
"ת""פ 37900-06-22","העיקרון המנחה בגזירת הדין הוא קיומו של יחס הולם בין חומרת העבירה בנסיבותיה ומידת אשמו של הנאשם העומד לדין, לבין סוג העונש שיוטל עליו ומידתו.",דיון והכרעה
"ת""פ 37900-06-22","בעת קביעת מתחם עונש הולם לעבירה שביצע נאשם בפלילים, על בית המשפט להתחשב בערך החברתי שנפגע מביצוע העבירה, במידת הפגיעה בו, במדיניות הענישה הנהוגה ובנסיבות הקשורות בביצוע העבירה.",דיון והכרעה
"ת""פ 37900-06-22","לאחר קביעת מתחם העונש ההולם, יפנה בית המשפט לאתר את העונש המתאים לנאשם בגבולות המתחם שנקבע, תוך התייחסות לנסיבות אשר אינן קשורות בביצוע העבירה. בית המשפט רשאי לחרוג ממתחם העונש שקבע הן לקולא - משיקולי שיקום, והן לחומרה - משיקולי הגנה על שלום הציבור.",דיון והכרעה
"ת""פ 37900-06-22","טרם ניגש למלאכת קביעת מתחם העונש ההולם והשתת העונש הראוי על כל אחד מהנאשמים, יש להכריע תחילה האם כלל המעשים המיוחסים לנאשמים 1 ו-3 מהווים ""אירוע אחד"", בגינם יש לקבוע מתחם עונש אחד ויחיד, כפי עתירת הסנגורים, או שמא כל אחד משני האישומים מהווה אירוע שונה המצדיק קביעת מתחם ענישה נפרד, כפי עתירת המאשימה.",דיון והכרעה
"ת""פ 37900-06-22","סעיף 40יג לחוק, שכותרתו ""ריבוי עבירות"", קובע, כי על בית המשפט אשר מרשיע נאשם במספר עבירות, ליתן דעתו לשאלה האם עסקינן באירוע אחד או בכמה אירועים. פסיקת בית המשפט העליון התוותה את המבחן בדבר קיומו של ""קשר הדוק"" בין העבירות, אשר יסייע לצורך הקביעה אם יש לסווגן כאירוע אחד אם לאו. נקבע, כי עבירות שיש ביניהן קשר ענייני הדוק ואשר ניתן להשקיף עליהן כמסכת עבריינית אחת, ייחשבו לאירוע אחד (ראו ע""פ 4910/13 ג'אבר נ' מדינת ישראל (29.10.2014), (להלן: ""עניין ג'אבר"")). כדי לעמוד על עוצמת הקשר שבין העבירות, על בית המשפט לעמוד על הנסיבות העובדתיות של העניין שלפניו, נסיבות המהוות כלי עזר לקביעת עוצמת הקשר. ""במסגרת זו ניתן לבחון, למשל, האם ביצוען של העבירות מאופיין בתכנון; האם ניתן להצביע על שיטתיות בביצוע העבירות; האם העבירות התרחשו בסמיכות של זמן או מקום; האם ביצועה של עבירה אחת נועד לאפשר את ביצועה של העבירה האחרת או את ההימלטות לאחר ביצועה, וכיוצא באלו נסיבות עובדתיות. קיומה של נסיבה אחת או יותר מנסיבות אלו (ואין זו רשימה סגורה) עשוי להעיד על קשר הדוק בין העבירות השונות, המלמד כי באירוע אחד עסקינן. בבחינת הנסיבות העובדתיות, מן ההכרח לבית המשפט להעמיד לנגד עיניו את השאלה האם השקפה על העבירות כעל כמה אירועים תהא מלאכותית, באופן שיגרע ממהות העניין בכללותו, או שלא ישקף את סיפור המעשה כהווייתו"" (ע""פ 1261/15 מדינת ישראל נ' דלאל, פסקה 22 (3.9.2015) (ההדגשות במקור)).",אירוע אחד או שני אירועים?
"ת""פ 37900-06-22","בעניין ג'אבר, קובעת השופטת ברק-ארז בפסק דינה, כי קשר הדוק בין עבירות יימצא ברגיל ""כאשר תהיה ביניהן סמיכות זמנים או כאשר הן תהיינה חלק מאותה תוכנית עבריינית אף כאשר הן בוצעו לאורך תקופת זמן שאינה קצרה ..."" (פסקה 5). ובהמשך קובעת, כי ""מבחן הקשר ההדוק בוחן את עוצמת הקשר שבין העבירות, ולא את השאלה האם הן ניתנות להפרדה. בהתאם לכך, כאמור, ייתכן כי עבריין יבצע מספר רב של פעולות שניתן להפריד ביניהן, ושהוא אף יכול היה לחדול לאחר ביצוע כל אחת מהן (כך שאין לראות בהן מעשה אחד), אך נכון יהיה לראות בהן חלק מתוכנית עבריינית אחת ..."" (שם, פסקה 6).",אירוע אחד או שני אירועים?
"ת""פ 37900-06-22","השופט פוגלמן, שהצטרף לעמדתה העקרונית של השופטת ברק-ארז באותו עניין, ציין כי להשקפתו, ""התיבה 'אירוע אחד' רחבה דיה כדי לכלול גם פעולות עברייניות שבוצעו על פני רצף זמן; כללו מעשים שונים; ביחס לקורבנות שונים; ובמקומות שונים. הכל – כל עוד הם מהווים מסכת עבריינית אחת"" (עניין ג'אבר, פסק דינו של השופט פוגלמן, פסקה 2).",אירוע אחד או שני אירועים?
"ת""פ 37900-06-22","גישה דומה של פרשנות רחבה להגדרת המונח ""אירוע אחד"", הציע גם השופט זילברטל בע""פ 5643/14 עיסא נ' מדינת ישראל (23.6.2015), אשר לדידו, ""ראוי לאפשר פרשנות רחבה דיה להגדרת המונח 'אירוע אחד' אשר תשאיר מתחם להפעלת שיקול דעתו של בית המשפט, וזאת הן בשל שיקולי יעילות עבודתו של בית המשפט והן לשם הגשמת תכליתו של תיקון 113 לחוק. בהקשר זה ייאמר, כי קביעת מספר מתחמי עונש שלא לצורך עלולה במקרים מסוימים להביא להעלאת רף הענישה באופן שאינו ראוי, על-ידי פריטה לפרוטות של הרכיבים העונשיים בעניינו של הנאשם ויצירת תחושה לא נוחה של 'התחשבנות' עמו, העצמה של חומרת מעשיו מעבר למתחייב וחריצת דינו בדרך מלאכותית"" (פסקה 11).",אירוע אחד או שני אירועים?
"ת""פ 37900-06-22","בענייננו, המאשימה טענה כי מדובר באירועים נפרדים ושונים, ובעיקר מחמת שמדובר בכלי נשק שונים ובמעשים אשר בוצעו בפער זמנים ניכר זה מזה. ואולם, דווקא עניינים אלו, ובראי הפרשנות הרחבה שניתן להעניק למונח ""אירוע אחד"", הובילוני למסקנה כי עסקנין באירוע אחד.",אירוע אחד או שני אירועים?
"ת""פ 37900-06-22","הן האישום הראשון והן האישום השני עניינם בעבירות בנשק, ובעבירות בנשק בלבד. זאת, להבדיל מהאישום השלישי המיוחס לנאשם 2, ואשר עניינו בעבירת התקהלות אסורה. פעם שמדובר בעבירות מעולם הנשק, על חומרתן הרבה, לא מצאתי לדקדק וליתן נפקות מיוחדת לכך שבאישום הראשון דובר בקרלו ובאישום השני דובר ב-M16. זה גם זה, מהווים כלי נשק רב עוצמה אשר ביכולתו לגרום לתוצאה של קטל חיי אדם. מה גם שבשני האישומים כלולות עבירות של רכישת נשק. באישום הראשון, הקרלו נתקבל אצל נאשם 3 מידי מכרו, ובהמשך הועבר מידיו של נאשם 3 לידי נאשמים 1 ו-2, תמורת חיסול חוב כספי של נאשם 3 לנאשם 1. באישום השני מתואר כי נאשמים 1 ו-3 רכשו את ה- M16 והחזיקו בו.",אירוע אחד או שני אירועים?
"ת""פ 37900-06-22","גם בפער הזמנים אין כדי ליצור חיץ בין המעשים עד כי ראוי לראותם כאירועים שונים. כל המעיין בכתב האישום המתוקן, ייודע לכך כי המאשימה אינה יודעת במדויק את מועדי קרות המעשים אשר ננקבו בשנים. כך בנוגע לאישום הראשון, הקרלו התקבל אצל נאשם 3 במהלך שנת 2019. העברתו לידי נאשמים 1 ו-2 נעשתה בהמשך, בשנים 2019 עד 2020. כך גם בנוגע לאישום השני, המתאר את רכישת ה-M16 על ידי נאשמים 1 ו-3 בין שנת 2020 למחצית הראשונה של שנת 2021. עינינו הרואות, כי על פי סד הזמנים המופיע בכתב האישום המתוקן, יכול והעברת הקרלו לידי נאשמים 1 ו-2, כמו גם רכישת ה-M16, נעשו באותה השנה כשאין לדעת את פער הזמנים ביניהם, אם בכלל.",אירוע אחד או שני אירועים?
