verdict,text,part
"ת""פ 3728-01-15","ע""פ 9543/09 בילאל ראחל נ' מדינת ישראל [19.1.10], שאליו הפנתה התביעה - המערער הורשע על יסוד הודאתו בכתב אישום מתוקן במסגרת הסדר טיעון, לפיו המערער סייע לעבירות נשק וניסה להרוס נכס בחומר נפיץ, בכך שסייע לזריקת רימון לחצר ביתו של המערער. הרימון לא התפוצץ בשל תקלה. על מעשה זה קיבל המערער והאחר סכום כסף. בית המשפט העליון אישר את עונשו של המערער - 54 חודשי מאסר, מהם 30 חודשים מאסר בפועל, והיתרה מאסר על תנאי.",מדיניות הענישה הנהוגה
"ת""פ 3728-01-15","ע""פ 5995/11 ראיד בדראן נ' מדינת ישראל [14.10.12], שאליו הפנתה התביעה - המערער הורשע לאחר שהודה במסגרת הליך גישור, בביצוע עבירות של היזק בחומר נפיץ ועבירות נשק (נשיאה והובלה) בכך שהשיג מטען חבלה מאולתר המורכב מצינור מתכת, והשליך אותו לחצר ביתו של המתלונן עמו היה לו סכסוך על רקע כבוד המשפחה (אשת המתלונן והנאשם הם אחים). בית המשפט העליון קיבל חלקית את ערעורו והפחית את עונשו של המערער לשלוש שנות מאסר (חלף 4 שנים בניכוי ימי המעצר שגזר עליו בית משפט קמא). יתר רכיבי העונש נותרו על כנם.",מדיניות הענישה הנהוגה
"ת""פ 3728-01-15","ת""פ (מחוזי חיפה) 31218-10-14 מדינת ישראל נ' דיאב אסדי [11.2.15], שאליו הפנתה ההגנה - הנאשם הורשע לאחר שהודה בכתב אישום מתוקן בעבירות נשק, בכך שהשליך רימון הלם לעבר מרפסת ביתו של המתלונן. ממעשים אלו לא נגרם נזק. בית המשפט קבע כי מתחם העונש ההולם נע בין 8 לבין 20 חודשי מאסר בפועל. לחובתו של הנאשם עבר פלילי בעבירה של הנחת חומר נפץ והעדר תסקיר חיובי. לזכותו לקח בית המשפט בחשבון את גילו (בן 32), גיוסו לצבא בהתנדבות והעובדה כי הפך לאב. במכלול השיקולים, גזר בית המשפט על הנאשם עונש מאסר בפועל של 9 חודשים ועונשים נלווים.",מדיניות הענישה הנהוגה
"ת""פ 3728-01-15","ת""פ (מחוזי חיפה) 218-10-09 מדינת ישראל נ' מוחמד רמלאווי [24.3.10] - הנאשם הורשע על פי הודאתו במסגרת הסדר טיעון בהליך גישור בעבירות של החזקה, נשיאה והובלה של נשק בכך שהשליך רימון הלם ברחובות העיר חיפה בשעת לילה. ממעשיו לא נגרם נזק לאדם או רכוש. בית המשפט לקח בחשבון את התעוזה שבמעשי הנאשם וחומרתם, את נסיבותיו האישיות של הנאשם כפי שעלו מתסקיר שירות המבחן, הודאתו והחרטה שהביע, גילו הצעיר ועברו הפלילי המועט - בית המשפט גזר על הנאשם 24 חודשי מאסר בפועל מתוכם 12 חודשים יישא הנאשם מאחורי סורג ובריח, והיתרה יהיו על תנאי למשך שלוש שנים. על פסק דין זה לא הוגש ערעור.",מדיניות הענישה הנהוגה
"ת""פ 3728-01-15","ת""פ (מחוזי חיפה) 40450-09-15 מדינת ישראל נק מוחמד עכאוי [20.1.16], שאליו הפנתה ההגנה - הנאשם הורשע על פי הודאתו בעבירות נשק ומעשי פזיזות ורשלנות בכך שזרק רימון הלם בתוך מרכול, לאחר שהתגלע סכסוך בין הנאשם לבין מנהל המרכול ובין השניים התפתח ויכוח קולני וקטטה. בית המשפט עמד על החומרה שבמעשים, על הנזק הצפוי, מדיניות הענישה והערכים החברתיים שנפגעו וקבע כי מתחם העונש ההולם נע בין 6 לבין 24 חודשי מאסר בפועל. בית המשפט לקח בחשבון את גילו הצעיר של הנאשם, ה""סולחה"" שנערכה בין המשפחות, עברו הפלילי המועט והודאתו וגזר על הנאשם 10 חודשי מאסר בפועל בניכוי ימי מעצרו, ו- 12 חודש מאסר על תנאי למשך 3 שנים.",מדיניות הענישה הנהוגה
"ת""פ 3728-01-15","ת""פ (מחוזי מרכז) 4222-09-15 מדינת ישראל נ' ג'באלי [4.4.16], שאליו הפנתה התביעה - נגזרו 34 חודשי מאסר בפועל על נאשם שהורשע על פי הודאתו בנשיאת נשק, בשל כך שהגיע למפגש בין צדדים ניצים בסכסוך כשברשותו אקדח טעון, שאותו החביא תחת חולצתו. האֵרוע נקטע באיבו בשל התערבות המשטרה.",מדיניות הענישה הנהוגה
"ת""פ 3728-01-15","תכנון שקדם לביצוע העבירה: חרף טענת הנאשם כי לא קדם תכנון לביצוע העבירה, הוא הודה והורשע בכך שרימוני ההלם היו ברשותו בעת שנסעו למקום ביצוע העבירה. עוד הודה בכך שעובר לביצוע האירועים הלך עם שותפו, ויחדיו הם שתו משקאות אלכוהוליים. בטיעוניו לעונש טען הסניגור כי הנאשם לא נתן לעצמו דין וחשבון מלא על מעשיו מאחר שהיה שתוי. ההתנהלות בכללותה מלמדת על אֵרוע שתוכנן מראש, תוך עשיית ההכנות הנדרשות לשם ביצוע העבירות, ולא מצביעה על אֵרוע ספונטני. גם אם עיקר התכנון היה של אמיל, השותף, הנאשם היה שותף אקטיבי לפחות לשלבים האחרונים, מבחינת חלקו ותרומתו לאֵרוע.",נסיבות שקשורות בביצוע העבירה
"ת""פ 3728-01-15","חלקו של הנאשם באֵרוע: אין מחלוקת, כי ""בעל הסכסוך"" שעמד ברקע כתב האישום הוא שותפו של הנאשם, אמיל, ואמיל הוא גם זה שזרק את הרימונים, בפועל. לכן חלקו של הנאשם באֵרוע קטן יותר מחלקו של אמיל. זה המקום לציין, כי לטעמי, טועה המאשימה בסברה כי המתחם לגבי נאשם זה והנאשם האחר, שחלקיהם בביצוע העבירות שונה, הוא מתחם זהה, וכי ההבדל ביניהם יבוא לידי ביטוי במיקום בתוך המתחם. סעיף 40ט לחוק מלמד כי חלקו של נאשם באֵרוע הוא שיקול לקביעת המתחם ולא שיקול לעניין מיקומו של אדם במתחם. המיקום בתוך המתחם נגזר בנסיבות שאינן קשורות בביצוע העבירה, ואילו חלקו של שותף במסכת העבריינית הוא נסיבה שקשורה בביצוע העבירה. לכן, מבלי להתייחס למתחם של השותף, אני סבורה כי יהא עליו להיות שונה (ותחילתו ברף גבוה יותר) משל הנאשם דנן.",נסיבות שקשורות בביצוע העבירה
"ת""פ 3728-01-15","נזק פוטנציאלי ונזק קונקרטי: למרבה המזל, הנזק הקונקרטי במקרה דנן היה לרכוש בלבד, וגם זאת - לא נזק קשה מדי, אך אין מחלוקת, כפי שצויין לא אחת בפסיקה (לרבות בעניין עווד שאותו הגיש הסנגור), כי גם אם סכנתו של רימון ההלם פחותה משל רימון רסס, ""עדיין מדובר בנשק שבכוחו לגרום פציעה לאדם, בכפוף לקרבתו למוקד הפעלתו"" (עניין חסן).",נסיבות שקשורות בביצוע העבירה
"ת""פ 3728-01-15","לא מצאתי כי קיים במקרה דנן שיקול נוסף מבין אלה שקובעים את המתחם, שראוי להתייחס אליו באופן מיוחד.",נסיבות שקשורות בביצוע העבירה
"ת""פ 3728-01-15","בהתחשב בכל השיקולים המפורטים לעיל, ובעיקר בסוג הנשק שבו עסקינן, בכך שהוא הושלך בפועל ולא רק הוחזק, ובנזק שנגרם, אני קובעת מתחם שעונש המאסר בו נע בין 18 ל-42 חודשים, הכל - לצד עונשים נלווים כגון מאסר מותנה, קנס או פיצוי.",קביעת מתחם העונש ההולם
"ת""פ 3728-01-15","במקרה שלפני לא מצאתי שיש שיקולים, לא לקולא ובודאי שלא לחומרה, לחריגה מהמתחם. השיקולים העיקריים המצדיקים חריגה ממתחם הענישה הם - כמצוות סעיף 40ג(ב) לחוק - שיקולי שיקום. הנאשם אמנם טען שלמד את לקחו והוא היום אדם אחר משהיה, אך אפילו תסקיר שירות המבחן, שבסופו המלצה מקלה מאד, גורס כי נדרשת התערבות טיפולית בעניינו של הנאשם, להגברת הסיכוי שלא יהא מעורב שוב בהתנהגות אלימה ושולית. קרי: ההליך השיקומי עוד לפניו. לעניין תסקיר שירות המבחן אציין כי המלצתו לענישה שכוללת מאסר על תנאי והעמדה בצו מבחן, בלבד, אינה באה בחשבון, לטעמי, בשום צורה ואופן. זו ענישה שאינה קרובה למתחם הראוי ואף תשלח מסר מאד שגוי בהתייחס לחומרה שבה יש לראות את העבירות שבהן הורשע הנאשם.",האם יש הצדקה לחריגה מהמתחם?
"ת""פ 3728-01-15","שני הצדדים הסכימו כי יש למקם את הנאשם בתחתית מתחם העונש הראוי, ומאחר שאף אני רואה עימם עין בעין, אתייחס לעניין זה בקיצור:",מיקום הנאשם בתוך המתחם
"ת""פ 3728-01-15","הנאשם צעיר בימים, והיה אף יותר צעיר עת ביצע את העבירות שבהן הורשע. לפיכך, פגיעת העונש בו, בעיקר בשל גילו, בשל היותו נעדר עבר פלילי, בשל כך שזהו לו מאסר ראשון וגם בשל המצוקה שחווה בכלא, היא קשה (אם כי לא יותר מאשר עבור נאשמים צעירים אחרים, נטולי עבר פלילי, בנסיבותיו). הנאשם נטל אחריות למיוחס לו והודה בכתב אישום מתוקן עוד טרם תחילת הליך של הוכחות, ויש לזקוף עובדה זו לזכותו. יש להתחשב גם בפרק הזמן שבו שהה במעצר בפיקוח אלקטרוני (כ-9 חודשים), שאותו אין מנכים מתקופת המאסר (בניגוד לתקופה שבה שהה הנאשם במעצר מאחורי סורג ובריח), אך יש בו כדי להשפיע לקולא על עונש המאסר שייגזר (ע""פ 7768/15 פלוני נ' מדינת ישראל [20.4.16], פסקה 33).",מיקום הנאשם בתוך המתחם
"ת""פ 3728-01-15","נוכח כל האמור, אני מטילה על הנאשם את העונשים הבאים:",סיכום
"ת""פ 3728-01-15","מאסר בן 18 חודש, בניכוי ימי מעצרו (בין 18.12.14 עד 25.8.15);",סיכום
"ת""פ 3728-01-15","מאסר בן 8 חודשים, אך הנאשם לא ישא עונש זה אלא אם בתוך שלוש שנים מיום שחרורו יבצע עבירת היזק בחומר נפץ או עבירת נשק מסוג פשע;",סיכום
"ת""פ 3728-01-15","מאסר בן 4 חודשים, אך הנאשם לא ישא עונש זה אלא אם בתוך שלוש שנים מיום שחרורו יבצע עבירת נשק מסוג עוון;",סיכום
"ת""פ 3728-01-15","תשלום פיצוי למתלוננים (הוריה של ס.מ) בסך 3,000 ₪. הסכום ישולם עד ליום 1.10.16 ויועבר למתלוננים באמצעות פרטים שיימסרו על ידי התובעת למזכירות בית המשפט.",סיכום
"ת""פ 3728-01-15","54678313ניתן היום,  כ""א אייר תשע""ו, 29 מאי 2016, בנוכחות הצדדים.",5129371
"ת""פ 3728-01-15",מיכל ברק נבו 54678313,5129371
"ת""פ 3728-01-15",נוסח מסמך זה כפוף לשינויי ניסוח ועריכה,5129371
"ת""פ 3728-01-15","בעניין עריכה ושינויים במסמכי פסיקה, חקיקה ועוד באתר נבו – הקש כאן",5129371
