verdict,text,part
"ת""פ 69261-01-23","ת""פ 69261-01-23 מדינת ישראל נ' עטון (עציר) ואח'",בית המשפט המחוזי בירושלים
"ת""פ 69261-01-23","ת""פ 69261-01-23 מדינת ישראל נ' עטון (עציר) ואח'",בית המשפט המחוזי בירושלים
"ת""פ 69261-01-23","בא-כוח המאשימה:	עו""ד אריאל אילוז (פרקליטות מחוז ירושלים (פלילי))",מחמד עטון (עציר)
"ת""פ 69261-01-23","בא-כוח הנאשם 1:	עו""ד חמזה קוטינה",מחמד עטון (עציר)
"ת""פ 69261-01-23","באת-כוח הנאשם 2:	עו""ד לאה צמל ",מחמד עטון (עציר)
"ת""פ 69261-01-23","חוק העונשין, תשל""ז-1977: סע'  25, 29, 144(ב), 144(ב2), 152, 274(1), 2, 3, 329(א)(2), 448(א), 452",חקיקה שאוזכרה: 
"ת""פ 69261-01-23","חוק המאבק בטרור, תשע""ו-2016: סע'  24(א)(1), 30(א), 37",חקיקה שאוזכרה: 
"ת""פ 69261-01-23","על-פי הכרעת הדין מיום 21.5.2024, הנאשמים הורשעו בהתאם להודאתם במסגרת הסדר טיעון, אשר כלל את תיקון כתב האישום (ובין השאר, את מחיקת האישום הרביעי), אך לא כלל הסכמה בעניין העונש. העבירות שבהן הורשעו הן כלהלן.",גזר דין
"ת""פ 69261-01-23","הנאשם 1, עסאם עטון, יליד 15.7.2004 (בן 20), הורשע בעבירות הבאות: הצתה, לפי סעיף 448(א) רישה בחוק העונשין, התשל""ז-1977 (להלן – החוק); שלוש עבירות ניסיון תקיפת שוטר בנסיבות מחמירות, לפי סעיפים 274(1) ו-(3) וסעיף 25 בחוק; ארבע עבירות התפרעות, לפי סעיף 152 בחוק; מעשה טרור של חבלה בכוונה מחמירה, לפי סעיף 329(א)(2) בחוק בצירוף סעיף 37 בחוק המאבק בטרור, התשע""ו-2016 (להלן – חוק המאבק בטרור); פעולה בנשק למטרות טרור, לפי סעיף 30(א) בחוק המאבק בטרור; היזק בזדון, לפי סעיף 452 בחוק; ניסיון ייצור נשק בצוותא, לפי סעיפים 144(ב2), 25 ו-29 בחוק; ניסיון נשיאת נשק בצוותא, לפי סעיפים 144(ב), 25 ו-29 בחוק; גילוי הזדהות עם ארגון טרור והסתה לטרור בצוותא, לפי סעיף 24(א)(1) בחוק המאבק בטרור וסעיף 29 בחוק.",גזר דין
"ת""פ 69261-01-23","הנאשם 2, מחמד עטון, יליד 25.4.2004 (בן 20 ו-3 חודשים), הורשע בעבירות הבאות: שתי עבירות ניסיון תקיפת שוטר בנסיבות מחמירות, לפי סעיפים 274(1) ו-(3) וסעיף 25 בחוק; שלוש עבירות התפרעות, לפי סעיף 152 בחוק; מעשה טרור של חבלה בכוונה מחמירה, לפי סעיף 329(א)(2) בחוק בצירוף סעיף 37 בחוק המאבק בטרור; פעולה בנשק למטרות טרור, לפי סעיף 30(א) בחוק המאבק בטרור; היזק בזדון, לפי סעיף 452 בחוק; הצתה, לפי סעיף 448(א) רישה בחוק; ניסיון ייצור נשק בצוותא, לפי סעיפים 144(ב2), 25 ו-29 בחוק; ניסיון נשיאת נשק בצוותא, לפי סעיפים 144(ב), 25 ו-29 בחוק; גילוי הזדהות עם ארגון טרור והסתה לטרור בצוותא, לפי סעיף 24(א)(1) בחוק המאבק בטרור וסעיף 29 בחוק.",גזר דין
"ת""פ 69261-01-23",תסקירי שירות המבחן הוגשו ביום 9.7.2024 והטיעונים לעונש נשמעו ביום 15.7.2024.,גזר דין
"ת""פ 69261-01-23","חלק כללי: בשנת 2017 הוקם בשכונת צור באהר בירושלים מרכז שירות משולב (להלן – המש""מ), שמטרתו חיזוק תחושת הביטחון ומתן מענה לתושבי השכונה באמצעות פעילות ממוקדת שירות, לצד פעילות אכיפה וטיפול בפשיעה. במש""מ ניתנים שירותי משרד הפנים, מגן דוד אדום, כיבוי אש, שירותי עירייה ותחנת משטרה והוא מאובטח בכל ימי השבוע ובכל שעות היממה. נוסף למאבטחים, נמצאים במקום שוטרים, לוחמי כיבוי אש והצלה ואנשי מד""א העובדים גם בלילות.",עובדות כתב האישום המתוקן
"ת""פ 69261-01-23","במקרים רבים במהלך החודשים שקדמו לאירועים שיתוארו להלן, נורו זיקוקים אל עבר המש""מ וכן הושלכו לעברו בקבוקי תבערה, בקבוקי צבע, אבנים ומטען צינור.",עובדות כתב האישום המתוקן
"ת""פ 69261-01-23","ביום 8.10.2022 ביצע עודיי תמימי פיגוע במחסום שועפט שבמהלכו כידוע, נהרגה החיילת נועה לזר ז""ל וחייל נפצע קשה מאד (עובדה שמשום מה, לא הוזכרה בכתב האישום). מיד לאחר הפיגוע נמלט המפגע, שהיה מבוקש עד יום 19.10.2022, עת נהרג במהלך ניסיונו לבצע פיגוע נוסף במעלה אדומים. על רקע אירועים אלו, התקיימו אירועי הפרות סדר בצו באהר שבמהלכם הותקפו כחות הביטחון.",עובדות כתב האישום המתוקן
"ת""פ 69261-01-23","הנאשמים ושאר המעורבים שיוזכרו להלן גרים בצור באהר ומכירים זה את זה על רקע שכנות וקרבת משפחה. המעורבים הנוספים הם מוחמד גאדאללה (להלן – גאדאללה), מחמד אטרש (להלן – אטרש), נאהד גאדאללה (להלן – נאהד), יאסר ג'דאללה (להלן – יאסר), אברהים גאדאללה (להלן – אברהים), האחים דגאנה (להלן – דגאנה) ומחמד עטון (להלן – מחמד).",עובדות כתב האישום המתוקן
"ת""פ 69261-01-23","האישום הראשון: במהלך חודש יולי 2022, כשבועיים לאחר חג הקורבן, סמוך לשעה 20:00, קבעו דגאנה והנאשמים להיפגש בכיכר השאהיד בצור באהר. משם הגיעו אל בית הספר אבו בקר והצטרפו אל גאדאללה, אטרש ואברהים והחליטו להשתתף בהפרת סדר והתפרעות שהחלה במקום. הם חסמו את הכביש באמצעות מכולות אשפה וצמיגים והנאשם 1 ודגאנה הציתו את מכולות האשפה באמצעות בקבוקי תבערה שהוכנו קודם לכן. לאחר מכן יידו הנאשמים אבנים אל עבר כוח משטרה שהיה במקום. כחלק מההתפרעות יידו הנאשמים, דגאנה, גאדאללה, אברהים ואטרש מספר אבנים אל עבר כוחות המשטרה ממרחק כ-30 מטר מהם, שפגעו סמוך למקום עמידת השוטרים.",עובדות כתב האישום המתוקן
"ת""פ 69261-01-23","בהתאם למתואר, הנאשמים הורשעו בעבירות ניסיון תקיפת שוטר בנסיבות מחמירות והתפרעות והנאשם 1 הורשע גם בעבירת הצתה ושני.",עובדות כתב האישום המתוקן
"ת""פ 69261-01-23","האישום השני (רק הנאשם 1): ביום 27.9.2024 סמוך לשעה 20:30 התפתחו הפרות סדר סמוך לכיכר השאהיד בצור באהר בהשתתפות צעירים תושבי השכונה. המתפרעים, חלקם רעולי פנים, הציתו מכולות אשפה, חסמו את המעבר לכלי רכב ויידו אבנים אל עבר כוחות משטרה שפעלו לפיזור ההתפרעות תוך שימוש באמצעים שונים. סמוך לשעה 21:00 נפגשו הנאשמים בביתו של הנאשם 2 ולאחר ששמעו את הרעש ממקום ההתפרעות, החליטו להצטרף. הם עטו את חולצותיהם על פניהם כדי להסתירם והלכו לכיוון כיכר השאהיד. לשם הגיע גם נאהד. הנאשם 1 יידה אבנים אל עבר השוטרים שהיו ליד הנש""מ, ממרחק כ-50 מטר ונאהד יידה לעברם אבן ממרחק כ-70 מטר.",עובדות כתב האישום המתוקן
"ת""פ 69261-01-23","בהתאם למתואר, הנאשם 1 הורשע בעבירות התפרעות וניסיון תקיפת שוטר בנסיבות מחמירות.",עובדות כתב האישום המתוקן
"ת""פ 69261-01-23","האישום השלישי: ביום 10.10.2022 סמוך לשעה 20:00 נפגשו הנאשמים עם דגאנה, גאדאללה ונאהד והנאשמים אמרו להם שהם מתנגדים להימצאות תחנת משטרה ישראלית בצור באהר. כל משתתפי הפגישה נענו להצעת דגאנה לצאת אל המש""מ וליידות לעברה בקבוקי תבערה באמצעות בקבוקי תבערה וזיקוקים שדגאנה הכין מראש. דגאנה חילק לכל אחד בקבוק תבערה אחד והחזיק בזיקוקים וכולם הלכו לכיוון המש""מ. דגאנה ירה זיקוק אל עבר דלת המש""מ ממרחק כ-15 מטר והנאשמים, דגאנה, גדאללה ונאהד יידו את בקבוקי התבערה לכיוון המש""מ. גאדאללה יידה גם בקבוק צבע שהיה ברשותו ולאחר מכן כל החמישה נמלטו. אחד מבקבוקי התבערה פגע בקרבת ניידת שחנתה סמוך לבניין המש""מ ובקבוק תבערה נוסף פגע בגג מקום לשטיפת מכוניות הצמוד למש""מ.",עובדות כתב האישום המתוקן
"ת""פ 69261-01-23","בהתאם למתואר, הנאשמים הורשעו בעבירות מעשה טרור של חבלה בכוונה מחמירה, פעולה בנשק למטרות טרור, היזק בזדון והתפרעות.",עובדות כתב האישום המתוקן
"ת""פ 69261-01-23","האישום החמישי: ביום 19.10.2022 נהרג המפגע עודי תמימי במהלך ניסיון פיגוע נוסף במעלה אדומים. בעקבות מותו הוכרזה שביתת מסחר ביום 20.10.2022, שבמהלכו אירעו הפרות סדר והתפרעויות בצור באהר, שכללו ירי זיקוקים אל עבר המש""מ ובכיכר השאהיד ועימותים עם המשטרה. סמוך לשעה 20:00 נפגשו הנאשמים עם דגאנה, גאדאללה, אברהים ואטרש והחליטו להשתתף באותם עימותים. הם עטו חולצות על פניהם, דגאנה הצטייד בבקבוק תבערה והם הלכו לכיוון מסגד אלעומרי, שם הצטרפו אל המתפרעים שיידו אבנים אל עבר השוטרים. הנאשמים והאחרים שהיו עמם גררו מכולות אשפה וצמיגים שהיו במקום אל מרכז הכביש באופן שמנע מעבר והנאשם 2 הצית את מכולות האשפה באמצעות בקבוק תבערה שקיבל מאחד המתפרעים והמתפרעים החלו לידות אבנים אל עבר השוטרים. הנאשמים וחבריהם הנזכרים צעדו לכיוון בית הספר ושם הצית הנאשם 2 את מכולות האשפה באמצעות בקבוק תבערה שקיבל מדגאנה. כמו כן, הנאשמים וכל אחד מחבריהם יידו מספר אבנים אל עבר השוטרים ממרחק כ-30 מטר.",עובדות כתב האישום המתוקן
"ת""פ 69261-01-23","בהתאם למתואר, הנאשמים הורשעו בעבירות ניסיון תקיפת שוטר בנסיבות מחמירות והתפרעות והנאשם 2 הורשע גם בעבירת הצתה.",עובדות כתב האישום המתוקן
"ת""פ 69261-01-23","האישום השישי: במועד כלשהו בחודש נובמבר 2022 נפגשו הנאשמים עם דגאנה ומחמד והחליטו להרכיב מטעני צינור באמצעות אביזרים שדגאנה ומחמד הביאו. הם מילאו שני צינורות ברזל שאורכם כ-15 ס""מ באבקת שריפה שלקחו מזיקוקים, נעצו פתיל ואטמו את הצינורות. הם לקחו את המטענים והלכו אל בית הקברות הסמוך לביתם של דגאנה ומחמד. הנאשמים קיבלו ממחמד את המטענים, כל אחד הדליק אחד במצית והשליך אותו סמוך לבית הקברות. המטענים התפוצצו תוך השמעת קול פיצוץ חזק ואחד השכנים צעק עליהם.",עובדות כתב האישום המתוקן
"ת""פ 69261-01-23","בהתאם למתואר, הנאשמים הורשעו בעבירות ניסיון ייצור נשק בצוותא וניסיון נשיאת נשק בצוותא.",עובדות כתב האישום המתוקן
"ת""פ 69261-01-23","האישום השביעי: בהתאם להכרזת הממשלה מיום 22.6.1989, ארגון חמאס הוא ארגון טרור והחל מיום 1.11.2016 ארגון זה הוכרז כארגון טרור מכוח חוק המאבק בטרור. ביום 14.12.2022 ציין חמאס שלושים וחמש שנה להקמתו. במועד זה נפגשו הנאשמים עם דגאנה, גאדאללה ונאהד בכיכר השאהיד בצור באהר. דגאנה הביא מודעות שעליהן דמויות של חברי חמאס, לרבות אבו עוביידה, דובר גדודי עז אלדין אל קסאם, הזרוע הצבאית של חמאס והנאשם 1 הביא עמו דגלי חמאס. לרגל מועד ייסוד חמאס, החליטו הנאשמים וחבריהם האמורים לפרסם את הזדהותם עם הארגון ואת תמיכתם בו באמצעות תליית מודעות ודגלים בצור באהר. הנאשם 2 וחבריו הנזכרים תלו את המודעות ואת הדגלים וכן ריססו בצוותא על קירות ברחובות את הכתובת ""חמאס 35"" בצבע ירוק, המזוהה עם חמאס. הנאשם 1 שימש תצפיתן כדי להזהיר אם המשטרה תגיע.",עובדות כתב האישום המתוקן
"ת""פ 69261-01-23","בהתאם למתואר, הנאשמים הורשעו בעבירת גילוי הזדהות עם ארגון טרור והסתה לטרור בצוותא.",עובדות כתב האישום המתוקן
"ת""פ 69261-01-23","לשאלת בית המשפט הודיעה המאשימה כי כתב אישום נוסף הוגש נגד שישה מהמעורבים. שלושה שוחררו בסוף נובמבר 2023 במסגרת העסקה לשחרור החטופים ושלושה נוספים הודו והורשעו והטיעונים לעונש נקבעו לאחר פגרת הקיץ (ת""פ 6222-01-23)",עניינם של מעורבים נוספים
"ת""פ 69261-01-23","התסקיר בעניין הנאשם 1, עסאם עטון: הנאשם 1 (להלן בחלק זה – הנאשם) יליד 15.7.2004 (בן 20), הבן השלישי מבין חמישה ילדים במשפחתו. אביו עובד באלומיניום ואמו עקרת בית. הוא סיים 12 שנות לימוד עם תעודת בגרות. קודם מעצרו עבד במדידת כבישים. לדבריו, גדל בסביבה נורמטיבית ולא היו לו קשיים חברתיים או לימודיים. בעתיד הוא רוצה לעסוק בתחום התשתיות. בהיבט המשפחתי ציין קשר טוב עם הוריו המשמשים עבורו גורם תומך ומכיל. למשפחתו אין קשיים כלכליים או אחרים, הם אינם מעורבים בפלילים, לא משתייכים לארגון טרור ולא תומכים בו. עם זאת, אחיו נשא עונש מאסר בשל הרשעה בעבירת טרור. לדברי הנאשם, הוריו מגנים את המעשים.",תסקירי שירות המבחן
"ת""פ 69261-01-23","הנאשם נעדר הרשעות קודמות והוא מכיר באחריותו למעשיי העבירות. שותפו לכתב האישום הוא בן דודו ולדבריו, העבירות נעברו עת היה קטין, על רקע טעות בבחירותיו ובשיקול דעתו. הוא לא התכוון לפגוע, אלא פעל מתוך לחץ חברתי. הוא התקשה להסביר את הפער בין המעשים לבין דבריו ואת ההיבטים האידיאולוגים של המעשים. בעניין האישום השביעי, שלל השתייכות לחמאס וטען כי לא היה ער לאידיאולוגיה של הארגון ולמטרותיו.",תסקירי שירות המבחן
"ת""פ 69261-01-23","גורמי הסיכון להישנות עבירות הם היעדר גבולות יציבים ומגובשים, חומרת העבירות ומאפייניהן, אי הכרה בהשלכות המעשים ובתוצאותיהם, קושי לעסוק בהיבטי התכנון שקדמו למעשים, נטייה לטשטש פרטים, קושי לבחון את המעשים ולשתף במניע האידיאולוגי. עם זאת, העובדה שהוא נעדר הרשעות קודמות צוינה כגורם סיכוי לשיקום. שירות המבחן מעריך שרמת הסיכון להישנות עבירות דומות גבוהה. הומלץ על השתת עונש מאסר בפועל, תוך שקילת תקופת המעצר, מאסר מותנה וקנס.",תסקירי שירות המבחן
"ת""פ 69261-01-23","התסקיר בעניין הנאשם 2, מחמד עטון: הנאשם 2 (להלן בחלק זה – הנאשם) יליד 25.4.2004 (בן 20 ו-3 חודשים), הבן החמישי מבין תשעה ילדים במשפחתו. אביו עובד כעצמאי בנגרות ואמו עקרת בית. בעת מעצרו עמד לסיים כתה י""ב ולמד לבחינות בגרות. בחופשות עבד בתיקון מעליות במרכז הארץ. לדבריו, גדל בסביבה נורמטיבית ואף לא נחשף לחברה שולית או לתכנים אידיאולוגיים קיצוניים. לא היו לו בעיות משמעת ובתקופת העבירות היה עסוק בלימוד לבחינות. הוא הופנה להרשעתו הקודמת, אך תחילה הכחיש זאת ובהמשך אמר שדובר בטעות מצדו וכי בכוונתו לנהל אורח חיים נורמטיבי. בהיבט המשפחתי ציין כי הקשר עם הוריו טוב וכי הם משמשים עבורו גורם תומך. למשפחתו אין קשיים כלכליים או אחרים. אישר שאחד מאחיו היה מעורב בפלילים, אך סירב לפרט. שירות המבחן העיר שנראה כי אחד מאחיו נושא עונש מאסר בשל הרשעה בעבירות טרור. מכל מקום, לדברי הנאשם, במשפחתו חינכו לערכים נורמטיביים וכי הוריו מגנים את המעשים.",תסקירי שירות המבחן
"ת""פ 69261-01-23","בעבר הנאשם הורשע בבית משפט לנוער בעבירות התפרעות וניסיון תקיפת שוטר ונדון למאסר מותנה, קנס, צו מבחן שבמסגרתו שולב בקורס באוניברסיטה העברית ושל""צ שעשה במתנ""ס השכונתי בצור באהר. הנאשם מכיר באחריותו למעשיי העבירות הנדונות וציין כי שותפו לכתב האישום הוא בן דודו. לדבריו, לדבריו, עבר את העבירות הנדונות ללא מחשבה, לא התכוון לפגוע בשוטרים ופעל מתוך שיקול דעת מוטעה אך מעבר לכך התקשה להסביר את מעשיו, את התכנון שקדם למעשים וכן התקשה לענות לשאלות בעניין אפשרות התמיכה בארגון טרור או להגיב למניע האידיאולוגי של המעשים.",תסקירי שירות המבחן
"ת""פ 69261-01-23","גורמי הסיכון להישנות עבירות הם היעדר גבולות יציבים ומגובשים, חומרת העבירות ומאפייניהן, אי הכרה בהשלכות המעשים ובתוצאותיהם, קושי לעסוק במניע האידיאולוגי, נטייה לטשטש פרטים, היבט אידיאולוגי של המעשים המתבטא גם בהרשעה הקודמת והיעדר הרתעה חרף אותה הרשעה. כגורם סיכוי לשיקום צוינו הכרת הנאשם בכך ששגה. רמת הסיכון להישנות עבירות דומות הוערכה כגבוהה. הומלץ להשית על הנאשם מאסר בפועל, מאסר מותנה וקנס.",תסקירי שירות המבחן
"ת""פ 69261-01-23","גיליון מידע פלילי בעניין הנאשם 2 (ת/1) וגזר דין בעניינו מיום 4.7.2022 בת""פ (שלום נוער ירושלים) 46920-05-21 (ת/2). על-פי ראיות אלו הנאשם 2 הורשע על-פי הודאתו בעבירות התפרעות (סעיף 152 בחוק) וניסיון תקיפת שוטר בנסיבות מחמירות (סעיף 274(1), (2), (3) וסעיפים 25 ו-29 בחוק), על רקע השתתפותו באירועי התפרעות המוניים ביום 12.5.2021. על-פי גזר הדין, הוא נדון ל-4 חודשי מאסר מותנה, 100 שעות של""צ, קנס בסך 3,000 ₪ וצו מבחן למשך חודשיים.",הראיות לעונש מטעם המאשימה
"ת""פ 69261-01-23","טענות המאשימה: נטען כי מדובר בריבוי אירועים מתוכננים המצביעים על תודעה פלילית גבוהה, אשר נעשו בצוותא, בחבורה, ממניע אידיאולוגי תוך יצירת סיכון משמעותי לתושבי המקום ולכוחות הביטחון. הנאשמים יכולים היו להפסיק את מעשיהם בשלבים רבים, אך בחרו להמשיך בהם. האירועים היו על פני תקופה, בין חודש יולי לחודש דצמבר 2022, תוך החמרה בין אירוע אחד לאחר. בשל פער הזמנים, השוני ומאפייניהם הייחודיים, נטען כי יש לקבוע מתחמי ענישה נפרדים.",טענות הצדדים בעניין העונש ודברי הנאשמים
"ת""פ 69261-01-23","בעניין נסיבותיו של כל אחד מפרטי האישום ובעניין מתחמי הענישה שהתבקשו, בא-כוח המאשימה טען כלהלן: האישום הראשון – אירוע מתוכנן שכלל חסימת כביש באמצעות מכולת אשפה וצמיגים, שיצר סיכון משמעותי למשתמשי הדרך. הנאשם 1 הצית את המכולה עם בקבוקי תבערה שהוכנו מראש, הנאשמים ואחרים יידו אבנים אל עבר כוח משטרה, שחלקן פגע סמוך לכוח תוך יצירת סיכון משמעותי. נטען כי על מתחם העונש בעניין הנאשם 1 להיות בין 18 ל-36 חודש ובעניין הנאשם 2 בין 12 ל-24 חודש; האישום השני – התפרעות חמורה של רעולי פנים שיידו אבנים אל עבר כוח משטרה וחסימת הדרך. הנאשם 1 היה רעול פנים ויידה אבנים לכיוון השוטרים. נטען כי על מתחם העונש בעניינו להיקבע בין 12 ל-24 חודש; האישום השלישי – חומרת האירוע נובעת מהתנגדות הנאשמים למש""מ בצור באהר. דובר באירוע מתוכנן לאחר הכנה והצטיידות בבקבוקי תבערה ובזיקוקים. הנאשמים היו רעולי פנים והם יידו בקבוקי תבערה ומעורב נוסף ירה זיקוקים. לנוכחים בנש""מ נשקף סיכון משמעותי ופוטנציאל הנזק היה רב. אף מדובר בעבירות מעשה טרור וחבלה בכוונה מחמירה, שעונשיהם חמורים ולפיכך נטען, כי על מתחם העונש להיות בין 36 ל-72 חודש; האישום החמישי – חומרת אירוע ההתפרעות נובעת מהתרחשותה על רק מות המחבל עודאי תמימי. הנאשם 2 הצית פעמיים מכולות אשפה ונשקף נזק משמעותי לתושבי השכונה ולכוחות המשטרה. על מתחם העונש בעניין הנאשם 1 להיות בין 12 ל-24 חודש ובעניין הנאשם 2 בין 18 ל-36 חודש; האישום השישי – אף שהדבר לא נאמר במפורש, ניתן להסיק את מטרת הכנת מטעני הצינור מיתר האירועים. נטען כי יש לקבוע מתחם העונש בין 36 ל-72 חודש; האישום השביעי – חרף התרחשות האירוע לפני 7.10.2023, יש לראות בחומרה מעשה ההזדהות עם ארגון הטרור חמאס ולקבוע מתחם עונש בין 10 ל-18 חודש.",טענות הצדדים בעניין העונש ודברי הנאשמים
