verdict,text,part
"ת""פ 51912-09-23","ת""פ 51912-09-23 מדינת ישראל נ' דהן(עציר) ואח'",בית המשפט המחוזי בתל אביב -יפו
"ת""פ 51912-09-23","ע""י ב""כ עו""ד ענבר גולדשטוף",מדינת ישראל
"ת""פ 51912-09-23",אדיר דהן,הנאשמים
"ת""פ 51912-09-23","ע""י ב""כ עו""ד שמואל פלישמן",הנאשמים
"ת""פ 51912-09-23",אליעד אדמה,הנאשמים
"ת""פ 51912-09-23","ע""י ב""כ עו""ד משה אלגאלי",הנאשמים
"ת""פ 51912-09-23","חוק העונשין, תשל""ז-1977: סע'  144 (ב), 333, 335 (א)(1)",חקיקה שאוזכרה: 
"ת""פ 51912-09-23","הנאשמים הורשעו, על בסיס הודאתם בעובדות כתב אישום מתוקן, בעבירות כדלקמן:",כללי והסכמות הצדדים
"ת""פ 51912-09-23","נאשם 1- חבלה חמורה בנסיבות מחמירות- לפי סעיף 333 יחד עם סעיף 335 (א)(1) לחוק העונשין, התשל""ז- 1977 (להלן: חוק העונשין).",כללי והסכמות הצדדים
"ת""פ 51912-09-23",נאשם 2- חבלה חמורה בנסיבות מחמירות- לפי סעיף 333 יחד עם סעיף 335 (א)(1) לחוק העונשין; נשיאת נשק- לפי סעיף 144 (ב) רישא לחוק העונשין.,כללי והסכמות הצדדים
"ת""פ 51912-09-23","הוסכם בין הצדדים כי המאשימה תעתור ביחס לנאשם 1 למתחם ענישה של 4-6 שנות מאסר ותבקש לגזור עליו 5 שנות מאסר. ביחס לנאשם 2 המאשימה תעתור למתחם ענישה של 5.5-8 שנות מאסר, ותעתור לגזור עליו 7 שנות מאסר וכן הפעלת מאסרים מותנים, במצטבר. ההגנה תוכל לטעון לעונש באופן פתוח.",כללי והסכמות הצדדים
"ת""פ 51912-09-23","הסכמות הצדדים הן פרי הליך גישור, במסגרתו נבחן חומר הראיות על ידי המותב המגשר. כן הוסכם בין הצדדים כי הטיעונים לעונש יישמעו לפניי ולא לפני המותב המגשר.",כללי והסכמות הצדדים
"ת""פ 51912-09-23","בהתאם לעובדות, כחודש ימים עובר למועד הרלוונטי, הגיע נאשם 1 למועדון ""ארט קלאב"" בתל אביב (להלן- המועדון), וסורב להיכנס על ידי המארחת והמאבטחים. ביום 8/9/23 בשעה 5:40 או בסמוך לכך, הגיעו הנאשם 1, נאשם 2 עימו יש לו היכרות מוקדמת, ואחרים, וביקשו להיכנס למועדון כשנאשם 2 מצויד באקדח שהוסתר בבגדיו. משסורבו הנאשמים להיכנס למועדון, החלו להתעמת עם המאבטחים, ועזבו את המקום.",עובדות כתב האישום המתוקן
"ת""פ 51912-09-23","בחלוף מספר דקות, יצאו המאבטחים עובדה ודיאא (להלן- עובדה, דיאא או המאבטחים) מהמועדון כדי לוודא כי הנאשמים והאחרים עזבו את המקום, וביצעו סריקה באזור. ברחוב קיבוץ גלויות 45 הבחינו המאבטחים בנאשמים והחל עימות.",עובדות כתב האישום המתוקן
"ת""פ 51912-09-23","במהלך העימות, תקף נאשם 1 את עובדה בכך שדקר אותו באמצעות סכין כשהוא משסף בעוצמה את באנו לרוחב.",עובדות כתב האישום המתוקן
"ת""פ 51912-09-23","באותו מעמד, שלף נאשם 2 את האקדח ממכנסיו ותקף את דיאא, בכך שירה ברגלו.",עובדות כתב האישום המתוקן
"ת""פ 51912-09-23",הנאשמים נמלטו מהמקום.,עובדות כתב האישום המתוקן
"ת""פ 51912-09-23","כתוצאה ממעשיו של נאשם 1 נגרמו לעובדה חבלות בטן, הוא נזקק לניתוח מציל חיים במסגרתו בוצעה כריתת מקטע של המעי.",עובדות כתב האישום המתוקן
"ת""פ 51912-09-23",כתוצאה ממעשיו של נאשם 2 נגרמה לדיאא חבלה של פצע ירי ברגל ימין מעל הברך ונדרש לטיפול בבית החולים.,עובדות כתב האישום המתוקן
"ת""פ 51912-09-23","ב""כ המאשימה הגישה קלסר המאגד הצהרות נפגעי עבירה ואסופת מסמכים רפואיים הקשורים במצבם הרפואי של המתלוננים (במ/1).",ראיות לעונש
"ת""פ 51912-09-23","מהמסמכים עולה כי עובדה, בן 25 בעת האירוע, הובהל לבית החולים בשל פצע דקירה בדופן בטן שמאלית תחתונה, ולאחר קבלת מנות דם, הוכנס מיידית לחדר ניתוח. בוצעה כריתת מעי דק (כ- 30 ס""מ) ובמהלך הניתוח הופיע דמם פעיל מעורקו.",ראיות לעונש
"ת""פ 51912-09-23","עוד במהלך אשפוזו, הופיעו תופעות פוסט-טראומטיות, והומלץ על המשך טיפול פסיכולוגי ופסיכיאטרי, כמו גם המשך טיפולים מתחום הגסטרו בעקבות כריתת חלק מהמעי (צורפה שורת מסמכים).",ראיות לעונש
"ת""פ 51912-09-23","בהצהרתו תאר כי עקב המעשים הפך מבחור צעיר שרירי ומתפקד, לנכה החווה כאבים עזים, סיוטי לילה וחרדות הנמשכים עד למועד זה.",ראיות לעונש
"ת""פ 51912-09-23",עוד צורפו מסמכים המעידים על קביעת אחוזי נכות משמעותיים ,ראיות לעונש
"ת""פ 51912-09-23","מהמסמכים עולה כי דיאא, בן 28 בעת האירוע, הובהל לחדר המיון כשפצע ירי ברגל ימין. בהצהרתו הדגיש כי בעת שהיה בתפקיד, נגרמו לו חבלות פיזיות ונפשיות בעקבות הירי ברגלו, וכן נגרם לו נזק כלכלי. צורפו מסמכים המעידים על כך שעקב הפציעה אינו מסוגל לעבוד",ראיות לעונש
"ת""פ 51912-09-23","ב""כ נאשם 1 מסמכים רפואיים במ/2- במ/5 הנוגעים לאירוע פציעה בשנת 2022. מהמסמכים עולה כי בסוף חודש ינואר 2022 נפגע מפליטת כדור בשוגג מאקדח של חברו ונפגע בחוליה 2- L . כתוצאה מהאירוע, נותח ואושפז במחלקה כירורגית עקב שברים שנגרמו בחוליות, ואף נכרתה כליה בשל דימום נרחב. עוד עולה, כי נזקק לתקופת שיקום והתנייד בעזרת קביים ואף כיסא גלגלים. מהמסמכים עלה כי סבל מדיכאון וחרדות.",ראיות לעונש
"ת""פ 51912-09-23","בנוסף, בחודש יולי 2019 היה מעורב בתאונת אופנוע, באופן בו נותרו כאבים כרוניים בצוואר.",ראיות לעונש
"ת""פ 51912-09-23","לנאשם 2 ניתנה אפשרות להגיש עדויות אופי בכתב, אולם לא התקבלו ראיות עד למועד מתן גזר הדין.",ראיות לעונש
"ת""פ 51912-09-23","ב""כ המאשימה הדגישה כי עסקינן באירוע בעל חומרה יתרה, שתוצאותיו יכולות היו להיות אף חמורות יותר וטראגיות, ולפיכך, מדובר בצד המחמיר של הוראות החיקוק המיוחסות לנאשמים בכתב האישום המתוקן. נסיבות המקרה חמורות ביותר עת הנאשם 1 דקר את המאבטח בכך ששיסף את בטנו ונאשם 2 ירה ברגלו של המאבטח הנוסף.","ב""כ המאשימה "
"ת""פ 51912-09-23","הודגשו הפציעות החמורות שנגרמו לשני המאבטחים, תוך הפנייה לקלסר במ/1 המכיל מסמכים רפואיים מפורטים. למאבטח עובדה נגרמה חבלת בטן קשה בגינה עבר ניתוח מציל חיים כולל כריתת חלק מהמעי הדק. מתצהיר שהוגש עלה כי חייו השתנו לבלי היכר בכל אפיקי חייו והוא אף איבד את עבודתו. למאבטח דיאא נגרמה חבלה ברגל כתוצאה מהירי מעל הברך ואף הוא אושפז לטיפול, כפי שעולה מהמסכמים.","ב""כ המאשימה "
"ת""פ 51912-09-23","הודגש, כי האירוע התרחש במסגרת עבודתם של המאבטחים ונודעת לכך חומרה יתרה, ביתר שאת כאשר הנאשמים הם מחוללי האירוע. בנוסף, נעשה שימוש באקדח שהנאשם 2 הצטייד בו מראש, ונאשם 1 עשה שימוש בסכין. ב""כ המאשימה הדגישה את הצורך להילחם בנגע האלימות שהפך מכת מדינה, פרטה את הפגיעה המשמעותית בערכים המוגנים שעיקרם הגנה על שלום הציבור ושלמות הגוף.","ב""כ המאשימה "
"ת""פ 51912-09-23","ב""כ המאשימה הגישה אסופת פסיקה ממנה עתרה לאמץ את מתחמי הענישה להם טענה, כמפורט בפתיח. ואשר למיקום הנאשמים בתוך המתחמים, הדגישה את ההרשעות הקודמות, ובאשר לנאשם 1, הטעימה כי פציעתו בעבר בשל ירי אמורה הייתה להוות גורם מרתיע, בידעו את התוצאות הקשות שנגרמו לו בעצמו, ואין להתחשב בנתון זה להקלה בעונש.","ב""כ המאשימה "
"ת""פ 51912-09-23","מעבר לענישה שלה עתרה בהתאם להסכמות, התבקש להטיל מאסר מותנה ופיצוי משמעותי, תוך אבחנה מסוימת בין נפגעי העבירה בהתאם לעצמת הנזק.","ב""כ המאשימה "
"ת""פ 51912-09-23","ב""כ נאשם 1 ציין כי מעשי הנאשם חמורים וראויים לגינוי, הנאשם מפנים את החומרה ואף מתבייש במעשיו. הודגש, כי הסכין נשלפה עם קרות האירוע ולא מיוחסת לנאשם הצטיידות בסכין מראש, וכן כי נוצר עימות בין הנאשמים למאבטחים.","ב""כ הנאשם 1"
"ת""פ 51912-09-23","לטעמו, יש לתת משקל משמעותי ללקיחת האחריות, כאשר ניהול ההליך בדרך של שמיעת חלק מהראיות אינו צריך לעמוד לרועץ, שכן לא הובאו לעדות עדים מהותיים. באופן זה נחסכה עדות המתלוננים ועדים רבים נוספים. בנוסף, נודעת חשיבות לתיקון סעיף החיקוק בכתב האישום המתוקן, פרי הליך הגישור. חשיבות נוספת נודעת לכך שהנאשם הודה על אף שהצדדים לא הגיעו לכלל ענישה מוסכמת.","ב""כ הנאשם 1"
"ת""פ 51912-09-23","ב""כ הנאשם 1 תאר את אירוע הפציעה במסגרתו נפלט כדור ופצע את הנאשם בשנת 2022, ועתר להתחשב בכך, אף שהטעים כי הנאשם אמור היה להבין מהן תוצאות של ירי.","ב""כ הנאשם 1"
"ת""פ 51912-09-23","ב""כ הנאשם 1 ציין כי מנעד הענישה רחב, אבחן את המקרים עליהם נסמכה המאשימה בטיעוניה, והפנה למקרה במסגרתו הוטל על נאשם 22 חודשים כעונש ראוי בנסיבות.","ב""כ הנאשם 1"
"ת""פ 51912-09-23","הנאשם נטל אחריות מלאה על מעשיו, הביע צער ובושה על קרות האירוע, הסביר כי עבר תקופה קשה לאחר פציעתו, הן פיזית והן נפשית, דבר שהוביל להתדרדרות במצבו.",נאשם 1
"ת""פ 51912-09-23","ב""כ הנאשם 2 הצטרף לטיעוניו הכללים של ב""כ נאשם 1 לרבות בנוגע לנסיבות המקרה ולפסיקה","ב""כ הנאשם 2 "
"ת""פ 51912-09-23","כן, הדגיש כי הוא מגנה את המעשה בגינו הורשע הנאשם 2, והנאשם עצמו מבין היטב את החומרה ומוקיע אותה אף הוא. הנאשם 2 נקלע לסיטואציה קשה, כאשר למתלוננים חלק באירוע בשל כך שערכו סריקות לחפש את הנאשמים והאירוע התלקח באופן זה והסלים.","ב""כ הנאשם 2 "
"ת""פ 51912-09-23","ב""כ הנאשם 2 הטעים כי משפחתו של הנאשם נורמטיבית, אמו עובדת במשרד הביטחון, אחיו עובד בהיי-טק, אחות מנהלת אמרכלות בחברה גדולה. הנאשם עושה כל מאמץ להשתקם ולחזור לחיים נורמטיביים, והחל בכך בין כתלי בית המעצר.","ב""כ הנאשם 2 "
"ת""פ 51912-09-23","ב""כ נאשם 2 אבחן אף הוא את הפסיקה אליה הפנתה ב""כ המאשימה במסגרת טיעוניה, והגיש פסיקה המדגימה את המנעד הרחב, כאשר ברף תחתון, מוטלים אף עונשי מאסר בדרך של עבודות שירות.","ב""כ הנאשם 2 "
"ת""פ 51912-09-23","אשר להפעלת המאסרים המותנים התלויים ועומדים כנגד הנאשם 2, התבקש להפעילם בחלקם הגדול בחופף, נוכח משך המאסר הצפוי.","ב""כ הנאשם 2 "
"ת""פ 51912-09-23","הנאשם הביע חרטה על מעשיו, תאר את נסיבות חייו עת גדל ללא דמות אבהית. לאחר שחרורו ממאסר בחר ללכת בדרך לא טובה ועם אנשים לא טובים. כעת משולב בקבוצות טיפול בבית המעצר והוא מעוניין להיקלט במתקן כליאה אשר יאפשר את המשך שיקומו.",הנאשם 2 
"ת""פ 51912-09-23","יוזכר, כי במסגרת ההסכמות בין הצדדים, נטענו על ידי המאשימה מתחמי ענישה ביחס לשני הנאשמים, והתבקש עונש הולם במסגרת זו, כאשר טיעוני ההגנה חופשיים. עוד יוזכר, כי השוני בעתירת המאשימה ביחס לעונש שיש להטיל על כל אחד מהנאשמים נובע משוני בעבירות המיוחסות לכל אחד מהם (לנאשם 2 מיוחסת גם נשיאת נשק), ולהפעלת מאסרים מותנים התלויים ועומדים כנגדו.",מתחמי העונש ההולם
"ת""פ 51912-09-23","בחינת נסיבות המעשים המיוחסים לנאשמים בכתב האישום המתוקן מגלה רכיבי חומרה משמעותית, זאת בכמה היבטים:",מתחמי העונש ההולם
"ת""פ 51912-09-23","ראשית, הנאשמים הפעילו אלימות קשה כלפי נפגעי העבירה, כאשר נאשם 1 עשה שימוש בסכין, ונאשם 2 הצטייד באקדח- כל האמור במקום ציבורי בעיבורה של עיר. נאשם 1 דקר את עובדה באמצעות סכין, כשהוא משסף בעצמה את בטנו לרוחבה. נאשם 2 ירה ברגלו של דיאא באמצעות האקדח עמו הצטייד מראש. לנאשם זה מיוחסת גם עבירה של נשיאת נשק, ועובדה זו תתבטא בקביעת מתחם הענישה.",מתחמי העונש ההולם
"ת""פ 51912-09-23","שנית, לנפגעי העבירה נגרמו חבלות משמעותיות ביותר, כפי המפורט בהרחבה לעיל, ותוצאות הפגיעה, על כל רבדיה, חמורות ומתמשכות עד לימים אלה.",מתחמי העונש ההולם
"ת""פ 51912-09-23","שלישית, נפגעי העבירה נפגעו על ידי הנאשמים במסגרת עבודתם כמאבטחים במועדון בתל אביב. לנתון זה נודעת חומרה. מעובדות כתב האישום המתוקן עולה כי הפגיעה ארעה בעת שנפגעי העבירה יצאו מהמועדון על מנת לוודא כי הנאשמים והאחרים עזבו את המקום.",מתחמי העונש ההולם
"ת""פ 51912-09-23","מעשי הנאשמים פגעו בערכים המוגנים שעניינם שמירה על שלמות הגוף ושלום הציבור בכללותו, ופגיעה זו הינה משמעותית. כידוע, תופעת האלימות על כל גווניה, ראויה למענה חריף על ידי בית המשפט, בשל נפיצותה. בעיקר הדברים אמורים בעת שנעשה שימוש בנשק קר, בין אם עסקינן בסכין ובין בנשק. נשיאת נשק מהווה סיכון פוטנציאלי גדול לציבור כולו. לעיתים, המרחק התוצאתי בין גרימת חבלה חמורה לבין תוצאה קטלנית הינו רק עניין של מזל.",מתחמי העונש ההולם
"ת""פ 51912-09-23","אשר לשימוש בסכין, נקבע לא אחת כי קיים צורך להיאבק בתופעת הסכינאות באמצעות ענישה הולמת ומרתיעה, כאשר מדובר בתופעה שקנתה לה אחיזה בחברה, והפכה שכיחה ביותר כדרך לפתרון סכסוכים (ראו לדוגמא ע""פ 6910/09 הדרה נ' מדינת ישראל (9/5/2010)). הדברים אמורים ביתר שאת כאשר אלימות זו מופנית כלפי בעל תפקיד. נפגעי העבירה בענייננו סרבו להכניס את הנאשמים למועדון ובשל כך התעורר פרץ האלימות משולל הרסן.",מתחמי העונש ההולם
"ת""פ 51912-09-23","בית משפט העליון עמד לא אחת על חומרתן של עבירות הנשק המקימות סיכון חמור ביותר וממשי לנפגע ולציבור כולו, ולפיכך ראויות לענישה מחמירה בדמות מאסר לתקופות הולמות ומשמעותיות. הדברים אמורים הן בנוגע לנשיאת נשק, ובוודאי גם כאשר נעשה בו שימוש. נקבע לא אחת כי עבירות אלה לא רק מקימות סיכון ממשי לציבור, אלא מבססות פוטנציאל הסלמה ופגיעה בחפים מפשע נוספים ועוברי אורח (ראו לדוגמא ע""פ 6235/22 מדינת ישראל נ' חסארמה ( 21/6/2023)).",מתחמי העונש ההולם
"ת""פ 51912-09-23","במעשיהם, פגעו הנאשמים במידה משמעותית בערכים המוגנים האמורים לעיל, ופגיעה זו תקבל ביטוי הולם בענישה.",מתחמי העונש ההולם
"ת""פ 51912-09-23","אשר לפסיקה הנוהגת במקרים דומים- עיון בפסיקה מלמד על תוצאה של הטלת עונשי מאסר משמעותיים בעבירות אלימות במסגרתן נעשה שימוש בנשק קר, כחלק מהצורך להיאבק בתופעה. מגמה זו משקפת את הצורך בהחמרת הענישה בין היתר לצורך הרתעה. ברי, כי משך המאסר מביא לכלל ביטוי את הנסיבות הקונקרטיות של המעשה מושא גזר הדין.",מתחמי העונש ההולם
"ת""פ 51912-09-23","ע""פ 3867/23 מדינת ישראל נ' שנקור (11/7/2023) במסגרתו הוחמרה ענישה שהוטלה בבית משפט המחוזי ל- 45 חודשי מאסר. בהתאם לעובדות, בעקבות קטטה בין המתלונן למשיב, בקיוסק, דקר המשיב פעמיים את המתלונן בפלג גופו העליון, ובהמשך דקר פעם נוספת באזור הבטן. בין היתר, נגרם למתלונן פצע עמוק בבטן אשר הצריך ניתוח. חרף גילו הצעיר של המשיב, לחובתו הרשעות קודמות מרובות, כאשר תסקיר שירות המבחן הצביע על מסוכנות גבוהה.",מתחמי העונש ההולם
"ת""פ 51912-09-23","ע""פ 8587/20 חסון נ' מדינת ישראל (8/12/2021) במסגרתו נאשם הורשע לאחר שניהל הוכחות בדקירה על רקע סכסוך שכנים. למתלונן נגרם חתך מאסיבי. הנאשם אף תקף שוטרים ואיים עליהם. נקבע מתחם הנע בין 2-5 שנות מאסר, והוטל על הנאשם עונש של 3.5 שנות מאסר, לצד רכיבי ענישה נוספים. ",מתחמי העונש ההולם
"ת""פ 51912-09-23","ע""פ 425/23 מדינת ישראל נ' Teklu (4/7/2023) במסגרתו הורשע המשיב על יסוד הודאתו, ללא הסדר טיעון, בכך ששיסף את גרונו של המתלונן (שניהם נתינים זרים ומכירים זה את זה). המתלונן נזקק לניתוח חירום. בית משפט המחוזי קבע מתחם הנע בין 22 ל- 52 חודשי מאסר, וגזר 32 חודשי מאסר. עונשו הועמד במסגרת ערעור המדינה על 48 חודשי מאסר בפועל.",מתחמי העונש ההולם
"ת""פ 51912-09-23","ב""כ נאשם 1 הפנה לת""פ 5295-09-19 מדינת ישראל נ' עבדאלג'ני (3/8/2020) במסגרתו הוטלו בין היתר 24 חודשי מאסר בפועל לנאשם אשר תקף את בן זוגה של גרושתו במפתח ברגים וכן הדיח בחקירה ושיבש מהלכי משפט. ניתן משקל לנסיבותיו האישיות, היות נעדר הרשעות ולמצבו הנפשי באותה תקופה שהיה לו השפעה על ביצוע המעשים. ",מתחמי העונש ההולם
"ת""פ 51912-09-23","באשר לעבירות בנשק ראוי להפנות לת""פ 56731-07-23 מדינת ישראל נ' אבוחסרה (22/5/2023) במסגרתו הורשע הנאשם בכך שנשא נשק וירה לעבר בנין 3 כדורים. בעת הימלטותו ירה לעבר שוטרים ונפגע בעצמו מירי לכיוונו. על הנאשם, בעל עבר פלילי שסיים לרצות מאסר, הוטל עונש של 5 שנות מאסר.",מתחמי העונש ההולם
"ת""פ 51912-09-23","ת""פ 28139-10-13 מדינת ישראל נ' אבו עאמר (18/1/2015) במסגרתו נדון הנאשם ל-4 שנות מאסר בגין ניסיון חבלה חמורה והחזקת נשק, בגין ניסיון לחבול באמצעות ירי לעבר רכב בו ישבה משפחת המתלונן שלא נפגעה. ",מתחמי העונש ההולם
"ת""פ 51912-09-23","פסיקה נוספת אליה הפנה ב""כ נאשם 2 שונה מענייננו, כך למשל במסגרת ת""פ 5388-11-13 נדון נאשם ל- 18 חודשי מאסר בגין חבלה חמורה ונשיאת נשק והובאו בחשבון נתוני שיהוי, התרשמות שירות המבחן בנוגע לדפוסיו ועברו הנקי.",מתחמי העונש ההולם
"ת""פ 51912-09-23","לאור האמור, ובהתחשב במדיניות הענישה הנוהגת במקרים בהם אופי העבירות וטיב המעשים הם כאלה שניתן להקיש מהם לענייננו, ובנסיבות הקונקרטיות של עניין זה כפי שפורטו לעיל, בשים לב לעוצמת הפגיעה בערכים המוגנים, ראיתי לקבוע מתחמי ענישה, כדלקמן:",קביעת המתחמים
"ת""פ 51912-09-23",לנאשם 1- המתחם נע מ-38 חודשי מאסר ועד 72 חודשי מאסר,קביעת המתחמים
"ת""פ 51912-09-23",לנאשם 2- המתחם נע מ- 54 חודשי מאסר ועד 84 חודשי מאסר,קביעת המתחמים
"ת""פ 51912-09-23","בהינתן מתחמי הענישה האמורים אותם קבעתי, ייקבע העונש המתאים לכל אחד מהנאשמים, בהתחשב בנסיבות אשר אינן קשורות בביצוע העבירות, להלן.",קביעת העונש המתאים לנאשמים
"ת""פ 51912-09-23","הנאשמים הודו ונטלו אחריות על מעשיהם בשלב מוקדם בהליך וללא הבטחה עונשית מצד המאשימה. אמנם בהליך החלו להישמע ראיות, אולם מדובר היה בשלב לא מתקדם ולא העידו עדים מרכזיים לרבות נפגעי העבירה. בסופו של הליך גישור, אף תוקן כתב האישום, במסגרתו הודו הנאשמים. נטילת האחריות באה לכלל ביטוי גם בדבריהם האחרון בבית המשפט.",קביעת העונש המתאים לנאשמים
"ת""פ 51912-09-23","לנאשם 1, בן 26, הרשעה קודמת בעבירות של איומים והיזק לרכוש במזיד, משנת 2022 בגינה הוטל עליו מאסר מותנה והתחייבות להימנע מעבירה.",קביעת העונש המתאים לנאשמים
"ת""פ 51912-09-23","לנאשם 2, בן 21, הרשעה בגין עבירות רכוש איומים תקיפה וסמים משנת 2022 על דרך של צירוף תיקים בבית משפט לנוער, בגינה ריצה מאסר למשך 6 חודשים. והרשעה נוספת מאותה שנה בגין תקיפה וחבלה, הפרת הוראה חוקית, ועבירת רכוש, בגינה ריצה 8 חודשי מאסר בפועל. תלויים ועומדים כנגדו מאסר על תנאי של 8 חודשים, ושל 5 חודשים.",קביעת העונש המתאים לנאשמים
