verdict,text,part
"ת""פ 25624-03-22","	בנוסף, הבאתי בחשבון את הנזק הפוטנציאלי שעלול היה להיגרם כתוצאה מביצוע העבירות. הנאשם הורשע בעבירה של עסקה בנשק, במסגרתה הועבר תת מקלע מאולתר מסוג קרלו לידי מואמן. מגזר הדין שהוגש בעניינו של מואמן עולה כי הלה עשה שימוש בנשק (אם כי מדובר בנשק אחר) על מנת לבצע ירי לעבר משרדי מפלגת חד""ש. בנוסף קשר אותו מואמן קשר עם אחרים לבצע ירי לעבר ביתו של תושב סכנין בגין חוב כספי, תוך שימוש בנשק מושא הדיון בענייננו. מזימה זו לא יצאה בסופו של דבר אל הפועל משום שהמשטרה תפסה את הנשק במהלך בדיקה אקראית. אילולא כן אין לדעת את היקף הנזקים שהיו נגרמים כתוצאה מהשימוש בנשק מושא הדיון. בע""פ 4456/21 מדינת ישראל נ' אבו עבסה (23.1.2022) עמד בית המשפט על הפגיעה הרחבה הנגרמת לחברה בכללותה כתוצאה משימוש בנשק המוחזק באופן בלתי חוקי בציינו כי:",קביעת מתחם העונש ההולם
"ת""פ 25624-03-22","'השימוש בנשק חם ככלי ליישוב סכסוכים הפך לרעה חולה, וכמעשה של יום ביומו גובה חיי אדם ולעיתים אף את חייהם של חפים מפשע אשר כל חטאם היה כי התהלכו באותה עת ברחובה של עיר. בשנים האחרונות אף חלה עליה מתמדת במספר אירועי הירי המדווחים למשטרה (ראו למשל: דו""ח מבקר המדינה התמודדות משטרת ישראל עם החזקת אמצעי לחימה לא חוקיים ואירועי ירי ביישובי החברה הערבית וביישובים מעורבים 28(2018) ) על רקע המציאות אותה אנו חווים למרבה הצער מדי יום, אנו עדים לקריאה ציבורית נרגשת להגברת האכיפה כלפי עבירות נשק – ולהחמרה במדיניות הענישה הנוהגת...'.",קביעת מתחם העונש ההולם
"ת""פ 25624-03-22","בהתאם לזאת, וכחלק מתפקידו של בית המשפט בביעורן של תופעות קשות אלו, קיימת חשיבות של ממש להטלת ענישה הולמת ומרתיעה על כל חוליות השרשרת העבריינית – החל מיצרני או מבריחי הנשק הבלתי חוקי, דרך הסוחרים בו, ועד לאלו הנוטלים אותו לידם ועושים בו שימוש בלתי חוקי.",קביעת מתחם העונש ההולם
"ת""פ 25624-03-22","עוד בנסיבות הקשורות בביצוע עבירת הנשק הבאתי בחשבון את חלקו של הנאשם בעסקה. אמנם לא הנאשם הוא זה שסיפק את הנשק, אלא קישר בין מואמן לבין הסוחר שמכר את הנשק תמורת סך 3,500 ₪. אולם הטענה כי חלקו התמצה בתיווך בלבד, חוטאת לאמת. לאחר שהצדדים הישירים לעסקה סיכמו את התמורה ששולמה בשטחי הרשות הפלסטינאית, הנאשם הוא זה שהכניס את הנשק משטחי הרשות לתחומי מדינת ישראל ומסר אותו לידי מואמן בעיר טייבה. מכאן שאין לומר כי חלקו בעסקה היה שולי או זניח.",קביעת מתחם העונש ההולם
"ת""פ 25624-03-22","עיון בפסיקה המתייחסת לעבירות בנשק מלמד על מנעד ענישה רחב אשר תלוי מטבע הדברים בנסיבות הפרטניות של כל מקרה ומקרה, לרבות כמות הנשק, סוגו, נסיבות ביצוע עסקת הנשק ומאפייניו האישיים של המבצע, ובכלל זאת עברו הפלילי וסיכויי שיקומו. כפי שצוין בהרחבה לעיל, מגמת הפסיקה בעבירות בנשק הנה להחמרה. עיון בפסיקה שדנה בעבירות בנשק בנסיבות דומות או קרובות, מלמד על מדיניות ענישה הכוללת בין היתר עונשי מאסר בפועל לתקופה ממושכת.",קביעת מתחם העונש ההולם
"ת""פ 25624-03-22","להלן מספר דוגמאות של פסקי דין בהם נדונו עבירות של סחר, רכישה והחזקה של כלי נשק. אני ער לכך שחלק מאותם פסקי דין מתייחסים לנסיבות חמורות מאלו שבענייננו. יחד עם זאת, יש בדוגמאות שלהלן כדי ללמד על מדיניות הענישה הנוהגת.",קביעת מתחם העונש ההולם
"ת""פ 25624-03-22","	בע""פ 1944/20 אמארה נ' מדינת ישראל (2.9.20), נדחה ערעורו של מי שהורשע בעבירות של סחר בנשק שלא כדין (תת מקלע מסוג CZ ומחסנית ריקה שתואמת לנשק), החזקה ונשיאה של נשק, נהיגה ללא רישיון נהיגה תקף וללא פוליסת ביטוח תקפה. בית המשפט המחוזי קבע מתחם ענישה הנע בין 3 ל- 6 שנות מאסר בפועל, וגזר על המערער עונש של 6 שנות מאסר בפועל, לצד הפעלת מאסר על תנאי שנגזר עליו בתיק קודם.",קביעת מתחם העונש ההולם
"ת""פ 25624-03-22","	בע""פ 4456/21 לעיל (מדינת ישראל נ' אבו עבסה (23.1.22)), קיבל בית המשפט העליון את ערעורה של המדינה על קולת עונשו של המשיב, אשר היה חלק מחבורת צעירים שנהגה לסחור בכלי נשק, חלקי כלי נשק ותחמושת, והורשע בשישה אישומים בעבירות ניסיון ייצור וסחר בנשק, החזקת נשק ותחמושת, קשירת קשר לביצוע פשע ועוון, סחר בנשק ותחמושת והובלת נשק. בית המשפט המחוזי קבע מתחם עונש הולם הנע בין 4 ל-9 שנות מאסר, וגזר על המשיב 54 חודשי מאסר. כאמור, בית המשפט העליון קיבל את ערעור המדינה, קבע כי העונש שנגזר על המשיב סוטה לקולה באופן קיצוני ואינו מבטא באופן הולם את חומרת מעשיו, והעמיד את עונשו על 72 חודשי מאסר בפועל.",קביעת מתחם העונש ההולם
"ת""פ 25624-03-22","	בע""פ 8665/21 אגבאריה נ' מדינת ישראל (8.11.21), נדחה ערעורו של מי שהורשע בין היתר בעבירות של ייבוא ועשיית עסקה אחרת בנשק (שלושה תתי מקלעים ומחסניות). בית המשפט המחוזי קבע מתחם עונש הולם הנע בין 3 ל- 6 שנים, וגזר על המערער 4.5 שנות מאסר בפועל. כאמור, בית המשפט העליון דחה את הערעור, וקבע כי אין מקום להתערב בעונש שנגזר על המשיב, בין היתר בשל חומרת המעשים, כמות כלי הנשק, ומדיניות ההחמרה בעבירות נשק.",קביעת מתחם העונש ההולם
"ת""פ 25624-03-22","	בע""פ 315/20 פתחי אבו טאה נ' מדינת ישראל (7.6.20), דחה בית המשפט העליון ערעורים על גזר דינו של בית המשפט המחוזי, במסגרתו הושתו על המערערים עונשי מאסר בפועל של 54 ו-36 חודשים, וזאת בגין עבירות נשק, ובכללן סחר ועסקה אחרת בנשק (רובה מסוג קרלו ושני תתי מקלע מאולתרים). באותו מקרה העמיד בית המשפט המחוזי את מתחם הענישה בעניינו של אחד הנאשמים על תקופה שבין  3.5 ל- 5.5 שנות מאסר; ומתחם הענישה ההולם בעניינו של האחר על תקופה שבין 3 ל- 5 שנות מאסר.",קביעת מתחם העונש ההולם
"ת""פ 25624-03-22","	בע""פ 147/21 מדינת ישראל נ' ביטון (14.2.21), קיבל בית המשפט העליון את ערעור המדינה על קולת עונשו של המשיב, אשר הורשע בעבירות נשק (רכישה והחזקה), לאחר שביקש לרכוש אקדח, תחמושת ולבנת חבלה, וזאת מאדם אשר נעצר בדרכו ונשא עליו את כלי הנשק הנ""ל. בית המשפט המחוזי קבע כי מתחם הענישה ההולם נע בין 15 ל- 36 חודשי מאסר בפועל, וגזר על המשיב עליו 18 חודשי מאסר בפועל. כאמור, בית המשפט העליון קיבל את ערעור המדינה, והעמיד את עונשו של המשיב על 3 שנות מאסר, זאת לאחר שנקבע כי גזר הדין שניתן עומד בסתירה למדיניות ההחמרה עם עברייני הנשק לסוגיהם; וכי רק בנסיבות חריגות ביותר יהא ניתן להסתפק בעונש של 18 חודשי מאסר בפועל.",קביעת מתחם העונש ההולם
"ת""פ 25624-03-22","	בת""פ (מחוזי ב""ש) 54607-07-19 מדינת ישראל נ'  ג'בור (12.1.20), הורשע הנאשם בהחזקת M16 ומחסנית ריקה, ונגזר עליו עונש של 22 חודשי מאסר, זאת לאחר שבית המשפט המחוזי קבע בעניינו מתחם ענישה הנע בין 30-20 חודשי מאסר בפועל.",קביעת מתחם העונש ההולם
"ת""פ 25624-03-22","	בע""פ 3793/20 מורייחי נ' מדינת ישראל (23.11.20), נדחה ערעורו של מי שהורשע בעבירה של ניסיון לעסקה אחרת בנשק, שעה שקשר עם אחרים קשר לביצוע מכירה והעברה של אקדח ומחסנית תואמת. בית המשפט המחוזי העמיד את מתחם הענישה על תקופה שבין 18 ל- 52 חודשי מאסר, וגזר על המערער 30 חודשי מאסר בפועל. כאמור, בית המשפט העליון דחה את הערעור, תוך שציין שענישה מחמירה נדרשת לכל חוליה בשרשרת של עבירת הסחר בנשק.",קביעת מתחם העונש ההולם
"ת""פ 25624-03-22","	בע""פ 1658/20 ג'מאחנה נ' מדינת ישראל (21.06.20), נדחה ערעורו של מי שהורשע בעבירות של נשיאה והובלה של נשק ורכישת נשק, ונגזר עליו עונש של 24 חודשי מאסר בפועל. במקרה הנדון רכש המערער לעצמו, שלא כדין, נשק מסוג M16 תמורת 2,000 ₪. כאמור, בית המשפט העליון דחה את הערעור, תוך שציין כי העונש שהוטל על המערער הינו מאוזן ואולי אף מקל.",קביעת מתחם העונש ההולם
"ת""פ 25624-03-22","לאחר שבחנתי את הערכים המוגנים שנפגעו כתוצאה מביצוע העבירות בענייננו, את נסיבות ביצוען ואת מדיניות הענישה הנוהגת, אני קובע כי מתחם העונש ההולם בגין שתי העבירות בהן הורשע הנאשם נע בין 30 - 60 חודשי מאסר.",קביעת מתחם העונש ההולם
"ת""פ 25624-03-22","בבואי לגזור את עונשו של הנאשם בתוך המתחם אני רואה להתחשב בהודאתו שניתנה בשלב מוקדם של ההליך, עוד בטרם החלה שמיעת הראיות. הודאתו לא זו בלבד שחסכה זמן שיפוטי יקר אלא שהיא מגלמת בחובה נטילת אחריות מצדו על מעשיו.",גזירת העונש בתוך המתחם
"ת""פ 25624-03-22","הבאתי בחשבון גם את הרשעתו הקודמת של הנאשם. אמנם לא מדובר בעבירות חמורות, אך מנגד גם לא  מדובר במי שזוהי הרשעתו היחידה. יוער כי במסגרת תיק 58907-07-22 שהוגש לאחר כתב האישום בתיק דנא, הורשע הנאשם בעבירה של קשירת קשר לפשע, בכך שקשר עם אחר קשר לקדם עסקת נשק (תחמושת), כפי העולה מגזר הדין שהוצג (מ/2). בגין אותה הרשעה נדון הנאשם ביום 3.10.2022 למאסר לתקופה החופפת את מעצרו מיום 18.7.2022 ועד 3.10.2022. לפיכך, ימים אלה לא יבואו במניין התקופה לצורך חישוב מאסרו בגין תיק זה.",גזירת העונש בתוך המתחם
"ת""פ 25624-03-22","סיכומו של דבר, אני גוזר על הנאשם את העונשים הבאים:",גזירת העונש בתוך המתחם
"ת""פ 25624-03-22","א.	36 חודשי מאסר לריצוי בפועל בניכוי ימי מעצרו מיום 28.2.2022 ועד היום, למעט התקופה שבין 18.7.2022 ועד 3.10.2022 שלא תבוא במניין הימים שינוכו.",גזירת העונש בתוך המתחם
"ת""פ 25624-03-22","	ב.	אני מורה על הפעלת המאסר המותנה בן שבועיים שהוטל על הנאשם על ידי בית המשפט המחוזי מרכז-לוד בת""פ 1961-03-22 באופן חופף לעונש המאסר בגין תיק זה. ",גזירת העונש בתוך המתחם
"ת""פ 25624-03-22","ג.	10 חודשי מאסר על תנאי לבל יעבור משך שלוש שנים ממועד שחרורו, כל עבירת נשק מסוג פשע ויורשע בגינה.",גזירת העונש בתוך המתחם
"ת""פ 25624-03-22",זכות ערעור לבית המשפט העליון תוך 45 ימים. ,גזירת העונש בתוך המתחם
"ת""פ 25624-03-22","54678313ניתן היום, א' שבט תשפ""ג, 23 ינואר 2023, במעמד הנוכחים.",5129371
"ת""פ 25624-03-22","בעניין עריכה ושינויים במסמכי פסיקה, חקיקה ועוד באתר נבו – הקש כאן",5129371
"ת""פ 25624-03-22",אמיר טובי 54678313-/,5129371
