verdict,text,part
"ת""פ 32787-10-18","תסקיר שירות המבחן מעלה כי לנאשם נסיבות חיים קשות. הוא גדל בתנאי דחק ומצוקה, בצל אב אלים ואלכוהוליסט ונעדר תפקוד והתמודד עם אובדן של אמו ממחלה בגיל צעיר. השירות התרשם כי מגיל צעיר הנאשם מתמודד עם תפקידים שאינם מותאמים ליכולותיו ולהתפתחותו הרגשית וכל זאת ללא מעורבות תמיכתית או טיפולית כלשהי. הגם שהנאשם שיתף פעולה עם השירות, הוא התקשה להתייחס באופן מעמיק לנסיבות שעמדו בבסיס התנהגותו ולמעורבותו בקשרים שוליים, והשירות התרשם כי הנאשם אינו מכיר בחומרת התנהגותו וקבע כי רמת הסיכון למעורבותו בעבירות אלימות הינה בינונית ברמת חומרה נמוכה. הנאשם לא מסר בדיקות שתן לאיתור סמים כנדרש, והבדיקה היחידה שמסר הצביעה על שימוש בסם מסוג גראס.",מתחם העונש ההולם
"ת""פ 32787-10-18","לא ניתן להתעלם מטענות ב""כ הנאשם בדבר התנהלות תמוהה של המשטרה כלפי הנאשם במסגרת החקירה, בהשוואה להתנהלותה ביחס ליתר המעורבים באירוע. טענות אלה מקבלות משנה תוקף נוכח דו""חות הפעולה שהוגשו במסגרת הראיות לעונש, מהם עולה כי במהלך האירוע נצפה הרכב מושא כתב האישום כשבתוכו ישובים שניים – איברהים, בעל הרכב ומי שנהג ברכב, ולצדו איאד, כשהשניים אף היו תחת השפעת אלכוהול. בנוסף, כשהתקרבה ניידת המשטרה לרכב, נזרק אחד מכלי הנשק מהחלון הקדמי של הרכב (ת/1), ונשק נוסף וכדורי תחמושת נתפסו במושב האחורי ועל רצפת הרכב (ת/2). למרות שעל פניו, ולכאורה, די באמור בדו""חות הפעולה של שלושת השוטרים שנכחו בזירה כדי לקיים את יסודותיה העובדתיים והנפשיים של עבירת החזקת נשק בעניינם של איברהים ואיאד, לצד בסיס ראייתי, לכאורה, בעבירות נוספות של הפרעה לשוטר, שיבוש מהלכי משפט ונהיגה תחת השפעת אלכוהול, הרי שהתיק בעניינם נסגר. ודוק: חרף העובדה שניתנה למאשימה הזדמנות להגיש חומר ראיות שיש בו לשפוך אור אחר על ההתרחשות מושא כתב האישום ועל החקירה שהתנהלה, היא בחרה שלא לעשות כן, והסתפקה בהפניה כללית להכחשה גורפת של איברהים ואיאד, לתרגיל חקירה שבוצע להם במסגרתו הפלילו את הנאשם ולחקירה מאוחרת שבוצעה לנאשם, לאחר שהוטח בו שהופלל על ידי השניים, במסגרתה הודה בהחזקת כלי הנשק.",מתחם העונש ההולם
"ת""פ 32787-10-18","בית המשפט אינו ""תובע-על"", ולא מחליף את שיקול דעת התביעה הכללית בשיקול דעתו שלו, מה גם שבמקרה דנן לא נחשפתי למכלול חומר הראיות, ועל כן, הדברים שנכתבו לעיל נאמרים בזהירות הראויה (ראה והשווה: רע""פ 7052/18 מדינת ישראל נ' רותם (5.5.20); בג""ץ 5752/17 פלונית נ' פרקליטות המדינה (9.9.19)).",מתחם העונש ההולם
"ת""פ 32787-10-18","יחד עם זאת, לא ניתן להתעלם מכך שבעתירתה לקביעת מתחם עונש מקל (לעומת מתחמים לה עותרת בהתאם להנחיית פרקליט המדינה), ובבקשתה למיקום עונשו של הנאשם בתחתית המתחם (חרף האמור בתסקיר שירות המבחן), הרי שגם המאשימה מודה שאין מדובר בסיטואציה ""רגילה"" וכי יש לנהוג בנאשם אחרת נוכח העובדה שהוא היחיד שהורשע בהחזקת כלי הנשק והוא היחיד שיישא בעונש מאסר. התביעה עצמה, בטיעוניה לעונש דיברה על קשיים ראייתיים, בהיבט של אי העמדה לדין של מעורבים אחרים, שהביאה אותה לעתירה על פי מתחם עונש מקל.",מתחם העונש ההולם
"ת""פ 32787-10-18","הפסיקה התייחסה, לא אחת, לנסיבות בהן עומד נאשם אחד לדין בעוד שנגד אחרים התיק נסגר כאשר עומדת נגדם תשתית ראייתית דומה. עוד עמדה הפסיקה על חשיבותו של עקרון אחידות הענישה. אמנם נקבע כי עיקרון אחידות הענישה אינו חזות הכל, וכי הוא נועד למנוע אפליה בין נאשמים שפשעו יחדיו ובנסיבות דומות, אך לא בא לכפות על בית המשפט אמת-מידה עונשית מוטעית, רק מפני שהיא ננקטה במקרהו של אחד הנאשמים המשותפים (דנ""פ 1729/14 ערפאת ביומי נ' מדינת ישראל (23.4.14); דנ""פ 1109/02 מרדכי שושני נ' מדינת ישראל (12.2.02)). יחד עם זאת, הפסיקה קבעה כי יש לאזן את עקרון אחידות הענישה אל מול עקרון ההלימה שנקבע כעקרון המנחה בענישה, כאמור בסעיף 40ב' לחוק העונשין.",מתחם העונש ההולם
"ת""פ 32787-10-18","כך, בית המשפט העליון הכיר בחריגה משמעותית לקולא ממתחם הענישה אך ורק בשל עקרון אחידות הענישה והותיר על כנה את קביעת בית המשפט המחוזי לפיה הגם שנקבע כי עקרון אחידות הענישה אינו נכלל במפורש בתיקון 113 לחוק, הרי שבהתאם לאמור בסעיף 40יב' לחוק, רשאי בית המשפט לשקול נסיבות נוספות הקשורות בביצוע העבירה (ע""פ 4761/15 אמיר ג'ורבאן נ' מדינת ישראל (23.11.15); ת""פ (מחוזי חי') 42927-05-14 מדינת ישראל נ' אמיר ג'ורבאן (22.6.15)).",מתחם העונש ההולם
"ת""פ 32787-10-18","במקרה אחר, בע""פ 9545/09 ריואן עז אלדין נ' מדינת ישראל (24.3.10) הקל בית המשפט העליון בעונשו של נאשם, למרות שקבע כי עונשו אינו סוטה, לכשעצמו, ממדיניות הענישה הראויה, אולם ראוי להתערבות לאור עקרון אחידות הענישה.",מתחם העונש ההולם
"ת""פ 32787-10-18","לעניין טענת אכיפה בררנית שבאי העמדתם של מעורבים נוספים באירוע מושא כתב אישום, נקבע כי אין באי העמדתם של מעורבים נוספים לדין, כשלעצמו, כדי לבסס אכיפה בררנית, אלא במקום בו עלו שיקולים זרים או שרירותיות בהחלטות התביעה להעמיד לדין רק חלק מהמעורבים בפרשה. יחד עם זאת, יתכנו מקרים חריגים בהם תתקבל הטענה אף אם לא הוכח מניע זר, ובתנאי שהתשתית הראייתית אשר בבסיס החשדות כלפי כל אחד מהמעורבים דומה (ע""פ 7216/20 שמואל קינן קליין נ' מדינת ישראל (18.2.21); וראה גם: ע""פ 5805/19 קליינמן נ' מדינת ישראל, (28.12.20)).",מתחם העונש ההולם
"ת""פ 32787-10-18","בענייננו, לא זו בלבד שב""כ הנאשם הגיש חומרי חקירה המצביעים על מעורבותם, לכאורה, של איברהים ואיאד בעבירה, אלא שכאמור ב""כ המאשימה אף לא הגישה מטעמה חומרי חקירה שיתמכו בטענתה ל""שוני ראייתי"" בינם לבין הנאשם, ואף עתרה לקביעת מתחם עונש הולם מקל מזה לו טוענת בדרך כלל. גם עיון בגזר דינו של הקטין מעלה כי הגם שחלקו באירוע דומה עד זהה לזה של הנאשם (על פי האמור בכתב האישום), העבירה בעניינו הומרה לעבירה קלה משמעותית מזו שיוחסה לו ולנאשם בתחילה, והתיק נגדו הסתיים ללא הרשעה. אף בכך יש כדי לפגוע בתחושת הצדק.",מתחם העונש ההולם
"ת""פ 32787-10-18","משכך, מצאתי לקבוע מתחם עונש הולם המתאים לנסיבותיו המיוחדות של האירוע, כמפורט לעיל, הנע בין 17 ל-40 חודשי מאסר.",מתחם העונש ההולם
"ת""פ 32787-10-18",נוכח גילו הצעיר של הנאשם; היעדר עבר פלילי; נסיבות חיים קשות כמפורט בתסקיר שירות המבחן; הודאה ונטילת אחריות; חסכון בזמן שיפוטי; חלוף זמן רב מאז ביצוע העבירה; העובדה שהנאשם היה עצור בגין תיק זה משך כשבועיים; היותו של הנאשם נתון בתנאים מגבילים משך זמן רב מאוד; ומבלי להתעלם מהעובדה שהנאשם לא נרתם להליך שיקומי ועישן גראס במהלך שהייתו במעצר הבית הממושך – מצאתי למקם עונשו של הנאשם בתחתית המתחם.,מתחם העונש ההולם
"ת""פ 32787-10-18","לאור האמור לעיל, אני גוזר על הנאשם את העונשים הבאים:",מתחם העונש ההולם
"ת""פ 32787-10-18","17 חודשי מאסר בניכוי ימי מעצרו, 9.10.18 עד ליום 21.10.18.",מתחם העונש ההולם
"ת""פ 32787-10-18","הנאשם יתייצב לריצוי מאסרו ביום 16.5.21 שעה 10:00 בבית סוהר ""הדרים"" כשבידו תעודת זהות. התנאים המגבילים והערבויות הכספיות שהוטלו על הנאשם במסגרת הליך המעצר עד תום ההליכים ימשיכו לחול עד להתייצבות הנאשם למאסר.",מתחם העונש ההולם
"ת""פ 32787-10-18","9 חודשי מאסר על תנאי למשך 3 שנים מיום שחרורו, והתנאי שלא יעבור כל עבירת נשק מסוג פשע.",מתחם העונש ההולם
"ת""פ 32787-10-18","6 חודשי מאסר על תנאי למשך 3 שנים מיום שחרורו, והתנאי שלא יעבור כל עבירת נשק מסוג עוון.",מתחם העונש ההולם
"ת""פ 32787-10-18","קנס כספי בסך 3,500 ₪ או 15 ימי מאסר תמורתו. הקנס ישולם ב-10 תשלומים חודשיים, שווים ורצופים, החל ביום 15.5.21. לא ישולם תשלום במועדו, יעמוד כל הסכום לפירעון מיידי.",מתחם העונש ההולם
"ת""פ 32787-10-18","	לבקשת ב""כ הנאשם, ובהסכמת הנאשם, יועבר סכום על חשבון הקנס מהפקדה שהפקיד הנאשם במסגרת תיק מ""ת 32829-10-28. היתרה תישאר מופקדת לצורך הבטחת התייצבותו של הנאשם למאסר, כמפורט לעיל. ",מתחם העונש ההולם
"ת""פ 32787-10-18",זכות ערעור לבית המשפט המחוזי מרכז בתוך 45 יום.,מתחם העונש ההולם
"ת""פ 32787-10-18",מוצגים – כלי נשק ותחמושת – יושמדו. ,מתחם העונש ההולם
"ת""פ 32787-10-18",5129371ניתן צו כללי למוצגים. ,מתחם העונש ההולם
"ת""פ 32787-10-18","ניתן היום,  ט' ניסן תשפ""א, 22 מרץ 2021, במעמד ב""כ המאשימה, עו""ד ראזי בטחיש, הנאשם ובא-כוחו.",54678313
"ת""פ 32787-10-18","בעניין עריכה ושינויים במסמכי פסיקה, חקיקה ועוד באתר נבו – הקש כאן",5129371
"ת""פ 32787-10-18",אביב שרון 54678313-/,5129371
