verdict,text,part
"ת""פ 3728-01-15","ת""פ 3728-01-15 מדינת ישראל נ' עזאם",בית המשפט המחוזי מרכז-לוד
"ת""פ 3728-01-15","על ידי ב""כ עו""ד נעמה טל", מדינת ישראל
"ת""פ 3728-01-15","על ידי ב""כ עו""ד ג'ואד נאטור",סעיד עזאם
"ת""פ 3728-01-15","חוק העונשין, תשל""ז-1977: סע'  40ג(ב), 40ט, 144(ב), 40יג, 454",חקיקה שאוזכרה: 
"ת""פ 3728-01-15","הנאשם הורשע על פי הודאתו בכתב אישום מתוקן, שייחס לו שתי עבירות של היזק בחומר נפץ (לפי סעיף 454 לחוק העונשין, התשל""ז-1977 [החוק]) ועבירה של נשיאת נשק (לפי סעיף 144(ב) לחוק).",הרקע וכתב האישום
"ת""פ 3728-01-15","ביום 18.12.14 בשעת בוקר, נהג הנאשם בכלי רכב. לצידו במכונית ישב בן דודו הצעיר, אמיל, שהיה באותה תקופה בקשר רומנטי עם ו.ס מטירה. עובר לאותו יום, התגלע סכסוך בין ו.ס ל-ס.מ, שבבעלות משפחתה מאפיית ""אלמדינה"" בטייבה. הנאשם ואמיל נסעו ביחד במכונית בטייבה, לאחר מכן נסעו לכפר סבא, שם רכשו משקה אלכוהולי ומשם נסעו יחדיו למקום הסמוך ליישוב סלעית, שם שתו וודקה יחדיו.",הרקע וכתב האישום
"ת""פ 3728-01-15","בשעות הצהריים חזרו הנאשם ואמיל לטייבה, כשהנאשם נוהג ואמיל יושב לצידו, וברשותם שני רימוני הלם. לקראת השעה 14:00, כשהגיעו השניים בסמוך לבית הקברות הישן בטייבה, האט הנאשם את נסיעתו, אמיל השליך מהחלון הקדמי במכונית את אחד הרימונים למדרכה, הנאשם האיץ את נסיעתו והשניים נמלטו מהמקום. הרימון התפוצץ על המדרכה, כשזמן קצר לפני כן עברו במקום אישה ופעוט.",הרקע וכתב האישום
"ת""פ 3728-01-15","המאפיה בנויה ממתחם חיצוני ופנימי. השניים נסעו מכיוון מערב למזרח, כשהמאפיה נמצאת משמאל לרכב. מטרים ספורים לאחר המאפיה עצר הנאשם את הרכב, אמיל ירד מהרכב כשבידו הרימון השני וכשהוא מסתיר את פניו בעזרת חולצתו. אמיל רץ לתוך המאפיה והשליך את הרימון, שהתפוצץ במתחם החיצוני של המאפיה, כשבאותה שעה היו בחלק האחורי של המאפיה הוריה של ס.מ ופועל נוסף. כתוצאה מהתפוצצות הרימון נגרמו במאפיה נזקים, ונהרסו מחשב וארון זכוכית.",הרקע וכתב האישום
"ת""פ 3728-01-15","בינתיים הנאשם ביצע פניית פרסה לכיוון מערב, על מנת לאסוף את אמיל, שיצא מהמאפיה בריצה. כשראה את אמיל, קרא לו הנאשם בצעקה, אמיל חצה את הכביש ונכנס בריצה לרכב, הנאשם נסע לאחור, הסתובב ונמלט בנסיעה מהירה. בהמשך הסיע הנאשם את אמיל לטירה ומיד בסמוך לכך גם התקשר ל-ו.ס ודיווח לה על האֵרוע.",הרקע וכתב האישום
"ת""פ 3728-01-15","הצדדים הגיעו להסדר טיעון שבמסגרתו תוקן כתב האישום לקולא, הנאשם הודה והוסכם כי יישלח לשירות המבחן לשם קבלת תסקיר. הצדדים לא הגיעו להסכמה עונשית.",הרקע וכתב האישום
"ת""פ 3728-01-15","שירות המבחן הגיש תסקיר (ביום 7.4.16). מהתסקיר עולה כי הנאשם בן 26, רווק, שוהה ממאי 2015 במעצר בפיקוח אלקטרוני ובפיקוח הוריו בדירה שכורה. הנאשם סיים 12 שנות לימוד, ובידיו תעודת בגרות חלקית. לאחר הלימודים עבד הנאשם בעבודות זמניות. לנאשם אין עבר פלילי ואין לחובתו, מלבד תיק זה, תיקים פתוחים נוספים. הנאשם תיאר כי בתקופה שטרם מעצרו, ועל רקע בעיות בביתו, החל לבלות זמן רב מחוץ לבית, התחבר לחברה שולית, החל לשתות אלכוהול ועבד באורח לא יציב. הנאשם מסר כי הפסיק את השימוש באלכוהול בכוחות עצמו לאחר שהבין את השלכותיו על מצבו.",הרקע וכתב האישום
"ת""פ 3728-01-15","באשר לעבירות שבהן הודה, תיאר הנאשם כי ביום האירוע בילה עם בן דודו, שותפו לעבירה, בשתיית אלכוהול, ובדרך חזרה לביתם הציע בן דודו כי יבצעו את המעשים מושא כתב האישום. הנאשם הסכים לבצעם, שמא ייתפס בעיניי בן דודו והאחרים כאדם חלש. לדבריו, מאז מעצרו הבין את הבעייתיות בהתנהלותו ומבין כיום את חומרת מעשיו. משיחה עם אבי הנאשם התרשמה קצינת המבחן כי האב אינו מודע למורכבות מצבו הרגשי של בנו והוא עסוק במחירים החומריים שאותם הוא משלם בגין מעשיי הנאשם. עוד צוין כי ניסיונות לשוחח עם המתלונן לא צלחו, אך הוצג לקצינת המבחן הסכם ""סולחה"" שנערך בין שותפו של הנאשם לעבירות ובין המתלוננים.",הרקע וכתב האישום
"ת""פ 3728-01-15","מבחינת גורמי הסיכון להישנות התנהגותו של הנאשם, לקח שירות המבחן בחשבון את אופי העבירות ומאפייניהן, את קשייו של הנאשם לקחת אחריות על התנהגותו, עבודתו בעבודות מזדמנות, התחברותו השולית על רקע הצורך בהשתייכות והתרשמות שירות המבחן מדפוסים של ריצוי וחוסר בשלות רגשית. מבחינת סיכויי שיקום שירות המבחן לקח בחשבון את העובדה כי הנאשם נעדר עבר פלילי ובמהלך ניהול התיק הקפיד על תנאי מעצרו במשך תקופה ממושכת. עוד צוין כי הנאשם בעל יכולת שיתוף ושוחח על מצבו באופן פתוח ואותנטי. לפיכך, העריך שירות המבחן כי ההליכים המשפטיים היוו עבורו גורם מרתיע ומציבי גבול ברור. שירות המבחן העריך כי הסיכון להישנות התנהגותו של הנאשם פחתה בעיתוי הנוכחי, אך נדרשת התערבות טיפולית להגברת הסיכוי וצמצום הסיכון.",הרקע וכתב האישום
"ת""פ 3728-01-15","מכל האמור, המליץ שירות המבחן לאמץ את הפן הטיפולי והשיקומי ולהעמיד את הנאשם במבחן למשך שנה, לצד עונש מאסר על תנאי מרתיע.",הרקע וכתב האישום
"ת""פ 3728-01-15",הנאשם שהה במעצר מאחורי סורג ובריח בין 18.12.14 עד 25.8.15 ומאז ועד עתה שוהה במעצר בפיקוח אלקטרוני.,הרקע וכתב האישום
"ת""פ 3728-01-15","ב""כ המאשימה טענה כי זמינותו של נשק חם בידי מי שאינו מורשה לכך עלול להביא לביצוע עבירות חמורות, לפגיעה בחיי אדם ובחפים מפשע. עבירות הנשק הפכו כה נפוצות, עד כי ניתן לכנותן ""מכת מדינה"", או - במילותיו של הרכב בראשותו של הנשיא טל בבית משפט מחוזי מרכז: ""מכת האיזור"" (עפ""ג 27417-11-15 מדינת ישראל נ' עבד אל רחים [17.1.16]). במקרה דנן מדובר ברימוני הלם, שלא זו בלבד שהנאשם ושותפו נשאו אותם, שלא כדין, ברכבו של הנאשם, אלא אף השליכו אותם מהרכב, כאשר ברקע סכסוך, הקשור בקשר ישיר למקום השלכת הרימון השני. הרימון הראשון הושלך במקום ציבורי, באמצע היום, והשני במקום שבו שהו אנשים, שם נגרם נזק לרכוש. התובעת הזכירה, כי הנאשם עצמו לא היה ""בעל הסכסוך"", והוא היה המבוגר מבין שני השותפים, כך שניתן היה לצפות שישמש ""המבוגר האחראי"" באֵרוע. ואולם - לא זו בלבד שלא מנע משותפו לזרוק את הרימונים, ולא ניסה לעצור בעדו גם לאחר זריקת הרימון הראשון, אלא תחת זאת, סייע לו בצורה פעילה לבצע את זממו ולחמוק.",טיעונים לעונש
"ת""פ 3728-01-15","התובעת התייחסה גם לתכנון שקדם לעבירה, שכלל הצטיידות ברימונים ושתיית אלכוהול. היא ציינה כי לא ברור אם זריקת הרימון הראשון היה בבחינת ""ניסוי כלים"", או משהו אחר. היא ציינה את הנזק הפוטנציאלי, שיכול היה להיות גדול מאד, מאחר שכאן אין מדובר בנשיאת רימונים ותו לא, אלא בהשלכתם בפועל. למרבה המזל, הנזק הקונקרטי לא היה רב במיוחד.",טיעונים לעונש
"ת""פ 3728-01-15","בהתייחס לנסיבות שאינן קשורות בביצוע העבירה ביקשה ב""כ המאשימה לזקוף לזכות הנאשם את הודייתו והחסכון בזמן שיפוטי, את גילו הצעיר והעדר עבר פלילי. עוד ציינה את התסקיר של שירות המבחן, שהוא חיובי ברובו, ואת התרשמות שירות המבחן כי הסיכון שהנאשם יתנהג בצורה אלימה - פחת. עם זאת, אין בתסקיר התייחסות לסיכון עתידי, כאשר תפוג ההרתעה של ההליך הנוכחי על הנאשם. שירות המבחן סבור כי נדרשת התערבות טיפולית להגברת הסיכוי לאי מעורבות פלילית וצמצום הסיכון.",טיעונים לעונש
"ת""פ 3728-01-15","ב""כ המאשימה טענה שלפי עמדת המאשימה, מתחם העונש בגין ארועי כתב האישום נע בין 3 ל-6 שנות מאסר בפועל. בתוך המתחם סבורה המאשימה כי יש למקם את הנאשם בתחתית המתחם, וזאת, לטענתה, במובחן משותפו, אמיל, שהיה מחולל האֵרוע והמבצע העיקרי, ועל כן יש למקמו במקום גבוה יותר בתוך המתחם.",טיעונים לעונש
"ת""פ 3728-01-15","אשר לרכיבי ענישה נוספים טענה התובעת כי יש להטיל על הנאשם גם מאסר על תנאי מרתיע, קנס ופיצוי. אמנם, קיים הסכם סולחה בין הניצים בסכסוך שברקע כתב האישום, שבמסגרתו סוכם שהמתלוננים לא מעוניינים בפיצוי, אך האינטרס הציבורי מחייב השתת פיצוי שעל הפוגע לשלם לנפגע.",טיעונים לעונש
"ת""פ 3728-01-15","ב""כ הנאשם ביקש לאמץ את המלצת שירות המבחן להטיל על הנאשם עונש נושא פני עתיד, ותו לא, תוך הסתפקות בתקופת המעצר הממושכת מאחורי סורג ובריח, שהייתה מנת חלקו של הנאשם עובר להרשעתו, ובתקופת המעצר בפיקוח אלקטרוני, שנמשכת עד היום.",טיעונים לעונש
"ת""פ 3728-01-15","מדובר בצעיר, יליד 1990, נעדר כל עבר פלילי, שלקח אחריות על מה שיוחס לו בכתב האישום, הבין את חומרת המעשים ומביע חרטה מלאה על שעשה. זו הסתבכותו הראשונה עם החוק ומאז האֵרוע מושא כתב האישום לא נפתחו לו תיקים נוספים. הסניגור הזכיר את נסיבותיו המשפחתיות של הנאשם, ואת הקשיים שהשפיעו עליו לא מעט. יש לזקוף לזכות הנאשם את החסכון המשמעותי בזמן ציבורי, שכן אלמלא ההודיה, היו צריכים להעיד 21 עדי תביעה והמשפט היה אורך זמן רב.",טיעונים לעונש
"ת""פ 3728-01-15","לטענת ההגנה, לא ניתן לדבר על תכנון מוקדם, והא ראיה - מחיקת עבירת קשירת הקשר מכתב האישום המתוקן. אמנם, הנאשם ידע שברשותו שני רימונים, אך לא ידע כי בכוונת שותפו, בן דודו אמיל, להשליך את הרימון שעה שביקש ממנו להאט את נסיעת המכונית. רק לאחר השלכת הרימון הראשון הבין את תכניתו של השותף.",טיעונים לעונש
"ת""פ 3728-01-15","הסנגור הזכיר כי הנזק שנגרם היה לרכוש בלבד, ולמרבה המזל לא היו פגיעות בגוף. בשני המקרים לא הושלכו הרימונים לעבר אנשים. הרימון הראשון הושלך לאחר שהאישה והפעוט עברו במקום והרימון השני הושלך לקדמת המאפיה, כשהאנשים היו בחלקה האחורי. לטענתו, יש לזקוף לזכות הנאשם את העובדה שלא הבין את ההשלכות של המעשים, מאחר שהיה שתוי והיה תחת השפעת שותפו לעבירה.",טיעונים לעונש
"ת""פ 3728-01-15","הנאשם עבר ""תקופת צינון"" משמעותית. שבעה חודשים ושבוע שהה מאחורי סורג ובריח. לאחר מכן יצא מבית המעצר למעצר בפיקוח אלקטרוני, שבו הוא שוהה מזה תשעה חודשים. הוא לא הפר את המעצר בפיקוח אלקטרוני אפילו פעם אחת, הוא שוהה מחוץ לעיר מגוריו (טייבה) והוא התרחק מאותם אנשים שהשפיעו עליו לרעה וניתבו אותו לאורח חיים שולי. הוא חזר בתשובה בעזרת אביו, הפסיק לשתות אלכוהול ועבר שינוי משמעותי. הנאשם כעת אינו דומה למי שהיה עובר לביצוע העבירות. שירות המבחן מבקש לשלב את הנאשם בטיפול ייעודי לצעירים עוברי חוק והסניגור מציין כי גם האינטרס הציבורי מחייב שלא להחזיר את הנאשם אל הכלא, שם הוא עשוי ""להתערבב"" עם אנשים שישפיעו עליו לרעה.",טיעונים לעונש
"ת""פ 3728-01-15","הענישה היא אינדיווידואלית וחרף מגמת ההחמרה בענישה בגין עבירות נשק, יש לבצע בדיקה פרטנית של כל מקרה לגופו ובמקרה דנן יש להקל משמעותית.",טיעונים לעונש
"ת""פ 3728-01-15","בהתייחס לענישה הנוהגת ביקש הסנגור להבחין בין סוגי נשק שונים ולזכור שכאן מדובר ברימוני הלם. כפי שמבחינים בין סוגי סמים שעה שמענישים סוחר סמים, כך יש לעשות גם כאן, ואין רימון הלם דומה לרימון רסס או למטען חבלה, אף לא לאקדח, ובודאי שלא לרובה סער או רובה צלפים.",טיעונים לעונש
"ת""פ 3728-01-15","ההגנה הזכירה את הסכם הסולחה שנערך. במסגרתו, הנאשם לא הוזכר כמי שביצע את העבירות, כי המתלונן לא הכיר כלל את הנאשם ולא רצה שהוא ישב בסולחה. הסנגור (כמו גם שירות המבחן) רצה לאתר את המתלונן. למיטב ידיעתו, לא נערך הסכם סולחה בינו לבין הנאשם מאחר שהוא נעלם ולא ניתן היה לאתרו.",טיעונים לעונש
"ת""פ 3728-01-15","לדברי הנאשם ובא כוחו, ניתן להשלים את העונש על ידי הטלת פיצוי לטובת המתלונן בגין המעשים החמורים שעשה כלפיו הנאשם.",טיעונים לעונש
"ת""פ 3728-01-15","ההגנה עתרה לקביעת מתחם שונה מזה שייקבע לגבי השותף, וסבורה שהמתחם צריך להתחיל ממאסר על תנאי. לאחר שהסניגור שמע את הערת בית המשפט, שלפיה בכל הפסיקה שאליה הפנה אין אף פסק דין שמתקרב לענישה המקלה שהוא מבקש, תיקן עתירתו באופן שהמתחם ינוע בין עבודות שרות למאסר בפועל בן 10 חודשים, כאשר במקרה דנן - נוכח המעצר הממושך שהנאשם כבר נשא בו, לא יוטל עליו מאסר נוסף.",טיעונים לעונש
"ת""פ 3728-01-15","הנאשם בדבריו האחרונים ציין עד כמה הוא מתחרט על מעשיו. עוד הדגיש כמה קשה היה לו בבית הסוהר וביקש שלא להחזירו לשם. הוא ביקש שבית המשפט יתן בו אמון וישלח אותו לשיקום. לדבריו, התנתק מכל עולמו הקודם והוריו עזבו הכל כדי לסייע לו - מכרו את מכוניתם, אביו עזב את העבודה והם מרוכזים במתן עזרה לנאשם. הוא חש חוב גדול כלפי הוריו ולו מהטעם הזה - לא יחזור לעולם לבצע מעשים אסורים. הוא עשה עם עצמו חשבון נפש קשה בתקופת המעצר והבין שפגע באנשים שהוא כלל לא מכיר. הנאשם הביע רצונו לפצותם על שעולל למתלוננים, ובלבד שבית המשפט לא יחזירו לבית הסוהר. הוא ציין כי חזר בתשובה, הפסיק לשתות אלכוהול, הפסיק ""לעשות שטויות"" והוא מבקש לשוב לאורח חיים נורמטיבי. הוא מבין את חומרת מעשיו, אך מאמין שיכול להוציא את עצמו מהבוץ שנקלע אליו ולחזור למוטב.",טיעונים לעונש
"ת""פ 3728-01-15","תחילה יש לקבוע, כמצוות סעיף 40יג לחוק, האם עסקינן בכמה עבירות בארוע אחד (ס""ק א), שבגינן יש לקבוע מתחם עונש אחד, או שמא מדובר בכמה עבירות בכמה ארועים (ס""ק ב), שאז יש לקבוע מתחם לכל אֵרוע, ולקבוע האם יש לגזור עונש נפרד לכל אֵרוע (ומידת החפיפה בין העונשים, אם בכלל), או שיש לקבוע עונש כולל. כאן ברור לחלוטין שמדובר במספר עבירות באֵרוע אחד, ומאחר שכך טענו גם הצדדים, אין צורך להרחיב מעבר לכך.",אֵרוע אחד או מספר ארועים
"ת""פ 3728-01-15","הערכים החברתיים המוגנים שנפגעו הם השמירה על בטחון הציבור, שמירה על הסדר הציבורי, זכותו של הפרט לבטחון, לשלמות גופו וקניינו, וכפי שציין הסנגור - האינטרס הציבורי בפתרון סכסוכים בדרכים חוקיות ובדרכי שלום.",הערך החברתי שנפגע
"ת""פ 3728-01-15","הערך המוגן נפגע במידה בינונית, נוכח זריקת שני רימונים, הנזק שנגרם במאפיה, והעובדה שאישה עם פעוט עברה במקום סמוך לפני זריקת הרימון הראשון ונוכחות אנשים בחלקה האחר של המאפיה בזמן זריקת הרימון השני. עם זאת, לא היו פציעות או פגיעות בנפש.",מידת הפגיעה בערך המוגן
"ת""פ 3728-01-15","כל אחד משני הצדדים הפנה לפסקי דין התומכים בעמדתו העונשית. אביא להלן חלק מפסקי הדין שאליהם הפנו הצדדים (רוב פסקי הדין של ההגנה התייחסו למקרים של החזקת הרימונים בלבד, ולא למקרים שבהם הם הושלכו), ופסיקה נוספת.",מדיניות הענישה הנהוגה
"ת""פ 3728-01-15","תחילה לעניין ההבחנה בין רימוני הלם לרימוני רסס: אין מחלוקת, כי הסכנה הטמונה ברימון הלם קטנה מהסכנה הטמונה ברימון רסס. בע""פ 1323/13 רך חסן נ' מדינת ישראל [5.6.13] [עניין חסן] ציין בית המשפט העליון בהתייחס לסחר ברימוני הלם: ""מדובר בסחר בנשק הנמצא באחת הדיוטות הנמוכות שבסולם החומרה. אינני מקלה ראש בנזק הפוטנציאלי הטמון בסוג נשק זה, ואף על פי כן מדובר בנשק שנועד לטשטש אדם ולהכניסו למצב של הלם והגם שיש בכוחו לגרום נזק, אין הוא מסוג כלי הנשק שיכול להביא להרג ללא הבחנה"" (כבוד הש' ארבל, פסקה 11 לפסק הדין).",מדיניות הענישה הנהוגה
"ת""פ 3728-01-15","פ""ח (מחוזי ת""א) 1135/04 מדינת ישראל נ' רועי כהן [28.12.04] - הנאשם הורשע בכתב אישום מתוקן במסגרת הסדר טיעון בעבירות של נשיאה והחזקת נשק, והיזק בזדון, בכך שהשליך רימון רסס לעבר חצר ביתו של המתלונן (בכיר בעיריית פתח תקווה אשר הורה על פינוי חווה שבנה הנאשם שלא כדין). בית המשפט לקח בחשבון את העובדה כי לא היו נפגעים בנפש מביצוע מעשיו של הנאשם והוסכם כי הנאשם יפצה את המתלונן בפיצוי כספי בסך של 7,000 ₪. בית המשפט גזר על הנאשם עונש מאסר של שלוש שנים ומחצה, אשר מתוכם ירצה שנתיים מאחורי סורג ובריח, ואת היתרה - 18 חודשים - יהיו על תנאי לתקופה של שלוש שנים.",מדיניות הענישה הנהוגה
"ת""פ 3728-01-15","עפ""ג [מחוזי מרכז] 27417-11-15 מדינת ישראל נ' שאכר עבד אל רחים [17.1.16], שאליו הפנתה התביעה - הנאשם הורשע על יסוד הודאתו במסגרת הסדר טיעון בכתב אישום מתוקן, בשתי עבירות של נשיאת נשק, בכך שהחזיק בביתו ובבית העסק שבבעלותו תת מקלע עוזי, מחסניות ותחמושת. בית המשפט המחוזי קבע כי מתחם העונש ההולם בעניינו של המשיב עומד על בין 18 ועד 36 חודשי מאסר בפועל. בית המשפט לקח בחשבון את הודייתו של המערער, חסכון בזמן שיפוטי, העדר עבר פלילי, תסקיר שירות מבחן שלא בא בהמלצה טיפולית והעובדה כי היה נתון במעצר בית מעל שנה. משכך גזר בית המשפט על המשיב מאסר בפועל למשך 20 חודשים ועונשים נלווים (חלף 14 חודשים שנגזרו על המשיב בבית משפט השלום).",מדיניות הענישה הנהוגה
"ת""פ 3728-01-15","ת""פ (מחוזי מרכז) 49160-11-15 מדינת ישראל נ' נאסר [10.4.16], שאליו הפנתה התביעה - הנאשם הורשע על פי הודאתו במסגרת הסדר טיעון בכתב אישום מתוקן, שלפיו ביצע עבירות של נשיאה והובלת נשק שלא כדין וכן נהג ברכב בזמן פסילה. על פי עובדות כתב האישום המתוקן, הנאשם קיבל לידיו אקדח, שתי מחסניות ותחמושת. בהמשך לכך, לקח הנאשם את הנשק בעודו טעון במחסנית ובה שישה כדורים והניחו מתחת למושב הנהג. הנאשם נתפס בעודו נוהג בזמן פסילה כשהוא נושא עמו את נשק טעון. בית המשפט קבע כי בעבירות הנשק מתחם העונש ההולם נע בין 18 ל-40 חודשי מאסר בפועל, והטיל על הנאשם 30 חודשי מאסר בפועל בניכוי ימי מעצרו.",מדיניות הענישה הנהוגה
"ת""פ 3728-01-15","ע""פ 7386/13 חוסיין עווד נ' מדינת ישראל [23.3.14] [עניין עווד], שאליו הפנתה ההגנה - נדחה ערעור על עונשו של מי שהורשע על פי הודאתו בהחזקת רימון הלם ועשיית עסקה בו, שבמסגרתה מסר את הרימון לאחר. נגזרו עליו 18 חודשי מאסר בפועל ומאסר על תנאי.",מדיניות הענישה הנהוגה
