verdict,text,part
"תפ (ב""ש) 8077∕02","הנאשם הורשע על-פי הודאתו בעבירות שיוחסו לו בכתב-האישום העובדות הן כי במהלך ויכוח שהיה לנאשם עם המתלוננים, אב ובנו, עמם לנאשם ומשפחתו סכסוך ממושך, ירה הנאשם ברובה לעבר המתלוננים וגרם להם חבלות חמורות שלא כדין","הנאשם ובא כוחו- עוה""ד רון סולקין "
"תפ (ב""ש) 8077∕02","הנאשם הורשע על פי הודאתו בעבירות שיוחסו לו בכתב האישום המתוקן - בשתי עבירות של חבלה חמורה בנסיבות מחמירות, עבירות לפי סעיף 333 + 335 (א) 1 לחוק העונשין, תשל""ז - 1977 [להלן:""החוק""] ובעבירה של החזקת נשק שלא כדין, עבירה לפי סעיף 144 (א) רישא לחוק.",גזר דין
"תפ (ב""ש) 8077∕02","העובדות המקימות את העבירות הנ""ל, הן כי בתאריך 2.5.02 ,במהלך ויכוח שהיה  לנאשם עם המתלוננים, אב ובנו, עמם לנאשם ומשפחתו סכסוך ממושך, ירה הנאשם ברובה לעבר המתלוננים וגרם להם חבלות חמורות שלא כדין.",גזר דין
"תפ (ב""ש) 8077∕02","5129371 תחילה פגע הנאשם ברגל של המתלונן - עאדל, אשר נפל על הארץ, לאחר מכן פגע הנאשם ברגלו של המתלונן - סאלים והמשיך לירות לכיוונו, אך סאלים הצליח להתחבא מפני הנאשם. לאחר מכן שוב ירה הנאשם לכיוונו של עאדל ופגע ברגלו ובידו.",גזר דין
"תפ (ב""ש) 8077∕02","המתלוננים נפגעו בגפיהם, נגרמו להם שברים פתוחים והם נזקקו לאישפוז שכלל ניתוחים. נ",גזר דין
"תפ (ב""ש) 8077∕02","ב""כ המאשימה מבקשת להטיל על הנאשם עונש ממושך של מאסר בפועל.",גזר דין
"תפ (ב""ש) 8077∕02","לטענתה,יש להחמיר עם הנאשם לאור חומרת העבירות ונסיבותיהן ולאור הצורך בהרתעה מפני שימוש בנשק ועשיית דין עצמית.",גזר דין
"תפ (ב""ש) 8077∕02","לטענת ב""כ המאשימה, אין לזקוף לזכות הנאשם את הטענה שהנשק בו בוצעו העבירות נתפס, משום שלא הוכח באופן חד משמעי שהנשק שנתפס הוא אכן הנשק בו בוצעו העבירות וכן משום שגם אם אכן מדובר באותו נשק, הרי שהוא לא נתפס בזכות הנאשם.",גזר דין
"תפ (ב""ש) 8077∕02","ב""כ הנאשם עמד בטיעוניו לעונש על תיפקודו הנורמטיבי של הנאשם עד לביצוע העבירות, על היות הנאשם נשוי ואב לשני ילדים שפרנסתם עליו וכן על הודאת הנאשם, שעל אף שבאה לאחר שמיעת חלק מעדי התביעה, חסכה זמן שיפוטי.",גזר דין
"תפ (ב""ש) 8077∕02","כן עמד ב""כ הנאשם על כך שלא נגרם למתלוננים נזק לצמיתות ובעיקר על כך שהמתלוננים התנכלו לנאשם קודם לאירועים הנדונים ואף תקפו קשות את הנאשם ואת אחיו, באופן שהצריך טיפול רפואי ואף אישפוז של האח למספר ימים.",גזר דין
"תפ (ב""ש) 8077∕02","ב""כ הנאשם הגיש פסיקה, שלטענתו, יש בה כדי לתמוך בטענותיו.",גזר דין
"תפ (ב""ש) 8077∕02",העבירות בהן הורשע הנאשם הנן חמורות.ב,גזר דין
"תפ (ב""ש) 8077∕02","אין צורך להכביר מילים בדבר החומרה שיש במעשיו של הנאשם, אשר תוך כדי שימוש בנשק שאותו החזיק שלא כדין, ירה לעבר המתלוננים ולא הירפה  מהם גם לאחר שאחד מהם כבר שכב פצוע. למזלם של המתלוננים, לא נגרם להם נזק לצמיתות, אך שניהם נפצעו פצעים חמורים שהצריכו אישפוז והתערבות כירורגית.",גזר דין
"תפ (ב""ש) 8077∕02","אכן, אין חולקין, כי הנאשם ירה במתלוננים על רקע סכסוך ממושך בין משפחתו לבין משפחתם ולאחר שגם אחד המתלוננים תקף את הנאשם ומשפחתו, תקיפות שגם הן הצריכו טיפול רפואי ואף אישפוז. ו",גזר דין
"תפ (ב""ש) 8077∕02","יחד עם זאת, צודקת ב""כ המאשימה בטענתה, שגם במקרה כזה יש צורך בהטלת עונש מאסר מרתיע, לבל תהיה, בהתחשבות בנסיבות הנ""ל, משום הכרה ומתן לגיטימציה למי שעושה דין לעצמו.",גזר דין
"תפ (ב""ש) 8077∕02","לזכות הנאשם עומדת הודאתו, אף שבאה בשלב שלאחר שמיעת עדויות המתלוננים. בהודאתו זו יש, לצד החסכון בזמן שיפוטי, גם משום הבעת חרטה ולקיחת אחריות על מעשיו.",גזר דין
"תפ (ב""ש) 8077∕02","עוד עומד לזכות הנאשם עברו הכמעט נקי; לנאשם רישום ללא הרשעה מלפני מספר שנים בגין עבירת תקיפה הגורמת חבלה ממשית, בגינו חוייב לחתום על התחייבות להימנע מעבירה.",גזר דין
"תפ (ב""ש) 8077∕02","כן עומד לזכות הנאשם תיפקודו הנורמטיבי שהתבטא בעבודה רציפה במשך מספר שנים כנהג, כפי שעולה מעדותו של מעבידו. נ",גזר דין
"תפ (ב""ש) 8077∕02",לאחר ששקלתי את טענות הצדדים אני גוזרת על הנאשם עונשים כדלקמן:,גזר דין
"תפ (ב""ש) 8077∕02",אני דנה את הנאשם ל -  4  שנות מאסר בפועל מיום מעצרו: -  3.5.02.,גזר דין
"תפ (ב""ש) 8077∕02","אני דנה את הנאשם ל - 18 חודשים על תנאי למשך 3 שנים מיום שחרורו, שלא יעבור עבירה של החזקת נשק שלא כדין וכל עבירת אלימות הגורמת חבלה חמורה. ב",גזר דין
"תפ (ב""ש) 8077∕02","ניתן היום י""ג ב אדר ב, תשס""ג (17 במרץ 2003) במעמד הצדדים",זכות ערעור 45 יום לבית המשפט העליון. 
