verdict,text,part
"תפ""ח 46590-06-18","                       מספר פל""א 123521/2018",02 ינואר 2022
"תפ""ח 46590-06-18","לפני כבוד השופטת - נשיאה רות לורך, שופטת דבורה עטר, שופט עמי קובו",02 ינואר 2022
"תפ""ח 46590-06-18","לפני כבוד השופטת - נשיאה רות לורך, שופטת דבורה עטר, שופט עמי קובו",02 ינואר 2022
"תפ""ח 46590-06-18","חוק העונשין, תשל""ז-1977: סע'  144(ב), 300(א), 300(א)(2), 301א, 311א",חקיקה שאוזכרה: 
"תפ""ח 46590-06-18","חוק שחרור על-תנאי ממאסר, תשס""א-2001",חקיקה שאוזכרה: 
"תפ""ח 46590-06-18",מיני-רציו:,חקיקה שאוזכרה: 
"תפ""ח 46590-06-18","* בית המשפט גזר על הנאשם שהורשע על פי הודאתו בביצוע עבירת רצח (בכוונה) לפי סעיף 300(א) לחוק העונשין כנוסחו לאחר הרפורמה עונש מאסר בפועל למשך 27 שנים. בתוך כך, דחה בית המשפט את עמדת המאשימה כי אין מקום לקבוע כלל מתחם ענישה בעבירת הרצח הבסיסית שנעברה בכוונה. נפסק, כי עמדה זו אינה עולה בקנה אחד עם כוונת המחוקק.",חקיקה שאוזכרה: 
"תפ""ח 46590-06-18",* עונשין – ענישה – מדיניות ענישה: עבירת רצח,חקיקה שאוזכרה: 
"תפ""ח 46590-06-18","בית המשפט נדרש לגזור את דינו של הנאשם שהודה בעובדות כתב אישום מתוקן, אשר גובש במסגרת הסדר דיוני שנערך בין הצדדים, והורשע על פי הודאתו בביצוע עבירת רצח (בכוונה) לפי סעיף 300(א) לחוק כנוסחו לאחר הרפורמה וכן בעבירה של נשיאת נשק לפי סעיף 144(ב) רישא לחוק. הסדר הטיעון לא כלל הסכמות לעניין העונש, למעט ברכיב הפיצוי שהוסכם כי סך 150,000 ₪ יופקד על ידי הנאשם לאשת המנוח, עוד בטרם שמיעת הטיעונים לעונש.",.
"תפ""ח 46590-06-18",בית המשפט פסק כלהלן:,.
"תפ""ח 46590-06-18","על פי הסדר הטיעון שאליו הגיעו הצדדים תוקן כתב האישום, כאמור, כך שהנאשם הורשע בעבירת הרצח הבסיסית, תוך יסוד נפשי של כוונה, כנוסחה לאחר הרפורמה. לצידה של עבירה זו קבוע עונש מרבי של מאסר עולם, באופן שמאפשר לבית המשפט שיקול דעת בעת גזירת העונש. בהינתן כי אין המדובר בעונש מאסר עולם חובה, ובהתאם להוראות תיקון 113 שעניינו הבניית שיקול הדעת בענישה, הרי שיש צורך בקביעת מתחם ענישה הולם למעשה העבירה, שלו רף עליון ורף תחתון. ויודגש כי לו מצא המחוקק להשית מאסר עולם כעונש חובה בגין עבירת הרצח הבסיסית שנעברה בכוונה, להבדיל מיסוד נפשי של אדישות, כטענת המאשימה, ברי כי היה מבצע הבחנה בין יסודות נפשיים אלה.",.
"תפ""ח 46590-06-18","לשתי העבירות בהן הורשע הנאשם ראוי לקבוע מתחם עונש הולם אחד, שכן יש ""קשר הדוק"" בין עבירת נשיאת הנשק לבין עבירת הרצח שבוצעה באמצעותו, משנעשו בסמיכות של זמן ומקום.",.
"תפ""ח 46590-06-18","אין בתחושותיו הסובייקטיביות של הנאשם בעת האירוע, על רקע הפוסט טראומה ממנה הוא סובל, כדי להפחית מחומרת מעשה העבירה או מאשמו לצורך קביעת המתחם.",.
"תפ""ח 46590-06-18",מתחם העונש ההולם נע בין 25 שנות מאסר לבין מאסר עולם.,.
"תפ""ח 46590-06-18","במקרה דנן, לא קיימים שיקולים אשר מצדיקים חריגה מהמתחם.",.
"תפ""ח 46590-06-18","כתב האישום המקורי שהוגש נגד הנאשם ייחס לו עבירת רצח בכוונה תחילה, לפי סעיף 300(א)(2) לחוק העונשין, התשל""ז-1977 (להלן: ""החוק""),  כנוסחו טרם תיקון 137 לחוק בנוגע לרפורמה בעבירות המתה (להלן: ""הרפורמה""), לצד עבירות של נשיאת נשק וקשירת קשר לפשע.",גזר דין
"תפ""ח 46590-06-18","ביום 18.01.21 הודה הנאשם בעובדות כתב אישום מתוקן, אשר גובש במסגרת הסדר דיוני שנערך בין הצדדים, והורשע על פי הודאתו בביצוע עבירת רצח (בכוונה) לפי סעיף 300(א) לחוק כנוסחו לאחר הרפורמה (להלן: ""עבירת הרצח הבסיסית"") וכן בעבירה של נשיאת נשק לפי סעיף 144(ב) רישא לחוק.",גזר דין
"תפ""ח 46590-06-18","הסדר הטיעון לא כלל הסכמות לעניין העונש, למעט ברכיב הפיצוי שהוסכם כי סך 150,000 ₪ יופקד על ידי הנאשם לאשת המנוח, עוד בטרם שמיעת הטיעונים לעונש.",גזר דין
"תפ""ח 46590-06-18","הנאשם הוא אחיהם של נאשמים 2 ו-3, וקרוב משפחתו של נאשם 4. הנאשם הינו קטוע רגל, ומסתייע בקביים לצרכי הליכה.",עובדות כתב האישום המתוקן
"תפ""ח 46590-06-18","עובר לאירוע נושא כתב האישום, התגלע סכסוך בין הנאשם לבין רביע פריג' (להלן: ""המנוח""). ביום 16.03.18 לפנות בוקר, או בסמוך לכך, נפגשו הנאשם והמנוח בסמוך למועדון ""הפטרה"" בתל אביב, והתעמתו זה עם זה. בגין העימות חש הנאשם מושפל ומאוים וחשש מהמנוח (להלן: ""העימות עם המנוח"").",עובדות כתב האישום המתוקן
"תפ""ח 46590-06-18","על רקע סכסוך קודם בין הנאשם לבין אחרים שזהותם אינה ידועה למאשימה נשא הנאשם על גופו אקדח בקוטר 9 מ""מ, ובו מחסנית המכילה כדורים תואמים, המוסתר תחת מעיל שחור (להלן: ""האקדח"" ולהלן: ""הסכסוך הקודם"").",עובדות כתב האישום המתוקן
"תפ""ח 46590-06-18","ביום 17.03.18 בשעה 12:45 לערך, נפגשו הנאשם ונאשמים 2-3 בבית הוריהם בכפר קאסם. החל מהשעה 12:51, יצאו נאשמים 2 ו-3 מהבית, בזה אחר זה, צעדו לכיוון רח' סולטני ונעצרו מול בית מס' 72 (להלן: ""המקום""). בשעה 12:57 או בסמוך לכך, יצא הנאשם, רגלית, אל עבר המקום, כשהוא חבוש כובע מצחייה ונושא עמו את האקדח, שלא כדין, וחבר לנאשמים 2 ו-3. בשעה 13:03 או בסמוך לכך הגיע נאשם 4, רגלית, למקום שם חבר לנאשמים האחרים. באותה העת, נסע המנוח ברכב מסוג יונדאי, בו נהג חברו. החבר שינה את מסלול נסיעת הרכב ובאופן בלתי מתוכנן הגיע בנסיעה למקום.",עובדות כתב האישום המתוקן
"תפ""ח 46590-06-18","בשעה 13:07 או בסמוך לכך, עת הבחין הנאשם ברכב היונדאי בו נסע המנוח, ועל רקע תחושותיו שנבעו מהעימות עם המנוח, דרך הנאשם את האקדח, רץ לעבר הרכב כשהאקדח שלוף בידו, כיוון אותו לעבר החלק הימני של הרכב וירה מספר יריות מטווח קצר לעבר המנוח. הרכב המשיך בנסיעה והנאשם המשיך בירי לעבר צידו הימני של הרכב, בכוונה לגרום למותו של המנוח.",עובדות כתב האישום המתוקן
"תפ""ח 46590-06-18","בתגובה לירי נמלטו המנוח וחברו מהמקום ברכב, כאשר המנוח פצוע באופן אנוש כתוצאה מהירי, בחלקי גופו השונים: בגו, בבית החזה, בריאות, בלב, בירך הימנית, בשוק הימנית ובגף הימני התחתון. החבר הבהיל את המנוח למרכז הרפואי בכפר קאסם, משם הובהל באמבולנס לבית החולים ""בילינסון"", שם נקבע מותו כתוצאה מהירי, תוך זמן קצר.",עובדות כתב האישום המתוקן
"תפ""ח 46590-06-18","תסקיר נפגע עבירה הוגש בעניינן של אשת המנוח ואחותו, אשר לבקשת שירות המבחן הוטל עליו חיסיון ורק תמצית ממנו הועברה לעיון הנאשם, על מנת להימנע מחשיפת מידע רגיש אשר יחמיר את מצבן של נפגעות העבירה.",תמצית תסקיר נפגע עבירה
"תפ""ח 46590-06-18","התסקיר כלל התייחסות למכלול הנזקים שנגרמו לנפגעות העבירה כתוצאה ממות המנוח בכל תחומי חייהן, לרבות נזקים נפשיים, רגשיים, משפחתיים, תפקודיים וכלכליים.",תמצית תסקיר נפגע עבירה
"תפ""ח 46590-06-18","לאור תמונת הנזק הקשה המליץ שירות המבחן להשית על הנאשם גם פיצוי משמעותי לבני המשפחה, כהכרה בפגיעה האנושה שגרם למנוח ובהשלכות הקשות על חייהן של נפגעות העבירה.",תמצית תסקיר נפגע עבירה
"תפ""ח 46590-06-18","ד""ר סבר מונה כמומחה מטעם בית משפט מחוזי חיפה (ת""א 766/98) בעניין קביעת נכותו של הנאשם, עקב פציעתו בתאונת דרכים שהובילה לקטיעת רגלו בעת היותו כבן 10. במסגרת זו ערך בפברואר 2000, כשנתיים לאחר התאונה, חוות דעת פסיכיאטרית על אודות הנאשם, אשר הוגשה גם בהליך שלפנינו (ע/1). ","הפסיכיאטר ד""ר סבר יהונתן"
"תפ""ח 46590-06-18","בחוות הדעת צוין כי מאז התאונה חל שינוי ברור במצבו של הנאשם, הוא סובל מדיכאון מג'ורי, מדימוי עצמי נמוך ותחושת דחייה חברתית, ופיתח תסמונת פוסט טראומטית קשה וכרונית, אשר באה לידי ביטוי בסיוטי לילה, שחזור של הטראומה, הימנעות ממקום התאונה ובהלה מצפירות אמבולנס ובלימות פתע של רכבים. לאור האמור נקבע כי נכותו קבועה וצמיתה, והיא הוערכה בשיעור של 50%.","הפסיכיאטר ד""ר סבר יהונתן"
"תפ""ח 46590-06-18","בשל חלוף הזמן התיק בבית המשפט המחוזי בוער (אישור על ביעורו- ע/2) ואולם מערעור שהוגש לבית המשפט העליון בע""א 9232/02 מנורה נ' עיסא עבד אלקאדר [פורסם בנבו] (28.04.2004) (ע/3) עולה כי בית המשפט המחוזי דחה את קביעתו של ד""ר סבר לפיה נכותו הצמיתה של הנאשם בתחום הפסיכיאטרי היא בשיעור של 50%, שכן נקבע כי הוטעה על ידי אחותו של הנאשם. חלף זאת, העמיד בית המשפט המחוזי את שיעור נכותו בתחום זה על 30%, וזאת בשל ""סימנים קליניים ברורים המגבילים באופן ניכר את ההתאמה הסוציאלית ואת כושר העבודה"". בית המשפט העליון לא התערב בפסק הדין.","הפסיכיאטר ד""ר סבר יהונתן"
"תפ""ח 46590-06-18","בעדותו לפנינו אישר ד""ר סבר כי לא בדק את הנאשם מאז שנת 2000, ואף לא פגש בו מאז. העד עמד על האמור בחוות דעתו כי הנאשם סובל מנכות צמיתה וציין כי בנסיבות אלה עשויה התסמונת הפוסט טראומתית להימשך כל החיים. בהתייחסו לקביעת בית המשפט המחוזי כי נכותו עומדת על 30%, ולא 50% כפי שהומלץ על ידו, שלל כי הוטעה על ידי אחותו של הנאשם.","הפסיכיאטר ד""ר סבר יהונתן"
"תפ""ח 46590-06-18","העדה ערכה חוות דעת פסיכו-סוציולוגית-קרימינולוגית בעניינו של הנאשם, מיום 16.06.21 (ע/4). בחוות הדעת עמדה העדה על קשייו החברתיים, הלימודיים והתעסוקתיים של הנאשם לאורך השנים, על רקע קטיעת רגלו בגיל 10. כן צוין כי לנאשם עבר פלילי הכולל 3 הרשעות קודמות בגין עבירות רכוש, נשק ואלימות שבוצעו בשנים 2009-2015, וכן הרשעה בעבירת תעבורה. ","עו""ס מראם עאזם-נאשף "
"תפ""ח 46590-06-18","הנאשם ציין בפני העדה כי בשנת 2006 החליט להשקיע סכום כסף נכבד מכספי הפיצויים שקיבל עקב פציעתו, במגרש לסחר ברכבים בכפר קאסם, תמורת הבטחה לקבלת אחוזים מהרווחים, אשר מעולם לא מומשה. בעל המגרש הסתבך ב""סכסוך דמים"" ובהמשך הוא ושני בניו נרצחו. הנאשם עצמו נקלע על לא עוול בכפו לסכסוך האמור, הפך ליעד לחיסול ואף בוצעו מספר ניסיונות לפגוע בו, כשבאחד מהם אף נפצע ונזקק לטיפול רפואי. באשר לאירוע הנוכחי, תיאר הנאשם כי משהבחין ברכב בו נסע המנוח חש מאוים מפניו, נכנס ללחץ שהתעצם על רקע פגיעתו הנפשית והפיזית, ואז ביצע את המעשה שיוחס לו.","עו""ס מראם עאזם-נאשף "
"תפ""ח 46590-06-18","מחוות הדעת עולה כי הנאשם מודה בעבירות המיוחסות לו בכתב האישום המתוקן, נוטל אחריות מלאה ומביע צער וחרטה כנים. הוא גילה תובנות ביחס לדינמיקה שהביאה אותו לבצען, והתמונה העולה היא כי ביצע את העבירות על רקע תחושת מאוימות ממשית שחש בסמוך ובעת ביצוע העבירות. הנאשם מגלה מוטיבציה להשתלב בתכנית טיפולית-שיקומית במסגרת שב""ס. הערכת העו""ס היא כי ככל שיקבל מענה טיפולי הולם, קיימת פרוגנוזה שיקומית חיובית בעניינו.","עו""ס מראם עאזם-נאשף "
"תפ""ח 46590-06-18","העדה עמדה בעדותה על הקשיים הרבים שחווה הנאשם בבית הסוהר, על רקע נכותו הפיזית המקשה על סיפוק צרכיו היומיומיים. האמור הוביל למצוקה נפשית ובדידות, והציף בקרבו את תחושות הדחייה והדימוי העצמי הנמוך מהם סבל לאורך חייו. בנוסף סובל הנאשם מכאבים כרוניים בשל מחסור בציוד אורתופדי ובתרופות, שהיו זמינים עבורו טרם המעצר.","עו""ס מראם עאזם-נאשף "
"תפ""ח 46590-06-18","עו""ס עאזם הטעימה כי קיימים גורמי סיכוי לשיקומו של הנאשם, הכוללים נטילת אחריות מלאה על חומרת העבירות, הכרה בצורך בטיפול, והיותו בעל משפחה תומכת. מנגד קיימים גורמי סיכון הטמונים בעצם חומרת העבירה ותוצאתה הקשה. לדבריה הנאשם החל לקבל טיפול פסיכולוגי ופסיכיאטרי בילדותו, אך ככל הנראה בשל תופעות לוואי שנגרמו לו כתוצאה מהתרופות שנטל הפסיק את הטיפול. באותה העת משפחתו כשלה מלספק לו את המענה הטיפולי הראוי.","עו""ס מראם עאזם-נאשף "
"תפ""ח 46590-06-18","העדה אישרה כי לא צפתה בסרטון המתעד את האירוע ולדבריה מאחר ומבחינה קרימינולוגית שימת הדגש היא על המניע שהביא את הנאשם לעשות את המעשה, ועל פוטנציאל השיקום שלו, ולא על חומרת האירוע והראיות. צפייה בקלטות עשויה היתה לפגוע באובייקטיביות וביכולת לגלות אמפתיה כלפי הנאשם.","עו""ס מראם עאזם-נאשף "
"תפ""ח 46590-06-18","עוד עמדה העדה על הקשר בין נכותו הצמיתה של הנאשם לבין ביצוע העבירה בה הורשע, מבחינת יכולתו לנהוג באיפוק ולהפעיל שיקול דעת, והקלות היתירה בה יוצא משליטה נוכח דריכות היתר ממנה סובל.","עו""ס מראם עאזם-נאשף "
"תפ""ח 46590-06-18","העדה שללה כי ניזונה רק מדברי הנאשם, אלא הסתמכה על נתונים אובייקטיביים ובין היתר על רישומו הפלילי. כשנשאלה מדוע התעלמה מהמידע שמסרה לה אשתו באשר לתלונה שהגישה נגד הנאשם ואשר בגינה הוגש נגדו כתב אישום בשנת 2011, השיבה כי לא מצאה קשר בין העבירות למעט העובדה שמדובר במי שמתקשה לשלוט בכעסיו. כן ציינה שלא ידעה כי תלונתה של אשתו הגיעה לפתחו של בית משפט, וסברה כי מאחר ומדובר באירוע חד פעמי ולא בעבירה רצידיוויסטית, ניתן היה להסתפק בציון העובדה כי היחסים בין בני הזוג ידעו עליות ומורדות.","עו""ס מראם עאזם-נאשף "
"תפ""ח 46590-06-18","לדברי העדה למיטב זיכרונה, הנאשם טען בפניה שאינו עושה שימוש באלכוהול או בחומרים פסיכו אקטיביים. באשר לטענה כי הנאשם ביצע בעברו עבירות בעת היותו בגילופין ציינה כי מידע זה אינו עולה מהרישום הפלילי שלו ולא  עיינה ברישום התעבורתי שנטען כי כולל נהיגה תחת השפעת סמים ואלכוהול, בשנת 2012.","עו""ס מראם עאזם-נאשף "
"תפ""ח 46590-06-18","הפסיכולוג, ד""ר עאמר, טיפל בנאשם כ-3 שנים לאחר התאונה שעבר בגיל 10 וביום 28.6.21 ערך חוות דעת בעקבות שיחות שקיים עם הנאשם כיום (ע/5). בחוות הדעת צוין כי הנאשם מגלה תובנות לגבי הנסיבות שהובילו אותו לביצוע העבירה וחש תחושות אשמה, צער וחרטה על מעשיו. הנאשם ציין בפניו כי בתקופה שקדמה לביצוע העבירה עבר שני ניסיונות התנקשות בחייו, שהובילו לתחושות של לחץ וחרדה. כן סיפר על העימות עם המנוח שהתרחש יומיים לפני האירוע, בעקבותיו חש מאוים, מושפל, וחשש לחייו. צוין כי ההפרעות הנפשיות מהן סובל הנאשם עד היום, קרי: הפרעת דחק פוסט-טראומתית ודיכאון מג'ורי, אכן באות לידי ביטוי בחרדות קשות ותחושות פאניקה, ויש לראות את התנהלותו ביום האירוע על רקע האמור. צוין כי קיימת היתכנות חיובית לשיקום הנאשם, לאור המוטיבציה והתובנה שמגלה לצורך בטיפול, אשר לו הוא אכן זקוק.","הפסיכולוג ד""ר חסן עאמר "
"תפ""ח 46590-06-18","בחקירתו הנגדית ציין העד כי לא קיבל מידע אובייקטיבי על הנאשם משב""ס, לרבות טיפולים שעבר, ואף אינו זקוק לכך שכן מכיר את הנאשם ואת אישיותו מגיל צעיר ומפאת מגוריהם באותו הכפר. כן פגש אותו פעם אחת לאחרונה לצורך עריכת חוות הדעת, שלא כגורם טיפולי. לדבריו לא ניזון רק מדבריו של הנאשם, אלא ערך לו מבחני אישיות – מבחן בינדר, מבחן ציורים וגם ריאיון, על מנת לבחון האם קיים הבדל בין העבר לבין היום, אך לא ציין זאת בחוות הדעת.","הפסיכולוג ד""ר חסן עאמר "
"תפ""ח 46590-06-18","באשר לקביעתו כי הנאשם סובל מדיכאון מג'ורי, ציין העד כי למד על כך מדברי הנאשם. לדבריו, הגם שדיכאון ופוסט טראומה הם בני טיפול וייתכנו עליות ומורדות, תופעות אלה יישארו בתת המודע במשך שנים, שכן ישנו שחזור של הטראומה כמעט מידי יום.","הפסיכולוג ד""ר חסן עאמר "
"תפ""ח 46590-06-18",העד ציין כי לא מצא חשיבות לעיין בכתב האישום או לצפות בסרטון המתעד את האירוע אלא הסתפק בדברי הנאשם עצמו.,"הפסיכולוג ד""ר חסן עאמר "
"תפ""ח 46590-06-18","ב""כ המאשימה, עו""ד עינת בניטה, עתרה להשית על הנאשם מאסר עולם. בטיעוניה התייחסה לרפורמה שנעשתה בעבירות ההמתה וציינה כי הגם שבעבירת הרצח ה""בסיסית"" בה הורשע הנאשם העונש הנקוב בצידה הוא מאסר עולם לתקופה בלתי קצובה, או מאסר לתקופה מירבית של 30 שנה, נקודת המוצא צריכה להיות דווקא הטלת העונש המירבי, קרי מאסר עולם בלתי קצוב. זאת נוכח חומרתה היתירה של עבירת הרצח ולאור עליונותו של ערך קדושת החיים. ככל שגזירת העונש המירבי תיעשה רק במקרים נדירים או יוצאי דופן, כיתר העבירות בחוק העונשין, עונש מאסר עולם בעבירות הרצח יהפוך לאות מתה. בעניינו של הנאשם לא מתקיימות אותן נסיבות חריגות ומיוחדות שיצדיקו חריגה מנקודת המוצא שהיא השתת מאסר עולם.",טיעוני המאשימה לעונש
"תפ""ח 46590-06-18","באשר לשיקול הדעת הנתון לבתי המשפט שלא להשית עונש של מאסר עולם, נטען כי האפשרות נועדה מלכתחילה לעבירות רצח שנעשו ביסוד נפשי של אדישות, הנכלל אף הוא בגדרה של העבירה, להבדיל מעבירות שבוצעו בכוונה, קרי- מתוך רצון להמית. כן נטען בהתבסס על הצעת החוק וועדת קרמניצר, כי אי הטלת מאסר עולם יתאפשר רק במקרים בהם מתקיימות נסיבות מקלות הקשורות בביצוע העבירה, הגורעות באופן ממשי מחומרתו של האירוע ומאשמו של הנאשם.",טיעוני המאשימה לעונש
"תפ""ח 46590-06-18","ב""כ המאשימה טענה כי בעבירות הרצח ""הבסיסי"", בשונה מעבירות אחרות, אין מקום לקבוע מתחם עונש הולם. לטעמה אם יקבע מתחם שהרף העליון יהיה מאסר עולם ואילו הרף התחתון יהיה מאסר לתקופה קצובה כזו או אחרת, רק לעיתים נדירות יוטל מאסר עולם על נאשם בעבירות אלה. וזאת רק כאשר הנסיבות שאינן קשורות בביצוע העבירה, יצדיקו זאת, כגון, כשהנאשם בעל עבר פלילי מכביד ביותר ורלוונטי. ברי כי מדובר במקרה נדיר ביותר, וככלל לא יינתן ביטוי הולם לחומרת המעשה.",טיעוני המאשימה לעונש
"תפ""ח 46590-06-18","על כן, הוצע כי במקרים החמורים של עבירת הרצח הבסיסי, נקודת המוצא תהא עונש מאסר עולם, ונסיבות שאינן קשורות לביצוע העבירה, לרבות חרטה ונטילת אחריות, ייבחנו במסגרת בקשה לקציבת העונש בפני נשיא המדינה או במסגרת שיקולי ועדת השחרורים.",טיעוני המאשימה לעונש
"תפ""ח 46590-06-18","ב""כ המאשימה הפנתה למספר פסקי דין, תוך שצוין כי אמנם בתי המשפט המחוזיים קבעו, בניגוד לעמדתה, מתחמי עונש הולמים בעבירות אלה, ולא גזרו מאסר עולם, ואולם טרם נשמע קולו של בית המשפט העליון בסוגיה וקיימים ערעורים התלויים ועומדים.",טיעוני המאשימה לעונש
