verdict,text,part
"תפ""ח 46590-06-18","באשר לנסיבות הקשורות בביצוע העבירה, עמדה ב""כ המאשימה על הפגיעה הקשה בערך קדושת החיים ושלמות הגוף שנגרמו על ידי מעשי הנאשם. נטען כי מדובר במקרה קשה של ירי בכוונה להמית את המנוח, שבוצע באופן ברוטלי ואכזרי, ללא עכבות, על רקע סכסוך סתמי, באופן המבטא אשם בדרגה גבוהה מאוד. עוד נטען כי הירי בוצע במרחב הציבורי, בצהריי היום, ללא מורא מהחוק, ובאופן המערער את בטחון הציבור.",טיעוני המאשימה לעונש
"תפ""ח 46590-06-18","נסיבה מחמירה נוספת טמונה בעצם העובדה שהעבירה בוצעה תוך שימוש בנשק, שהחזקתו מהווה עבירה חמורה כשלעצמה, ובענייננו התממש הסיכון מעצם ההחזקה. הנשק בו עשה הנאשם שימוש לא נתפס, ולא מן הנמנע כי אותו כלי נשק ממשיך ומערער את בטחון הציבור. הודגש כי על אף האמור בסעיף 7 לכתב האישום, לפיו הנאשם נשא את הנשק על רקע סכסוך קודם, אין בכך כדי להניח לטובתו כי נשא את הנשק לצורך הגנתי, ואין לראות בסיבת הנשיאה משום נסיבה מקלה. יש לשים את כובד המשקל על זמינותו לנאשם והשימוש ההתקפי שעשה בו, וביתר שאת לאור התממשות התוצאה הקטלנית. כעולה מפסיקה (ע""פ 4406/09) [פורסם בנבו] הקושי הטמון בנשיאת הנשק היא בזמינותו ובעידוד שבשימוש בו, והדברים אף עלו בעדותה של עו""ס עאזם בעניינו של הנאשם.",טיעוני המאשימה לעונש
"תפ""ח 46590-06-18","צוין כי הסדר הטיעון בתיק דנן הוא תוצר של הליך גישור, במסגרתו תוקנה הוראת החיקוק מאחר שהמאשימה סברה כי קיים קושי ראייתי בהוכחת הנסיבה המחמירה של תכנון מוקדם, אחרת היתה עומדת על הרשעתו בעבירת רצח בנסיבות מחמירות, אך אין מקום ליתן לנאשם ""הנחה"" נוספת בגין כך. בצד האמור הודגש כי הנאשם יצא מביתו כשהוא מצויד באקדח, ומוכן לעשות בו שימוש, ואין בעובדה שההחלטה להמית התגבשה באופן ספונטני ובלהט הרגע כדי להמעיט מהחומרה וממידת המסוכנות, שעה שהרצח בוצע ללא סיבה מוצדקת וכשבפני הנאשם עמדו אפשרויות אחרות שאינן פוגעניות. כן צוין שאין בהסכמת המאשימה בגישור לכך שעונש המאסר שיושת בגין העבירה ההתנהגותית של נשיאת הנשק יהיה בחופף לעונש מאסר עולם שיוטל בגין עבירת הרצח, כדי להפחית מחומרת עבירת נשיאת הנשק. כן צוינה לחומרה העובדה שהירי בוצע לעבר רכב נוסע, בסביבת בתי מגורים ומסחר, הומת אדם ואך בנס לא נגרם נזק גדול יותר.",טיעוני המאשימה לעונש
"תפ""ח 46590-06-18","עוד עמדה המאשימה על הנזק החמור שנגרם למשפחתו של המנוח כתוצאה מהפגיעה בו, כעולה מהתסקיר.",טיעוני המאשימה לעונש
"תפ""ח 46590-06-18","באשר לסיבות שהביאו את הנאשם לבצע את העבירה, ביקשה המאשימה להדגיש שהמפורט  בסעיף 3 לכתב האישום כי הנאשם חש ""מושפל, מאוים וחשש מהמנוח"" על רקע העימות עם המנוח, מהווה חשש סובייקטיבי גרידא שלא תאם את המצב לאשורו. בפועל הנאשם לא היה בסכנת חיים, שכן המנוח נסע ברכב ואילו הנאשם הוא שחתר למגע בכך שרץ לעברו עם אקדח שלוף וירה בו מטווח קצר, חרף אפשרויות פעולה אחרות שאינן פוגעניות, שעמדו בפניו.",טיעוני המאשימה לעונש
"תפ""ח 46590-06-18","ב""כ המאשימה הדגישה בטיעוניה כי אין מקום להקל בעונשו של מי שבחר להמית את המנוח בשל תחושת ההשפלה שחש, לאור הפגיעה בכבודו. ההיפך הוא הנכון – רגש של פגיעה בכבוד הוא רגש שיש לגנותו בהיותו מניע למעשי אלימות, ולמרבה הצער מקרי רצח רבים תחילתם בפגיעה בכבוד. הוטעם כי הנאשם חש מושפל ביתר קלות, אף במקומות שאינם מותאמים לסיטואציה, וזאת מתוך רגשי נחיתות או העדר בטחון עצמי. בהקשר זה הפנתה לדברי עו""ס עזאם מהם עולה כי הנאשם חש מושפל כתוצאה ממבטיהם של האסירים האחרים בשל נכותו.",טיעוני המאשימה לעונש
"תפ""ח 46590-06-18","עוד צוין כי אין מקום להתחשב לקולא בפוסט טראומה ממנה סובל הנאשם שהינה תולדה של תאונת דרכים שהתרחשה 18 שנים לפני אירוע הרצח, במהלכן כשל מלטפל בעצמו או ללמוד טכניקות לשליטה בכעסים וחרף האמור אף אוחז בנשק. נטען בהקשר זה כי התזה לפיה הנאשם נהג בעת הרצח באימפולסיביות, מתוך לחץ, על רקע נתוניו האישיים ופוסט הטראומה ממנה סובל, אינה עולה בקנה אחד עם התנהלותו קרת הרוח באירוע, ולאופן ההתקפי והנחוש בו פעל הנאשם. אף אין מקום להקל עמו אף בשל נכותו הפיזית, שכן מגבלה זו לא עצרה בעדו לרוץ על הקביים לכיוון המנוח, כאילו אינו סובל מכל מגבלה גופנית. החריגה הבולטת מהנורמות החברתיות, והעובדה כי היו ברשותו של הנאשם אפשרויות פעולה חלופיות, אינן מאפשרות הקלה עמו בשל נסיבותיו האישיות.",טיעוני המאשימה לעונש
"תפ""ח 46590-06-18","עוד נטען כי אין מקום לקבל את הטענה כאילו יש מקום להקל בעונשו של הנאשם בשל היותו מאוים מאחרים. כעולה מעדויות מומחי ההגנה בעניין זה, הנאשם עצמו לא טען לקשר ישיר בין הסכסוך הקודם לבין המנוח.",טיעוני המאשימה לעונש
"תפ""ח 46590-06-18","הודגש כי לנאשם עבר פלילי קודם בגין איומים, עבירות רכוש, תגרה וירי באזור מגורים. הודגש כתב האישום וגזר הדין העוסקים באירוע שהתרחש במאי 2009, במסגרתו ירה הנאשם כ-5-6 יריות באוויר בעקבות קטטה בין 2 קבוצות, ובהמשך אושפז עקב דקירה. מהאמור עולה כי אין זו הפעם הראשונה בה מנסה הנאשם לפתור סכסוכים באמצעות נשק שבענייננו הוביל לתוצאה הקשה.",טיעוני המאשימה לעונש
"תפ""ח 46590-06-18","כן הודגש הצורך למגר את נגע הפשיעה והאלימות הגואה בחברה הערבית, שהפך בהדרגה לאתגר אסטרטגי ומדיני. העברת מסר מרתיע וברור על ידי בית המשפט, לפיו למערכת אכיפת החוק יש ""אפס סובלנות"" כלפי האלימות, תסייע למיגור התופעה.",טיעוני המאשימה לעונש
"תפ""ח 46590-06-18","ב""כ המאשימה ביקשה שלא ליתן משקל לחוות הדעת של מומחי ההגנה, או לחילופין להעניק להן משקל אפסי. הוטעם כי לא בכדי בחר ב""כ הנאשם שלא להפנותו לעריכת תסקיר שירות מבחן, ואין בחוות הדעת של המומחים להוות תחליף לכך. כן נטען כי המומחים כשלו בכך שבחרו שלא לצפות בסרטון האירוע ולנתח את האירוע גם לאורו, והסתפקו בדברי הנאשם שהובררו בחלקם כבלתי מדויקים. באשר לחרטה שהביע הנאשם בפני המומחים, נטען שאין לתת לה משקל בעת גזירת העונש אלא במסגרת בקשה לקציבת העונש בפני הנשיא או כשיקול לקיצור עונשו בועדת השחרורים.",טיעוני המאשימה לעונש
"תפ""ח 46590-06-18","לאור האמור, עתרה המאשימה להשית על הנאשם עונש מאסר עולם בלתי קצוב, מאסר בגין עבירת הנשק שיושת בחופף למאסר העולם, מע""ת בגין עבירות אלימות ונשק ופיצוי למשפחת המנוח כפי שהופקד.",טיעוני המאשימה לעונש
"תפ""ח 46590-06-18","ב""כ הנאשם, עו""ד משה מרוז, עתר לדחות את עמדת המאשימה להשתת מאסר עולם מבלי לקבוע מתחם עונש הולם בעבירות רצח, תוך שסמך ידיו על פסיקת בתי המשפט השונים. הודגש כי אי קביעת מתחם אינה עולה בקנה אחד עם לשון החוק המקנה לבית המשפט שיקול דעת בגזירת עונשו של הנאשם, בעבירה בה הורשע. כן הוטעם כי לא בכדי קיימת הבחנה בין עבירת הרצח ""הבסיסי"" בה הורשע הנאשם לעבירת הרצח בנסיבות מחמירות שהעונש הנקוב בצידה הוא מאסר עולם חובה.",טיעוני ההגנה לעונש
"תפ""ח 46590-06-18","באשר לנסיבות הקשורות בביצוע העבירה, נטען כי מבלי להקל ראש מריבוי עבירות הרצח במגזר הערבי, לא ניתן להתעלם מ""תרומת"" המדינה והמשטרה למצב, שהתדרדר לאורך השנים בשל אוזלת היד והזנחת הנושא, ולבטח אין מקום לגלגל לפתחו של הנאשם את המחדל האמור. מעבר לכך, אין מקום להשוות בין מקרי רצח בין כנופיות, או כאלה שבוצעו לאחר תכנון, לבין הרצח בנסיבותיו של התיק דנן, שהינו יוצא דופן על רקע הפסיקה שניתנה עד היום.",טיעוני ההגנה לעונש
"תפ""ח 46590-06-18","נטען כי הרקע לביצוע העבירה טמון בפוסט טראומה ממנה סובל הנאשם, מאז קטיעת רגלו עקב תאונת דרכים שעבר כהולך רגל בגיל 10. סבלו הרב נמשך לאורך השנים, הנאשם הפסיק את לימודיו, לא הצליח להשתלב בשוק העבודה, היה דחוי חברתית והמצב השפיע לרעה על מצבו הנפשי. ב""כ הנאשם הפנה לעדויותיהם של המומחים שהעידו מטעם ההגנה וציינו כי התסמונת הפוסט-טראומתית חלה לצמיתות.",טיעוני ההגנה לעונש
"תפ""ח 46590-06-18","עוד נטען כי במהלך השנה האחרונה לפני האירוע ניסו להתנקש בחייו של הנאשם פעמיים (הוגשו כתבי האישום בעניין זה נ/4 ו-נ/5) והנאשם שהיה מודע לניסיונות הפגיעה בו, החל לשאת נשק, לשם הגנתו העצמית. הודגש כי אין חולק שהמנוח נורה באופן ספונטני ובלא תכנון מוקדם ואין בעובדה שהיה בכיסו של הנאשם אקדח זמין מבעוד מועד כדי לערער קביעה זו. עוד צוין כי הנאשם לא חיפש את המנוח, אלא שהה ביחד עם אחיו בחנות באזור מגוריו וכעולה מסעיף 10 לכתב האישום הרכב בו שהה המנוח נסע תחילה בנתיב הנגדי של הכביש, בחלק הרחוק יותר של החנות בה שהה הנאשם, ולאחר מכן הסתובב לכיוון בו שהה הנאשם ואחיו.",טיעוני ההגנה לעונש
"תפ""ח 46590-06-18","ב""כ הנאשם הפנה לסעיף 11 לכתב האישום ממנו עולה כי העימות עם המנוח שהתרחש זמן קצר לפני האירוע, היווה טריגר עבור הנאשם, שממילא חי בפחדים ובחרדה פן יפגעו בו, ובייחוד על רקע נכותו הגורמת לו להיות פגיע יותר. הנאשם שחש מאוים ומושפל מהמנוח האמין כי נשקפת סכנה מוחשית לחייו ועל רקע האמור רץ לעבר הרכב עם אקדח שלוף. הסיבה שהנאשם לא ברח מהמקום אלא התקדם דווקא לעבר הרכב, קשורה להפרעת הדחק הפוסט טראומטית הצמיתה ממנה הוא סובל. בהקשר לאמור הפנה ב""כ הנאשם לעדויות המומחים שהעידו מטעם ההגנה לפיה הנאשם חי תחת תחושת איום תמידית בגינה רואה לעיתים צל הרים כהרים, וכאשר הוא חש מאוים הוא מרגיש צורך לעשות מעשה ולהגן על עצמו, בלא יכולת לשקול ולכלכל את צעדיו כדבעי. הגם שבפועל לא נשקפה באירוע סכנה לחייו, סבר כאמור ופעל בהתאם.",טיעוני ההגנה לעונש
"תפ""ח 46590-06-18","בהסתמך על פסיקה אליה הפנה, טען ב""כ הנאשם כי יש בתחושותיו הסובייקטיביות בעת האירוע כדי להקהות מחומרת נסיבות האירוע ולהוביל לקביעת מתחם מקל יותר.",טיעוני ההגנה לעונש
"תפ""ח 46590-06-18","באשר למדיניות הענישה הנוהגת, הפנה ב""כ הנאשם לשורה ארוכה של פסקי דין, תוך שאבחן לקולא את עניינו של הנאשם ועתר לקבוע מתחם עונש שנע בין 16 ל-24 שנים.",טיעוני ההגנה לעונש
"תפ""ח 46590-06-18","באשר לנסיבות שאינן קשורות בביצוע העבירה, הודגש כי הנאשם מביע צער רב על מות המנוח ועל הסבל שנגרם לבני משפחתו, ומתחרט מעומק ליבו על התוצאה הטראגית. נטען באשר לקושי המהותי ממנו סובל הנאשם בין כתלי הכלא נוכח מצבו הגופני ונכותו והיעדר מענה הולם. כן הפנה ב""כ הנאשם לסיכויי שיקומו הטובים כפי שעולה מעדותה של עו""ס עאזם. בהתייחסו לתסקיר נפגע העבירה צוין כי הסבל הרב שעוברת משפחתו של המנוח הינו ברור וטמון בעצם האובדן.",טיעוני ההגנה לעונש
"תפ""ח 46590-06-18","באשר לחפיפת עונש המאסר שיוטל בגין עבירת החזקת הנשק הודגש כי ההסכמה בין הצדדים היתה לחפיפה לכל עונש מאסר שיוטל, ולאו דווקא לעונש מאסר עולם.",טיעוני ההגנה לעונש
"תפ""ח 46590-06-18","בית המשפט התבקש לגזור את עונשו של הנאשם, לאור מכלול הנסיבות לקולא, על פי מידת הרחמים בתחתית המתחם, ל-16 שנות מאסר.",טיעוני ההגנה לעונש
"תפ""ח 46590-06-18","הנאשם הביע צער על מותו של המנוח, שהיה חברו הטוב, וגם משפחותיהם היו בקשרי קרבה הדוקים. לדבריו חושב באופן יומיומי על בתו של המנוח, שהיא עבורו כמו בת. לצד האמור הביע בפני בית המשפט את הקושי שחווה בבית הסוהר בשל מצבו הפיזי והיעדר מענה ראוי משב""ס.",דבר הנאשם
"תפ""ח 46590-06-18","במסגרת הרפורמה נקבע מדרג חדש לעבירות ההמתה, ובוטלה עבירת הרצח בכוונה תחילה, אשר דינה היה מאסר עולם חובה. חלף זאת נקבעו שתי עבירות שונות: עבירת הרצח בנסיבות מחמירות לפי סעיף 301א לחוק, שבצידה נותר עונש מאסר עולם חובה ועבירת הרצח הבסיסית, רצח בכוונה או באדישות לפי סעיף 300(א) לחוק, שבגינה כעולה מסעיף 311א לחוק: ""רשאי בית המשפט להטיל מאסר עולם לתקופה בלתי קצובה או מאסר לתקופה שלא תעלה על שלושים שנים.",דיון והכרעה
"תפ""ח 46590-06-18","על פי הסדר הטיעון שאליו הגיעו הצדדים תוקן כתב האישום, כאמור, כך שהנאשם הורשע בעבירת הרצח הבסיסית, תוך יסוד נפשי של כוונה, כנוסחה לאחר הרפורמה.",דיון והכרעה
"תפ""ח 46590-06-18","בדברי ההסבר להצעת חוק העונשין (תיקון מס' 124) (עבירות המתה), תשע""ו-2015, ה""ח הממשלה 972, נקבע כי עבירת הרצח הבסיסית נועדה לחול על המקרים החמורים של המתת אדם, אך לא על המקרים החמורים ביותר. למקרים החמורים ביותר של המתה נועדה העבירה של רצח בנסיבות מחמירות. עוד הובהר בדברי ההסבר כי ההצעה לקבוע בצד עבירת הרצח הבסיסית עונש מרבי של מאסר עולם או מאסר שלא יעלה על 30 שנים, באה לבטא את ""החשיבות המיוחדת של ערך חיי אדם, החומרה המיוחדת הנלווית לקיפוח חיי אדם וההוקעה החברתית הראויה למעשה ולעושה. קביעת העונש של מאסר עולם כעונש מרבי מאפשרת גמישות והטלת עונשים קלים יותר במקרים המתאימים..."" (הצעת החוק, בעמ' 169-170). ",דיון והכרעה
"תפ""ח 46590-06-18","בדו""ח הצוות לבחינת עבירות המתה בחוק מצוין כי עונש מאסר עולם כעונש מרבי בעבירת רצח הוא עונש ראוי מבחינת התיוג והמסר שהוא מגלם. הוא מבטא את החשיבות המיוחדת של ערך חיי אדם, והחומרה המיוחדת שבקיפוחם וההוקעה החברתית הראויה למעשה ולעושה. במקרים החמורים של עבירת הרצח הבסיסית ישנה הצדקה להטלת עונש חריג שאינו לתקופה קצובה, קרי- מאסר עולם. עם זאת, במקרים אחרים יש לאפשר לבית המשפט להטיל עונש מאסר קצוב, שלא יעלה על שלושים שנה, וזאת נוכח הוראות חוק שחרור על תנאי ממאסר, לפיהן ועדת שחרורים מיוחדת מוגבלת בהמלצתה לקצוב את עונשו של אסיר עולם לתקופה שלא תפחת משלושים שנה (דו""ח ועדת קרמניצר, בעמ' 16-17).",דיון והכרעה
"תפ""ח 46590-06-18","לאור נוסחו של סעיף עבירת הרצח הבסיסית וברוח דברי ההסבר להצעת החוק, לא מצאנו לקבל את טענת ב""כ המאשימה כי אין מקום לקבוע כלל מתחם ענישה בעבירת הרצח הבסיסית שנעברה בכוונה שכן לטעמה של המאשימה עונש המוצא בעבירה זו הוא מאסר עולם.",דיון והכרעה
"תפ""ח 46590-06-18","כאמור, לצידה של עבירה זו קבוע עונש מרבי של מאסר עולם, באופן שמאפשר לבית המשפט שיקול דעת בעת גזירת העונש. בהינתן כי אין המדובר בעונש מאסר עולם חובה, ובהתאם להוראות תיקון 113 שעניינו הבניית שיקול הדעת בענישה, הרי שיש צורך בקביעת מתחם ענישה הולם למעשה העבירה, שלו רף עליון ורף תחתון. ויודגש כי לו מצא המחוקק להשית מאסר עולם כעונש חובה בגין עבירת הרצח הבסיסית שנעברה בכוונה, להבדיל מיסוד נפשי של אדישות, כטענת המאשימה, ברי כי היה מבצע הבחנה בין יסודות נפשיים אלה.",דיון והכרעה
"תפ""ח 46590-06-18","יודגש כי עמדת ב""כ המאשימה לא התקבלה על ידי כלל בתי המשפט המחוזיים. גם ב""כ המאשימה אינה חולקת על כך ואין בידה להציג פסקי דין התומכים בעמדתה. נוכח כניסת הרפורמה לתוקפה שלא מכבר, המדובר בפסקי דין שחלקם אינם חלוטים ובית המשפט העליון טרם אמר את דברו.",דיון והכרעה
"תפ""ח 46590-06-18","מצאנו על פי מבחני הפסיקה (ע""פ 4910/13 ג'אבר נ' מדינת ישראל [פורסם בנבו] (29.10.14)) כי לשתי העבירות בהן הורשע הנאשם ראוי לקבוע מתחם עונש הולם אחד, שכן יש ""קשר הדוק"" בין עבירת נשיאת הנשק לבין עבירת הרצח שבוצעה באמצעותו, משנעשו בסמיכות של זמן ומקום.",ריבוי עבירות
"תפ""ח 46590-06-18","עבירת הרצח הוגדרה כ""אחת העבירות המתועבות והשפלות ביותר בספר החוקים..."" (ע""פ 3617/13 טייטל נ' מדינת ישראל, פס' 66 [פורסם בנבו] (‏28.6.2016)). הערך המוגן הוא הערך העליון של קדושת החיים. מידת הפגיעה בערך זה הינה ברף הגבוה ביותר, נוכח התוצאה הבלתי הפיכה של מות המנוח, על ידי ירי מתוך כוונה  לגרום למותו, באמצעות אקדח אותו נשא הנאשם באופן בלתי חוקי.  ",הערך החברתי שנפגע ומידת הפגיעה בו
"תפ""ח 46590-06-18","המחוקק נתן ביטוי לחומרה ולענישה המתחייבת בגין עבירת הרצח הבסיסית, בקבעו בצידה עונש מקסימלי של מאסר עולם. גם בתי המשפט עמדו לא אחת על החומרה הטבועה בביצוע עבירת המתה בכלל ובאמצעות נשק בפרט, ועל הענישה המחמירה המתחייבת בגינה.",הערך החברתי שנפגע ומידת הפגיעה בו
"תפ""ח 46590-06-18","כך נקבע בעניין זה בע""פ 9422/11 דהן נ' מדינת ישראל, פס' 8 [פורסם בנבו] (3.7.13): ",הערך החברתי שנפגע ומידת הפגיעה בו
"תפ""ח 46590-06-18","בהקשר לאמור אף נפנה לדברים שנקבעו בע""פ 4406/19 ‏מדינת ישראל נ' יונס סובח, פס' 16-18 [פורסם בנבו] (‏5.11.2019):",הערך החברתי שנפגע ומידת הפגיעה בו
"תפ""ח 46590-06-18","נסיבות ביצוע העבירה מלמדות על חומרתן. הנאשם הגיע בצהרי היום, למרחב ציבורי הומה אדם, במרכזה של עיר,  כשהוא נושא על גופו את האקדח שלא כדין. בהעדר עכבות ובלא מורא, ותוך סיכון העוברים ושבים, עשה שימוש באקדח וירה לעבר המנוח שהיה ישוב בתוך רכב, והמשיך לירות לעברו גם כשהרכב חלף על פניו והמשיך בנסיעתו, ובכך גרם למותו.",הנסיבות הקשורות לביצוע העבירה
"תפ""ח 46590-06-18","במעשיו הנלוזים קיפד הנאשם את חייו של המנוח, רביע פריג', שהיה רק בן 29 במותו, נשוי ואב לילדה בת 5, והיווה דמות מרכזית ומלכדת של המשפחה המורחבת. מהתסקיר שנערך בעניינן של נפגעות העבירה, אלמנתו ואחותו, עולה תמונת נזק קשה לכל בני משפחתו של המנוח, במכלול תחומי החיים. האירוע הטראגי והפתאומי, ממשיך להוות גם כיום, בחלוף כ-3 שנים מאז האירוע, ציר מרכזי בדינמיקה המשפחתית ומגדיר אותה כמשפחה אבלה ושכולה, המתקשה להתאושש ולשוב למסלול החיים.",הנסיבות הקשורות לביצוע העבירה
