verdict,text,part
"תפ""ח 46590-06-18","כעולה מכתב האישום, הנאשם החזיק באקדח על רקע הסכסוך הקודם וההגנה ביקשה להיבנות מעובדה זו לקולא, בטענה כי הנאשם נשא את האקדח לצרכי הגנה עצמית. אין אנו רואים את האמור עין בעין עם ההגנה. החומרה הגלומה בעבירת נשיאת הנשק כשלעצמה, נובעת בין היתר מהסיכון הממשי כי המחזיק בו יתפתה לעשות שימוש בנשק, גם אם מתוך תחושת לחץ, וסיכון זה אכן התממש בענייננו. אין חולק כי לאירוע לא קדם תכנון מוקדם וכי הנאשם לא יזם את המפגש עם המנוח. ואולם היות הנאשם מצויד מבעוד מועד באקדח, איפשר לו להוציא לפועל את החלטתו הספונטנית להמית את המנוח. גם העובדה כי האקדח לא נתפס מוסיפה נופך של חומרה.",הנסיבות הקשורות לביצוע העבירה
"תפ""ח 46590-06-18","מכתב האישום עולה בנוסף כי ברקע לביצוע העבירה מצוי העימות עם המנוח שהתרחש כיממה קודם לכן, אשר גרם לנאשם לחוש מאוים ומושפל ולחשוש מפניו של המנוח. כן עולה כי המנוח עבר במקום כשהוא ישוב ברכב בו נהג חברו ושינה את מסלול נסיעתו באופן בלתי מתוכנן, והגיע למקום. ואולם, חלף לעזוב את המקום, חתר הנאשם למגע עם המנוח, התקדם לעבר הרכב עם אקדח שלוף, וירה לעבר הרכב בו נסע המנוח מספר יריות מטווח קצר, וגם כשהרכב המשיך בנסיעה, הוסיף הנאשם לירות לעבר צדו של הרכב. בהקשר זה טען ב""כ הנאשם בהסתמך על פסיקה שאליה הפנה כי יש בתחושותיו הסובייקטיביות של הנאשם בעת האירוע כדי להקהות מחומרת נסיבות האירוע ולהוביל לקביעת מתחם מקל יותר.",הנסיבות הקשורות לביצוע העבירה
"תפ""ח 46590-06-18","הוא הדגיש כי כעולה מעדויות המומחים שהעידו מטעם ההגנה, הנאשם לא ברח מהמקום אלא התקדם דווקא לעבר הרכב, בשל הפרעת הדחק הפוסט טראומטית הצמיתה ממנה הוא סובל. הנאשם אשר חש מאוים נוכח העימות עם המנוח וניסיונות החיסול שעבר במסגרת הסכסוך הקודם, סבר כי נשקפת סכנה לחייו ופעל להגן על עצמו, בלא יכולת לשקול ולכלכל את צעדיו כדבעי וזאת הגם שבפועל לא נשקפה לו סכנה כאמור.",הנסיבות הקשורות לביצוע העבירה
"תפ""ח 46590-06-18","אכן, בפסקי הדין אליהם הפנה ב""כ הנאשם, לרבות בת""פ (מח' ב""ש) 27212-01-21 מדינת ישראל נ' שיף [פורסם בנבו] (09.11.21) (אשר הפך חלוט לאחרונה), ניתן משקל ממשי בעת קביעת העונש לתחושות הסובייקטיביות של הנאשם. ואולם, עניין זה הובא בחשבון על ידי בתי המשפט השונים לצרכי הקלה בעונש בעת שקילת גדרי המתחם ובמסגרת נסיבת הקרבה לסייג ההגנה העצמית, תוך קביעה כי המדובר בנסיבה המפחיתה את חומרת מעשה העבירה ואת אשמו של הנאשם. ",הנסיבות הקשורות לביצוע העבירה
"תפ""ח 46590-06-18","בענייננו ההגנה לא טענה לקרבה לסייג ההגנה העצמית (ר' עמ' 274 ש' 15-16 וכן בסעיף 5 לבקשתו מיום 14.11.21). גם לגופו של עניין, לא הוכח כי מדובר במקרה העולה כדי קרבה לסייג ההגנה העצמית. ",הנסיבות הקשורות לביצוע העבירה
"תפ""ח 46590-06-18","ד""ר סבר שימש כמומחה מטעם בית משפט באותו ההליך וחוות דעתו לא אומצה במלואה על ידי בית המשפט. מעבר לכך ד""ר סבר הגדיר את הפוסט טראומה ככזו שבאה לידי ביטוי בסיוטי לילה ושחזור של הטראומה של התאונה ובהלה מצפירות אמבולנס ובלימות פתע. מאז לא פגש בנאשם וחוות דעתו אינה מתייחסת למצבו העדכני.",הנסיבות הקשורות לביצוע העבירה
"תפ""ח 46590-06-18","ד""ר חסאן עאמר טיפל בנאשם כ-3 שנים אחרי התאונה ופגש בו בחלוף שנים ארוכות עובר למועד עריכת חוות דעתו, באוגוסט 2021. העד למד על מצבו העדכני של הנאשם מדבריו ולא נמצאה אינדיקציה בחוות דעתו ובעדותו כי ביסס את קביעתו מעבר לדברי הנאשם גם על מבחני אישיות שערך לו.",הנסיבות הקשורות לביצוע העבירה
"תפ""ח 46590-06-18","לפיכך לא מצאנו לקבוע כי יש בתחושותיו הסובייקטיביות של הנאשם בעת האירוע, על רקע הפוסט טראומה ממנה הוא סובל, כדי להפחית מחומרת מעשה העבירה או מאשמו לצורך קביעת המתחם.",הנסיבות הקשורות לביצוע העבירה
"תפ""ח 46590-06-18","בבואנו לקבוע את מתחם העונש ההולם, התחשבנו בגזרי הדין שיפורטו להלן, וזאת בשינויים המחויבים ובכללם נסיבות המעשה, הסיבות שהובילו לביצוע העבירה, האמצעי ששימש לצורך ביצועה, קיומו של תכנון מוקדם, וטיב הקשר בין הנאשם לבין נפגע העבירה.",מדיניות הענישה הנוהגת
"תפ""ח 46590-06-18","תפ""ח (מחוזי מר') 885-11-18 מדינת ישראל נ' מסרשה [פורסם בנבו] (6.1.2021)- הנאשם ששרת כשוטר, הורשע לאחר שמיעת ראיות בביצוע עבירת הרצח הבסיסית בכוונה. הנאשם ירה בראשה של אשתו, ירייה אחת באמצעות אקדח שהחזיק ברישיון, על רקע ויכוח שהתגלע ביניהם ובלא תכנון מוקדם. מיד לאחר מכן התקשר לרשויות. נקבע מתחם עונש הולם הנע בין 26 שנות מאסר בפועל לבין מאסר עולם. על הנאשם, נעדר עבר פלילי, אשר הביע חרטה מיד לאחר המעשה, נגזרו 29 שנות מאסר. (תלוי ועומד ערעור המאשימה בע""פ 1226/21) [פורסם בנבו]. ",מדיניות הענישה הנוהגת
"תפ""ח 46590-06-18","תפ""ח (מחוזי חי') 46210-12-18 מדינת ישראל נ' בדארנה [פורסם בנבו] (25.10.21)- הנאשם הורשע, לאחר שמיעת ראיות, בביצוע עבירה של רצח בכוונה תחילה. בהמשך לכך, ובהתאם לעמדת המאשימה כי לא מתקיימים במקרה זה נסיבות מחמירות, הורשע בעבירת הרצח הבסיסית, כנוסחה לאחר הרפורמה. בין הנאשם לאשתו, אחותו של המנוח, התפתח עימות, לאחריו נסע הנאשם למקום עבודתו של המנוח לפגוש בו.  במפגש ביניהם שנמשך זמן קצר, דחף הנאשם את המנוח, הפיל אותו ארצה ודקר אותו באמצעות סכין, שתי דקירות עמוקות בגב שגרמו למותו. נקבע כי ההחלטה להמית התגבשה אצל הנאשם באותן שניות קריטיות, בהן עמד מול המנוח וכי הנאשם לא הצטייד בסכין מבעוד מועד. ",מדיניות הענישה הנוהגת
"תפ""ח 46590-06-18","מתחם העונש ההולם במקרה זה נקבע כנע בין 22 לבין 30 שנות מאסר בפועל. בהתחשב בהעדר התכנון והפיצוי המשמעותי של משפחת המנוח, הושתו עליו 25 שנות מאסר בפועל.",מדיניות הענישה הנוהגת
"תפ""ח 46590-06-18","תפ""ח (מחוזי מר') 20749-11-18 מדינת ישראל נ' שפק [פורסם בנבו] (24.03.21)- הנאשם הורשע על פי הודאתו בעבירת הרצח הבסיסית, בעקבות הסדר טיעון שהושג במהלך שמיעת פרשת התביעה, ללא הסכמה לעניין העונש. הנאשם היה נשוי למנוחה, והיא הביעה את רצונה להתגרש ממנו בניגוד לרצונו, ובשלב מסוים עזבה את הבית. לבסוף חתמו בני הזוג על הסכם גירושין ונקבע דיון לצורך מתן הגט. כשבועיים לפני מועד גירושיהם, הגיע הנאשם לדירה בה שהתה המנוחה, בעקבות ויכוח שפרץ ביניהם יום קודם, ודקר את המנוחה באמצעות סכין בשר חדה, 15  דקירות בפלג גופה העליון של המנוחה, בכוונה לגרום למותה. כתוצאה ממעשיו נפטרה המנוחה. נקבע מתחם עונש הנע בין 27 שנים ועד למאסר עולם, ועל הנאשם נגזרו 28.5 שנות מאסר, וכן הופעל מאסר על תנאי בן חצי שנה בגין עבירת אלימות קודמת כלפי המנוחה, כך שסך הכל ירצה 29 שנות מאסר. (תלוי ועומד ערעור המאשימה בע""פ 3223/21) [פורסם בנבו].",מדיניות הענישה הנוהגת
"תפ""ח 46590-06-18","תפ""ח (מחוזי חי') 30108-09-19 מדינת ישראל נ' יאסין [פורסם בנבו] (17.06.21)- הנאשם הורשע בדעת רוב, לאחר שמיעת ראיות, בעבירת הרצח הבסיסית ביסוד נפשי של כוונה, בגין כך שרצח את אשתו המנוחה. כשבועיים לפני האירוע התעורר ויכוח בין הנאשם למנוחה, במהלכו סטר לה. ביום האירוע התעורר בין הנאשם למנוחה ויכוח נוסף במהלכו דקר אותה באופן מכוון דקירה אחת בחלק גופה העליון, באמצעות סכין חדה. נקבע כי המדובר באירוע ספונטני, שלא קדמו לו כל מעשי הכנה או תכנון. עוד נקבע כי לאחר האירוע נותרה המנוחה בחיים, אך הנאשם נמנע מלסייע לה, בעוד ילדיהם הקטינים מנסים לעשות כן בכוחם הדל. נקבע מתחם עונש הולם הנע בין 19 ל-25 שנות מאסר, ונגזר עונש של 22 שנות מאסר. (תלוי ועומד ערעור המאשימה בע""פ 6063/21) [פורסם בנבו].",מדיניות הענישה הנוהגת
"תפ""ח 46590-06-18","תפ""ח (מחוזי חי') 34802-06-19 מדינת ישראל נ' בולבול [פורסם בנבו] (21.1.21)- הנאשם הורשע, על פי הודאתו, במסגרת הסדר טיעון, בביצוע עבירת הרצח הבסיסית, תקיפה חבלנית ועבירות נשק. הרקע לאירוע סכסוך אלים שניטש בין הנאשם ואחיו ובין המנוח ובני משפחתו. לאחר עימות בין אחיו של הנאשם למנוח, שבו נכח הנאשם, סוכם שהאח והמנוח ייפגשו כדי ללבן את העניינים. הנאשם נכנס לביתו והצטייד באקדח טעון בכדורים, בו החזיק באופן לא חוקי, ונסע ברכב עם אחיו להיפגש עם המנוח. לאחר עימות שהיה בין האח ובין המנוח ובני משפחתו, יצא הנאשם מהרכב כשהוא אוחז באקדח, התקרב לעבר בני משפחת המנוח, ובהיותו במרחק של מטרים בודדים מהם, כיוון את האקדח לעבר המנוח וירה 5 יריות לפחות, בכוונה להמיתו. היריות פגעו במנוח שהתמוטט במקום. לאחר הירי, זינק אחי המנוח על הנאשם במטרה לחלץ את האקדח, ובין השניים התפתח עימות, שבמהלכו היכה הנאשם את אחי המנוח בראשו עם האקדח וגרם לו חבלה של ממש. בית המשפט קבע מתחם עונש הנע בין 22 ל-30 שנות מאסר, וגזר עליו 24 שנות מאסר בפועל. (תלוי ועומד ערעור המאשימה בע""פ 1605/21) [פורסם בנבו] . ",מדיניות הענישה הנוהגת
"תפ""ח 46590-06-18","בתפ""ח (מחוזי ב""ש) 5228-11-17 מדינת ישראל נ' עמרו [פורסם בנבו] (18.11.20), הורשע נאשם על פי הודאתו בעבירת רצח לפי סעיף 300(א), חטיפה לשם חבלה והשמדת ראיות. המנוח דרש מהנאשם כסף ואיים עליו שאם לא ישלם לו, יטיל עליו ועל משפחתו כישוף. הנאשם פנה למנוח שיבוא לאסוף אותו ברכבו בתואנה שישלם לו את שדרש. המנוח נכנס לרכב בו היו הנאשם ואחר והם נסעו לבית ששייך למשפחת הנאשם, שם נטל הנאשם טוריה ואת חפירה כדי לפגוע במנוח. הנאשם הציע למנוח לנסוע לראות שטח ששייך למשפחתו וכשהגיעו לשטח, וירדו מהרכב, הנאשם ריסס בפניו של המנוח גז פלפל ואז הנאשם והאחר היכו בראשו של המנוח באמצעות הטורייה והאת ובכך הביאו למותו. בהמשך חפרו בור, קברו את גופת המנוח, והשמידו את מכשירי הטלפון של המנוח ופרטים נוספים מהזירה. הצדדים הגיעו להסדר טיעון ובית המשפט קיבל את ההסדר והשית על הנאשם עונש של 28 שנות מאסר בפועל לצד ענישה נלווית. ",מדיניות הענישה הנוהגת
"תפ""ח 46590-06-18","תפ""ח (מחוזי מר') 58246-02-18 מדינת ישראל נ' ברהנו [פורסם בנבו] (10.12.19)- הנאשם הורשע על פי הודאתו בעבירת הרצח הבסיסית בכוונה, חבלה חמורה בנסיבות מחמירות, גניבה ושיבוש מהלכי משפט. בין הנאשם למנוח, שכנו, קשיש כבד שמיעה, לא הייתה הכרות מוקדמת. הנאשם נכנס לדירת המנוח בה שהה המנוח בגפו והיכה בחזקה באמצעות אגרופיו בפניו, בראשו ובגבו של המנוח בכוונה שהתגבשה באופן ספונטני, לגרום למותו. המנוח נפל ארצה ונפטר תוך זמן קצר כתוצאה מהמכות. הנאשם נטל את מפתח הדירה ובמהלך סוף השבוע שלאחר הרצח נכנס מספר פעמים לדירה, נטל ממנה פריטים שונים, ובמטרה להסוות את הרצח ניסה להצית את גופת המנוח ואת דירתו. למחרת הגיעה לדירה בתו של המנוח, והנאשם תקף אותה במכות פטיש בראשה וגרם לה חבלות בראש ובגפיים. במסגרת הסדר טיעון בין הצדדים, אשר נבע מקשיים ראייתיים מסוימים, הגבילה המאשימה את עתירתה לעונש של 30 שנות מאסר. נוכח הסדר הטיעון נמנע בית המשפט מלקבוע מתחם עונש, והשית על הנאשם עונש של 28 שנות מאסר בפועל. (בע""פ 616/20 ברהנו נ' מדינת ישראל [פורסם בנבו] (23.6.21), נדחה ערעורו של הנאשם, לאחר שחזר בו מהערעור).",מדיניות הענישה הנוהגת
"תפ""ח 46590-06-18","תפ""ח (מחוזי ת""א) 13903-07-18 מדינת ישראל נ' מרמש [פורסם בנבו] (17.9.20)- הנאשמים הורשעו על פי הודאתם במסגרת הסדר טיעון בעבירת הרצח הבסיסית בכוונה. הנאשמת שבזמן ביצוע העבירה הייתה מעט מעל גיל 18 ובן זוגה הנאשם שהיה כבן 21 שנים קשרו קשר לרצוח את אם הנאשמת נוכח התנגדותה לקשר ביניהם. לאחר תכנון מוקדם הנאשם רצח את אם הנאשמת, בהסכמתה ועל דעתה של הנאשמת, בשבע דקירות סכין. בית-המשפט קבע מתחם עונש הולם הנע בין 24 ל-29 שנות מאסר, וגזר את העונש המוסכם על פי ההסדר, של 25 שנות מאסר בפועל לצד ענישה נלווית.  ",מדיניות הענישה הנוהגת
"תפ""ח 46590-06-18","תפ""ח (מחוזי מר') 13100-10-19 מדינת ישראל נ' קחמאן [פורסם בנבו] (19/05/21)- הנאשם הורשע על פי הודאתו בעבירת הרצח הבסיסית. ברקע לביצוע הרצח, עימות בין חברו של הנאשם וחברו של המנוח שהוביל לקטטה בין החבורות. הנאשם יצר קשר עם שניים מאחיו, והם סיכמו להיפגש ולהידבר עם המנוח ואחיו עוד באותו הלילה. בעת המפגש הנאשם היה חמוש באקדח טעון בכדורי 9 מ""מ אותו הטמין במכנסיו מאחורי גבו, ואחיו היה חמוש באלת ברזל מתקפלת. כשהגיע המנוח למקום ברכב רצו לעברו הנאשם ואחיו. אחד האחים ניפץ את השמשה עם האלה והנאשם החל לירות במנוח והמשיך בירי גם כשהמנוח ניסה לנסוע מהמקום וירה 6 יריות. אחד מהקליעים פגע בראשו של המנוח, וגרם למותו. בנסגרת הסדר הטיעון שגובש בין הצדדים הוסכם לעתור במשותף לעונש של 25 שנות מאסר. בית המשפט החליט לכבד את הסדר הטיעון תוך שציין לזכותו של הנאשם את היותו אדם צעיר, אשר הודה, נטל אחריות למעשיו והביע חרטה. הודייתו של הנאשם ייתרה את שמיעת הראיות בתיק מורכב יחסית, ומכאן שנחסך זמן שיפוטי יקר. ",מדיניות הענישה הנוהגת
"תפ""ח 46590-06-18",לאור האמור מצאנו לקבוע את מתחם העונש ההולם כנע בין 25 שנות מאסר לבין מאסר עולם.,מדיניות הענישה הנוהגת
"תפ""ח 46590-06-18","במקרה דנן, לא קיימים שיקולים אשר מצדיקים חריגה מהמתחם. ",מדיניות הענישה הנוהגת
"תפ""ח 46590-06-18","הנאשם יליד שנת 1988. לחובתו עבר פלילי הכולל 3 הרשעות בעבירות רכוש, הפרת הוראה חוקית ואלימות מילולית ופיזית. מעיון בכתבי האישום שהוגשו ע""י המאשימה עולה כי דרך האלימות אינה זרה לנאשם ואין המדובר בפעם הראשונה בה הוא עושה שימוש בנשק חם. במקרה הקודם, אשר אירע בשנת 2009, נידון הנאשם ל-45 ימי מאסר בגין כך שירה 5-6 יריות באוויר, במסגרת קטטה בה נטל חלק. כן הורשע בביצוע עבירות איומים בפגיעה שלא כדין בבת זוגו ובבנם המשותף. ",גזירת העונש המתאים לנאשם 
"תפ""ח 46590-06-18","לקולא שקלנו את הודייתו של הנאשם בכתב אישום מתוקן, תוך לקיחת אחריות על המעשים והבעת חרטה על ביצועם, כעולה מחוות דעתה של עו""ס מראם עאזם-נאשף ומדברי הנאשם לפנינו. בהקשר זה יש להפנות גם לפיצוי הכספי המוסכם לאשת המנוח, בסך 150,000 ₪ , אשר הופקד על ידו עוד בטרם שמיעת הטיעונים לעונש.",גזירת העונש המתאים לנאשם 
"תפ""ח 46590-06-18","עוד מצאנו ליתן משקל לקולא, בגדרי המתחם, לנסיבות חייו הקשות של הנאשם אשר איבד את רגלו בתאונת דרכים בגיל 10, וסובל מנכות פיסית ונפשית לצמיתות. נוכח האמור אף יקשה על הנאשם לספק את צרכיו היומיומיים בין כתלי הכלא ועונש המאסר אשר יוטל עליו יהא קשה עבורו יותר מאשר עבור אסירים אחרים. עוד נתנו דעתנו לכך שהנאשם היה נתון בעבר לניסיונות פגיעה בו.",גזירת העונש המתאים לנאשם 
"תפ""ח 46590-06-18","אשר על כן, אנו גוזרים על הנאשם את העונשים הבאים:",גזירת העונש המתאים לנאשם 
"תפ""ח 46590-06-18","מאסר בפועל למשך 27 שנים, בניכוי ימי מעצרו 22/5/2018. ",גזירת העונש המתאים לנאשם 
"תפ""ח 46590-06-18","12 חודשי מאסר על תנאי לבל יעבור הנאשם במשך 3 שנים מיום שחרורו מן המאסר כל עבירת אלימות מסוג פשע, או עבירת נשק מסוג פשע.",גזירת העונש המתאים לנאשם 
"תפ""ח 46590-06-18","פיצוי לאשת המנוח בסך 150,000 ₪, אשר יועבר מסך הפיקדון שהופקד על ידי הנאשם לשם כך. המאשימה תמסור את פרטי חשבון הבנק אליו יש להעביר את הפיצוי.",גזירת העונש המתאים לנאשם 
"תפ""ח 46590-06-18","ניתן והודע היום כ""ט טבת תשפ""ב, 02/01/2022 במעמד הנוכחים.  ",<#4#>
"תפ""ח 46590-06-18","רות  לורך, שופטת - נשיאה",<#4#>
"תפ""ח 46590-06-18","דבורה עטר, שופטת",<#4#>
"תפ""ח 46590-06-18","עמי קובו, שופט",<#4#>
"תפ""ח 46590-06-18",5467831354678313הוקלד על ידי ליאת קחלון,51293715129371 
"תפ""ח 46590-06-18","בעניין עריכה ושינויים במסמכי פסיקה, חקיקה ועוד באתר נבו – הקש כאן",51293715129371 
"תפ""ח 46590-06-18",רות לורך 54678313-/,51293715129371 
