verdict,text,part
"ע""פ 6038∕21","עוד חזר המערער על טענותיו, כי לא יכול היה לבצע את עבירות המין המיוחסות לו, נוכח מצבו הרפואי; כי היה מעביר את מרבית ימיו בבית קפה; וכי האם לא הייתה נוהגת לצאת מהבית. לטענתו, בחקירותיו במשטרה ציין את מצבו הרפואי ואת מנהגו להעביר את רוב שעות היום בבית קפה, אולם הדברים לא נרשמו על-ידי החוקרים. בתוך כך, טען המערער, כי גרסתו בהקשר זה נתמכת על-ידי עדות האם ועדותם של שני חבריו. כן השיג המערער על קביעת בית המשפט המחוזי, לפיה האם הייתה נוהגת לצאת מהבית שלוש עד ארבע פעמים בשבוע, לערך. לטענתו, קביעה זו נסמכת בעיקרה על עדותה של המתלוננת (אשר אינה מהימנה); עדות בתו הקטנה (להלן: האחות ח'), אשר שותפה למזימה שרקמה המתלוננת ודבריה הם תוצר של שאלות מכווינות; ועדות האם, שמסרה בעניין זה ""בליל של גרסאות"" ולא ניתן ללמוד מאמרותיה בחקירתה במשטרה, או בבית המשפט, על התדירות בה נהגה לצאת מהבית. לטענת המערער, מי שיכולה הייתה לשפוך אור על התדירות בה ביקרה האם את האחות הבכורה היא – האחות הבכורה. אולם, זו לא זומנה לחקירה במשטרה או למתן עדות בבית המשפט. לסיכום חלק זה, טען המערער, כי גרסתו מהימנה, אמינה, עקבית ומפורטת; וכי בית המשפט החמיר באופן שבו הוא בחן אותה, בפרט נוכח האופן המקל בו הוא בחן את גרסתה של המתלוננת.",עיקרי נימוקי הערעור
"ע""פ 6038∕21","בנוסף, טען המערער, כי שגה בית המשפט המחוזי שעה שהעדיף את חוות דעתה של ד""ר מימון, על-פני חוות דעתו של ד""ר שיזף. לעמדתו, כלל השיקולים עליהם עמד בית המשפט לצורך העדפת חוות דעתה של האחרונה, דווקא נוטים לכיוון העדפת חוות דעתו של ד""ר שיזף. זאת, נוכח ניסיונו הרב בתחום הגניקולוגיה; האופן בו הוא ביסס את מסקנתו; והתאמת מסקנתו לספרות המקצועית בתחום. כן נטען, כי חוות דעתה של ד""ר מימון לא התבססה על תשתית עובדתית מספקת, וכי מסקנתה התבססה על מחקרים שנפלו בהם כשלים מתודולוגיים. כך או אחרת, טען המערער, כי הספרות עליה התבססה ד""ר מימון דווקא מחזקת את מסקנתו של ד""ר שיזף. כמו כן, טען המערער, כי העדת ד""ר מימון כעדת הזמה, פגעה בזכותו להעיד את עדיו לאחר פרשת התביעה; ומנעה את האפשרות שד""ר שיזף יגיב לדבריה של ד""ר מימון.",עיקרי נימוקי הערעור
"ע""פ 6038∕21","אשר לערעור על גזר הדין, טען המערער, כי מתחם הענישה שנקבע בעניינו אינו תואם את מדיניות הענישה המקובלת במקרים דומים. עוד טען המערער, כי בית המשפט המחוזי נתן דעתו אך לנסיבות לחומרא בעניינו. כך, למשל, בית המשפט מנה לחובתו את כפירתו באשמה ובחירתו לנהל הליך הוכחות. בנוסף נטען, כי קיימים בעניינו שיקולים לקולא, אשר לא קיבלו ביטוי בגזר הדין של בית המשפט המחוזי, ובהם מצבו הרפואי והנפשי, והנזק שצפוי להיגרם למשפחתו עקב מאסרו. לצורך ביסוס טענותיו, הפנה המערער למקרים הדומים, לשיטתו, לעניינו, בהם נקבעו עונשים מקלים יותר. לאור האמור, עתר המערער לקבוע מתחם ענישה מקל יותר בעניינו, ולמקם את עונשו ברף הנמוך של מתחם ענישה זה, תוך התחשבות בשיקולים לקולא שפורטו.",עיקרי נימוקי הערעור
"ע""פ 6038∕21","לטענת המשיבה, מקרה זה אינו נמנה עם אותם מקרים חריגים ונדירים, בהם על ערכאת הערעור להתערב בממצאי מהימנות שקבעה הערכאה הדיונית. זאת, בפרט שעה שמדובר בעבירות מין במשפחה שבוצעו בקטינה. לעמדתה, הכרעת הדין מפורטת ומנומקת, ונותנת מענה לכלל הטענות שהעלה המערער בהליך שהתנהל בבית המשפט המחוזי. בית המשפט מצא חיזוקים פנימיים לגרסת המתלוננת, ומנגד לא התרשם כי קיימות סתירות של ממש בין אמירותיה בחקירתה במשטרה, ובין אמירותיה בעדותה בבית המשפט. עוד טענה המשיבה, כי השגותיו של המערער בדבר קביעת ממצאי מהימנות, בהתבסס על התנהגותה של המתלוננת, עומדים בניגוד למושכלות יסוד בדין הפלילי, לפסיקה ולשון סעיף 53 לפקודה שעניינו הערכת משקלה של עדות.",עיקרי תשובת המשיבה
"ע""פ 6038∕21","אשר לטענת המערער, לפיה עדותה של המתלוננת אינה רציפה, נעדרת שטף של סיפור והיא אפוא תוצר של שאלות מכווינות, טענה המשיבה, כי הדבר קרה פעם אחת בלבד ובאישור בית המשפט. המשיבה הזכירה את הקשיים הכרוכים בלהעיד את המתלוננת – נוכח גילה, המגזר אליו היא משתייכת, והעובדה כי היא נדרשה לפרט על אודות אירועים קשים בפני אנשים זרים. בתוך כך טענה המשיבה, כי בניגוד לטענת המערער, לא הייתה מוטלת על בית המשפט חובת הנמקה מוגברת לצורך הרשעתו. זאת, בין היתר, הואיל ובית המשפט מצא את המתלוננת מהימנה, ומצא ראיות לחיזוק ולסיוע גרסתה.",עיקרי תשובת המשיבה
"ע""פ 6038∕21","עוד טענה המשיבה, כי לא ניתן לחייב קורבן לעבירות מין לתת הסבר מלא לכל פרט בהשתלשלות האירועים מושא הפרשה, אלא יש לבחון את ליבת הגרסה שניתנה. וביחס לכך, קבע בית המשפט המחוזי בענייננו, כי לא קיימות סתירות מהותיות בגרסתה; וכי העובדה שעדותה דלה בפרטים נובעת מהקושי לתאר כל מעשה שביצע בה המערער בפירוט ובאופן מובחן מיתר המעשים, מקום בו אלו הפכו לשגרת חייה.",עיקרי תשובת המשיבה
"ע""פ 6038∕21","לא זו אף זו נטען, כי די באמון שנתן בית המשפט המחוזי בגרסתה של המתלוננת לצורך הרשעת המערער בעבירות שיוחסו לו בכתב האישום, אולם ממילא קיימות ראיות לחיזוק ולסיוע גרסתה. עוד נטען, כי ההימנעות מלחקור ולהעיד את האחות הבכורה נבעה משיקולים הנוגעים לביטחונה האישי, וכי לו חפץ המערער בלהעיד אותה רשאי היה לזמנה כעדה מטעמו. בלאו הכי, נטען, כי גרסתה של המתלוננת ביחס לתדירות בה נהגה האם לצאת מהבית, נתמכת בעדותה שלה.",עיקרי תשובת המשיבה
"ע""פ 6038∕21","זאת, בפרט בכל הנוגע לטענתו כי לא היו לו הזדמנויות לבצע את עבירות המין בהן הורשע; ובנוגע למצבו הרפואי, אשר אין להן זכר בחקירתו במשטרה. נטען, כי מדובר בגרסה כבושה ומלאה בסתירות, והעדים שהעידו מטעם המערער החלישו את הגרסה אף יותר. על כל פנים, די היה בחלון הזמנים אותו תיאר המערער, בו היה נוהג לשוב לבית כדי לנוח, לצורך ביצוע המעשים בהם הוא הורשע.",עיקרי תשובת המשיבה
"ע""פ 6038∕21","אשר לעדויות המומחים, המשיבה סומכת ידה על נימוקיו וקביעותיו של בית המשפט המחוזי, בנוגע להעדפת עדותה של ד""ר מימון על-פני עדותו של ד""ר שיזף; תוך שהיא טוענת כי הקביעה, לפיה אין בהיעדר ממצאים חבלתיים על קרום הבתולין כדי להעיד על היעדר חדירה, תואמת את הפסיקה בנושא זה. כן מציינת המשיבה, כי לפני שד""ר שיזף העיד, הועברה לידי המערער חוות דעתה של ד""ר מימון; וכי ד""ר מימון העידה כעדת הזמה לאחר שהמערער ציין שאינו מתנגד לכך. נוכח זאת, אין מקום לקבל את טענתו, לפיה נפגעה לו זכות בהקשר זה.",עיקרי תשובת המשיבה
"ע""פ 6038∕21","אשר לערעור על גזר הדין, המשיבה טענה כי מתחם הענישה שנקבע תואם את נסיבות המקרה הנוכחי, ואינו חורג מרמת הענישה הנוהגת. עוד נטען, כי העונש שהושת על המערער, בתוך גדרי המתחם, הוא עונש ראוי, שנותן משקל הולם לחומרת מעשיו, לנסיבות בהן בוצעו המעשים, לנזק שנגרם למתלוננת, לשיקולי הענישה השונים ולשיקולים לקולא.",עיקרי תשובת המשיבה
"ע""פ 6038∕21","בדיון שנערך לפנינו ביום 20.10.2022, חזרו באי-כוח הצדדים על עיקרי טיעוניהם שבכתב. בא-כוח המערער שב וטען, כי לא היה מקום להרשיע את המערער על סמך עדותה היחידה של המתלוננת, משלא נמצאו לה ראיות מאששות; משהתלונה הוגשה בשיהוי; היות שאיש לא חשד בדבר בתקופה הרלבנטית לכתב האישום; ונוכח העובדה שגרסתה דלה ומלאה בסתירות. עוד חזר בא-כוח המערער על המניעים הנטענים של המתלוננת להפליל את אביה, וכן על היעדר הסבירות שאכן ביצע בה את המעשים המיניים, נוכח היעדרם של ממצאים חבלתיים בקרום הבתולין שלה. לבסוף חזר בא-כוח המערער על האמור בכתב בכל הנוגע לערעור על גזר הדין.",הדיון שנערך בערעור
"ע""פ 6038∕21","מנגד, טענה באת-כוח המשיבה, כי המתלוננת נעדרת כל מניע להפליל את המערער, ולהפך – המתלוננת נשאה ונושאת במחיר כבד עקב הגשת תלונתה. עוד נטען, כי אין זו הפעם הראשונה בה נפגעת עבירות מין במשפחה אינה מצליחה לפרט בצורה מדויקת, על אודות האירועים הטראומטיים שחוותה; בפרט כאשר אירועים אלה דומים במהותם והפכו לחלק משגרת יומה. כמו כן, עמדה באת-כוח המשיבה על החיזוקים שנמצאו לגרסת המתלוננת; ועל כך שאין בהיעדר ממצאים חבלתיים בקרום הבתולין של המתלוננת כדי להפריך את גרסתה. לבסוף נטען, כי העונש שהושת על המערער תואם את מדיניות הענישה במקרים דומים, וכי אף הפסיקה אליה הפנה בא-כוח המערער אינה מבססת את טענותיו, ביחס לגזר הדין.",הדיון שנערך בערעור
"ע""פ 6038∕21","לאחר ששמענו את טיעוני הצדדים, הודענו בפניהם, כי איננו מוצאים מקום להתערבות בהכרעת הדין של בית המשפט המחוזי. נוכח זאת, המלצנו למערער לחזור בו מערעורו על הכרעת הדין, תוך שציינו את החשיבות הרבה בלקיחת אחריות מצד הפוגעים בעבירות מין והמשמעות של כך עבור הנפגעות – בפרט כאשר מדובר בעבירות מין שמבוצעות על-ידי קרוב משפחה. עוד ציינו, כי לקיחת אחריות באופן כן ואמיתי, אף בשלב מאוחר מהווה, במידה מה, שיקול לקולא, שאנו נכונים לקחת בחשבון בבחינת הערעור על גזר הדין. לאחר שחזרו הצדדים מהיוועצות, הודיע בא-כוח המערער כי מרשו עומד על מלוא ערעורו. משכך, נדרשים אנו כעת לשורת הדין.",הדיון שנערך בערעור
"ע""פ 6038∕21","לאחר שבחנתי את הכרעת הדין וגזר הדין, נתתי דעתי לטענות הצדדים בכתב והקשבתי קשב רב לטיעונים של באי-כוחם בעל-פה, אציע לחברותיי לדחות את הערעור על שני חלקיו ולהותיר את פסק דינו של בית המשפט המחוזי על כנו. אנמק עמדתי.",דיון והכרעה
"ע""פ 6038∕21","כלל נקוט הוא, כי אין זו מדרכה של ערכאת הערעור להתערב בממצאי עובדה ומהימנות של הערכאה הדיונית (ע""פ 2092/21 לוז'קין נ' מדינת ישראל, פסקה 12 [פורסם בנבו] (30.10.2022); ע""פ 2261/21 פלוני נ' מדינת ישראל, פסקה 25 [פורסם בנבו] (24.10.2022)). זאת, נוכח יתרונה של הערכאה הדיונית, אשר שומעת את העדויות ומתרשמת מהן באופן ישיר ובלתי אמצעי (ע""פ 1682/22 סבג נ' מדינת ישראל, פסקה 20 [פורסם בנבו] (11.09.2022)). הכלל האמור, בדבר אי-התערבות, מקבל משנה תוקף כשמדובר בעבירות מין (ע""פ 2647/21 פלוני נ' מדינת ישראל, פסקה 28 [פורסם בנבו] (21.08.2022), והאסמכתאות שם (להלן: ע""פ 2647/21)). זאת מכיוון ש""חלקן הארי של עבירות המין מבוצעות בחדרי חדרים, הרחק מעין בולשת, ולאחר שהעבריין הצליח לבודד את קורבנו"" (ע""פ 10049/03 פלוני נ' מדינת ישראל, פ""ד נט(1) 385, 392 (2004). ראו גם: ע""פ 4327/12 פלוני נ' מדינת ישראל, פסקה 13 [פורסם בנבו] (05.06.2013)); ובהתאם לכך, ככלל, הרשעה בעבירות ממין זה תתבסס בראש ובראשונה על העדפת גרסה אחת מבין שתי גרסאות עובדתיות סותרות – כאשר אין בנמצא ראיות אובייקטיביות התומכות באילו מן אותן גרסאות (ע""פ 2647/21, בפסקה 28 והאסמכתאות שם; לגישה המבקרת עמדה זו ראו את פסק דינו של השופט א' גרוניס בע""פ 3250/10 מדינת ישראל נ' פלוני, פ""ד סה(2) 482 (2012) (להלן: עניין פלוני)). ",על ממצאי עובדה ומהימנות בעבירות מין – כללי
"ע""פ 6038∕21","ואולם, ""כלל אי-ההתערבות אינו כלל בל-יעבור"" (ע""פ 7653/11 ידען נ' מדינת ישראל, פסקה 20 [פורסם בנבו] (26.07.2012) (להלן: עניין ידען)), גם לו מצויים חריגים, אם כי אלה – מצומצמים (ע""פ 1275/09 פלוני נ' מדינת ישראל, פסקה 34 [פורסם בנבו] (01.09.2009) (להלן: ע""פ 1275/09)). ערכאת הערעור רשאית גם היא לבחון ממצאי עובדה ומהימנות, ולהסיק מהראיות מסקנות שונות מאלו שהסיקה הערכאה הדיונית (סעיף 212 לחוק סדר הדין הפלילי [נוסח משולב], התשמ""ב-1982). ככלל, ניתן לחלק את המקרים בהם ערכאת הערעור תעשה כן לשתי קטגוריות עיקריות: הראשונה, כאשר מתבטל או מצטמצם היתרון שיש לערכאה הדיונית על-פני ערכאת הערעור בקביעת ממצאי עובדה ומהימנות (למשל, כאשר בדיקת העדויות נעשתה על בסיס מבחן ההיגיון, ולא על בסיס התרשמות ישירה מהעדים); ו-השנייה, כאשר נפלה טעות של ממש באופן בו העריכה ערכאת הערעור את הראיות שעמדו לפניה וקבעה את ממצאיה (השוו: ע""פ 9352/99 יומטוביאן נ' מדינת ישראל, פ""ד נד(4) 632, 645-644 (2000); עניין פלוני, בעמוד 535; עניין ידען, בפסקה 20).",על ממצאי עובדה ומהימנות בעבירות מין – כללי
"ע""פ 6038∕21","כפי שכבר צוין בפסיקת בית משפט זה, קיים קושי מסוים במגמה של צמצום ההתערבות של ערכאת הערעור בממצאי עובדה ומהימנות של הערכאה הדיונית בעבירות מין מצד אחד, כשמהעבר השני קיימת מגמה של הקלה בדרישה הראייתית לצורך הרשעה בעבירות מסוג זה (עניין ידען, בפסקה 22). שכן, אם בעבר, כדי להרשיע אדם המואשם בביצוע עבירות מין על בסיס עדותה של הנפגעת, הייתה נדרשת תוספת ראייתית מסוג סיוע; כיום ניתן להסתפק בעדותה היחידה של הנפגעת, ודרישת התוספת הראייתית הומרה בחובת נימוק (חוק לתיקון פקודת הראיות (מס' 6), התשמ""ב-1982; סעיף 54א(ב) לפקודה; ע""פ 8794/20 פלוני נ' מדינת ישראל, פסקאות 2 ו-22 לפסק דינה של השופטת ד' ברק ארז [פורסם בנבו] (10.05.2022) (להלן: ע""פ 8794/20)). משכך, על שופט לנקוט משנה זהירות שעה שעליו להכריע בעניין שלפניו, כאשר מן העבר האחד עדות המתלוננת, ואילו מן העבר השני עדות הנאשם. זאת, בראש ובראשונה נוכח החשש, שההקלה הראייתית לצד הכלל בדבר אי-ההתערבות בממצאי עובדה ומהימנות תגביר את הסיכון להרשעות שווא של מואשמים בביצוע עבירות מין (ראו: ע""פ 6378/95 ברוק נ' מדינת ישראל, פ""ד מט(5) 278, 283 (1996); עניין פלוני, בעמוד 540). כמו כן, על בית המשפט, היושב כערכאת ערעור על הרשעה בעבירות מין, להיזהר מפני החלת הכלל בדבר אי-התערבות באופן אוטומטי, מבלי בחינה פרטנית האם קיימת לכך הצדקה במקרה שלפניו (שם). בתוך כך יש לתת את הדעת, כי סתירות, במידה זו או אחרת, כמעט ותמיד יהיו בנמצא, בפרט כאשר מדובר בעדות של קטינה שנפלה קורבן לעבירות מין שבוצעו בה על-ידי קרוב משפחה (ראו: ע""פ 5582/09 פלוני נ' מדינת ישראל, פסקה 84 [פורסם בנבו] (20.10.2010) (להלן: ע""פ 5582/09)).",על ממצאי עובדה ומהימנות בעבירות מין – כללי
"ע""פ 6038∕21","האם בעניינו יש מקום לסטות מהכלל בדבר אי-התערבות ערכאת הערעור בממצאי עובדה ומהימנות של הערכאה הדיונית (כדעת המערער)? או שמא עלינו לפסוע בדרך המקובלת, ולמשוך ידינו מכך (כדעת המשיבה)? סבורני, כי בנסיבות מקרה זה, אין מקום לסטות מהכלל בדבר אי-התערבות.",על ממצאי עובדה ומהימנות – המקרה דנא
"ע""פ 6038∕21","התרשמותו הישירה והבלתי אמצעית של בית המשפט המחוזי, מעדות המתלוננת, עוברת כחוט השני בהכרעת דינו, המתפרשת על-פני 75 עמודים מפורטים ומנומקים. מעיון בהכרעת הדין לא ניתן אלא להגיע למסקנה, כי להתרשמותו הישירה של בית המשפט מהתנהלות המתלוננת, התנהגותה, שפת גופה, נימת דבריה והערכת אישיותה ניתן משקל של ממש (השוו: ע""פ 1442/06 מדינת ישראל נ' פלוני, פסקה 23 [פורסם בנבו] (01.09.2008) (להלן: ע""פ 1442/06); ע""פ 7596/20 פלוני נ' מדינת ישראל, פסקה 6 [פורסם בנבו] (16.03.2022)). בכך, מובחן ענייננו מעניין פלוני, עליו סומך המערער את ידו (ראו: עניין פלוני, בעמודים 533, 535, 540-539, 560).",על ממצאי עובדה ומהימנות – המקרה דנא
"ע""פ 6038∕21","בית המשפט המחוזי ציין את התנהגותה של המתלוננת על דוכן העדים, לרבות המבוכה שהיא חשה במהלך עדותה; מבוכה אשר באה לידי ביטוי בכך שלעיתים נהגה ללחוש, להרכין את ראשה, ולהשפיל את מבטה, וכל זאת – כאשר היא מכונסת ומכווצת אל תוך עצמה (עמוד 17 להכרעת הדין). עוד ציין בית המשפט את האופן ""הכה פשוט ואפילו ילדותי"" בו תיארה המתלוננת את הדברים, ואת התיאוריים האותנטיים והייחודיים שעשתה בהם שימוש (שם, בעמוד 21). כן צוין, כי המתלוננת לא הפריזה בדבריה, לא שאפה להשחיר את המערער והציגה את הדברים כהווייתם – אף כאשר הדבר עשוי היה לציירה באופן שלא יטיב עמה (שם, בעמודים 22-21). כל זאת, באופן שאינו עולה בקנה אחד עם מי שמבקשת להפליל את אביה.",על ממצאי עובדה ומהימנות – המקרה דנא
"ע""פ 6038∕21","מהאמור עולה, כי קביעותיו של בית המשפט המחוזי בכל הנוגע למהימנותה של המתלוננת נטועות עמוק בהתרשמותו הישירה ממנה. משכך, סבורני כי המקרה דנא מהווה דוגמה מובהקת למצב בו לערכאה הדיונית יתרון ניכר על-פני ערכאת הערעור, בהערכת העדויות שנשמעו בפניה. בהתאם לכך, איני סבור כי נכון שנתערב באופן שבו העריך בית המשפט את עדות המתלוננת, בהתבסס על התרשמותו ממנה, שבאה לידי ביטוי באינדיקציות הרבות עליהן עמד בהכרעת דינו המנומקת.",על ממצאי עובדה ומהימנות – המקרה דנא
"ע""פ 6038∕21","כן יוער, כי לא נעלמו מעיני השגותיו של המערער בכל הנוגע לטעמים עליהם עמד בית המשפט המחוזי, שעה שנימק מדוע מצא את המתלוננת מהימנה ואת עדותה אותנטית וכנה. יחד עם זאת, ובשים לב לאמור לעיל, הרי שטענותיו בנושא זה עומדות בניגוד לעקרונות יסוד של ההליך הפלילי בכלל; בראשם – האופן שבו על בית המשפט להעריך משקלה של עדות, והחשיבות שבהתרשמותה הישירה, והבלתי אמצעית, של הערכאה הדיונית מהתנהגותה של עדה (ראו: סעיף 53 לפקודה; ע""פ 1442/06, בפסקה 23)). על כן, הרי שדינן – דחייה.",על ממצאי עובדה ומהימנות – המקרה דנא
"ע""פ 6038∕21","דומה, כי די היה באמור לעיל כדי לדחות את הערעור על הכרעת הדין. ואולם, כזכור, לטענת המערער, גרסתה של המתלוננת רוויית סתירות, באופן הפוגם במהימנותה. בהתאם לכך, עלינו לבחון, האם הסתירות הנטענות הן אכן סתירות מהותיות. במובן זה, שאם אכן כך, שגה בית המשפט המחוזי בניתוח גרסתה של המתלוננת. כפי שיובהר להלן, סבורני כי גם על כך יש לענות בשלילה.",על ממצאי עובדה ומהימנות – המקרה דנא
