verdict,text,part
"ע""פ 3265∕22","כידוע, העונש המרבי הקבוע בצד עבירת האינוס בנסיבות בהן הורשע המערער הוא 20 שנות מאסר בפועל מאחורי סורג ובריח. לא אחת הובהר בבית משפט זה כי העונש המרבי אינו בגדר ""סימון גבול עליון"" בעלמא, כי אם עונש הולם וראוי בהתקיים נסיבות חמורות מתאימות (עניין רימוני, פסקה 12). בענייננו, בית המשפט המחוזי תיאר בפירוט ובאופן מוחשי את אירוע האונס תוך שהוא מדגיש את אכזריות המעשים, האלימות שנלוותה אליהם וניצול האמון שרחשה המתלוננת כלפי המערער לשם פגיעה מינית בה. בשקלול נסיבות ביצוע העבירה וחומרתה, בית המשפט המחוזי גדר את מתחם העונש ההולם בין 13 ל-17 שנות מאסר בפועל.",דיון והכרעה
"ע""פ 3265∕22","בשלב הבא במלאכת גזירת העונש, חיפושיו של בית המשפט המחוזי אחר נסיבה מקלה לזכותו של המערער – העלו חרס. על כן, לבסוף בית המשפט המחוזי גזר על המערער 16 שנות מאסר בפועל, לצד ענישה נלווית. כאשר אנו בוחנים את העונש אשר נגזר על המערער באופן זה, ניכר כי בית המשפט המחוזי התחשב בגזירת עונשו של המערער גם בנסיבות, המעטות, שניתן לזקוף לטובתו – ובפרט, להודאת המערער במיוחס לו.",דיון והכרעה
"ע""פ 3265∕22","בהקשר זה, שלם אני עם קביעתו של בית המשפט המחוזי כי אף שיש להתחשב בהודאת המערער במלאכת גזירת עונשו – משקלה מוגבל. להודאת נאשם במיוחס לו במסגרת הליך פלילי ישנן מספר מעלות, בין היתר, חסכון בזמן שיפוטי; שיתוף פעולה עם הרשויות; חסכון בהעדת נפגעת העבירה בבית המשפט ותרומה מסוימת להליך שיקומה של נפגעת העבירה. אלו הנחו את בית המשפט המחוזי להתחשב בהודאת המערער לקולה בגזירת עונשו בגדרי המתחם.",דיון והכרעה
"ע""פ 3265∕22","כך אף בחלוף מספר שנים ממועד ביצוע העבירה, כעולה מהתסקיר העדכני שהונח בפנינו. התרשמות זו מאפילה על כנות ההודאה ולקיחת האחריות של המערער על מעשיו, באופן המשליך על טיבה והשפעתה במלאכת גזירת העונש. לפיכך, בדין התחשב בית המשפט המחוזי בהיבטי הודאת המערער, מכאן ומכאן, בגזירת עונשו בגדרי המתחם.",דיון והכרעה
"ע""פ 3265∕22","המסקנה היא כי העונש שנגזר על המערער הולם את חומרת מעשיו ואת נסיבות ביצוע העבירה, וודאי שהוא לדידי אינו מגלה עילה להתערבות בית משפט זה. אשר על כן, אני סבור כי דין הערעור להידחות, וכך אציע לחבריי.",דיון והכרעה
"ע""פ 3265∕22",ש ו פ ט,דיון והכרעה
"ע""פ 3265∕22","המעשים המיוחסים למערער מזעזעים ומעוררי חלחלה בצורה יוצאת דופן, וכעניין של גמול ראוי לגזור לו ענישה מחמירה, שמשמעותה שנות מאסר ארוכות, אולי עד כדי התקופה שנגזרה לו על ידי בית המשפט קמא. ואולם, בבוא בית משפט להכריע בדינו של נאשם עליו לפעול בהתאם להוראות הדין, ובכלל זה בהתאם להוראות בעניין הבניית שיקול הדעת בענישה, אשר נקבעו במסגרת תיקון מס' 113 לחוק העונשין, התשל""ז-1977 (להלן: חוק העונשין). משנפלה לדעתי טעות מהותית ובולטת בדרך בה יישם בית המשפט קמא הוראות אלה, סברתי כי חובתנו היא להתערב ולהקל בעונש. אבהיר את עמדתי בקצרה.",השופט ע' גרוסקופף:
"ע""פ 3265∕22","כידוע, הליך גזירת העונש, על פי ההוראות בעניין הבניית שיקול הדעת בענישה, מורכב משני שלבים: בשלב הראשון על בית המשפט לקבוע ""מתחם עונש הולם למעשה העבירה שביצע הנאשם בהתאם לעיקרון המנחה, ולשם כך יתחשב בערך החברתי שנפגע מביצוע העבירה, במידת הפגיעה בו, במדיניות הענישה הנהוגה ובנסיבות הקשורות בביצוע העבירה כאמור בסעיף 40ט"" (סעיף 40ג(א) לחוק העונשין). בשלב השני על בית המשפט לגזור את העונש המתאים לנאשם. ככלל, ובהעדר שיקולים לסטייה מהמתחם, גזירת העונש בתוך המתחם צריכה להתבצע ""בהתחשב בנסיבות שאינן קשורות בביצוע העבירה כאמור בסעיף 40יא"" (סעיף 40ג(ב) לחוק העונשין).",השופט ע' גרוסקופף:
"ע""פ 3265∕22","במקרה דנן, בית המשפט קמא קבע כי העונש ההולם למעשה העבירה שביצע הנאשם מצוי בטווח שבין 13 שנים ל-17 שנים. בכך פעל בהתאם להוראת 40ג(א) לחוק העונשין, ולא מצאתי לא בטיעוני המשיבה, לא בחוות דעתו של חברי, השופט יוסף אלרון, ולא בפסיקה שהביאו הצדדים, כדי ללמד שמתחם עונש זה הינו מקל ובלתי ראוי למעשה העבירה שביצע הנאשם.",השופט ע' גרוסקופף:
"ע""פ 3265∕22","סעיף 40יא לחוק העונשין מונה 11 נסיבות בהן רשאי בית המשפט להתחשב בבואו לגזור את עונשו של הנאשם בתוך המתחם. חלקן של הנסיבות הללו אינן רלוונטיות לעניינו של הנאשם, או רלוונטיות במידה מועטה מאד לכאן או לכאן, ואילו נסיבות אחרות פועלות באופן מובהק ומשמעותי לטובתו. בין אלה ניתן למנות את נטילת האחריות של הנאשם על מעשיו, אשר גם אם אינה שלמה, בוודאי פועלת לטובתו (ס""ק 4); שיתוף הפעולה שלו עם רשויות החוק שהתבטא בכך שהודה וחסך את חקירת המתלוננת (ס""ק 6); חלוף הזמן מעת ביצוע העבירה – העבירה בוצעה בשנת 2015. כתב האישום הוגש חמש שנים לאחר מכן, שלא מסיבות התלויות במערער (ס""ק 10); ועברו הפלילי הזניח, הכולל הרשעות בעבירות משנת 2014 של מכירת עותקים מפרים ומכירת משקה משכר לקטין (ס""ק 11). במצב דברים זה, דומני כי לא יכול להיות ספק שהמיקום הנכון של המערער הוא בחלקו התחתון של מתחם העונש הראוי (גם אם לא ממש בתחתית), ובוודאי שלא בסמוך לתקרת המתחם, כפי שמיקמו בית המשפט קמא. להערכתי בתוך המתחם (כזכור 13 עד 17 שנים), בהתחשב בשיקולים שאינם קשורים לביצוע העבירה, היה מקום לגזור למערער 14 שנות מאסר.",השופט ע' גרוסקופף:
"ע""פ 3265∕22","לא נעלמה מעיניי העובדה כי בית המשפט קמא הצדיק את החלטתו האמורה באמצעות הפניה לסעיף 40ז לחוק העונשין, המאפשר להביא בחשבון במסגרת המתחם את שיקול ""הרתעת הרבים"". ואולם, אני מתקשה לקבל הצדקה זו במקרה דנן. אין חולק כי הרתעת הרבים מצדיקה החמרה בעבירות מין בכלל, ובעבירות מסוג אינוס בפרט. ואולם, עניין זה מוצא ביטויו בשנים האחרונות בצורה ראויה בהחמרת מתחם הענישה בגין עבירות אלה, ובענייננו בכך שבגין מעשה בודד נקבע מתחם של 17-13 שנים, הגבוה משמעותית מזה שהיה נהוג בעבר. זאת ועוד, למרבה הצער, המעשה בו הורשע המערער, על כל שיפלותו ונבזיותו, אינו כה חריג ויוצא דופן עד שניתן להצדיק באמצעות טעם הרתעת הרבים לנהוג עמו בצורה שונה מהמקובל ביחס לעברייני מין אחרים, ולא למקמו בתוך המתחם על פי השיקולים והאיזונים בהם אנו עושים שימוש חדשות לבקרים. אכן, לא בכדי נמנע חברי, השופט אלרון, מלהתבסס על טיעון זה בבואו להצדיק את עונשו של המערער.  ",השופט ע' גרוסקופף:
"ע""פ 3265∕22","דומה שהטעם המרכזי בעטיו נמנע חברי מלהתערב במקרה זה, היא עמדתו כי העונש שנגזר על המערער אינו חורג מהראוי לו. אומנם, לעיתים קרובות חוזרים אנו בפני הצדדים על האמירה כי כערכאת ערעור אין אנו מדקדקים בבחינת המתחם שתחמה הערכאה הדיונית והמיקום שמיקמה את הנאשם בתוכו, אלא בוחנים אם מתקיימת הלימה בתוצאה הסופית. אכן כך, אולם גם למדיניות אי התערבות זו יש גבולות. כאשר המתחם שנקבע הינו ראוי, ואינו נוטה לקולה, מחד גיסא, ואילו מיקום הנאשם בתוך המתחם שגוי בעליל, מאידך גיסא, אינני רואה כיצד יכולים אנו להימנע מביצוע חובתנו להתערב כשמלאכת גזרת הדין לא נעשתה כמצוות המחוקק. כך הורה בית משפט זה בעבר (ראו ע""פ 8538/18 פרוך נ' מדינת ישראל[פורסם בנבו] (7.1.2019)). כך סבורני שראוי להורות גם במקרה זה.",השופט ע' גרוסקופף:
"ע""פ 3265∕22","לאור האמור, אילו דעתי הייתה נשמעת היינו מקלים ברכיב המאסר בפועל בעונש שנגזר על המערער, ומעמידים אותו על 14 שנות מאסר.",השופט ע' גרוסקופף:
"ע""פ 3265∕22",ש ו פ ט,השופט ע' גרוסקופף:
"ע""פ 3265∕22","לדעת חברי השופט י' אלרון, העונש שנגזר על המערער – 16 שנות מאסר ועונשים נלווים – הולם את חומרת מעשיו ואת נסיבות ביצוע עבירת האינוס שבביצועה הורשע. לעומתו, סבור חברי השופט ע' גרוסקופף, כי נפלה טעות מהותית ובולטת בדרך שבה יִשׂם בית המשפט קמא את הוראות הדין, ומן הראוי להקל בעונש, להפחית שנתיים מתקופת המאסר. עלי להכריע ביניהם.",השופט נ' סולברג:
"ע""פ 3265∕22","חברַי תמימי-דעים, כי מתחם העונש ההולם שקבע בית המשפט המחוזי – 13 עד 17 שנות מאסר בפועל – ראוי, ומשקף את חומרת מעשיו של המערער. המחלוקת מתמקדת בגזירת העונש בתוך המתחם, בהתאם לנסיבות שאינן קשורות בביצוע העבירה (סעיף 40יא לחוק העונשין, התשל""ז-1977) (להלן: חוק העונשין). דעתי שונה.",השופט נ' סולברג:
"ע""פ 3265∕22","ראשית, באשר לנטילת האחריות של המערער על מעשיו – הפכתי והפכתי במה שהובא לעיוננו, ולא מצאתי עדות נאמנה לנטילת אחריות כאמור. אמנם, המערער שיתף פעולה עם רשויות החוק, והודה במעשים שבביצועם הואשם. אולם, ברי כי הודאה לחוד, ונטילת אחריות לחוד. לא בכדי שקד המחוקק, ויצר הבחנה ברורה בין נטילת האחריות של נאשם על מעשיו (סעיף 40יא(4) לחוק העונשין), לבין שיתוף הפעולה של הנאשם עם רשויות אכיפת החוק (סעיף 40יא(6) לחוק העונשין). אכן, הודאת הנאשם יכולה, בנסיבות מסוימות, להוות אינדיקציה לנטילת אחריות, אך האחרונה אינה נובעת בהכרח מהראשונה; לשון אחר, הודאה היא אמנם תנאי הכרחי לנטילת אחריות, אך אינה תנאי מספיק. אין בעצם ההודאה, אם כן, כדי ללמד על נטילת אחריות מצדו של המערער; יש להביאה בחשבון, כנסיבה מקלה, אך במסגרת השיקול של שיתוף הפעולה עם רשויות החוק.",השופט נ' סולברג:
"ע""פ 3265∕22","שנית, אינני סבור כי בנסיבות העניין שעל הפרק, יש בחלוף הזמן מעת ביצוע העבירה ועד הגשת כתב האישום – כ-5 שנים – כדי להצדיק הקלה בעונשו של המערער. לא פעם ולא פעמיים, עמד בית משפט זה על הקושי הכרוך בהגשת תלונות על עבירות מין; קל וחומר, כאשר מדובר בקטינה; בן בנו של קל וחומר, כאשר בין המתלוננת הקטינה לבין הנאשם מתקיימים יחסי קרבה (ראו למשל: ע""פ 2485/00 פלוני נ' מדינת ישראל, פ""ד נה(2) 918, 925 (2001); ע""פ 5271/09 פלוני נ' מדינת ישראל, פסקה 6 [פורסם בנבו] (17.5.2011); ע""פ 4197/14 מדינת ישראל נ' פלוני, פסקה 14 [פורסם בנבו] (12.4.2015) (להלן: עניין פלוני); ראו גם את הסייג להתיישנות עבירות מין בקטין, בסעיף 354 לחוק העונשין). קושי זה עשוי, במקרים מסוימים, לגרום לחלוף זמן רב מעת ביצוע העבירה עד להגשת התלונה, וכפועל יוצא מכך, עד להגשת כתב האישום. על כן, בהתחשב בכך שהמקור לקושי, טמון בעצם מעשיו של הנאשם – רק בחלוף זמן רב, רב מאוד, ניתן להצביע על פרק הזמן שחלף ממועד ביצוע העבירה עד הגשת כתב האישום, כנסיבה מקלה. לא בכדי, במרבית המקרים שבהם הכיר בית משפט זה בפרק הזמן שחלף מעת ביצוע עבירות אינוס עד להגשת כתב אישום, כנסיבה מקלה לפי סעיף 40יא(10) לחוק העונשין, מדובר היה על פרק זמן של 10 שנים לפחות (ע""פ 5386/19 פלוני נ' מדינת ישראל [פורסם בנבו] (15.6.2020); ע""פ 2790/13 פלוני נ' מדינת ישראל [פורסם בנבו] (8.9.2014); ע""פ 7211/13 פלוני מ' מדינת ישראל [פורסם בנבו] (13.12.2015)). לא זו אף זו: טענה שהועלתה בעניין פלוני, כי יש בחלוף 5 שנים מביצוע המעשים ועד להגשת התלונה, כדי להוות נסיבה מקלה, במקרה של ביצוע מעשי סדום בקטינה – נדחתה במפורש (שם, פסקה 14). אין הצדקה אפוא להביא את חלוף הזמן שעבר מביצוע העבירה עד להגשת כתב האישום, כשיקול להקלה בעונש שנגזר על המערער. ",השופט נ' סולברג:
"ע""פ 3265∕22","משאֵלו הם פני הדברים, הגם שאין לכחד כי העונש שנגזר על המערער הוא על הצד המחמיר, לא מצאתי כי יש בנסיבות המקלות הנותרות – הודאתו של המערער, ועברוֹ הפלילי ה""זניח"" – שאותן שקל גם בית המשפט המחוזי, כדי להביא את המקרה שלפנינו בגדר המקרים החריגים, המצדיקים את התערבות ערכאת הערעור בגזר הדין. לפיכך, החלטתי לצרף את דעתי לדעתו של חברי, השופט י' אלרון; דינו של הערעור – להידחות. מעשה האינוס מזוויע ונורא; גזר הדין יעמוד בעינו.",השופט נ' סולברג:
"ע""פ 3265∕22",ש ו פ ט,השופט נ' סולברג:
"ע""פ 3265∕22",הוחלט כאמור בפסק דינו של השופט י' אלרון אליו הצטרף השופט נ' סולברג כנגד דעתו החולקת של השופט ע' גרוסקופף.,השופט נ' סולברג:
"ע""פ 3265∕22"," ניתן היום, ‏ח' בחשון התשפ""ג (‏2.11.2022). ",השופט נ' סולברג:
"ע""פ 3265∕22",54678313ש ו פ ט,5129371
"ע""פ 3265∕22",ש ו פ ט,5129371
"ע""פ 3265∕22",ש ו פ ט,5129371
"ע""פ 3265∕22","מרכז מידע, טל' 077-2703333, 3852* ; אתר אינטרנט,  https://supreme.court.gov.il",   22032650_J04.docx   
"ע""פ 3265∕22",נ' סולברג 54678313-3265/22,   22032650_J04.docx   
"ע""פ 3265∕22",נוסח מסמך זה כפוף לשינויי ניסוח ועריכה,   22032650_J04.docx   
"ע""פ 3265∕22","בעניין עריכה ושינויים במסמכי פסיקה, חקיקה ועוד באתר נבו – הקש כאן",   22032650_J04.docx   
