verdict,text,part
"ע""פ 5611∕16","אין להקל ראש בחומרת מעשיו של המערער, שניסה לבצע שוד שתוכנן מראש ובצוותא, כאשר במהלך האירועים נפגעו עוברי אורח על לא עוול בכפם. יתרה מכך, וכפי שציין בית המשפט המחוזי, המערער ושותפיו הפגינו תעוזה רבה כשהמשיכו לסניף הבנק השני לאחר שלא עלה בידם לבצע את השוד בסניף הראשון. עם זאת, בעת הימשכות ההליכים בעניינו של המערער, עבר הוא תהליך ראשוני המעיד על פוטנציאל שיקום. על סמך האמור בתסקירי שירות המבחן כפי שפורט לעיל, הגענו לכלל מסקנה כי פוטנציאל השיקום של המערער כיום הוא משמעותי דיו כדי להצדיק חריגה לקולה ממתחם העונש בהתאם לרוח סעיף 40ד(א) לחוק העונשין. בפרט, יודגש כי מזה למעלה משנה המערער מתמיד בטיפול הפסיכיאטרי במרכז לבריאות הנפש לרבות נטילת התרופות דרך קבע, וכי בחודשים האחרונים אף השתלב בהצלחה במסגרת בתחום התעסוקה והביע רצון להשתלב בתוכנית טיפולית קבוצתית בשירות המבחן. כאמור לעיל, שני התסקירים האחרונים שנערכו בעניינו מעידים על מגמת שיפור ועל פוטנציאל שיקומי רב מבעבר.",דיון והכרעה 
"ע""פ 5611∕16","יתרה מזאת, יש לייחס משקל גם לעובדה שהמערער ביצע את העבירות בהיותו כבן עשרים וללא עבר פלילי (השוו: ע""פ 7781/12 פלוני נ' מדינת ישראל, [פורסם בנבו] פסקה 58 (20.6.2013) (להלן: ע""פ 7781/12); ע""פ 3582/13 סעד נ' מדינת ישראל, [פורסם בנבו] פסקה 17 (29.1.2014)). אכן, ""לא בכל מקרה בו קיימים סיכויי שיקום, יוקל העונש שהוטל על הנאשם עד כדי חריגה ממתחם הענישה שנקבע לעבירה שנעברה, גם אם מדובר ב'בגיר צעיר', וגם אם המלצת שירות המבחן מצדדת בהקלה כזו"" (ע""פ 452/14 דבוש נ' מדינת ישראל, [פורסם בנבו] פסקה 15 לפסק דיני (3.4.2014)), וכן, עצם גילו הצעיר של נאשם פלוני בעת ביצוע העבירות אינו מקים כשלעצמו עילה להקלה בעונש. אולם, כפי שהובהר בעבר, מדובר בקבוצת משתנים, אשר יש לבחון את המידה שבה הם מתקיימים באותו מקרה פרטני של אותו בגיר צעיר, וזאת במסגרת שיקולי הענישה הקבועים בסימן א'1 לפרק ו לחוק העונשין (ראו: ע""פ 308/16 נאטור נ' מדינת ישראל, [פורסם בנבו] פסקאות 11-10 (7.11.2016); ע""פ 2420/15 אבטליון נ' מדינת ישראל, [פורסם בנבו] פסקאות 21-18 (29.11.2015) (להלן: עניין אבטליון). יובהר תחילה המערער כי לא יוכל להיבנות מהשיקולים המנויים בסעיף 40יא לחוק העונשין, הגם שחלקם מאפשרים להתחשב בנסיבות המתאימות בגילו של הנאשם (ראו: ע""פ 8487/15 פלוני נ' מדינת ישראל, [פורסם בנבו] פסקה 14 (8.11.2016); עניין אבטליון, פסקה 21). זאת, מאחר ששיקולים אלה משפיעים על גזירת העונש בתוך המתחם, בעוד ממילא הושת על המערער העונש המצוי בתחתית המתחם שנקבע לו. עם זאת, במקרה שלפנינו התרשמנו כי הפוטנציאל השיקומי של המערער, בפרט כפי שעולה מן התסקירים השונים בעניינו, גדול דיו בכדי להצדיק פסיעת הצעד הנוסף וחריגה ממתחם העונש משיקולי שיקום, כהוראת סעיף 40ד(א) לחוק העונשין (לדיון בפוטנציאל השיקום הייחודי של בגירים צעירים ראו: ע""פ 7781/12, פסקאות 51-48). ונסביר.",דיון והכרעה 
"ע""פ 5611∕16","כזכור, בית המשפט המחוזי מצא בשעתו כי עניינו של המערער אינו נמנה עם המקרים המצדיקים לחרוג לקולה ממתחם העונש ההולם משיקולי שיקום, וזאת משום ש""התסקיר מלמד כי על אף ההליך הטיפולי והזמן שחלף מאז ביצוע המעשים, הנאשם (המערער – ס.ג'.) עודנו מתייחס באופן מצומצם לעבירות שביצע. בדומה לכך, טענה בפנינו באת-כוח המשיבה כי לפי תסקיר המבחן בעניינו כפי שעמד בפני בית המשפט המחוזי, המערער טרם הפנים באופן מלא את הסיבות להידרדרותו ועדין זקוק להשגחה. עובדה זו הייתה אומנם נכונה בשעתו, ואולם במרוצת הזמן ובחלוף כשנתיים של ליווי בשירות המבחן ובמסגרות נוספות דומה כי חל שיפור משמעותי במצבו של המערער בהיבטי הסיכוי והסיכון. מעבר לכך, יובהר כי לא מצאנו ממש בטענת המשיבה, שכן עצם העובדה שהפנמת המערער את מעשיו הייתה חלקית (בשעתו, כאמור) אינה גורעת מכברת הדרך שעבר בהמשך ומהפוטנציאל השיקומי הקיים כיום, ואינה מאיינת, כשלעצמה, את חשיבות שקילת הדברים במסגרת ההכרעה אם יש להטיל עליו עונש של מאסר מאחורי סורג ובריח אם לאו. מזה זמן לא מבוטל שהמערער מביע חרטה כנה על מעשיו ואמפתיה כלפי נפגעת העבירה, וניכרת מגמת שיפור ברורה מהתסקירים בעניינו. במצב דברים זה, מצאנו כי יש מקום להעניק למערער הזדמנות להגשים את הפוטנציאל השיקומי שלו ולחזור למוטב.",דיון והכרעה 
"ע""פ 5611∕16","לצד זאת, יוער, שלא נעלם מעינינו כי תהליך שיקומו של המערער עודנו באיבו, ובהיבט זה אנו מלאי תקווה שהמערער ימשיך וינצל את תקופת המבחן עד לשיקומו המלא.",דיון והכרעה 
"ע""פ 5611∕16","סוף דבר, נוכח כל האמור לעיל, אנו מורים בזאת כדלקמן:",דיון והכרעה 
"ע""פ 5611∕16",הערעור מתקבל במובן זה שעונש המאסר בפועל שהוטל על המערער יופחת ויומר ל-6 חודשי מאסר לריצוי על דרך של עבודות שירות. יתר רכיבי העונש שהוטלו על המערער יוותרו על כנם.,דיון והכרעה 
"ע""פ 5611∕16","המערער יתייצב לשאת בעונש שהוטל עליו ביום 22.10.2017 בשעה 8:00 ביחידת עבודות שירות, אשר במפקדת מחוז מרכז של שירות בתי הסוהר, ת.ד. 81 רמלה 72100, טלפון 08-9787060, פקס 08-9193217. התנאים המגבילים והערבויות שהוטלו על המערער יעמדו בעינם עד למועד התייצבותו לעבודות השירות.",דיון והכרעה 
"ע""פ 5611∕16","מוצא בזאת צו מבחן לתקופה בת שנה החל ממועד פסק דין זה. צו זה מוצא לאחר שהמערער הוזהר, במסגרת שימוע שנערך לו בעל-פה, כי אם תפקודו בביצוע עבודות השירות יהיה לקוי, הוא ייאלץ לרצות את יתרת עונשו במאסר מאחורי סורג ובריח. המערער הביע את נכונותו למלא אחר הוראות הצו.",דיון והכרעה 
"ע""פ 5611∕16",המזכירות תמציא עותק של פסק דיננו זה לשירות המבחן למבוגרים ולממונה על עבודות שירות.,דיון והכרעה 
"ע""פ 5611∕16","           ניתן היום, ‏כ""ג באלול התשע""ז (‏14.9.2017).  ",דיון והכרעה 
"ע""פ 5611∕16",המשנה לנשיאה (בדימ'),דיון והכרעה 
"ע""פ 5611∕16",ש ו פ ט,דיון והכרעה 
"ע""פ 5611∕16",ש ו פ ט,דיון והכרעה 
"ע""פ 5611∕16",העותק כפוף לשינויי עריכה וניסוח.   16056110_H08.doc   שצ,_________________________
"ע""פ 5611∕16","מרכז מידע, טל' 077-2703333 ; אתר אינטרנט,  www.court.gov.il",_________________________
"ע""פ 5611∕16",י' עמית 54678313-5611/16,_________________________
"ע""פ 5611∕16",נוסח מסמך זה כפוף לשינויי ניסוח ועריכה,_________________________
"ע""פ 5611∕16","בעניין עריכה ושינויים במסמכי פסיקה, חקיקה ועוד באתר נבו – הקש כאן",_________________________
