verdict,text,part
"ע""פ 6038∕21","יחד עם זאת, סבר בית המשפט, כי המתלוננת חזרה על ליבת תלונתה באופן עקבי לאורך כל השתלשלות העניינים. עוד התייחס בית המשפט באופן פרטני לטענות המערער בדבר קיומן של סתירות בגרסתה של המתלוננת, ודחה אותן, משסבר כי אלה אינן פוגעות בליבת גרסתה ואינן יורדות לשורשו של עניין. כך, למשל, קבע בית המשפט, כי שגיאתה של המתלוננת בתיאור השנה בה החלו האירועים – שנת 2016, ולא לעומת זאת שנת 2017 – אינה פוגעת במהימנותה. כך גם אשר להבדלים באופן בו תיארה את האירוע הראשון, בכל הנוגע לתנוחה בה היו, מה לבשה, מתי המערער ליטף אותה והיכן הגיע לפורקן; ובאילו מן הבתים בהם גרו בתקופה הרלבנטית לכתב האישום פגע בה מינית. כמו כן, התייחס בית המשפט לטענת המערער, כי בבתים בהם התגוררו לא היו מנעולים לדלתות, ומשכך לא יכול היה לנעול את הדלתות כאשר ביצע את מעשיו במתלוננת ובאחותה הבכורה, כגרסת המתלוננת. אולם, ביחס לכך נקבע, כי המערער לא הצליח להוכיח שלדלתות הבתים לא היו מנעולים, כטענתו.",עיקרי הכרעת הדין של בית משפט קמא
"ע""פ 6038∕21","לצד התרשמותו החיובית מעדותה של המתלוננת, ועל-אף סמכותו להרשיע את המערער על בסיסה בלבד (בהתאם לסעיף 54א(ב) לפקודת הראיות [נוסח חדש], התשל""א-1971) (להלן: הפקודה)), מצא בית המשפט המחוזי חיזוקים לגרסתה, כמו גם ראיות המסייעות לה. כך, למשל, התייחס בית המשפט לאמון שבני המשפחה נתנו במתלוננת, אשר בא לידי ביטוי, בין היתר, באופן בו הם פעלו כדי להרחיק אותה מהמערער. עוד מצא בית המשפט המחוזי, כי יש בעדותם של עדים נוספים משום חיזוק לגרסתה של המתלוננת. לבסוף, התייחס בית המשפט למצבה הנפשי הקשה של המתלוננת, כפי שהוא התרשם ממנו באופן בלתי אמצעי במהלך עדותה; וכפי שזה עלה מעדויות נוספות.",עיקרי הכרעת הדין של בית משפט קמא
"ע""פ 6038∕21","מן העבר השני, בית המשפט המחוזי לא נתן אמון בגרסתו של המערער, וקבע כי: ""[המערער – ח.כ.] העיד באופן מתחמק ומתפתל, תוך שהוא מנסה להתחכם בתשובותיו ולשפר את גרסתו. [המערער – ח.כ.] שינה פרטים בגרסתו במהלך עדותו ביחס לחלק מדבריו, הוסיף פרטים שלא בא זכרם בחקירה במשטרה והכל על מנת להציג עצמו באור חיובי יותר. ממבט על, הרושם הוא כי גרסתו של [המערער – ח.כ.] התרכזה באופן אסטרטגי בניסיון להרחיק עצמו ככול הניתן מן ההזדמנות לביצוע העבירה, או מהיכולת לביצועה"" (עמוד 44 להכרעת הדין).",עיקרי הכרעת הדין של בית משפט קמא
"ע""פ 6038∕21","בהתאם לכך, דחה בית המשפט המחוזי את כל אחד משלושת האדנים עליהם נשענה גרסת המערער. אשר לטענת המערער, לפיה מצבו הרפואי לא אפשר לו לקיים יחסי מין עם המתלוננת, בית המשפט קבע, כי מדובר בגרסה כבושה שאין לה זכר בחקירתו במשטרה, כמו גם שלא נמצאה כל ראיה התומכת בה. זאת, פרט לעדות האם, לגביה נקבע, כי היא עשתה כל שביכולתה ""להיטיב עם [המערער – ח.כ.] וליישר קו עם תזת ההגנה"" (שם, בעמוד 40). עוד קבע בית המשפט, כי הראיות שהציג המערער לכך שנהג לשהות רוב היום בבית קפה אינן מוכיחות את טענתו; וממילא גם אם הייתה מתקבלת טענתו, הרי שאין בכך כדי לשלול את האפשרות כי ביצע את המיוחס לו. זאת, היות שאף לפי גרסתו, היה חוזר מבית הקפה במהלך הצהריים למשך שעתיים כדי לנוח, באופן שאפשר לו חלון הזדמנויות לבצע את העבירות. אשר לטענת המערער, כי האם לא נהגה לצאת מהבית, בית המשפט קבע, כי זו אינה מתיישבת עם יתר העדויות בתיק, בפרט עם עדות האם עצמה.",עיקרי הכרעת הדין של בית משפט קמא
"ע""פ 6038∕21","בכל הנוגע לאירועי התקיפה, בית המשפט קבע כי מחומר הראיות עולה, כי יש תימוכין, לרבות בעדות המערער והאם, לכך שהמערער נהג כלפי המתלוננת באלימות.",עיקרי הכרעת הדין של בית משפט קמא
"ע""פ 6038∕21","בנוסף, בית המשפט המחוזי דחה את טענות המערער בכל הנוגע למניע של המתלוננת להגיש את תלונתה נגדו. נקבע, כי טענתו, לפיה משפחתו הניעה את המתלוננת להגיש את התלונה כחלק מניסיון לחייב אותו לחזור ליישוב, אינה מתיישבת עם יתר הראיות והעדויות בתיק. כן דחה בית המשפט המחוזי את טענת המערער, כי המעשים המתוארים בתלונה הם פרי דמיונה של המתלוננת, והתלונה אינה אלא ניסיון לזכות ביותר חופש. זאת, לאחר שהתרשם, כי ""המתלוננת מספרת את הדברים כהווייתם ולא מתנהלת כמי שרוצה להסתיר מניע כלשהו. עם זאת ברור כי המתלוננת לא בדתה את התלונה כדי לשפר את מצבה... מעבר לכך המתלוננת נמצאת היום במעון, ולא מסתובבת בעיר הגדולה או ביישוב חופשיה או משוחררת, כפי שניסה [שהמערער – ח.כ.] לצייר"" (שם, בעמוד 51). עוד ציין בית המשפט, כי המערערת ""מודעת לכך שהיא צפויה לחזור לבית אמה בעיר ולא מציגה כל התנגדות לכך"" (שם). ומשכך, אין כל יסוד לסברה, כי העלילה את התלונה במטרה לחזור ליישוב.",עיקרי הכרעת הדין של בית משפט קמא
"ע""פ 6038∕21","לבסוף, התייחס בית המשפט המחוזי למשמעות הראייתית של היעדר ממצאים חבלתיים בקרום הבתולין של המתלוננת. ביום 09.09.2019, בעקבות הגשת התלונה, הגיעה המתלוננת לבדיקה אצל ד""ר מימון, מומחית לבחינת פגיעות בילדים, במהלכה לא נמצאו ממצאים חבלתיים באיבר מינה. בחוות דעת שערכה, ציינה ד""ר מימון כי לא ניתן לשלול או לאשש את עיקרי התלונה בהתבסס על כך, היות שאין הכרח לכך שהחדרת גוף נוקשה לאיבר מין נשי, ישאיר ממצאים כאמור. ביום 10.09.2019, נלקחה המערערת על-ידי בני משפחתה לבדיקה גניקולוגית אצל ד""ר שיזף. במסמך שערך ד""ר שיזף צוין, כי קרום הבתולין של המערערת שלם, וללא הפרשה חריגה.",עיקרי הכרעת הדין של בית משפט קמא
"ע""פ 6038∕21","על המשמעות הראייתית של היעדר ממצאים חבלתיים כאמור, העידו ד""ר שיזף וד""ר מימון (כעדת הזמה). במסמך שערך ציין ד""ר שיזף, כי הוא גניקולוג פעיל כ-20 שנים, כאשר בתקופה זו בדק אלפי נשים כולל נפגעות מין, אם כי אינו מומחה בתחום של תקיפות מיניות. עוד צוין, כי קרום הבתולין של המתלוננת תקין, ושאין סממנים של טראומה. בעדותו, ציין ד""ר שיזף, כי הסבירות שהמתלוננת עברה מאות מקרי אונס, ללא כל סממן בקרום הבתולין, נמוכה. כאשר אומת עם מאמרים אשר הגיעו למסקנות שונות משלו, ציין כי אלו לרוב מתבססים על נשים שקיימו יחסי מין מספר פעמים, ולא מאות פעמים; כי יש לקרוא מאמרים אלה באופן ביקורתי, נוכח האינטרס האישי של מחבריהם; ושהמנעד בין הממצאים של מאמרים אלה רחב.",עיקרי הכרעת הדין של בית משפט קמא
"ע""פ 6038∕21","בעדותה, ציינה ד""ר מימון, כי על אף שהיא רופאת ילדים במקצועה, היא עברה הכשרה מיוחדת בתחום של פגיעות מיניות. על המסקנה אליה הגיעה בחוות דעתה העידה ד""ר מימון, תוך שהיא מבהירה, כי בזמן פגיעה מינית עשוי להיגרם מגוון של חבלות לקרום הבתולין, אולם אם הקרום אינו נקרע עד בסיסו, רוב הפגיעות נרפאות עם הזמן ואינן משאירות צלקות, כך שלא יהיה ניתן להבחין בהן במהלך בדיקה. עוד ציינה ד""ר מימון, כי בגילה של המתלוננת קרום הבתולין מתחיל תהליך בו הוא הופך לעבה וגמיש יותר, באופן המפחית את ההסתברות כי יקרע עד בסיסו בקיום יחסי מין. ואילו, מספר הפעמים בהן מתבצעת חדירה אל איבר המין, אינו משנה את ההסתברות למצוא ממצאים לקיום יחסי מין בבדיקת קרום בתולין – שכן כל אירוע חדירה עומד בפני עצמו. במסגרת עדותה הפנתה ד""ר מימון למאמרים במסגרתם נבחנו קרום הבתולין של קטינות שעברו פגיעות מין ממושכות, אשר נמצאו שלמים ותקינים.",עיקרי הכרעת הדין של בית משפט קמא
"ע""פ 6038∕21","בסופם של דברים, בית המשפט המחוזי העדיף את עדותה של ד""ר מימון על-פני עדותו של ד""ר שיזף. צוין, כי גרעין מומחיותו של ד""ר שיזף אינו נוגע לתחום הפגיעות המיניות, תחום בו הוכשרה ד""ר מימון. עוד צוין, כי הספרות הרפואית בנושא בכלל, והספרות הרפואית אליה הפנה ד""ר שיזף בפרט, לא מתיישבת עם מסקנתו, ולכל הפחות אין בה כדי לבססה; וכי לא ניתן לכך הסבר המניח את הדעת. ואילו, מנגד, ספרות זו תואמת את מסקנתה של ד""ר מימון; ומקום שלא כך הדבר, ניתן על-ידה הסבר הולם לכך. לבסוף צוין, כי אף ד""ר שיזף אינו שולל כל אפשרות, כי במקרים של ריבוי עבירות מין, לא יהיו ממצאים בקרום הבתולין. בהתאם לכך, קבע בית המשפט, כי ""אין בהעדר הממצא אצל המתלוננת כדי לאשש או כדי לפגוע בדברים שמסרה בתלונתה"" (עמוד 71 להכרעת הדין).",עיקרי הכרעת הדין של בית משפט קמא
"ע""פ 6038∕21","לאור כל האמור, הרשיע בית המשפט המחוזי את המערער בעבירות שיוחסו לו בכתב האישום. יחד עם זאת, סבר בית המשפט המחוזי, כי לא הוכח (ואף לא נטען) שהמערער ביצע את מעשיו במתלוננת כשלוש עד ארבע פעמים בשבוע באופן קונסיסטנטי; וכי פרט לאירוע בחדר השינה, יתר המעשים המגונים שביצע במתלוננת נבלעים בתוך יתר עבירות המין בהן הואשם. על כן, בית המשפט הרשיע את המבקש בביצוע ריבוי עבירות אינוס בקרובת משפחה במשך כשנה ו-7 חודשים (מסוף חודש דצמבר 2017 ועד לחודש יולי 2019); שתי עבירות של מעשה סדום בקרובת משפחה; עבירה של מעשה מגונה בקרובת משפחה; ומספר עבירות של תקיפת קטין בנסיבות מחמירות, והכל – לפי סעיפי החוק אשר פורטו לעיל.",עיקרי הכרעת הדין של בית משפט קמא
"ע""פ 6038∕21","לאחר ששמע את טיעוני הצדדים לעונש, פנה בית המשפט לקביעת מתחם העונש ההולם בעניינו של המערער, כמו גם העונש שיש להשית עליו בגדרי המתחם.",עיקרי גזר הדין של בית משפט קמא
"ע""פ 6038∕21","בפתח הדברים התייחס בית המשפט לתסקיר נפגעת העבירה שהוגש בעניינה של המתלוננת. כמתואר שם, מאז חשיפת האירועים, המתלוננת נמצאת במסגרת חוץ ביתית. להתנהגות המתלוננת מאפיינים של פוסט טראומה, וביניהם התקפי חרדה, הרגלי שינה שאינם תקינים וחוסר תיאבון. בפרט צוין, כי זיכרונות של האירועים מציפים את המתלוננת באופן המקשה עליה להירדם בלילות, לישון שינה רציפה ולהתרכז בלימודיה. תחושותיה של המתלוננת אף מביאים אותה עד כדי פגיעה עצמית. עוד תואר, כי המתלוננת מתקשה לתת אמון בחברה, בזכרים ובבני משפחתה; וכי היא חיה בחשש שמא יפגעו בה שוב. לצד זאת, המתלוננת מרגישה אשמה בכך שחשפה את המעשים שביצע בה המערער, וזאת נוכח הקשיים הכלכליים שמשפחתה חווה מאז שנעצר. במסגרת התסקיר צוין, כי המתלוננת מבקשת מבית המשפט להשית על המערער עונש מאסר ממושך ופיצוי כספי; וכי לדעת עורכת התסקיר הטלת עונש מחמיר על המערער תסייע לשיקום המתלוננת.",עיקרי גזר הדין של בית משפט קמא
"ע""פ 6038∕21","בקביעת המתחם, ציין בית המשפט המחוזי, כי בהתאם לסעיף 40יג לחוק כמו גם המבחנים שנקבעו בפסיקה, יש לראות בכלל האירועים מושא כתב האישום בתור אירוע אחד. לאחר מכן, עמד בית המשפט על חומרת מעשיו של המערער; נסיבות ביצועם, ובכלל זאת – התכנון שקדם להם, האלימות שנקט כלפי המתלוננת וניצול מעמדו כאביה. עוד עמד בית המשפט על הערכים החברתיים המוגנים בהם פגע המערער והנזק שגרם למתלוננת. בתוך כך צוינה הפגיעה בזכותה של המתלוננת לכבוד, לפרטיות, לשלמות הגוף ולאוטונומיה; וכן לתחושת הביטחון שלה – פגיעה, אשר מתעצמת בשים לב לכך שהיא נפגעה בביתה על-ידי מי שהיה אמון על שלומה ובטחונה. כן התייחס בית המשפט, להשפעה של העונש המזערי שנקבע בעבירות בהן הורשע המערער על מתחם העונש, וציין כי העונש המזערי בעבירת האינוס (העבירה החמורה ביותר בה הורשע המערער) עומד על 5 שנות מאסר. לאחר מכן, התייחס בית המשפט למדיניות הענישה הנוהגת במקרים דומים.",עיקרי גזר הדין של בית משפט קמא
"ע""פ 6038∕21","בהתחשב בכל אלו, נקבע מתחם ענישה הנע בין 16 ל-21 שנות מאסר בפועל.",עיקרי גזר הדין של בית משפט קמא
"ע""פ 6038∕21","בעת קביעת עונשו של המערער בתוך המתחם, שקל בית המשפט, בין היתר, את העובדה שהמערער כפר בעובדות כתב האישום; לא הביע חרטה על מעשיו ולא נטל עליהם אחריות; תוך שצוין, כי על אף שלא ניתן לזקוף זאת לחובתו, גם ""לא ניתן לזקוף לזכותו... את הנסיבות הנגזרות מהודאה באשמה והבעת חרטה..."" (עמוד 10 לגזר הדין). עוד שקל בית המשפט את ניסיונו של המערער להביא את המתלוננת לחזור בה מתלונתה, באמצעות הדוד ח' וחברו. בית המשפט אף הביא במניין שיקוליו את מידת המסוכנות הנשקפת מהמערער, נוכח מעשיו והעובדה שאינו נוטל עליהם אחריות; וכן שיקולים של הרתעת היחיד והרבים. לאור האמור, השית בית המשפט על המערער עונש של 18 שנות מאסר בפועל בניכוי ימי מעצרו; 18 חודשי מאסר על תנאי למשך 3 שנים, שמא יעבור עבירת מין מסוג העבירות בהן הורשע או עבירות מין שהן פשע; ופיצוי למתלוננת בסך של 150,000 ש""ח.",עיקרי גזר הדין של בית משפט קמא
"ע""פ 6038∕21","ייאמר מיד – טענות המערער נפרשות על-פני 95 עמודים, בשני מסמכים שנושאים כותרות ""נימוקי ערעור על הכרעת הדין וגזר הדין"" ו-""עיקרי טיעון לערעור על הכרעת הדין""; ודומה כי אלה מופנות נגד כל קביעה וקביעה של בית המשפט המחוזי. ואולם, לא מצאתי מקום לפרט על אודות כל טענה וטענה שהעלה המערער, ועל כן, בחלק זה, ובחלק הבא, אציג את עיקר טיעוניו.",עיקרי נימוקי הערעור
"ע""פ 6038∕21","בלב הערעור נגד הכרעת הדין ניצבת הטענה, כי על אף שלבית המשפט הסמכות להרשיע אדם המואשם בביצוע עבירות מין על בסיס עדות יחידה של המתלוננת, לא היה ראוי לעשות כן בנסיבות דנא. זאת, מאחר שהתלונה נגדו הוגשה בשיהוי, והיות שגרסתה של המתלוננת דלה בפרטים, מלאה בסתירות ואי-דיוקים, כאשר אין ראיות חיצוניות התומכות בה. המערער מפרט טענותיו ביחס לכל אירוע בו הוא הורשע, כדלהלן.",עיקרי נימוקי הערעור
"ע""פ 6038∕21","האירועים המתמשכים ואירועי מעשי סדום: ביחס להרשעתו באירועים אלה, טען המערער, כי גרסתה של המתלוננת רזה, שלדית, אינה כוללת פרטים פריפריאליים והיא תוצר של שאלות מכווינות שנשאלו במהלך עדותה. משכך, היה על בית המשפט המחוזי לתת הנמקה 'ממשית' להחלטה להרשיעו על בסיס עדותה בלבד. אל מול האמור נטען, כי נימוקי בית המשפט שניתנו בהקשר זה אינם מתחייבים בנסיבות העניין, ואף שגויים. בסופם של דברים, טען המערער, כי הרשעתו התבססה בעיקר על התרשמותו של בית המשפט המחוזי מהתנהגות המתלוננת, לא על תוכן דבריה, וכי לא ניתן לקבוע על בסיס כך ממצאי מהימנות.",עיקרי נימוקי הערעור
"ע""פ 6038∕21","האירוע הראשון: לטענת המערער, על אף שגרסתה של המתלוננת אשר לאירוע זה מפורטת יותר, היא רוויית סתירות מהותיות אשר פוגמות במהימנותה. בפרט טען המערער, כי גרסתה של המתלוננת אינה אחידה ביחס לתיאור הבגדים שלבשה, שמלה או טוניקה, במועד האירוע; לאופן בו הוא הגיע לפורקן – בפנים, בחוץ או חצי בפנים חצי בחוץ; למועד בו הוא ליטף את גופה והורה לה לשחק עם איבר מינו – לפני או אחרי שקיים עמה יחסי מין; ולתנוחה בה קיים עמה יחסי מין – בעמידה, בשכיבה, או גם וגם. בתוך כך, השיג המערער על הנימוקים שסיפק בית המשפט המחוזי לסתירות אלה. לאור האמור, טען המערער, כי לא הוכח מעבר לכל ספק סביר שביצע את האירוע הראשון.",עיקרי נימוקי הערעור
"ע""פ 6038∕21","האירוע בחדר השינה: בכל הנוגע להרשעה באירוע זה, טען המערער, כי נוכח קיומן של סתירות מהותיות בגרסתה של המתלוננת, לא ניתן היה להרשיעו בעבירה של מעשה מגונה בקרובת משפחה. כך, תחילה סיפרה המתלוננת בחקירתה במשטרה, כי המערער ליטף אותה מתחת לבגדיה, ואילו לאחר מכן בעדותה בבית המשפט שינתה גרסתה, וטענה כי זה נעשה מעל לבגדיה, והוסיפה כי המערער גם ליטף אותה באזור איבר מינה.",עיקרי נימוקי הערעור
"ע""פ 6038∕21","אירועי התקיפה: ביחס לכך טען המערער, כי לא היו די ראיות לצורך הרשעתו במספר עבירות של תקיפת קטין בנסיבות מחמירות, וזאת הן לנוכח גרסתה הרזה של המתלוננת, אשר לא כללה פירוט מדויק על אודות מעשי האלימות; הן משום שנקבע, כי הטיח את ראשה בקיר אך פעם אחת.",עיקרי נימוקי הערעור
"ע""פ 6038∕21","מעבר לכך, טען המערער, כי למתלוננת היו מניעים רבי עוצמה אשר כל אחד מהם לחוד בעל עוצמה מספקת להניע אותה להפלילו. בתוך כך, עמד המערער על לא פחות מארבעה מניעים שיש למתלוננת להפלילו: כוונתו לחתן אותה עם גבר שלא רצתה להינשא לו; העובדה שהוא הגביל את החופש שלה; רצונה לחזור לגור ביישוב, שם נטען כי היה לה קשר רומנטי; ורצונה להתרחק מהעוני בו גדלה (שנטען כי המתלוננת מאשימה את המערער במצב הכלכלי של המשפחה), וכן מהאלימות, שלטענתה, נקט כלפיה.",עיקרי נימוקי הערעור
"ע""פ 6038∕21","כמו כן, השיג המערער על הקביעות של בית המשפט המחוזי בכל הנוגע לראיות לחיזוק ולסיוע גרסתה של המתלוננת. בתוך כך טען המערער, כי לא ניתן להיתלות על האמון שבני משפחתה של המתלוננת נתנו בה, לצורך חיזוק גרסתה; כי אין להתייחס לכך שהמתלוננת עמדה על תלונתה כראיה לחיזוק גרסתה, נוכח קיומם של מחדלי חקירה שנפלו בתיעוד השיחה שנערכה עמה בתחנת המשטרה; וכי לא נצפה אצל המתלוננת מצב נפשי קשה אשר מצדיק לייחס לו משקל ראייתי.",עיקרי נימוקי הערעור
