verdict,text,part
"ע""פ 4453∕16","מכל מקום מוטל עלינו לספק תשובה לשאלה האם אשמתו של המשיב הוכחה מעבר לספק סביר? המענה צריך לבוא בראש ובראשונה מתוך שיקול דעתנו כערכאת ערעור, אך בתוך כך אנו נדרשים לתת משקל להתרשמותם של שופטי הערכאה הדיונית. נקודת המוצא לדיון היא קביעותיו העובדתיות של בית המשפט המחוזי, וגם לקראת סיום נשוב ונתחשב בהתרשמותם הישירה של שלושת שופטי המחוזי מן העדים. למרות זאת, ברי כי אין אנו מחוייבים לדבוק בדעת הרוב, אלא חובתנו היא להעביר את פסק הדין תחת שבט הערעור ולבחון את מסקנותיו של בית משפט קמא (ע""פ 6643/05  מדינת ישראל נ' פלוני, [פורסם בנבו] בפסקה 7 (3.7.2007) (להלן: ע""פ 6643/05‏)). על כן נפסע בזהירות בעקבות שופטי הרוב, ונאתר את הנקודות שבהן מצאו שופטי הרוב פגמים בגרסתה של המתלוננת או במהימנותה הכללית.",דיון והכרעה
"ע""פ 4453∕16",הסתייגויותיהם של שופטי הרוב ממהימנות המתלוננת,דיון והכרעה
"ע""פ 4453∕16","הסתייגות ראשונה של שופטי הרוב מגרסתה של המתלוננת אנו מוצאים בהקשר של יחסיה עם לירון, חברו של המשיב. כאן נדרשת השלמה עובדתית: לאחר שהמתלוננת מסרה את גרסתה במשטרה, המשיב נעצר. אימה של המתלוננת צידדה במשיב וסירבה להאמין למתלוננת. בנסיבות אלה מצאה עצמה המתלוננת ללא קורת גג, והמחנכת שלה אספה אותה אל ביתה. בני משפחתה של המתלוננת התנכרו לה, והיא יצרה קשר עם חבריו של המשיב, וביקשה מהם לתמוך באִימה בתקופה קשה זו, כשהמשיב נתון במעצר והיא לבדה. אחד מהחברים היה לירון, שבינו לבין המתלוננת התפתח קשר טלפוני מתמשך. יצויין כי לירון הוא חבר של המשיב אך צעיר ממנו, ומבוגר מהמתלוננת רק בארבע שנים. לירון הביע תמיכה רגשית במתלוננת, אולם לצד זאת ניסה לגרום לה להודות שהיא העלילה על המשיב עלילת שווא, ולשם כך הקליט חלק משיחותיו עימה.",דיון והכרעה
"ע""פ 4453∕16","שופטי הרוב ציינו כי המתלוננת משתייכת למגזר החרדי, שאוסר על קשרים עם בני המין השני בשנות הנעורים. למרות זאת, המתלוננת שוחחה עם לירון שיחות טלפון ארוכות ""בשעות הלילה המאוחרות, שאת חלקן היא יזמה, למרות שהיתה מודעת לכך שהדבר מהווה מעילה באמונה של [המחנכת] אשר קיבלה אותה לביתה... על רקע זה סברו שופטי הרוב כי ""קשריה של [המתלוננת] עם לירון מעלים שאלות כבדות משקל באשר לגרסתה"" (עמ' 11 לפסק הדין).",דיון והכרעה
"ע""פ 4453∕16","לא עלה בידי להבין כיצד הקשר של המתלוננת עם לירון פוגם בגרסתה לעניין האישומים נגד המשיב. אפשרות אחת היא כי נערה שגדלה בסביבה דתית-חרדית ואינה מצייתת לנורמות החברתיות המקובלות בה – מאבדת את אמונו של בית המשפט באופן גורף. הקושי הגלום בטענה זו ניכר כבר כאשר היא מועלית על הכתב, ואין צורך להכביר מילים. המדינה טענה בערעור כי המתלוננת אינה בדיוק חרדית אלא חיה בסביבה חרדית, אבל לטעמי איננו נדרשים לכך. גם אם המתלוננת היתה חרדית מבטן ומלידה ונהגה לשוחח בלילות עם גבר מבוגר ממנה, עובדה זו, כשלעצמה, לא היתה גורעת ממהימנות גרסתה. אפשרות שניה היא, כי הקשר עם לירון פוגם במהימנות גרסתה של המתלוננת משום שלירון לא האמין לה והיא המשיכה לשוחח איתו. גם טענה זו אינה מקובלת עליי. בתקופה הרלוונטית, המתלוננת כמהה לאוזן קשבת, ולדעתי העובדה שהיא עמדה בקשר עם לירון איננה פוגמת כהוא זה במהימנות גרסתה (ראו גם להלן בפסקה 30; וכן עדותה של המתלוננת בעמ' 85, 108 ו-228 לפרוטוקול).",דיון והכרעה
"ע""פ 4453∕16","בהקשר זה ראיתי להוסיף הערה שיש לה גם פן כללי. ההגנה טרחה להגיש לבית המשפט תמונה שהמתלוננת צילמה את עצמה (תמונת ""סלפי"") והעלתה לחשבון האינסטגרם הפרטי שלה. בתמונה נראית המתלוננת מכווצת את שפתיה למעין נשיקה וירטואלית. על בסיס ראיה זו טענה באת-כוח המשיב כי המתלוננת אינה ""ילדה תמימה"" המקפידה על כללי הצניעות כפי שהציגה את עצמה (עמ' 943 לפרוטוקול). כשלעצמי, ברור לי שאין בתמונה זו כדי להשליך ולו במעט על ההכרעה בתיק הנוכחי. למרבה הצער, נראה שמדובר בחלק מתופעה רחבה יותר שבה נאשמים בעבירות מין מנסים להבליט אלמנטים מיניים בהתנהגותה של המתלוננת (או המתלונן), מתוך מחשבה שבכך הם תורמים להגנתם המשפטית. לפחות בחלק גדול מהמקרים, מדובר בטקטיקה שנועדה ""להכתים"" את המתלוננת ב""מיניות"" או ""פריצות"", באופן בלתי רלוונטי כלל ועיקר לפרשת ההגנה. למעט מקרים מיוחדים שבהם הוכחה הרלוונטיות, יש לשרש תופעה זו כדי שלא תהפוך לנורמה לגיטימית במסגרת הליך פלילי, ולקוות כי זה מכבר הותרנו מאחורינו את התקופה שבה נאשם היה יכול לקדם את הגנתו המשפטית בטענה שהמתלוננת נהגה במתירנות מינית (ראו ע""א 7426/14 פלונית נ' עו""ד אורי דניאל, [פורסם בנבו] בפסקה 45 וההפניות שם (14.3.2016)). על אחת כמה וכמה בענייננו, שבו לא מדובר על דפוס של התנהגות מינית אלא על העלאת תמונה לרשת חברתית. יוער כי גם התביעה לא טמנה ידה בצלחת והגישה לבית המשפט תמונה של הנאשם עם בנו במקלחת, כשלעצמי התקשיתי להבין כיצד תמונה זו יכולה לתרום לבירור האשמה.",דיון והכרעה
"ע""פ 4453∕16","ההסתייגות השניה של שופטי הרוב ממהימנותה של המתלוננת, קשורה גם היא למפגש עם לירון. כאמור, המתלוננת עזבה מסיבת יום הולדת של חברתה ונפגשה עם לירון בגינה ציבורית בשעת ערב. המתלוננת שוחחה עם לירון, ואז חששה שחברותיה הבחינו בכך. כדי להימנע מהסטיגמה השלילית הכרוכה במפגש עם גבר, המתלוננת חזרה למסיבת יום ההולדת וסיפרה לחברותיה, בדמעות, שגבר זר רדף אחריה. כלומר, שופטי הרוב סברו שהמתלוננת מסוגלת לביים בכי והיסטריה, ולכן לא ניתן להסתמך על הבעת רגשות מצידה, שברגיל היא עשויה היתה לשמש חיזוק לגרסתה.",דיון והכרעה
"ע""פ 4453∕16","           גם בנקודה זו, התקשיתי לקבל את עמדתם של שופטי הרוב. לא השתכנעתי כי העובדה שהמתלוננת בדתה סיפור ופרצה בבכי מעושה במקרה אחד, מאיינת את המשקל של סערת רגשות קיצונית בהקשרים אחרים: בחקירות במשטרה, בעימות עם המשיב או בבית המשפט (השוו: ע""פ 3231/09 פלוני נ' מדינת ישראל, [פורסם בנבו] בפסקה 12 (31.5.2010)). מקובלת עליי עמדתו של שופט המיעוט, כי סביר בהחלט שהבכי והפגנת הרגשות של המתלוננת נבעו מהתרגשות אמיתית ומחשש ששמה הטוב ייפגע (עמ' 49 לפסק הדין). מה עוד, שבאותה תקופה המתלוננת הייתה תחת חסותה של המחנכת, ומן הסתם חששה לאכזב אותה. חרף עמדתי זו, בהינתן שמדובר בתחום הנושק לליבת ההתרשמות הישירה של שופטי הערכאה הדיונית מ""אותות האמת"" הנגלים בהתנהגותו של עד, הרי שלצורך הדיון אקבל את קביעתם של שופטי הרוב כי הבעת רגשות בחקירה או בבית המשפט לא תשמש חיזוק עצמאי למהימנותה של המתלוננת.",דיון והכרעה
"ע""פ 4453∕16","התייחסות שלילית נוספת למהימנותה של המתלוננת, נוגעת לדברים שאמרה המתלוננת ללירון לגבי האירוע שבו נחשפה הפרשה. גם בנקודה זו עלינו לעצור ולספר על השתלשלות העניינים: המתלוננת היתה במצוקה וסיפרה בבכי לחברתה על מעשיו של המשיב. החברה הציעה למתלוננת לשוחח עם אחותה הבוגרת, וזו הפנתה את המתלוננת לרב, שניסה לשכנע את המתלוננת לפנות למשטרה. למחרת השיחה עם הרב, המחנכת של המתלוננת פנתה אליה בבית הספר ושאלה לשלומה. המתלוננת פרצה בבכי, ורק לאחר שנשאלה מספר פעמים, ומשסברה כי הרב כבר העביר את המידע, סיפרה למורה שאביה מבצע בה מעשים מגונים. המחנכת עדכנה מיד את מנהלת בית הספר, שהורתה לעדכן גם את פסיכולוגית בית הספר. לבקשת הפסיכולוגית, אימה של המתלוננת הוזמנה בדחיפות לבית הספר, ולמשמע הדברים הגיבה האֵם בזעזוע עמוק ובהתפרצות. לדברי המתלוננת, מילותיה הראשונות של האם היו: ""איך עשיתם לי את זה?!"". מתוך סערת הרגשות, האם הסירה מעל ראשה את כיסוי הראש. בסמוך לאחר מכן הגיע לבית הספר גם המשיב. האם והמשיב יצאו למסדרון והתפתחה ביניהם מריבה קולנית, והמשיב נתבקש לעזוב את בית הספר. האם השאירה את בתה הקטנה בבית הספר והלכה כשהיא מכריזה ""אני מתאבדת"", סבתה של המתלוננת הוזעקה לבית הספר ונטלה את אחותה הקטנה של המתלוננת, חיבקה את המתלוננת והרגיעה אותה. ובקיצור, בבית הספר התחוללה מהומה פומבית שכללה צעקות, היסטריה ובכי. בהמשך הגיעו פקידת סעד ועובדת סוציאלית, ולאחר מכן הגיעו גם חוקרות נוער שליוו את המתלוננת לתחנת המשטרה (ת/8, עמ' 71-67, 374-373, 502-499, 516-512, 790-789 לפרוטוקול).",דיון והכרעה
"ע""פ 4453∕16","[במאמר מוסגר: ההתנהלות בבית הספר היתה בעייתית מאד ברמה המערכתית. בין היתר, פרטיותה וכבודה של המתלוננת ושל בני משפחתה נפגעו כאשר תלמידות מן השורה נחשפו לסיפור. הליך שהיה אמור להתבצע ברגישות שיא, הלך והתדרדר לכדי מהומה רבתי, וכאמור גם המשיב עצמו הגיע במהרה לזירת ההתרחשות. במקרים עגומים מעין אלה נדרש הצוות החינוכי לפעול בזהירות ובאופן שקול, תוך פנייה לפקידת הסעד ומבלי לפנות לאמה של המתלוננת. למיטב ידיעתי, הנחיות בנושא פורסמו בחוזר מנכ""ל משרד החינוך 11–2.1 ""חובת הדיווח על עברה בקטין על פי חוק וחקירת תלמידים כקרבנות או כעדים"", וראו סעיף 7.1.ב (1) לנוהל].",דיון והכרעה
"ע""פ 4453∕16","כאשר המתלוננת נפגשה עם לירון בגינה הציבורית, הוא הקליט את השיחה בסתר. לדברי לירון הוא הקליט רק את החלק האחרון של הפגישה. מתוך החלק שהוקלט והוגש כראיה, ישנו קטע שבו המתלוננת מספרת ללירון על ההתרחשויות בבית הספר, בזו הלשון:",דיון והכרעה
"ע""פ 4453∕16","           בהקשר זה נאמר בהכרעת הדין, בדעת הרוב, כי: ",דיון והכרעה
"ע""פ 4453∕16","בדומה לאמור לעיל, כך גם בהקשר זה איני סבור כי שיחתה של המתלוננת עם לירון מטילה צל על מהימנות גרסתה. המתלוננת הדגישה בשיחה עם לירון אנקדוטה משעשעת או אף נלעגת, אך היא ציינה בפירוש שהאם היתה בסערת רגשות (""אמא שלי כולה משתגעת הורידה את הכיסוי משתגעת""), ובהמשך אף מביעה אהבה כלפיה (""אני חולה על אמא שלי אבל, אין על אמא שלי בעולם, חיים שלי""). ייתכן שהאופן שבו המתלוננת דיברה על אמה צורם לאוזן, אבל מכאן ועד למסקנות הנוגעות למהימנות עדותה אודות המעשים המגונים – המרחק גדול. התייחסות מעין זו להורים, או צורת ביטוי מעין זו, בבחינת ""דחקה"" על חשבון ההורים, אינה עניין חריג בקרב נערות ונערים בגיל ההתבגרות.",דיון והכרעה
"ע""פ 4453∕16","           יש לזכור כי הרקע לשיחה הוא שהאם סירבה להאמין למתלוננת, והמתלוננת אף חשה כי התגובה הראשונית של האם היתה לראות בה ""שותפה לפשע"". כלשונה של המתלוננת ""ואני בעצם אומרת לעצמי תוך כדי מה 'איך עשיתם'? כל השנים האלה אני סובלת אני מנסה להתנגד אני מנסה לצאת מזה ו'איך עשיתם לי את זה' כאילו אני שיתפתי פעולה"" (עמ' 69), וכך גם הסבירה המתלוננת בבית המשפט, באמרה ""אני פגועה ממנה"" (עמ' 104-103 לפרוטוקול). אוסיף ואומר כי לאחר האזנה קשובה להקלטת השיחה ולאינטונציה של המתלוננת, אני נוטה גם כאן לעמדתו של שופט המיעוט, שסבר כי שופטי הרוב ""פרשו את התנהגות המתלוננת באופן המחמיר עימה, מעבר לנדרש"" (ראו עמ' 48-47 לפסק הדין).",דיון והכרעה
"ע""פ 4453∕16","משהזכרנו את תגובתה של האם, אציין את עדותה של המחנכת ולפיה במהלך המפגש המתלוננת התחננה בפני אמה ""תאמיני לי, תאמיני לי"" (עמ' 377), בעוד האֵם צעקה במסדרון בית הספר כי המתלוננת שיתפה עם הנאשם פעולה (עמ' 383). כשלעצמי, אני סבור כי דווקא תגובה ספונטנית זו של האם – שבהמשך הדרך התנכרה לבתה ותמכה במשיב – יכולה ללמד על כך שהאם אכן האמינה למתלוננת, אך בכרה להטיל את ""האשמה"" עליה, שמא מתוך ראיה מעוותת של המתלוננת כמי ש""פתתה"" את בן זוגה. אציין כי ידיעה או חשד או עצימת עיניים של האם בסיטואציה כגון דא, אף היא אחד מהמאפיינים של עבירות מין במשפחה, ואיני מתיימר כמובן לקבוע כי כך היה הדבר גם במקרה זה.",דיון והכרעה
"ע""פ 4453∕16","סיכום ביניים: סקרנו שלושה נושאים שעוררו ספק בליבם של שופטי הרוב, והגענו למסקנה כי אין בהם כדי לעורר ספק באמיתות גרסתה של המתלוננת [יובהר: אין אנו מניחים מראש שהמתלוננת מהימנה, ולסוגיה קרדינלית זו נידרש בהמשך]. מדובר באירועים שוליים (קשר טלפוני ופגישה עם לירון; המצאת ""סיפור כיסוי""; התבטאות לעגנית כלפי האם) שאין בהם כדי לשפוך אור על היתכנותם של האירועים המתוארים בכתב האישום.",דיון והכרעה
"ע""פ 4453∕16",גרסתה של המתלוננת: כוללנית או מפורטת?,דיון והכרעה
"ע""פ 4453∕16","אם הכוונה בכך היא לקשיים המפורטים לעיל, הרי שכאמור אין בידי לקבל את מסקנתם של שופטי הרוב. מדובר לכל היותר בקשיים שוליים שאינם משליכים על השאלה אם האירועים המפורטים בכתב האישום אכן אירעו במציאות. בשל חשיבותו, נביא את הקטע הרלוונטי מתוך פסק הדין בשלמותו:",דיון והכרעה
"ע""פ 4453∕16","""הבעיה המרכזית בעדותה של המתלוננת נובעת מדלות תיאורם של המעשים. המתלוננת תיארה את האירועים בתיאור כוללני, מבלי להתייחס למקרה ספציפי. העדות נעדרת פרטים אותנטיים יחודיים ולעיתים שוליים בעלי עיגון בקונטקסט ובנסיבות המתוארות, כמו גם פרטים חווייתיים למעט ריח הסיגריות שנדף מפיו של הנאשם עת ניסה לנשק אותה, אותו יכלה היתה להריח גם בנסיבות אחרות. המתלוננת אינה מחברת אף ולו אחד מהאירועים הנטענים למקרה ספציפי המעוגן בנסיבות סביבתיות, כגון חג, עונות שנה, התרחשויות קודמות שקדמו למעשה וכדומה. על פי גרסתה, המעשים החלו בהיותה כבת 8-7 שנים, הנאשם שכב לידה במיטה ונישק אותה כשהוא מחדיר את לשונו לפיה [...] מבלי להוסיף כל פרט מעבר לכך. היא אינה מתארת את הפעם הראשונה בה התרחש המגע, את הנסיבות האופפות אותו או מה היו תחושותיה או מחשבותיה באותו רגע, למעט האמירה הכללית המתייחסת למכלול האירועים 'הרגשתי שיש משהו, הרגשתי שכן קורה משהו שכן, שהוא אוהב אותי לא בתור ילדה שהוא אוהב אותי מעבר לילדה. כי נשיקה וחיבוק של אבא זה לא מתנהל בצורה כזאת זה מתנהל אולי נשיקה בלחי, חיבוק, ילדה שלי אני אוהב אותך, כן. אבל לשכב במיטה...' [...] גם בהתייחס למעשים החמורים יותר, שהתרחשו החל מהגיעה לגיל 12-9, אין המתלוננת מעגנת בזמן ובנסיבות נוספות כלשהן, מעבר לתיאור המעשה המיני וליטוף החזה. הפרט היחיד אותו היא מוסרת בקשר לאירועים אלה הוא בקשתה מהנאשם שלא יגע בחזה, כי הדבר מכאיב לה, וזאת למרות שהמעשים חזרו על עצמם כמעט כל לילה"" (עמ' 16-15 לפסק הדין).",דיון והכרעה
"ע""פ 4453∕16","כאן אנו מתקרבים ללב העניין – מהימנות עדותה של המתלוננת אודות המעשים המתוארים בכתב האישום. לפסקה המצוטטת לעיל יש השפעה ניכרת על ההכרעה בתיק, ולכן עלינו לבחון אותה בעיון. נפרק את הפסקה לרכיבים ונבדוק אותם אחד לאחד:",דיון והכרעה
"ע""פ 4453∕16","כאמור, שופטי הרוב ציינו שהמתלוננת מסרה ""תיאור כוללני, מבלי להתייחס למקרה ספציפי"". כתב האישום מתמקד באירועים שהתרחשו במיטתה של המתלוננת בשעות הלילה. ביחס לדפוס התנהגות נטען זה, המתלוננת אכן התקשתה לספק פרטים על אירוע ספציפי שבו המשיב נכנס למיטתה ונגע בה. לשאלה ""מתי את זוכרת שזה התחיל?"", ענתה המתלוננת: ""מגיל 8-7, התמונה הראשונה שרצה לי בראש זה שהיה שוכב לידי במיטה. אני זוכרת גם שהוא היה מנשק אותי בפה"" (עמ' 59 לפרוטוקול). יובהר כי אך טבעי הוא שהמתלוננת לא זכרה את פרטי האירוע הראשון, שהתרחש לדבריה כמעט 10 שנים לפני הדיון, בהיותה ילדה קטנה. המתלוננת נשאלה אודות המקרה האחרון שבו המשיב נגע בה, וענתה: ""אני חושבת שהיה קיץ רגיל, הייתי ישנה רק עם שמיכת פוך שאני זוכרת זה קרה אותו דבר כמו שסיפרתי מקודם"". בהמשך חזרה המתלוננת על התיאור הכללי של המעשים החוזרים ונשנים, ואז העיר בית המשפט: ""מה שהיא אמרה שזה היה כמו בפעמים האחרות, אנחנו נסתפק בזה בשלב הזה"" (עמ' 73-72 לפרוטוקול).",דיון והכרעה
"ע""פ 4453∕16","כפי שכבר ציינו שופטי הרוב, בעדותה של המתלוננת הוזכר גם אירוע שבו המשיב נגע בחזה והפסיק אחרי שהיא אמרה לו שזה כואב (עמ' 60 לפרוטוקול). בנוסף העידה המתלוננת על אירועים שאמנם לא נכללו בכתב האישום אך הם מוסיפים עומק ורוחב לגרסתה:",דיון והכרעה
"ע""פ 4453∕16","           א.      המתלוננת העידה: ""אני זוכרת שכן קרה פעם אחת שזה כן קרה בסלון אבל זה ממש היה בזהירות וזה לא היה כאילו, לא היה משהו זה..."" (עמ' 58 לפרוטוקול). המתלוננת חזרה ותיארה את המקרה גם בחקירה הנגדית, כשלדבריה היא ישבה על הספה, המשיב נגע באיבר מינה לזמן קצר ""בזהירות... לא כמו שהוא נוגע בי בחדר... כמה דקות וזהו, לא כמו שקורה בחדר... הוא לא הפשיט אותי... הכניס את היד שלו [למכנסיים]... מהחלק העליון למעלה"" (עמ' 254-251 לפרוטוקול).",דיון והכרעה
"ע""פ 4453∕16","ב. המתלוננת התבקשה לתאר אירוע מיני אחד, וסיפרה באופן מפורט על מקרה שבו המשיב החמיא למראה גופה, ובין היתר אמר: ""אם היא היתה חילוניה איך היא היתה מתלבשת"" (עמ' 72 ועמ' 153 לפרוטוקול).",דיון והכרעה
"ע""פ 4453∕16","           ג.      במסגרת החקירה הנגדית, המתלוננת תיארה מקרה קונקרטי, מפורט, מעוגן בזמן ובמקום מדוייקים. לדבריה, בשמחת תורה המשיב שתה לשכרה, וניצל רגע קצר שבו היו לבדם כדי לטפוח על ישבנה ולומר ""וואי איזה ישבן יפה"" (עמ' 244 לפרוטוקול). המשיב ואשתו אישרו שהוא השתכר באותה הזדמנות (עמ' 679-678 ועמ' 836 לפרוטוקול) אבל הכחישו את המעשה והאמירה.",דיון והכרעה
"ע""פ 4453∕16","           ד.      המתלוננת סיפרה כי היא חזרה עם המשיב מאמירת סליחות בבית הכנסת, ובדרך הביתה המשיב נשבע ""במזוזה של הרב חיים"" שהוא יחדול ממעשיו (עמ' 250-249 לפרוטוקול). ",דיון והכרעה
