verdict,text,part
"ע""פ 4453∕16","           ה.      המתלוננת העידה כי ""מתי שהוא היה נוגע בי הוא לא היה מניח תפילין [...] הוא אמר לי [...] שהוא מרגיש שמה שהוא עושה לי הוא לא ראוי להניח תפילין"" (עמ' 248-247 לפרוטוקול). מעבר לאותנטיות הגלומה באמירה זו, נוסף לה חיזוק בכך שהמשיב אישר כי היו ימים רבים שבהם הוא לא הניח תפילין חרף היותו אדם דתי, אלא שלדבריו הסיבה לכך היתה ""עצלנות"" גרידא (עמ' 626 לפרוטוקול).",דיון והכרעה
"ע""פ 4453∕16","גם המעשים עצמם תוארו על-ידי המתלוננת בצורה מפורטת ומוחשית, והיא הסבירה איך ואיפה בדיוק המשיב נגע בה והתחכך בה (עמ' 62-61, 178 לפרוטוקול).",דיון והכרעה
"ע""פ 4453∕16","פרטים נוספים תוארו על-ידי המתלוננת באמרה כי לפעמים המשיב נישק אותה אחרי שנגע בה. לדבריה: ""זה היה כאילו מין כזה לפני שאני הולך רגע אני אנשק אותה, והיו פעמים שהוא אמר לי אני מצטער בבקשה תסלחי לי, אני לא יודע מה קורה לי זה משהו שנכנס בי. אני מצטער"" (עמ' 64 לפרוטוקול).",דיון והכרעה
"ע""פ 4453∕16","אגב כך ראוי לציין, כי עדותה של המתלוננת כללה התייחסות לשיחותיה עם המשיב על המעשים עצמם. לשם המחשה והתרשמות, נביא קטע מעדותה שבו היא מתארת דו-שיח מורכב עם המשיב: ""הבטחתי לו שאני לא מספרת את הסיפור הזה והבטחתי לו, והוא אמר לי שאם אני אספר הוא יבין אותי, והוא גם אמר לי שאם אני אספר באותו רגע הוא יהרוג את עצמו. הבטחתי לו שאני לא מספרת. והבטחתי ואני עמדתי על שלי ואמרתי תקשיב אתה מפסיק ואני לא מספרת כלום. הוא אמר לי אבל אני חושש שתספרי את זה לבעלך, אמרתי לו מה קשור בעלי? אני אומרת לך אני לא מספרת את הסיפור הזה אז מה בעלי? נראה לך? והוא אמר לי אני מבין אותך אני מצטער"" (עמ' 63 לפרוטוקול).",דיון והכרעה
"ע""פ 4453∕16","           בדומה, העידה המתלוננת על שיחה עם המשיב: ",דיון והכרעה
"ע""פ 4453∕16","כפי שניתן להתרשם, המתלוננת סיפרה על השיחות בצורה שוטפת, והתיאור כולל גם פרטים שוליים.",דיון והכרעה
"ע""פ 4453∕16","אכן, כדברי שופטי הרוב בבית משפט קמא, קיים חסר בכל הנוגע לחיבור האירועים הנטענים ""למקרה ספציפי במעוגן בנסיבות סביבתיות, כגון חג, עונות שנה, התרחשויות קודמות שקדמו למעשה וכדומה"". עם זאת, בהקשר זה כבר נפסק כי ""אין בעובדה, כי פרט לאירוע בית החולים, לא הצביעה המתלוננת [...] על אירועים ספציפיים, כדי לפגום בעדותה. זאת, מאחר שמדובר במעשי אינוס שבוצעו בה במשך שנים ובתדירות גבוהה, ואין לצפות ממנה כי תדע להבחין בין מקרה אחד למשנהו"" (ע""פ 8080/11 פלוני נ' מדינת ישראל, [פורסם בנבו] בפסקה 30 (31.12.2013) (להלן: ע""פ 8080/11)). בפרט יפים הדברים לענייננו, שבו המעשים בוצעו בילדה-נערה, בשעות לילה מאוחרות, בעודה שוכבת במיטתה.",דיון והכרעה
"ע""פ 4453∕16","תיאורים אותנטיים, פרטים חווייתיים ותיאור מחשבות ורגשות מזמן אמת",דיון והכרעה
"ע""פ 4453∕16","לטעמי, גם קביעה זו מנוסחת באופן גורף מדי. כך, למשל, תיארה המתלוננת בפירוט רב את פרטי הלבוש והסרתם, באופן ספונטני ובלי שנשאלה על כך:",דיון והכרעה
"ע""פ 4453∕16","""הוא מוריד לי לאט לאט את השמיכה [...] שהייתי ישנה עם פיג'מה רגילה הוא היה מוריד לי לאט לאט את המכנס לפעמים זה היה ביחד עם התחתונים ולפעמים זה היה בנפרד [...] אם זה היה רק חצאית הוא היה מרים לי את החצאית ואם זה היה מכנס וחצאית היה מרים לי את החצאית מוריד לי את המכנס, לפעמים מוריד לי את התחתונים ביחד עם המכנס לפעמים בנפרד. לפעמים היה מוריד לי הכל, הרוב היה מוריד לי חצי עד הברך [...] הרוב היה קורה מוריד לי חצי. אחרי שהוא היה מוריד לי את המכנס ואת התחתונים הוא היה מתחיל לגעת לי באיבר מין"" (עמ' 61-60).",דיון והכרעה
"ע""פ 4453∕16","אשר להיעדרם של ""פרטים חווייתיים"" מן הגרסה, בית משפט קמא כבר ציין את דבריה של המתלוננת על ריח הסיגריות שנדף מן המשיב. גם כאן ראיתי לנכון להביא את דבריה כלשונם כדי שניתן יהיה להתרשם מהם: ""[המשיב] נכנס לאמבטיה ולדעתי עישן איזה משהו [...] ריח חנוק, לא ריח של סיגריה ואז שהוא היה בא נוגע בי ומנשק אותי אז היה יוצא לו ריח מהפה שהייתי נורא נגעלת שכמעט זה היה מגיע כאילו אני עומדת להקיא. זה לא קרה הרבה. זכור לי רק פעם אחת"" (עמ' 74 לפרוטוקול; ויצויין כי בעדותו של המשיב הוא סיפר שלעיתים היה מעשן חשיש בחדר האמבטיה (עמ' 592-591)). כמפורט בחוות דעתו של שופט המיעוט, אני סבור שעדותה של המתלוננת כללה ""פרטים חוייתיים"" נוספים (עמ' 31-30 לפסק הדין). בין היתר אציין כי המתלוננת העידה שהמשיב ""מנשק אותי פותח את הפה שלו, נשיקה לא עדינה, נשיקה..."" – וכאן בית המשפט ציין לפרוטוקול כי המתלוננת החוותה בידה תנועת אגרוף – ""...ממש רטובה"" (עמ' 59 לפרוטוקול). ובהמשך: ""שהיה נוגע לי בחזה זה היה נורא כואב כי זה היה הגיל שהתפתחתי"" (עמ' 59). ועוד הוסיפה המתלוננת: ""הייתי עם הגב אליו, והייתי מרגישה שהוא מוריד לי את המכנס, מוציא את האיבר מין, הייתי מרגישה הכול, היה מניח את היד שלו על האיבר מין עושה את התנועות שהוא תנועות מהירות כאלה שאני מרגישה שהיד זזה לאיבר מין שלו ואחרי שתי דקות שלוש דקות הייתי מרגישה על עצמי משהו רטוב"" (עמ' 63).",דיון והכרעה
"ע""פ 4453∕16","האם עדותה של המתלוננת כוללת תיאור של ""תחושותיה או מחשבותיה"" בזמן אמת? המתלוננת נשאלה: ""במהלך האירועים האלה מה היית חושבת מה היה רץ לך בראש מה היית מרגישה?"" ותשובתה היתה: ""אני ידעתי שאני לא מוציאה את הסיפור הזה, לא מספרת, הבטחתי לו שאני לא מספרת את הסיפור הזה והבטחתי לו"" (עמ' 63 לפרוטוקול). המתלוננת נשאלה על כך שוב, והשיבה: ""הייתי אומרת לעצמי וואי אני לא מאמינה שזה עוד פעם קורה, כאילו אמרתי לעצמי כל הזמן אם הוא יפסיק אני לא מספרת אז למה זה בא, למה זה עוד פעם קורה, למה הוא עוד פעם בא בלילה?"" (עמ' 72 לפרוטוקול). כמו כן, כשהמתלוננת מעידה על התדירות המשתנה של האירועים היא מספרת: ""חשבתי שזה נגמר אבל פתאום זה חזר עוד הפעם"" (עמ' 60). לגבי ההסתרה של המקרה היא העידה: ""פחדתי שאחד האחים שלי יראה [...] פחדתי מהתגובה. מה שחשבתי ש[המשיב] יעשה את זה שאם אחד האחים יראה אז הוא הוא יתקוף או משהו. זה מה שאני חשבתי אני לא יודעת מה היה באמת קורה"" (עמ' 62 ועמ' 64). ובהמשך: ""פחדתי מהתגובה, פחדתי מזה שהוא אמר לי כל הזמן אני אהרוג את עצמי, פחדתי מה יהיה אחרי כל ה... [...] פחדתי מהתגובות, תמיד חשבתי על אחרי מה יהיה אחרי זה אמא שלי אחים שלי מה הוא יגיד? אני לא יודעת אני תמיד לא ידעתי איך לעשות את זה איך אני מספרת? פשוט הרגשתי שאני לא מסוגלת, אין לי את האומץ להוציא את זה [...] תמיד אמרתי לעצמי אני חייבת, אני לא יודעת איך"" (עמ' 77-76 לפרוטוקול).",דיון והכרעה
"ע""פ 4453∕16","תיאורים נוספים של רגשות, שנחזים בעיניי אותנטיים במיוחד, הם דברי המתלוננת לפיהם כבר בהיותה ילדה קטנה: ""הרגשתי שכן קורה משהו שכן, שהוא אוהב אותי לא בתור ילדה, שהוא אוהב אותי מעבר לילדה. כי נשיקה וחיבוק של אבא זה לא מתנהל בצורה כזאת זה מתנהל אולי נשיקה בלחי, חיבוק, ילדה שלי אני אוהב אותך, כן. אבל לשכב לידי במיטה..."" (עמ' 59). כאשר המתלוננת נשאלה על חיי היומיום בבית, היא השיבה: ""הכל היה מתנהל כרגיל, אני הייתי הולכת לבית הספר חוזרת הביתה, עוזרת לאמא שלי הכל היה רגיל, תגישי לי את האוכל תגהצי לי חולצה. גם אותו בוקר שסיפרתי את המקרה שלא ידעתי שזה מה שיקרה אני זוכרת שהוא ביקש ממני לפני שהוא יוצא לעבודה את הבושם, משהו אני זוכרת. כל פעם שהיה מבקש ממני דברים הייתי אומרת לעצמי כאילו וואי אתה פשוט עושה לי דברים שלא צריך לעשות ואתה מבקש ממני דברים, שהיה מבקש ממני שאני אגיש לו את האוכל או שאני ארים לו את האוכל הייתי אומרת לעצמי כאילו, ברור שהייתי מרימה לא היה לי מה לעשות, אבל הייתי אומרת לעצמי כאילו זה כבר זה באמת לא יכול להיות"" (עמ' 65 לפרוטוקול).",דיון והכרעה
"ע""פ 4453∕16","מסקנת ביניים: הבעיה העיקרית שמצאו שופטי הרוב בעדותה של המתלוננת היא תיאור כוללני. להשקפתי, עדותה של המתלוננת כוללת פרטים ותיאורים, חלקם שוליים, כמפורט לעיל, וכן מחשבות ורגשות. לא מדובר אפוא בעדות לקונית ותמציתית באופן שגורע מן האפשרות לתת בה אמון. אמנם נותר חוסר בעובדות ובפרטים, אבל החוסרים אינם נוגעים ללב הגרסה ואינם חותרים תחת מהימנותה הבסיסית של המתלוננת.",דיון והכרעה
"ע""פ 4453∕16",קשיים נוספים על פי חוות דעתם של שופטי הרוב,דיון והכרעה
"ע""פ 4453∕16",בשלב זה של הכרעת הדין מנו שופטי הרוב קשיים נוספים שהתעוררו ביחס לגרסתה של המתלוננת.,דיון והכרעה
"ע""פ 4453∕16","             גרסה מתפתחת: גרסתה הבסיסית של המתלוננת לא השתנתה לאורך ההליך, אך נוספו לה שני פרטים מהותיים שלא נמסרו במשטרה. הראשון הוא שהמשיב החדיר את לשונו לפיה של המתלוננת, והשני – שהמשיב הגיע לסיפוק מיני כאשר התחכך בגופה (עמ' 16-15 לפסק הדין). שני הפרטים הללו מוסיפים חומרה יתרה למעשים המגונים. שופטי הרוב לא הבהירו מה המשקל שהם נותנים להתפתחות הגרסה, והבהירו כי הם מודעים להלכות הרלוונטיות שלפיהן גרסה מתפתחת של מתלונן בעבירות מין היא תופעה מוכרת שלא בהכרח תיזקף לחובתו ותגרע ממהימנותו. המתלוננת התבקשה להסביר בבית המשפט את התפתחות גרסתה. לדבריה, בשיחה שקיימה עם הפרקליטה ""הרגשתי שאני יותר פתוחה ממה שהיה לי בחקירה הראשונה. בחקירה הראשונה נורא הייתי לחוצה, נורא פחדתי, הייתי עדיין בתוך חלום כזה שכאילו הוצאתי את הסיפור הזה אז כאילו נורא היה לי קשה נורא לדבר במשטרה נורא נורא, עכשיו אני מרגישה שגם השם נותן לי כח לדבר לא אף אחד אחר. ושהייתי אצל [הפרקליטה] גם הרגשתי שאני נורא פתוחה לספר לה והוספתי עוד דברים שחשובים"" (עמ' 65 לפרוטוקול). לגבי הגעתו של המערער לסיפוק מיני, נשאלה המתלוננת על-ידי בית המשפט מדוע לא סיפרה על כך במשטרה, ותשובתה היתה: ""זה פשוט לא יצא לי מרוב שלא יכלתי לדבר על זה [...] עוד פעם, זה באותו יום, באותו רגע לא יצא לי. לא יכולתי להוציא את זה"" (עמ' 142 לפרוטוקול). בשים לב להלכות המקובלות לגבי חשיפה הדרגתית של המעשים והאירועים אצל נפגעי עבירות מין (ראו, בין רבים אחרים, ע""פ 5582/09 פלוני נ' מדינת ישראל, [פורסם בנבו] פסקה 85 והאסמכתאות שם (20.10.2010) (להלן: ע""פ 5582/09); ע""פ 4481/14 פלוני נ' מדינת ישראל, [פורסם בנבו] פסקה 58 (16.11.2016); ע""פ 8805/15 פלוני נ' מדינת ישראל, [פורסם בנבו] בפסקה 20 (2.4.2017)) ולנסיבות הפרטניות במקרה דנא, הסבריה של המתלוננת מקובלים עליי ואיני סבור כי יש לזקוף זאת לחובתה.",דיון והכרעה
"ע""פ 4453∕16","עוד ציינו שופטי הרוב כי המתלוננת לא הצליחה לתאר את התחושה של איבר המין של המשיב על גופה (עמ' 16 לפסק הדין). איני רואה מקום להרחיב בנושא, ודי אם אציין כי גם בהקשר זה מקובלת עליי עמדתו של שופט המיעוט שסבר כי ""תיאור מפורט, מעבר למה שמסרה המתלוננת, בשים לב למאפייניה היחודיים, אינו הכרחי בנסיבות העניין"" (עמ' 39-38 לפסק הדין; ראו עמ' 180-178 לפרוטוקול, שם ניכר הקושי של המתלוננת לדבר, והיא מעדיפה לכתוב את תשובתה על פתק, וגם במשטרה המתלוננת התקשתה כשנדרשה לתיאורים מעין אלה). באת-כוח המשיב התאמצה להראות שהמתלוננת נחשפה לתכנים מיניים בסדרות טלוויזיה פופולריות כגון ""עספור"" ו""הבורר"", אך אין בכך כדי לשנות את המסקנה.",דיון והכרעה
"ע""פ 4453∕16","שופטי הרוב הוסיפו, כי אף לאחר התחשבות במאפיינים המוכרים של עדויותיהם של נפגעי עבירות מין, במקרה הנוכחי נותרו ""אי בהירויות ותמיהות היורדות לשורשו של עניין שלא ניתן להתעלם מהן"": באירוע שבו נחשפה הפרשה בבית הספר, המתלוננת אמרה לאימה שהנאשם שכב איתה, ואז חזרה בה; הגודל והמבנה של הדירה מקשה על ביצוע מעשים מגונים במשך תקופה ארוכה בקרבת בני המשפחה בלי ידיעתם ובלי שהאם הבחינה בכתמי זרע על המצעים; ותמיהה מדוע המשיב לא ניצל את ההזדמנויות שבהן הוא היה לבד עם המתלוננת בבית (עמ' 19-17 לפסק הדין).",דיון והכרעה
"ע""פ 4453∕16","           תחילה, לכך שהמתלוננת אמרה שהמשיב שכב איתה. כאמור, גרסתה של המתלוננת נחשפה לראשונה באירוע דרמטי בבית הספר. כאשר אימה של המתלוננת הגיעה למקום היא שאלה את המתלוננת אם היא שכבה עם המשיב. המתלוננת השיבה בחיוב ולאחר מכן חזרה בה. עד כאן, העובדות מוסכמות. גם אין מחלוקת כי לאחר שהאם קיבלה תשובה חיובית לשאלתה, היא אמרה למתלוננת שהיא תיקח אותה לבדיקה רפואית כדי לבדוק את אמיתות דבריה. נותרה מחלוקת בשאלה אם המתלוננת חזרה בה בגלל החשש מבדיקה רפואית שתפריך את גרסתה. שופטי הרוב סברו כי לאור ""מכלול הראיות"" התשובה לכך חיובית, אך שופט המיעוט ניתח את העדויות והגיע למסקנה שונה (עמ' 18 ועמ' 40 לפסק הדין, בהתאמה). המתלוננת הסבירה שהיא השיבה לשאלתה של האם בחיוב מתוך בלבול ולחץ (עמ' 143 לפרוטוקול), ואכן אין ספק שהסיטואציה היתה מטלטלת ומסעירה. החשוב יותר, בעיניי, הוא שכאשר המתלוננת חשפה את המעשים (בפני חברותיה, הרב והמחנכת) היא לא סיפרה שהמשיב קיים איתה יחסי מין אלא שהוא נהג לגעת בגופה. לפיכך, מסתבר יותר שהמתלוננת אכן שגתה בלשונה בשל אי הבנה לכוונת אמה, שהרי מבחינתה המערער אכן שכב עמה במיטה, להבדיל מ""שכב"" במובן של קיום יחסי מין. למעשה, כבר בעימות עם הנאשם המתלוננת אומרת כי אמרה לאמה ""הוא נוגע בי. אז היא אמרה לי: הוא שכב איתך? אז אמרתי לה כן. ואז אמרתי לה לא (מילים לא ברורות). היא אמרה לי שאני צריכה לעשות בדיקה."" (ת/3(א), עמ' 7, שורות 38-36). דהיינו, המתלוננת תיקנה את תשובתה לאם על אתר. נראית לי אפוא יותר גישת שופט המיעוט שדחה את הטענה כי המתלוננת ניסתה להפליל את המשיב באונס וחזרה בה רק מחמת האיום בבדיקה רפואית.",דיון והכרעה
"ע""פ 4453∕16","ומכאן לשאלת היתכנות המעשים בדירה קטנה ובחדר חסר דלת שבו ישנו גם אחיה של המתלוננת. למרבה הצער, ניסיון החיים מלמדנו שעברייני מין אינם נרתעים מביצוע עבירות בסיטואציות ""לא הגיוניות"", בקרבת בני משפחה ואף בשעות היום ובמקומות פתוחים (ע""פ 5582/09 בפסקה 87: ""כך, ניסיון החיים והפסיקה מלמדים כי מעשי אינוס ומעשים מגונים בוצעו במקומות חשופים וגלויים כמו סלון הבית או חדר שכל אחד יכול להיכנס אליו בכל עת, ואף שעה שאדם אחר נוכח בחדר במיטה סמוכה וכיו""ב""; ע""פ 6643/05‏, בפסקה 19 ופסקה 21; ע""פ 8080/11, בפסקה 30; ע""פ 7843/05 פלוני נ' מדינת ישראל, [פורסם בנבו] בפסקה 8 (26.6.2006)). לכן, אם מתעורר קושי, הוא נעוץ בכך שאיש לא שמע את המעשים שחזרו על עצמם פעמים רבות. המשיב טען שהמיטה של המתלוננת היתה שבורה ולכן חורקת ורועשת מאד (עמ' 593 לפרוטוקול). המתלוננת מסרה גרסה מתונה יותר שלפיה רק ברגע שהמשיב היה מתיישב על המיטה נשמע רעש מסויים (עמ' 197 לפרוטוקול). חוקרי המשטרה לא הטריחו עצמם לבית המשפחה כדי לבדוק את המקום הפיזי שבו בוצעו העבירות הנטענות, וקשה שלא לראות בכך מחדל חקירה. חרף המחדל החקירתי, אינני סבור כי ביצוע המעשים בנסיבות אלה הוא מופרך או בלתי סביר. המשיב העיד על עצמו כי נהג לקיים יחסי מין עם אשתו ""בשקט ודממה [...] ממש בשקט ולאט"" (עמ' 629 ו-631 לפרוטוקול). בהנחה שהמעשים המגונים נעשו בשעות לילה מאוחרות, כשבני הבית ישנו שינה עמוקה, המשיב יכול היה להתגנב למיטתה של המתלוננת ולבצע את זממו בשקט (ולא נעלמו מעיניי הטענות לשנתם הקלה של האם והאח, ומנגד, האם העידה כי היא נוטלת כדור הרגעה המשפיע על השינה מסוג אלפרליד - עמ' 832 לפרוטוקול). כפי שהעידה המתלוננת: ""הוא היה עושה את זה נורא בשקט שאף אחד לא ישמע. גם אמרו שהמיטה שלי משמיעה רעש, שבורה לא טובה משמיעה רעש נורא שאי אפשר לא לשמוע. ובעצם התנועות שהוא היה עושה זה היה בזהירות ולא תנועות שהיו עלולים להשמיע את הרעש שצריכים להשמיע מהמיטה. וגם אם היה טיפה רעש מהמיטה היו חושבים שכנראה אני זזה ולא היו קמים מזה שיש רעש מהמיטה. האחים שלי היו ישנים נורא חזק אני הייתי רואה"" (עמ' 73 לפרוטוקול). כאמור, לחדר הילדים לא היתה דלת אך יצויין כי לחדר השינה של האם היתה דלת (עמ' 550-549 לפרוטוקול; ראו גם עמ' 598, שם אומר המשיב כי האם שמעה כל מה שקורה בסלון, בשירותים ובאמבטיה, להבדיל אולי מחדר הילדים).",דיון והכרעה
"ע""פ 4453∕16","           גם עדותה של האם, כי לא הבחינה בכתמי זרע על המצעים, אינה פוגמת בהיתכנות הגרסה המפלילה באופן מהותי, בפרט בשים לב לדברי המתלוננת כי המשיב ניגב את הזרע (ראו והשוו: ע""פ 6164/10 פלוני נ' מדינת ישראל, [פורסם בנבו] בפסקה 28 (20.2.2012)). בהמשך לכך, גם התמיהה הלכאורית מדוע המשיב לא ""ניצל הזדמנויות"" שבהן שהה עם המתלוננת לבדה, אינה מעוררת קושי ממשי (בהקשר זה ראו גם האמור להלן בפסקה 33).",דיון והכרעה
"ע""פ 4453∕16","עד כה סקרתי את הקשיים והתמיהות שנמנו בחוות דעתם של שופטי הרוב בבית משפט קמא, והבהרתי כי לשיטתי לא נמצאה סיבה ממשית לפקפק במהימנותה של המתלוננת. לטעמי, התנהגותה של המתלוננת בהקשרים אחרים שאינם נוגעים ישירות לכתב האישום (קשר עם לירון; ""סיפור הכיסוי""; לעג לאם), אינה נוגעת להכרעה בדבר התרחשות העבירות מושא דיוננו. בהערת אגב אציין כי כל שלושת האירועים הללו קשורים למעורבותו של לירון בפרשה, וכפי שעוד אזכיר בהמשך, איני סבור כי מדובר בצירוף מקרים גרידא. בהמשך ראינו כי המתלוננת מסרה עדות כוללנית על המעשים המגונים שנעשו במיטתה, אך לצד זאת סיפרה גם על אירועים קונקרטיים המעוגנים בזמן ומקום. כמו כן, ניתן למצוא בעדותה של המתלוננת פרטים המעידים על אותנטיות, פרטים חוייתיים, וכן תיאורים של רגשות ומחשבות אודות התקופה שבה בוצעו בה המעשים המגונים. לצד זאת, אינני סבור כי התפתחות הגרסה (ביחס להחדרת לשון ו""רטיבות""), האמירה של המתלוננת לאימה כי המשיב שכב איתה, וסוגיית היתכנות המעשים בדירה הקטנה, מערערים את ליבת גרסתה של המתלוננת.",סיכום ביניים
