verdict,text,part
"ת""פ 32731-05-18","בנוסף, לאחר שהאחר ירה באקדח והשליך את רימון ההלם לעבר בית המתלונן, מילט הנאשם את חברו מהזירה.",דיון ומסקנות
"ת""פ 32731-05-18","מנגד, הגם שחלקו של הנאשם, לעניין הובלת הנשק, זהה לזה של האחר ניתן להקל עמו במעט שכן לא הוא זה שהביא את הנשק ולא נטען כי מדובר בכלי נשק השייכים לו.",דיון ומסקנות
"ת""פ 32731-05-18","מדובר, כאמור, במבצע בצוותא.",דיון ומסקנות
"ת""פ 32731-05-18","כמו כן, הגם שציינתי כי יש לזקוף לחובתו את העובדה כי מדובר בנשיאת והובלת שני כלי נשק, עומדת לזכותו, מנגד, העובדה כי אחד מהם הינו רימון הלם ""בלבד"", שהתייחסות אליו בפסיקה הינה מקלה באופן יחסי משום הפוטנציאל המופחת לגרימת נזק בהשוואה לרימון רסס.",דיון ומסקנות
"ת""פ 32731-05-18","כמצוין בהרחבה לעיל, לא זקפתי לחובת הנאשם את הירי ואת השלכת הרימון לעבר בית המתלונן.",דיון ומסקנות
"ת""פ 32731-05-18",לא מצאתי כי יש מקום לסטות ממתחם העונש ההולם – אם לקולה משום שיקולי שיקום ואם לחומרה משום שיקולי הגנה על הציבור.,דיון ומסקנות
"ת""פ 32731-05-18",לעניין העונש שיש להשית בתוך המתחם - יש להתייחס בהקשר זה לנסיבותיו האישיות של הנאשם לקולה ולחומרה וכן לנתונים ונסיבות המנויים ברובם בס' 40 יא' לחוק.,דיון ומסקנות
"ת""פ 32731-05-18",אתחשב בהודאת הנאשם אשר הביאה לחיסכון בזמן שיפוטי וחסכה את העדת המתלונן.,דיון ומסקנות
"ת""פ 32731-05-18","יחד עם זאת, אין מדובר בהודיה שבאה בפתח ההליך ואפנה לכך כי טרם ההודיה העידה המאשימה שני עדים שנאלצו להגיע מהמטה הארצי ויש להניח כי לא התפנו באותו יום למטלות נוספות.",דיון ומסקנות
"ת""פ 32731-05-18","עוד בהקשר זה, דומה היה שהנאשם פסח על שתי הסעיפים, הודה, חזר בפני שירות המבחן מהודייתו, וחוזר חלילה עד ש""התייצב"" על גרסתו הנוכחית.",דיון ומסקנות
"ת""פ 32731-05-18",כך לא נוהג מי שמביע חרטה כנה ואמיתית.,דיון ומסקנות
"ת""פ 32731-05-18","נתתי דעתי לכך שמדובר באב לשני ילדים קטנים שזהו מאסרו הראשון מאחורי סורג ובריח ולכך שניהל, על פני הדברים, אורח חיים נורמטיבי עד להסתבכותו.",דיון ומסקנות
"ת""פ 32731-05-18","משכך, יש ליתן משקל להשפעותיו השליליות של מאסר בפועל.",דיון ומסקנות
"ת""פ 32731-05-18","השתת תקופת מאסר ממושכת עלולה להותיר חותם שלילי של הווית הכלא, במובן של אימוץ דפוסים עבריינים [ור' בהקשר זה האמור בדו""ח וועדת דורנר (הועדה הציבורית לבחינת מדיניות הענישה והטיפול בעבריינים), עמ' 26 והמובאות שם].",דיון ומסקנות
"ת""פ 32731-05-18","יחד עם זאת, יש ליתן משקל – בתוך המתחם – לשיקולי הרתעה.",דיון ומסקנות
"ת""פ 32731-05-18","אפנה בהקשר זה לאמור בעניין אלהזייל לעיל (ע""פ 2398/14) שם צוינו הדברים הבאים: ""בסוף, ולא אחרון בסדר חשיבותו, אחזור ואדגיש את מדיניות ההחמרה בעבירות נשק, שבאה לידי ביטוי בשורה ארוכה של פסקי דין של בית משפט זה בשנים האחרונות  (...).",דיון ומסקנות
"ת""פ 32731-05-18","לזמינות הבלתי נסבלת של נשק חם בידי מי שאינם מורשים לכך, יש פוטנציאל לשמש ל""חיסול חשבונות"" ול""פתרון סכסוכים"" כמו-גם לעבירות חמורות נוספות.",דיון ומסקנות
"ת""פ 32731-05-18","המציאות בארצנו מוכיחה כי הקלישאה אודות האקדח במערכה הראשונה אינה מדוייקת, באשר לעיתים מזומנות האקדח אינו ממתין עד למערכה האחרונה ויורה עוד קודם לכן.",דיון ומסקנות
"ת""פ 32731-05-18","מכאן, שבעבירות כגון דא, גם לשיקולי ההרתעה משקל של ממש."" (ההדגשה לא במקור – י.ל.).",דיון ומסקנות
"ת""פ 32731-05-18","לגבי חילוט האופנוע – המאשימה, כאמור, עתרה לחלטו מכוח סעיף 39 לפקודת סדר הדין הפלילי (מעצר וחיפוש) [נוסח חדש], תשכ""ט – 1969.",דיון ומסקנות
"ת""פ 32731-05-18","מעובדות כתב האישום המתוקן עולה כי קיימת זיקה ברורה בין האופנוע לבין ביצוע העבירה, שכן הנאשם והאחר הובילו ונשאו את האקדח והרימון באמצעות האופנוע עד לבית המתלונן.",דיון ומסקנות
"ת""פ 32731-05-18",עוד עלה מפלט הבעלויות כי הנאשם הינו הבעלים הרשום של האופנוע ולא נטען כי אחר טוען לבעלות.,דיון ומסקנות
"ת""פ 32731-05-18","הנאשם לא העלה כל טענה של ממש כנגד החילוט ומשכך, אני מורה על קבלת הבקשה בנדון.",דיון ומסקנות
"ת""פ 32731-05-18","אפנה הקשר זה לאמור בע""פ 1000/15 אבו אלחווה נ' מדינת ישראל (3.7.2015).",דיון ומסקנות
"ת""פ 32731-05-18","באותו מקרה אושר חילוט רכב בנסיבות דומות לענייננו (הובלת נשק), וצוינו הדברים הבאים:""...",דיון ומסקנות
"ת""פ 32731-05-18","בנסיבות העניין, משלא הורשע הנאשם בעבירות הנוגעות לירי ולנזק שנגרם לרכוש המתלונן, לא מצאתי לחייבו בפיצויים.",דיון ומסקנות
"ת""פ 32731-05-18","בשים לב לחילוט האופנוע ומשום יתר הנסיבות, לא מצאתי להשית קנס.",דיון ומסקנות
"ת""פ 32731-05-18","סוף דבר, אני גוזר על הנאשם את רכיבי הענישה הבאים:",דיון ומסקנות
"ת""פ 32731-05-18",14 חודשי מאסר.,דיון ומסקנות
"ת""פ 32731-05-18",מתקופת המאסר תנוכה התקופה בה היה הנאשם במעצר בתיק זה – מיום 24.4.18 ועד ליום 19.6.18.,דיון ומסקנות
"ת""פ 32731-05-18","הנאשם יתייצב לריצוי מאסרו בבית מעצר קישון ביום 14.4.19 עד השעה 10:00, או על פי החלטת שב""ס, כשברשותו תעודת זהות או דרכון.",דיון ומסקנות
"ת""פ 32731-05-18","על הנאשם לתאם את הכניסה למאסר, כולל האפשרות למיון מוקדם, עם ענף אבחון ומיון של שב""ס, טלפונים: 08-9787377, 08-9787336.",דיון ומסקנות
"ת""פ 32731-05-18","תנאי השחרור או המעצר באיזוק בהם היה נתון הנאשם עד כה, ימשיכו לחול עד להתייצבותו לתחילת ריצוי עונשו.",דיון ומסקנות
"ת""פ 32731-05-18","מאסר לתקופה של 10 חודשים, על תנאי למשך שלוש שנים מיום שחרורו והתנאי הוא כי לא יעבור עבירת נשק מסוג פשע.",דיון ומסקנות
"ת""פ 32731-05-18","מאסר לתקופה של 5 חודשים, על תנאי למשך שלוש שנים מיום שחרורו והתנאי הוא כי לא יעבור עבירת נשק מסוג עוון.",דיון ומסקנות
"ת""פ 32731-05-18","אני מורה על חילוט אופנוע הנאשם –  מסוג ימאהה R6, ל.ז. 1057357.",דיון ומסקנות
"ת""פ 32731-05-18","עד להתייצבותו למאסר, ימשיך הנאשם להיות נתון במעצר באיזוק באותם תנאים שהיו  עד כה.",זכות ערעור תוך 45 יום לבית המשפט העליון.
"ת""פ 32731-05-18","המזכירות תשלח עותק מגזר הדין לשב""ס וכן לממונה על הפיקוח האלק' (במידה והנאשם עצור באיזוק אלק').",זכות ערעור תוך 45 יום לבית המשפט העליון.
"ת""פ 32731-05-18","54678313ניתן היום,  ו' אדר ב' תשע""ט, 13 מרץ 2019, בהעדר הצדדים.",5129371
"ת""פ 32731-05-18","בעניין עריכה ושינויים במסמכי פסיקה, חקיקה ועוד באתר נבו – הקש כאן",5129371
