verdict,text,part
"ת""פ 32731-05-18","ת""פ 32731-05-18 מדינת ישראל נ' ח'טיב(עצור בפיקוח)",בית המשפט המחוזי בחיפה
"ת""פ 32731-05-18","מדינת ישראל
באמצעות פרקליטות מחוז חיפה (פלילי)",בעניין:
"ת""פ 32731-05-18",עלי ח'טיב (עצור בפיקוח),נגד
"ת""פ 32731-05-18","באמצעות בא כוחו – עו""ד עאדל דבאח",נגד
"ת""פ 32731-05-18","חוק העונשין, תשל""ז-1977: סע'  29, 144(ב), 40 יא'",חקיקה שאוזכרה: 
"ת""פ 32731-05-18","פקודת סדר הדין הפלילי (מעצר וחיפוש) [נוסח חדש], תשכ""ט-1969: סע'  39",חקיקה שאוזכרה: 
"ת""פ 32731-05-18","הנאשם הורשע, על פי הודייתו, בעבירות נשק (נשיאה והובלה), לפי סעיף 144(ב) רישא וסיפא + סעיף 29 לחוק העונשין, תשל""ז–1977 (להלן: החוק).",כללי
"ת""פ 32731-05-18","הודיית הנאשם ניתנה במסגרת הסדר טיעון שגובש בתחילת פרשת התביעה וכלל את תיקונו של כתב האישום, ללא הסכמות עונשיות.",כללי
"ת""פ 32731-05-18",במועד הרלוונטי לכתב האישום שרר בכפר נחף סכסוך בין שני בעלי תחנות דלק (להלן: הסכסוך).,כתב האישום המתוקן 
"ת""פ 32731-05-18",מ.ו.,כתב האישום המתוקן 
"ת""פ 32731-05-18","(להלן: המתלונן), הוא חתנו של אחד מבעלי תחנות הדלק ותושב הכפר נחף.",כתב האישום המתוקן 
"ת""פ 32731-05-18","צוין, כי בינו לבין הנאשם, שהינו תושב ג'דיידה-מכר, לא היתה היכרות מוקדמת.",כתב האישום המתוקן 
"ת""פ 32731-05-18","על רקע הסכסוך, ביום 9.4.18 בסביבות השעה 23:30, הגיע הנאשם יחד עם אחר שזהותו אינה ידועה (להלן: האחר), סמוך לבית המתלונן (להלן: הבית) כשהם רכובים על אופנוע השייך לנאשם מסוג ימאהה R6 ל.ז. 1057357 (להלן: האופנוע).",כתב האישום המתוקן 
"ת""פ 32731-05-18","הנאשם נהג באופנוע ואילו האחר ישב מאחור, כשהם נושאים ומובילים אקדח טעון ורימון הלם (להלן: האקדח והרימון).",כתב האישום המתוקן 
"ת""פ 32731-05-18","הנאשם עצר את האופנוע בסמוך לבית המתלונן ואז האחר השליך לעבר הבית את רימון ההלם, ירה באמצעות האקדח מספר יריות לעבר הבית ומיד לאחר מכן נמלטו השניים מהמקום.",כתב האישום המתוקן 
"ת""פ 32731-05-18",הכדורים שנורו פגעו בחנות פרחים שבבעלות המתלונן הממוקמת בקומה התחתונה של הבית והסבו נזקים לחנות.,כתב האישום המתוקן 
"ת""פ 32731-05-18","המתלונן, ששהה אותה עת בעסק סמוך והבחין במתרחש נכנס לרכבו מסוג יונדאי והחל במרדף אחר האופנוע (להלן: המרדף).",כתב האישום המתוקן 
"ת""פ 32731-05-18","במהלך המרדף עצר הנאשם את האופנוע לזמן קצר, האחר ירד מהאופנוע נכנס לרכב מסוג ""באגי"" ונמלט מהמקום לעבר שטח חקלאי.",כתב האישום המתוקן 
"ת""פ 32731-05-18","הנאשם המשיך ברכיבה על גבי האופנוע כאשר המתלונן דולק אחריו עד שבסמוך לצומת דיר אל אסד, פגע המתלונן באמצעות רכבו באופנוע ונסע מהמקום.",כתב האישום המתוקן 
"ת""פ 32731-05-18","בעקבות הפגיעה, הנאשם נפל מהאופנוע ונחבל.",כתב האישום המתוקן 
"ת""פ 32731-05-18",כתב האישום הוגש בחודש 5/18.,תקציר ההליכים בתיק והבהרות לגבי חלקו של הנאשם
"ת""פ 32731-05-18",משום כפירת הנאשם במיוחס לו נקבע התיק לשמיעת ראיות.,תקציר ההליכים בתיק והבהרות לגבי חלקו של הנאשם
"ת""פ 32731-05-18","בדיון מיום 21.10.18 ולאחר שנשמעו 2 עדי תביעה, הודיעו הצדדים על הסדר הטיעון שפורט לעיל.",תקציר ההליכים בתיק והבהרות לגבי חלקו של הנאשם
"ת""פ 32731-05-18","הנאשם הודה במיוחס לו, הורשע, ושירות המבחן התבקש להכין לגביו תסקיר.",תקציר ההליכים בתיק והבהרות לגבי חלקו של הנאשם
"ת""פ 32731-05-18",גרסת הנאשם בפני שירות המבחן היתה כי לא היה מודע לכך כי האחר נשא עמו את כלי הנשק.,תקציר ההליכים בתיק והבהרות לגבי חלקו של הנאשם
"ת""פ 32731-05-18",הנאשם הוסיף כי הדבר התחוור לו רק כאשר האחר ירה לעבר בית המתלונן והשליך את רימון ההלם.,תקציר ההליכים בתיק והבהרות לגבי חלקו של הנאשם
"ת""פ 32731-05-18","על רקע גרסה זו של הנאשם, עליה חזר גם במהלך הדיון מיום 3.2.19, ביטלתי את הרשעתו.",תקציר ההליכים בתיק והבהרות לגבי חלקו של הנאשם
"ת""פ 32731-05-18","בהמשך, בדיון מיום 24.2.19 ביקש הנאשם, בשנית, להודות בעובדות כתב האישום המתוקן וציין כי ""..",תקציר ההליכים בתיק והבהרות לגבי חלקו של הנאשם
"ת""פ 32731-05-18","בנוסף, ומשום הערפל המסוים שעלה מהאופן שבו נוסח כתב האישום המתוקן, הבהירה המאשימה את עמדתה בהקשר להיקף אחריות הנאשם למעשי האחר.",תקציר ההליכים בתיק והבהרות לגבי חלקו של הנאשם
"ת""פ 32731-05-18","בדיון מיום 24.2.19 מסר בא כוח המאשימה כי: ""אנו לא מייחסים לנאשם כל עבירה מלבד עבירת הנשק.",תקציר ההליכים בתיק והבהרות לגבי חלקו של הנאשם
"ת""פ 32731-05-18","איננו טוענים כי הנאשם הוא זה שירה בכלי הנשק או שהשליך את הרימון או שיש לו אחריות משפטית מכוח דיני השותפות לאותו ירי ולאותה השלכת רימון"", וגם בישיבת הטיעונים לעונש מיום 26.2.19 הובהרו הדברים כך:""...",תקציר ההליכים בתיק והבהרות לגבי חלקו של הנאשם
"ת""פ 32731-05-18","הנאשם בן 34 שנים, תושב מאכר, גרוש ואב לשני ילדים קטנים.",תסקיר שירות המבחן 
"ת""פ 32731-05-18","לדבריו סיים 12 שנות לימוד, לאחר מכן החל בלימודי רפואה אך הפסיק כעבור מספר חודשים משום שנפצע בתאונת דרכים ונזקק לשיקום רפואי ממושך.",תסקיר שירות המבחן 
"ת""פ 32731-05-18",הנאשם מסר כי עבד במהלך השנים במספר מקומות עבודה.,תסקיר שירות המבחן 
"ת""פ 32731-05-18","צוין כי הנאשם נעדר הרשעות קודמות, הגם שבשנת 2016 הסתיים כנגדו באי הרשעה הליך בו הואשם בהפרעה לשוטר במילוי תפקידו (אירוע משנת 2006).",תסקיר שירות המבחן 
"ת""פ 32731-05-18","כפי שפורט לעיל, הנאשם לא לקח אחריות על מעשיו בפני קצינת המבחן ומסר כי לא היה מודע לנשיאת כלי הנשק על ידי האחר.",תסקיר שירות המבחן 
"ת""פ 32731-05-18","שירות המבחן התרשם מהנאשם כבעל יכולות קוגנטיביות וורבליות טובות, שמתקשה בהפעלת שיקול דעת ובהצבת גבולות.",תסקיר שירות המבחן 
"ת""פ 32731-05-18","משום אי לקיחת האחריות והיעדר ביטוי לנזקקות טיפולית, הומלץ על ענישה מרתיעה בדמות  מאסר מאחורי סורג ובריח.",תסקיר שירות המבחן 
"ת""פ 32731-05-18",מטעם המאשימה הוגש גיליון הרישום הפלילי בדבר ההליך שצוין לעיל וכן פלט עבירות התעבורה שאינו רלוונטי לענייננו.,ראיות הצדדים לעונש
"ת""פ 32731-05-18","עוד הוגש פלט רישום בעלויות לגבי האופנוע, ממנו עלה כי במועד הרלוונטי הנאשם היה בעליו הרשום.",ראיות הצדדים לעונש
"ת""פ 32731-05-18",מטעם הנאשם לא הוגשו ראיות לעונש.,ראיות הצדדים לעונש
"ת""פ 32731-05-18","המאשימה עמדה על חומרת מעשי הנאשם והפנתה לערכים החברתיים המוגנים שנפגעו בענייננו - שמירה על שלום הציבור ובטחונו, חייו וקניינו.",תמצית טיעוני המאשימה לעונש
"ת""פ 32731-05-18","נטען, כי בשנים האחרונות התרבו עבירות האלימות המבוצעות באמצעות כלי נשק, והדבר הינו נגזרת של החזקת כלי נשק בידי גורמים אשר אינם מורשים ומיומנים בהחזקה ובשימוש בנשקים.",תמצית טיעוני המאשימה לעונש
"ת""פ 32731-05-18","נטען שיש להחמיר עם מי שמורשע בעבירות בנשק, כדי להביא לצמצום תופעה עבריינית זו וכדי להרתיע את הפרט והכלל.",תמצית טיעוני המאשימה לעונש
"ת""פ 32731-05-18","באשר לנסיבות ביצוע העבירה, הפנתה המאשימה לנזק שנגרם מביצוע העבירה הגם שהנאשם לא היה מודע לתוכניות האחר.",תמצית טיעוני המאשימה לעונש
"ת""פ 32731-05-18",הודגש כי כלי הנשק ששימש לביצוע העבירה לא נתפס וכן נטען כי יש לזקוף לחובת הנאשם את העובדה כי מילט את האחר לאחר אירוע הירי.,תמצית טיעוני המאשימה לעונש
"ת""פ 32731-05-18","לאחר שהפנתה לפסיקה המשקפת לטענתה את מדיניות הענישה הנוהגת במקרים דומים ועל בסיס כל הנתונים לעיל, עתרה המאשימה למתחם ענישה בין 2 ל 4.5 שנות מאסר בפועל.",תמצית טיעוני המאשימה לעונש
"ת""פ 32731-05-18","בגדרי מתחם זה, נטען כי יש למקם את עונשו על הרף האמצעי.",תמצית טיעוני המאשימה לעונש
"ת""פ 32731-05-18","בנוסף למאסר על תנאי, קנס ופיצוי המתלונן, עתרה המאשימה לחלט את האופנוע לטובת אוצר המדינה, מכוח סעיף 39 לפקודת סדר הדין הפלילי (מעצר וחיפוש) [נוסח חדש], תשכ""ט - 1969, מאחר והאופנוע שימש לביצוע העבירה.",תמצית טיעוני המאשימה לעונש
"ת""פ 32731-05-18",בא כוח הנאשם טען כל שלאל ידו על מנת להקהות מחומרת האירוע.,תמצית טיעוני הנאשם לעונש ודבר הנאשם טרם גזר הדין
"ת""פ 32731-05-18","הודגש, כי הנאשם אמנם ידע והסכים לכך שהאחר נשא עמו אקדח ורימון הלם, אך לא הייתה לו ידיעה אודות כוונות האחר לירות לעבר ביתו של המתלונן.",תמצית טיעוני הנאשם לעונש ודבר הנאשם טרם גזר הדין
"ת""פ 32731-05-18","הודגש, כי הנאשם הורשע בעבירת הנשק מכוח דיני השותפות, הגם שאין מחלוקת שלא הוא זה שנשא פיזית את כלי הנשק או עשה בהם שימוש.",תמצית טיעוני הנאשם לעונש ודבר הנאשם טרם גזר הדין
"ת""פ 32731-05-18","לכן, הגם שאין חולק אודות אחריותו המשפטית לעבירה זו, נסיבות ביצוע העבירה ממקמות את העבירה ברף חומרה נמוך.",תמצית טיעוני הנאשם לעונש ודבר הנאשם טרם גזר הדין
"ת""פ 32731-05-18","ביחס למדיניות הענישה הנוהגת, הפנה ב""כ הנאשם לפסיקה המייצגת לשיטתו את מדיניות הענישה במקרים דומים, ועתר לקביעת מתחם הנע בין 6 ל 14 חודשי מאסר בפועל.",תמצית טיעוני הנאשם לעונש ודבר הנאשם טרם גזר הדין
"ת""פ 32731-05-18","באשר לנסיבות שאינן קשורות בביצוע העבירה, ב""כ הנאשם הפנה לנתונים שעלו בתסקיר שירות המבחן אודות הנאשם - גילו הצעיר, היותו אב לשני ילדים קטנים, העדר עבר פלילי (למעט ההליך שתואר לעיל) ותפקודו התקין עד להסתבכותו הנוכחית.",תמצית טיעוני הנאשם לעונש ודבר הנאשם טרם גזר הדין
"ת""פ 32731-05-18","נטען, כי שליחתו למאסר מאחורי סורג ובריח עלולה להביא לפגיעה קשה בנאשם ובמשפחתו.",תמצית טיעוני הנאשם לעונש ודבר הנאשם טרם גזר הדין
"ת""פ 32731-05-18","עוד נטען, כי יש לזקוף לזכותו את הודייתו בכתב אישום מתוקן בשלב מוקדם, שמעבר לחיסכון בזמן שיפוטי יש בה כדי לבטא הכאה על חטא והפנמת חומרת מעשיו.",תמצית טיעוני הנאשם לעונש ודבר הנאשם טרם גזר הדין
"ת""פ 32731-05-18",לא בכדי הבאתי לעיל את השתלשלות ההליך ואת הבהרות המאשימה בהקשר לחלקו של הנאשם.,דיון ומסקנות
"ת""פ 32731-05-18","הנאשם הורשע ""רק"" בעבירה של הובלת ונשיאת נשק, אך ניתן היה לפרש את עובדות כתב האישום המתוקן כמייחסות לו, לכאורה, אחריות גם לעצם הירי והשלכת הרימון.",דיון ומסקנות
"ת""פ 32731-05-18","אלמלא ההבהרות, ניתן היה לפרש את עובדות כתב האישום ככאלה המייחסות לנאשם, לכל הפחות, (גם) עבירת סיוע לאחֵר - אותו הרכיב על האופנוע (ואכן, כתב האישום המקורי ייחס לנאשם גם עבירות של ירי בשטח בנוי והיזק בזדון).",דיון ומסקנות
"ת""פ 32731-05-18","זאת ועוד, מטיעוני המאשימה בכתב שהוגשו בפתח ישיבת הטיעונים לעונש ניתן היה להבין שהיא אכן מייחסת לנאשם אחריות (גם) לירי ולהשלכת רימון ההלם, על אף שלא יוחסה כל עבירה בהקשר זה.",דיון ומסקנות
"ת""פ 32731-05-18","בכל אופן, הבהרות המאשימה הבהירו את העניין, ובכך נתחמה ונחתמה הגדר העובדתית והמשפטית.",דיון ומסקנות
"ת""פ 32731-05-18","כפי שצוין: ""מן הראוי שבית המשפט הגוזר את עונשו של נאשם שהודה בכתב אישום לצורך הסדר טיעון, לא יעשה שימוש בפרטים ועובדות שאינם נכללים במפורש בכתב האישום"" (ע""פ 329/13 ורגס נ' מדינת ישראל, 9.3.14; וכן ר' ער""ם 2950/08  עיריית חיפה נ' ויסמן, 22.5.2008, פסקה ח').",דיון ומסקנות
"ת""פ 32731-05-18","חרף התמיהות העולות באופן טבעי למקרא כתב האישום המתוקן בדבר ידיעת הנאשם אודות כוונות האחר, אין בפניי אלא את עובדות כתב האישום המתוקן, את העבירה בה הורשע ואת הבהרות המאשימה.",דיון ומסקנות
"ת""פ 32731-05-18","אפנה בהקשר זה לע""פ 9702/16 אבו אלוליאיה נ' מדינת ישראל (13.9.17), באותו מקרה צוינה בכתב האישום המתוקן גרסת הנאשם אודות מציאת כלי נשק בתיק בצד הדרך ובאשר לכוונותיו לאחר שמצא את התיק.",דיון ומסקנות
"ת""פ 32731-05-18","בית המשפט העליון העלה תמיהותיו אודות גרסת המערער שאף כונתה כ""מדרש פליאה"", אך חרף זאת נקבע כי ""לתהיות והערכות אלה אין מקום בקביעת מתחם העונש ההולם – וזאת שעה שמדובר בהודאה במסגרתו של הסדר טיעון.",דיון ומסקנות
"ת""פ 32731-05-18","ולענייננו, חרף התמיהות שכאמור אינן רלוונטיות עוד, האירוע בענייננו נחלק למספר חלקים: בחלק הראשון - שהנאשם נושא לגביו באחריות – הוא הרכיב את האחר על האופנוע לאחר שידע והסכים כי האחר נושא עמו אקדח ורימון הלם.",דיון ומסקנות
"ת""פ 32731-05-18","בעצם הסכמתו להרכיב את האחר, בנתונים לעיל, הפך הנאשם כמבצע בצוותא לעבירות הנשק.",דיון ומסקנות
"ת""פ 32731-05-18","כאמור, על פי נתוני כתב האישום המתוקן והבהרות המאשימה, הנאשם לא היה מודע לתוכניות האחר ואינו שותף למעשיו של האחר אשר ירה לעבר בית המתלונן והשליך את רימון ההלם.",דיון ומסקנות
"ת""פ 32731-05-18","בנוסף, כנסיבה לחומרה לחובת הנאשם עומדת העובדה כי הוא מילט את האחר בנסיבות שתוארו בכתב האישום המתוקן.",דיון ומסקנות
"ת""פ 32731-05-18","באותו שלב היה הנאשם, מטבע הדברים, מודע למעשיו של האחר.",דיון ומסקנות
"ת""פ 32731-05-18",הערכים החברתיים המוגנים שנפגעו בענייננו הינם השמירה על ערך החיים וביטחון הציבור.,דיון ומסקנות
"ת""פ 32731-05-18",הנאשם החזיק נשק שלא כדין ונשא אותו כשהוא נוסע עם אחר באופנוע.,דיון ומסקנות
"ת""פ 32731-05-18","החזקת ונשיאת נשק ללא היתר טומנת בחובה סכנה ממשית שמא אותו הנשק יגיע לידיים לא זהירות או שיעשה שימוש פלילי בנשק ובכך ייגרם נזק ממשי חמור, החל בנזק לרכוש וכלה בנזק לגוף, עד כדי גרימת מוות.",דיון ומסקנות
"ת""פ 32731-05-18","זאת ועוד, עצם החזקת נשק באופן שאינו מפוקח על ידי הרשויות טומן בחובו סיכון פן המחזיק בו יתפתה לעשות בו שימוש, ולו ברגעי לחץ ופחד (ר' ע""פ 4945/13 מדינת ישראל נ' סלימאן (19.1.14); ע""פ 3300/06 אבו סנינה נ' מדינת ישראל (10.8.06)).",דיון ומסקנות
"ת""פ 32731-05-18","בענייננו, סיכון זה אף התממש ונעשה שימוש בנשק, הגם שלא על ידי הנאשם עצמו, ונגרמו כאמור נזקים לרכוש.",דיון ומסקנות
"ת""פ 32731-05-18","על כן, במכלול נסיבות האירוע, משום החזקת שני כלי נשק יחדיו, סבורני כי מידת הפגיעה בערכים המוגנים הינה במידה בינונית.",דיון ומסקנות
"ת""פ 32731-05-18","מדיניות הענישה הכללית הנוהגת בעבירות נשק היא כי יש להשית עונשים ממשיים ומרתיעים וזאת משום החומרה הטמונה בעבירות אלה, משום שיקולי ההלימה וההרתעה וכדי לצמצם את היקף התופעה הרעה של ההחזקה והשימוש בכלי נשק לא חוקיים (ור' לדוגמה בהקשר זה האמור בע""פ 135/17 מדינת ישראל נ' בסל (8.3.17); ע""פ 4215/18 ח'טיב נ' מדינת ישראל (8.7.18)).",דיון ומסקנות
"ת""פ 32731-05-18","עם זאת, כל מקרה ונסיבותיו הקונקרטיות ובהקשר זה יש להתחשב בסוג הנשק, מאפייני הנשיאה (משך הנשיאה, מקום הנשיאה), מטרת הנשיאה, (וראה האמור בע""פ 1323/13 חסן נ' מדינת ישראל (5.6.13)) ובהקשר זה עמדתי לעיל על נסיבות המקרה שבפנינו.",דיון ומסקנות
"ת""פ 32731-05-18","אביא להלן פסיקה במקרים הדומים בנסיבותיהם, בשינויים המחויבים, לענייננו.",דיון ומסקנות
"ת""פ 32731-05-18","בע""פ 2398/14 אלהזייל נ' מדינת ישראל (8.7.2014) החזיק המערער ברכבו אקדח, מחסנית וכדורים.",דיון ומסקנות
"ת""פ 32731-05-18","נקבע מתחם בין 10 ל 24 חודשי מאסר והמערער נדון ל 13 חודשי מאסר (הודה, בן 29 ואב ל 3 ילדים, לחובתו עבר פלילי הגם שלא ריצה מאסר בפועל, את הנשק החזיק בעת שריצה עבודות שירות, תסקיר שאינו חיובי).",דיון ומסקנות
"ת""פ 32731-05-18",הערעור על חומרת העונש נדחה.,דיון ומסקנות
"ת""פ 32731-05-18","בע""פ 4982/15 שחיטה נ' מדינת ישראל (3.9.15) נהג המערער ברכב בו הסתיר אקדח ומחסנית בפתחי האוורור של הרכב.",דיון ומסקנות
"ת""פ 32731-05-18",המערער הורשע בהובלת כלי נשק.,דיון ומסקנות
"ת""פ 32731-05-18","נקבע מתחם בין 12 ל 36 חודשי מאסר והושת עונש מאסר בן 20 חודשים (הודה, אב לשמונה ילדים, לחובתו עבר לא מכביד).",דיון ומסקנות
"ת""פ 32731-05-18",בית המשפט העליון הקל מעט ברכיב המאסר והעמידו על 16 חודשים.,דיון ומסקנות
"ת""פ 32731-05-18","בע""פ 9702/16 אבו אלוליאיה נ' מדינת ישראל (13.9.17) שהוזכר לעיל, טען המערער שהבחין באדם זורק תיק בצד הדרך, המערער נטל עמו את התיק שהכיל תת מקלע ותחמושת והחביאו בביתו למשך חצי שנה.",דיון ומסקנות
"ת""פ 32731-05-18",בגין כך הורשע בהובלת נשק ותחמושת.,דיון ומסקנות
"ת""פ 32731-05-18","בית המשפט המחוזי קבע מתחם בין 14 ל 36 חודשי מאסר וגזר 18 חודשי מאסר (הודה, אורח חיים נורמטיבי, עבר שאינו מכביד).",דיון ומסקנות
"ת""פ 32731-05-18","צוין כי ניתן היה לקבוע מתחם מתון יותר שבין 10 ל 30 חודשי מאסר, אך דעת הרוב סברה שאין מקום להתערב בעונש.",דיון ומסקנות
"ת""פ 32731-05-18","בע""פ 3047/17 מוסטפא נ' מדינת ישראל (8.2.18), הוביל המערער תת מקלע מאולתר ומחסנית במונית מחברון לירושלים.",דיון ומסקנות
"ת""פ 32731-05-18","בית המשפט המחוזי קבע מתחם בין 10 ל 30 חודשי מאסר והנאשם נדון ל 10 חודשי מאסר (הודה, תסקיר חיובי, לחובתו עבר שאינו מכביד, ניתן משקל לשיהוי של כשנתיים בהגשת כתב האישום).",דיון ומסקנות
"ת""פ 32731-05-18",בית המשפט העליון הגדיר את העונש כמתון ודחה את הערעור על חומרת העונש.,דיון ומסקנות
"ת""פ 32731-05-18","בע""פ 3336/18 מדינת ישראל נ' סמארה (29.11.18) נדון עניינו של מי שהוביל ברכבו שני תתי מקלע ""קרל גוסטב"" וכן תחמושת.",דיון ומסקנות
"ת""פ 32731-05-18",המשיב עצר את רכבו רק לאחר מרדף.,דיון ומסקנות
"ת""פ 32731-05-18","בית המשפט המחוזי קבע מתחם בין 16 ל 40 חודשי וגזר על המשיב 18 חודשי מאסר בפועל (הודה במהלך שמיעת ראיות, תסקיר חיובי, עבר פלילי ישן).",דיון ומסקנות
"ת""פ 32731-05-18",בית המשפט העליון קיבל את הערעור על קולת העונש והעמידו על 24 חודשי מאסר תוך שהודגשה המגמה לפיה יש להחמיר בעבירות מסוג זה.,דיון ומסקנות
"ת""פ 32731-05-18","לאחר שנתתי דעתי לערכים החברתיים המוגנים ואת מידת הפגיעה בהם, לנסיבות ביצוע העבירה ולמדיניות הענישה הנוהגת, אני קובע את מתחם העונש ההולם בין 12 ל 36 חודשי מאסר.",דיון ומסקנות
"ת""פ 32731-05-18","עיקר הנתונים צוינו לעיל: מחד, הנאשם נשא והוביל שני כלי נשק – אקדח ורימון הלם.",דיון ומסקנות
