verdict,text,part
ME-20-09-5778-327,"גישה מקלה יותר ניתן למצוא בת""פ (ת""א) 22611-02-17 מ""י נ' מרדוש [פורסם בנבו] (17.5.18), שם הורשע הנאשם בהחזקת 1.085 ק""ג מהסם הנ""ל, שלא לצריכה עצמית, ונקבע מתחם ענישה של 6 עד 18 חודשי מאסר בפועל. לאור העובדה כי לאחר מועד ביצוע העבירה קיבל הנאשם רישיון לשימוש בקנאביס רפואי ועל רקע מחלותיו הקשות, נגזר על הנאשם עונש מאסר על תנאי בלבד.",דיון והכרעה:
ME-20-09-5778-327,"עוד ראוי להזכיר את ת""פ (ב""ש) 53457-11-15 מ""י נ' איסטחרוב [פורסם בנבו] (27.6.16), שם הושתו, במסגרת הסדר טיעון ""סגור"", 30 חודשי מאסר בפועל על בחור צעיר אשר הורשע בהחזקה שלא לשימוש עצמי של 21.25 ק""ג של סם מסוג AB-CHMINACA, המהווה גם כן נגזרת של אינדזול קרבוקסאמיד. ",דיון והכרעה:
ME-20-09-5778-327,"ב""כ המאשימה הפנה בטיעוניו לפסיקה מכבידה יותר, במסגרתה נקבעו מתחמי ענישה והושתו עונשי מאסר ממושכים בגין עבירות שבוצעו ב""סמי פיצוציה"". כך למשל, בע""פ 4623/07 מ""י נ' אזרי [פורסם בנבו] (31.10.07), גזר ביהמ""ש המחוזי 3 שנות מאסר בגין החזקת כ-9 ק""ג קאתינון, הידוע גם כ""חגיגת"", ואילו ביהמ""ש העליון החמיר את העונש ל-4.5 שנות מאסר. בעניין יהודה שכבר הוזכר, הושתו עונשי מאסר בני 30 ו-42 חודשים בגין יבוא של ""סם פיצוציות"" המכיל קאתינון, אשר ביטאו את הרף התחתון של מתחמי הענישה שנקבעו על ידי בית המשפט. עוד אזכיר את ת""פ (חי') 46018-03-14 מ""י נ' טרסוב [פורסם בנבו] (24.2.15), שם נקבעו מתחמים של 18 עד 56 חודשי מאסר בגין ייבוא של 100 גרם ושל 12 עד 48 חודשי מאסר בגין החזקה של 6 גרם של סם מסוכן מסוג JWH-210. החלטות אלה אינן ניתנות ליישום ישיר על ענייננו, בשים לב להכרח להתאים את מתחמי הענישה לטיבו הספציפי של הסם המדובר, מאפייניו והשפעותיו, כאמור בעניין יהודה, אך הן מבטאות היטב את הנחיות ביהמ""ש העליון בדבר ענישה מרתיעה והולמת, ובמיוחד בשים לב לכך שמאז הכללתו של הסם לפקודה חלפו כמעט 7 שנים, ואין מדובר עוד במקרים ראשונים של אכיפה. ",דיון והכרעה:
ME-20-09-5778-327,"אם נפנה כעת ליישום ההלכות והעקרונות המנחים על המקרה שלפנינו, הרי שבעניינו של הנאשם מתקיימות, כפי שציין התובע, מספר בלתי מבוטל של נסיבות לחומרה. הנאשם חבר לאחר וביחד פעלו לייבא כשני ק""ג של קנבינואיד סינטטי, מתוך תכנון וסיכום מוקדם. חלקו של הנאשם במעשים משמעותי שכן הוא שתיאם את קבלת הסם והיה אמור להחזיק בו. לא זו אף זו, בביתו החזיק הוא כמות גדולה נוספת מאותו סם ממש, כארבעה ק""ג, וכן קילוגרם נוסף של סם מסוג קנבוס. מדובר אפוא במי שייבא סם שמסוכנותו ניכרת, והחזיק בביתו כמויות מסחריות משני סוגים שונים של סם, באופן המעיד על מעורבות עמוקה בעולם הסמים. הנזק שעלול היה להיגרם כתוצאה מהפצתם של סמים אלה לציבור הישראלי היה משמעותי, וכך היא גם עצמת הפגיעה של מעשיו של הנאשם בערכים המוגנים שפורטו לעיל. על רקע מכלול נסיבות אלה, ובשים לב לסוגי הסמים, לכמות הסם ולשילוב שבין עבירות הייבוא וההחזקה, אני סבור כי ראוי לקבוע  מתחם עונש הולם הנע בין 27 ל-54 חודשי מאסר בפועל.",דיון והכרעה:
ME-20-09-5778-327,"באשר לסיבות שאינן קשורות בביצוע העבירה, הרי שמדובר באדם כבן 41, אשר הודה במיוחס לו, נטל אחריות וחסך זמן ציבורי ניכר. מדברי בא כוחו עולה כי נסיבות חייו אינן פשוטות וכי גורלו לא שפר עליו. נתונים אלה יביאו למיתון העונש שיושת על הנאשם וימנעו את מיצוי מלוא כובד הדין עמו. עם זאת, לא ניתן להתעלם מהעובדה כי לחובת הנאשם עבר פלילי רלבנטי, אשר אינו מאפשר למקם את עונשו בחלק התחתון של המתחם. עיון בגיליון ההרשעות הקודמות שלו מלמד כי לחובתו מספר לא מבוטל של הרשעות, בעיקר בתחום עבירות האלימות. הרשעות אלו לבדן אולי לא היו מצדיקות החמרה של ממש עם הנאשם, שהרי מדובר כיום בעבירות סמים ולא בעבירות אלימות, אלא שהרשעתו האחרונה מחודש מאי 2016 עוסקת כל כולה בעבירות סמים חמורות, לרבות תיווך בסם מסוכן ועבירות של סחר וסיוע לסחר בסם. בגין הרשעה זו נדון ל-15 חודשי מאסר בפועל, אך בעונש שהושת עליו לא היה כדי להרתיעו ולמנוע את חזרתו לביצוע עבירות דומות בחלוף שנים אחדות בלבד מאז שוחרר ממאסרו הקודם.",דיון והכרעה:
ME-20-09-5778-327,"במסגרת ההליך שלפני לא הופנה הנאשם לקבלת תסקיר, ולא הוצג כל מסמך או חוות דעת שבכוחם להצביע על שינוי באורחותיו של הנאשם או על הפחתת הסיכון הנשקף לציבור מצידו. בנסיבות אלה יש למקם את עונשו מעט מתחת לאמצע מתחם העונש ההולם שנקבע, לצד מאסר על תנאי וקנס כספי, אשר ייקח בחשבון את עונש המאסר הממושך ואת היכולות הכלכליות הדלות.",דיון והכרעה:
ME-20-09-5778-327,אשר על כן אני גוזר על הנאשם את העונשים הבאים:,דיון והכרעה:
ME-20-09-5778-327,"36 חודשי מאסר בפועל, מיום המעצר – 24.8.20. ",דיון והכרעה:
ME-20-09-5778-327,"12 חודשי מאסר על תנאי, והתנאי הוא כי במשך 3 שנים מיום שחרורו לא יעבור הנאשם כל עבירה מסוג פשע על פקודת הסמים.",דיון והכרעה:
ME-20-09-5778-327,"6 חודשי מאסר על תנאי, והתנאי הוא כי במשך 3 שנים מיום שחרורו מהמאסר לא יעבור הנאשם כל עבירה מסוג עוון על פקודת הסמים המסוכנים.",דיון והכרעה:
ME-20-09-5778-327,"קנס בסך 8,000 ₪ או 80 ימי מאסר תמורתו. הקנס ישולם ב-10 תשלומים חודשיים, שווים ורצופים, החל מיום 14.9.21.",דיון והכרעה:
ME-20-09-5778-327,"ניתן היום,  כ""ו תמוז תשפ""א, 06 יולי 2021, במעמד הצדדים.",54678313
ME-20-09-5778-327,נוסח מסמך זה כפוף לשינויי ניסוח ועריכה,חגי טרסי 54678313
ME-20-09-5778-327,"בעניין עריכה ושינויים במסמכי פסיקה, חקיקה ועוד באתר נבו – הקש כאן",חגי טרסי 54678313
