verdict,text,part
SH-17-03-34607-993,"ת""פ (אשדוד) 44292-05-10 מדינת ישראל נגד אלכסיי גלינובסקי [פורסם בנבו] (09.02.12), הנאשם הודה והורשע בעבירות עסקה אחרת בסם והחזקת סמים שלא לצריכה עצמית. בית המשפט כיבד הסדר טיעון אליו הגיעו הצדדים והאריך מאסר מותנה שעמד לחובתו של הנאשם למשך 4 חודשים, מאסר על תנאי, קנס, התחייבות, צו פיקוח לשנה ופסילת רישיון על תנאי.",מדיניות הענישה
SH-17-03-34607-993,"ת""פ (אשדוד) 1358-05-11 מדינת ישראל נגד יאן מטטוב [פורסם בנבו] (10.09.12), נאשם מס' 4 הודה והורשע בביצוע עבירת עסקה אחרת בסם. בית המשפט גזר עליו 4 חודשי מאסר לריצוי בדרך של עבודות שרות, מאסר על תנאי, קנס ופסילה על תנאי.",מדיניות הענישה
SH-17-03-34607-993,"ת""פ (כפר סבא) 38654-02-13 מדינת ישראל נגד מאגד שלוף [פורסם בנבו] (05.03.14), הנאשם הודה והורשע בעבירות החזקת סמים שלא לצריכה עצמית וניסיון לעסקה אחרת בסם. בית המשפט גזר עליו 6 חודשי מאסר בפועל ועונשים נלווים.",מדיניות הענישה
SH-17-03-34607-993,"ת""פ (אשדוד) 33759-07-12 מדינת ישראל נגד ודים אזימוב [פורסם בנבו] (13.02.13), הנאשם הודה והורשע בעבירת עסקה אחרת בסם. בית המשפט כיבד הסדר טיעון אליו הגיעו הצדדים וגזר עליו חודשיים מאסר בפועל לריצוי בדרך של עבודות שרות, שני מאסרים על תנאי והתחייבות.",מדיניות הענישה
SH-17-03-34607-993,"ת""פ (עכו) 39589-07-13 מדינת ישראל נגד קנאר אסדי [פורסם בנבו] (16.10.13), הנאשם מכר לסוכן משטרתי בשתי הזדמנויות שונות סם מסוג חשיש, פעם אחת - בכמות של 1.34 גרם ובנוסף 5 טבליות MDPV  ובפעם השנייה – 5.44 גרם חשיש ו-10 טבליות MDPV. לנאשם שתי הרשעות קודמות בעבירות סמים. בית המשפט גזר עליו 10 חודשי מאסר בפועל, מאסר על תנאי וקנס.",מדיניות הענישה
SH-17-03-34607-993,"ת""פ (תל אביב-יפו) 52916-07-10 מדינת ישראל נגד אנגל פוקס ואח' [פורסם בנבו] (07.06.12), נאשם 1, בעל עבר פלילי, הורשע בעבירה של סחר בסם מסוכן מסוג חשיש במשקל 18 גרם. בית המשפט גזר עליו 6 חודשי מאסר על תנאי, קנס ופסילת רישיון נהיגה על תנאי. נאשם 2 – הורשע בעבירה של סחר בסם ובעבירה של החזקת סם לצריכה עצמית. לחובתו 4 הרשעות קודמות. בית המשפט גזר עליו מאסר על תנאי, קנס ופסילה על תנאי מלהחזיק רישיון רכב.",מדיניות הענישה
SH-17-03-34607-993,"ת""פ (רמלה) 48125-05-11 מדינת ישראל נגד אבי ספיבק [פורסם בנבו] (11.11.12), הנאשם הורשע בשני אישומים כשבכל אחד מהם יוחס לו סחר בסם מסוכן, במשקל 3.66 גרם ובמשקל של 4.73 גרם. לחובתו עבר פלילי בגין עבירה של היעדרות מו השירות. בית המשפט גזר עליו 6 חודשי מאסר בעבודות שרות.",מדיניות הענישה
SH-17-03-34607-993,"ת""פ (ירושלים) 54706-01-13 מדינת ישראל נגד אברהם חביב [פורסם בנבו] (09.09.13), הנאשם, נעדר עבר פלילי, הורשע בארבעה אישומים של סחר בסם מסוכן, שיבוש שמהלכי משפט ואחזקת סמים לצריכה עצמית. נגזרו עליו 6 חודשי מאסר בפועל לריצוי בדרך של עבודות שרות.",מדיניות הענישה
SH-17-03-34607-993,"ת""פ (ירושלים) 21605-07-13 מדינת ישראל נגד בילאל אל אעסם [פורסם בנבו] (24.11.13), הנאשם, נעדר עבר פלילי, הורשע בשלוש עבירות של סחר בסם מסוכן ובעבירה של החזקת סם לשימוש עצמי. בית המשפט גזר עליו 18 חודשי מאסר בפועל, מאסר על תנאי, פסילה על תנאי והתחייבות.",מדיניות הענישה
SH-17-03-34607-993,"גם בעבירת החזקת סמים שלא לצריכה עצמית ניתנה קשת רחבה של עונשים, המתחשבת, בין היתר, בכמות וסוג הסם. במקרים הדומים לענייננו, אשר עוסקים בסמים מסוג קנאביס או חשיש, נגזרו עונשים החל ממאסרים מותנים, ועד מאסרים קצרים בפועל. ראו לעניין זה את רע""פ 10423/09 ניצר שורר נגד מדינת ישראל [פורסם בנבו] (26.04.10), רע""פ 8374/06 עמיר גילילוב נגד מדינת ישראל [פורסם בנבו] (12.12.06), ע""פ (באר שבע) 39557-01-14 פרג דעיס נגד מדינת ישראל [פורסם בנבו] (30.04.14), ת""פ (רמלה) 42543-06-14 מדינת ישראל נגד קובי בלו [פורסם בנבו] (03.01.16), ת""פ (טבריה) 51933-05-12 מדינת ישראל נגד אלון בוטבול [פורסם בנבו] (27.03.14), ת""פ (פתח תקווה) 37340-06-12 מדינת ישראל נגד ליאור בוחניק [פורסם בנבו] (04.02.14), ת""פ (קריית גת) 12111-12-12 מדינת ישראל נגד אמיר נאסר [פורסם בנבו] (02.09.13),  ת""פ (פתח תקווה) 24156-11-12 מדינת ישראל נגד מור גבריאל [פורסם בנבו] (15.01.13), ת""פ (טבריה) 764-04-09 מדינת ישראל נגד חננאל מורינו ואח' [פורסם בנבו] (25.06.09).",מדיניות הענישה
SH-17-03-34607-993,"לאור כל האמור לעיל ובנסיבותיו של מקרה זה, שנופל בחומרתו מרובם של אירועי ""עסקה אחרת"" בסם שהוזכרו לעיל, אני קובעת כי מתחם העונש ההולם הוא בין מאסר על תנאי ועד 10 חודשי מאסר לריצוי בפועל.",מדיניות הענישה
SH-17-03-34607-993,"בגזירת עונשו של נאשם, בית המשפט רשאי להתחשב בהתקיימות נסיבות שאינן קשורות בביצוע העבירה כמפורט בסעיף 40יא לחוק העונשין, ובלבד שהעונש שייקבע לא יחרוג ממתחם העונש ההולם שנקבע לעיל.",גזירת עונשו של הנאשם
SH-17-03-34607-993,"מדובר בנאשם צעיר בן 23 שנים, הודה במיוחס לו בכתב האישום המתוקן, וחסך מזמנו של בית המשפט.",גזירת עונשו של הנאשם
SH-17-03-34607-993,"הנאשם נעדר עבר פלילי, השתחרר לפני שנה ושמונה חודשים מהצבא.",גזירת עונשו של הנאשם
SH-17-03-34607-993,"תסקיר שרות המבחן היה חיובי במהותו לגבי הנאשם. הנאשם תואר כמי שמנהל אורח חיים מתפקד וכי ההליך המשפטי היווה עבורו גורם מרתיע ומציב גבולות. שרות המבחן העריך כי הנאשם לקח אחריות פורמלית בלבד על מעשיו, יחד עם זאת ביטא צער וחרטה על מעורבותו והבין את הפסול בהם.",גזירת עונשו של הנאשם
SH-17-03-34607-993,"לאור נתוניו החיוביים במהותם של הנאשם, ולאחר שהחלטתי לא לבטל את הרשעתו, החלטתי למקם את עונשו בתחתית המתחם שקבעתי לעיל.",גזירת עונשו של הנאשם
SH-17-03-34607-993,"לאור כל האמור לעיל, אני גוזרת את עונשו של הנאשם כדלקמן:",סוף דבר
SH-17-03-34607-993,"ארבעה חודשי מאסר על תנאי, ואולם הנאשם לא יישא עונש זה אלא אם יעבור במהלך תקופה של שלוש שנים מהיום עבירות לפי פקודת הסמים המסוכנים שעניינן איננו צריכה עצמית בלבד.",סוף דבר
SH-17-03-34607-993,"קנס על סך 1,000 ₪ או 4 ימי מאסר תמורתו. הקנס ישולם עד ליום 10/12/17.",סוף דבר
SH-17-03-34607-993,חודשיים פסילה על תנאי מלקבל ו/או להחזיק רישיון נהיגה. והתנאי הוא שלא יעבור במהלך תקופה של 3 שנים מהיום עבירות לפי פקודת הסמים המסוכנים.,סוף דבר
SH-17-03-34607-993,"חתימה על התחייבות על סך 2,000 ₪, להימנע במהלך תקופה של שלוש שנים מהיום, מלעבור עבירות לפי פקודת הסמים המסוכנים. במידה ולא יחתום כאמור תוך 7 ימים, ייאסר ליומיים.",סוף דבר
SH-17-03-34607-993,"54678313ניתן היום,  י' כסלו תשע""ח, 28 נובמבר 2017, במעמד הנוכחים.",5129371
SH-17-03-34607-993,רות שפילברג כהן 54678313,5129371
SH-17-03-34607-993,נוסח מסמך זה כפוף לשינויי ניסוח ועריכה,5129371
SH-17-03-34607-993,"בעניין עריכה ושינויים במסמכי פסיקה, חקיקה ועוד באתר נבו – הקש כאן",5129371
