verdict,text,part
SH-17-03-34607-993,"פקודת הסמים המסוכנים [נוסח חדש], תשל""ג-1973: סע'  7.א., 7.ג, 13, 19א",חקיקה שאוזכרה: 
SH-17-03-34607-993,מיני-רציו:,"חוק העונשין, תשל""ז-1977: סע'  40יא"
SH-17-03-34607-993,"* בית המשפט גזר על הנאשם שהודה והורשע, במסגרת הסדר טיעון, בביצוע עבירות סמים עונש של מאסר על תנאי, קנס ופסילה מלהחזיק ברישיון נהיגה על תנאי. רף הענישה נקבע בהתחשב בנסיבות הלא מחמירות שאפפו את ביצוע העבירות ובנתוניו החיוביים של הנאשם.","חוק העונשין, תשל""ז-1977: סע'  40יא"
SH-17-03-34607-993,* עונשין – ענישה – מדיניות ענישה: עבירות סמים,"חוק העונשין, תשל""ז-1977: סע'  40יא"
SH-17-03-34607-993,* עונשין – ענישה – מדיניות ענישה: אי-הרשעה,"חוק העונשין, תשל""ז-1977: סע'  40יא"
SH-17-03-34607-993,"הנאשם הודה והורשע, במסגרת הסדר טיעון, בכתב אישום מתוקן שייחס לו עבירות עסקה אחרת בסם, והחזקת סמים מסוכנים שלא לצריכה עצמית. ב""כ המאשימה מבקש להרשיע את הנאשם ומבקש, כי העונש יוגבל ל- 4 חודשי מאסר לריצוי בדרך של עבודות שרות וענישה נלווית. ב""כ הנאשם ביקש לטעון באופן חופשי לעניין העונש.",.
SH-17-03-34607-993,בית המשפט פסק כלהלן:,.
SH-17-03-34607-993,"ככלל, העבירה בה הורשע הנאשם מחייבת הרשעה בדין. בנסיבות העניין, יש להותיר את הרשעתו של הנאשם על כנה.",.
SH-17-03-34607-993,מתחם העונש ההולם הוא בין מאסר על תנאי ועד 10 חודשי מאסר לריצוי בפועל.,.
SH-17-03-34607-993,"לאור נתוניו החיוביים במהותם של הנאשם, ולאחר שהוחלט לא לבטל את הרשעתו, יש למקם את עונשו בתחתית המתחם שנקבע.",.
SH-17-03-34607-993,"הנאשם הודה והורשע, במסגרת הסדר טיעון, בכתב אישום מתוקן שייחס לו עבירות עסקה אחרת בסם - לפי סעיף 13 + 19א לפקודת הסמים המסוכנים (נוסח חדש), תשל""ג-1973 והחזקת סמים מסוכנים שלא לצריכה עצמית – לפי סעיף 7(א) + 7(ג) רישא לפקודת הסמים המסוכנים.",כתב אישום ורקע
SH-17-03-34607-993,"על פי המיוחס לו בכתב האישום המתוקן, ביום 11/3/17 סמוך לשעה 00:30, במהלך מסיבת טבע שהתקיימה ביער הפקאן, סמוך לעיר קריית שמונה, ניגש אל הנאשם שוטר מסווה, ושאל אותו ""אתה יכול לצבוע אותי בפנים"" והנאשם ענה לו בחיוב. בטרם החל הנאשם לצבוע את פני השוטר, שאל אותו השוטר ""יש לך איך לארגן אותי"" והנאשם ענה ""מה אתה רוצה"", השוטר השיב ""אקסטה או בולים מה שיש"", והנאשם אמר לו ""יש לי אקסטה וחצי ואני מוכן למכור רק חצי מהאקסטה"" וכשנשאל בכמה הוא מוכן למכור אותה, ענה ""שבעים שקלים"".",כתב אישום ורקע
SH-17-03-34607-993,"בהמשך, העביר השוטר לנאשם 100 ₪, והנאשם החזיר לו שני שטרות של 20 ₪ כל אחד, תוך שאמר לו ""קח עליי האקסטה ב-60 ₪"" והעביר לשוטר כדור ""אקסטה"" המכיל סם מסוכן שזהותו וכמותו המדויקת אינם ידועים ל מאשימה.",כתב אישום ורקע
SH-17-03-34607-993,"בהמשך, משנעצר הנאשם, זרק מידיו נרתיק לבן שנתפס על ידי השוטרים ובתוכו נמצא 1.23 גרם של סם מסוכן מסוג קנבוס ו- 4.46 גרם של סם מסוכן מסוג חשיש, ועל גופו נמצא השטר בסך 100 ₪ שקיבל מהשוטר.",כתב אישום ורקע
SH-17-03-34607-993,"ביום 7/7/17 הגיעו הצדדים להסדר טיעון לפיו כתב האישום תוקן, הנאשם הודה והורשע והופנה לקבלת תסקיר שרות המבחן, שיבחן, בין היתר, את שאלת ביטול הרשעתו. ב""כ המאשימה הצהיר כי עמדתם היא להרשיע וכי הם מגבילים את עצמם לעונש של 4 חודשי מאסר לריצוי בדרך של עבודות שרות וענישה נלווית, בעוד שב""כ הנאשם יטען באופן חופשי לעניין העונש.",כתב אישום ורקע
SH-17-03-34607-993,"על פי התסקיר, הנאשם רווק בן 23, סיים 12 שנות לימוד, והציג מסמך המעיד על כך שנרשם להשלמת השכלה במרכז הלמידה בכפרו להשלמת בגרות. הנאשם שירת שרות צבאי מלא.",תסקיר שרות המבחן
SH-17-03-34607-993,"הנאשם עובד כשכיר בחברת ""תיא עבודות טרומי"" וכן הנו בעל עסק פרטי להשכרת ציוד לחתונות שפתח בחודש יוני 2017.",תסקיר שרות המבחן
SH-17-03-34607-993,"הנאשם דיווח על  בריאות פיזית ונפשית תקינה, שיתף כי צורך אלכוהול באופן מזדמן בעיקר בנסיבות חברתיות ושלל שימוש בסם. הנאשם ביצע בדיקת שתן שהעידה על ניקיון מסמים.",תסקיר שרות המבחן
SH-17-03-34607-993,הנאשם מסר בפני שרות המבחן כי נחשף לראשונה לסמים במהלך מסיבת הטבע על רקע האווירה ששררה.,תסקיר שרות המבחן
SH-17-03-34607-993,שרות המבחן מסר כי הנאשם נעדר עבר פלילי.,תסקיר שרות המבחן
SH-17-03-34607-993,"בהתייחסו לעבירות – מסר כי הגיע למסיבת הטבע יחד עם חבריו לשעבר מהצבא, וכי רכש את הסם לשימושו העצמי, אך בבילוי החליט כי אינו רוצה לעשות בו שימוש וניסה למכור אותו לסוכן הסמוי.",תסקיר שרות המבחן
SH-17-03-34607-993,"הנאשם מסר כי בעת אירוע העבירה היה תחת השפעת אלכוהול ואינו זוכר פרטים מדויקים על האירוע, אך ציין כי לא הייתה לו כוונה לסחור בסמים ושלל מניעים כלכליים בבסיס התנהגותו.",תסקיר שרות המבחן
SH-17-03-34607-993,"הנאשם מסר כי התנהגותו בעבירה אינה מאפיינת את חייו ואת התנהלותו, ודיווח כי הוריו התקשו לקבלה שכן היא נוגדת את ערכיה של המשפחה. עוד מסר כי פעל ללא שיקול דעת לגבי השלכות מעשיו והוסיף כי פעל באופן אימפולסיבי כשרכש את הסם וגם כשמסר אותו לסוכן וכשהוא תחת השפעת אלכוהול. שרות המבחן התרשם כי הנאשם התקשה להעריך את מורכבות התנהגותו, פעל בחוסר שיקול דעת ובסביבה חברתית בה אין גבולות ברורים נטה לפרוץ את גבולות החוק, וכי מצבים כאלה עלולים להעלות את הסיכון להישנות ביצוע עבירות על ידו.",תסקיר שרות המבחן
SH-17-03-34607-993,"שרות המבחן העריך כי הנאשם קיבל אחריות פורמלית בלבד על מעשיו, הכיר באופן מילולי בעבירות שביצע, הביע צער וחרטה וביטא הבנה ביחס למורכבות התנהגותו, יחד עם זאת תלה את הסתבכותו בגורמים חיצוניים כגון צריכת האלכוהול. הנאשם שלל כוונה לסחור בסמים.",תסקיר שרות המבחן
SH-17-03-34607-993,"שרות המבחן התרשם כי מדובר בנאשם בעל יכולות תפקודיות טובות, אשר שומר על יציבות במסגרות חייו ושביטא שאיפות מקצועיות ולימודיות לעתיד.",תסקיר שרות המבחן
SH-17-03-34607-993,בהערכת סיכויי שיקומו ציין שרות המבחן את התרשמותו כי הנאשם הבין את חומרת התנהגותו וניכר כי ההליך המשפטי היווה עבורו גורם מרתיע וחידד את גבולות החוק עבורו.,תסקיר שרות המבחן
SH-17-03-34607-993,בבחינת גורמי הסיכון מסר שרות המבחן כי מעורבותו בפלילים מעידה על קושי אצל הנאשם בזיהוי מצבי סיכון ומבטאת דפוסים אימפולסיביים וחוסר שיקול דעת.,תסקיר שרות המבחן
SH-17-03-34607-993,"הנאשם הביע בפני שרות המבחן את שאיפותיו להמשיך ללימודים מתקדמים ותיאר פגיעה עתידית שתיגרם לו בתחום התעסוקתי כתוצאה מהרשעתו וכן הביע שאיפה להתגייס למשטרה, יחד עם זאת הוא לא הציג מסמכים קונקרטיים המעידים על פגיעה כאמור ועל כן שרות המבחן לא בא בהמלצה לבטל את הרשעתו.",תסקיר שרות המבחן
SH-17-03-34607-993,הנאשם שלל נזקקות טיפולית ומסר כי מאסר בדרך של עבודות שרות עלול לקטוע את רצף התקדמותו במישור התעסוקתי.,תסקיר שרות המבחן
SH-17-03-34607-993,"שרות המבחן סבר כי הטלת של""צ בהיקף נרחב עשוי להוות עבורו עונש חינוכי הרתעתי והמליץ להטיל עליו צו בהיקף של 350 שעות והתחייבות.",תסקיר שרות המבחן
SH-17-03-34607-993,ביום 22/10/17 טענו הצדדים לעונש.,טיעוני הצדדים לעונש
SH-17-03-34607-993,"טיעוני ב""כ המאשימה",טיעוני הצדדים לעונש
SH-17-03-34607-993,"ב""כ המאשימה התנגד להמלצת שרות המבחן בדבר הטלת 350 שעות של""צ. ב""כ המאשימה התייחס למעשיו של הנאשם לוחומרתם וטען כי הרשעתו של הנאשם בדין לא תשפיע עליו ועל עתידו שכן הוא עובד בעסק להשכרת ציוד לחתונות.",טיעוני הצדדים לעונש
SH-17-03-34607-993,"ב""כ המאשימה ביקש להרשיע את הנאשם ולהטיל עליו 4 חודשי מאסר לריצוי בדרך של עבודות שרות, מאסר על תנאי, קנס ופסילת רישיון נהיגה בפועל ועל תנאי.",טיעוני הצדדים לעונש
SH-17-03-34607-993,"טיעוני ב""כ הנאשם",טיעוני הצדדים לעונש
SH-17-03-34607-993,"ב""כ הנאשם התחיל וציין שהרשום בכתב האישום ""יש לי אקסטה וחצי ואני מוכן למכור רק חצי אקסטה"" מעיד שהחומר היה לשימושו העצמי של הנאשם וכשנשאל מה המחיר, וענה: "" 70 ₪"", ציין את  המחיר בו קנה את הכדור.",טיעוני הצדדים לעונש
SH-17-03-34607-993,"ב""כ הנאשם טען כי האמור בתסקיר שהינו חיובי במהותו עומד בסתירה לכך שלא הומלץ על אי הרשעה.",טיעוני הצדדים לעונש
SH-17-03-34607-993,"ב""כ הנאשם טען כי ההרשעה עלולה לפגוע בתעסוקתו של הנאשם בעתיד ולהפריע להליך שיקומו.",טיעוני הצדדים לעונש
SH-17-03-34607-993,"ב""כ הנאשם ציין כי הנאשם עובד באופן זמני בעסק המשפחתי וכי הוא מתכוון לעבוד באבטחה כסטודנט או להתגייס למשטרה, עוד ציין כי הנאשם עובד במפעל אקרשטיין והוא עלול להיות מפוטר במידה ויורשע.",טיעוני הצדדים לעונש
SH-17-03-34607-993,"ב""כ הנאשם הגיש המלצות לעיון בית המשפט על שירותו הצבאי, ממעסיקו הנוכחי ומהמועצה המקומית.",טיעוני הצדדים לעונש
SH-17-03-34607-993,"ב""כ הנאשם ביקש לבטל את הרשעתו שכן מדובר בנאשם נעדר עבר פלילי, אשר הודה בהזדמנות הראשונה, חסך מזמנו של בית המשפט וכי התחרט על מעשיו. נטען כי הרשעה תפגע בנאשם ובשיקומו. הסנגור עתר להטיל 350 שעות של""צ ללא הרשעה והציע להוסיף קנס מנהלי.",טיעוני הצדדים לעונש
SH-17-03-34607-993,"הנאשם ציין כי השתחרר מהצבא לפני שנה ושמונה חודשים, וזו העבירה הראשונה שלו עליה הוא מצטער. עוד הוסיף כי כל העתיד לפניו וכי אינו מעשן ואינה שותה.",דברי הנאשם
SH-17-03-34607-993,"הכלל בהליך הפלילי הוא כי נאשם בגיר, שהוכחה אשמתו - יורשע בדין.",שאלת ההרשעה בדין
SH-17-03-34607-993,"הימנעות מהרשעה הינה חריג לכלל, שהנו מוצדק רק במקרים נדירים וחריגים, בהם אין יחס סביר בין הנזק הצפוי לנאשם מן ההרשעה, אשר יש לקבוע כי הוא ממשי וחריף, לבין היעדר חומרתה של העבירה, שניתן להימנע מהרשעת מבצעה, מבלי שהדבר יפגע באינטרס הציבורי ובערך המוגן.",שאלת ההרשעה בדין
SH-17-03-34607-993,"הכלל המנחה לגבי הימנעות מהרשעה, נקבע בע""פ 2083/96 תמר כתב נגד מדינת ישראל [פורסם בנבו] (21.08.97), שם נקבע כי הימנעות מהרשעה תהיה מוצדקת רק בהתקיים שני תנאים מצטברים: ",שאלת ההרשעה בדין
SH-17-03-34607-993,"בע""פ 2513/96 מדינת ישראל נגד ויקטור שמש [פורסם בנבו] (02.09.96), נקבע כי ניתן להסתפק במבחן בלי הרשעה, רק במקרים מיוחדים ויוצאי דופן. הימנעות מהרשעה על ידי בית המשפט כאשר אין לכך צידוק ממשי מפרה את הכלל בדבר הרשעה ובכך פוגעים גם בעקרון השוויון בפני החוק.",שאלת ההרשעה בדין
SH-17-03-34607-993,"לאור האמור לעיל, ניתן לומר כי השאלה אם ניתן להימנע מהרשעת נאשם נענית תוך איזון הדדי בין שני שיקולים שמשקלם משפיע זה על זה – ככל שהעבירה חמורה יותר, נסיבותיה קשות, ופגיעתה בערכים ובמוסכמות החברתיות גבוהה יותר, אזי הימנעות מהרשעה של מבצעה תהיה פחות סבירה ומוצדקת, ותתאפשר, אם בכלל, רק מקום בו תוכח פגיעה ניכרת וקשה בעתידו של הנאשם.",שאלת ההרשעה בדין
SH-17-03-34607-993,"חומרת העבירה ונסיבותיה – הנאשם עשה ""עסקה אחרת"" בסם, במהלך ""מסיבת טבע"", בכך שמכר לסוכן משטרתי כדור אקסטה המכיל סם שזהותו וכמותו אינה ידועה, תמורת 60 ₪. תיאור האירוע בכתב האישום מלמד על עסקת סמים שאיננה ברף חומרה גבוה, והיא נטולת מאפיינים המצביעים על סחר שיטתי למטרת כסף.",שאלת ההרשעה בדין
SH-17-03-34607-993,"ראשית, יש לציין כי באותו כדור שנמכר לשוטר תמורת 60 ₪, לא נמצא בסופו של דבר סם מסוכן, ולכן העבירה בה הורשע הנאשם איננה ,סחר בסמים, כי אם כאמור ""עסקה אחרת"" בסם.",שאלת ההרשעה בדין
SH-17-03-34607-993,"שנית, התנהגותו של הנאשם מאופיינת בהעברת אותו כדור לשוטר, במה שנראה כהתרועעות במסיבה, אגב צביעת פנים ושיחה, ולא כאקט שיטתי במטרה לסחור ולהפיץ סם.",שאלת ההרשעה בדין
SH-17-03-34607-993,"שלישית, אצל הנאשם נמצא אומנם סם שהחזיק, ואולם לא דובר בסמי הזייה נוספים, כי אם רק בסמים מסוג קנביס וחשיש בכמות קטנה. לא נמצאו אצל הנאשם סממני סחר דוגמת אריזות, רשימות, או כסף מזומן (זולת השטר שקיבל מהשוטר).",שאלת ההרשעה בדין
SH-17-03-34607-993,"מדובר לפיכך – בעבירת סמים שאיננה לצריכה עצמית, ולכן איננה מסווגת אל העבירות הקלות ביותר בתחום זה, ואולם בתוך התחום החמור יותר של עבירות הסמים, מצוי האירוע הפלילי בדרגת חומרה נמוכה.",שאלת ההרשעה בדין
SH-17-03-34607-993,עבירות בתחום הסמים פוגעות בערכים המוגנים של בריאות הציבור ושלומו הפיזי והנפשי מפני הנזקים הישירים והעקיפים הנגרמים עקב השימוש בסמים.,שאלת ההרשעה בדין
SH-17-03-34607-993,"בית המשפט חזר והדגיש את הצורך לעקור את נגע הסמים מהשורש. ייצור, הפצה, סחר וכן שימוש בסמים טומנים בחובם פוטנציאל לנזק עצום, לא רק למעורבים הישירים בביצוע העבירות אלא לחברה כולה – צרכן הסמים, משפחתו והנפגעים העקיפים מהפעילות העבריינית שנלווית פעמים רבות לעבירות הסמים.",שאלת ההרשעה בדין
SH-17-03-34607-993,"בעקיפין, פוגעות עבירות הסמים גם בערכים מוגנים נוספים, שהנם שמירה על בטחון הציבור ועל רכוש הציבור, שכן קיים קשר מוכח בין צריכת סמים לסוגיהם לבין ביצוע עבירות רכוש, שנעברות על רקע הכורח למימון הסמים על ידי המכורים, ואף לבין עבירות נהיגה תחת השפעת סמים או התנהגויות אלימות, הפוגעות בביטחון הכללי בחברה.",שאלת ההרשעה בדין
SH-17-03-34607-993,חומרתן של עבירות עסקה אחרת בסם והחזקת סמים שלא לצריכה עצמית נלמדת גם מהעונש שקבע המחוקק בצידה של כל עבירה – 20 שנות מאסר.,שאלת ההרשעה בדין
SH-17-03-34607-993,"ראו לעניין זה את הדברים שנאמרו בע""פ 972/11 מדינת ישראל נגד יניב יונה [פורסם בנבו] (04.07.12):",שאלת ההרשעה בדין
SH-17-03-34607-993,"למאבק בנגע הסמים יש שותפים רבים. חלקם מתמקדים בחינוך מניעתי ובהסברה. אחרים מסייעים בהליכי הגמילה. לצידם פועלים גם אנשי אכיפת החוק, שתפקידם לסכל את עבירות הסמים וללכוד את העבריינים. אף בית המשפט נוטל חלק חשוב במאבק, באמצעות הטלת עונש מרתיע על מי שהורשע בעבירות סמים.",...
SH-17-03-34607-993,"וכן את הדברים שנאמרו בבית המשפט העליון מפי כבוד השופט עמית בע""פ 3172/13 עלא סואעד נגד מדינת ישראל [פורסם בנבו] (07.01.14):",...
SH-17-03-34607-993,"שימוש והפצה של כדורי סם במסיבות הנם תופעה נפוצה ומסוכנת, אשר במקרים קשים ומצערים גורמת לפגיעה קשה, ואפילו מוות, למשתמשי הסמים. משטרת ישראל פועלת למיגור תופעת הפצת הסמים באירועים דומים לזה בו עסקינן כאן, והנאשם, במקרה זה, נתפס מבצע עבירת עסקת סמים עם שוטר מוסווה בתפקיד, שלו מסר, תמורת כסף, כדור, לאחר משא ומתן קצר. במעשיו, פגע הנאשם בערכים המוגנים, ואולם מדובר בפגיעה נמוכה עד בינונית, יחסית לטווח עבריינות הסמים.",...
SH-17-03-34607-993,"אדגיש כי על אף היעדרם של סממנים חמורים לגבי הפצת סמים, עדיין לא מדובר בעבירה קלה, שכן נעשתה עסקת סמים על המשתמע ממונח זה.",...
SH-17-03-34607-993,"ניתן לסכם ולומר כי ככלל, העבירה בה הורשע הנאשם מחייבת הרשעה בדין.",...
SH-17-03-34607-993,"בבואו של בית המשפט לבחון את הנזק העלול להיגרם לנאשם, על הנאשם להתייחס לנזק מוחשי קונקרטי ולא לאפשרויות תיאורטיות לפיהן ייגרם לנאשם נזק בעתיד. ראו לעניין זה את הדברים שנאמרו ברע""פ 9118/12 אלכסנדר פריגין נגד מדינת ישראל [פורסם בנבו] (03.01.13):",...
SH-17-03-34607-993,נטען כי הרשעתו של הנאשם תפגע בהליך שיקומו וכן בעתידו שכן הוא מעוניין להתגייס למשטרה או לעבוד באבטחה כסטודנט. בא כוחו של הנאשם ציין כי אין ביכולתו להציג מסמכים המעידים על כוונה להתגייס למשטרה שכן אין מסמכים כאלה.,...
SH-17-03-34607-993,"לא כל טענה על רצון להתקבל למקום עבודה עתידי, תוכיח את קיומה של פגיעה קונקרטית. ישנו צורך בהוכחת כוונה אמיתית ורצינית, וכן להוכיח כי נעשו פעולות וננקטו צעדים במטרה לנסות ולהתקבל לאותו מקום עבודה. הנאשם הביע שאיפה להמשיך וללמוד ולעבוד בעתיד, אך אין ערובה כי הוא יחליט בסופו של דבר להתגייס דווקא למשטרה.",...
SH-17-03-34607-993,"נכון לעת ביצוע העבירה, ובהמשך, במועד הטיעונים לעונש, הנאשם נרשם להשלמת בגרות בכפרו, ועבד בעסק פרטי, כמו גם כשכיר. טענותיו לגבי תכניות אחרות נמצאו בלתי קונקרטיות.",...
SH-17-03-34607-993,"מעבר לנדרש, ומבלי להיכנס לשיקולי ההעסקה במשטרת ישראל , יש לתמוהה אם צעיר שלחובתו רישום פלילי ללא הרשעה בעבירת עסקת סמים, יימצא מתאים לגיוס כשוטר, ואין כל ערובה, אף לא הוצגה כל ראייה שזו היא התמונה.",...
SH-17-03-34607-993,"כיום עובד הנאשם בשני מקומות שהרשעה פלילית, ככל הנראה, לא תפגע בהמשך תעסוקתו בהם.",...
SH-17-03-34607-993,"לאור כל האמור לעיל, הרשעתו של הנאשם נותרת על כנה.",...
SH-17-03-34607-993,"מלאכת גזירת העונש נעשית, על פי הוראות תיקון 113 שבחוק העונשין, בשני שלבים עיקריים. ראשית, יש לקבוע את מתחם הענישה הראוי לעבירה, תוך מתן ביטוי מרכזי לעיקרון ההלימה, בהתחשבות בערכים המוגנים בעבירה ובמידת הפגיעה בערכים אלה, מדיניות הענישה הנוהגת ובהתאם לנסיבות הקשורות לביצוע העבירה. שנית, יש להציב את העונש בתחומי המתחם שנקבע, וזאת על פי נסיבות שאינן קשורות בביצוע העבירה. בנוסף, יש לבחון את מתקיימים שיקולים אשר מצדיקים סטייה מתחומי המתחם שנקבע.",דיון והכרעה
SH-17-03-34607-993,התייחסתי לערכים המוגנים ולנסיבותיו של המקרה וכעת אסקור בדוגמאות את מדיניות הענישה בעבירות מהסוג הנדון.,דיון והכרעה
SH-17-03-34607-993,"עיון בפסיקה שניתנה בעבירות סחר בסמים ועסקה אחרת בסם, מעלה כי ניתנה ענישה מגוונת המתחשבת בנסיבותיו של כל מקרה.",מדיניות הענישה
SH-17-03-34607-993,"עפ""ג (ירושלים) 31347-08-14 מדינת ישראל נגד אברהים בשיטי [פורסם בנבו] (10.12.14), המשיב, נעדר עבר פלילי, הורשע במכירת סם מסוג קנאביס בשתי הזדמנויות, במשקל 97 גרם ו- 47 גרם וכן 5 טבליות MDMA. נגזרו עליו 6 חודשי עבודות שרות, מאסר על תנאי וקנס.",מדיניות הענישה
