verdict,text,part
SH-20-09-43084-871,"מידת הפגיעה בערכים המוגנים היא בינונית – גבוהה. הנאשם כחלק מפעילותו העבריינית היה מעורב בהוצאתן של שלוש עסקאות סמים מסוג קוקאין, אשר טמון סיכון רב בהפצתם בקרב הציבור. מדובר בכמויות נכבדות של סמים במשקל כולל של כ- 40 גרם תמורתם שילם הסוכן 16,000 ₪, והנאשם גרף לכיסו עמלת תיווך שאינה צנועה ובסך 1,500 ש""ח. כידוע, סוג הסמים ומשקלם, כמו גם הרווח הקל והמהיר הנובע מהם בעלי השפעה ישירה על גבולות המתחם. הנזק הפוטנציאלי הוא רב, הן בשל סוג הסם שנחשב לאחד מהסמים הקשים והן לאור הכמות שעלולה הייתה לשמש להכנת מנות סם רבות.",קביעת מתחם העונש ההולם
SH-20-09-43084-871,"אשר לסכנה הנשקפת מסם הקוקאין ראה ע""פ 972/11 מדינת ישראל נ' יונה (4.7.2012): ",קביעת מתחם העונש ההולם
SH-20-09-43084-871,"הנאשם ביצע את העבירות במטרה לגרוף כסף קל ומהיר. והוא עשה זאת על חשבון בריאותו ורווחתו של צרכן הסמים, תוך ניצול תופעות התמכרות מבלי לתת את הדעת לנזקים האישיים והחברתיים הנגרמים משימוש בסם. הנזק הקונקרטי במקרה הנוכחי נמנע בטרם הופצו הסמים למשתמשי הקצה, לא משום חרטה שחש הנאשם על מעשיו, אלא הודות למאמצי רשויות אכיפת החוק שנדרשו להשקיע משאבים לא מעטים לצורך הפעלתו של הסוכן. אולם, הנזק הפוטנציאלי רב בשל סוג הסם והכמות הגדולה שעלולה הייתה לשמש להכנת מנות סם רבות.",קביעת מתחם העונש ההולם
SH-20-09-43084-871,"הגם שהנאשם שימש במתווך, חלקו אינו שולי או זניח והוא לא התמצה בקשירת הקשר ובהפגשתם של הצדדים. פעולות התיווך במקרה דנן, היו אקטיביות למדי, ובכל אחת מהן היה כדי לקדם את הוצאת העסקה אל הפועל ולהבטיח את מימושה. הסוכן לא היה צריך לרתום את הנאשם לביצוע עסקאות הסמים ולשכנע אותו לבצען, אלא שהלה פעל באופן עצמאי. במסגרת הפעילות הפלילית, ערך הנאשם תיאומים טלפונים ומסר פרטים מהותיים כגון: מקום, שעה ומחיר. כן פגש הנאשם בסוכן במקומות שונים, ונטל חלק אקטיבי במעגל העבירה, כשברור לכל, כי בגין פעולות התיווך זכאי לתשלום עמלה הולמת.",קביעת מתחם העונש ההולם
SH-20-09-43084-871,"למותר לציין כי ביצוען של עבירות סחר בסמים בהיקפים מסוג זה, מצריך מחשבה, תכנון מוקדם, הערכות, קשר עם גורמים עברייניים, מוכנות ונכונות להשתתף בפעילות פורצת חוק והן מלמדות על עומק מעורבותו של הנאשם בתחום הסמים.",קביעת מתחם העונש ההולם
SH-20-09-43084-871,"עוד בקביעת המתחם יש להביא בחשבון כי מבחינת העונש המרבי הקבוע בפקודת הסמים המסוכנים אין הבדל בין עבירת סחר בסמים לבין עבירת התיווך. גם מבחינת רמת הסיכון וגם מבחינת ההכרח להילחם בנגע הסמים אין הבדל גדול בין סוחר הסמים ובין המתווך. מדובר בשני גורמים חשובים ועיקריים בשרשרת הפצת הסם, וההגדרה אינה פורמלית או טכנית, אלא שיש לבחון את חומרת המעשים בנסיבות המקרה הפרטני. יש לעיתים סחר שנסיבותיו קלות באופן יחסי ויש תיווך שחומרתו רבה. וגם ההפך הוא הנכון. ובמקרה דנן, מעמדו של הנאשם כמתווך נמצא גבוה בהיררכיה של שרשרת הפצת הסם.",קביעת מתחם העונש ההולם
SH-20-09-43084-871,"באשר למדיניות הענישה הנהוגה המהווה כלי עזר בקביעת מתחם הענישה, לא ראיתי טעם לסקור את הפסיקה הענפה שהציגו הצדדים, שכן כאמור, נקודת המוצא לענייננו היא המתחם שנקבע בעניין אבו חגג' אשר מביא בחשבון גם מדרג בין המעורבים בפעילות העבריינית.",קביעת מתחם העונש ההולם
SH-20-09-43084-871,"עם זאת, נזכיר כי הפסיקה עמדה פעמים רבות על ההכרח במדיניות ענישה מרתיעה כלפי אלה הלוקחים חלק בהפצתם של סמים מסוכנים תוך העדפת האינטרס הציבורי על פני אינטרסים אחרים. ראו מיני רבים: ע""פ 6029/03 מדינת ישראל נ' שמאי, פ""ד נח (2) 734 (9.2.2004); ע""פ 6021/95, 4998/95, 5267/95, 5313/95 מדינת ישראל נ' גומז (31.7.1997); ע""פ 575/88 עודה נ' מדינת ישראל, פ""ד מב (4) 242 (11.12.1988) וע""פ 6990/13 חט'יב נגד מדינת ישראל (24.2.2014):",קביעת מתחם העונש ההולם
SH-20-09-43084-871,"לאור כל האמור בהתחשב בנסיבות ביצוע העבירות, במידת הפגיעה בערכים המוגנים ובמדיניות הענישה הנהוגה, מתחם העונש ההולם יקבע בין 24 ועד 48 חודשי מאסר בפועל, לצד ענישה נלווית. יודגש כי בעבירות מסוג זה, אשר מבוצעות מבצע כסף גרידא, נודעת חשיבות לענישה כספית הולמת אשר תהווה חלק בלתי נפרד מהרתעתם של המפיצים, הסוחרים, ועל כל מי שידו במעגל נגוע זה. הקנס נועד לבטא, בין השאר, ענישה בגין הרווח הכלכלי שהושג בעבירה. ראו מיני רבים : ע""פ 4387/20 מדינת ישראל נ' דרור (8.2.2021); ע""פ 100/14 מדינת ישראל נ' מחטייב (10.12.2014); ע""פ 2996/09 פלוני נ' מדינת ישראל (11.05.2009). וביחס לרכיב הקנס אף הבאתי בכלל חשבון שיעור הקנס שהושת על האחרים בפרשייה, כמו גם מצבו הכלכלי של הנאשם. ",קביעת מתחם העונש ההולם
SH-20-09-43084-871,גזירת העונש המתאים לנאשם,קביעת מתחם העונש ההולם
SH-20-09-43084-871,"אקדים תוצאה להנמקה, ואומר כי שקלתי בכובד ראש את עתירת ההגנה הנשענת על המלצת התסקירים לנקוט בענישה שיקומית בדמות מאסר בעבודות שירות, אך המלצה זו לא אוכל לקבל. המלצת שירות המבחן כשמה כן היא – המלצה, ואין באמור בה לכבול את ידי בית המשפט (ראו: רע""פ 1756/16 ימיני נ' מדינת ישראל, פסקה 11 (16.3.2016); ע""פ 2048/18 פלוני נ' מדינת ישראל, פסקה 13 (14.11.2018); ע""פ 4472/16 עווד נ' מדינת ישראל, פסקה 7 (15.06.2016); ע""פ 2015/13 פלוני נ' מדינת ישראל, פסקה 10 (5.8.2013); רע""פ 10904/04 מיארה נ' מדינת ישראל, פסקה 6 (9.12.2004); רע""פ 6908/04 איבגי נ' מדינת ישראל (27.7.2004)). למותר לציין כי השיקולים לאורם פועל שירות המבחן אינם בהכרח חופפים באופן מלא למגוון השיקולים שבית המשפט נדרש לאזן ביניהם בגזירת הדין. ",קביעת מתחם העונש ההולם
SH-20-09-43084-871,"הנאשם יליד 1990, מאורס,  הודה בכתב האישום המתוקן ונטל אחריות על מעשיו. היה בהודאה זו לחסוך בזמן שיפוטי יקר ובמשאבי ציבור הכרוכים בניהול הליך משפטי. לחובת הנאשם הרשעה קודמת אחת משנת 2011 בגין פציעה כשעבריין מזוין, תקיפה סתם ואיומים, בעטיה נידון ל- 6 חודשי מאסר לריצוי בעבודות שירות וענישה נלווית (טענ/1- טענ/2). מדובר בהרשעה שהתיישנה, כך שההשפעה שלה מתונה מאוד אם בכלל על העונש בגדרי המתחם. כן לחובת הנאשם - 4 הרשעות בתחום התעבורה לרבות נהיגה ללא רישיון נהיגה באופן המלמד על זלזול בחוק (טעת/3).",קביעת מתחם העונש ההולם
SH-20-09-43084-871,"כן יש להביא בחשבון את תקופת מעצרו של הנאשם מאחורי סורג ובריח כ- 3 חודשים, בפיקוח אלקטרוני, וכן את התקופה הארוכה בה נתון בתנאים מגבילים כאלו ואחרים.",קביעת מתחם העונש ההולם
SH-20-09-43084-871,"בעניינו כאמור, הוגשו שבעה תסקירים. כבר בתסקיר השני הביע שירות המבחן דעתו כי מדובר באדם בעל יכולות וכוחות לתפקוד תקין במישורי חייו השונים ועובד בעבודה יציבה, מבטא שאיפות להתקדם בחייו ובעל מוטיבציה לשיקום. כמו כן העריך שירות המבחן כי הנאשם למד את הלקח והסיק מסקנות אודות התנהגותו עוברת החוק, חומרת מעשיו והשלכותיהם והצליח להעמיק במחירים ששילם עקב מעורבותו בפלילים. משכך, ומכיוון שלא נמצאה נזקקות טיפולית בתחום ההתמכרויות ועל אף שהנאשם לא שולב בטיפול, סבר שירות המבחן כי בשלה העת לסיים את ההליך המשפטי והמליץ על ענישה שיקומית בדמות עבודות שירות, ואפילו לא ביקש להעמיד את הנאשם במבחן.",קביעת מתחם העונש ההולם
SH-20-09-43084-871,"רק לאחר שהופנה הנאשם שוב לשירות המבחן, לבקשת ההגנה, והביע רצון להשתלב בטיפול, שולב בקבוצת הכנה לטיפול ארוך טווח, ובהמשך ובקבוצה הטרוגנית לטיפול בעברייני חוק. עוד לאורך התקופה מסר הנאשם בדיקות שתן נקיות מסמים. מבלי להמעיט כהוא זה בהליך טיפולי זה ובמאמציו של הנאשם לנהל אורח חיים נורמטיבי כמו גם ניתוק הקשר עם גורמים שוליים והעדר הסתבכות נוספת, קשה לומר כי מדובר בהליך שיקומי מרהיב ויוצא דופן המצדיק סטייה ממתחם הענישה.",קביעת מתחם העונש ההולם
SH-20-09-43084-871,"ממכלול הנתונים עולה כי הנאשם כמו רבים אחרים, תפקד באופן חיובי למעט מעידה בתחום האלימות לפני למעלה מעשור, והסתבך בביצוע עבירות סמים חמורות, לאחר שחבר לגורמים שוליים והתפתה לרווח הכלכלי. הוא אינו הראשון שהתפתה לעבור על החוק ולמרבה הצער, הוא אינו האחרון. בנסיבות מעיין אלו, ספק רב אם הנאשם בכלל נזקק להליך שיקומי.",קביעת מתחם העונש ההולם
SH-20-09-43084-871,"כך או כך, לא בכל מקום שבו נאשם נמנע ממעורבות נוספת בפלילים ומוסר בדיקות שתן נקיות אפשר לדבר ב""מונחי שיקום"". שומה על בית המשפט לנהוג בזהירות יתרה בעת הפעלת הסמכות הקבועה בסעיף 40ד לחוק העונשין, כך שסטייה מהמתחם שמורה למקרים חריגים בהם שיקולי שיקום מובהקים מצדיקים זאת. אל לנו להפוך את החריג לכלל ואת הכלל לחריג (ראו ע""פ 126/22 מדינת ישראל נ' פלוני (27.4.2022)). ",קביעת מתחם העונש ההולם
SH-20-09-43084-871,"משכך, ומכיוון ששיקולי שיקום אינם חזות הכל, ולאור חומרת העבירות והאינטרס הציבורי המובהק במלחמה בנגע הסמים, סבורני יש לתת משקל בכורה לעיקרון ההלימה (ראו מיני רבים, ע""פ 5826/19 מדינת ישראל נ' דורי רפאל (30.9.2020); ע""פ 2194/14 בן שמעון נ' מדינת ישראל (10.9.2014)). בבחינת למעלה מן הצורך אומר כי גם אם היה מוכיח הנאשם כי עבר שיקום משמעותי בתחום ההתמכרויות ספק אם לנוכח חומרת המעשים, הסטייה ממתחם הענישה הייתה יכולה להיות כה חדה עד כדי הימנעות ממאסר בפועל. ",קביעת מתחם העונש ההולם
SH-20-09-43084-871,"דא עקא, לא אוכל להתעלם מפרק הזמן הנכבד שחלף ממועד ביצוע העבירות, למועד הגשת כתב האישום, דרך מועד הכרעת הדין ועד למועד גזר הדין. הלכה למעשה, הנאשם נותן את הדין כעבור שנים רבות מיום ביצוע העבירות לאחר שאחרים בפרשייה לא רק נידונו זה מכבר, אלא שעניינם נבחן על ידי ערכאת הערעור, והממונה על עבודות השירות התבקש להגיש חוות דעתו ביחס להתאמתו של הנאשם לרצות מאסר בעבודות שירות, פעמיים. פרק זמן ארוך זה שהוא בהחלט חריג כטענת ההגנה, נובע מאילוצים שונים, שלא כולם היו בהכרח תלויים בנאשם.",קביעת מתחם העונש ההולם
SH-20-09-43084-871,"אף אי אפשר להתעלם מהעובדה כי משך כל התקופה הארוכה בה מתנהל ההליך הפלילי נגד הנאשם, הסכימה המאשימה גם אם בשתיקה, לדחייה על גבי דחייה ולהמשך הקשר הטיפולי בחסות שירות המבחן, באופן שיש בו ליצור אצל הנאשם ציפייה לגיטימית לפיה הצלחת הטיפול והימנעות ממעורבות בפעילות עוברת חוק, יקבלו משקל של ממש בעת גזירת הדין.",קביעת מתחם העונש ההולם
SH-20-09-43084-871,"לכך אוסיף כי עתירתה של המאשימה להשית על הנאשם תקופת מאסר כפי שהוטלה על חג'ג' מעוררת חוסר נוחות וזאת בלשון המעטה. אסביר. אבו חג'ג' בעל 3 הרשעות קודמות רלבנטיות בתחום הסמים לרבות בגין ניסיון הדחת קטין לסמים. הלה הורשע בגין מעורבותו בביצוע 3 עסקאות סם מסוג קוקאין ובמשקל כולל כ- 50 גרם תמורת 22,500 ₪ ועמלת תיווך בסך 2,100 ₪, עבירות אותן ביצע הנאשם שעה שעמד ותלוי נגדו כתב אישום אף הוא בעבירות סמים. אבו חג'ג' אף היה עצור מאחורי סורג ובריח, עצור בפיקוח אלקטרוני וכן שהה בתנאים ומגבלות. תסקירי המבחן היו חיוביים במהותם, תיארו השתלבות בקבוצות טיפוליות לעוברי חוק והתרשמות כי מצוי בעיצומו של הליך שהביא לשינוי ויציבות בכל תחומי חייו בדגש על משפחתו. מכך, המליץ שירות המבחן על ענישה שיקומית לא בדמות עבודות שירות כבענייננו, אלא בדמות צו מבחן וצו של""צ. בית המשפט הביע ספקנות בהליך השיקומי הנטען אך הביאו במניין השיקולים באופן שהוביל למיקום העונש בתחתית המתחם. משמע, עניינו של אבו חג'ג' חמור מעניינו של הנאשם, במובנים רבים.",קביעת מתחם העונש ההולם
SH-20-09-43084-871,"נדמה כי צריך להזכיר מושכלות יסוד: עיקרון אחידות הענישה, מורה להחיל שיקולי ענישה דומים על מי שביצעו עבירות דומות במהותן, בנסיבות דומות ובעלי נסיבות אישיות שונות, תוך שמירה על ייחס הולם בין הנאשמים. קבלת עתירתה של המאשימה, שאינה מביאה בחשבון את חלוף הזמן המשמעותי ושיקולי השיקום, ועל אף שאינם מצדיקים סטייה ממתחם הענישה, עשויה לפגוע במראית פני הצדק ובהגינות ההליך המשפטי ומחייבת איזון עונשי ראוי.",קביעת מתחם העונש ההולם
SH-20-09-43084-871,לנוכח האמור ובאיזון בין הנסיבות לזכותו של הנאשם לבין הנסיבות העומדות לחובתו אני גוזרת על הנאשם את העונשים הבאים:,תוצאה 
SH-20-09-43084-871,"18 חודשי מאסר בפועל בניכוי ימי מעצרו בהתאם לרישומי שב""ס. הנאשם יתייצב לריצוי עונש מאסר ביום 28.10.2024 עד השעה 10:00 במתקן הכליאה ""הדרים"" או על פי החלטת  שירות בתי הסוהר, כשברשותו תעודת זהות או דרכון ועותק מהחלטה זו. על הנאשם לתאם את הכניסה למאסר, כולל אפשרות למיון מוקדם, עם ענף אבחון ומיון של שירות בתי הסוהר, בטלפונים: 08-9787377 או 08-9787336.",תוצאה 
SH-20-09-43084-871,8 חודשי מאסר אותם לא ירצה הנאשם אלא אם יעבור בתוך שלוש שנים כל עבירת פשע לפי פקודת הסמים המסוכנים.,תוצאה 
SH-20-09-43084-871,3 חודשי מאסר אותם לא ירצה הנאשם אלא אם יעבור בתוך שלוש שנים כל עבירת עוון לפי פקודת הסמים המסוכנים.,תוצאה 
SH-20-09-43084-871,"קנס בסך 15,000 ₪ או 30 ימי מאסר תמורתו. הקנס ישולם ב- 5 תשלומים חודשיים שווים ורצופים, החל מיום 1.1.2025. לא ישולם איזה מהתשלומים במועדו, תעמוד יתרת הקנס לפירעון מידי.",תוצאה 
SH-20-09-43084-871,"לבקשת הנאשם, הקנס ישולם מתוך ערבון שהופקד מטעם הנאשם בהליך המעצר, והיתרה תושב לנאשם בכפוף לכל דין. מובהר, כי רכיב זה בגזר הדין כפוף לכל מניעה חוקית לרבות עיקול.",תוצאה 
SH-20-09-43084-871,פסילה מותנית למשך 12 חודשים שלא יעבור עבירות נהיגה ללא רישיון נהיגה או עבירות סמים מסוג פשע למשך 3 שנים. הפסילה תצטבר לכל עונש פסילה אחר. על הנאשם להפקיד את רישיון הנהיגה במזכירות בית המשפט.,תוצאה 
SH-20-09-43084-871,"אני מכריזה על הנאשם כסוחר סמים – לפי סעיף 36 א(ב) לפקודת הסמים ומורה על חילוט הטלפון הנייד ששימש לביצוע העבירות, לאוצר המדינה – קרן החילוט.",תוצאה 
SH-20-09-43084-871,"ניתן היום,  ז' אלול תשפ""ד, 10 ספטמבר 2024, במעמד הצדדים.",54678313
SH-20-09-43084-871,"בעניין עריכה ושינויים במסמכי פסיקה, חקיקה ועוד באתר נבו – הקש כאן",5129371
SH-20-09-43084-871,זהר דיבון סגל 54678313-/,5129371
