verdict,text,part
SH-20-09-43084-871,"ת""פ 43084-09-20 מדינת ישראל נ' אבדיר",בית משפט השלום ברמלה
SH-20-09-43084-871,"ת""פ 43084-09-20 מדינת ישראל נ' אבדיר",בית משפט השלום ברמלה
SH-20-09-43084-871,"ת""פ 43084-09-20 מדינת ישראל נ' אבדיר",בית משפט השלום ברמלה
SH-20-09-43084-871,                     נגד,"ע""י ב""כ עוה""ד ברק לקס ועו""ד ירדן אוקנין "
SH-20-09-43084-871,                     נגד,"ע""י ב""כ עוה""ד ברק לקס ועו""ד ירדן אוקנין "
SH-20-09-43084-871,                     נגד,"ע""י ב""כ עוה""ד ברק לקס ועו""ד ירדן אוקנין "
SH-20-09-43084-871,"חוק העונשין, תשל""ז-1977: סע'  40ד, 499(א)(1)",חקיקה שאוזכרה: 
SH-20-09-43084-871,"פקודת הסמים המסוכנים [נוסח חדש], תשל""ג-1973: סע'  13, 19א",חקיקה שאוזכרה: 
SH-20-09-43084-871,"הנאשם הורשע בהתאם להודאתו בביצוע עבירות כדלקמן, קשירת קשר לעשות פשע (3 אישומים), לפי סעיף 499(א)(1) לחוק העונשין, תשל""ז–1977 (להלן: חוק העונשין); תיווך בסמים מסוכנים בצוותא חדא, (3 אישומים), לפי סעיפים 13 + 19א לפקודת הסמים המסוכנים (נוסח חדש), תשל""ג–1973 (להלן: הפקודה).",גזר דין
SH-20-09-43084-871,"כחלק מהסדר הטיעון הדיוני התבקש שירות המבחן לבחון את נסיבותיו האישיות של הנאשם כמו גם נסיבות ביצוע העבירות ולהעביר המלצותיו לבית המשפט. אקדים את המאוחר ואומר כי בסופו של הליך אבחון וטיפול, המליץ שירות המבחן על ענישה שיקומית בדמות מאסר לריצוי בדרך של עבודות שירות.",גזר דין
SH-20-09-43084-871,בין הצדדים לא התגבשה הסכמה לעניין העונש שראוי שיוטל על הנאשם וכל צד טען בעניין זה כראות עיניו וכמיטב שיקול דעתו המקצועי.,גזר דין
SH-20-09-43084-871,כתב האישום הוא חלק מפרשייה רחבה במסגרתה הופעל סוכן משטרתי סמוי (להלן: הסוכן) אשר ביצע מול הנאשם ואחרים עסקאות סמים מסוג קוקאין. כתב האישום המתוקן כולל פרק מבוא ושלושה אישומים. העובדות הצריכות לעניין יובאו בתמצית.,כתב האישום המתוקן
SH-20-09-43084-871,"לפי האישום הראשון, בין התאריכים 24.9.2019 ועד 10.11.2019 התקיימו בין הנאשם לסוכן שיחות בנוגע למכירת סמים מסוג קוקאין, כן הפגיש הנאשם את הסוכן עם האחר. לאחר המפגש המשיך הנאשם בתיאום פרטי העסקה אל מול הסוכן, לרבות מקום ושעת ביצוע העסקה, עד שביום 10.11.2019 בשעות הערב יצאה העסקה לפועל. אז מסר הנאשם לסוכן 2 שקיות סם מסוג קוקאין במשקל 9.6693 גרם נטו בתמורה שילם הסוכן לנאשם 4,000 ₪ עבור הסמים ו- 400 ₪ עבור התיווך. באתו המעמד הזהיר הנאשם את הסוכן מקיומן של מצלמות אבטחה באזור.",כתב האישום המתוקן
SH-20-09-43084-871,"לפי האישום השני, ביום 17.12.2019 בשעות אחר הצהריים התקשר הסוכן לנאשם ולאחר חילופי הודעות ותיאום פרטי העסקה, נפגשו השניים בכפר קאסם, ובהמשך נסעו לתחנת דלק הממוקמת בכביש 5, שם מסר הנאשם לסוכן נייר טואלט שהכיל שקית ובתוכה סם מסוכן מסוג קוקאין במשקל 9.9431 גרם נטו. בהמשך, הוריד הסוכן את הנאשם סמוך לבית החולים שניידר והשניים קבעו כי הסוכן יחזור למקום בעוד כ-40 דקות על מנת לשלם בעבור הסם. סמוך לשעה 22:50 נפגשו השניים בשנית, ובאותו המעמד, מסר הסוכן לנאשם 4,000 ₪ וכן 400 ₪ עבור התיווך.",כתב האישום המתוקן
SH-20-09-43084-871,"לפי האישום השלישי, ביום 20.2.2020 בשעות הערב, ולאחר תיאום טלפוני, נפגשו הסוכן והנאשם ליד תחנת משטרת כפר קאסם. השניים החלו בנסיעה, במהלכה תיאם הנאשם עם אחר שזהותו אינה ידועה למאשימה, עסקת סמים, ולאחר זמן קצר וסמוך לשעה 22:25 נפגשו הנאשם והסוכן בתחנת דלק בכפר קאסם. אז מסר הנאשם לסוכן 2 שקיות סם מסוכן מסוג קוקאין במשקל 19.9464 גרם נטו ובתמורה, שילם הסוכן לנאשם 8,000 ₪ וכן 700 ₪ נוספים עבור התיווך.",כתב האישום המתוקן
SH-20-09-43084-871,"שירות המבחן ערך שבעה תסקירים המגוללים את הרקע האישי והמשפחתי, היסטוריה עבריינית, התייחסותו של הנאשם לעבירות, ההליך הטיפולי בו השתלב, גורמי הסיכון וסיכויי השיקום. להלן עיקרי התסקירים.",תסקירי מבחן 
SH-20-09-43084-871,תסקיר מבחן מיום 29.9.2021 (להלן: התסקיר הראשון),תסקירי מבחן 
SH-20-09-43084-871,"הנאשם בן 31, רווק ומתגורר עם משפחת מוצאו בכפר קאסם, תיאר כי אחיו מנהלים אורח חיים נורמטיבי, אביו מתקיים מקצבת נכות מהמוסד לביטוח לאומי ואמו אינה עובדת. הנאשם מסר כי בנוסף לעבודתו בעבר בחווה לגידול כבשים בתפקיד סוכן מכירות, שותף בעסק משלוחים. לדבריו, נקלע לקשיים כלכליים לאור שהותו בתנאים מגבילים וללא אפשרות עבודה משך שנה וחצי. הנאשם מסר כי סיים 12 שנות לימוד ללא תעודת בגרות מלאה, היה חסר עניין בלימודים גבוהים והתמקצע בתחום הכדורגל עד לפציעתו בשנת 2014 ושהייתו בתקופה ארוכה של שיקום.",תסקירי מבחן 
SH-20-09-43084-871,"לנאשם הרשעה אחת שהתיישנה משנת 2011 בגין עבירות אלימות. לשירות המבחן מוכר הנאשם, מאבחונים קודמים בין השנים 2010 – 2011 וממסגרת הליך המעצר שבתיק זה. בזמנו, הפנה שירות המבחן את הנאשם למרכז לשלום המשפחה לצורך טיפול בהתנהגות אלימה מצדו אך הוא סירב לטיפול וניתק קשר עם שירות המבחן. בית המשפט אומנם נתן לנאשם הזדמנות לממש את צו המבחן אך הנאשם לא התחיל טיפול בקבוצה טיפולית נוכח בקשתו להשתלב בטיפול פרטני ולא קבוצתי.",תסקירי מבחן 
SH-20-09-43084-871,"באשר לעבירות מושא עניינינו. הנאשם הודה בפני שירות המבחן בביצוע העבירות, קיבל אחריות על ביצוען וגילה הבנה להשלכות שבהתנהלותו וגם חרטה בגין מעורבותו בהן. לדבריו, פעל מתוך לחץ שאחר הפעיל עליו וצורך ברצייה חברתית ובהמשך גם התפתה לרווח כספי. שירות המבחן התרשם שכיום נרתע הנאשם מהתנהגותו והשלכותיה. באשר לשימוש בסמים, שלל זאת הנאשם לחלוטין והדגיש כי ניהל אורח חיים בריא וספורטיבי. שירות המבחן ציין כי לא עלה בידו לערוך בדיקות לאיתור שרידי סם.",תסקירי מבחן 
SH-20-09-43084-871,"בין גורמי הסיכון, שקל שירות המבחן בחשבון את אופי העבירות וחומרתן, קשייו של הנאשם לווסת דחפיו, ההתרשמות מקיום קשרים שוליים, קשייו בהצבת גבולות פנימיים, חוסר שקול דעת מעמיק להשלכות מעשיו, העובדה כי לעתים פועל מתוך צורך ברצייה חברתית ונטייה לנגררות מצבי לחץ חברתי. בין גורמי הסיכוי, שקל שירות המבחן את קבלת האחריות של הנאשם על ביצוע העבירות תוך ביטוי צער וחרטה, גילוי הבנה להשלכות מעשיו וחומרתן, העובדה כי בעל תפיסת תפקיד מגובשת, יציבות במסגרות כגון עבודה, ההתרשמות מיכולות הנאשם לתפקד באופן תקין, קיומן של מערכות תמיכה, ביטויי רצון לשקם את מצבו, ההתרשמות מעמדות וערכים חברתיים מקובלים של הנאשם, וכן מרתיעתו מההליך המשפטי המתנהל כנגדו ושמירתו על התנאים המגבילים בהם נתון מזה כשנה וחצי. במכלול הדברים, העריך שירות המבחן כי הסיכון להישנות ביצוע העבירה פחת בעיתוי הנוכחי. לצד זאת, ועל מנת לגבש תמונה מלאה עתר שירות המבחן לדחייה, במהלכה יתבצעו לנאשם בדיקות שתן אקראיות.",תסקירי מבחן 
SH-20-09-43084-871,תסקיר מבחן מיום 9.12.2021 (להלן: התסקיר השני),תסקירי מבחן 
SH-20-09-43084-871,"שירות המבחן עדכן כי במהלך תקופת הדחייה, שיתף הנאשם בדאגותיו סביב הימשכות ההליך המשפטי, שינויים במצבו האישי כגון צמצום קשרים שוליים, בקרה על קשרים חדשים, מאמציו להתפתחות תעסוקתית, גילו מועדות מצדו לנטייתו לריצוי חברתי, ומודעותו לצורך בחינה יותר מעמיקה בעניינו. עוד שיתף הנאשם כי ממוקד בשיקום אורח חייו וניהול אורח חיים תקין ונורמטיבי.",תסקירי מבחן 
SH-20-09-43084-871,"שירות המבחן התרשם מנאשם שגדל במשפחה מתפקדת, בעל יכולות וכוחות לתפקוד תקין במישורי חייו, מבטא שאיפות לקידום חייו ומבטא מוטיבציה לשקם מצבו. עוד להתרשמותם, הנאשם הסיק מסקנות על אודות התנהגותו עוברת החוק והחומרה שבה והצליח להעמיק במחירים ששילם. בנוסף, במהלך תקופת הדחייה מסר הנאשם בדיקות שתן אקראיות שתוצאותיהן העידו על ניקיון מסמים, ולא נפתחו נגדו תיקי משטרה חדשים. נוכח האמור, שירות המבחן מסר כי הערכתו לכך שהסיכון להישנות ביצוע העבירות פחת – התחזקה.",תסקירי מבחן 
SH-20-09-43084-871,"משכך, לא בא שירות המבחן בהמלצה על העמדתו של הנאשם בצו מבחן והמליץ על הטלת עונש של מאסר בעבודות שירות וזאת לאור חומרת העבירות.",תסקירי מבחן 
SH-20-09-43084-871,תסקיר מבחן מיום 16.6.2022 (להלן: התסקיר השלישי),תסקירי מבחן 
SH-20-09-43084-871,"בתקופת הדחייה התארס הנאשם והמשיך בעבודה בתחום המשלוחים. לדבריו, רואה בקשר עם ארוסתו כמקור תמיכה. שירות המבחן עדכן כי טרם עלה בידיו לשלב את הנאשם בקבוצה טיפולית נוכח רשימות המתנה ארוכות, אך ערך פגישות פרטניות עם הנאשם ומעקב טלפוני, בהן שיתף אודות מצבו האישי והמשפחתי, קשייו הכלכליים, גילה נכונות להשתלב בטיפול על מנת לבחון לעומק קשייו וביטא צורך בקבלת תמיכה והכוונה לשיקום חייו. בתקופה זו לא נפתחו לנאשם תיקים חדשים במשטרה. לאור עמדתו החדשה של הנאשם באשר להליך טיפולי ושיקומי, המליץ שירות המבחן כן להעמידו בצו מבחן למשך שנה ולשלבו בטיפול מותאם לצרכיו, וחזר על המלצתו הראשונית להטלת עונש מאסר לריצוי בדרך של עבודות שירות.",תסקירי מבחן 
SH-20-09-43084-871,תסקיר מבחן מיום 18.9.2022 (להלן: התסקיר הרביעי),תסקירי מבחן 
SH-20-09-43084-871,"שירות המבחן עדכן כי במהלך תקופת הדחייה שמר על קשר עם שירות המבחן ומסר כי הצליח להשתלב בעבודה חדשה, התחתן וממוקד ברצונו להביא ליציבות בחייו. הנאשם שולב בקבוצת הכנה לטיפול, פגישה ראשונה התקיימה ביום 8.9.2022 ועד כתיבת התסקיר הרביעי התקיימו שני מפגשים בהם נכח הנאשם ושיתף פעולה באופן מלא. מגיליון רישום פלילי מעודכן עולה כי לנאשם לא נפתחו תיקים חדשים. לאור האמור, חזר שירות המבחן על המלצותיו האחרונות מהתסקיר השלישי, משמע ענישה שיקומית.",תסקירי מבחן 
SH-20-09-43084-871,תסקיר מבחן מיום 30.11.2022 (להלן: התסקיר החמישי),תסקירי מבחן 
SH-20-09-43084-871,"שירות המבחן עדכן כי הנאשם סיים בהצלחה השתלבותו בטיפול בקבוצת הכנה לטיפול, הגיע לרוב המפגשים שהתקיימו, גילה אחריות ועמד בדרישות ההליך הטיפולי. בהמשך שולב בקבוצה הטרוגנית אשר עוסקת בהגברת מודעות ויכולת הפרט לקיים תקשורת בינאישית ישירה ובונה, תוך הפחתת השימוש בתקשורת פוגענית כלפי הסביבה ועצמו, זיהוי והכרה בקשיים האישיים תוך התייחסות לתפיסות ודפוסים עבריינים ופיתוח דרכי התמודדות והבנייה של התנהגויות נורמטיביות ביחוד במצבי לחץ ומצוקה. עד למועד כתיבת התסקיר התקיימו ארבעה מפגשים והנאשם הגיע לכולם והשתתף באופן מלא.",תסקירי מבחן 
SH-20-09-43084-871,"הנאשם שיתף את שירות המבחן אודות שיפור והתייצבות במצבו האישי והתעסוקתי כמו גם שביעות רצונו מהשתתפותו בטיפול הקבוצתי, והדגיש כי נעזר בתכנים בהתמודדותו בחיי היום יום, בייחוד סביב קשריו החברתיים. שירות המבחן התרשם כי הנאשם מצוי בהליך עריכת שינוי באורח חייו ברבדים השונים. מגיליון רישום פלילי עדכני עלה כי לא נפתחו כנגד הנאשם תיקים חדשים בתקופת הדחייה. נוכח כל האמור חזר שירות המבחן על המלצותיו.",תסקירי מבחן 
SH-20-09-43084-871,תסקיר מבחן מיום 18.6.2023 (להלן: התסקיר השישי),תסקירי מבחן 
SH-20-09-43084-871,"במסגרת תקופת הדחייה המשיך הנאשם לשתף פעולה עם שירות המבחן כנדרש, הגיע באופן סדיר למפגשים הקבוצתיים ומצוי בשלב טיפולי מתקדם. שירות המבחן מסר כי ניכר שהנאשם מגלה מחויבות ומוטיבציה לשקם את מצבו ואת אורח חייו, והנאשם עצמו ציין שביעות רצונו מהשתתפותו בקבוצה הטיפולית.",תסקירי מבחן 
SH-20-09-43084-871,"שירות המבחן התרשם מנאשם בוגר המגלה יכולת התבוננות עצמית, מחויבות לשקם מצבו, לומד ומסיק מסקנות על אודות התנהגותו עוברת חוק שמודע יותר למחירים של מעורבותו בעבירות. בתקופת הדחייה לא נפתחו כנגדו תיקים חדשים במשטרה.",תסקירי מבחן 
SH-20-09-43084-871,"בין גורמי הסיכון, שקל שירות המבחן את אופי העבירות המיוחסות לנאשם, וחומרתן ונטייתו להתנהגות אימפולסיבית בסיטואציות מורכבות וקשייו לווסת את דחפיו. בין גורמי הסיכוי לשיקום שקל שירות המבחן את לקיחת האחריות של הנאשם, תוך ביטוי צער וחרטה מצדו, יציבותו והתמדתו בתחום התעסוקה, ההערכה כי הוא בעל תפיסת תפקיד מגובשת, מודעותו להשלכות מעשיו, שיתוף פעולה חיובי בהליך הטיפול הקבוצתי, ההתרשמות של שירות המבחן מיכולת הנאשם להפיק תועלת ולמידת לקחים, יכולתו לבחון את התנהגותו עוברת חוק באופן ביקורתי, הערכת שירות המבחן כי ההליכים המשפטיים מהווים גורם מרתיע ומציב גבול והעובדה כי לא נפתחו כנגד הנאשם תיקים חדשים. נוכח האמור, חזר שירות המבחן על המלצותיו.",תסקירי מבחן 
SH-20-09-43084-871,תסקיר מבחן מיום 28.2.2024 (להלן: התסקיר השביעי והאחרון),תסקירי מבחן 
SH-20-09-43084-871,"הנאשם סיים השתתפותו בהצלחה בקבוצה הטיפולית ביום 19.2.2024 ובתקופת הדחייה לא נפתחו כנגדו תיקים חדשים. שירות המבחן התרשם משינוי בתפיסותיו של הנאשם ומודעותו הגוברת לדפוסיו הבעייתיים. משכך, שב שירות המבחן וחזר על המלצתו המקורית, משמע, להשית על הנאשם עונש מאסר לריצוי בעבודות שירות.",תסקירי מבחן 
SH-20-09-43084-871,"המאשימה בטיעוניה עמדה על הערכים המוגנים שנפגעו ממעשיו של הנאשם ובהם ההגנה על שלום הציבור ובריאותו וכן על הנזקים העקיפים הפוטנציאלים הנלווים לעבירות סחר בסמים. בתוך כך נטען כי כתב האישום הנדון הוא חלק מפרשייה, והגם שהנאשם תיווך בעבירות סמים, תפקידו היה דומיננטי, ניכר כי הוא מעורה בתחום הסמים ובעל קשרים. כן הפנתה המאשימה למספר העסקאות, סוג הסם שנמכר והכמות כמו גם עמלות התיווך שגבה הנאשם עבור פעילותו הפלילית. בהינתן אלו ולנוכח העונשים שהוטלו על אחרים במסגרת הפרשייה בדגש על מר אבו חג'ג' (עפ""ג 8112-11-23 אבו חג'ג' נ' מדינת ישראל (19.3.2024) (טעת/4) – (להלן: עניין אבו חג'ג'), עתרה המאשימה לקבוע מתחם ענישה בין 48-24 חודשים ורכיבים נוספים. ",טיעוני הצדדים לעונש
SH-20-09-43084-871,"באשר לעונש שראוי שיוטל על הנאשם, המאשימה זקפה לזכותו את גילו ונסיבותיו האישיות, הודאתו ונטילת האחריות, תסקירי המבחן שהם בעלי אלמנטים חיוביים כמו גם לתקופה בה שהה הנאשם במעצר מאחורי סורג ובריח (8.9.2020 ועד 8.12.2020). לחובתו של הנאשם זקפה המאשימה את הרשעתו הקודמת שהתיישנה והרשעותיו בתחום התעבורה (טעת/1, טעת/2, טעת/3). המאשימה הבהירה כי אינה מתעלמת מהמלצת התסקירים אך לטעמה, שיקולי שיקום מצדיקים התחשבות אך לא סטייה ועונש מאסר בדרך של עבודות שירות אינו עולה בקנה אחד עם עיקרון ההלימה.",טיעוני הצדדים לעונש
SH-20-09-43084-871,"משכך, עתרה המאשימה להכריז על הנאשם סוחר סמים ולהטיל עליו עונש הנמצא בתחתית מתחם הענישה לו עתרה, דהיינו 24 חודשי מאסר בפועל לצד מע""ת, קנס בסך 25,000 ₪, פסילת רישיון נהיגה בפועל ועל תנאי כמו גם חילוט הטלפון ששימש את הנאשם בעבירות.",טיעוני הצדדים לעונש
SH-20-09-43084-871,"ב""כ הנאשם לא חלק על מתחם הענישה שנקבע בעניין אבו חג'ג' שהוא ראוי גם בענייננו, בהינתן חלקו של הנאשם כמתווך ולא כמקור הסמים ומי שגרף לכיסו מלוא הרווחים. למעשה, במוקד הטיעון עמדו הנסיבות המצדיקות, כך לטעם ההגנה, חריגה ממתחם הענישה כהמלצת שירות המבחן. בין אלו, מנה את גילו של הנאשם, נסיבותיו האישיות, עברו הפלילי שהתיישן, ההודאה והחיסכון בזמן שיפוטי, תקופת המעצר הממושכת שהיוותה גורם מטלטל ומציב גבול, וההליך הטיפולי בו השתלב הנאשם בחסות שירות המבחן. לטעם ההגנה, חלוף הזמן המשמעותי, שינוי הסטטוס המשפחתי, שמירה על יציבות תעסוקתית, ניתוק קשרים שוליים ובדיקות שתן נקיות כמו גם העדר הסתבכות נוספת והמוטיבציה שמביע הנאשם להמשיך ולשנות את מסלול חייו לטובה, מלמדים כאלף עדים על שיקום של ממש ולא רק על פוטנציאל שיקומי מבטיח.",טיעוני הצדדים לעונש
SH-20-09-43084-871,"כן נטען כי התמשכות ההליכים, והסכמות התביעה לדחיות השונות, יצרה אצלו באופן טבעי ולגיטימי ציפייה כי העונש שיוטל עליו יהיה מאסר בדרך של עבודות שירות ולא במאסר מאחורי סורג ובריח, ולא בכדי התבקש הממונה לחוות דעתו ביחס לאפשרות זו, פעמיים.",טיעוני הצדדים לעונש
SH-20-09-43084-871,"לאור האמור, עתר ב""כ הנאשם לקבוע כי יש מקום לחרוג מהמתחם בשל שיקולי שיקום. בהתאם לכך, הפנה לתסקירים שהתקבלו בעניינו של הנאשם ולהמלצות החוזרות של שירות המבחן. עוד הוסיף, כי הנאשם נכון לעמוד בכל רכיב כלכלי אשר יגזור בית המשפט.",טיעוני הצדדים לעונש
SH-20-09-43084-871,"הנאשם בדברו האחרון: ""כל העונשים שאני יכול לקבל, אנשים איבדו בי אמון. אני עובד פה יום, שם יום. אם אלך לבית סוהר זה גזר דין מוות.",טיעוני הצדדים לעונש
SH-20-09-43084-871,"לצורך קביעת גבולות המתחם, הצדדים מסכימים שכתב האישום מגלם אירוע אחד הכולל מספר מעשים עבריינים. עוד מוסכם כי המתחם שנקבע בעניין אבו חג'ג' שאושרר בערכאת הערעור, משמע, 48-24 חודשי מאסר וענישה נלווית, נכון גם לענייננו. לכאורה, ניתן היה להסתפק בכך כדי לעבור לשלב השני בגזירת הדין. עם זאת, אתייחס לפגיעה בערכים המוגנים כמו גם לנסיבות ביצוע העבירות, מפאת חשיבותם לבחינת בקשת ההגנה לסטייה ממתחם הענישה. ",קביעת מתחם העונש ההולם
SH-20-09-43084-871,"הנאשם במעורבותו בעסקאות הסמים פגע בערכים עליהם ביקש המחוקק להגן ובכלל אלה, שמירה על שלום ובריאות הציבור וההגנה מפני הנזקים החברתיים, הן הישירים והן העקיפים אשר נגרמים כתוצאה מעבריינות הנלווית לשימוש בסמים לרבות ההגנה על הביטחון האישי ורכוש הציבור.",קביעת מתחם העונש ההולם
