verdict,text,part
SH-21-03-56850-36,"ת""פ 56850-03-21 מדינת ישראל נ' ניסימוב",בית משפט השלום בתל אביב -יפו
SH-21-03-56850-36,"ת""פ 56850-03-21 מדינת ישראל נ' ניסימוב",בית משפט השלום בתל אביב -יפו
SH-21-03-56850-36,"ת""פ 56850-03-21 מדינת ישראל נ' ניסימוב",בית משפט השלום בתל אביב -יפו
SH-21-03-56850-36,"ע""י ב""כ עו""ד שיראל טויטו",מדינת ישראל 
SH-21-03-56850-36,"ע""י ב""כ עו""ד שיראל טויטו",מדינת ישראל 
SH-21-03-56850-36,"ע""י ב""כ עו""ד שיראל טויטו",מדינת ישראל 
SH-21-03-56850-36,"ע""י ב""כ עו""ד וליד כבוב",דוד ניסימוב 
SH-21-03-56850-36,"ע""י ב""כ עו""ד וליד כבוב",דוד ניסימוב 
SH-21-03-56850-36,"ע""י ב""כ עו""ד וליד כבוב",דוד ניסימוב 
SH-21-03-56850-36,"פקודת הסמים המסוכנים [נוסח חדש], תשל""ג-1973: סע'  7(א), 7(ג), 13, 19א",חקיקה שאוזכרה: 
SH-21-03-56850-36,"הנאשם הורשע – על יסוד הודאתו בעובדות כתב האישום, שניתנה במסגרת הסדר טיעון – בביצוע עבירות של סחר בסמים מסוכנים, לפי הוראות סעיף 13 יחד עם סעיף 19א לפקודת הסמים המסוכנים [נוסח חדש], תשל""ג-1973 (להלן – פקודת הסמים המסוכנים) ושל החזקת סמים מסוכנים שלא לצריכה עצמית, לפי הוראות סעיף 7(א) וסעיף 7(ג) רישא לפקודת הסמים המסוכנים.",רקע כללי:
SH-21-03-56850-36,"בעובדות כתב האישום נטען כי ביום 23.03.2021 בשעה 21:12 או בסמוך לכך, ברחוב בתל אביב וכשהוא יושב ברכב, מכר הנאשם לפלונית סמים מסוכנים מסוג קנבוס, במשקל של 5.3 גרם נטו ובתמורה לסך של 400 ₪. בנוסף, באותן הנסיבות החזיק הנאשם בסמים מסוכנים מסוג קנבוס, ברכב, כלהלן: בדלת שמאל של הרכב, הקרובה למושב הנהג, בשקית ובה סמים במשקל של 5.1 גרם נטו; על הרצפה שמאחורי מושב הנהג, בשקית גדולה המכילה 3 אריזות סמים במשקל של 30.1 גרם נטו ועוד 8 אריזות סמים מסוכנים במשקל של 93.60 גרם נטו.",רקע כללי:
SH-21-03-56850-36,"בדיונים המקדמיים לא הגיעו הצדדים לכלל הסכמות, הנאשם כפר במיוחס לו והתיק הועבר לשמיעת הראיות לפניי. ואולם, במועד שנקבע לשמיעת הראיות הציגו הצדדים הסדר טיעון, שבמסגרתו הודיעה המאשימה כי תגביל את עתירתה ברכיב המאסר בפועל לעונש של שמונה חודשי מאסר בפועל, שניתן לשאתם בעבודות שירות. אשר ליתר רכיבי הענישה הסכימו הצדדים לעתור במשותף להשתת עונשי מאסר מותנה, קנס, פסילת רישיון נהיגה על תנאי, כאשר המאשימה תעתור גם לפסילת רישיון נהיגה בפועל. עוד הסכימו הצדדים לעתור במשותף לחילוט הכסף המזומן, בסך של 400 ₪, שנתפס בידי הנאשם, ולהשבת שני הטלפונים הניידים שנתפסו ברשותו (ר' בפרוטוקול, עמ' 7 שורה 11 ואילך).",רקע כללי:
SH-21-03-56850-36,"הנאשם הודה אפוא בעובדות כתב האישום והורשע, על יסוד הודאה זו, בעבירות שבהן הואשם כאמור בפסקה 2 דלעיל (ר' הכרעת הדין בעמ' 8 ובעמ' 12 לפרוטוקול). בהמשך להסכמות הצדדים הורה בית המשפט על חילוט הסכום האמור של 400 ₪ (ר' גם בהודעה שבסיפא לכתב האישום), והשבת הטלפונים הניידים. עוד הורה בית המשפט על תסקיר שירות המבחן וחוות דעת הממונה, תוך הבהרה כי אין בהחלטה משום קביעה באשר לעונש הראוי במקרה זה (ר' ההחלטה בעמ' 9-8 לפרוטוקול).",רקע כללי:
SH-21-03-56850-36,"תסקיר שירות המבחן (מיום 02.04.2023), מפרט את נסיבותיו האישיות של הנאשם, יליד שנת 1996 (בן 27 שנים כיום). הנאשם, רווק המתגורר עם משפחתו בבאר שבע, עלה ארצה מהקווקז בגיל שנתיים. הנאשם סיים 12 שנות לימוד ושירת שירות צבאי מלא, כלוחם. לאחר שחרורו עבד הנאשם במספר עבודות וכיום הוא עובד בפיצרייה. לאחרונה החל הנאשם, במקביל לעבודתו, לימודי הנדסאות תוכנה במכללה הטכנולוגית בעיר מגוריו.",עיקר תסקירי שירות המבחן:
SH-21-03-56850-36,"אשר לצריכת חומרים פסיכו-אקטיביים מסר הנאשם כי החל לצרוך אלכוהול, בסופי שבוע, עוד בהיותו בן 16 שנים. לדברי הנאשם, הוא התנסה לראשונה בצריכת סמים מסוכנים מסוג קנבוס בהיותו בן 17, בנסיבות חברתיות, אך הדבר גרם לו לתחושות לא נעימות ועל כן נמנע מכך. את הרקע לביצוע העבירות דנא תירץ בכך שבאותה התקופה עבד באופן מזדמן, ללא הכנסה קבועה, ועל כן – נוכח היכרותו עם חברה שולית בסביבת מגוריו – בחר לרכוש סמים באמצעות אפליקציית ""טלגרם"" ולסחור בהם.",עיקר תסקירי שירות המבחן:
SH-21-03-56850-36,"שירות המבחן בחן את גורמי הסיכון והסיכוי בעניינו של הנאשם. כגורמי סיכון צוינו המסגרת החברתית אשר עטפה את הנאשם בצעירותו ותרמה לביצוע עבירות, הקושי בוויסות צרכיו והשגת רווחים מידיים מבלי לבחון את השלכת מעשיו על עצמו ועל הסובבים אותו, וכן עמדותיו המקלות של הנאשם כלפי צריכת סמים מסוכנים מסוג קנביס. מנגד, כגורמי סיכוי צוינה ההתרשמות מנאשם נעדר עבר פלילי, בעל יכולות הסתגלות במסגרות תעסוקתיות ולימודיות לצד מוטיבציה לתרום לחברה, כפי שבאה לידי ביטוי בשירותו הצבאי. עוד צוינו התמיכה המשפחתית בנאשם וההתרשמות מההשפעה המרתיעה של ההליך המשפטי ומנזקקות טיפולית. בנסיבות אלה המליץ שירות המבחן לדחות את הדיון לצורך שילוב הנאשם בהליכי טיפול.",עיקר תסקירי שירות המבחן:
SH-21-03-56850-36,"התסקיר המשלים (מיום 20.09.2023) מתאר את שילוב הנאשם בהליכי הטיפול. ממנחות הקבוצה הטיפולית עלה כי הנאשם הגיע לכל המפגשים בזמן ושיתף שברצונו לרכוש כלים יישומיים על מנת לנקוט בבחירות מיטביות בהמשך חייו. בשיחה שערך השירות עם הנאשם שיתף הלה כי הוא רואה את שילובו בקבוצה כהזדמנות לשקם את עצמו, ללמוד ולהחכים בכל הנוגע לבחירות חייו העתידיות; כשתוך כך הוא מתמיד בעבודתו בפיצרייה.",עיקר תסקירי שירות המבחן:
SH-21-03-56850-36,"בנסיבות אלה, נוכח ההתרשמות החיובית של שירות המבחן משיתוף הפעולה של הנאשם, כמו גם החשיבות שבמעקב אחר השתלבות הנאשם בהליכי טיפול, המליץ השירות להטיל על הנאשם צו מבחן לתקופה של שנה. בהמשך לכך, ובמישור העונשי, המליץ שירות המבחן להסתפק בענישה שיקומית-טיפולית בדמות צו של""צ בהיקף משמעותי של 300 שעות.",עיקר תסקירי שירות המבחן:
SH-21-03-56850-36,"בטיעוניה לעונש עמדה ב""כ המאשימה על עובדות כתב האישום המתוקן, בהן הודה הנאשם, והדגישה את נסיבות החומרה שבהן, דהיינו: העובדה שהנאשם סחר בסמים ברכבו, בשעת ליל, וכן העובדה שהנאשם החזיק בכמות סמים נוספת נכבדה, כשהם מחולקים וברכבו, עובדות המלמדות על פוטנציאל הפצה גבוה. יש להעיר כי ב""כ המאשימה חזרה על העתירה לחילוט, אלא שכאמור הוראה בדבר חילוט ניתנה עוד במועד הצגת הסדר הטיעון (ר' בפסקה 4 דלעיל).",עיקר טיעוני הצדדים:
SH-21-03-56850-36,"עוד עמדה ב""כ המאשימה על הערכים החברתיים, אשר נפגעו כתולדה מביצוען של עבירות הסמים דנא, ובהם הצורך למגר את נגע הסמים נוכח הפגיעות בשלום הציבור, בביטחונו ובבריאותו הנגרמות עקב השימוש בסמים מסוכנים. בנסיבות אלה ותוך הפניה לפסיקה עתרה ב""כ המאשימה לקביעת מתחם עונש הולם שבין 8 חודשי מאסר בפועל לבין 18 חודשי מאסר בפועל. אשר למדיניות הענישה הנהוגה הפנתה ב""כ המאשימה, בין השאר, לת""פ (שלום ב""ש) 6118-02-19 מדינת ישראל נ' רובינוב (30.03.2022). באותו מקרה דובר בהחזקת סמים מסוכנים מסוג קנבוס שלא לצריכה עצמית, ברכב ובמשקל של 101.5 גרם נטו, ונקבע מתחם עונש הולם שבין 4 חודשי מאסר בפועל לבין 12 חודשי מאסר בפועל. ",עיקר טיעוני הצדדים:
SH-21-03-56850-36,"אשר לגזירת עונשו של הנאשם בתוך מתחם העונש ההולם ציינה ב""כ המאשימה כי התסקירים הם אמנם ""בסדר"" אך לשיטתה אינם מצדיקים חריגה ממתחם העונש ההולם, שכן עולה מהם שהנאשם אימץ תפיסות שוליות בהתייחס לסמים מסוכנים ובמצבי דחק הוא עשוי לפעול באופן עובר חוק. עם זאת, ב""כ המאשימה עמדה גם על נסיבות הקולה, ובהן העדר העבר הפלילי ונטילת האחריות, ובנסיבות אלה עתרה לגזירת העונש ברף התחתון של המתחם לו טענה, בצירוף ענישה נלווית כפי שפורטה במסגרת הצגת הסדר הטיעון.",עיקר טיעוני הצדדים:
SH-21-03-56850-36,"ב""כ הנאשם, מצידו, הדגיש את נסיבותיו האישיות של מרשו, שהוא כאמור נעדר עבר פלילי כלשהו. הנאשם שולב בהליך טיפולי ממושך, והוא מביע רצון ונכונות להמשיך בו. לשיטתו של הסניגור, מדובר בנאשם שמעד חד פעמית – בפעם הראשונה ובפעם האחרונה – ובנסיבות אלה עתר מאוד לאימוץ המלצות שירות המבחן ולהסתפקות בענישה שיקומית-טיפולית.",עיקר טיעוני הצדדים:
SH-21-03-56850-36,"לבסוף הנאשם, בדברו האחרון לעונש, אמר: ""אני מביע חרטה, אני סיימתי לימודים ועובד והכל מאחוריי"" (בפרוטוקול, עמ' 14 שורה 15 ואילך).",עיקר טיעוני הצדדים:
SH-21-03-56850-36,"בעת גזירת עונשו של נאשם על בית המשפט לקבוע, תחילה, את מתחם העונש ההולם לאירוע שבגינו הורשע הנאשם, וזאת בהתאם לעיקרון ההלימה. בהקשר זה יתחשב בית המשפט בערכים החברתיים שנפגעו מביצוע העבירות ובמידת הפגיעה בהם, במדיניות הענישה הנהוגה ובנסיבות הקשורות בביצוע העבירות.",קביעת מתחם העונש ההולם:
SH-21-03-56850-36,"לעניין הערכים החברתיים, שנפגעו כתולדה מביצוע העבירות, מקובל עליי טיעון ב""כ המאשימה. הפסיקה חוזרת ומדגישה את חומרתן הרבה של עבירות הסמים, בפרט כאשר מדובר בהחזקת סמים מסוכנים שלא לצריכה עצמית; ואף מעבר לכך כאשר מדובר בסחר בסמים מסוכנים. בנוסף, חומרתן של העבירות נובעת גם מנסיבות ביצוען, כאשר בענייננו – לגבי העבירה של החזקת סמים מסוכנים שלא לצריכה עצמית – מתקיימות מספר נסיבות חומרה: ראשית, החזקת כמות לא מבוטלת של סמים מסוכנים, המחולקת לאחת עשרה שקיות. שנית, החזקת הסמים האמורים ברכב, על כל החומרה הנוספת הנובעת מכך לעניין פוטנציאל ההפצה.",קביעת מתחם העונש ההולם:
SH-21-03-56850-36,"לעניין מדיניות הענישה הנהוגה, כאשר מדובר בסחר בסמים מסוכנים – בסמים מסוג קנבוס ובכמויות קטנות – נקבעים ככלל מתחמי עונש הולמים שתחילתם במאסר בפועל, לנשיאה בעבודות שירות, הגם שיש מקרים בהם נקבעים מתחמים שתחילתם בענישה צופה פני עתיד בצירוף ענישה נלווית (ר' והשווה ת""פ (שלום ת""א) 2125-05-20 מדינת ישראל נ' שמשון (25.12.2022) והאסמכתאות שם). בענייננו לא מדובר רק בסחר אלא גם בהחזקה של כמות סמים נוספת, שלא לצריכה עצמית, ובנסיבות מחמירות כנ""ל (למדיניות הענישה בהקשר זה ר' ת""פ (שלום ת""א) 36891-03-22 מדינת ישראל נ' ביבליוביץ (28.06.2023)).",קביעת מתחם העונש ההולם:
SH-21-03-56850-36,"אני קובע אפוא את מתחם העונש ההולם, במקרה זה, בין מספר חודשי מאסר בפועל, לנשיאה בדרך של עבודות שירות, לבין 12 חודשי מאסר בפועל.",קביעת מתחם העונש ההולם:
SH-21-03-56850-36,גזירת עונשו של הנאשם בתוך מתחם העונש ההולם והאפשרות לחריגה הימנו:,קביעת מתחם העונש ההולם:
SH-21-03-56850-36,"לאחר קביעת מתחם העונש ההולם על בית המשפט לגזור את עונשו של הנאשם בתוך מתחם זה, תוך התחשבות בנסיבות שאינן קשורות בביצוע העבירה. עם זאת, לבית המשפט קיימת סמכות לחרוג לכף קולה ממתחם העונש ההולם, משיקולי שיקום, בהתאם להוראות סעיף 40ד לחוק העונשין. לפי הוראות סעיף זה, אם מצא בית המשפט כי הנאשם השתקם או כי יש סיכוי של ממש שישתקם, הוא רשאי לחרוג לכף קולה ממתחם העונש ההולם ולקבוע את עונשו של הנאשם לפי שיקולי שיקומו.",קביעת מתחם העונש ההולם:
SH-21-03-56850-36,"הנאשם שלפניי הוא אדם צעיר יחסית, כאמור בן 27 שנים, ללא כל רישומים פליליים – לא לפני מועד ביצוע העבירות דנא ולא לאחריהן, כאשר להיבט אחרון זה משמעות מהותית נוכח חלוף תקופה של כשנתיים וחצי מאז ביצוע העבירות. הנאשם נטל אחריות על מעשיו, הודה בעובדות כתב האישום והצהיר על רצונו לשנות כיוון בחייו ולא לשוב עוד לדרך העבירה. בנוסף, לנאשם תמיכה משפחתית, הוא עובד לפרנסתו ואף השתלב בלימודים, מתוך מגמה לרכוש מקצוע ולנהל חיים נורמטיביים ויצרניים. לבסוף, וזו הנקודה העיקרית כאן, הנאשם השתלב בהליכים טיפוליים, בהם הוא משתף פעולה באופן מלא וכן, תוך הבעת מוטיבציה להסתייע בהליכים אלה ולהשתקם.",קביעת מתחם העונש ההולם:
SH-21-03-56850-36,"בנסיבות אלה יש מקום, אפוא, לחריגה לכף קולה ממתחם העונש משיקולי שיקום, על מנת לעודד את הנאשם בדרך השיקום, לרבות בהימנעות מהטלת עונש של פסילת רישיון נהיגה בפועל. עם זאת, כאיזון להקלה מהותית זו יש להשית על הנאשם ענישה כלכלית ממשית, שתבהיר לנאשם את חומרת מעשיו.",קביעת מתחם העונש ההולם:
SH-21-03-56850-36,"אשר על כן – ובהתחשב בשיקולים לכף חומרה ולכף קולה, אשר פורטו לעיל – אני גוזר על הנאשם את העונשים הבאים:",סוף דבר:
SH-21-03-56850-36,"(א)	מאסר על תנאי למשך 6 חודשים, אותו לא יישא הנאשם אלא אם כן יעבור, תוך שלוש שנים מהיום, עבירה לפי הוראות פקודת הסמים המסוכנים מסוג פשע.",סוף דבר:
SH-21-03-56850-36,"(ב)	קנס בסך של 3,500 ₪, או 10 ימי מאסר תמורתו.",סוף דבר:
SH-21-03-56850-36,"הקנס ישולם ב-7 תשלומים חודשיים, שווים ורצופים, החל מיום 01.01.2024 ובכל אחד בחודש שלאחריו. היה והנאשם לא ישלם את אחד התשלומים במועד תועמד כל יתרת הקנס לפירעון מידי.",סוף דבר:
SH-21-03-56850-36,"(ג)	פסילה מלקבל או להחזיק רישיון נהיגה למשך 3 חודשים על תנאי, והתנאי הוא שבמשך שנתיים מהיום לא יעבור הנאשם עבירה מהעבירות המנויות בפקודת הסמים המסוכנים.",סוף דבר:
SH-21-03-56850-36,"(ד)	שירות לתועלת הציבור בהיקף של 300 שעות. השירות יבוצע, בהתאם לתכנית שגיבש שירות המבחן, בהקדם האפשרי, החל במועד שייקבע שירות המבחן.",סוף דבר:
SH-21-03-56850-36,"מובהר בזה לנאשם כי אם הוא לא ימלא אחר הוראות צו השירות יהא בית המשפט רשאי לבטל את צו השירות ולהטיל עליו, במקום צו השירות, עונש נוסף.",סוף דבר:
SH-21-03-56850-36,"(ה)	צו מבחן, לתקופה של 12 חודשים מהיום.",סוף דבר:
SH-21-03-56850-36,"מובהר בזה לנאשם כי אם הוא לא ימלא אחר הוראות צו המבחן ולא ישתף פעולה עם קצין המבחן, יהא בית המשפט רשאי לבטל את צו המבחן ולגזור עליו, במקום צו המבחן, עונש נוסף.",סוף דבר:
SH-21-03-56850-36,"ככל שנותר בתיק בית המשפט – או בתיקים קשורים – פיקדון שהופקד מטעם הנאשם, בהסכמת ההגנה יקוזז הפיקדון לתשלום הקנס.",סוף דבר:
SH-21-03-56850-36,"5129371ניתן בזה צו כללי, לעניין מוצגים, לשיקול דעתו של קצין משטרה. הסמים יושמדו (לעניין החילוט ר' ההחלטה בפרוטוקול הדיון מיום 23.10.2022).",סוף דבר:
SH-21-03-56850-36,54678313זכות ערעור בתוך 45 יום מהיום.,סוף דבר:
SH-21-03-56850-36,המזכירות תמציא גזר דין זה לשירות המבחן.,סוף דבר:
SH-21-03-56850-36,"ניתן היום, כ""ג כסלו תשפ""ד, 06 דצמבר 2023, במעמד הצדדים.",סוף דבר:
SH-21-03-56850-36,נוסח מסמך זה כפוף לשינויי ניסוח ועריכה,שאול אבינור 54678313
SH-21-03-56850-36,"בעניין עריכה ושינויים במסמכי פסיקה, חקיקה ועוד באתר נבו – הקש כאן",שאול אבינור 54678313
