verdict,text,part
"ת""פ 21724-08-22","ת""פ 21724-08-22 מדינת ישראל נ' ראובן",בית משפט השלום בתל אביב -יפו
"ת""פ 21724-08-22","ב""כ המאשימה: עו""ד לילך גולן, עו""ד מיכל כהן ומתמחה, מר פינחס סנדיק",נוכחים:
"ת""פ 21724-08-22","ב""כ הנאשם: עו""ד משה זכות",נוכחים:
"ת""פ 21724-08-22","פקודת הסמים המסוכנים [נוסח חדש], תשל""ג-1973: סע'  7.א., 7.ג, 13, 19א",חקיקה שאוזכרה: 
"ת""פ 21724-08-22","חוק המרשם הפלילי ותקנת השבים, תשמ""א-1981",חקיקה שאוזכרה: 
"ת""פ 21724-08-22","הנאשם, יליד 1994, הורשע על בסיס הודאתו ובמסגרת הסכמה דיונית, בעבירת יצוא, יבוא, מסחר, הספקה סמים מסוכנים – עבירה לפי סעיף 13 + 19א לפקודת הסמים המסוכנים (נוסח חדש) התשל""ג-1973, ועבירה של החזקה/ שימוש בסמים שלא לצריכה עצמית – עבירה לפי סעיף 7(א)+7(ג).",כללי
"ת""פ 21724-08-22","בהתאם לעובדות כתב האישום המתוקן, ביום 2.8.22, בשעה 19:00, הזמינה מ.פ דרך אפליקציית ""טלגרם"" סם מסוכן מסוג קנאביס. ביום 2.8.22 בשעה 22:40, הגיע הנאשם על רכבו מסוג ""סיטוראן"", לרחוב סוקולוב 94 בת""א וחסם את נתיב הנסיעה. מ.פ. ניגשה במהירות לעבר חלון הרכב שלצד הנוסע והנאשם מכר לה סם מסוכן מסוג קנאביס במשקל 4.62 גרם נטו, בתמורה ל-300 ₪. באותן נסיבות, החזיק הנאשם ברכב ברצפה שמתחת למושב הנוסע הקדמי שקית לבנה ובתוכה 92 שקיות ובתוכן סם מסוכן מסוג קנאביס במשקל כולל של כ-300 גרם נטו, וזאת שלא לצריכתו העצמית. כמו כן, החזיק הנאשם בתוך הרכב על מושב הנוסע 300 ₪ וכן על גופו 1,440 ₪.",כללי
"ת""פ 21724-08-22","ההסדר לא כלל הסכמות לעניין העונש. הוסכם כי בטרם טיעונים לעונש יופנה הנאשם לשירות המבחן לקבלת תסקיר אשר יבחן, בין היתר, אפשרות לבטל את ההרשעה. התביעה הבהירה כי עמדתה תהיה להותרת ההרשעה.",כללי
"ת""פ 21724-08-22","מתסקיר שירות המבחן מיום 10.7.23 עולה כי הנאשם בן 29, רווק, מתגורר בבית הוריו ועובד בעבודות מזדמנות בנגרות ושיפוצים וכן בעסק של הוריו. בגיל 10 נפגע ברגלו, עבר ניתוח וסובל מאז מכאבי גב. הנאשם נעדר עבר פלילי, השלים 12 שנות לימוד ובעל תעודת בגרות מלאה, התגייס לצה""ל ושירת בתפקידי הדרכה בפיקוד העורף ואף זכה להערכה רבה ממפקדיו. מאז עסק בתחומים שונים, בהם אבטחת מידע בחברת הייטק, בעל נגרייה עצמאי וכן שותף עם אחרים בתחום זה. כיום גם לומד בקורס ""משיטים"", מתעתד לשפר ציוני בגרות ולעבור הבחינה הפסיכומטרית, כאשר היעד בהמשך הוא להשתלב בלימודי משפטים. עוד נמסר כי מזה מספר שנים מחזיק ברשיון לשימוש בקאנביס רפואי. בחינה כללית וראשונית של נסיבות ההסתבכות הנוכחית עם החוק העלתה כי הנאשם מודה במיוחס לו וכי באותה תקופה כבר החזיק ברישיון שימוש בקאנביס רפואי, אולם לדבריו הכמויות שאושרו לו לא ענו על צרכיו, ועל כן גם קנה סם באופן לא חוקי והיה מעורב בקשר עם גורמי סחר. שירות המבחן ביקש דחייה של מספר חודשים לצורך השלמת התמונה האבחונית, הערכת מצבו וצרכיו של הנאשם וכן גיבוש ההמלצה בשאלת ההרשעה והעונש.",תסקירי שירות מבחן וחוות דעת הממונה על עבודות שירות
"ת""פ 21724-08-22","בתסקיר שירות מבחן מיום 14.1.24 דיווח שירות המבחן כי בתקופת הדחייה נשמרה שגרה חיובית בחייו, הוא מתגורר בבית הוריו, עובד באופן חלקי כמורה מחליף בבי""ס יסודי וכן מסיע בעסק של הוריו ומפעיל יזמויות שונות על מנת להגדיל את הכנסותיו. לדבריו, שוקל גם לימודים גבוהים בהמשך. התרשמו כי עבר תהליך עצמי של בחינת מהלכיו באירוע, הורתע, מבין את החומרה העולה ממעשיו וכן מסוגל לזהות את הקשיים שעמדו ברקע. באשר לסוגיית ההרשעה, לא היה בידי הנאשם להציג אסמכתאות לפגיעה ישירה בשל הרשעה. עם זאת הוערך כי יהיה בכך לפגוע בדימויו העצמי, ובאמון שלו ביכולותיו, ובהמשך גם בסיכוייו להתבסס בשוק העבודה, כאשר ההרשעה תהווה אבן נגף בפני מעסיקים שונים, ובפרט באם יקדם תוכנותיו ללימודים גבוהים. הומלץ לשקול בחיוב לבטל ההרשעה ולהסתפק בענישה שיקומית, כך שהוא יועמד בפיקוח שירות המבחן למשך שנה, לצו צו של""צ משמעותי בן 500 שעות.",תסקירי שירות מבחן וחוות דעת הממונה על עבודות שירות
"ת""פ 21724-08-22",מחוות דעת ממונה מיום 30.10.23 עולה שהנאשם כשיר לריצוי מאסר בדרך של עבודות שירות.,תסקירי שירות מבחן וחוות דעת הממונה על עבודות שירות
"ת""פ 21724-08-22","ב""כ המאשימה חזר על נסיבות ביצוע העבירה והתייחס לנזקים הישירים והעקיפים הנגרמים כתוצאה מתופעת השימוש בסמים. התובע התייחס לפוטנציאל הפצה העולה מן העבירות ולפיכך לעוצמת פגיעה גבוהה בערכים המוגנים. המאשימה עתרה לקביעת מתחם שבין 8 ל-18 חודשי מאסר בפועל ולתמיכה בעמדה זו הוגשה פסיקה. באשר לשאלת ביטול ההרשעה המאשימה סבורה שבהעדר נזק קונקרטי יש להותיר ההרשעה על כנה. ב""כ המאשימה ביקש למקם את הנאשם בתחתית המתחם ולהטיל עליו 8 חודשי מאסר בעבודות שירות לצד רכיבים נלווים. בנוסף הוסכם על חילוט סכום הכסף שנתפס בסך 1,740 ₪.",טיעוני הצדדים
"ת""פ 21724-08-22","ב""כ הנאשם אבחן את הפסיקה שהוגשה והתנגד לטיעון לגבי פוטנציאל הנזק בשל שימוש בסמים כאשר המדינה עצמה מתירה שימוש בסמים. בנוסף, הנאשם בן 29, התארס לאחרונה, לקח אחריות באופן מיידי כבר בישיבה הראשונה. לדברי הסנגור הנאשם נמצא כמעט שנתיים בטיפול בפיקוח שירות המבחן (אם כי הנאשם עצמו סיפר שהגיע לשתי פגישות בלבד לשם הכנת התסקירים). עוד הוסיף הסנגור כי הנאשם נכה, בעל 42% נכות, מחזיק ברישיון לקנביס והעבירה זרה לאורח חייו. כן הוסיף את הרקע בו גדל הנאשם והכוחות שנדרשו לו לבנות חיים נורמטיביים. הסנגור ביקש לתת לנאשם הזדמנות. לגבי ההרשעה הוסיף שהנאשם עובד כמורה מחליף בבית ספר והוא בעל רשיון תיווך ואלו עלולים להיפגע כתוצאה מהרשעה. הסנגור ביקש להימנע מהרשעה ולחילופין לגזור על מרשו 500 שעות של""צ.",טיעוני הצדדים
"ת""פ 21724-08-22",הנאשם בדבריו מסר כי נפגש פעמיים עם קצינת המבחן ועשה מה שהתבקש ממנו. סיפר על רצונו לנהל אורח חיים תקין. סיפר שביצע תפקידי הדרכה בצבא וכיום הוא מורה ובעל רשיון תיווך ובעתיד הוא מעונין לגשת לבחינה הפסיכומטרית וללמוד לימודי משפטים. הנאשם ביקש מבית המשפט הזדמנות.,טיעוני הצדדים
"ת""פ 21724-08-22","הערכים המוגנים שנפגעו- להפצת סמים נזקים רחבים והשפעה הרסנית ברבדים חברתיים רבים. פגיעת הסמים רחבת היקף וכוללת גם את המשתמש הבודד, משפחתו והמעגל הקרוב אליו וגם את החברה כולה בשל פעילות פלילית של הצרכן המבקש לספק את הדחף לסם ומבצע לשם כך עבירות נוספות. מעבר לאלו מייצרים ייצרני הסמים ומעגלי השיווק שלהם, פעילות עבריינית נרחבת. אני דוחה את טיעוני הסנגור לפיהם המדינה מנועה מלטעון לפוטנציאל הנזק הכרוך בשימוש בקנביס נוכח הכרתה באפשרות שימוש בסם זה. טענות דומות הועלו ונדחו בבית המשפט העליון וראו למשל רע""פ 8759/21 קסלר נ' מדינת ישראל (23.12.21) בפסקה 11:",דיון והכרעה
"ת""פ 21724-08-22","""ויודגש, כי אף לאחר ההחלטה אליה מפנה בא כוח המבקש, שב בית משפט זה על הקביעה כי כפי שמוגדר בפקודה, סם הקנבוס הוא סם מסוכן, והוראת המחוקק לעניין זה היא הדין הנוהג והמחייב. כל עוד לא נקבע אחרת, התפיסה לפיה קנבוס הוא בגדר ""סם קל"" ודינו שונה מדינם של סמים אחרים נעדרת אחיזה בדין, ואין בה כדי לבטל את החזקה הקבועה בפקודה"" (ראו ע""פ 6299/20 חן נ' מדינת ישראל [פורסם בנבו] (4.2.2021); בש""פ 6789/21 מדינת ישראל נ' שצ'רבקוב [פורסם בנבו] (17.10.2021); רע""פ 174/21 סויסה נ' מדינת ישראל [פורסם בנבו] (25.2.2021)).",דיון והכרעה
"ת""פ 21724-08-22","דברים אלו נאמרו לגבי החזקה של 229 גר' קנביס והם נכונים מקל וחומר מקום שמדובר בסחר שבוצע באמצעות טלגרם כמו במקרה שלפני. סוחרי הסמים מגדילים כל העת את מעגל המכורים, גורמים לכך שהסמים זמינים לכל דורש לרבות קטינים ומסייעים להפצת הנזקים בקלות ובמהירות בקרב הציבור.",דיון והכרעה
"ת""פ 21724-08-22","בענייננו הנאשם סחר בסם באמצעות אפליקציית ""טלגרם"" כאשר מכר לאחרת סם מסוכן מסוג קנאביס במשקל 4.62 גרם נטו, וזאת בתמורה ל-300 ₪ ובנוסף החזיק ברכבו 92 שקיות ובתוכן סם מסוג קנאביס במשקל כולל של כ-300 גרם נטו. עוצמת הפגיעה בערכים המוגנים אינה נמוכה ופוטנציאל הנזק בלתי מבוטל אף שהמכירה שבוצעה בפועל בכמות קטנה ובסכום נמוך.",דיון והכרעה
"ת""פ 21724-08-22","הערכים המוגנים ועוצמת הפגיעה בהם הם מרכיב מרכזי בבחינת עניינו של נאשם העותר לביטול הרשעה. בבוא בית המשפט לשקול אפשרות זו שומה עליו לאזן בין שני ערכים מתנגשים. האינטרס הציבורי מול נסיבותיו האישיות של הנאשם. רק בהתקיים שני תנאים מצטברים ניתן לסיים הליך ללא הרשעה: האחד - נסיבות העבירה מאפשרות להימנע מהרשעה מבלי לפגוע יתר על המידה באינטרס הציבורי ובשיקולי הענישה האחרים; השני - ההרשעה תסב נזק בלתי מידתי, קונקרטי וממשי לסיכוי שיקומו של הנאשם (ראו רע""פ 8453/15 פלוני נ' מדינת ישראל (03.01.16), רע""פ 8663/15 ‏ ‏לוזנאנו נ'  מדינת ישראל  (22.12.15)). בין שני השיקולים מתקיימת ""מקבילית כוחות""  - ככל שחומרת העבירות פחותה יותר קטנה הדרישה להוכחת נזק קונקרטי  (ראו ע""פ (מחוזי מרכז) 24457-03-15 פבל גוטרמן נ' מדינת ישראל, (30.08.2015) בסעיף 69.",שאלת ביטול ההרשעה 
"ת""פ 21724-08-22","סיום הליך ללא הרשעה הוא תוצאה חריגה וכאשר מדובר בעבירות סחר בסמים והחזקת סם שלא לצריכה עצמית תוצאה חריגה ונדירה עוד יותר. בביצוע עבירות אלה הנאשם חוטא ומחטיא ומשכך יש מקום ליתן משקל ממשי לשיקולי הרתעה, ראו בהקשר זה רע""פ 873/12 פלוני נ' מדינת ישראל (2.2.12). וראו גם: רע""פ 5478/19 נטע לוין נ' מדינת ישראל  (25.08.19). ניתן למצוא מקרים בפסיקה שבהם הסתיים הליך ללא הרשעה בעבירות סחר בסם אולם באותם מקרים יוצאי דופן הוכח קיומו של נזק קונקרטי או דובר בנאשם שעבר הליך שיקומי משמעותי, ראו למשל עפ""ג (מחוזי י-ם) 67452-12-18 מדינת ישראל נ' בוזגלו מיום (7.4.19), וכן ת""פ (שלום ירושלים) 54750-01-19 בעניין בן שבת, החלטה מיום (2.4.23). ",שאלת ביטול ההרשעה 
"ת""פ 21724-08-22","יתר על כן, וזה העיקר במקרה שלפני, לא הוכח כי הרשעה תפגע באופן מיידי וקונקרטי בנאשם. הנאשם הביע התעניינות בתואר מתקדם ויש לברך על כך אולם מדובר בתכנית כללית שעדיין לא התגבשה לכלל מציאות והעולם האקדמי מלא ופתוח למקצועות רבים כך שהקשר בינם לבין הרשעה מרוחק בשלב זה. שירות המבחן המליץ לבטל את הרשעת הנאשם על מנת שלא לפגוע בדימוי העצמי של הנאשם ועל מנת לא לפגוע באפשרויות העסקה שבהם ישתלב בעתיד. מובן החשש לפגיעה בדימוי העצמי וביתר שאת כאשר הנאשם הצליח להימנע מהסתבכות עד כה אולם על בית המשפט לשקול גם שיקולי שוויון. החשש לפגיעה בדימוי העצמי אינו מספיק כדי להבחין בין הנאשם לבין כל נאשם אחר שהורשע באותה עבירה כמוהו. פגיעה בעקרון השוויון לפיה מי שביצע עבירה יורשע מחייבת הצדקה של ממש על פי הכללים שנקבעו בפסיקה עקבית וארוכת שנים והצדקה כזו לא קיימת במקרה שלפני. אינני מפחיתה דבר מהתרשמותו החיובית של שירות המבחן ואף לא ממאמצי הנאשם לשמור על אורח חיים נורמטיבי אך אלו יבואו בחשבון בשלב גזירת הדין ולא לביטול הרשעה. כמו כן לא הוצגה ראיה כלשהיא ולא הוגש כל מסמך מאת הסנגור שיהיה בו להוכיח שהרשעה תפגע בעיסוקו הנוכחי של הנאשם. לא הוצג רישיון תיווך ולא הוצג אישור העסקה כמורה מחליף.",שאלת ביטול ההרשעה 
"ת""פ 21724-08-22","בהקשר זה ובטרם גזירת הדין מצאתי להוסיף כי במידה ובעתיד הרשעתו בפלילים תפגע בתפקודו או קידומו של הנאשם במקצוע שירכוש לעצמו בדין מצויות ""דרכים שונות"" למחיקת הרשעה, כדברי כבוד השופט גרוניס בע""פ 4947/05 פלוני נ' מדינת ישראל (תק-על 2006(3), 3532 , 3533 (2006):",שאלת ביטול ההרשעה 
"ת""פ 21724-08-22","על דברים אלה חזר כבוד השופט רובינשטיין בע""פ 8927/06, שלומציון אלפסי נ' מדינת ישראל, תק-על 2007(4), 240 , 244 (2007). ",שאלת ביטול ההרשעה 
"ת""פ 21724-08-22","מדיניות הענישה הנוהגת בעבירות של סחר בסם והחזקתו, משקללת את סוג הסם, הכמויות, התארגנות עסקית והמיקום בשרשרת הפצת הסמים. ראו למשל:",גזר דין
"ת""פ 21724-08-22","ראו מקרה דומה לענייננו עפ""ג (מחוזי ב""ש) 10519-09-22 מדינת ישראל נ' מיקי מיכאל סוויסה (נבו 02.04.2023)‏‏ - הנאשם בענין זה הורשע על פי הודאתו בעבירות של החזקת סמים מסוכנים שלא לצריכה עצמית וניסיון לסחר בסמים מסוכנים. הנאשם תיאם עם אדם אחר מכירת סם מסוג קנבוס במשקל של כ-20 גרם תמורת 900 ₪. בהתאם לסיכום נפגשו השניים בחניית ביתו של הנאשם. באותו מעמד החזיק הנאשם בסם מסוג קנבוס במשקל כולל של כ-378 גרם נטו וכן החזיק בשני משקלים. הנאשם ניסה לסחור בסם מסוכן מסוג קנבוס אולם בעת שהלך להביא את הסם, נתפס בכף על ידי צוות השוטרים. בית משפט קמא קבע כי מתחם העונש ההולם בין ענישה טיפולית ומאסר מותנה ועד 8 חודשי מאסר וגזר את עונשו של הנאשם בתחתית מתחם זה בשים לב לגילו הצעיר, עברו הנקי ומאמציו הטיפוליים לחזרה למוטב. המדינה ערערה על גזר הדין ועתרה להעלות את מתחם הענישה ולקבוע מתחם שנע מ-6 ל-12 חודשי מאסר. בית המשפט המחוזי קיבל את הערעור ופסק באלו המילים (שם בפסקה 13): ""מתחם העונש ההולם צריך להיות מחמיר יותר, הן ברף התחתון והן ברף העליון, בהינתן העבירות ונסיבות ביצוען, ואולם, בהינתן מכלול השיקולים והתוצאה להלן, נצא מהבסיס של מתחם עונש הולם כפי עתירת המאשימה."" בסופו של יום וגם לאור השיקולים לקולה שעמדו לזכות הנאשם מצא בית המשפט שלערעור לגזור עליו 6 חודשי מאסר בעבודות שירות תוך שציין שגם עונש זה מאפשר הליך טיפולי שיקומי. ",גזר דין
"ת""פ 21724-08-22","ראו מקרה דומה בת""פ (ת""א) 3603-12-19 מדינת ישראל נ' שוורצברג (27.3.2022)- הנאשם הגיע רכוב על קטנוע ובהיותו שליח שנשלח על ידי אחר. הנאשם מכר לאדם אחר קנבוס במשקל של 5.07 גרם נטו בתמורה לסכום לא ידוע. בנוסף, החזיק בידו שקית ובה קנבוס במשקל 5.06 גרם ועוד 11.38 גרם נטו קנבוס החזיק בקטנוע (בשתי שקיות ובתפזורת). בית המשפט קבע מתחם שבין מספר חודשי מאסר לבין 12 חודשי מאסר בפועל. ",גזר דין
"ת""פ 21724-08-22",בית המשפט חרג מן המתחם מטעמי שיקום והסתפק בענישה צופה פני עתיד לצד רכיבים נלווים.,גזר דין
"ת""פ 21724-08-22","ראו מקרה בו מדובר על סחר בכמות כפולה לצד החזקת סם שלא לצריכה עצמית: ת""פ (תל-אביב) 12807-02-20 מדינת ישראל נ' אביתן (4.10.21)- הנאשם מכר לאחר סם מסוכן מסוג קנבוס במשקל 10 גרם בתמורה ל- 500 ₪. באותן הנסיבות, החזיק באופנועו סם מסוכן מסוג קנבוס במשקל של כ-130 גרם מחולק לשקיות. בית המשפט קבע מתחם עונשי הולם הנע בין מספר חודשי מאסר שיכול וירוצו בעבודות שירות ועד ל-12 חודשי מאסר לריצוי בפועל, לצד ענישה נלווית. ",גזר דין
"ת""פ 21724-08-22","ראו מקרה בו מדובר על שתי עבירות סחר ללא החזקת סם: רע""פ 7858/19 וקנין נ' מדינת ישראל (28.11.19)- הנאשם מכר 2 גר' חשיש בתמורה ל- 100 ₪ וכעבור חודש מכר לאחר 3.8 גר' קנבוס בתמורה ל- 200 ₪. בית המשפט קבע כי בהתחשב שמדובר בכמויות סם קטנות ובסכומי כסף זעומים מתחם העונש ההולם נע ממאסר בפועל למספר חודשים ועד ל-8 חודשי מאסר שיכול וירוצו בדרך של עבודות שירות.",גזר דין
"ת""פ 21724-08-22","מתחם העונש ההולם –מדובר בעבירת סחר בודדת לצד החזקת סמים לצריכה עצמית בכמות ובנסיבות שמתיישבות עם הפצת סמים. המעשים כללו תכנון והיערכות מראש בשל שימוש באפליקציית טלגרם. מנגד סוג הסם, הכמות ומכירה אחת בודדת מציבים את הנאשם שלא בין המקרים החמורים. אני קובעת כי מתחם העונש ההולם נע ממספר חודשי מאסר שיכול וירוצו בעבודות שירות ועד 12 חודשי מאסר בפועל.",גזר דין
"ת""פ 21724-08-22","העונש המתאים לנאשם – השאלה המרכזית היא האם יש מקום לסטות לקולה ממתחם העונש ההולם מטעמי שיקום ולהסתפק בענישה במאסר מותנה לצד רכיבי ענישה נלווים ביניהם צו של""צ. הנאשם צעיר שעברו נקי ותפקודו נורמטיבי לפני ביצוע העבירה ואחריה. הנאשם הודה וקיבל אחריות למעשים ולזכותו התרשמותו החיובית של שירות המבחן. כל אלו מצדיקים סטיה קלה מן המתחם אך לא עד כדי הסתפקות בענישה צופה פני עתיד. לשם סטיה כה משמעותית ממתחם העונש ההולם על הנאשם להציג סיכוי ממשי לשיקום. על פי רוב ערובה לסיכויים כאלה הם הליך שיקומי משמעותי וטיפול מוצלח ומרשים. גם במקרים אלה בית המשפט העליון חוזר ומבהיר כי בירידה אל מתחת למתחם העונש ההולם יש לנקוט זהירות, ויש ליתן את הדעת לשיקולי הענישה האחרים, ראו למשל רע""פ 4512/17 הרוש נ' מדינת ישראל, [פורסם בנבו] (6.7.2015). עוד פסק בית המשפט העליון פעם אחר פעם כי המלצת שירות המבחן היא שיקול אחד ממכלול השיקולים שעל בית המשפט לשקול בגוזרו את הדין, ראו למשל ע""פ 1167/21 טארק חוג'יראת נ' מדינת ישראל [פורסם בנבו] (31.5.2021). ",גזר דין
"ת""פ 21724-08-22",תסקיר שירות המבחן בענייננו אינו מתייחס כלל לפן הטיפולי בעניינו של הנאשם. שירות המבחן התרשם מהתהליך העצמי שעבר הנאשם וככל הנראה התרשם שדי בו אך אין פירוט מהו אותו הליך עצמי ומה עוצמתו. בפועל נפגש הנאשם פעמיים עם שירות המבחן לשם עריכת התסקיר אך לא שולב בהליך טיפולי מעבר לכך.,גזר דין
