verdict,text,part
"ת""פ 6788-06-16","ת""פ 6788-06-16 מדינת ישראל נ' בנעטייה",בית המשפט המחוזי מרכז-לוד
"ת""פ 6788-06-16","ב""כ המאשימה: עו""ד מיכאל סטופ",הנאשמת
"ת""פ 6788-06-16","ב""כ הנאשמת: עוה""ד אבי חימי ומשה ויי",הנאשמת
"ת""פ 6788-06-16","פקודת הסמים המסוכנים [נוסח חדש], תשל""ג-1973: סע'  13, 19א",חקיקה שאוזכרה: 
"ת""פ 6788-06-16","חוק העונשין, תשל""ז-1977: סע'  29, 40ד, 40ד(א), 40 ט', 40 יא', 40 יג', 499(א)",חקיקה שאוזכרה: 
"ת""פ 6788-06-16",הנאשמת הורשעה בהתאם להודאתה בעובדות כתב האישום המתוקן בעבירות כדלקמן:,רקע
"ת""פ 6788-06-16","ייבוא סם מסוכן בצוותא, לפי סעיף 13 ביחד עם סעיף 19א לפקודת הסמים המסוכנים [נוסח חדש], התשל""ג – 1973 ביחד עם סעיף 29 לחוק.",רקע
"ת""פ 6788-06-16","קשירת קשר לביצוע פשע, לפי סעיף 499(א) בחוק העונשין, תשל""ז – 1977 (להלן: ""החוק"").",רקע
"ת""פ 6788-06-16","על-פי המתואר בעובדות כתב האישום המתוקן, הנאשמת הייתה בת זוג של שי (להלן: ""שי""). הנאשמת קשרה קשר עם מוטי אזולאי (להלן: ""מוטי"") ואחרים, במסגרתו תשלח לכתובתה של הנאשמת חבילה המכילה סמים מסוכנים שיגיעו מהולנד. במהלך חודש מרץ 2016 פנה מוטי לשי וביקש שחבילה המכילה סמים מסוכנים שתגיע בדואר מהולנד תשלח אליו לכתובתו, הנאשמת שהייתה עדה לשיחה מסרה את כתובתה כיעד למשלוח החבילה. עובר ליום 23.4.16, נשלחה ארצה מהולנד חבילה ארוזה ובתוכה 5 מעילים שבחלקם הוסלק בשרוולים סם מסוכן מסוג קוקאין במשקל נטו של 2.565 ק""ג. החבילה מוענה לכתובתה של הנאשמת ונשלחה על שמה. בתאריך 8.5.16 הונפקה הודעת דואר רשום על שם הנאשמת. בתאריך 9.5.16 הגיעה הנאשמת לסניף הדואר, הציגה את שובר הדואר הרשום ודרשה את החבילה. כאשר נאמר לה כי החבילה טרם הגיעה, הביעה חוסר שביעות רצון על כך, כעסה וביקשה לשוחח עם מנהלת הסניף. הנאשמת שבה אל הסניף בשעה 13:00 סמוך לשעת הסגירה של הסניף ודרשה שוב את החבילה ונמסר לה שהחבילה טרם הגיעה. בתאריך 10.5.16 הגיעה הנאשמת שוב לסניף הדואר, הציגה את השובר הזדהתה וקיבלה את החבילה. כל זאת כאשר שי משוחח עמה בטלפון הנייד מתעדכן במתרחש, מזהיר אותה מפני הימצאות של שוטרים ומנחה אותה כיצד לפעול וכיצד להגיב אם תיעצר. בהתאם להנחיית שי הייתה אמורה הנאשמת להעביר את החבילה לדירה של אחר. בסמוך לאחר קבלת החבילה נעצרה הנאשמת ביציאה מסניף הדואר.",רקע
"ת""פ 6788-06-16","בהחלטה שניתנה טרם הודאתה הנאשמת בעובדות כתב האישום, בתום שמיעת העדויות בתיק זה ולאחר שמיעת סיכומי הצדדים, נקבעו על ידי הדברים הבאים: ""ראשית, הנאשמת לא הייתה מודעת בפועל לסוג הסם ולכמותו, אם כי מדובר בעצימת עיניים. שנית, הנאשמת לא קיבלה כסף ואין ראיה לכך שהייתה אמורה לקבל כסף כתוצאה מביצוע המעשים.",רקע
"ת""פ 6788-06-16","הצדדים הגיעו להסדר דיוני, לפיו הנאשמת הודתה והורשעה בכתב האישום המתוקן ונשלחה לקבלת תסקיר שירות מבחן.",רקע
"ת""פ 6788-06-16","על פי תסקיר שירות המבחן, הנאשמת כבת 21, רווקה המתגוררת בבית משפחתה ועובדת מזה שלושה חודשים כמטפלת במעון. סיימה 12 שנות לימוד ובעלת תעודת בגרות מלאה, לא גויסה לצה""ל בשל מחלה תורשתית שבה היא לוקה. לאחר סיום לימודיה עבדה במשך שנתיים במאפייה, שם הכירה את שותפה לעבירה, ולאחר מכן כקופאית במסעדה. מסרה כי גדלה במשפחה שסיפקה מענה למכלול צרכיה הרגשיים והחומריים וניכר כי בני משפחתה מהווים עבורה מערכת תמיכה משמעותית. הנאשמת נעדרת עבר פלילי.",תסקיר שירות המבחן
"ת""פ 6788-06-16","בהתייחסותה לכתב האישום קיבלה אחריות מלאה על ביצוע העבירות. שיתפה כי ברקע לביצוען, מערכת יחסית אינטימית שניהלה במשך כשנתיים עם גבר נשוי כבן 33 ולאחר כשנה וחצי של קשר עמו גילתה כי הוא נוהג לצרוך סמים. בתקופת ביצוע העבירות, הוא ביקש ממנה לסייע לו לייבא סמים, בכך שחבילה המכילה סמים תישלח לכתובת ביתה, והיא ביטאה הסכמתה ופעלה כמתואר בכתב האישום.",תסקיר שירות המבחן
"ת""פ 6788-06-16","שירות המבחן התרשם כי הנאשמת מבטאת בושה ונבוכה מהתנהלותה בעבירות, כאשר לדבריה, בתקופת ביצוע העבירות פיתחה תלות רגשית בקשר הזוגי, במסגרתו התנהלה מתוך ריצוי וצורך בחיזוקים, זאת לצד חווית ניצול וחוסר הדדיות מולו. מסרה כי החלה להשתמש בסמים מסוג MDMA במסגרת הקשר האינטימי שניהלה עד למעצרה בחודש מאי 2016. בתחילה צרכה את הסם בתדירות נמוכה ובקשר עם כאבים שמהם סבלה בשל מחלתה, אולם כעבור תקופה קצרה הפך השימוש ליומיומי. בבדיקות שתן שמסרה לא נמצאו שרידי סם.",תסקיר שירות המבחן
"ת""פ 6788-06-16","במסגרת פיקוח מעצרה, אשר נמשך שנה, השתלבה הנאשמת בחודש אוקטובר 2016 בתכנית ""המנטורינג"" – צעירות למען צעירות, וסיימה את התוכנית בהצלחה ביום 13.6.17. במהלך השתתפותה בתוכנית, אותרה על ידי גורמי הטיפול כבעלת יכולות גבוהות והיא כיום עובדת בשכר בתוכנית כמנטורית אשר מנחה קבוצה של צעירות בשיתוף עם עובדת סוציאלית ומשמשת אוזן קשבת ודמות תומכת עבורן לאורך תקופת השתתפותה בתכנית. עוד עולה כי הנאשמת הגיעה לכל המפגשים בתכנית ללא יוצא מן הכלל, היא יצרה קשרים קרובים עם צעירות אחרות בתוכנית, גילתה אמפטיה ורגישות לצעירות ששיתפו מחוויות חייהן, לקחה חלק פעיל במרחבי התוכנית השונים והייתה משתתפת דומיננטית, ייחודית ומרגשת. היא שיתפה בחוויות חייה, כולל בנוגע למערכת היחסים אשר ברקע למצבה המשפטי. היא בדקה לעומק דפוסי התנהגות ובחירות שעשתה בחייה, והדגישה את המאמצים שאותם עושה לשיפור מצבה ולשיקום דמויה ובטחונה העצמי. עוד עולה כי מהתכנים בהם שיתפה עלתה התרשמות כי היא ביצעה את העבירה מתוך תלות כפולה, הן בבן הזוג עמו הייתה בקשר פתולוגי והן בסם, אלה עמדו בבסיס התנהגותה. עוד עולה מהתכנים בתוכנית כי הקשר הפתולוגי שניהלה אשר נשמר בסוד מפני סביבתה, השפיע על התנהלותה בכל מישורי החיים. היא הגיע לשם מדי שבוע (בנוסף ליום ההכשרה), יצרה קשרים קרובים עם הנערות והייתה דמות משמעותית עבורן. בשל התרשמות מכוחותיה ויכולותיה של הנאשמת ומהנכונות שלה לסייע לבנות אחרות, הצטרפה הנאשמת כמנטורית בשכר לצוות התוכנית. כיום, היא מנחה קבוצה בתוכנית ההכשרה, יחד עם אשת מקצוע. הנאשמת מתפקדת כמנטורית רצינית, אחראית ומשקיעה. היא מהווה השראה עבור הצעירות הלומדות בתוכנית וכן משתתפת בקבוצת הדרכה הכוללות נשות מקצוע ומנטוריות. ההתרשמות הינה כי לנאשמת מוטיבציה ורצון להמשיך ולנתב את מסלול חייה כצעירה נורמטיבית ומתפקדת. בנוסף להשתלבותה בתוכנית המנטורינג הגיעה הנאשמת לשיחות בשירות המבחן לכל אורך תקופת הפיקוח. בשיחות אלו בלטה מצוקתה הנפשית סביב התפקחותה מהקשר הבעייתי שניהלה והשלכותיו על מצבה כיום. בפגישות אלה הנאשמת גילתה יכולת התבוננות עצמית בוגרת ומעמיקה, תוך מודעות עצמית גבוהה לקשייה הרגשיים. שירות המבחן לא התרשם מבעיה התמכרותית ונראה כי השימוש בסמים היה סביב מערכת היחסים שניהלה. כיום מקיימת קשר זוגי משמעותי חדש ומיטיב, ומסוגלת במסגרתו לראות את צרכיה ולנהוג באופן אסרטיבי. הנאשמת ביטאה נכונות להמשיך את הקשר עם תוכנית המנטורינג בשנת הלימודים הבאה.",תסקיר שירות המבחן
"ת""פ 6788-06-16","שירות המבחן הבהיר כי הנאשמת שיתפה פעולה באופן מלא. שירות המבחן התרשם כי הנאשמת הינה צעירה אינטליגנטית, בעלת יכולות וכישורים גבוהים ובעלת מערכת ערכים  נורמטיבית, לצד דימוי עצמי נמוך. עוד התרשם שירות המבחן כי היא פעלה מתוך היעדר בשלות רגשית ואישיותית כאשר פיתחה תלות רגשית במסגרת מערכת יחסים מורכבת ובלתי הדדית עם גבר מבוגר ממנה. שירות המבחן לא התרשם מקיומם של דפוסים עבריינים והתמכרותיים. שירות המבחן העריך כי לאור קשייה הרגשיים של הנאשמת היא טרם מיצתה את ההליך השיקומי ועל כן המליץ על הטלת צו מבחן למשך שנה. שירות סבר כי על אף חומרת העבירות המיוחסות לה, ענישה מחמירה תחבל בתפקודה התקין והנורמטיבי של הנאשמת והמליץ על הטלת צו של""צ. עוד המליץ שירות המבחן להימנע מהרשעת הנאשמת זאת לאור גילה הצעיר וההליך השיקומי המשמעותי ויוצא הדופן שהיא עוברת וכן כדי שלא לפגוע בשאיפותיה ללימודים אקדמאיים בעתיד.",תסקיר שירות המבחן
"ת""פ 6788-06-16","מטעם הנאשמת העידה פרופ' מרים גולן, שהינה מרצה לעבודה סוציאלית באוניברסיטת תל אביב, ומנהלת תוכנית המנטורינג. פרופ' גולן העידה כי היא מכירה את הנאשמת מזה שנתיים. תיארה את התהליך הטיפולי שאותו עברה הנאשמת במסגרת התוכנית והבהירה כי היא מעוניינת שהנאשמת תמשיך כאחת מאנשי הסגל בתוכנית. כן הבהירה כי לדעתה שהות במאסר יכולה להיות הרסנית עבור הנאשמת. כמו כן מסרה כי תבנה לנאשמת תכנית מסודרת של מספר ימים בשבוע שבהם היא תהיה מועסקת מעבר לעבודתה הרגילה.",ראיות לעונש
"ת""פ 6788-06-16","עוד העידה מטעם הנאשמת הגב' דנה קירשנבאום שעובדת בתוכנית המנטורינג כבר כמה שנים, ובמסגרתה הכירה את הנאשמת. מסרה כי הנאשמת לא החסירה אף מפגש מאז החל ההליך, שזהו דבר נדיר. שיתפה בתהליך ובהתפתחות של הנאשמת. רואה בנאשמת קולגה, היא יושבת עמה בישיבות צוות. הייתה רוצה לראות אותה ממשיכה הלאה בתהליך.",ראיות לעונש
"ת""פ 6788-06-16","עוד העידה מטעם הנאשמת הגב' חנה מנדלסון, עו""ס מנחה קבוצות בתוכנית המנטורינג. העדה מנחה עם הנאשמת קבוצה מאז תחילת שנת הלימודים. תיארה את פועלה של הנאשמת ומסרה כי היא עושה נפלאות בקבוצה שאותה היא מנחה.",ראיות לעונש
"ת""פ 6788-06-16","בנוסף העיד מר אלי בנעטיה, אביה של הנאשמת, אשר מסר כי כאשר נעצרה הנאשמת חרב עליהם עולמם. מדובר בילדה שלא היה חסר לה דבר. כאשר היא נעצרה מצבה היה קשה, היא ירדה במשקל ושקלה 34 ק""ג. הוא עזב את עבודתו ונשאר להיות עמה בבית כמפקח. כיום הם מעורבים יותר בחייה של הנאשמת. מבקש להתחשב במצבה הבריאותי ולהימנע משליחתה למאסר.",ראיות לעונש
"ת""פ 6788-06-16","כמו כן הוגש נע/1 – אסופת מסמכים רפואיים המתארים את מצבה הבריאותי של הנאשמת ואת מחלתה, וכן את הגורמים להחמרתה שהינם בעיקר זיהומים, טראומה, עקה נפשית ועוד.",ראיות לעונש
"ת""פ 6788-06-16","לטענת ב""כ המאשימה, עו""ד מיכאל סטופ, הנאשמת צעירה כבת 20, נעדרת עבר פלילי, הורשעה על פי הודאתה בכתב אישום מתוקן בעבירות של ייבוא סמים וקשירת קשר, זאת לאחר הליך הוכחות שהתקיים כמעט עד סופו. הנאשמת הייתה מעורבת בייבוא של 2.5 ק""ג קוקאין. מדובר בעבירת סמים ברף הגבוה, לא בכדי העונש בצידה הינו של 20 שנות מאסר. כמות הסם אף היא גדולה ואין ספק כי היו מעורבים בעבירה סכומי כסף גדולים גם אם הם לא הגיעו לידה של הנאשמת. נכון הדבר שהנאשמת אינה 'הרוח החיה' והיא אף האחרונה במדרג כתב האישום, אך לא ניתן לומר כי היא אינה חלק מהמעגל הפנימי של העבירה. הנאשמת מסרה את כתובתה והגיעה בעצמה לדואר כדי לקחת את החבילה ועל כן יש לה תרומה משמעותית לביצוע העבירה. על אף שנקבע כי מדובר בעצימת עיניים, והיא לא ידעה באיזו כמות סם מדובר, לא ניתן להתעלם מהכמות הגדולה של הסם. הנסיבות שהובילו את הנאשמת לביצוע העבירה היו רגשותיה לשי ולא על רקע התמכרות לסמים, על כך גם ההגנה אינה חולקת. שי נידון ל- 4 שנות מאסר, עונש שעליו אמר בית המשפט שאינו מחמיר ותוך התחשבות במצבו הבריאותי והכלכלי. עונש זה צריך להוות קריאת כיוון בעניינה של הנאשמת. עונשה לא צריך להיות 4 שנים ואף לא קרוב לכך, אך גם לא צריך להיות מאסר בעבודות שירות. ייבוא של 2.5 ק""ג סמים מחייב מתחם ענישה של מאסר בפועל וגם ענישה סופית של מאסר. המתחם צריך להתחיל משנתיים מאסר עד לחמש שנות מאסר לצד מאסר על תנאי וקנס. בתסקיר מדובר על תלות כפולה שהיא בין היתר גם בסם. לעומת זאת המסקנה של שירות המבחן היא שאין בעיה התמכרותית ובפועל הנאשמת לא עברה שום הליך טיפולי בתחום הסמים. על אף ההליך הטיפולי שעברה, לא נראה שהנאשמת עברה הליך טיפולי משמעותי בתחום העבירות שביצעה. באשר לחריגה ממתחם העונש בשל שיקולי שיקום נשאלת השאלה עד כמה יש לחרוג, והאם יש לחרוג עד כדי עבודות שירות. לטעמה של המאשימה התשובה לכך היא שלילית. המאשימה סבורה כי אין מקום לסטות מהמתחם, אלא להתחשב בהליך שעשתה הנאשמת בתוך המתחם. ואולם, גם אם תהיה סטייה ממתחם העונש עדיין יש להטיל על הנאשמת מאסר בפועל. עונשה של הנאשמת צריך להיקבע בשליש הנמוך של המתחם. לפיכך עתר ב""כ המאשימה להשית על הנאשמת 30 חודשי מאסר בפועל לצד מאסר על תנאי וקנס.",טיעוני הצדדים
"ת""פ 6788-06-16","לטענת ב""כ הנאשמת, עוה""ד אבי חימי ומשה וייס, אין חולק כי מעשה הנאשמת הינו בלתי ראוי. עם זאת יש פער עצום בין העבירה החמורה לבין מאפייני אישיותה של הנאשמת בכל מהלך חייה. את הפער הזה מילא שי שגרר את הנאשמת מלהיות נערה צעירה ונורמטיבית, המתנדבת במשטרה ובתנועת נוער לנערה אשר משתמשת בסמים ונגררת לייבוא סמים. שי ניצל את הנאשמת והפך אותה לתלותית בו. מתחם העונש שהוצג על ידי המאשימה הינו מחמיר. יש לתת משקל לחלקה של הנאשמת שהינו קטן, למידת ההשפעה של האחר שהינה רבה, ולנסיבות שהובילו אותה לבצע את המעשים שאינן נסיבות עברייניות קלסיות או כלכליות. הנאשמת לא קיבלה כסף ואין ראיה שהייתה אמורה לקבל כסף. יש לתת משקל לגילה של הנאשמת שהייתה מעט מעל גיל 18 ולא הבינה את חומרת המעשה. הנאשמת לא הייתה מודעת לסוג הסם ולכמותו. כל אלו צריכים להוביל למתחם שהרף הנמוך שלו הוא עבודות שירות. ללא קשר לקביעת המתחם, עותרת ההגנה לסטייה ממנו משיקולי שיקום. הנאשמת הייתה תלמידת תיכון, ילדה טובה, שלא גויסה לצה""ל בעקבות מחלה קשה בה היא לוקה. מרבית חבריה התגייסו לצה""ל, והיא נותרה ביישוב מגוריה והחלה לעבוד. קשר סודי שהתחיל בינה לבין שי, אדם נשוי, אב לילדים, הלך והעמיק. ההסתרה הזו הובילה אותה למקום שבו היא עומדת כיום. מאז ששוחררה מהמעצר היא השכילה לנצל את ההליך המשפטי לשיקום והיא נרתמת כל כולה לשיקום. במסגרת פיקוח מעצר של שנה היא השתלבה בתוכנית המנטורינג, היא סיימה את התוכנית והצטרפה לצוות ומנחה קבוצות ביחד עם עובדת סוציאלית, ויש כוונה להמשיך ולשלב אותה בסגל. ההגנה אינה עותרת לאי הרשעה או של""צ, אלא רק לכך שהנאשמת תוכל להמשיך את חייה ולסייע לנערות נוספות. הנאשמת הייתה בקשר אינטנסיבי עם קצינת המבחן, נתנה בדיקות שתן, השתתפה בשיחות פרטניות, יש לה מסגרת תומכת בכל המובנים ומשפחה טובה. התסקיר שלה הוא יוצא דופן, השיקום שלה מרשים ולכן קיימת הצדקה לחריגה מהמתחם. היום הנאשמת שוקלת 37 ק""ג, המחלה שלה אינה פשוטה וסביבת כליאה עשויה להחמיר את מצבה. לפיכך עתרו ב""כ הנאשמת להשית על הנאשמת עונש מאסר שירוצה בעבודות שירות.",טיעוני הצדדים
"ת""פ 6788-06-16",הנאשמת הביעה חרטה כנה ובושה על מעשיה וביקשה שתינתן לה הזדמנות לשקם את חייה.,טיעוני הצדדים
"ת""פ 6788-06-16","כתב האישום מתאר אירוע אחד, ומכאן שיש לקבוע בגינו מתחם עונש הולם אחד.",דיון - קביעת מתחם העונש ההולם
"ת""פ 6788-06-16","במקרה דנן, הערך החברתי אשר נפגע הינו הגנה על הציבור מפני הנזקים הנלווים לשימוש בסמים מסוכנים. נזקי הסמים כוללים נזקים ישירים למכורים לסמים, אשר פעמים רבות נופלים כנטל על החברה, ונזקים עקיפים הנגרמים כתוצאה מביצוע עבירות על ידי המכורים לסמים כדי לממן את רכישתם.",דיון - קביעת מתחם העונש ההולם
"ת""פ 6788-06-16","בחינת מידת הפגיעה בערך המוגן מובילה למסקנה כי הפגיעה בערך המוגן הינה ברף גבוה נוכח הסם מסוג קוקאין שהינו מן הקשים שבסמים, והכמות הרבה של למעלה מ- 2.5 קילוגרם שהנאשמת ייבאה ארצה.",דיון - קביעת מתחם העונש ההולם
"ת""פ 6788-06-16","בכל הנוגע להשפעותיו הקשות של הסם מסוג קוקאין, קבע כב' השופט נ' הנדל בע""פ 972/11 מדינת ישראל נ' יונה (4.7.12) (פסקה 4) את הדברים הבאים: ",דיון - קביעת מתחם העונש ההולם
"ת""פ 6788-06-16","במסגרת הנסיבות הקשורות בביצוע העבירה (סעיף 40 ט' לחוק), יש לתת את הדעת לנסיבות הבאות:",דיון - קביעת מתחם העונש ההולם
"ת""פ 6788-06-16","התכנון שקדם לביצוע העבירה; למעשיה של הנאשמת קדם תכנון מוקדם. היא קשרה קשר עם אחרים לצורך ייבוא הסם, ומסרה מבעוד מועד את כתובתה במטרה שהחבילה ובה הסמים תגיע אליה.",דיון - קביעת מתחם העונש ההולם
"ת""פ 6788-06-16","חלקה היחסי של הנאשמת בביצוע העבירה ומידת ההשפעה של אחר על הנאשמת בביצוע העבירה; חלקה היחסי של הנאשמת בביצוע העבירה אינו המרכזי והיא אינה הגורם הדומיננטי בביצוע העבירה, אלא חלקה הוא הנמוך במדרג המעורבים בפרשה. אין ספק כי הנאשמת לא הייתה מחוללת העבירות, לא יזמה אותן ואף לא הייתה עתידה להרוויח כסף מביצוען. חלקה של הנאשמת היה במסירת כתובתה, ולאחר מכן באיסוף חבילת הסמים מהדואר, מבלי שידעה באילו סמים או כמויות מדובר, וזאת כאשר הסכמתה נבעה מרצונה לסייע לשי ותוך שהיא נתונה להשפעתו של שי, עמו הייתה בקשר רומנטי תלותי. ניכר כי לשי, שהינו מבוגר מהנאשמת, ולנוכח מערכת היחסים ביניהם, הייתה השפעה רבה מאוד על הנאשמת, ומעשיה בוצעו בהשפעתו ולמענו.",דיון - קביעת מתחם העונש ההולם
"ת""פ 6788-06-16","הנזק שהיה צפוי להיגרם מביצוע העבירה; אין ספק בדבר הנזק הרב שעלול היה להיגרם אילו היו מגיעים הסמים לידי סוחרי הסמים ומופצים לציבור, וזאת לנוכח סוג הסם וכמותו.",דיון - קביעת מתחם העונש ההולם
"ת""פ 6788-06-16","הסיבות שהביאו את הנאשמת לבצע את העבירה; הנאשמת החלה בגיל 17 לנהל מערכת יחסים זוגית עם שי, גבר נשוי, אב לילדים שהינו מבוגר ממנה ביותר מעשור שנים. במסגרת מערכת היחסים החלה להשתמש בסמים, ואף פיתחה תלות רגשית בשי באופן שגרם לה לבצע עבורו דברים שונים. מתוך רצונה לסייע לשי ביצעה את המיוחס לה בכתב האישום.",דיון - קביעת מתחם העונש ההולם
"ת""פ 6788-06-16",בחינת מדיניות הענישה הנוהגת מעלה כי במקרים דומים הוטלו על נאשמים עונשים במנעד רחב כמפורט להלן:,דיון - קביעת מתחם העונש ההולם
