verdict,text,part
"ת""פ 6788-06-16","בע""פ 3449/11 סל נגד מדינת ישראל (12.9.12), נדחה ערעורו של נאשם אשר הורשע על-יסוד הודאתו בעבירות של קשירת קשר, יבוא והספקת סם ועבירות סמים נוספות. המערער קשר קשר עם אחרים לייבא סם בכמות גדולה מחו""ל באמצעות הדואר. אל המערער נשלחה חבילת דואר מפנמה שהכילה 7,106 גרם קוקאין. בנוסף, נתפסו 23.9 גרם של סם מסוג חשיש בחיפוש שנערך בביתו. שירות המבחן המליץ להטיל עליו עונש מאסר בעבודות שירות לאור התרשמותם כי אינו מונע ממחשבה עבריינית. על הנאשם, שהיה ללא עבר פלילי, נגזר עונש של 48 חודשי מאסר בפועל. ",דיון - קביעת מתחם העונש ההולם
"ת""פ 6788-06-16","בע""פ 3022/15 גרינשפן נ' מדינת ישראל (7.11.16), התקבל ערעורו של נאשם אשר הורשע בעבירות של יבוא סם מסוכן, החזקת סם שלא לצריכה עצמית, וקשירת קשר לביצוע פשע. הנאשם קשר קשר יחד עם אחר לייבא מפנמה לישראל סם מסוכן מסוג קוקאין במשקל של 200.8 גרם באמצעות חברת שילוח אשר התקבלה בארץ על ידו. בית המשפט העליון הקל בעונשו של הנאשם כדי לעודדו להמשיך בדרך הטיפולית-שיקומית בה החל והשית עליו 4 שנות מאסר (חלף 4.5 שנות מאסר).",דיון - קביעת מתחם העונש ההולם
"ת""פ 6788-06-16","בע""פ 2518/16 יצחקי נגד מדינת ישראל (25.12.16), התקבל ערעורו של נאשם אשר הורשע יחד עם אחר בעבירות של יבוא סם מסוכן וקשירת קשר. האחר ארגן משלוח של חבילה ובה 710 גרם של קוקאין נוזלי מברזיל לסניף דואר בארץ, כאשר הנאשם הוא שהגיע לסניף הדואר וקיבל את החבילה לידיו. בית המשפט המחוזי קבע מתחם ענישה שנע בין 3.5 ל- 5.5 שנות מאסר. בית המשפט העליון התחשב בחלקו של הנאשם בפרשה, העדר עבר פלילי ופוטנציאל שיקומי גבוה והשית עליו 30 חודשי מאסר בפועל (חלף 42 חודשי מאסר בפועל). ",דיון - קביעת מתחם העונש ההולם
"ת""פ 6788-06-16","בע""פ 9020/14 מזרחי נ' מדינת ישראל (9.7.15) נדחה ערעורה של נאשמת אשר הורשעה, לאחר ניהול הוכחות, בייבוא דרך נתב""ג של סם מסוג קוקאין במשקל של 421 גרם. טענת הכורח שהעלתה הנאשמת נדחתה. הנאשמת, ללא עבר פלילי, לוקה בנכות בשיעור של 100%. נדונה ל- 30 חודשי מאסר בפועל. ",דיון - קביעת מתחם העונש ההולם
"ת""פ 6788-06-16","בע""פ 6533/16 פלונית נגד מדינת ישראל (23.11.16), נדחה ערעורה של נאשמת אשר הורשעה על פי הודאתה, בכתב אישום שייחס לה עבירות של קשירת קשר ויבוא (שתי עבירות). הנאשמת ואדם נוסף קשרו קשר לייבא קוקאין לארץ באמצעות שליחת חבילות בהן מוסלקים הסמים באמצעות הדואר. הנאשמת מסרה את שמה וכתובתה כדי שהחבילה תגיע לביתה. לביתה של הנאשמת הגיעה מעטפה שהכילה קוקאין במשקל לא ידוע, ובהמשך הגיעה לישראל חבילה נוספת ובה 389.23 גרם קוקאין. בנוסף מכרה בהזדמנויות ספורות כמויות קטנות של סמים מסוג חשיש וקוקאין. בית-המשפט המחוזי קבע מתחם ענישה אחד שנע בין 25 – 45 חודשי מאסר. הנאשמת, בת 41 שנים, לחובתה הרשעה אחת ובאותה עת עברה טיפולי פוריות, נידונה לעונש מאסר בפועל בן 28 חודשים.",דיון - קביעת מתחם העונש ההולם
"ת""פ 6788-06-16","בת""פ (מח' מרכז- לוד) 376-10-16 מ""י נ' אזרן (1.2.18), הורשעה הנאשמת בעבירה של יבוא סם מסוכן. הנאשם 1 והנאשמת הם אח ואחות, אשר קשרו קשר עם אחר לייבא לישראל מבלגיה סם מסוג קוקאין במשקל כולל של כ – 951 גרם נטו. חבילת הסמים נשלחה לנאשמים בדואר, על שמה וכתובתה של הנאשמת. הנאשם נידון ל – 40 חודשי מאסר בפועל. הנאשמת נידונה ל-22 חודשי מאסר. ",דיון - קביעת מתחם העונש ההולם
"ת""פ 6788-06-16","בת""פ 16863-10-16 (מח' ת""א), מדינת ישראל נ' דריגנט, הורשעו הנאשמים בעבירה של יבוא סם. הנאשמים קשרו קשר ליבוא סם מסוכן מסוג קוקאין במשקל של 1,376 גרם באמצעות שליחתו בדואר. הנאשם 2 בעל נסיבות חיים מורכבות וגילו הצעיר נדון ל- 18 חודשי מאסר ונאשם 4 בעל עבר פלילי בעבירות סמים נדון ל-4 שנות מאסר.",דיון - קביעת מתחם העונש ההולם
"ת""פ 6788-06-16","בהתאם לתיקון 113 לחוק העונשין (סעיף 40 יג'), סבורני כי מתחם העונש ההולם הינו החל  מ- 18 חודשי מאסר בפועל ועד ל- 48 חודשי מאסר בפועל.",דיון - קביעת מתחם העונש ההולם
"ת""פ 6788-06-16","במקרה דנן, קיימת הצדקה לחריגה ממתחם העונש ההולם משיקולי שיקום, באופן שיוטל על הנאשמת עונש מאסר לריצוי בדרך של עבודות שירות לתקופה המרבית, לצד עונשים נלווים.",סטייה מהמתחם משיקולי שיקום
"ת""פ 6788-06-16","לאחרונה התייחס בית המשפט העליון בהרחבה לשאלה באילו מקרים יש לסטות ממתחם העונש ההולם משיקולי שיקום ולהימנע מהטלת עונש מאסר בפועל בע""פ 6637/17 קרנדל נ' מדינת ישראל (18.4.18). כך קבעה כב' השופטת דפנה ברק ארז בדעת הרוב:",סטייה מהמתחם משיקולי שיקום
"ת""פ 6788-06-16","על מנת לעמוד בתנאי זה על הנאשם להציג עובדות וראיות לסיכויי השיקום, להבדיל מטענות בעלמא... את התשתית העובדתית להוכחת סיכויי השיקום ניתן לגבש באמצעים ראייתיים שונים, ובראשם התסקיר של שירות המבחן. באילו נסיבות יכיר בית המשפט בקיומו של סיכוי של ממש לשיקום באופן שיצדיק חריגה ממתחם העונש? עד כה לא ניתנה בפסיקה תשובה מחייבת וכוללת לשאלה זו, ומטבע הדברים יש להתחשב בכל מקרה על נסיבותיו... במקרים קודמים שבהם נדרש בית המשפט להעריך את סיכויי השיקום במסגרת סעיף 40ד לחוק העונשין הובאו בחשבון, בין היתר, השיקולים המרכזיים הבאים: המוטיבציה שהפגין האדם שהורשע להשתקם; הליך של גמילה מהתמכרות שהוא עובר; השתלבות מוצלחת בהליכים טיפוליים שונים; אינדיקציות לשינוי עמוק בהתנהגות ובדרך החשיבה; הבעת חרטה כנה על המעשים והפגנת אמפתיה כלפי נפגעי העבירה. .. חשוב להבהיר: אין מדובר ברשימה ממצה של שיקולים, והתקיימותו של שיקול זה או אחר אינה מצדיקה בהכרח חריגה ממתחם העונש משיקולי שיקום. .. עם זאת, ומבלי לקבוע מסמרות, ניתן לציין ששילוב בין שינוי מהותי בהתייחסות הרגשית לאירוע העבירה המתבטא בנטילת אחריות, כפרה והבעת אמפתיה לנפגעי העבירה לבין אינדיקציות אובייקטיביות לקיומו של תהליך שיקומי-טיפולי מוצלח וחזרה לדרך הישר, עשוי להצביע על ""סיכוי של ממש לשיקום"" כלשונו של סעיף 40ד(א). דברים אלה זוכים למשנה חיזוק מקום בו מדובר באדם צעיר נעדר עבר פלילי.",סטייה מהמתחם משיקולי שיקום
"ת""פ 6788-06-16","בפסיקה קיימים מקרים בהם סטו בתי המשפט ממתחם העונש ובכל זאת הטילו עונשי מאסר מאחורי סורג ובריח (ראו למשל: ע""פ 6720/16 מדינת ישראל נ' פלוני (7.3.17); ע""פ 4876/15  פלוני נ' מדינת ישראל (3.12.15); רע""פ 4795/11 זאיד נ' מדינת ישראל (27.6.11); רע""פ 262/14 נאשף נ' מדינת ישראל (22.1.14) וכן רע""פ 5354/12 קובר נ' מדינת ישראל (12.7.12)). ",סטייה מהמתחם משיקולי שיקום
"ת""פ 6788-06-16","לצד זאת פעמים רבות בחרו בתי המשפט לסטות ממתחם העונש ההולם עד כדי הטלת עונש שירוצה בעבודות שירות (ראו למשל בע""פ 6637/17 קרנדל נ' מדינת ישראל (18.4.18) (קשירת קשר לפשע, סיוע לחטיפה, סיוע לתקיפה הגורמת חבלה של ממש ושיבוש הליכי משפט); בע""פ 779/15 פלוני נ' מדינת ישראל (12.4.15) (שוד באיומי סכין); ע""פ 911/14 פלונית נ' מדינת ישראל (4.11.14) (התעללות בקטין או חסר ישע); ת""פ (מח' חי') 27277-01-15 מדינת ישראל נ' קעדאן (16.9.15) (עבירות בנשק); ת""פ (מח' ב""ש) 33495-12-13 מדינת ישראל נ' דדשב (30.3.15) (עבירות בנשק); ת""פ 7498-11-14 מדינת ישראל נ' אלצראיעה (30.3.17) (עבירות בנשק); ת""פ (מח' מרכז-לוד) 8833-01-14 מדינת ישראל נ' אפלצ'יוק (22.12.16) (עבירות שוד); ת""פ (מח' מרכז-לוד) 8761-01-14 מדינת ישראל נ' פוגרבניאק (26.4.17) (עבירות שוד); ת""פ (מח' י-ם) 23513-03-14 מדינת ישראל נ' שצ'ינוב (10.11.16).",סטייה מהמתחם משיקולי שיקום
"ת""פ 6788-06-16","הנאשמת ילידת 1997, הייתה כבת 19 בעת ביצוע העבירה. סיימה 12 שנות לימוד ובעלת תעודת בגרות מלאה, לא גויסה לצה""ל בשל מחלה תורשתית ממנה היא סובלת, נעדרת עבר פלילי. משהוחלט כי לא תוכל להתגייס לצבא, עבדה במשך שנתיים במאפייה, ולאחר מכן כקופאית במסעדה. באותה תקופה, הכירה הנאשמת את שי, שהינו גבר נשוי, אב לילדים המבוגר ממנה במעל עשור שנים, אשר ניהל עמה מערכת יחסים רומנטית תוך שהוא חושף אותה לשימוש בסמים. מערכת היחסים בין השניים, אשר נשמרה בסוד מבני משפחתה ומכריה של הנאשמת, הלכה והעמיקה והפכה לקשר פתולוגי שבמהלכו פיתחה הנאשמת תלות רגשית והתנהלה מתוך ריצוי וצורך בחיזוקים, זאת לצד ניצול וחוסר הדדיות. קשר זה, אשר כאמור נשמר בסוד מפני סביבתה, השפיע על התנהלותה בכל מישורי החיים. הנאשמת הסכימה להשתתף ביבוא הסמים בכך שחבילה המכילה סמים תישלח לכתובת ביתה, תוך שהיא פועלת מתוך היעדר בשלות רגשית ואישיותית ותחת התלות הרגשית שבמסגרת מערכת היחסים.",סטייה מהמתחם משיקולי שיקום
"ת""פ 6788-06-16","מאז ביצוע העבירה נרתמה הנאשמת באופן מוחלט לשיקום חייה. שיתפה פעולה באופן מלא עם שירות המבחן, הגיעה לכל המפגשים ועשתה כל הנדרש ממנה. הנאשמת הגיעה לשיחות בשירות המבחן לכל אורך תקופת הפיקוח (כשנה). בפגישות אלה הנאשמת גילתה יכולת התבוננות עצמית בוגרת ומעמיקה, תוך מודעות עצמית גבוהה לקשייה הרגשיים. שירות המבחן לא התרשם מבעיה התמכרותית ונראה כי השימוש בסמים היה סביב מערכת היחסים הבעייתית שניהלה עם שי. שירות המבחן התרשם כי הנאשמת הינה צעירה אינטליגנטית, בעלת יכולות וכישורים גבוהים ובעלת מערכת ערכים נורמטיבית. עוד התרשם שירות המבחן כי היא פעלה מתוך היעדר בשלות רגשית ואישיותית כאשר פיתחה תלות רגשית במסגרת מערכת יחסים מורכבת ובלתי הדדית עם גבר מבוגר ממנה. שירות המבחן לא התרשם מקיומם של דפוסים עברייניים והתמכרותיים.",סטייה מהמתחם משיקולי שיקום
"ת""פ 6788-06-16","יתר על-כן, הנאשמת השתלבה בתכנית ""המנטורינג"" – צעירות למען צעירות, באוניברסיטת תל אביב, וסיימה את התוכנית בהצלחה. עוד עולה כי הנאשמת הגיעה לכל המפגשים בתכנית ללא יוצא מן הכלל, היא יצרה קשרים קרובים עם צעירות אחרות בתוכנית, גילתה אמפטיה ורגישות לצעירות ששיתפו מחוויות חייהן, לקחה חלק פעיל במרחבי התוכנית השונים והייתה משתתפת דומיננטית. היא שיתפה בחוויות חייה, בדקה לעומק דפוסי התנהגות ובחירות שעשתה בחייה, וביצעה מאמצים לשיפור מצבה ולשיקום דמויה ובטחונה העצמי.",סטייה מהמתחם משיקולי שיקום
"ת""פ 6788-06-16","היא הגיעה לשם מדי שבוע (בנוסף ליום ההכשרה), יצרה קשרים קרובים עם הנערות והייתה דמות משמעותית עבורן. בשל התרשמות מכוחותיה ויכולותיה של הנאשמת ומהנכונות שלה לסייע לבנות אחרות, הצטרפה הנאשמת כמנטורית בשכר לצוות התוכנית. כיום, היא מנחה קבוצה בתוכנית ההכשרה, יחד עם אשת מקצוע. הנאשמת מתפקדת כמנטורית רצינית, אחראית ומשקיעה. היא מהווה השראה עבור הצעירות הלומדות בתוכנית וכן משתתפת בקבוצת הדרכה הכוללות נשות מקצוע ומנטוריות. ההתרשמות של גורמי הטיפול הינה כי לנאשמת מוטיבציה ורצון להמשיך ולנתב את מסלול חייה כצעירה נורמטיבית ומתפקדת.",סטייה מהמתחם משיקולי שיקום
"ת""פ 6788-06-16","ואכן, לא בכל תיק מתייצבות בבית המשפט עדות אופי כפי שהתייצבו בתיק זה: פרופ' לעבודה סוציאלית באוניברסיטת תל אביב, אשר ייזמה את תכנית המנטורניג ומנהלת אותה; עובדת סוציאלית ומנחת קבוצות בתכנית המנטורינג, ועובדת נוספת בתכנית המנטוניג. נראה כי התגייסות זו של שלוש העדות הללו למענה של הנאשמת, מהווה כשלעצמה אינדיקציה לשיקום המשמעותי שעברה הנאשמת.",סטייה מהמתחם משיקולי שיקום
"ת""פ 6788-06-16","כיום מקיימת הנאשמת קשר זוגי משמעותי חדש ומיטיב, ומסוגלת במסגרתו לראות את צרכיה ולנהוג באופן אסרטיבי. הנאשמת ביטאה נכונות להמשיך את הקשר עם תכנית המנטורינג בשנת הלימודים הבאה. מתוך הדברים שנאמרו על ידי עדות האופי ובפרט על ידי פרופ' מרים גולן, מנהלת התכנית, עולה כי התהליך הטיפולי שאותו עברה הנאשמת במסגרת התוכנית הינו יוצא דופן בהצלחתו וכי פרופ' גולן אף מעוניינת שהנאשמת תמשיך בתוכנית בשנה הקרובה כאחת מאנשי הסגל במסגרת תכנית עבודה מסודרת שתבנה לה לצד עבודתה היומיומית של הנאשמת.",סטייה מהמתחם משיקולי שיקום
"ת""פ 6788-06-16","נתתי דעתי לחומרתה של העבירה ולשיקולי ההלימה, ואולם סבורני כי במקרה דנן הנאשמת עברה כברת דרך שיקומית יוצאת דופן, וקיים סיכוי גבוה מאוד (ובוודאי סיכוי של ממש כלשון החוק) שהנאשמת תשתקם. לעומת זאת, קיים סיכון גבוה כי שליחתה לריצוי עונש מאחורי סורג ובריח תסכל את ההליך השיקומי או תפגע בו באופן משמעותי.",סטייה מהמתחם משיקולי שיקום
"ת""פ 6788-06-16","תסקיר שירות המבחן, העדויות שנשמעו בעניינה של הנאשמת, וכן התרשמותי מהנאשמת עצמה, מלמדים כולם על כך שהנאשמת עושה מאמצים כנים לשוב למסלול חיים נורמטיבי, ויש לעודד אותה בהמשך מסלול החיים הנורמטיבי באמצעות הימנעות מהטלת עונש מאסר מאחורי סורג ובריח. סבורני כי הטלת עונש מאסר בכליאה תחטא לשיקול השיקום ועלולה לגרום ליותר נזק מתועלת לחברה. הצלחת ההליך השיקומי של הנאשמת מהווה אינטרס של החברה בכללותה ולא רק של הנאשמת.",סטייה מהמתחם משיקולי שיקום
"ת""פ 6788-06-16","סבורני כי מסקנה זו עולה בקנה גם עם הדברים שנכתבו בדו""ח צוות התביעה לבחינת יישום דו""ח דורנר (דו""ח הוועדה הציבורית לבחינת מדיניות הענישה והטיפול בעבריינים) מיום 7.6.18, שם נקבע בין היתר כי במקום בו שיקולי ההלימה ואיון המסוכנות אינם מחייבים מאסר או מעצר בין כותלי הכלא, וכשניתן לשלב את הנאשם בהליך שיקומי ממשי המותאם לצרכיו, מחוץ לכותלי הכלא, כי אז יש להעדיף את ההליך השיקומי על פני מעצר או מאסר.",סטייה מהמתחם משיקולי שיקום
"ת""פ 6788-06-16","סבורני כי המקרה דנן, נכנס בגדרי השיקולים המפורטים לעיל כמקרה הראוי לסטייה ממתחם העונש והעדפת עונש מאסר בעבודות שירות על פני מאסר מאחורי סורג ובריח.",סטייה מהמתחם משיקולי שיקום
"ת""פ 6788-06-16","בגזירת העונש המתאים לנאשמת יש להתחשב בנסיבות שאינן קשורות בביצוע העבירה (סעיף 40 יא'). במסגרת זו מן הראוי לתת את הדעת לכך שהנאשמת הינה צעירה, ילידת 1997, אשר מתמודדת עם בעיות רפואיות משמעותיות, ונעדרת עבר פלילי. אין כל ספק כי כל עונש מאסר בפועל בכליאה ממש יפגע בה ובאפשרויות העומדות בפניה בעתיד. הנאשמת הודתה במיוחס לה, נטלה אחריות מלאה על מעשיה והביעה חרטה כנה. כמו כן, כאמור לעיל, נרתמה הנאשמת להליך טיפולי ושיקומי משמעותי וכיום במסגרת הליך זה מסייעת לנערות אחרות הנמצאות במצבי סיכון. הנאשמת ניהלה את ההליך כמעט עד תומו, ואולם לבסוף תוקן כתב האישום, בחלקו, לאור הדברים שעלו תוך כדי ניהול המשפט.",גזירת העונש המתאים לנאשמת
"ת""פ 6788-06-16","עוד יש לתת את הדעת לשיקול הרתעת היחיד בגדרו של המתחם, וזאת בשים לב להתרשמות שירות המבחן כי בשלב זה עדיין סובלת הנאשמת מקשיים רגשיים וכי התהליך הטיפולי טרם בא אל סופו.",גזירת העונש המתאים לנאשמת
"ת""פ 6788-06-16","בשולי הדברים יצוין, כי לא שוכנעתי שיש מקום לגזור את עונשה של הנאשמת בהתייחס לעונש שנגזר על שי, וזאת לאור ההבדלים המשמעותיים ביניהם, הן בנסיבות הקשורות בביצוע העבירה וחלקו היחסי של כל אחד מהם במעשים, הן בנסיבות שאינן קשורות בביצוע העבירה, והן בפן השיקומי.",גזירת העונש המתאים לנאשמת
"ת""פ 6788-06-16","באיזון בין השיקולים השונים, סבורני כי יש לגזור על הנאשמת עונש מאסר שיכול וירוצה בעבודות שירות לתקופה המרבית לצד עונשים נוספים, וזאת לצד קנס כספי משמעותי, אשר יהווה רכיב ענישה נוסף, קונקרטי ומרתיע, תוך התחשבות במצבה הכלכלי.",גזירת העונש המתאים לנאשמת
"ת""פ 6788-06-16","6 חודשי מאסר בפועל אשר ירוצו בעבודות שירות. עבודות השירות תבוצענה על פי חוו""ד הממונה על עבודות השירות. תחילת מועד עבודות השירות ביום 5.8.18.","אשר על-כן, הנני גוזר על הנאשמת את העונשים הבאים:"
"ת""פ 6788-06-16","10 חודשי מאסר על תנאי, לבל תעבור הנאשמת במשך שלוש שנים מהיום כל עבירת סמים מסוג פשע.","אשר על-כן, הנני גוזר על הנאשמת את העונשים הבאים:"
"ת""פ 6788-06-16","קנס כספי בסך של 25,000 ₪ או 100 ימי מאסר תמורתו. הקנס ישולם ב- 10 תשלומים חודשיים שווים ורצופים, שהראשון שבהם ביום 1.9.18. לא ישולם תשלום כלשהו במועדו, תעמוד היתרה לפירעון מיידי.","אשר על-כן, הנני גוזר על הנאשמת את העונשים הבאים:"
"ת""פ 6788-06-16",צו מבחן למשך שנה.,"אשר על-כן, הנני גוזר על הנאשמת את העונשים הבאים:"
"ת""פ 6788-06-16","מובהר בזאת לנאשמת כי אם לא תעמוד בתנאי הצו, ניתן יהיה להפקיעו ולגזור את דינה מחדש.","אשר על-כן, הנני גוזר על הנאשמת את העונשים הבאים:"
"ת""פ 6788-06-16",מזכירות בית המשפט תמציא העתק גזר דין לשירות המבחן ולממונה על עבודות השירות.,"אשר על-כן, הנני גוזר על הנאשמת את העונשים הבאים:"
"ת""פ 6788-06-16",	זכות ערעור לבית-המשפט העליון תוך 45 ימים. ,"אשר על-כן, הנני גוזר על הנאשמת את העונשים הבאים:"
"ת""פ 6788-06-16","54678313ניתן היום,  א' תמוז תשע""ח, 14 יוני 2018, בנוכחות הצדדים.",5129371
"ת""פ 6788-06-16",נוסח מסמך זה כפוף לשינויי ניסוח ועריכה,עמי קובו 54678313
"ת""פ 6788-06-16","בעניין עריכה ושינויים במסמכי פסיקה, חקיקה ועוד באתר נבו – הקש כאן",עמי קובו 54678313
