verdict,text,part
"ת""פ 21724-08-22","יתר על כן, האמור בתסקיר מעורר תהייה לענין עומק התובנה של הנאשם לגבי הגורמים לביצוע העבירה, נקודות הסיכון שלו ויכולתו להתמודד עם סיכונים בעתיד. בתסקיר הראשון תולה הנאשם את העבירה בכך שכמות הקנביס הרפואי שקיבל לא הספיקה לו. זה לא הסבר מספיק לביצוע עבירה של סחר בסמים. הנאשם לא 'רק' קנה סם לענות על צרכיו אלא סחר בסם, באמצעות טלגרם כלומר לא ברגע של היסח הדעת אלא מתוך תכנון. הנאשם גם נתפס כשברשותו כמויות נוספות וסכומי כסף במזומן. התסקיר הראשון וודאי אינו מצביע על תובנה או הליך פנימי משמעותי. בתסקיר השני תיאר הנאשם את העבירה כהסתבכות על רקע כלכלי. בשני המקרים חסר טיפול משמעותי. חסר מענה לשאלה האם הנאשם סובל מהתמכרות לסמים וצורך מעבר לכמות לה זכאי על פי מרשם רפואי, חסר מענה לשאלה כיצד הוא מתמודד כעת עם המחסור או עם התמכרות או כיצד חדל מכך. חסר מענה בדבר דרכי התמודדות עם קשיים כלכליים שעלולים להיות בעתיד. כל שנאמר בתסקיר הוא כי המסלול הטיפולי מבוסס על התרשמות 'מתהליך עצמי'. לא מצאתי בסיס לחריגה משמעותית מן המתחם מבלי שיובהר מהו אותו תהליך עצמי, עד כמה הוא יציב, על מה הוא מבוסס והאם די בו להבטיח סיכוי ממשי לשיקום במובן הימנעות מעבירות דומות בעתיד.",גזר דין
"ת""פ 21724-08-22","מנגד מצאתי לתת משקל רב לקבלת אחריות כבר בישיבה הראשונה וכן לנסיבותיו האישיות של הנאשם. נתתי משקל למצבו הרפואי ולנכות ממנה סובל, לתפקודו התורם הן בשירות צבאי והן בעסקיו הפרטיים ובעיקר נתתי משקל לשמירה על שאיפות נורמטיביות לעתיד שבכוחן לשמור על הנאשם מפני הסתבכויות נשנות. יש לחזק את הנאשם שעד היום היה ללא הרשעות קודמות והוא הצליח לסלול לעצמו דרך חיובית השונה מהדרך שלתוכה גדל.",גזר דין
"ת""פ 21724-08-22","4 חודשי מאסר בפועל שירוצו בעבודות שירות. הנאשם יבצע את עבודות שירות ב ""המשקם רמת גן,  5 ימים בשבוע, על פי טווח השעות המתאפשר בחוק בכתובת - אצטדיון רמת גן. תחילתן של ביצוע העבודות נקבעו ליום 29.1.24 והמועד חלף. נקבע מועד ביום 1.4.24 הממונה על עבודות השירות מתבקש להתאים את המועד החדש.",אני גוזרת על הנאשם את העונשים הבאים:
"ת""פ 21724-08-22","על הנאשם להתייצב לפני מפקח על עבודות השירות לצורך קליטה והצבה בתאריך תחילת העבודה, בשעה 08:00, במפקדת מחוז מרכז, יחידת עבודות שירות, ת""ד 81, רמלה.",אני גוזרת על הנאשם את העונשים הבאים:
"ת""פ 21724-08-22","אני מודיעה לנאשם כי עליו להודיע לממונה על כל שינוי, אם יחול, בכתובת מגוריו, וכן עליו לעמוד בתנאי הפיקוח, שכן אי מילוי עבודות השירות על פי הנחיות המפקח, עלול להביא להפסקתן ולכליאה במתקן כליאה.",אני גוזרת על הנאשם את העונשים הבאים:
"ת""פ 21724-08-22",6 חודשי מאסר על תנאי לתקופה של 3 שנים והתנאי הוא שהנאשם לא יעבור עבירה מסוג פשע לפי פקודת הסמים המסוכנים.,אני גוזרת על הנאשם את העונשים הבאים:
"ת""פ 21724-08-22",3 חודשי מאסר על תנאי לתקופה של 3 שנים והתנאי הוא שהנאשם לא יעבור עבירה מסוג עוון לפי פקודת הסמים המסוכנים.,אני גוזרת על הנאשם את העונשים הבאים:
"ת""פ 21724-08-22","קנס בסך 1,500 ₪. לבקשת הנאשם ניתן לעשות שימוש בסכום כסף שבפקדון לצורך עמידה בתשלום הקנס. ככל שקיימת יתרת חובה תשולם בתוך 90 יום.",אני גוזרת על הנאשם את העונשים הבאים:
"ת""פ 21724-08-22",פסילת רשיון נהיגה למשך 3 חודשים וזאת על תנאי שלא יעבור עבירה לפי פקודת הסמים המסוכנים במשך שלוש שנים.,אני גוזרת על הנאשם את העונשים הבאים:
"ת""פ 21724-08-22","חילוט בסך 1,740 ₪ לטובת קרן החילוט-סמים.",אני גוזרת על הנאשם את העונשים הבאים:
"ת""פ 21724-08-22","ניתן צו כללי למוצגים לפי שיקול דעת קצין המשטרה. המוצגים יחולטו/יושמדו/יושבו לבעליהם עפ""י החלטת קצין משטרה.",אני גוזרת על הנאשם את העונשים הבאים:
"ת""פ 21724-08-22","ככל שהופקד פיקדון בתיק או בתיק המעצרים הקשור לתיק זה ובהעדר מניעה על פי דין ולאחר עמידה בתשלום הקנס, יוחזר הפיקדון למפקיד או לידי מי מטעמו עפ""י יפוי כוח.",אני גוזרת על הנאשם את העונשים הבאים:
"ת""פ 21724-08-22","החוב מועבר למרכז לגביית קנסות, אגרות והוצאות ברשות האכיפה והגבייה, בהתאם למועדים והתשלומים שקבע בית המשפט.",אני גוזרת על הנאשם את העונשים הבאים:
"ת""פ 21724-08-22","ניתן יהיה לשלם את הקנס/ פיצוי/ ההוצאות כעבור שלושה ימים מיום מתן ההחלטה/  גזר הדין לחשבון המרכז לגביית קנסות, אגרות והוצאות ברשות האכיפה והגבייה באחת מהדרכים הבאות:",אני גוזרת על הנאשם את העונשים הבאים:
"ת""פ 21724-08-22","בכרטיס אשראי – באתר המקוון של רשות האכיפה והגבייה, www.eca.gov.il",אני גוזרת על הנאשם את העונשים הבאים:
"ת""פ 21724-08-22",מוקד שירות טלפוני בשרות עצמי (מרכז גבייה)  – בטלפון 35592* או בטלפון 073-2055000,אני גוזרת על הנאשם את העונשים הבאים:
"ת""פ 21724-08-22",במזומן בכל סניף של בנק הדואר – בהצגת תעודת זהות בלבד (אין צורך בשוברי תשלום).,אני גוזרת על הנאשם את העונשים הבאים:
"ת""פ 21724-08-22",המזכירות תעביר העתק לשירות המבחן ולממונה על עבודות שירות.,אני גוזרת על הנאשם את העונשים הבאים:
"ת""פ 21724-08-22","54678313ניתן היום,  כ""ב שבט תשפ""ד, 01 פברואר 2024, במעמד הצדדים.",5129371
"ת""פ 21724-08-22","בעניין עריכה ושינויים במסמכי פסיקה, חקיקה ועוד באתר נבו – הקש כאן",54678313
